"hep-ph/0007158","Sandor D. Katz","Z. Fodor and S.D. Katz","Ultra High Energy Cosmic Rays from Compact Sources","8 pages, 6 figures","Phys.Rev.D63:023002,2001","10.1103/PhysRevD.63.023002",,"hep-ph astro-ph",,"  The clustering of ultra high energy (above 10^20 eV) cosmic rays (UHECR)
suggests that they might be emitted by compact sources. Statistical analysis of
Dubovsky et al. (Phys. Rev. Lett. 85 (2000) 1154) estimated the source density.
We extend their analysis to give also the confidence intervals for the number
of sources using a.) no assumptions on the relationship between clustered and
unclustered events; b.) nontrivial distributions for the source intensities and
energies; c.) the energy dependence of the propagation. We determine the
probability that a proton created at a distance r with energy E arrives at
earth above a threshold E_c. Using this function one can determine the observed
spectrum just by one numerical integration for any injection spectrum. The
observed 14 UHECR events above 10^20 eV with one doublet gives for the source
densities 180_-165^+2730*10^-3 Mpc^-3 (on the 68% confidence level). We present
detailed results for future experiments with larger UHECRs statistics.
","[{""version"":""v1"",""created"":""Fri, 14 Jul 2000 17:59:31 GMT""},{""version"":""v2"",""created"":""Thu, 28 Sep 2000 13:37:38 GMT""}]","2009-12-31"
"hep-ph/0007159","Michael Strickland","Jens O. Andersen, Eric Braaten, and Michael Strickland","Screened Perturbation Theory to Three Loops","30 pages, 10 figures","Phys.Rev. D63 (2001) 105008","10.1103/PhysRevD.63.105008","UW-00-020","hep-ph",,"  The thermal physics of a massless scalar field with a phi^4 interaction is
studied within screened perturbation theory (SPT). In this method the
perturbative expansion is reorganized by adding and subtracting a mass term in
the lagrangian. We consider several different mass prescriptions that
generalize the one-loop gap equation to two-loop order. We calculate the
pressure and entropy to three-loop order and the screening mass to two-loop
order. In contrast to the weak-coupling expansion, the SPT-improved
approximations appear to converge even for rather large values of the coupling
constant.
","[{""version"":""v1"",""created"":""Fri, 14 Jul 2000 22:16:55 GMT""},{""version"":""v2"",""created"":""Tue, 9 Jan 2001 20:01:03 GMT""}]","2009-10-31"
"hep-ph/0007161","Jonathan R. Ellis","John Ellis (CERN)","Perspectives in High-Energy Physics","19 pages latex using JHEP.cls, 27 eps figures, concluding talk at
  SILAFAE III, Cartagena de Indias, Colombia, April 2-8, 2000",,,"CERN-TH/2000-129","hep-ph hep-ex",,"  A personal view of current prospectives in particle physics is presented,
inspired by the contributions to this meeting. Particular emphasis is laid in
precision tests of the Standard Model and the search for the Higgs boson, on
probes of CP violation, on speculations about possible physics beyond the
Standard Model, on neutrino masses and oscillations, on the quest for
supersymmetry, on opportunities @ future accelerators, and on the ultimate
phenomenological challenge offered by the quest for a Theory of Everything.
","[{""version"":""v1"",""created"":""Sat, 15 Jul 2000 14:46:46 GMT""}]","2007-05-23"
"hep-th/0007113","Antonio Gonzalez-Arroyo","M. Garcia Perez, A. Gonzalez-Arroyo and C. Pena","Perturbative construction of self-dual configurations on the torus","latex file. 32 pages and 4 figures(24 eps files)","JHEP0009:033,2000","10.1088/1126-6708/2000/09/033","FTUAM-00-16, IFT-UAM/CSIC-00-23","hep-th hep-lat",,"  We develop a perturbative expansion which allows the construction of
non-abelian self-dual SU(2) Yang-Mills field configurations on the
four-dimensional torus with topological charge 1/2. The expansion is performed
around the constant field strength abelian solutions found by 't Hooft. Next to
leading order calculations are compared with numerical results obtained with
lattice gauge theory techniques.
","[{""version"":""v1"",""created"":""Fri, 14 Jul 2000 16:06:54 GMT""}]","2009-10-31"
"hep-th/0007114","Donam Youm","Donam Youm","q-Deformed Conformal Quantum Mechanics","10 pages, LaTeX, revised version with minor corrections to appear in
  Phys. Rev. D","Phys.Rev. D62 (2000) 095009","10.1103/PhysRevD.62.095009","CERN-TH/2000-210","hep-th",,"  We construct a q-deformed version of the conformal quantum mechanics model of
de Alfaro, Fubini and Furlan for which the deformation parameter is complex and
the unitary time evolution of the system is preserved. We also study
differential calculus on the q-deformed quantum phase space associated with
such system.
","[{""version"":""v1"",""created"":""Fri, 14 Jul 2000 16:44:00 GMT""},{""version"":""v2"",""created"":""Wed, 16 Aug 2000 15:08:35 GMT""}]","2009-10-31"
"hep-th/0007115","Jonathan R. Ellis","F. Anselmo (INFN Bologna), J. Ellis (CERN), D.V. Nanopoulos (Texas
  A&M, HARC, Academy of Athens), G. Volkov (CERN, IHEP Protvino)","Results from an Algebraic Classification of Calabi-Yau Manifolds","16 pages LaTeX, 3 eps figures","Phys.Lett.B499:187-199,2001","10.1016/S0370-2693(01)00014-4","CERN--TH--2000/208,ACT-10/00,CTP-TAMU-22/00","hep-th hep-ph math.AG",,"  We present results from an inductive algebraic approach to the systematic
construction and classification of the `lowest-level' CY3 spaces defined as
zeroes of polynomial loci associated with reflexive polyhedra, derived from
suitable vectors in complex projective spaces. These CY3 spaces may be sorted
into `chains' obtained by combining lower-dimensional projective vectors
classified previously. We analyze all the 4242 (259, 6, 1) two- (three-, four-,
five-) vector chains, which have, respectively, K3 (elliptic, line-segment,
trivial) sections, yielding 174767 (an additional 6189, 1582, 199) distinct
projective vectors that define reflexive polyhedra and thereby CY3 spaces, for
a total of 182737. These CY3 spaces span 10827 (a total of 10882) distinct
pairs of Hodge numbers h_11, h_12. Among these, we list explicitly a total of
212 projective vectors defining three-generation CY3 spaces with K3 sections,
whose characteristics we provide.
","[{""version"":""v1"",""created"":""Fri, 14 Jul 2000 17:14:05 GMT""},{""version"":""v2"",""created"":""Sat, 15 Jul 2000 13:22:06 GMT""}]","2009-09-11"
"hep-th/0007116","Galen M. Sotkov","J.F. Gomes, E. P. Gueuvoghlanian, G.M. Sotkov and A.H. Zimerman","T-duality of axial and vector dyonic integrable models","20 pages, latex, no figures,improvments in the text of Sects.1,2 and
  6;typos corrected,references added, to appear in Ann. of Physics (NY)","Annals Phys. 289 (2001) 232-250","10.1006/aphy.2000.6130",,"hep-th nlin.SI",,"  A general construction of affine Non Abelian (NA) - Toda models in terms of
axial and vector gauged two loop WZNW model is discussed. They represent {\it
integrable perturbations} of the conformal $\sigma$-models (with tachyons
included) describing (charged) black hole type string backgrounds. We study the
{\it off-critical} T-duality between certain families of axial and vector type
of integrable models for the case of affine NA- Toda theories with one global
U(1) symmetry. In particular we find the Lie algebraic condition defining a
subclass of {\it T-selfdual} torsionless NA Toda models and their zero
curvature representation.
","[{""version"":""v1"",""created"":""Fri, 14 Jul 2000 21:01:52 GMT""},{""version"":""v2"",""created"":""Thu, 31 Aug 2000 12:04:23 GMT""},{""version"":""v3"",""created"":""Tue, 2 Jan 2001 18:41:25 GMT""}]","2009-10-31"
"hep-th/0007117","John Schwarz","John H. Schwarz","Reminiscences of Collaborations with Joel Scherk","11 pages; Presented at Conference anniversaire du LPT-ENS",,,"CALT-68-2289, CITUSC/00-042","hep-th",,"  I had the privilege of collaborating with Joel Scherk on three separate
occasions: in 1970 at Princeton, in 1974 at Caltech, and in 1978-79 at the
Ecole Normale Superieure. In this talk I give some reminiscences of these
collaborations.
","[{""version"":""v1"",""created"":""Fri, 14 Jul 2000 21:44:34 GMT""}]","2007-05-23"
"hep-th/0007118","John Schwarz","John H. Schwarz","String Theory: The Early Years","10 pages; Presented at Symposium for L. Susskind's 60th Birthday",,,,"hep-th",,"  Lenny Susskind has made many important contributions to theoretical physics
during the past 35 years. In this talk I will discuss the early history of
string theory (1968-72) emphasizing Susskind's contributions.
","[{""version"":""v1"",""created"":""Fri, 14 Jul 2000 21:41:31 GMT""},{""version"":""v2"",""created"":""Wed, 19 Jul 2000 21:14:30 GMT""},{""version"":""v3"",""created"":""Wed, 26 Jul 2000 18:41:35 GMT""}]","2007-05-23"
"math-ph/0007022","Michael Aizenman","M. Aizenman, S. Goldstein and J.L. Lebowitz","Bounded Fluctuations and Translation Symmetry Breaking in
  One-Dimensional Particle Systems","LaTex document, 24 pp","J. Stat. Phys., v. 103, 601 (2001).",,,"math-ph cond-mat.str-el math.MP math.PR",,"  We present general results for one-dimensional systems of point charges
(signed point measures) on the line with a translation invariant distribution
$\mu$ for which the variance of the total charge in an interval is uniformly
bounded (instead of increasing with the interval length). When the charges are
restricted to multiples of a common unit, and their average charge density does
not vanish, then the boundedness of the variance implies translation-symmetry
breaking --- in the sense that there exists a function of the charge
configuration that is nontrivially periodic under translations --- and hence
that $\mu$ is not ``mixing.'' Analogous results are formulated also for one
dimensional lattice systems under some constraints on the values of the charges
at the lattice sites and their averages. The general results apply to
one-dimensional Coulomb systems, and to certain spin chains, putting on common
grounds different instances of symmetry breaking encountered there.
","[{""version"":""v1"",""created"":""Fri, 14 Jul 2000 22:44:55 GMT""},{""version"":""v2"",""created"":""Fri, 3 Nov 2000 21:17:41 GMT""}]","2007-05-23"
"math-ph/0007023","Edgardo S. Cheb-Terrab","E.S. Cheb-Terrab and T. Kolokolnikov","First order ODEs, Symmetries and Linear Transformations","13 pages. Submitted to European Journal of Applied Mathematics, July
  2000. Related Maple programs are available at
  http://lie.uwaterloo.ca/odetools.htm",,,,"math-ph math.GM math.MP",,"  An algorithm for solving first order ODEs, by systematically determining
symmetries of the form [ xi = F(x), eta = P(x) y + Q(x) ], where xi d/dx + eta
d/dy is the symmetry generator - is presented. To these {\it linear} symmetries
one can associate an ODE class which embraces all first order ODEs mappable
into separable through linear transformations {t = f(x), u = p(x) y + q(x)}.
This single ODE class includes as members, for instance, 78% of the 552
solvable first order examples of Kamke's book. Concerning the solving of this
class, a restriction on the algorithm being presented exists only in the case
of Riccati type ODEs, for which linear symmetries {\it always} exist but the
algorithm will succeed in finding them only partially.
","[{""version"":""v1"",""created"":""Sat, 15 Jul 2000 02:00:18 GMT""}]","2007-05-23"
"math/0007088","Charles Livington","Charles Livingston","Pseudo-slice knots",,"Proceedings AMS 130 (2002), 1551-1555 (title: New examples of
  non-slice, algebraically slice knots).",,,"math.GT",,"  For n >1, if the Seifert form of a knotted 2n-1 sphere K in S^{2n+1} has a
metabolizer, then the knot is slice. Casson and Gordon proved that this is
false in dimension three (n = 1). However, in the three dimensional case it is
true that if the metabolizer has a basis represented by a strongly slice link
then K is slice. The question has been asked as to whether it is sufficient
that each basis element is represented by a slice knot to assure that K is
slice. For genus one knots this is of course true; here we present a genus two
counterexample.
","[{""version"":""v1"",""created"":""Fri, 14 Jul 2000 16:02:37 GMT""}]","2007-05-23"
"math/0007089","Jan Snellman","Jan Snellman and Guillermo Moreno-Socias","Some conjectures about the Hilbert series of generic ideals in the
  exterior algebra","14 pages, no figures, LaTeX2e","Homology, homotopy and applications, volume 4, no 2, 2002, pages
  409-426",,"formerly math.RA/0007089","math.AC",,"  We give conjectures on the ""asymptotic"" behaviour of the Hilbert series of
(quotients by) generic ideals in the exterior algebra, as the number of
variables tend to infinity. Our conjectures are supported by extensive computer
calculations.
","[{""version"":""v1"",""created"":""Fri, 14 Jul 2000 17:14:29 GMT""},{""version"":""v2"",""created"":""Mon, 31 Jul 2000 10:37:09 GMT""},{""version"":""v3"",""created"":""Mon, 11 Mar 2002 15:09:23 GMT""}]","2007-05-23"
"math/0007090","David R. Morrison","David R. Morrison","Geometric Aspects of Mirror Symmetry","21 pages, 3 figures","Mathematics Unlimited -- 2001 and Beyond (B. Enquist and W.
  Schmid, eds.), Springer-Verlag, 2001, pp. 899-918",,"DUKE-CGTP-00-10, IASSNS-HEP-00/40","math.AG hep-th",,"  The geometric aspects of mirror symmetry are reviewed, with an eye towards
future developments. Given a mirror pair (X,Y) of Calabi-Yau threefolds, the
best-understood mirror statements relate certain small corners of the moduli
spaces of X and of Y. We will indicate how one might go beyond such statements,
and relate the moduli spaces more globally. In fact, in the boldest version of
mirror symmetry (the Strominger-Yau-Zaslow conjecture), the Calabi-Yau
threefolds X and Y should be directly related to each other through a very
geometric construction.
","[{""version"":""v1"",""created"":""Fri, 14 Jul 2000 17:28:28 GMT""}]","2007-05-23"
"math/0007091","Barbara L. Osofsky","Barbara L. Osofsky","Projective dimension is a lattice invariant","LaTex. 16 pages",,,"formerly math.RA/0007091","math.AC math.GR math.RA",,"  We show that, for a free abelian group $G$ and prime power $p^\nu$, every
direct sum decomposition of the group $G/p^\nu G$ lifts to a direct sum
decomposition of $G$. This is the key result we use to show that, if $R$ is a
commutative von Neumann regular ring, and $\mathcal{E}$ a set of idempotents in
$R$, then the projective dimension of the ideal $\mathcal{E} R$ as an
$R$-module is the same as the projective dimension of the ideal $\mathcal{EB}$,
where $\mathcal{B}$ is the boolean algebra generated by $\mathcal{E} \cup
\{1\}$. This answers a thirty year old open question of R. Wiegand. The proof
is based on gaussian elimination on an $\omega \times \omega$ matrix, with
adaptations enabling one to pass from the integers modulo $p^\nu$ to the
integers.
","[{""version"":""v1"",""created"":""Fri, 14 Jul 2000 20:53:29 GMT""}]","2007-05-23"
"math/0007092","Hans G. Kaper","H. G. Kaper and H. Nordborg","The frozen-field approximation and the Ginzburg-Landau equations of
  superconductivity","25 pages, 7 figures, 2 tables; manuscript to be published in special
  issue on asymptotics of the Journal of Engineering Mathematics",,,"formerly math.SC/0007092","math.NA",,"  The Ginzburg--Landau (GL) equations of superconductivity provide a
computational model for the study of magnetic flux vortices in type-II
superconductors. In this article we show through numerical examples and
rigorous mathematical analysis that the GL model reduces to the frozen-field
model when the charge of the Cooper pairs (the superconducting charge carriers)
goes to zero while the applied field stays near the upper critical field.
","[{""version"":""v1"",""created"":""Fri, 14 Jul 2000 21:27:08 GMT""}]","2007-05-23"
"math/0007093","Ilya S. Kofman","Ilya Kofman and Yongwu Rong","Approximating Jones coefficients and other link invariants by Vassiliev
  invariants","12 pages, to appear in J. Knot Theory Ramifications","J. Knot Theory Ramifications 9 (2000), no. 7, 955-966.",,,"math.GT",,"  We find approximations by Vassiliev invariants for the coefficients of the
Jones polynomial and all specializations of the HOMFLY and Kauffman
polynomials. Consequently, we obtain approximations of some other link
invariants arising from the homology of branched covers of links.
","[{""version"":""v1"",""created"":""Fri, 14 Jul 2000 22:05:26 GMT""}]","2007-05-23"
"math/0007094","Bryan Clair","Bryan Clair and Shahriar Mokhtari-Sharghi","Convergence of zeta functions of graphs","8 pages, 1 figure",,,,"math.NT math.CO",,"  The $L^2$-zeta function of an infinite graph Y (defined previously in a ball
around zero) has an analytic extension. For a tower of finite graphs covered by
Y, the normalized zeta functions of the finite graphs converge to the
$L^2$-zeta function of Y.
","[{""version"":""v1"",""created"":""Fri, 14 Jul 2000 23:07:02 GMT""}]","2007-05-23"
"math/0007095","Alan Horwitz","Alan Horwitz","Invariant Means","Submitted for publication-20 pages. No figures","Journal of Mathematical Analysis and Applications, 270(2002),
  499-518.",,,"math.CA",,"  Let m(a,b) and M(a,b,c) be symmetric means. We say that M is type 1 invariant
with respect to m if M(m(a,c),m(a,b),m(b,c)) = M(a,b,c) for all a, b, c > 0. If
m is strict and isotone, then we show that there exists a unique M which is
type 1 invariant with respect to m. In particular we discuss the invariant
logarithmic mean L_3, which is type 1 invariant with respect to L(a,b) =
(b-a)/(log b-log a). We say that M is type 2 invariant with respect to m if
M(a,b,m(a,b)) = m(a,b) for all a, b > 0. We also prove existence and uniqueness
results for type 2 invariance, given the mean M(a,b,c). The arithmetic,
geometric, and harmonic means in two and three variables satisfy both type 1
and type 2 invariance. There are means m and M such that M is type 2 invariant
with respect to m, but not type 1 invariant with respect to m(for example, the
Lehmer means). L_3 is type 1 invariant with respect to L, but not type 2
invariant with respect to L.
","[{""version"":""v1"",""created"":""Sat, 15 Jul 2000 02:58:07 GMT""}]","2007-05-23"
"math/0007096","Dr. S. Fennell","Dr. S. Fennell (Cambridge)","Antinomies of Mathematical Reason: The Inconsistency of PM Arithmetic
  and Related Systems","6 pages; two typos corrected, minor adjustment to accompanying
  descriptions",,,,"math.GM",,"  We give a proof of the inconsistency of PM arithmetic, classical set theory
and related systems, incidentally exposing an error in Goedel's own proof of
Goedel's Theorems. The inconsistency proof, that formulae of the form R and ~R
occur as theorems in the PM-isomorphic system P, proceeds from a reflexive
substitution instance of the first axiom of the propositional calculus (axiom
II.1 of P). Goedel's formalism is used throughout.
","[{""version"":""v1"",""created"":""Sat, 15 Jul 2000 09:40:34 GMT""},{""version"":""v10"",""created"":""Mon, 21 Aug 2006 10:27:27 GMT""},{""version"":""v11"",""created"":""Tue, 5 Sep 2006 13:56:14 GMT""},{""version"":""v12"",""created"":""Wed, 6 Sep 2006 12:17:12 GMT""},{""version"":""v13"",""created"":""Fri, 8 Sep 2006 18:43:31 GMT""},{""version"":""v2"",""created"":""Wed, 19 Jul 2000 20:54:39 GMT""},{""version"":""v3"",""created"":""Thu, 19 Oct 2000 21:48:11 GMT""},{""version"":""v4"",""created"":""Wed, 31 Jan 2001 13:05:48 GMT""},{""version"":""v5"",""created"":""Mon, 26 Feb 2001 07:27:48 GMT""},{""version"":""v6"",""created"":""Sun, 4 Mar 2001 22:47:32 GMT""},{""version"":""v7"",""created"":""Mon, 23 Apr 2001 11:56:43 GMT""},{""version"":""v8"",""created"":""Sun, 1 Jul 2001 21:52:02 GMT""},{""version"":""v9"",""created"":""Tue, 16 Aug 2005 17:13:22 GMT""}]","2007-05-23"
"math/0007097","Joerg Teschner","B. Ponsot, J. Teschner","Clebsch-Gordan and Racah-Wigner coefficients for a continuous series of
  representations of U_q(sl(2,R))","39 pages, AMS-Latex; V2: Added comments and references concerning
  relation to Faddeev's modular double, minor corrections, version to be
  published in CMP","Commun.Math.Phys. 224 (2001) 613-655","10.1007/PL00005590",,"math.QA hep-th",,"  The decomposition of tensor products of representations into irreducibles is
studied for a continuous family of integrable operator representations of
$U_q(sl(2,R)$. It is described by an explicit integral transformation involving
a distributional kernel that can be seen as an analogue of the Clebsch-Gordan
coefficients. Moreover, we also study the relation between two canonical
decompositions of triple tensor products into irreducibles. It can be
represented by an integral transformation with a kernel that generalizes the
Racah-Wigner coefficients. This kernel is explicitly calculated.
","[{""version"":""v1"",""created"":""Sat, 15 Jul 2000 13:39:42 GMT""},{""version"":""v2"",""created"":""Thu, 2 Aug 2001 12:55:09 GMT""}]","2009-10-31"
"nucl-th/0007034","Martin J. Savage","A. Bulgac, E. M. Henley, G. A. Miller, M. J. Savage, and L. Wilets","Annual Report for the Department of Energy: 1999-2000, Nuclear Theory
  Group at the University of Washington","33 pages, 5 eps figure, latex",,,"NT@UW-00-019","nucl-th",,"  This document is a summary of the physics research carried out by the Nuclear
Theory Group at the University of Washington during the last twelve-month
period, 1999-2000.
","[{""version"":""v1"",""created"":""Fri, 14 Jul 2000 22:05:46 GMT""}]","2007-05-23"
"physics/0007049","Alan Kostelecky","D. Bear, R.E. Stoner, R.L. Walsworth, V. Alan Kostelecky, Charles D.
  Lane","Limit on Lorentz and CPT Violation of the Neutron Using a Two-Species
  Noble-Gas Maser","4 pages","Phys.Rev.Lett.85:5038,2000; Erratum-ibid.89:209902,2002","10.1103/PhysRevLett.85.5038",,"physics.atom-ph hep-ex hep-ph nucl-ex physics.gen-ph",,"  A search for sidereal variations in the frequency difference between
co-located 129-Xe and 3-He Zeeman masers sets the most stringent limit to date
on leading-order Lorentz and CPT violation involving the neutron, consistent
with no effect at the level of 10^{-31} GeV.
","[{""version"":""v1"",""created"":""Fri, 14 Jul 2000 20:27:24 GMT""}]","2009-09-25"
"quant-ph/0007041","Liane Gabora","Diederik Aerts, Ellie D'Hondt, and Liane Gabora","Why the Disjunction in Quantum Logic is Not Classical","7 pages, no figures","Foundations of Physics, Vol. 30, Issue 10, 2000","10.1023/A:1026457918361",,"quant-ph",,"  The quantum logical `or' is analyzed from a physical perspective. We show
that it is the existence of EPR-like correlation states for the quantum
mechanical entity under consideration that make it nonequivalent to the
classical situation. Specifically, the presence of potentiality in these
correlation states gives rise to the quantum deviation from the classical
logical `or'. We show how this arises not only in the microworld, but also in
macroscopic situations where EPR-like correlation states are present. We
investigate how application of this analysis to concepts could alleviate some
well known problems in cognitive science.
","[{""version"":""v1"",""created"":""Fri, 14 Jul 2000 16:14:28 GMT""}]","2022-10-12"
"quant-ph/0007044","Liane Gabora","Diederik Aerts, Sven Aerts, Jan Broekaert, and Liane Gabora","The Violation of Bell Inequalities in the Macroworld","17 pages, 9 figures","Foundations of Physics, Vol. 30(10), 2000","10.1023/A:1026449716544",,"quant-ph q-bio.NC",,"  We show that Bell inequalities can be violated in the macroscopic world. The
macroworld violation is illustrated using an example involving connected
vessels of water. We show that whether the violation of inequalities occurs in
the microworld or in the macroworld, it is the identification of nonidentical
events that plays a crucial role. Specifically, we prove that if nonidentical
events are consistently differentiated, Bell-type Pitowsky inequalities are no
longer violated, even for Bohm's example of two entangled spin 1/2 quantum
particles. We show how Bell inequalities can be violated in cognition,
specifically in the relationship between abstract concepts and specific
instances of these concepts. This supports the hypothesis that genuine quantum
structure exists in the mind. We introduce a model where the amount of
nonlocality and the degree of quantum uncertainty are parameterized, and
demonstrate that increasing nonlocality increases the degree of violation,
while increasing quantum uncertainty decreases the degree of violation.
","[{""version"":""v1"",""created"":""Fri, 14 Jul 2000 21:23:27 GMT""}]","2022-10-12"
