"astro-ph/0007217","Romeel Dave'","Romeel Dav\'e, Renyue Cen, Jeremiah P. Ostriker, Greg L. Bryan, Lars
  Hernquist, Neal Katz, David H. Weinberg, Michael L. Norman, Brian O'Shea","Baryons in the Warm-Hot Intergalactic Medium","9 pages, emulateapj, submitted to ApJ","Astrophys.J.552:473-483,2001","10.1086/320548",,"astro-ph",,"  Approximately 30-40% of all baryons in the present day universe reside in a
warm-hot intergalactic medium (WHIM), with temperatures between 10^5<T<10^7 K.
This is a generic prediction from six hydrodynamic simulations of currently
favored structure formation models having a wide variety of numerical methods,
input physics, volumes, and spatial resolutions. Most of these warm-hot baryons
reside in diffuse large-scale structures with a median overdensity around
10-30, not in virialized objects such as galaxy groups or galactic halos. The
evolution of the WHIM is primarily driven by shock heating from gravitational
perturbations breaking on mildly nonlinear, non-equilibrium structures such as
filaments. Supernova feedback energy and radiative cooling play lesser roles in
its evolution. WHIM gas is consistent with observations of the 0.25 keV X-ray
background without being significantly heated by non-gravitational processes
because the emitting gas is very diffuse. Our results confirm and extend
previous work by Cen & Ostriker and Dave' et al.
","[{""version"":""v1"",""created"":""Sat, 15 Jul 2000 15:26:55 GMT""}]","2016-08-15"
"cond-mat/0007249","Seung-Hyun Chun","S. H. Chun, Y. Lyanda-Geller, M. B. Salamon (UIUC), R. Suryanarayanan,
  G. Dhalenne, A. Revcolevschi (Universite Paris-Sud)","Reentrant spin glass behavior in a layered manganite La1.2Sr1.8Mn2O7
  single crystals","5 pages, 5 figures, submitted to Phys. Rev. B",,"10.1063/1.1419260",,"cond-mat.str-el cond-mat.mtrl-sci",,"  We report here a detailed study of AC/DC magnetization and
longitudinal/transverse transport properties of
La$_{1.2}$Sr$_{1.8}$Mn$_{2}$O$_{7}$ single crystals below $T_{c}$ = 121 K. We
find that the resistivity upturn below 40 K is related to the reentrant spin
glass phase at the same temperature, accompanied by additional anomalous Hall
effects. The carrier concentration from the ordinary Hall effects remains
constant during the transition and is close to the nominal doping level (0.4
holes/Mn). The spin glass behavior comes from the competition between
ferromagnetic double exchange and antiferromagnetic superexchange interactions,
which leads to phase separation, i.e. a mixture of ferromagnetic and
antiferromagnetic clusters, representing the canted antiferromagnetic state.
","[{""version"":""v1"",""created"":""Fri, 14 Jul 2000 17:33:26 GMT""}]","2009-10-31"
"cond-mat/0007250","P. Grassberger","Peter Grassberger (NIC, FZ Juelich, Germany)","Opacity and Entanglement of Polymer Chains","3 pages, Latex, including 2 figures; minor changes",,"10.1088/0305-4470/34/47/303",,"cond-mat.stat-mech cond-mat.soft",,"  We argue that the mean crossing number of a random polymer configuration is
simply a measure of opacity, without being closely related to entanglement as
claimed by several authors. We present an easy way of estimating its asymptotic
behaviour numerically. These estimates agree for random walks (theta polymers),
self-avoiding walks, and for compact globules with analytic estimates giving
$\log N, a-b/N^{2\nu-1},$ and $N^{1/3}$, respectively, for the average number
of crossings per monomer in the limit $N\to \infty$. While the result for
compact globules agrees with a rigorous previous estimate, the result for SAWs
disagrees with previous numerical estimates.
","[{""version"":""v1"",""created"":""Fri, 14 Jul 2000 17:51:59 GMT""},{""version"":""v2"",""created"":""Mon, 7 Aug 2000 10:02:29 GMT""}]","2009-10-31"
"cond-mat/0007251","George Kastrinakis","George Kastrinakis (Cambridge, U.K.)","Cuprates: experiment vs. quasiparticle theory","Submitted to Physics Today",,,,"cond-mat.supr-con",,"  Comment on the view of P.W. Anderson on the cuprates, as expressed in the
Feb. '00 issue of Physics Today.
","[{""version"":""v1"",""created"":""Fri, 14 Jul 2000 18:55:22 GMT""}]","2007-05-23"
"cond-mat/0007252","Filip Ronning","F. Ronning, C. Kim, K.M. Shen, N.P. Armitage, A. Damascelli, D.H. Lu,
  and Z.-X. Shen (Stanford University), L.L. Miller (Iowa State)","n(k) Structure and Matrix Elements in Photoemission: Results from
  Insulating Ca_2CuO_2Cl_2",,,,,"cond-mat.str-el",,"  The photon energy dependence of angle-resolved photoemission data on
Ca_2CuO_2Cl_2 is presented, and the role of the matrix element is investigated.
It is shown that despite strong variations in the matrix element, the loss in
intensity as one crosses the antiferromagnetic zone boundary is a robust
feature of the Mott insulator. As expected for a two dimensional system, the
dispersion remains independent of the photon energy even when the matrix
element does not.
","[{""version"":""v1"",""created"":""Fri, 14 Jul 2000 19:38:35 GMT""}]","2007-05-23"
"cond-mat/0007253","Christopher D. Ling","C. D. Ling, J. E. Millburn, J. F. Mitchell, D. N. Argyriou J. Linton
  and H. N. Bordallo","Interplay of spin and orbital ordering in the layered colossal
  magnetoresistance manganite La2-2xSr1+2xMn2O7 (0.5<=x<=1.0)","32 pages, 13 figures, submitted to Phys. Rev. B",,"10.1103/PhysRevB.62.15096",,"cond-mat.mtrl-sci",,"  The crystallographic and magnetic phase diagram of the n=2 layered manganite
La2-2xSr1+2xMn2O7 in the region x=>0.5 has been studied using temperature
dependent neutron powder diffraction. The magnetic phase diagram reveals a
progression of ordered magnetic structures generally paralleling that of 3-D
perovskites with similar electronic doping: A (0.5<=x<=0.66) --> C
(0.75<=x<=0.90) --> G (0.90<=x<=1.0). However, the quasi-2-D structure
amplifies this progression to expose features of manganite physics uniquely
accessible in the layered systems: (a) a ""frustrated"" region between the A and
C regimes where no long-range magnetic order is observed; (b) magnetic
polytypism arising from weak inter-bilayer magnetic exchange in the Type-C
regime; and (c) a tetragonal to orthorhombic phase transition whose temperature
evolution directly measures ordering of d3y2-r2 orbitals in the a-b plane. This
orbital-ordering transition is precursory to Type-C magnetic ordering, where
ferromagnetic rods lie parallel to the b-axis. These observations support the
notion that eg orbital polarisation is the driving force behind magnetic spin
ordering. Finally, in the crossover region between Type-C and Type-G states, we
see some evidence for the development of local Type-C clusters embedded in a
Type-G framework, directly addressing proposals of similar short-range magnetic
ordering in highly-doped La1-xCaxMnO3 perovskites.
","[{""version"":""v1"",""created"":""Fri, 14 Jul 2000 20:06:51 GMT""}]","2009-10-31"
"cond-mat/0007254","Nicholas Read","Ilya A. Gruzberg, N. Read, and Andreas W. W. Ludwig","Random-bond Ising model in two dimensions, the Nishimori line, and
  supersymmetry","28 pages; largely independent of cond-mat/0007255. V. 2: small
  additions, references updated; as published","Phys. Rev. B 63, 104422 (2001).","10.1103/PhysRevB.63.104422",,"cond-mat.dis-nn cond-mat.mes-hall",,"  We consider a classical random-bond Ising model (RBIM) with binary
distribution of $\pm K$ bonds on the square lattice at finite temperature. In
the phase diagram of this model there is the so-called Nishimori line which
intersects the phase boundary at a multicritical point. It is known that the
correlation functions obey many exact identities on this line. We use a
supersymmetry method to treat the disorder. In this approach the transfer
matrices of the model on the Nishimori line have an enhanced supersymmetry
osp($2n+1|2n$), in contrast to the rest of the phase diagram, where the
symmetry is osp($2n|2n$) (where $n$ is an arbitrary positive integer). An
anisotropic limit of the model leads to a one-dimensional quantum Hamiltonian
describing a chain of interacting superspins, which are irreducible
representations of the osp($2n+1|2n$) superalgebra. By generalizing this
superspin chain, we embed it into a wider class of models. These include other
models that have been studied previously in one and two dimensions. We suggest
that the multicritical behavior in two dimensions of a class of these
generalized models (possibly not including the multicritical point in the RBIM
itself) may be governed by a single fixed point, at which the supersymmetry is
enhanced still further to osp($2n+2|2n$). This suggestion is supported by a
calculation of the renormalization-group flows for the corresponding nonlinear
sigma models at weak coupling.
","[{""version"":""v1"",""created"":""Fri, 14 Jul 2000 20:54:38 GMT""},{""version"":""v2"",""created"":""Mon, 18 Dec 2000 21:32:12 GMT""}]","2009-10-31"
"cond-mat/0007255","Nicholas Read","N. Read and Andreas W. W. Ludwig","Absence of a metallic phase in random-bond Ising models in two
  dimensions: applications to disordered superconductors and paired quantum
  Hall states","13 pages; largely independent of cond-mat/0007254; V. 2: as published","Phys. Rev. B 63, 024404 (2000)","10.1103/PhysRevB.63.024404",,"cond-mat.dis-nn cond-mat.stat-mech",,"  When the two-dimensional random-bond Ising model is represented as a
noninteracting fermion problem, it has the same symmetries as an ensemble of
random matrices known as class D. A nonlinear sigma model analysis of the
latter in two dimensions has previously led to the prediction of a metallic
phase, in which the fermion eigenstates at zero energy are extended. In this
paper we argue that such behavior cannot occur in the random-bond Ising model,
by showing that the Ising spin correlations in the metallic phase violate the
bound on such correlations that results from the reality of the Ising
couplings. Some types of disorder in spinless or spin-polarized p-wave
superconductors and paired fractional quantum Hall states allow a mapping onto
an Ising model with real but correlated bonds, and hence a metallic phase is
not possible there either. It is further argued that vortex disorder, which is
generic in the fractional quantum Hall applications, destroys the ordered or
weak-pairing phase, in which nonabelian statistics is obtained in the pure
case.
","[{""version"":""v1"",""created"":""Fri, 14 Jul 2000 21:18:12 GMT""},{""version"":""v2"",""created"":""Mon, 18 Dec 2000 21:02:43 GMT""}]","2009-10-31"
"cond-mat/0007256","Randall D. Kamien","Primoz Ziherl and Randall D. Kamien","Soap Froths and Crystal Structures","4 pages, RevTeX, 2 included eps figures","Phys. Rev. Lett. 85 (2000) 3528","10.1103/PhysRevLett.85.3528",,"cond-mat.soft cond-mat.stat-mech",,"  We propose a physical mechanism to explain the crystal symmetries found in
macromolecular and supramolecular micellar materials. We argue that the packing
entropy of the hard micellar cores is frustrated by the entropic interaction of
their brush-like coronas. The latter interaction is treated as a surface effect
between neighboring Voronoi cells. The observed crystal structures correspond
to the Kelvin and Weaire-Phelan minimal foams. We show that these structures
are stable for reasonable areal entropy densities.
","[{""version"":""v1"",""created"":""Fri, 14 Jul 2000 21:03:40 GMT""}]","2009-10-31"
"cond-mat/0007257","Tonica Valla","T. Valla, M. Kralj, A. Siber, M. Milun, P. Pervan, P. D. Johnson and
  D. P. Woodruff","Oscillatory Electron-Phonon Coupling in Ultra-Thin Silver Films on
  V(100)","6 pages, 3 figures","J. Phys.: Condens. Matter 12, L477 (2000)","10.1088/0953-8984/12/28/105",,"cond-mat.str-el cond-mat.supr-con",,"  The temperature dependence of peak widths in high resolution angle-resolved
photoelectron spectroscopy from quantum well states in ultra thin Ag films on
V(100) has been used to determine the electron-phonon coupling constant,
lambda, for films of thickness 1-8 layers. A strong oscillatory variation in
coupling strength is observed as a function of film thickness, peaking at a 2
layer film for which lambda~1. A simple theory incorporating interaction of the
photo-hole with the thermal vibrations of the potential step at the
adlayer-vacuum interface is shown to reproduce the main features of these
results.
","[{""version"":""v1"",""created"":""Fri, 14 Jul 2000 21:07:16 GMT""}]","2009-10-31"
"cond-mat/0007258","Andrea Cavagna","Kurt Broderix, Kamal K. Bhattacharya, Andrea Cavagna, Annette
  Zippelius and Irene Giardina","Energy landscape of a Lennard-Jones liquid: Statistics of stationary
  points","4 RevTeX pages, 6 eps figures. Revised version","Phys. Rev. Lett. 85, 5360 (2000)","10.1103/PhysRevLett.85.5360",,"cond-mat.stat-mech cond-mat.dis-nn",,"  Molecular dynamics simulations are used to generate an ensemble of saddles of
the potential energy of a Lennard-Jones liquid. Classifying all extrema by
their potential energy u and number of unstable directions k, a well defined
relation k(u) is revealed. The degree of instability of typical stationary
points vanishes at a threshold potential energy, which lies above the energy of
the lowest glassy minima of the system. The energies of the inherent states, as
obtained by the Stillinger-Weber method, approach the threshold energy at a
temperature close to the mode-coupling transition temperature Tc.
","[{""version"":""v1"",""created"":""Fri, 14 Jul 2000 21:21:07 GMT""},{""version"":""v2"",""created"":""Mon, 9 Apr 2001 09:41:10 GMT""}]","2009-10-31"
"cond-mat/0007259","Slava V. Rotkin","Slava V. Rotkin, Robert A. Suris","Rolling up of graphite sheet: Energetics of shell formation","4 pages, 2 PS figures",,,,"cond-mat.mtrl-sci cond-mat.stat-mech",,"  The energetics of transformation of a planar fragment of a graphite monolayer
into a spherical cluster is studied. The path considered is that a flat cluster
rolls up into a segment of a spherical shell. The energy landscape of the
process is presented. A simple model, formerly invented for calculating the
carbon nanocluster formation energy, is used to evaluate the energies of
intermediate states. Although the spherical-shell closed cluster has the lowest
energy, curving of a plane fragment into a segment has an energy barrier. The
barrier height goes to zero for clusters with the number of atoms greater than
some $N_{\rm th}$, for which the cluster size is found analytically.
","[{""version"":""v1"",""created"":""Fri, 14 Jul 2000 23:09:03 GMT""}]","2007-05-23"
"cond-mat/0007260","Tullio Scopigno","T. Scopigno (University of Trento - I), U. Balucani (CNR Firenze - I),
  G. Ruocco (University of L'Aquila - I), F. Sette (ESRF - F)","Collective dynamics of liquid aluminum probed by Inelastic X-ray
  Scattering","8 pages, 7 figures",,"10.1103/PhysRevE.63.011210",,"cond-mat.dis-nn",,"  An inelastic X-ray scattering experiment has been performed in liquid
aluminum with the purpose of studying the collective excitations at wavevectors
below the first sharp diffraction peak. The high instrumental resolution (up to
1.5 meV) allows an accurate investigation of the dynamical processes in this
liquid metal on the basis of a generalized hydrodynamics framework. The
outcoming results confirm the presence of a viscosity relaxation scenario ruled
by a two timescale mechanism, as recently found in liquid lithium.
","[{""version"":""v1"",""created"":""Sat, 15 Jul 2000 14:41:56 GMT""},{""version"":""v2"",""created"":""Wed, 11 Oct 2000 16:46:37 GMT""}]","2009-10-31"
"cs/0007027","Michael Frumkin","Michael A. Frumkin, Rob F. Van der Wijngaart","Efficient cache use for stencil operations on structured discretization
  grids","tex .tar.gz file, including ps file, 16 pagest, 5 figures, 2
  Appendicies",,,,"cs.PF cs.CC",,"  We derive tight bounds on cache misses for evaluation of explicit stencil
operators on structured grids. Our lower bound is based on the isoperimetrical
property of the discrete octahedron. Our upper bound is based on good surface
to volume ratio of a parallelepiped spanned by a reduced basis of the inter-
ference lattice of a grid. Measurements show that our algorithm typically
reduces the number of cache misses by factor of three relative to a compiler
optimized code. We show that stencil calculations on grids whose interference
lattice have a short vector feature abnormally high numbers of cache misses. We
call such grids unfavorable and suggest to avoid these in computations by
appropriate padding. By direct measurements on MIPS R10000 we show a good
correlation of abnormally high cache misses and unfavorable three-dimensional
grids.
","[{""version"":""v1"",""created"":""Fri, 14 Jul 2000 17:44:41 GMT""}]","2007-05-23"
"gr-qc/0007030","Emilio Elizalde","Emilio Elizalde and Sergi R. Hildebrandt","Regular quantum interiors for black holes","4 pages, no figures, RevTeX",,,,"gr-qc",,"  A family of spacetimes suitable for describing the interior of a
non-rotational black hole is constructed. The stress-energy tensor is that of a
spherically symmetric vacuum, as commonly assumed nowadays. The problem of
matching the exterior with the interior region is solved exactly, without using
any massive shell nor having to restrict oneself to only asymptotically
well-behaved solutions, whatsoever. The main physical and geometrical
properties of the resulting black hole solutions are described. As models for
the interior the general solution found includes, in particular, two known
previous atttempts at solving the problem. Finally, effective macroscopic
properties of the solution are linked with quantization issues of the
corresponding spacetime.
","[{""version"":""v1"",""created"":""Fri, 14 Jul 2000 17:09:44 GMT""},{""version"":""v2"",""created"":""Thu, 5 Oct 2000 16:11:37 GMT""}]","2007-05-23"
"gr-qc/0007031","Theodore A. Jacobson","Ted Jacobson and David Mattingly","Gravity with a dynamical preferred frame","9 pages; title changed, references added, relation to prior work of
  Gasperini discussed, errors in scalar field stress tensor corrected, various
  minor changes to Introduction; Final version to be published in PRD: relation
  to prior work of Kostelecky and Samuel spelled out in detail, clarifications
  and sign errors corrected in section on linearized solutions, references
  added; Really final version: (u^m \nabla_m u^a)^2 term added to most general
  Lagrangian eqn.(3.1)","Phys.Rev. D64 (2001) 024028","10.1103/PhysRevD.64.024028",,"gr-qc hep-ph hep-th",,"  We study a generally covariant model in which local Lorentz invariance is
broken ""spontaneously"" by a dynamical unit timelike vector field $u^a$---the
""aether"". Such a model makes it possible to study the gravitational and
cosmological consequences of preferred frame effects, such as ``variable speed
of light"" or high frequency dispersion, while preserving a generally covariant
metric theory of gravity. In this paper we restrict attention to an action for
an effective theory of the aether which involves only the antisymmetrized
derivative $\nabla_{[a}u_{b]}$. Without matter this theory is equivalent to a
sector of the Einstein-Maxwell-charged dust system. The aether has two massless
transverse excitations, and the solutions of the model include all vacuum
solutions of general relativity (as well as other solutions). However, the
aether generally develops gradient singularities which signal a breakdown of
this effective theory. Including the symmetrized derivative in the action for
the aether field may cure this problem.
","[{""version"":""v1"",""created"":""Fri, 14 Jul 2000 18:56:24 GMT""},{""version"":""v2"",""created"":""Fri, 8 Sep 2000 01:04:03 GMT""},{""version"":""v3"",""created"":""Fri, 27 Apr 2001 19:44:04 GMT""},{""version"":""v4"",""created"":""Sat, 2 Jun 2001 01:29:20 GMT""}]","2009-10-31"
"gr-qc/0007032","Dinesh Singh","D. Singh and G. Papini","Spin-1/2 Particles in Non-Inertial Reference Frames: Low- and
  High-Energy Approximations","LaTeX file, 23 pages. Presented at Marcel Grossmann IX Conference,
  Section GT8. Please note that eqs. (3.18) and (3.22) have been corrected for
  typos found in the refereed paper","Nuovo Cim. B115 (2000) 223",,,"gr-qc hep-th",,"  Spin-1/2 particles can be used to study inertial and gravitational effects by
means of interferometers, particle accelerators, and ultimately quantum
systems. These studies require, in general, knowledge of the Hamiltonian and of
the inertial and gravitational quantum phases. The procedure followed gives
both in the low- and high-energy approximations. The latter affords a more
consistent treatment of mass at high energies. The procedure is based on
general relativity and on a solution of the Dirac equation that is exact to
first-order in the metric deviation. Several previously known acceleration and
rotation induced effects are re-derived in a comprehensive, unified way.
Several new effects involve spin, electromagnetic and inertial/gravitational
fields in different combinations.
","[{""version"":""v1"",""created"":""Fri, 14 Jul 2000 20:22:21 GMT""}]","2007-05-23"
"hep-ex/0007027","Jussara M. de Miranda","E791 Collaboration","Study of the $D^+_s \to \pi^- \pi^+ \pi^+$ decay and measurement of
  $f_0$ masses and widths","10 pages, 3 eps figures","Phys.Rev.Lett.86:765-769,2001","10.1103/PhysRevLett.86.765","CBPF-NF-055/00","hep-ex",,"  From a sample of 848 $\pm$ 44 $D_s^+ \to \pi^- \pi^+ \pi^+$ decays, we find
$\Gamma(D_s^+ \to \pi^- \pi^+ \pi^+) / \Gamma(D_s^+ \to \phi \pi^+) =
  0.245 \pm 0.028^{+0.019}_{-0.012} $. Using a Dalitz plot analysis of this
three body decay, we find significant contributions from the channels
$\rho^0(770)\pi^+$, $\rho^0(1450)\pi^+$, $f_0(980)\pi^+$, $f_2(1270)\pi^+$, and
$f_0(1370)\pi^+$. We present also the values obtained for masses and widths of
the resonances $f_0(980)$ and $f_0(1370)$.
","[{""version"":""v1"",""created"":""Fri, 14 Jul 2000 18:05:45 GMT""},{""version"":""v2"",""created"":""Thu, 24 Aug 2000 18:17:57 GMT""}]","2012-08-27"
"hep-ex/0007028","Jussara M. de Miranda","E791 Collaboration","Experimental evidence for a light and broad scalar resonance in $D^+\to
  \pi^-\pi^+\pi^+$ decay","10 pages, 3 eps figures","Phys.Rev.Lett.86:770-774,2001","10.1103/PhysRevLett.86.770","CBPF-NF-056/00","hep-ex",,"  From a sample of $1172 \pm 61$ $D^+ \to \pi^- \pi^+ \pi^+$ decay, we find
$\Gamma (D^+ \to \pi^- \pi^+ \pi^+) / \Gamma (D^+ \to K^- \pi^+ \pi^+) =
  0.0311 \pm 0.0018 ^{+0.0016}_{-0.0026}$. Using a coherent amplitude analysis
to fit the Dalitz plot of this decays, we find strong evidence that a scalar
resonance of mass $478^{+24}_{-23} \pm 17$ MeV/$c^2$ and width $324^{+42}_{-40}
\pm 21$ MeV/$c^2$ accounts for approximately half of all decays.
","[{""version"":""v1"",""created"":""Fri, 14 Jul 2000 18:09:43 GMT""},{""version"":""v2"",""created"":""Thu, 24 Aug 2000 17:49:51 GMT""}]","2012-08-27"
"hep-lat/0007020","Giuseppe Lacagnina","K.C. Bowler, L. Del Debbio, J.M. Flynn, G.N. Lacagnina, V.I. Lesk,
  C.M. Maynard, D.G. Richards","Decay Constants of B and D Mesons from Non-perturbatively Improved
  Lattice QCD","Major revision, using new values of improvement coefficients, the
  scale set by f_pi, and an extended analysis. 37 Pages, 14 figures. Accepted
  for publication in NPB","Nucl.Phys.B619:507-537,2001","10.1016/S0550-3213(01)00511-9","Edinburgh 2000/14, IFUP-TH/2000-17, JLAB-THY-00-25, SHEP 00 08","hep-lat",,"  The decay constants of B, D and K mesons are computed in quenched lattice QCD
at two different values of the coupling. The action and operators are O(a)
improved with non-perturbative coefficients. The results are
f_B=195(6)(+24/-23) MeV, f_D=206(4)(+17/-10) MeV, f_B_s=220(6)(+23/-28) MeV,
f_D_s=229(3)(+23/-12) MeV and f_K= 150(3)(+12/-8) MeV. Systematic errors are
discussed in detail. Results for vector decay constants, flavour symmetry
breaking ratios of decay constants, the pseudoscalar-vector mass splitting and
D meson masses are also presented.
","[{""version"":""v1"",""created"":""Fri, 14 Jul 2000 17:02:07 GMT""},{""version"":""v2"",""created"":""Mon, 17 Jul 2000 17:58:22 GMT""},{""version"":""v3"",""created"":""Wed, 10 Oct 2001 11:25:30 GMT""}]","2014-11-17"
"hep-ph/0007157","Werner Porod","A. Bartl, W. Porod, D. Restrepo, J. Romao, and J.W.F. Valle","Neutralino Phenomenology at LEP2 in Supersymmetry with Bilinear Breaking
  of R-parity","21 pages, Latex, uses axodraw.sty (included), 13 figures included as
  ps- and eps-files, figures slightly changed after bug-fixing, comparison with
  GMSB and a few references added, version to appear in NPB","Nucl.Phys.B600:39-61,2001","10.1016/S0550-3213(01)00042-6","IFIC/00-45, UWThPh-2000/23","hep-ph",,"  We discuss the phenomenology of the lightest neutralino in models where an
effective bilinear term in the superpotential parametrizes the explicit
breaking of R-parity. We consider supergravity scenarios where the lightest
supersymmetric particle (LSP) is the lightest neutralino and which can be
explored at LEP2. We present a detailed study of the LSP decay properties and
general features of the corresponding signals expected at LEP2. We also
contrast our model with gauge mediated supersymmetry breaking.
","[{""version"":""v1"",""created"":""Fri, 14 Jul 2000 16:54:47 GMT""},{""version"":""v2"",""created"":""Wed, 31 Jan 2001 09:33:43 GMT""}]","2009-09-17"
