"astro-ph/0012071","John Magorrian","John Magorrian and David Ballantyne (CITA, U. Toronto and IoA,
  Cambridge)","Mass profiles and anisotropies of early-type galaxies","14 pages, 5 figures, accepted for publication in MNRAS","Mon.Not.Roy.Astron.Soc. 322 (2001) 702","10.1046/j.1365-8711.2001.04150.x",,"astro-ph",,"  We discuss the problem of using stellar kinematics of early-type galaxies to
constrain the galaxies' orbital anisotropies and radial mass profiles. We
demonstrate that compressing a galaxy's light distribution along the line of
sight produces approximately the same signature in the line-of-sight velocity
profiles as radial anisotropy. In particular, fitting spherically symmetric
dynamical models to apparently round, isotropic face-on flattened galaxies
leads to a spurious bias towards radial orbits in the models, especially if the
galaxy has a weak face-on stellar disk. Such face-on stellar disks could
plausibly be the cause of the radial anisotropy found in spherical models of
intermediate luminosity ellipticals such as NGC 2434, NGC 3379 and NGC 6703.
  In the light of this result, we use simple dynamical models to constrain the
outer mass profiles of a sample of 18 round, early-type galaxies. The galaxies
follow a Tully-Fisher relation parallel to that for spiral galaxies, but
fainter by at least 0.8 mag (I-band) for a given mass. The most luminous
galaxies show clear evidence for the presence of a massive dark halo, but the
case for dark haloes in fainter galaxies is more ambiguous. We discuss the
observations that would be required to resolve this ambiguity.
","[{""version"":""v1"",""created"":""Mon, 4 Dec 2000 12:06:00 GMT""}]","2009-10-31"
"astro-ph/0012072","Martin Reinecke","W. Hillebrandt, M. Reinecke, J.C. Niemeyer","Supernovae as stellar objects","9 pages, 3 figures, conference proceedings",,,,"astro-ph",,"  Type Ia supernovae (SN Ia) are generally believed to be the result of the
thermonuclear disruption of Chandrasekhar-mass carbon-oxygen white dwarfs,
mainly because such thermonuclear explosions can account for the right amount
of nickel, which is needed to explain the light curves and the late-time
spectra, and the abundances of intermediate-mass nuclei which dominate the
spectra near maximum light. Because of their enormous brightness and apparent
homogeneity SN Ia have become an important tool to measure cosmological
parameters.
  In this article the present understanding of the physics of thermonuclear
explosions is reviewed. In particular, we focus our attention on subsonic
(""deflagration"") fronts, i.e. we investigate fronts propagating by heat
diffusion and convection rather than by compression. Models based upon this
mode of nuclear burning have been applied very successfully to the SN Ia
problem, and are able to reproduce many of their observed features remarkably
well. However, the models also indicate that SN Ia may differ considerably from
each other, which is of importance if they are to be used as standard candles.
","[{""version"":""v1"",""created"":""Mon, 4 Dec 2000 12:05:25 GMT""}]","2016-08-30"
"astro-ph/0012073","Jochen Greiner","J. Greiner (AIP Potsdam, Germany), F.J. Vrba, A.A. Henden, H.H.
  Guetter, C.B. Luginbuhl (all Naval Observatory, Flagstaff, USA)","K band monitoring of GRS 1915+105 during 1999/2000","2 pages, Kluwer style, to appear in Astrophys. Space Sci. Rev, Proc.
  of 3rd Microquasar workshop, Granada, Sep. 2000, Eds. A.J. Castro-Tirado, J.
  Greiner, J.M. Paredes; all proceedings contr. available at
  http://www.aip.de/~jcg/granada.html","Astrophys.Space Sci. 276 (2001) 105-106",,,"astro-ph",,"  We report on long-term K band photometry of the galactic microquasar GRS
1915+105 since March 1999. We see variations of more than 1 mag, which are
seemingly correlated with variations in X-ray intensity and spectral slope.
","[{""version"":""v1"",""created"":""Mon, 4 Dec 2000 13:40:11 GMT""}]","2007-05-23"
"astro-ph/0012074","Jochen Greiner","J. Greiner, M.J. McCaughrean (both AIP Potsdam, Germany), J.G. Cuby
  (ESO, Chile), A.J. Castro-Tirado (IAA Granada, Spain), R.E. Mennickent (Uni.
  Concepcion, Chile)","Identification of the donor in GRS 1915+105","4 pages, Kluwer style, to appear in Astrophys. Space Sci. Rev, Proc.
  of 3rd Microquasar workshop, Granada, Sep. 2000, Eds. A.J. Castro-Tirado, J.
  Greiner, J.M. Paredes; all proceedings contr. available at
  http://www.aip.de/~jcg/granada.html","Astrophys.Space Sci. 276 (2001) 31-34",,,"astro-ph",,"  We report on the results of medium-resolution spectroscopy of GRS 1915+105 in
the H and K band using the 8m VLT at ESO. We clearly identify absorption
bandheads from CO12 and CO13. Together with other features this results in a
classification of the donor as a K-M III star.
","[{""version"":""v1"",""created"":""Mon, 4 Dec 2000 13:41:29 GMT""}]","2007-05-23"
"astro-ph/0012075","Matteo Perri","P. Giommi, A. Pellizzoni, M. Perri, P. Padovani","The Cosmological Evolution of BL Lacertae Objects","11 LaTeX pages, 4 PostScript figures, uses newpasp.sty (included). To
  appear in the proceedings of ""Blazar Demographics & Physics"", ASP Conf.
  Series, P. Padovani and C.M. Urry eds., in press",,,,"astro-ph",,"  We review the main results from several radio, X-ray and multi-frequency
surveys on the topic of cosmological evolution of BL Lacertae objects. Updated
findings on BL Lac evolution following the recent identification of many
sources in the ``Sedentary Multi-Frequency survey'' are also discussed. By
means of extensive Monte Carlo simulations we test some possible explanations
for the peculiar cosmological evolution of BL Lacs. We find that a dependence
of the relativistic Doppler factor on radio luminosity (as expected within the
beaming scenario) may induce low values of V/V_max and that both edge effects
at the low luminosity end of the BL Lacs radio luminosity function, and
incompleteness at faint optical magnitudes may be the cause of the low V/V_max
found for extreme HBL sources in X-ray selected samples.
","[{""version"":""v1"",""created"":""Mon, 4 Dec 2000 13:50:00 GMT""}]","2007-05-23"
"astro-ph/0012076","Marie-Noelle Celerier","Marie-No\""elle C\'el\'erier (Observatoire de Parie-Meudon), Reuben
  Thieberger (Ben Gurion University)","Relativistic corrections to fractal analyses of the galaxy distribution","9 LaTeX pages, accepted for publication in Astronomy and Astrophysics
  14 November 2000","Astron.Astrophys. 367 (2001) 449-456","10.1051/0004-6361:20000449",,"astro-ph",,"  The effect of curvature on the results of fractal analyses of the galaxy
distribution is investigated. We show that, if the universe satisfies the
criteria of a wide class of parabolic homogeneous models, the observers
measuring the fractal index with the integrated conditional density procedure
may use the Hubble formula, without having to allow for curvature, out to
distances of 600 Mpc, and possibly far beyond. This contradicts a previous
claim by Ribeiro (1995) that, in the Einstein-de Sitter case, relativistic
corrections should be taken into account at much smaller scales. We state for
the class of cosmological models under study, and give grounds for conjecture
for others, that the averaging procedure has a smoothing effect and that,
therefore, the redshift-distance relation provides an upper limit to the
relativistic corrections involved in such analyses.
","[{""version"":""v1"",""created"":""Mon, 4 Dec 2000 14:06:20 GMT""}]","2009-10-31"
"astro-ph/0012077","Thomas Tauris","T.M. Tauris (NORDITA, Copenhagen)","On the pre-RLO spin-orbit couplings in LMXBs","9 pages, 4 figures, to appear in: Evolution of Binary and Multiple
  Star Systems, ASP Conf. Series, Vol. ?, 2001, P. Podsiadlowski et al. (eds.)",,,,"astro-ph",,"  We investigate the effect of orbital decay caused by nuclear expansion of a
(sub)giant star in synchronous binary system. We compare this effect with the
presence of a magnetic stellar wind and show that the additional transfer of
orbital angular momentum into spin angular momentum is relatively important --
especially since it has been shown that the effect of magnetic braking
saturates at short orbital periods.
","[{""version"":""v1"",""created"":""Mon, 4 Dec 2000 14:17:47 GMT""}]","2007-05-23"
"astro-ph/0012078","Peter A. Milne","P.A. Milne, R.A. Kroeger, L.-S. The","Supernova Science with an Advanced Compton Telescope","16 pages, 7 figures. To appear in Proceedings for the 2nd Chicago
  Conference on Thermonuclear Astrophysical Explosions",,,,"astro-ph",,"  Gamma-ray line emission is a direct probe of the nucleosynthesis that occurs
in Type Ia supernovae. In this work we describe the wealth of information
obtainable from observations of this emission. Advanced Compton telescope
designs are being studied by the Naval Research Laboratory, with the goal being
the construction of a telescope which would be capable of detecting SNe Ia to
distances in excess of 100 Mpc. We describe the instrument capabilities and the
design issues that are being addressed. We assume a SN Ia rate and quantify the
frequency at which an advanced Compton telescope could detect, discriminate
between, and diagnose Type Ia supernovae. From these estimates, we argue that
an advanced Compton telescope would be a powerful astrophysical tool.
","[{""version"":""v1"",""created"":""Mon, 4 Dec 2000 15:06:23 GMT""}]","2007-05-23"
"astro-ph/0012079","Nissim Kanekar","Nissim Kanekar (1), Jayaram N Chengalur (1), Ravi Subrahmanyan (2),
  Patrick Petitjean (3) ((1) National Centre for Radio Astrophysics, India, (2)
  Australia Telescope National Facility, Australia (3) Institut d'Astrophysique
  de Paris, France)","ATCA search for 21 cm emission from a candidate damped Ly-$\alpha$
  absorber at z = 0.101","5 pages, 4 figures. Accepted by Astronomy and Astrophysics","2001, A & A, 367, 46.","10.1051/0004-6361:20000420",,"astro-ph",,"  We report a deep search for 21 cm emission/absorption from the $z \sim 0.101$
candidate damped Lyman-$\alpha$ system towards PKS 0439-433, using the
Australia Telescope Compact Array (ATCA). The spectrum shows a weak absorption
feature --- at the $3.3 \sigma$ level --- which yields a lower limit of 730 K
on the spin temperature of the system. No HI emission was detected: the
$3\sigma$ upper limit on the HI mass of the absorber is $2.25 \times 10^9
M_{\odot}$, for a velocity spread of $\sim 70$ km s$^{-1}$. The low HI mass and
the high spin temperature seem to rule out the possibility that the absorber is
a large gas-rich spiral galaxy.
","[{""version"":""v1"",""created"":""Mon, 4 Dec 2000 15:14:36 GMT""}]","2009-10-31"
"cond-mat/0012025","Bernhard Mehlig","B. Mehlig and M. Santer","Universal eigenvector statistics in a quantum scattering ensemble","4 pages, 5 figures","Phys. Rev. E 63, 020105 (2001)","10.1103/PhysRevE.63.020105",,"cond-mat.mes-hall",,"  We calculate eigenvector statistics in an ensemble of non-Hermitian matrices
describing open quantum systems [F. Haake et al., Z. Phys. B 88, 359 (1992)] in
the limit of large matrix size. We show that ensemble-averaged eigenvector
correlations corresponding to eigenvalues in the center of the support of the
density of states in the complex plane are described by an expression recently
derived for Ginibre's ensemble of random non-Hermitian matrices.
","[{""version"":""v1"",""created"":""Mon, 4 Dec 2000 15:07:00 GMT""}]","2009-10-31"
"cond-mat/0012027","Bernhard Mehlig","B. Mehlig and M. Wilkinson","Semiclassical trace formulae using coherent states","19 pages, 1 figure","Ann. Phys. (Lpz.) 10, 541 (2001)","10.1002/1521-3889(200106)10:6/7<541::AID-ANDP541>3.0.CO;2-A",,"cond-mat.mes-hall",,"  We derive semiclassical trace formulae including Gutzwiller's trace formula
using coherent states. This formulation has several advantages over the usual
coordinate-space formulation. Using a coherent-state basis makes it immediately
obvious that classical periodic orbits make separate contributions to the trace
of the quantum-mechanical time evolution operator. In addition, our approach is
manifestly canonically invariant at all stages, and leads to the simplest
possible derivation of Gutzwiller's formula.
","[{""version"":""v1"",""created"":""Mon, 4 Dec 2000 14:49:55 GMT""}]","2017-09-27"
"cond-mat/0012029","Wernsdorfer Wolfgang","M. Jamet, W. Wernsdorfer, C. Thirion, D. Mailly, V. Dupuis, P.
  Melinon, A. Perez","Magnetic Anisotropy of a Single Cobalt Nanoparticle","4 pages, 8 figures","Phys. Rev. Lett 86, 4676 (2001)","10.1103/PhysRevLett.86.4676",,"cond-mat.mes-hall cond-mat.stat-mech",,"  Using a new microSQUID set-up, we investigate magnetic anisotropy in a single
1000-atoms cobalt cluster. This system opens new fields in the characterization
and the understanding of the origin of magnetic anisotropy in such
nanoparticles. For this purpose, we report three-dimensional switching field
measurements performed on a 3 nm cobalt cluster embedded in a niobium matrix.
We are able to separate the different magnetic anisotropy contributions and
evidence the dominating role of the cluster surface.
","[{""version"":""v1"",""created"":""Sun, 3 Dec 2000 16:49:59 GMT""}]","2009-10-31"
"cond-mat/0012030","J. K. Jain","Vito W. Scarola, Kwon Park, and J.K. Jain","Cooper Instability of Composite Fermions","12 pages, 3 figures","Nature, vol. 406, p. 863 (2000)","10.1038/35022524",,"cond-mat.mes-hall",,"  When confined to two dimensions and exposed to a strong magnetic field,
electrons screen the Coulomb interaction in a topological fashion; they capture
and even number of quantum vortices and transform into particl es called
`composite fermions'. The fractional quantum Hall effect occurs in such a
system when the ratio (or `filling factor', $\nu$) of the number of electrons
and the degeneracy of their spin-split energy states (the Landau levels) takes
on particular values. The Landau level filling $\nu=1/2$ corresponds to a
metallic state in which the composite fermions form a gapless Fermi sea. But
for $\nu=5/2$, a fractional quantum Hall effect is observed instead; this
unexpected result is the subject of considerable debate and controversy. Here
we investigate the difference between these states by considering the
theoretical problem of two composite fermions on top of a fully polarized Fermi
sea of composite fermions. We find that they undergo Cooper pairing to form a
p-wave bound state at $\nu=5/2$, but not at $\nu=1/2$. In effect, the repulsive
Coulomb interaction between electrons is overscr eened in the $\nu=5/2$ state
by the formation of composite fermions, resulting in a weak, attractive
interaction.
","[{""version"":""v1"",""created"":""Sun, 3 Dec 2000 20:02:09 GMT""}]","2009-10-31"
"cond-mat/0012031",,"Enrique Canessa","Stochastics theory of log-periodic patterns","LaTeX, 1 ps figure - To appear J. Phys. A: Math & Gen",,"10.1088/0305-4470/33/50/301",,"cond-mat",,"  We introduce an analytical model based on birth-death clustering processes to
help understanding the empirical log-periodic corrections to power-law scaling
and the finite-time singularity as reported in several domains including
rupture, earthquakes, world population and financial systems. In our
stochastics theory log-periodicities are a consequence of transient clusters
induced by an entropy-like term that may reflect the amount of cooperative
information carried by the state of a large system of different species. The
clustering completion rates for the system are assumed to be given by a simple
linear death process. The singularity at t_{o} is derived in terms of
birth-death clustering coefficients.
","[{""version"":""v1"",""created"":""Sun, 3 Dec 2000 20:29:04 GMT""}]","2009-10-31"
"cond-mat/0012032","Robert Pelcovits","N. Priezjev and Robert A. Pelcovits","Cluster Monte Carlo Simulations of the Nematic--Isotropic Transition","4 figures","Phys. Rev. E 63, 062702 (2001)","10.1103/PhysRevE.63.062702",,"cond-mat.soft",,"  We report the results of simulations of the Lebwohl-Lasher model of the
nematic-isotropic transition using a new cluster Monte Carlo algorithm. The
algorithm is a modification of the Wolff algorithm for spin systems, and
greatly reduces critical slowing down. We calculate the free energy in the
neighborhood of the transition for systems up to linear size 70. We find a
double well structure with a barrier that grows with increasing system size,
obeying finite size scaling for systems of size greater than 35. We thus obtain
an estimate of the value of the transition temperature in the thermodynamic
limit.
","[{""version"":""v1"",""created"":""Sun, 3 Dec 2000 21:43:47 GMT""}]","2009-10-31"
"cond-mat/0012033","Hideo Hasegawa","Hideo Hasegawa (Tokyo Gakugei Univ.)","Spike-Train Responses of a Pair of Hodgkin-Huxley Neurons with
  Time-Delayed Couplings","19 pages, 4 figures","J. Phys. Soc. Jpn. 69 (2000) 3726","10.1143/JPSJ.69.3726",,"cond-mat.dis-nn q-bio.NC",,"  Model calculations have been performed on the spike-train response of a pair
of Hodgkin-Huxley (HH) neurons coupled by recurrent excitatory-excitatory
couplings with time delay. The coupled, excitable HH neurons are assumed to
receive the two kinds of spike-train inputs: the transient input consisting of
$M$ impulses for the finite duration ($M$: integer) and the sequential input
with the constant interspike interval (ISI). The distribution of the output ISI
$T_{\rm o}$ shows a rich of variety depending on the coupling strength and the
time delay. The comparison is made between the dependence of the output ISI for
the transient inputs and that for the sequential inputs.
","[{""version"":""v1"",""created"":""Mon, 4 Dec 2000 06:13:47 GMT""}]","2009-10-31"
"cond-mat/0012034","Yasuo Y. Suzuki","Y. Y. Suzuki, T. Dotera and M. Hirabayashi","Simulation of polymers in a curved box: Variable range bonding models","8 pages, 6 figures, submitted to Europhys. Lett; Corrected typos",,,"P20008603-151","cond-mat.soft cond-mat.stat-mech",,"  We propose new polymer models for Monte Carlo simulation and apply them to a
polymer chain confined in a relatively thin box which has both curved and flat
sides, and show that either an ideal or an excluded-volume chain spends more
time in the curved region than in the flat region. The ratio of the probability
of finding a chain in the curved region and in flat region increases
exponentially with increasing chain length. The results for ideal chains are
quantitatively consistent with a previously published theory. We find that the
same effect appears with excluded-volume chains and a similar scaling relation
can be applied to them up to a certain length of the polymer.
","[{""version"":""v1"",""created"":""Mon, 4 Dec 2000 08:45:37 GMT""},{""version"":""v2"",""created"":""Wed, 6 Dec 2000 01:51:17 GMT""}]","2007-05-23"
"cond-mat/0012035","Yuri Stroganov","Yu. Stroganov","The Importance of being Odd","9 pages, based on the talk given at NATO Advanced Research Workshop
  ""Dynamical Symmetries in Integrable Two-dimensional Quantum Field Theories
  and Lattice Models"", 25-30 September 2000, Kyiv, Ukraine. New references are
  added plus some minor corrections","J.Phys. A34 (2001) L179-L186","10.1088/0305-4470/34/13/104",,"cond-mat.stat-mech hep-th nlin.SI",,"  In this letter I consider mainly a finite XXZ spin chain with periodic
boundary conditions and \bf{odd} \rm number of sites. This system is described
by the Hamiltonian $H_{xxz}=-\sum_{j=1}^{N}\{\sigma_j^{x}\sigma_{j+1}^{x}
  +\sigma_j^{y}\sigma_{j+1}^{y}
  +\Delta \sigma_j^z\sigma_{j+1}^z\}$. As it turned out, its ground state
energy is exactly proportional to the number of sites $E=-3N/2$ for a special
value of the asymmetry parameter $\Delta=-1/2$. The trigonometric polynomial
$q(u)$, zeroes of which being the parameters of the ground state Bethe
eigenvector is explicitly constructed. This polynomial of degree $n=(N-1)/2$
satisfy the Baxter T-Q equation. Using the second independent solution of this
equation corresponding to the same eigenvalue of the transfer matrix, it is
possible to find a derivative of the ground state energy w.r.t. the asymmetry
parameter. This derivative is closely connected with the correlation function
$<\sigma_j^z\sigma_{j+1}^z> =-1/2+3/2N^2$. In its turn this correlation
function is related to an average number of spin strings for the ground state
of the system under consideration: $<N_{string}> = {3/8}(N-1/N)$. I would like
to stress once more that all these simple formulas are \bf wrong \rm in the
case of even number of sites. Exactly this case is usually considered.
","[{""version"":""v1"",""created"":""Mon, 4 Dec 2000 09:27:28 GMT""},{""version"":""v2"",""created"":""Tue, 26 Dec 2000 08:31:37 GMT""},{""version"":""v3"",""created"":""Wed, 3 Jan 2001 08:38:37 GMT""}]","2009-10-31"
"cond-mat/0012036","Fleurov Victor","M. Molotskii and V. Fleurov","Exchange Mediated Interaction of Dislocations and Deformation Hardening
  of Invar Alloys","7 pages, 1 figure","Philosophical Magazine B (2002), 82, 1173-1181","10.1080/01418610208240023",,"cond-mat.mtrl-sci",,"  We propose an explanation of anomalies observed in the behavior of
deformation hardening of Invars. An extremely strong volume magnetostriction,
typical of Invars, results in an enhancement of the exchange contribution to
the energy of the dislocation system by about three orders of magnitude with
respect to its value in conventional ferromagnetics. Both the self energy of
individual dislocations and the interaction between them, determined usually
only by the elastic deformation, in Invars is strongly diminished by the
contribution of the exchange energy. This fact explains a strong suppression of
the deformation hardening rate in the second stage as well as its strong
temperature and content dependence in Invars.
","[{""version"":""v1"",""created"":""Mon, 4 Dec 2000 10:02:48 GMT""}]","2015-06-24"
"cond-mat/0012037","Miguel Modesto Tardio Lopez","M. Tardio, R. Ramirez, R. Gonzalez, Y.Chen, M.R.Kokta","Semiconducting Characteristics of Magnesium-Doped Al2O3 Single Crystals","23pages, 15 figures; Physics Review B (PRB),(accepted for
  publication)",,"10.1063/1.1384481",,"cond-mat.mtrl-sci cond-mat.soft",,"  DC and AC electrical measurements were performed to investigate the
electrical conductivity of alpha-Al2O3:Mg samples with different concentrations
of [Mg]^0 centers .The concentration of [Mg]^0 centers was monitored by the
opticalabsorption peak at 2.56 eV. At low electrical fields, DC measurements
reveal blocking contacts. Steady electroluminescence is emitted at the negative
electrodeindicating that the majority of carriers are holes. Low voltage AC
measurements show that the equivalent circuit for the sample is the bulk
resistance in series with the junction capacitance connected in parallel with a
capacitance, which represents the dielectric constant of the sample. The values
determined for the bulk resistance in both DC and AC experiments are in good
agreement. The electrical conductivity of Al2O3:Mg crystals increases linearly
with the concentration of [Mg]^0 centers, regardless of the amount of other
impurities also present in the crystals, and is four times higher in the
$c_{\perpendicular}$ than in the $c_{\parallel}$ direction. The conductivity is
thermally activated with an activation energy of 0.68 eV, which is independent
of: 1) the [Mg]^0 content, 2) the crystallographic orientation, and 3) the
concentration of other impurities. These results favor the {\it
small-polaron-motion} mechanism.
","[{""version"":""v1"",""created"":""Mon, 4 Dec 2000 12:53:54 GMT""}]","2016-08-31"
"cond-mat/0012038","Hugues Pothier","F. Pierre (CEA/Saclay, SPEC, France), H. Pothier, D. Esteve, M.H.
  Devoret (CEA/Saclay, SPEC, France), A.B. Gougam, N.O. Birge (Department of
  Physics and Astronomy, Michigan State University)","Probing interactions in mesoscopic gold wires","latex pothier.tex, 12 files, 15 pages in: Proceedings of the NATO
  Advanced Research Workshop on Size Dependent Magnetic Scattering, Pesc,
  Hungary, May 28 - June 1st, 2000 Chandrasekhar V., Van Haesendonck C. eds
  (Kluwer, 2001) [SPEC-S00/083]",,,"SPEC-S00/083","cond-mat.mes-hall",,"  We have measured in gold wires the energy exchange rate between
quasiparticles, the phase coherence time of quasiparticles and the resistance
vs. temperature, in order to probe the interaction processes which are relevant
at low temperatures. We find that the energy exchange rate is higher than
expected from the theory of electron-electron interactions, and that it has a
different energy dependence. The dephasing time is constant at temperatures
between 8 K and 0.5 K, and it increases below 0.5 K. The magnetoresistance is
negative at large field scales, and the resistance decreases logarithmically
with increasing temperatures, indicating the presence of magnetic impurities,
probably Fe. Whereas resistivity and phase coherence measurements can be
attributed to magnetic impurities, the question is raised whether these
magnetic impurities could also mediate energy exchanges between quasiparticles.
","[{""version"":""v1"",""created"":""Mon, 4 Dec 2000 11:28:18 GMT""}]","2007-05-23"
