"cond-mat/0012039","Oded Agam","Assaf Ater and Oded Agam","Weak localization in disordered systems at the ballistic limit","13 pages, 13 figures","Phys. Rev. B 63, 205101 (2001).","10.1103/PhysRevB.63.205101",,"cond-mat.mes-hall nlin.CD",,"  The weak localization (WL) contribution to the two-level correlation function
is calculated for two-dimensional disordered conductors. Our analysis extends
to the nondiffusive (ballistic) regime, where the elastic mean path is of order
of the size of the system. In this regime the structure factor (the Fourier
transform of the two-point correlator) exhibits a singular behavior consisting
of dips superimposed on a smooth positive background. The strongest dips appear
at periods of the periodic orbits of the underlying clean system. Somewhat
weaker singularities appear at times which are sums of periods of two such
orbits. The results elucidate various aspects of the weak localization physics
of ballistic chaotic systems.
","[{""version"":""v1"",""created"":""Mon, 4 Dec 2000 12:24:31 GMT""}]","2009-10-31"
"cond-mat/0012040","Castin","Yvan Castin and Christopher Herzog","Bose-Einstein condensates in symmetry breaking states","24 pages, 2 figures, Lecture Notes of the Cargese School on
  Bose-Einstein condensates (July 2000); typos in Eqs.(72),(121) corrected","Comptes Rendus de l'Academie des Sciences de Paris, tome 2, serie
  IV, p.419-443 (2001)",,,"cond-mat.soft",,"  We consider two models of interacting Bose gases: a gas of spin one particles
in the ground state of a cubic box and a one-dimension Bose gas with contact
interactions. We show how to calculate exact eigenstates of the corresponding
N-body Hamiltonians. Both models share the property of not leading to the
formation of a Bose-Einstein condensate, even at zero temperature, in the
strict sense of the existence of a single one-particle state with a macroscopic
population. We show that a lot of physical insight can be gained on these two
model systems by using the usual Hartree-Fock mean field approach: in this
approximation, that we test against the exact result, everything happens as if
a single realization of the system was a Bose-Einstein condensate in a state
phi breaking the rotational or translational symmetry, and varying in a random
way for any new experimental realization.
","[{""version"":""v1"",""created"":""Mon, 4 Dec 2000 14:00:01 GMT""},{""version"":""v2"",""created"":""Mon, 19 Jul 2004 10:08:33 GMT""}]","2007-05-23"
"cond-mat/0012041","Mauro Sellitto","Y. Levin, J.J. Arenzon, M. Sellitto","Aging dynamics and density relaxation in granular compaction","7 pages, 5 figures. Eq.7 corrected plus minor changes. To appear in
  Europhys. Lett","Europhys. Lett. 55, 767 (2001).","10.1209/epl/i2001-00106-9",,"cond-mat.stat-mech",,"  We present an analytical approach to the out of equilibrium dynamics of a
class of kinetic lattice gases under gravity. The location of the jamming
transition, the critical exponents, and the scaling functions characterizing
the relaxation processes are determined. In particular, we find that
logarithmic compaction and simple aging are intimately related to the
Vogel-Fulcher law, while power-law compaction and super-aging behavior occur in
presence of a power-law diffusion.
","[{""version"":""v1"",""created"":""Mon, 4 Dec 2000 14:57:39 GMT""},{""version"":""v2"",""created"":""Wed, 6 Dec 2000 14:05:12 GMT""},{""version"":""v3"",""created"":""Thu, 28 Jun 2001 07:51:53 GMT""}]","2009-10-31"
"gr-qc/0012009","Stoytcho Yazadjiev","Stoytcho S.Yazadjiev (Sofia University)","Distorted charged dilaton black holes","14 pages, latex; v2 typos corrected, references added","Class.Quant.Grav. 18 (2001) 2105-2116","10.1088/0264-9381/18/11/308",,"gr-qc astro-ph hep-th",,"  We construct exact static, axisymmetric solutions of Einstein-Maxwell-dilaton
gravity presenting distorted charged dilaton black holes. The thermodynamics of
such distorted black holes is also discussed.
","[{""version"":""v1"",""created"":""Sun, 3 Dec 2000 18:50:09 GMT""},{""version"":""v2"",""created"":""Wed, 30 May 2001 13:58:34 GMT""}]","2009-10-31"
"gr-qc/0012010","Hideyuki Tagoshi","Hideyuki Tagoshi, Nobuyuki Kanda, Takahiro Tanaka, Daisuke Tatsumi,
  Souichi Telada, et al. (The TAMA Collaboration)","The First Search for Gravitational Waves from Inspiraling Compact
  Binaries using TAMA300 data","5 pages, 4 figures. To appear Phsical Review D","Phys.Rev.D63:062001,2001","10.1103/PhysRevD.63.062001","ICRR-Report-469-2000-13, OU-TAP-153","gr-qc astro-ph",,"  We analyzed 6 hours of data from the TAMA300 detector by matched filtering,
searching for gravitational waves from inspiraling compact binaries. We
incorporated a two-step hierarchical search strategy in matched filtering. We
obtained an upper limit of 0.59/hour (C.L.=90%) on the event rate of inspirals
of compact binaries with mass between 0.3M_solar and 10M_solar and with
signal-to-noise ratio greater than 7.2. The distance of 1.4M_solar (0.5M_solar)
binaries which produce the signal-to-noise ratio 7.2 was estimated to be 6.2kpc
(2.9kpc) when the position of the source on the sky and the inclination angle
of the binaries were optimal.
","[{""version"":""v1"",""created"":""Mon, 4 Dec 2000 08:10:06 GMT""}]","2008-11-26"
"gr-qc/0012011","Sawa Manoff","S. Manoff, B. Dimitrov","On the existence of a gyroscope in spaces with affine connections and
  metrics","12 pages, RevTex","Gen.Rel.Grav. 35 (2003) 25-33","10.1023/A:1021346626475",,"gr-qc",,"  Conditions for the existence of a gyroscope in spaces with affine connections
and metrics are found. They appear as special types of Fermi-Walker transports
for vector fields, lying in a subspace, orthogonal to the velocity vector field
of an observer.
  PACS numbers: 04.20Cv, 04.90.+e, 04.50.+h, 02.40.Ky
","[{""version"":""v1"",""created"":""Mon, 4 Dec 2000 12:19:18 GMT""}]","2015-06-25"
"hep-ex/0012007","Gabriella Pasztor","Gabriella Pasztor","Search for R-parity Violating Decays of Supersymmetric Particles at LEP","5 pages, 11 figures. To be published in the Proceedings of DPF2000,
  The Meeting of The Division of Particles and Fields of The American Physical
  Society, Columbus, Ohio, 9-12 August 2000, (Supplement of the International
  Journal of Modern Physics A (IJMP))","Int.J.Mod.Phys.A16S1B:781-785,2001","10.1142/S0217751X01008084","OPAL-CR-452","hep-ex",,"  Searches for pair-produced charginos, neutralinos and scalar fermions
decaying via R-parity violating / /\' and /\'' couplings with the OPAL detector
at LEP are presented at sqrt(s)=189 GeV. Partial updates using data up to the
highest energies of LEP, sqrt(s)=209 GeV, are also given.
","[{""version"":""v1"",""created"":""Sun, 3 Dec 2000 18:40:17 GMT""}]","2011-07-19"
"hep-ex/0012008","Gabriella Pasztor","Gabriella Pasztor","Study of ZZ production at LEP at sqrt(s) = 183 - 209 GeV","4 pages, 4 figures. To be published in the Proceedings of DPF2000,
  The Meeting of The Division of Particles and Fields of The American Physical
  Society, Columbus, Ohio, 9-12 August 2000, (Supplement of the International
  Journal of Modern Physics A (IJMP))","Int.J.Mod.Phys.A16S1A:311-314,2001",,"OPAL-CR-453","hep-ex",,"  A study of Z boson pair production in e+e- annihilation using the OPAL
detector at LEP is reported. The ZZ production cross-section is measured,
limits on anomalous ZZgamma and ZZZ couplings are derived, and constraints on
models of low scale quantum gravity in extra spatial dimensions are set.
","[{""version"":""v1"",""created"":""Sun, 3 Dec 2000 18:55:13 GMT""}]","2011-07-19"
"hep-ph/0012022","Dr. Abdelnasser Tawfik","Abdelnasser M. Tawfik (Marburg University, Germany)","On Contributions of Two-Particle Correlation Functions to the
  Intermittent behavior in Heavy-Ion Collisions","23 pages, 5 Postscript figures, 3 Tables","Heavy Ion Phys., 13 (2001) 1",,,"hep-ph",,"  The factorial moments (FM) of the multiplicity distributions in one- and
two-dimensions are studied in Pb+Pb collisions at 158 AGeV. Obvious
intermittency slopes are observed in the relation between FM and the partition
number M. The Bose-Einstein correlations (BEC) are investigated in the emulsion
data sample. The influences of the two-particle correlation functions (TPCF) on
the scaling behavior of FM are also investigated. The dependence of TPCF on the
invariant relative momentum Q as well as on the pseudo-rapidity $\delta\eta$
are calculated. It is found that TPCF fulfill the requirements of a power-law
scaling comparable with the scaling rule of FM. The expected contributions of
TPCD to FM are quantitatively estimated.
","[{""version"":""v1"",""created"":""Sun, 3 Dec 2000 19:35:34 GMT""},{""version"":""v2"",""created"":""Wed, 2 May 2001 13:41:49 GMT""}]","2016-09-06"
"hep-ph/0012023","Paul Buettiker","B. Ananthanarayan and P. B\""uttiker","Comparison of Pion-Kaon Scattering in SU(3) Chiral Perturbation Theory
  and Dispersion Relations","20 pages, LaTeX2e; replaced with version to appear in European
  Physical Journal C; typographical errors removed, minor stylistic changes","Eur.Phys.J.C19:517-528,2001","10.1007/s100520100629",,"hep-ph",,"  We establish the framework for the comparison of $\pi K$ scattering
amplitudes from SU(3) chiral perturbation theory with suitable dispersive
representations which result from the combination of certain fixed-t dispersion
relations with dispersion relations on hyperbolic curves. This allows for
predictions for some combinations of low energy constants appearing in higher
order calculations of chiral perturbation theory. Using a simple
parametrization for the lowest partial waves, first estimates for some
combinations are presented.
","[{""version"":""v1"",""created"":""Mon, 4 Dec 2000 09:36:34 GMT""},{""version"":""v2"",""created"":""Fri, 2 Mar 2001 00:06:58 GMT""}]","2009-01-07"
"hep-ph/0012024","Johan Bijnens","Johan Bijnens, Ada Farilla and Rory Miskimen (Conveners)","Report of the Working Group on Goldstone Bosons","15 pp, working group summary talk, Chiral Dynamics 2000: Theory and
  Experiment, July 17-22, 2000, Newport News, to be published in the
  proceedings",,"10.1142/9789812810977_0022","LU TP 00-50","hep-ph",,"  An overview is presented of the talks in the working group on Goldstone
Bosons. Topics touched on are CP-violation in the Kaon system, rare Kaon
decays, $\pi\pi$-scattering, $\phi$-meson decays, scalar mesons, form-factors
and polarizabilities, $\eta$-decays, chiral symmetry breaking, connections with
QCD at short-distances and effective theories for electroweak physics.
","[{""version"":""v1"",""created"":""Mon, 4 Dec 2000 08:57:14 GMT""}]","2017-08-23"
"hep-ph/0012025","Ralf Kuhn","R. Kuhn (Dresden, Tech. U. & Dresden, Max Planck Inst.), A.
  Schaelicke, F. Krauss, G. Soff (Dresden, Tech. U.)","Parton showers and multijet events","Talk given at Luederitz 2000: Fundamental and Applied Aspects of
  Modern Physics, Luederitz, Namibia, November 13-17, 2000. 9pp",,"10.1142/9789812810175_0030",,"hep-ph",,"  A Monte-Carlo event-generator has been developed which is dedicated to
simulate electron-positron annihilations. Especially a new approach for the
combination of matrix elements and parton showers ensures the independence of
the hadronization parameters from the CMS energy. This enables for the first
time the description of multijet-topologies, e.g. four jet angles, over a wide
range of energy, without changing any parameter of the model. Covering all
processes of the standard model our simulator is capable to describe
experiments at present and future accelerators, i.e. the LEP collider and a
possible Next Linear Collider(NLC).
","[{""version"":""v1"",""created"":""Mon, 4 Dec 2000 15:41:50 GMT""}]","2017-08-23"
"hep-ph/0012026","Nora Brambilla","Nora Brambilla (ITP Heidelberg and U. Milano)","A Short Introduction to Non-Relativistic Effective Field Theories","21 pages, latex, 8 figures; Invited talk given at the XXIII
  International Workshop on the Fundamental Problems of High Energy Physics,
  Protvino (Russia), June 2000. Few misprints corrected",,,"HD-THEP-00-58","hep-ph hep-lat hep-th",,"  I discuss effective field theories for heavy bound systems, particularly
bound systems involving two heavy quarks. The emphasis is on the relevant
concepts and on interesting physical applications and results.
","[{""version"":""v1"",""created"":""Mon, 4 Dec 2000 12:13:16 GMT""},{""version"":""v2"",""created"":""Fri, 10 Aug 2001 16:16:21 GMT""}]","2007-05-23"
"hep-ph/0012027","Arhrib Abdesslam","Abdesslam Arhrib and Wei-Shu Hou (National Taiwan University)","Window on Higgs Boson: Fourth Generation $b^\prime$ Decays Revisited","4 pages, RevTex, 4 eps figures, One more figure, version to be
  published in Phys. Rev. D","Phys.Rev.D64:073016,2001","10.1103/PhysRevD.64.073016",,"hep-ph hep-ex",,"  Direct and indirect searches of the Higgs boson suggest that 113 GeV
$\lesssim m_H \lesssim$ 170 GeV is likely. With the LEP era over and the
Tevatron Run II search via $p\bar p \to WH+X$ arduous, we revisit a case where
$WH$ or $ZH +$ jets could arise via strong $b^\prime\bar b^\prime$ pair
production. In contrast to 10 years ago, the tight electroweak constraint on
$t^\prime$--$b^\prime$ (hence $t^\prime$--$t$) splitting reduces FCNC
$b^\prime\to bZ$, $bH$ rates, making $b^\prime\to cW$ naturally competitive.
Such a ""cocktail solution"" is precisely the mix that could evade the CDF search
for $b^\prime\to bZ$, and the $b^\prime$ may well be lurking below the top. In
light of the Higgs program, this two-in-one strategy should be pursued.
","[{""version"":""v1"",""created"":""Mon, 4 Dec 2000 12:12:04 GMT""},{""version"":""v2"",""created"":""Fri, 10 Aug 2001 08:29:42 GMT""}]","2011-03-23"
"hep-ph/0012028","Daniele Dominici","Daniele Dominici","Non Linear Breaking of the Electroweak Symmetry and Large Extra
  Dimensions","10 pages, Latex","Phys.Lett. B500 (2001) 183-187","10.1016/S0370-2693(01)00067-3","DFF-362/9/00","hep-ph hep-th",,"  We consider the coupling to gravity in 4+delta dimensions of a non linear
electroweak symmetry breaking sector, with delta compactified dimensions, and
derive an effective lagrangian by integrating over the KK excitations of the
graviton and of the dilaton. The effective chiral lagrangian describes the
interactions of the electroweak gauge bosons and the goldstone bosons from the
electroweak breaking.
","[{""version"":""v1"",""created"":""Mon, 4 Dec 2000 12:21:59 GMT""}]","2009-10-31"
"hep-ph/0012029","Tetsuo Abe","Tetsuo Abe","GRAPE-Dilepton (version1.1), A Generator for Dilepton Production in ep
  Collisions","28 pages, 3 figures. To appear in CPC","Comput.Phys.Commun.136:126-147,2001","10.1016/S0010-4655(00)00246-0",,"hep-ph",,"  GRAPE-Dilepton is a Monte Carlo event generator for dilepton production in ep
collisions. The cross-section calculation is based on the exact matrix elements
in the electroweak theory at tree level. The dilepton productions via $\gamma
\gamma$, $\gamma Z^0$, $Z^0 Z^0$ collisions and via photon internal conversion
are taken into account. In addition, the effects of the $Z^0$ on/off-shell
production are also included. The relevant Feynman amplitudes are generated by
the automatic calculation system GRACE. The calculation of the proton vertex
covers the whole kinematical region. This generator has an interface to PYTHIA
and SOPHIA to obtain complete hadronic final states.
","[{""version"":""v1"",""created"":""Mon, 4 Dec 2000 12:52:09 GMT""},{""version"":""v2"",""created"":""Tue, 5 Dec 2000 01:28:20 GMT""}]","2014-11-17"
"hep-ph/0012030","Kosuke Odagiri","S. Kanemura, S. Moretti, K. Odagiri","Single charged Higgs boson production at next generation linear
  colliders","21 pages including 9 figures","JHEP 0102:011,2001","10.1088/1126-6708/2001/02/011","CERN-TH/2000-347, KEK-TH-729, MSUHEP-00911, RAL-TR-2000-037","hep-ph",,"  We study the single production of charged Higgs bosons in e+e- collisions,
chiefly in the Minimal Supersymmetric Standard Model. Our analysis complements
foregoing studies of the pair production channel especially in regions where
the kinematic constraint suppresses pair production. We present cross sections
relevant to experiments at the next generation linear colliders and some brief
discussions of their phenomenology. Our analysis shows that the single
production is a useful alternative channel for studying the phenomenology of
charged Higgs bosons, and there are regions of parameter space where it is
accessible beyond the kinematic limit for pair production.
","[{""version"":""v1"",""created"":""Mon, 4 Dec 2000 13:29:36 GMT""}]","2016-09-06"
"hep-ph/0012031","Janusz Rosiek","Nabil Ghodbane, Stavros Katsanevas, Imad Laktineh and Janusz Rosiek","Chargino searches at LEP for complex MSSM parameters","27 pages, 16 figures, uses axodraw.sty","Nucl.Phys.B647:190-214,2002","10.1016/S0550-3213(02)00944-6",,"hep-ph",,"  We reanalyze the results of the chargino searches at LEP (on the basis of the
DELPHI 189 GeV data sample), including the possibility of complex MSSM
parameters. We point out the possible differences between the complex- and
real-parameter analysis. We check that the regions excluded by ``standard''
analyses remain generally robust against the introduction of complex
parameters, with the exception of light sneutrino and low $\tan\beta$ scenario,
where additional constraints like those given by the $Z^0$ width or electric
dipole moment measurements are necessary.
","[{""version"":""v1"",""created"":""Mon, 4 Dec 2000 13:48:22 GMT""},{""version"":""v2"",""created"":""Wed, 20 Dec 2000 12:42:48 GMT""}]","2008-11-26"
"hep-th/0012014","Andrew K. Waldron","S. Deser and A. Waldron","(Dis)continuities of Massless Limits in Spin 3/2-mediated Interactions
  and Cosmological Supergravity","12 pages, LaTeX","Phys.Lett.B501:134-139,2001","10.1016/S0370-2693(01)00109-5","BRX-TH 478","hep-th gr-qc hep-ph",,"  We extend to its spin~3/2 supersymmetric partner the very recent
demonstration that the massless limit of massive spin~2 exchange amplitudes can
be made continuous in background AdS spaces, in contrast to the known flat
space discontinuities for both systems. In an AdS background, unlike spin~2
where the limit m\to0 is the massless one, spin~3/2 ``masslessness'' requires
m\to\sqrt{-\Lambda/3}, the supergravity value tuning the mass and cosmological
constant that uniquely provides gauge invariance and two helicities. We find
that continuity of the spin~3/2--mediated exchange amplitude can be regained in
two ``massless'' limits m\to0 and m\to\sqrt{-\Lambda/3}; only the latter
corresponds to cosmological supergravity.
","[{""version"":""v1"",""created"":""Sun, 3 Dec 2000 19:33:52 GMT""},{""version"":""v2"",""created"":""Fri, 23 Feb 2001 21:19:38 GMT""}]","2008-11-26"
"hep-th/0012015","Parampreet Singh","Naresh Dadhich and Narayan Banerjee","Global monopoles and scalar fields as the electrogravity dual of
  Schwarzschild spacetime","5 pages, RevTex","Mod.Phys.Lett. A16 (2001) 1193-1200","10.1142/S0217732301004376",,"hep-th gr-qc",,"  We prove that both global monopole and minimally coupled static zero mass
scalar field are electrogravity dual of the Schwarzschild solution or flat
space and they share the same equation of state, $T^0_0 - T^i_i = 0$. This
property was however known for the global monopole spacetime while it is for
the first time being established for the scalar field. In particular, it turns
out that the Xanthopoulos - Zannias scalar field solution is dual to flat
space.
","[{""version"":""v1"",""created"":""Mon, 4 Dec 2000 13:27:05 GMT""}]","2009-10-31"
"hep-th/0012016","Eduardo Eyras","E. Eyras, P.K. Townsend and M. Zamaklar","The Heterotic Dyonic Instanton","18 pages, LaTeX, no figures. Previous revision was to include exact
  multi-solitons. Third version corrects typos and ADM energy formula","JHEP 0105:046,2001","10.1088/1126-6708/2001/05/046","DAMTP-2000-132","hep-th",,"  The static Yang-Mills-Higgs dyonic instanton is shown to have a
non-vanishing, but anti-self-dual, angular momentum 2-form with skew
eigenvalues equal to the electric charge; for large charge the angular momentum
causes the instanton to expand into a hyper-spherical shell. A class of exact
multi dyonic instantons is then found and then generalized to a new class of
1/4 supersymmetric, non-singular, stationary, exact solutions of the
ten-dimensional supergravity/Yang-Mills theory. These self-gravitating dyonic
instantons yield new heterotic string solitons, to leading order in the inverse
string tension.
","[{""version"":""v1"",""created"":""Mon, 4 Dec 2000 13:57:26 GMT""},{""version"":""v2"",""created"":""Fri, 2 Feb 2001 19:19:20 GMT""},{""version"":""v3"",""created"":""Wed, 9 May 2001 13:42:03 GMT""}]","2010-02-03"
"hep-th/0012018","Andrei G. Bytsko","Andrei G. Bytsko","Singularities of the Seiberg-Witten map","8 pages, LaTeX","JHEP 0101:020,2001","10.1088/1126-6708/2001/01/020",,"hep-th",,"  We construct an explicit solution of the Seiberg-Witten map for a linear
gauge field on the non-commutative plane. We observe that this solution as well
as the solution for a constant curvature diverge when the non-commutativity
parameter theta reaches certain event horizon in the theta-space. This implies
that an ordinary Yang-Mills theory can be continuously deformed by the
Seiberg-Witten map into a non-commutative theory only within one connected
component of the theta-space.
","[{""version"":""v1"",""created"":""Mon, 4 Dec 2000 15:49:16 GMT""}]","2010-02-03"
"math-ph/0012005","Jan Lopuszanski","J. Cis{\l}o, J. {\L}opuszanski (ITP, Wroclaw University)","To what extent do the Classical Equations of Motion Determine the
  Quantization Scheme?","LaTeX 20 pages",,"10.1063/1.1405125",,"math-ph math.MP",,"  A simple example of one particle moving in a (1+1) space-time is considered.
As an example we take the harmonic oscillator. We confirm the statement that
the classical Equations of Motion do not determine at all the quantization
scheme. To this aim we use two inequivalent Lagrange functions, yielding
Euler-Lagrange Equations, having the same set of solutions. We present in
detail the calculations of both cases to emphasize the differences occuring
between them.
","[{""version"":""v1"",""created"":""Mon, 4 Dec 2000 12:44:15 GMT""}]","2015-06-26"
"math/0012010","Bernhard Lamel","Bernhard Lamel","A smooth regularity theorem for nondegenerate CR-mappings","AMS-LaTeX, 11 pages","Monatsh. Math. 142 (2004), no. 4, 315-326",,,"math.CV",,"  We prove the following regularity result: If M and M' are smooth generic
submanifolds of C^N and C^N' respectively, where N and N' are not necessarily
equal, and if M is minimal, then every C^k-CR-map from M into M^\prime which is
k-nondegenerate is smooth. As an application, every CR diffeomorphism of
k-nondegenerate minimal submanifolds in C^N of class C^k is smooth.
","[{""version"":""v1"",""created"":""Sun, 3 Dec 2000 16:28:43 GMT""}]","2007-05-23"
"math/0012011","Dr. Yucai Su","Yucai Su and Kaiming Zhao","Simple algebras of Weyl type","9 pages, Latex","Science in China A, 30 (2000), 1057-1063","10.1007/BF02881878",,"math.QA math-ph math.MP",,"  Over a field $F$ of any characteristic, for a commutative associative algebra
$A$ with an identity element and for the polynomial algebra $F[D]$ of a
commutative derivation subalgebra $D$ of $A$, the associative and the Lie
algebras of Weyl type on the same vector space $A[D]=A\otimes F[D]$ are
defined. It is proved that $A[D]$, as a Lie algebra (modular its center) or as
an associative algebra, is simple if and only if $A$ is $D$-simple and $A[D]$
acts faithfully on $A$. Thus a lot of simple algebras are obtained.
","[{""version"":""v1"",""created"":""Sun, 3 Dec 2000 19:03:18 GMT""}]","2015-06-26"
"math/0012012","Dr. Yucai Su","Yucai Su and Kaiming Zhao","Isomorphism classes and automorphism groups of algebras of Weyl type","15 pages, Latex, to appear in Science in China A",,,,"math.QA math-ph math.MP",,"  In one of our recent papers, the associative and the Lie algebras of Weyl
type $A[D]=A\otimes F[D]$ were defined and studied, where $A$ is a commutative
associative algebra with an identity element over a field $F$ of any
characteristic, and $F[D]$ is the polynomial algebra of a commutative
derivation subalgebra $D$ of $A$. In the present paper, a class of the above
associative and Lie algebras $A[D]$ with $F$ being a field of characteristic 0,
$D$ consisting of locally finite but not locally nilpotent derivations of $A$,
are studied. The isomorphism classes and automorphism groups of these
associative and Lie algebras are determined.
","[{""version"":""v1"",""created"":""Sun, 3 Dec 2000 19:03:24 GMT""}]","2007-05-23"
"math/0012013","Dr. Yucai Su","Yucai Su","On indecomposable modules over the Virasoro algebra","5 pages, Latex, to appear in Science in China A",,"10.1007/BF02878973",,"math.QA math-ph math.MP",,"  It is proved that an indecomposable Harish-Chandra module over the Virasoro
algebra must be (i) a uniformly bounded module, or (ii) a module in Category
$\cal O$, or (iii) a module in Category ${\cal O}^-$, or (iv) a module which
contains the trivial module as one of its composition factors.
","[{""version"":""v1"",""created"":""Sun, 3 Dec 2000 19:03:31 GMT""}]","2015-06-26"
