"quant-ph/0012146","Valdir B. Bezerra","G. de A. Marques (UFPb), Claudio Furtado (UFPb) V. B. Bezerra (UFPb)
  and Fernando Moraes(UFPe)","Landau Levels in the Presence of Topological Defects","17 pages, LATEX file",,"10.1088/0305-4470/34/30/306",,"quant-ph",,"  We study the Landau levels associated with electrons moving in a magnetic
field in the presence of a continuous distribution of disclinations, a magnetic
screw dislocation and a dispiration. We focus on the influence of these
topological defects on the spectrum of the electron(or hole) in a magnetic
field in the framework of the geometric theory of defects in solids of Katanaev
and Volovich. The presence of the defects breaks the degeneracy of the Landau
levels in different ways depending on the defect. Exact expressions for
energies and eigenfuctions are found for all cases.
","[{""version"":""v1"",""created"":""Thu, 28 Dec 2000 13:01:04 GMT""}]","2009-11-06"
