"cond-mat/0012492","Yuji Matsuda","K. Kumagai, K. Nozaki and Yuji Matsuda","Charged Vortices in High Temperature Superconductors Probed by NMR","6 pages, 7 figures, to be published in Phys Rev. B",,"10.1103/PhysRevB.63.144502",,"cond-mat.supr-con cond-mat.str-el",,"  We report a first experimental evidence that a vortex in the high temperature
superconductors (HTSC) traps a finite electric charge from the high resolution
measurements of the nuclear quadrupole frequencies. In slightly overdoped
YBa_2Cu_3O_7 the vortex is negatively charged by trapping electrons, while in
underdoped YBa_2Cu_4O_8 it is positively charged by expelling electrons. The
sign of the trapped charge is opposite to the sign predicted by the
conventional BCS theory. Moreover, in both materials, the deviation of the
magnitude of the charge from the theory is also significant. These unexpected
features can be attributed to the novel electronic structure of the vortex in
HTSC.
","[{""version"":""v1"",""created"":""Thu, 28 Dec 2000 10:16:17 GMT""},{""version"":""v2"",""created"":""Thu, 11 Jan 2001 06:07:16 GMT""}]","2009-10-31"
"cond-mat/0012493","Yu Kawasaki","Y.Kawasaki, K.Ishida, T.Mito, C.Thessieu, G.-q.Zheng, Y.Kitaoka,
  C.Geibel and F.Steglich","Exotic Superconducting Phase in CeCu2Si2 Close to Antiferromagnetism : A
  Cu-NQR Study under Hydrostatic Pressure","5 pages with 4 figures embedded in the text. To be published in Phys.
  Rev. B",,"10.1103/PhysRevB.63.140501",,"cond-mat.str-el cond-mat.supr-con",,"  We report Cu nuclear-quadrupole-resonance results under pressure on a
homogeneous CeCu2Si2 (Tc = 0.65 K) that revealed critical magnetic fluctuations
at the border to an antiferromagnetic phase. This exotic superconducting phase
evolves into the typical heavy-fermion superconducting phase at minute
pressures exceeding Pc ~ 0.2 GPa. The nuclear spin-lattice relaxation data in a
pressure range 0.85 - 2.58 GPa are shown to be accountable by the SCR theory
based on the nearly antiferromagnetic Fermi-liquid model. In 0 < P < Pc ~ 0.2
GPa, by contrast, we conclude that the exotic superconducting phase manifests
itself under the unconventional normal state where antiferromagnetic waves
propagate over a long range without any trace of antiferromagnetic order and
thereby the heavy-fermion state breaks up.
","[{""version"":""v1"",""created"":""Thu, 28 Dec 2000 10:31:02 GMT""}]","2009-10-31"
"cond-mat/0012494","Nicholas A. Pertsev","N. A. Pertsev and A. Yu. Emelyanov","Soft modes of collective domain-wall vibrations in epitaxial
  ferroelectric thin films","6 pages, 3 figures","Physical Review B, vol. 65, art. 174115 (2002)","10.1103/PhysRevB.65.174115",,"cond-mat.mtrl-sci",,"  Mechanical restoring forces acting on ferroelastic domain walls displaced
from the equilibrium positions in epitaxial films are calculated for various
modes of their cooperative translational oscillations. For vibrations of the
domain-wall superlattice with the wave vectors corresponding to the center and
boundaries of the first Brillouin zone, the soft modes are singled out that are
distinguished by a minimum magnitude of the restoring force. It is shown that,
in polydomain ferroelectric thin films, the soft modes of wall vibrations may
create enormously large contribution to the film permittivity.
","[{""version"":""v1"",""created"":""Thu, 28 Dec 2000 13:20:48 GMT""}]","2007-05-23"
"cond-mat/0012495","Mohammad Khorrami","Amir Aghamohammadi, Mohammad Khorrami","Phase transitions in autonomous reaction-diffusion systems on a
  one-dimensional lattice with boundaries","13 pages, LaTeX 2e","J. Phys. A34 (2001) 7431","10.1088/0305-4470/34/37/301",,"cond-mat.stat-mech",,"  The family of autonomous reaction-diffusion models on a one-dimensional
lattice with boundaries is studied. By autonomous, it is meant that the
evolution equation for n-point functions contain only n- or less- point
functions. It is shown that these models exhibit a static and a dynamic phase
transition.
","[{""version"":""v1"",""created"":""Thu, 28 Dec 2000 12:24:09 GMT""}]","2009-10-31"
"cond-mat/0012497","Marco Raberto","Marco Raberto, Enrico Scalas, Rudolf Gorenflo and Francesco Mainardi","The waiting-time distribution of LIFFE bond futures","Submitted to Quantitative Finance, Proceedings of Application of
  Physics in Financial Analysis II, Liege, 13-15 July 2000",,,,"cond-mat.dis-nn cond-mat.stat-mech q-fin.TR",,"  We apply the Continuous Time Random Walk (CTRW) framework, introduced in
finance by Scalas et al., to the analysis of the probability distribution of
time intervals between two consecutive trades in the case of BTP futures prices
traded at LIFFE in 1997. Results corroborate the validity of the CTRW approach
for the description of the temporal evolution of financial time series.
","[{""version"":""v1"",""created"":""Thu, 28 Dec 2000 14:09:47 GMT""}]","2008-12-02"
"cond-mat/0012498","Applied Math","V. P. Maslov (Moscow Univ.)","Quantization of Thermodynamics, Supersecondary Quantization, and a New
  Variational Principle","28 pages, Latex",,,,"cond-mat.supr-con cond-mat.stat-mech math-ph math.MP physics.atm-clus quant-ph",,"  In solving the problem of finding a temperature distribution which, at zero
temperature, corresponds to superfluidity, i.e., to nonzero energy, the author
tried to quantize free energy. This was done on the basis of supersecondary
quantization whose special case is the usual secondary quantization for bosons
and with the help of which new representations of the Schr\""odinger equation
were obtained. The supersecondary quantization allowed the author to construct
a variational method whose zero approximation are the Hartree-Fock and
Bogolyubov-BCSch variational principles. This method works especially well in
the case of not a large number of particles. The new quantization and the
variational method are of general character and can be used in the quantum
field theory.
","[{""version"":""v1"",""created"":""Thu, 28 Dec 2000 15:35:01 GMT""}]","2016-08-31"
"cond-mat/0012499","Shaoxin Feng","Shaoxin Feng, Qinghua Jin, Baohui Li, Zhenya Guo, Datong Ding","Empirical Calculations of the Formation Energies of Intrinsic Defects in
  Lithium Niobate","11 pages, 8 tables, 20 references",,,,"cond-mat.dis-nn cond-mat.mtrl-sci",,"  Results of our shell-model calculations concerning the determination of
empirical parameters of inter-ionic potentials and the formation energies of
point defects in LiNbO3 are presented. We employed the relaxed fitting method
which is particularly appropriate for the modeling of low-symmetry structure.
Attention is paid to guarantee the simulation precision of the parameters who
are sensitive for defect formation energy calculations. It is shown that Li
Frenkel disorders are the main intrinsic defects in stoichiometric lithium
niobate and Li vacancy model is the dominant defect species in congruent
lithium niobate.
","[{""version"":""v1"",""created"":""Thu, 28 Dec 2000 15:42:23 GMT""}]","2007-05-23"
"gr-qc/0012099","Marc Mars","Marc Mars, Jose M. M. Senovilla, Raul Vera","Signature Change on the Brane","RevTeX, 4 pages, 1 figure. Uses epsfig package. Slightly shorter
  version to match the published version. Reference added","Phys.Rev.Lett. 86 (2001) 4219-4222","10.1103/PhysRevLett.86.4219",,"gr-qc hep-th",,"  We explore the possibility of having a good description of classical
signature change in the brane scenario.
","[{""version"":""v1"",""created"":""Wed, 27 Dec 2000 16:01:43 GMT""},{""version"":""v2"",""created"":""Fri, 27 Apr 2001 14:06:39 GMT""}]","2009-10-31"
"gr-qc/0012100","Alejandro Perez","Alejandro Perez and Osvaldo M. Moreschi","Characterizing exact solutions from asymptotic physical concepts",,,,,"gr-qc",,"  We contribute to the subject of the physical interpretation of exact
solutions by characterizing them through a systematic study in terms of
unambiguous physical concepts coming from systems in linearized gravity. We use
the physical meaning of the leading order behavior of the Weyl spinor
components $\Psi_0^0$, $\Psi_1^0$ and $\Psi_2^0$ and of the Maxwell spinor
components $\phi_0^0$ and $\phi_1^0$ and integrate from future null infinity
inwards the exact field equations. In this way it is assigned an unambiguous
physical meaning to exact solutions. We indicate a method to generalize the
procedure to radiating spacetimes.
","[{""version"":""v1"",""created"":""Wed, 27 Dec 2000 18:12:14 GMT""}]","2007-05-23"
"gr-qc/0012101","Jose' P. S. Lemos","Alexander B. Balakin, Richard Kerner, Jose' P. S. Lemos","Cherenkov radiation in a gravitational wave background","LaTeX file, no figures, 19 pages","Class.Quant.Grav. 18 (2001) 2217-2232","10.1088/0264-9381/18/11/315",,"gr-qc astro-ph hep-th",,"  A covariant criterion for the Cherenkov radiation emission in the field of a
non-linear gravitational wave is considered in the framework of exact
integrable models of particle dynamics and electromagnetic wave propagation. It
is shown that vacuum interacting with curvature can give rise to Cherenkov
radiation. The conically shaped spatial distribution of radiation is derived
and its basic properties are discussed.
","[{""version"":""v1"",""created"":""Wed, 27 Dec 2000 18:40:59 GMT""},{""version"":""v2"",""created"":""Tue, 12 Jun 2001 19:25:19 GMT""}]","2009-10-31"
"gr-qc/0012102","Yuri N. Obukhov","Yuri N. Obukhov","Spin, gravity, and inertia","Revtex, 12 pages, no figures, accepted in Phys. Rev. Lett","Phys.Rev.Lett.86:192-195,2001","10.1103/PhysRevLett.86.192",,"gr-qc hep-th",,"  The gravitational effects in the relativistic quantum mechanics are
investigated. The exact Foldy-Wouthuysen transformation is constructed for the
Dirac particle coupled to the static spacetime metric. As a direct application,
we analyze the non-relativistic limit of the theory. The new term describing
the specific spin (gravitational moment) interaction effect is recovered in the
Hamiltonian. The comparison of the true gravitational coupling with the purely
inertial case demonstrates that the spin relativistic effects do not violate
the equivalence principle for the Dirac fermions.
","[{""version"":""v1"",""created"":""Thu, 28 Dec 2000 01:07:07 GMT""}]","2011-08-17"
"gr-qc/0012103","Valdir B. Bezerra","J. Spinelly (UFPb), E. R. Bezerra de Mello (UFPb) and V. B.
  Bezerra(UFPb)","Relativistic Quantum Scattering on a Cone","22 pages, LATEX file",,"10.1088/0264-9381/18/8/311",,"gr-qc",,"  We study the relativistic quantum mechanical scattering of a bosonic particle
by an infinite straight cosmic string, considering the non-minimal coupling
between the bosonic field and the scalar curvature. In this case, an effective
two-dimensional delta-function interaction takes place besides the usual
topological scattering and a renormalization procedure is necessary in order to
treat the problem that appears in connection with the delta-function.
","[{""version"":""v1"",""created"":""Thu, 28 Dec 2000 12:58:15 GMT""}]","2009-10-31"
"hep-ex/0012064","Alan J. Weinstein","Alan J. Weinstein","Semi-hadronic Tau Decays at CLEO","20 pages, 25 figs. Submitted to the Proceedings of the Sixth
  International Workshop on Tau Lepton Physics, 18-21 September, 2000 Victoria,
  Canada, Representing the CLEO Collaboration","Nucl.Phys.Proc.Suppl.98:261-280,2001","10.1016/S0920-5632(01)01235-X",,"hep-ex",,"  This contribution reviews several new or updated results on substructure in
semi-hadronic tau decays, recently published by the CLEO Collaboration. These
results are all based on data collected with the CLEO detector at Cornell's
CESR collider, in the reaction $e^+e^-\to \tau^+\tau^-$ at $\sqrt{s} \simeq
10.6$ GeV. Most of these results are based on $\approx 4.3\times 10^6$
$\tau^+\tau^-$ pairs collected with the CLEO II detector between 1990 --- 1995.
Some (where noted) also use $\approx 8.0\times 10^6$ $\tau^+\tau^-$ pairs
collected with the CLEO II.V detector (which includes a silicon vertex detector
and better drift chamber tracking) between 1995 --- 1999.
","[{""version"":""v1"",""created"":""Wed, 27 Dec 2000 23:38:33 GMT""}]","2014-11-17"
"hep-ex/0012065","Schilling F.-P.","F.-P. Schilling","Diffractive Dijet and 3-Jet Electroproduction at HERA","4 pages, talk at DIS 2000 (Liverpool; April 2000), to appear in the
  proceedings",,,,"hep-ex",,"  A new H1 measurement of diffractive dijet and 3-jet production cross sections
in diffractive deep inelastic scattering events of the type ep->eXY is
presented. The data constrain well the diffractive gluon distribution. At low
x-pom, a calculation based on perturbative QCD is in a reasonable agreement
with the data.
","[{""version"":""v1"",""created"":""Thu, 28 Dec 2000 14:32:08 GMT""},{""version"":""v2"",""created"":""Fri, 29 Dec 2000 07:55:31 GMT""}]","2007-05-23"
"hep-lat/0012028","Stam Nicolis","P. Dimopoulos, K. Farakos, C. P. Korthals-Altes, G. Koutsoumbas and S.
  Nicolis","Phase Structure of the 5D Abelian Higgs Model with Anisotropic Couplings","LaTeX (amssymb.sty and psfig) 21 pages, 17 figures","JHEP 0102:005,2001","10.1088/1126-6708/2001/02/005",,"hep-lat hep-th",,"  We establish the phase diagram of the five-dimensional anisotropic Abelian
Higgs model by mean field techniques and Monte Carlo simulations. The
anisotropy is encoded in the gauge couplings as well as in the Higgs couplings.
In addition to the usual bulk phases (confining, Coulomb and Higgs) we find
four-dimensional ``layered'' phases (3-branes) at weak gauge coupling, where
the layers may be in either the Coulomb or the Higgs phase, while the
transverse directions are confining.
","[{""version"":""v1"",""created"":""Thu, 28 Dec 2000 15:55:45 GMT""}]","2010-02-03"
"hep-ph/0012347","Dr A. N. Mitra","A.N.Mitra","Markov-Yukawa Transversality Principle And 3D-4D Interlinkage Of
  Bethe-Salpeter Amplitudes","Latex file 38 pp; to appear in the Proceedings of the XXIII Intl.
  Workshop on Fundamental Problems in QFT, Protvino, June 2000",,,,"hep-ph",,"  This article is designed to focus attention on the Markov-Yukawa
Transversality Principle (MYTP) as a novel paradigm for an exact 3D-4D
interlinkage between the corresponding BSE amplitudes, with a closely parallel
treatment of $q{\bar q}$ and $qqq$ systems, stemming from a common 4-fermion
Lagrangian mediated by gluon (vector)-like exchange. This unique feature of
MYTP owes its origin to a Lorentz- covariant 3D support to the BS kernel, which
acts as a sort of `gauge principle' and distinguishes it from most other 3D
approaches to strong interaction dynamics. Some of the principal approaches in
the latter category are briefly reviewed so as to set the (less familiar) MYTP
in their context. Two specific types of MYTP which provide 3D support to the
BSE kernel, are considered: a) Covariant Instantaneity Ansatz (CIA); b)
Covariant LF/NP ansatz (Cov.LF). Both lead to formaly identical 3D BSE
reductions but produce sharply different 4D structures: Under CIA, the 4D loop
integrals suffer from Lorentz mismatch of the vertex functions, leading to
ill-defined time-like momentum integrals, but Cov LF is free from this disease.
This is illustrated by the pion form factor under Cov LF. The reconstruction of
the 4D $qqq$ wave function is achieved by Green's function techniques. PACS:
11.10 st ; 12.38 Lg ; 13.40.Fn. Keywords: Tamm-Dancoff, Bethe-Salpeter,
Quasi-potentials, Light-front (LF), Markov-Yukawa, 3D-4D Interlinkage, CIA,
Cov-LF, Spectroscopy.
","[{""version"":""v1"",""created"":""Wed, 27 Dec 2000 17:51:36 GMT""}]","2007-05-23"
"hep-ph/0012348","Jianwei Qiu","Jianwei Qiu and Xiaofei Zhang (Iowa State University)","Role of the nonperturbative input in QCD resummed Drell-Yan
  $Q_T$-distributions","Latex, 43 pages including 15 figures; typos were corrected","Phys.Rev.D63:114011,2001","10.1103/PhysRevD.63.114011",,"hep-ph nucl-th",,"  We analyze the role of the nonperturbative input in the Collins, Soper, and
Sterman (CSS)'s $b$-space QCD resummation formalism for Drell-Yan transverse
momentum ($Q_T$) distributions, and investigate the predictive power of the CSS
formalism. We find that the predictive power of the CSS formalism has a strong
dependence on the collision energy $\sqrt{S}$ in addition to its well-known
$Q^2$ dependence, and the $\sqrt{S}$ dependence improves the predictive power
at collider energies. We show that a reliable extrapolation from perturbatively
resummed $b$-space distributions to the nonperturbative large $b$ region is
necessary to ensure the correct $Q_T$ distributions. By adding power
corrections to the renormalization group equations in the CSS formalism, we
derive a new extrapolation formalism. We demonstrate that at collider energies,
the CSS resummation formalism plus our extrapolation has an excellent
predictive power for $W$ and $Z$ production at all transverse momenta $Q_T\le
Q$. We also show that the $b$-space resummed $Q_T$ distributions provide a good
description of Drell-Yan data at fixed target energies.
","[{""version"":""v1"",""created"":""Wed, 27 Dec 2000 18:20:20 GMT""},{""version"":""v2"",""created"":""Tue, 20 Feb 2001 15:59:16 GMT""}]","2008-11-26"
"hep-ph/0012349","A. A. Arkhipov","A.A. Arkhipov","Three-body forces, single diffraction dissociation and shadow
  corrections to hadron-deuteron total cross-sections","Latex, 9 figures, the talk presented at the Workshop ""QFTHEP2000"",
  Tver, Russia, September 14-20, 2000",,,"IHEP 2000-59, Protvino 2000","hep-ph astro-ph nucl-th",,"  The relationships between the fundamental dynamics and diffraction phenomena
in scattering from two-body composite system are discussed. A new simple
formula for the shadow corrections to the total cross-section in scattering
from deuteron has been derived and new scaling characteristics with a clear
physical interpretation have been established. The effect of weakening the
inelastic screening at super-high energies is theoretically discovered. A
comparison with the experimental data on proton(antiproton)-deuteron total
cross-sections has been performed. It is shown that there is quite a remarkable
correspondence of the theory with the experimental data.
","[{""version"":""v1"",""created"":""Wed, 27 Dec 2000 18:37:16 GMT""}]","2007-05-23"
"hep-ph/0012350","Mary Hall Reno","S. Iyer Dutta, M. H. Reno, I. Sarcevic and D. Seckel","Propagation of Muons and Taus at High Energies","25 pages including 8 figures","Phys.Rev. D63 (2001) 094020","10.1103/PhysRevD.63.094020",,"hep-ph astro-ph",,"  The photonuclear contribution to charged lepton energy loss has been
re-evaluated taking into account HERA results on real and virtual photon
interactions with nucleons. With large $Q^2$ processes incorporated, the
average muon range in rock for muon energies of $10^9$ GeV is reduced by only
5% as compared with the standard treatment. We have calculated the tau energy
loss for energies up to $10^9$ GeV taking into consideration the decay of the
tau. A Monte Carlo evaluation of tau survival probability and range show that
at energies below $10^7-10^8$ GeV, depending on the material, only tau decays
are important. At higher energies the tau energy losses are significant,
reducing the survival probability of the tau. We show that the average range
for tau is shorter than its decay length and reduce to 17 km in water for an
incident tau energy of $10^9$ GeV, as compared with its decay length of 49 km
at that energy. In iron, the average tau range is 4.7 km for the same incident
energy.
","[{""version"":""v1"",""created"":""Wed, 27 Dec 2000 22:01:23 GMT""}]","2009-10-31"
"hep-ph/0012351","Dieter Zeppenfeld","N.Kauer, T.Plehn, D.Rainwater and D.Zeppenfeld","H-->WW as the discovery mode for a light Higgs boson","10 pages, 4 figures, uses revtex","Phys.Lett.B503:113-120,2001","10.1016/S0370-2693(01)00211-8","MADPH-00-1208","hep-ph",,"  The production cross section for a m_H=115 GeV, SM Higgs boson in weak boson
fusion at the LHC is sizable. However, the branching fraction for H-->WW is
expected to be relatively small. The signal, with its two forward jets, is
sufficiently different from the main backgrounds that a signal to background
ratio of better than 1:1 can nevertheless be obtained, with large enough rate
to allow for a 5 sigma signal with 35 fb^{-1} of data. The H-->WW signal in
weak boson fusion may thus prove to be the discovery mode for the Higgs boson
at the LHC.
","[{""version"":""v1"",""created"":""Wed, 27 Dec 2000 23:59:39 GMT""}]","2014-11-17"
"hep-ph/0012352","Kawamura","Yoshiharu Kawamura (Shinshu University)","Split Multiplets, Coupling Unification and Extra Dimension","10 pages, latex, no figures","Prog.Theor.Phys.105:691-696,2001","10.1143/PTP.105.691","DPSU-00-04","hep-ph",,"  We study a gauge coupling unification scenario based on a non-supersymmetric
5-dimensional model. Through an orbifold compactification, we obtain the
Standard Model with split multiplets on a 4-dimensional wall, which is
compatible with a grand unification.
","[{""version"":""v1"",""created"":""Thu, 28 Dec 2000 04:43:36 GMT""}]","2014-11-17"
"hep-ph/0012353","Arhrib Abdesslam","Abdesslam Arhrib (National Taiwan University)","Unitarity constraints on scalar parameters of the Standard and Two Higgs
  Doublets Model","16 pages, latex, 1 ps figures. Based on hep-ph/0006035. To be
  published in the proceedings of: Noncommutative Geometry, Superstrings and
  Particle Physics Workshop, Univ-Rabat, Morocco",,,,"hep-ph",,"  Unitarity constraints on the scalar parameters both for the Standard Model
and the general Two Higgs Doublet Model (THDM) are examined. In the case of the
THDM with an exact discrete symmetry transformation, we show that the mass of
the lightest CP-even Higgs boson ($M_h$) and $\tan\beta$ are strongly
correlated and consequently a strong lower bound can be put on $M_h$ for large
$\tan\beta$. It is also shown that the inclusion of the discrete symmetry
breaking term relaxes the aforementioned correlation.
","[{""version"":""v1"",""created"":""Thu, 28 Dec 2000 06:39:33 GMT""}]","2007-05-23"
"hep-ph/0012354","Takahashi Keitaro","K.Takahashi, M.Watanabe and K.Sato","The Earth effects on the supernova neutrino spectra","19 pages, 6 figures, corrected version","Phys.Lett.B510:189-196,2001","10.1016/S0370-2693(01)00610-4","UTAP-381/00, RESCEU-39/00","hep-ph astro-ph",,"  The Earth effects on the energy spectra of supernova neutrinos are studied.
We analyze numerically the time-integrated energy spectra of neutrino in a
mantle-core-mantle step function model of the Earth's matter density profile.
We consider a realistic frame-work in which there are three active neutrinos
whose mass squared differences and mixings are constrained by the present
understanding of solar and atmospheric neutrinos. We find that the energy
spectra change for some allowed mixing parameters. Especially, the expected
number of events at SNO shows characteristic behavior with respect to energy,
i.e. a great dip and peak. We show that observations of the Earth effect allow
us to identify the solar neutrino solution and to probe the mixing angle
$\theta_{2}$.
","[{""version"":""v1"",""created"":""Thu, 28 Dec 2000 10:02:59 GMT""},{""version"":""v2"",""created"":""Wed, 28 Feb 2001 07:48:12 GMT""},{""version"":""v3"",""created"":""Thu, 29 Mar 2001 13:12:33 GMT""},{""version"":""v4"",""created"":""Mon, 2 Apr 2001 13:39:23 GMT""}]","2014-11-17"
"hep-ph/0012355","Sapozhnikov","M.G. Sapozhnikov","Polarized strangeness in the nucleon","10 pages, Latex using espcrc1.sty, Invited talk at Low Energy
  Antiproton Physics Conference (LEAP 2000), Venice, Italy, August, 2000","Nucl.Phys. A692 (2001) 63-72","10.1016/S0375-9474(01)01160-5",,"hep-ph",,"  A large violation of the Okubo-Zweig-Iizuka rule was discovered in the
annihilation of stopped antiprotons. The explanation of these experimental data
is discussed in the framework of the model assumed that the nucleon strange sea
quarks are polarized.
","[{""version"":""v1"",""created"":""Thu, 28 Dec 2000 10:55:29 GMT""}]","2009-10-31"
"hep-ph/0012356","Wit","K. Fialkowski and R. Wit","Bose-Einstein effect from asymmetric sources in Monte Carlo generators","11 pages, 3 figures",,,,"hep-ph",,"  We discuss the implementations of the Bose-Einstein effect from asymmetric
sources in Monte Carlo generators. A comparison of LEP data with results from
the PYTHIA/JETSET code with the standard procedure imitating the effect and
with the results from the weight method
  (with weights depending in various ways on components of momenta differences)
is presented. We show that in this last method one can reproduce the
experimental hierarchy of the source radii.
","[{""version"":""v1"",""created"":""Thu, 28 Dec 2000 11:19:06 GMT""}]","2016-09-06"
"hep-ph/0012357","K. Matsuda","K.Matsuda, N.Takeda, T.Fukuyama, H.Nishiura","MNS Parameters from Neutrino Oscillations, Single Beta Decay and Double
  Beta Decay","25pages, 10figures","Phys.Rev.D64:013001,2001","10.1103/PhysRevD.64.013001",,"hep-ph",,"  We examine the constraints on the MNS lepton mixing matrix =66rom the present
and future experimental data of the neutrino oscillation, tritium beta decay,
and neutrinoless double beta decay for Majorana neutrinos. We show that the
small mixing angle solutions for solar neutrino problem are disfavored for
small averaged mass ($<m_\nu>$) of neutrinoless double beta decay ($\leq 0.01$
eV) in the inverse neutrino mass hierarchy scenario. This is the case even in
the normal mass hierarchy scenario except for very restrictive value of the
averaged neutrino mass ($\bar{m_\nu}$) of single beta decay. The lower mass
bound for $\bar{m_\nu}$ is given from the present neutrino oscillation data. We
obtain some relations between $<m_\nu>$ and $\bar{m_\nu}$. The constraints on
the Majorana CP violating phases are also given.
","[{""version"":""v1"",""created"":""Thu, 28 Dec 2000 12:51:44 GMT""},{""version"":""v2"",""created"":""Thu, 11 Jan 2001 10:05:56 GMT""}]","2014-11-17"
