"hep-ph/0012358","Masahiro Fukushima","M. Fukushima, E.-M. Ilgenfritz, H. Toki","Abelian Monopole and Center Vortex Views at the Multi-Instanton Gas","21 pages, 22 Postscript figures","Phys.Rev. D64 (2001) 034503","10.1103/PhysRevD.64.034503","RCNP-Th/00032","hep-ph hep-lat",,"  We consider full non-Abelian, Abelian and center projected lattice field
configurations built up from random instanton gas configurations in the
continuum. We study the instanton contribution to the $\bar{Q}Q$ force with
respect to ({\it i}) instanton density dependence, ({\it ii}) Casimir scaling
and ({\it iii}) whether various versions of Abelian dominance hold. We check
that the dilute gas formulation for the interaction potential gives an reliable
approximation only for densities small compared to the phenomenological value.
We find that Casimir scaling does not hold, confirming earlier statements in
the literature. We show that the lattice used to discretize the instanton gas
configurations has to be sufficiently coarse ($a \approx 2\bar{\rho}$ compared
with the instanton size $\bar{\rho}$) such that maximal Abelian gauge
projection and center projection as well as the monopole gas contribution to
the $\bar{Q}Q$ force reproduce the non-Abelian instanton-mediated force in the
intermediate range of linear quasi-confinement. We demonstrate that monopole
clustering also depends critically on the discretization scale confirming
earlier findings based on monopole blocking.
","[{""version"":""v1"",""created"":""Thu, 28 Dec 2000 14:39:57 GMT""},{""version"":""v2"",""created"":""Thu, 8 Mar 2001 11:30:12 GMT""}]","2009-10-31"
"hep-ph/0012360","Lz","B. G. Zakharov","On the Energy Loss of High Energy Quarks in a Finite-Size Quark-Gluon
  Plasma","7 pages, 0 figures","JETP Lett. 73 (2001) 49-52; Pisma Zh.Eksp.Teor.Fiz. 73 (2001)
  55-58","10.1134/1.1358417","FZJ-IKP(Th)-2000-31","hep-ph",,"  We study within the light-cone path integral approach the induced gluon
emission from a fast quark passing through a finite-size QCD plasma. We show
that the leading log approximation used in previous studies fails when the
gluon formation length becomes of the order of the length of the medium
traversed by the quark. Calculation of the energy loss beyond the leading log
approximation gives the energy loss which grows logarithmically with quark
energy contrary to the energy independent prediction of the leading log
approximation.
","[{""version"":""v1"",""created"":""Thu, 28 Dec 2000 15:11:30 GMT""}]","2009-10-31"
"hep-th/0012246","Youm Donam","Donam Youm","Cosmology of Dilatonic Brane World","11 pages, LaTeX, references added","Mod.Phys.Lett. A16 (2001) 937-946","10.1142/S0217732301004169","IC/2000/189","hep-th astro-ph gr-qc hep-ph",,"  We study cosmological solutions in the dilatonic brane world models. The
effective four-dimensional equations on the brane are analyzed for the models
with one positive tension brane and two branes with tensions of opposite signs.
Just as in the non-dilatonic brane case, the conventional Friedmann equations
of the four-dimensional universe are reproduced to the leading order in matter
energy density for the model with one brane and the introduction of a radion
potential is required in order to reproduce the Friedmann equations with the
correct sign for the model with two branes.
","[{""version"":""v1"",""created"":""Wed, 27 Dec 2000 16:13:15 GMT""},{""version"":""v2"",""created"":""Mon, 8 Jan 2001 13:17:31 GMT""}]","2009-10-31"
"hep-th/0012247",,"Seungjoon Hyun, Hyeonjoon Shin","Supersymmetry of Green-Schwarz Superstring and Matrix String Theory","28 pages, latex2e, no figures; v2: references added","Phys.Rev. D64 (2001) 046008","10.1103/PhysRevD.64.046008","KIAS-P00079","hep-th",,"  We study the dynamics of Green-Schwarz superstring on the gravitational wave
background corresponding to the Matrix string theory and the supersymmetry
transformation rules of the superstring. The dynamics is obtained in the
light-cone formulation and is shown to agree with that derived from the Matrix
string theory. The supersymmetry structure has the corrections due to the
effect of the background and is identified with that of the low energy one-loop
effective action of Matrix string theory in two superstring background in the
weak string coupling limit.
","[{""version"":""v1"",""created"":""Wed, 27 Dec 2000 16:18:54 GMT""},{""version"":""v2"",""created"":""Fri, 5 Jan 2001 07:04:12 GMT""}]","2009-10-31"
"hep-th/0012248","Alberto Zaffaroni","R. Rattazzi and A. Zaffaroni","Comments on the Holographic Picture of the Randall-Sundrum Model","misprints corrected, references added","JHEP 0104:021,2001","10.1088/1126-6708/2001/04/021",,"hep-th hep-ph",,"  We discuss some issues about the holographic interpretation of the compact
Randall-Sundrum model, which is conjectured to be dual to a 4d field theory
with non-linearly realized conformal symmetry. We make several checks of this
conjecture. In particular, we show that the radion couples conformally to a
background 4d metric. We also discuss the interpretation of the Goldberger-Wise
mechanism for stabilizing the radion. We consider situations where the
electroweak breaking stabilizes the radion and we discuss the issue of natural
conservation of flavor quantum numbers.
","[{""version"":""v1"",""created"":""Wed, 27 Dec 2000 17:19:38 GMT""},{""version"":""v2"",""created"":""Tue, 6 Feb 2001 17:27:30 GMT""}]","2010-02-03"
"hep-th/0012249","Michael Duff","M. J. Duff","State of the Unification Address","16 pages, Latex. Plenary talk delivered at The Division of Particles
  and Fields Meeting of The American Physical Society, August 9-12 2000, Ohio
  State University. Minor corrections and references added","Int.J.Mod.Phys. A16S1A (2001) 77-91","10.1142/S0217751X01006322","MCTP-00-01","hep-th gr-qc hep-ph",,"  After reviewing how M-theory subsumes string theory, I report on some new and
interesting developments, focusing on the ``brane-world'': circumventing no-go
theorems for supersymmetric brane-worlds, complementarity of the Maldacena and
Randall-Sundrum pictures; self-tuning of the cosmological constant. I conclude
with the top ten unsolved problems.
","[{""version"":""v1"",""created"":""Wed, 27 Dec 2000 18:04:14 GMT""},{""version"":""v2"",""created"":""Mon, 5 Feb 2001 19:33:18 GMT""}]","2009-10-31"
"hep-th/0012250","Arkady Vainshtein","A. Vainshtein and A. Yung","Type I Superconductivity upon Monopole Condensation in Seiberg-Witten
  Theory","LaTex, 25 pages. Minor changes. To be published in NPB","Nucl.Phys.B614:3-25,2001","10.1016/S0550-3213(01)00394-7","TPI-MINN-00/25, UMN-TH-1905/00, PNPI-TH-2396/00, ITEP-TH-85/00","hep-th hep-ph",,"  We study the confinement scenario in N=2 supersymmetric SU(2) gauge theory
near the monopole point upon breaking of N=2 supersymmetry by the adjoint
matter mass term. We confirm claims made previously that the
Abrikosov-Nielsen-Olesen string near the monopole point fails to be a BPS state
once next-to-leading corrections in the adjoint mass parameter taken into
account. Our results shows that type I superconductivity arises upon monopole
condensation. This conclusion allows us to make qualitative predictions on the
structure of the hadron mass spectrum near the monopole point.
","[{""version"":""v1"",""created"":""Wed, 27 Dec 2000 18:33:51 GMT""},{""version"":""v2"",""created"":""Sat, 15 Sep 2001 02:29:17 GMT""}]","2010-05-27"
"hep-th/0012251","Barton Zwiebach","Leonardo Rastelli, Ashoke Sen, and Barton Zwiebach","String Field Theory Around the Tachyon Vacuum","36 pages, 3 figures, LaTeX","Adv.Theor.Math.Phys.5:353-392,2002",,"CTP-MIT-3064, PUPT-1972,MRI-P-001201","hep-th",,"  Assuming that around the tachyon vacuum the kinetic term of cubic open string
field theory is made purely of ghost operators we are led to gauge invariant
actions which manifestly implement the absence of open string dynamics around
this vacuum. We test this proposal by showing the existence of lump solutions
of arbitrary codimension in this string field theory. The key ingredients in
this analysis are certain assumptions about the analyticity properties of
tachyon Green's functions. With the help of some further assumptions about the
properties of these Green's functions, we also calculate the ratios of tensions
of lump solutions of different dimensions. The result is in perfect agreement
with the known answers for the ratios of tensions of D-branes of different
dimensions.
","[{""version"":""v1"",""created"":""Wed, 27 Dec 2000 22:35:26 GMT""}]","2009-09-15"
"hep-th/0012252","Zelnikov Andrei","V. Frolov and A. Zelnikov","Non-Minimally Coupled Massive Scalar Field in a 2D Black Hole: Exactly
  Solvable Model","18 pages, 3 figures","Phys.Rev. D63 (2001) 125026","10.1103/PhysRevD.63.125026","Alberta-Thy-14-00","hep-th",,"  We study a nonminimal massive scalar field in a 2-dimensional black hole
spacetime. We consider the black hole which is the solution of the 2d dilaton
gravity derived from string-theoretical models. We found an explicit solution
in a closed form for all modes and the Green function of the scalar field with
an arbitrary mass and a nonminimal coupling to the curvature. Greybody factors,
the Hawking radiation, and $ < \phi^2 >^{ren} $ are calculated explicitly for
this exactly solvable model.
","[{""version"":""v1"",""created"":""Thu, 28 Dec 2000 01:03:57 GMT""}]","2009-10-31"
"hep-th/0012254","Yosuke Imamura","Yosuke Imamura","A D2-brane realization of Maxwell-Chern-Simons-Higgs systems","11 pages, 2 figures, LaTeX, reference added","JHEP 0102:035,2001","10.1088/1126-6708/2001/02/035","UT-920","hep-th",,"  We show that N=2 supersymmetric Maxwell-Chern-Simons-Higgs systems in three
dimension can be realized as gauge theories on a D2-brane in D8-branes
background with a non-zero B-field. We reproduce a potential of Coulomb branch
of the Chern-Simons theory as a potential of a D2-brane in a classical D8-brane
solution and show that each Coulomb vacuum is realized by a D2-brane stabilized
in the bulk at a certain distance from D8-branes.
","[{""version"":""v1"",""created"":""Thu, 28 Dec 2000 06:45:13 GMT""},{""version"":""v2"",""created"":""Fri, 5 Jan 2001 02:58:34 GMT""},{""version"":""v3"",""created"":""Tue, 3 Apr 2001 03:29:23 GMT""}]","2010-02-03"
"hep-th/0012255","Shoichi Ichinose","Shoichi Ichinose","Pole Solution in Six Dimensions and Mass Hierarchy","34 pages, 11 figures, a new section (sec.4) is added",,,"US-00-11","hep-th hep-ph",,"  A solution of the 6D gravitational model, which has the pole configuration,
is found. The vacuum setting is done by the 6D Higgs potential and the solution
is for a family of the vacuum and boundary parameters. The boundary condition
is solved by the $1/k^2$-expansion (thin pole expansion) where $1/k$ is the
{\it thickness} of the pole. The obtained analytic solution is checked by the
numerical method. This is a dimensional reduction model from 6D to 4D by use of
the soliton solution (brane world). It is regarded as a higher dimensional
version of the Randall-Sundrum 5D model. The mass hierarchy is examined.
Especially the {\it geometrical see-saw} mass relation is obtained. Some
physical quantities in 4D world such as the Planck mass, the cosmological
constant, and fermion masses are focussed. Comparison with the 5D model is
made.
","[{""version"":""v1"",""created"":""Thu, 28 Dec 2000 07:32:06 GMT""},{""version"":""v2"",""created"":""Sun, 25 Mar 2001 18:17:15 GMT""},{""version"":""v3"",""created"":""Mon, 17 Sep 2001 05:55:37 GMT""}]","2007-05-23"
"hep-th/0012256","Zhukovsk","V. Ch. Zhukovsky, K. G. Klimenko, V. V. Khudyakov, and D. Ebert","Magnetic catalysis of parity breaking in a massive Gross-Neveu model and
  high-temperature superconductivity","LaTeX 2.09, 8 pages, 2 eps figures","JETP Lett. 73 (2001) 121-125; Pisma Zh.Eksp.Teor.Fiz. 73 (2001)
  137-142","10.1134/1.1364538","Preprint IFVE 2000-62","hep-th cond-mat hep-ph",,"  In the framework of a (2+1)-dimensional P-even massive Gross-Neveu model, an
external magnetic field is shown to induce a parity breaking first order phase
transition. Possibility of applying the results obtained to description of
magnetic phase transitions in high-temperature superconductors is discussed.
","[{""version"":""v1"",""created"":""Thu, 28 Dec 2000 12:17:19 GMT""},{""version"":""v2"",""created"":""Thu, 25 Jan 2001 12:55:27 GMT""}]","2009-10-31"
"hep-th/0012257","Bratchikov","A.V.Bratchikov","Operator quantization of constrained WZNW theories and coset
  constructions","7 pages,Latex,misprints corrected.Published version","Mod.Phys.Lett. V16 (2001) 1139-1145","10.1142/S0217732301004340",,"hep-th math.QA",,"  Using two WZNW theories for Lie algebras $g$ and $h, h\subset g,$ we
construct the associative quotient algebra which includes a class of $g/h$
coset primary fields and currents.
","[{""version"":""v1"",""created"":""Thu, 28 Dec 2000 13:54:31 GMT""},{""version"":""v2"",""created"":""Fri, 9 Feb 2001 14:54:51 GMT""},{""version"":""v3"",""created"":""Fri, 29 Mar 2002 11:04:21 GMT""},{""version"":""v4"",""created"":""Fri, 12 Apr 2002 09:36:12 GMT""}]","2009-10-31"
"math-ph/0012046","Trifonov A.","V.V. Belov (Moscow Institute of Electronics and Mathematics), A.Yu.
  Trifonov(Tomsk Polytechnic University) and A.V. Shapovalov(Tomsk State
  University)","The Trajectory-Coherent Approximation and the System of Moments for the
  Hartree-Type Equation","36 pages, LaTeX-2e","Int. J. Math. and Math. Scien. (2002), Vol 32, N 6, P. 325-370","10.1155/S0161171202112142",,"math-ph math.MP",,"  The general construction of quasi-classically concentrated solutions to the
Hartree-type equation, based on the complex WKB-Maslov method, is presented.
The formal solutions of the Cauchy problem for this equation, asymptotic in
small parameter \h (\h\to0), are constructed with a power accuracy of
O(\h^{N/2}), where N is any natural number. In constructing the
quasi-classically concentrated solutions, a set of Hamilton-Ehrenfest equations
(equations for middle or centered moments) is essentially used. The nonlinear
superposition principle has been formulated for the class of quasi-classically
concentrated solutions of the Hartree-type equations. The results obtained are
exemplified by the one-dimensional equation Hartree-type with a Gaussian
potential.Comments: 6 pages, 4 figures, LaTeX Report no: Subj-class:
Accelerator Physics
","[{""version"":""v1"",""created"":""Thu, 28 Dec 2000 10:45:38 GMT""}]","2016-09-07"
"math-ph/0012047","Heiner Kohler","Th. Guhr, H. Kohler (MPIK Heidelberg)","Recursive Construction for a Class of Radial Functions II - Superspace","27 pages, submitted to Comm. Math. Phys",,,,"math-ph math.MP",,"  We extend the recursion formula for matrix Bessel functions, which we
obtained previously, to superspace. It is sufficient to do this for the unitary
orthosymplectic supergroup. By direct computations, we show that fairly
explicit results can be obtained, at least up to dimension $8\times 8$ for the
supermatrices. Since we introduce a new technique, we discuss various of its
aspects in some detail.
","[{""version"":""v1"",""created"":""Thu, 28 Dec 2000 13:28:56 GMT""}]","2007-05-23"
"math/0012253","Sergey A. Kukushkin","P. A. Gustomesov","An arithmetic function of two variables",,,,,"math.NT",,"  The arithmetic function of two variables is defined. Some properties of the
function are given along with the formula that is an analog of the so-called
Mobius' inversion formula. A heuristic statement is suggested.
","[{""version"":""v1"",""created"":""Wed, 27 Dec 2000 16:22:46 GMT""}]","2007-05-23"
"math/0012254","Atanas Stefanov","Atanas Stefanov, Gregory Verchota","Optimal solvability for the Dirichlet and Neumann problem in dimension
  two",,,,,"math.CA",,"  We show existence and uniqueness for the solutions of the regularity and the
Neumann problems for harmonic functions on Lipschitz domains with data in the
Hardy spaces H^p, p>2/3, where This in turn implies that solutions to the
Dirichlet problem with data in the Holder class C^{1/2}(\partial D) are
themselves in C^{1/2}(D). Both of these results are sharp. In fact, we prove a
more general statement regarding the H^p solvability for divergence form
elliptic equations with bounded measurable coefficients.
  We also prove similar solvability result for the regularity and Dirichlet
problem for the biharmonic equation on Lipschitz domains.
","[{""version"":""v1"",""created"":""Wed, 27 Dec 2000 17:43:35 GMT""}]","2007-05-23"
"math/0012255","Dennis Gaitsgory","E.Frenkel, D.Gaitsgory and K.Vilonen","On the geometric Langlands conjecture",,,,,"math.AG",,"  Let X be a smooth, complete, geometrically connected curve over a field of
characteristic p. The geometric Langlands conjecture states that to each
irreducible rank n local system E on X one can attach a perverse sheaf on the
moduli stack of rank n bundles on X (irreducible on each connected component),
which is a Hecke eigensheaf with respect to E. In this paper we derive the
geometric Langlands conjecture from a certain vanishing conjecture.
Furthermore, using recent results of Lafforgue, we prove this vanishing
conjecture, and hence the geometric Langlands conjecture, in the case when the
ground field is finite.
","[{""version"":""v1"",""created"":""Wed, 27 Dec 2000 19:36:18 GMT""},{""version"":""v2"",""created"":""Thu, 15 Feb 2001 00:16:30 GMT""},{""version"":""v3"",""created"":""Wed, 17 Oct 2001 01:10:37 GMT""}]","2007-05-23"
"math/0012256","Oganes Khudaverdian","Hovhannes Khudaverdian","Semidensities on Odd Symplectic Supermanifolds","Plain-TeX, 44 pages",,,,"math.DG math-ph math.MP",,"  We consider semidensities on a supermanifold E with an odd symplectic
structure. We define a new $\Delta$-operator action on semidensities as the
proper framework for Batalin-Vilkovisky formalism. We establish relations
between semidensities on E and differential forms on Lagrangian surfaces. We
apply these results to Batalin-Vilkovisky geometry. Another application is to
(1.1)-codimensional surfaces in E. We construct a kind of pull-back of
semidensities to such surfaces. This operation and the $\Delta$-operator are
used for obtaining integral invariants for (1.1)-codimensional surfaces.
","[{""version"":""v1"",""created"":""Wed, 27 Dec 2000 20:56:52 GMT""}]","2007-05-23"
"math/0012257","Mutsumi Saito","Mutsumi Saito","Logarithm-free A-hypergeometric series","20 pages, 2 figures, LaTeX2e",,,,"math.AG math.AC",,"  We give a dimension formula for the space of logarithm-free series solutions
to an A-hypergeometric (or a GKZ hypergeometric) system. In the case where the
convex hull spanned by A is a simplex, we give a rank formula for the system,
characterize the exceptional set, and prove the equivalence of the
Cohen-Macaulayness of the toric variety defined by A with the emptiness of the
exceptional set. Furthermore we classify A-hypergeometric systems as analytic
D-modules.
","[{""version"":""v1"",""created"":""Thu, 28 Dec 2000 04:29:27 GMT""}]","2007-05-23"
"nlin/0012061","Robert M. Kerr","Robert M. Kerr","The energy budget in Rayleigh-Benard convection","5 pages, 3 figures, new version 13 Mar, 2001",,"10.1103/PhysRevLett.87.244502",,"nlin.CD",,"  It is shown using three series of Rayleigh number simulations of varying
aspect ratio AR and Prandtl number Pr that the normalized dissipation at the
wall, while significantly greater than 1, approaches a constant dependent upon
AR and Pr. It is also found that the peak velocity, not the mean square
velocity, obeys the experimental scaling of Ra^{0.5}. The scaling of the mean
square velocity is closer to Ra^{0.46}, which is shown to be consistent with
experimental measurements and the numerical results for the scaling of Nu and
the temperature if there are strong correlations between the velocity and
temperature.
","[{""version"":""v1"",""created"":""Thu, 28 Dec 2000 03:09:00 GMT""},{""version"":""v2"",""created"":""Tue, 13 Mar 2001 23:25:08 GMT""},{""version"":""v3"",""created"":""Fri, 18 May 2001 00:47:48 GMT""}]","2009-10-31"
"nlin/0012062","Shiro Kawbata","Shiro Kawabata (ETL, Japan)","Anomalous Diffusion and Quantum Interference Effect in Nano-scale
  Periodic Lorentz Gas","3 pages","`Statistical Physics'', M. Tokuyama & I. Oppenheim (Eds.), p. 228
  (World Scientific, 1998)",,,"nlin.CD cond-mat.mes-hall",,"  Recent advances in submicrometer technology have made it possible to confine
the two-dimensional electron gas into high-mobility semi-conductor
heterostructures. Such structure with a lattice of electron-depleted circular
obstacles are called quantum antidot lattices, or quantum Lorentz gas systems.
By using the semiclassical scattering theory, we show that quantum interference
in finite-size open Lorentz gas systems is expected to reflect the difference
between normal and anomalous diffusions, i.e., L\'evy flights.
","[{""version"":""v1"",""created"":""Thu, 28 Dec 2000 03:23:02 GMT""}]","2007-05-23"
"nlin/0012063","Kenji Kajiwara","Kenji Kajiwara, Masatoshi Noumi, Yasuhiko Yamada","A study on the fourth q-Painlev\'e equation","18 pages",,"10.1088/0305-4470/34/41/312",,"nlin.SI math.QA",,"  A q-difference analogue of the fourth Painlev\'e equation is proposed. Its
symmetry structure and some particular solutions are investigated.
","[{""version"":""v1"",""created"":""Thu, 28 Dec 2000 06:55:45 GMT""}]","2019-08-17"
"nlin/0012064","Magnus Johansson","Magnus Johansson (Laboratoire Leon Brillouin, CEA-Saclay, France)","Decay of DNLS breathers through inelastic multiphonon scattering","4 pages, 1 figure, to be published in Physical Review E","Phys. Rev. E 63, 037601 (2001)","10.1103/PhysRevE.63.037601",,"nlin.PS cond-mat nlin.CD physics.optics",,"  We consider the long-time evolution of weakly perturbed discrete nonlinear
Schroedinger breathers. While breather growth can occur through nonlinear
interaction with one single initial linear mode, breather decay is found to
require excitation of at least two independent modes. All growth and decay
processes of lowest order are found to disappear for breathers larger than a
threshold value.
","[{""version"":""v1"",""created"":""Thu, 28 Dec 2000 13:52:55 GMT""}]","2009-10-31"
"nucl-th/0012093","Carsten Greiner","Carsten Greiner","Signatures of the quark gluon plasma: a personal overview","10 pages, 5 figures, uses ws-p8-50x6_00.cls style file, contribution
  for the proceedings of `Luederitz 2000: Fundamental and Applied Aspects of
  Modern Physics', November 2000, Luederitz, Namibia",,"10.1142/9789812810175_0031",,"nucl-th",,"  We first discuss, on a no-QGP basis, the two prominent indications of (a)
enhanced strangeness production and of (b) anomalous $J/\psi $-suppression: We
elaborate in particular on a recent idea of antihyperon production solely by
multi-mesonic reactions. As a possible source for an enhanced dissociation of
$c \bar{c}$ pairs we summarize the findings within the 'early'-comover
absorption scenario of prehadronic string excitations. As an exotic candidate
we then finally adress the stochastic formation of so called disoriented chiral
condensates: An experimentally feasible DCC, if it does exist, has to be a rare
event following an unusual and nontrivial distribution on an event by event
basis.
","[{""version"":""v1"",""created"":""Thu, 28 Dec 2000 09:59:27 GMT""}]","2017-08-23"
"quant-ph/0012144","Larry Ford","Chun-Hsien Wu and L. H. Ford","Quantum Fluctuations of Radiation Pressure","23 pages, 3 figures, RevTex","Phys.Rev. D64 (2001) 045010","10.1103/PhysRevD.64.045010",,"quant-ph gr-qc hep-th",,"  Quantum fluctuations of electromagnetic radiation pressure are discussed. We
use an approach based on the quantum stress tensor to calculate the
fluctuations in velocity and position of a mirror subjected to electromagnetic
radiation. Our approach reveals that radiation pressure fluctuations are due to
a cross term between vacuum and state dependent terms in a stress tensor
operator product. Thus observation of these fluctuations would entail
experimental confirmation of this cross term. We first analyze the pressure
fluctuations on a single, perfectly reflecting mirror, and then study the case
of an interferometer. This involves a study of the effects of multiple bounces
in one arm, as well as the correlations of the pressure fluctuations between
arms of the interferometer. In all cases, our results are consistent with those
previously obtained by Caves using different mehods.
","[{""version"":""v1"",""created"":""Wed, 27 Dec 2000 22:47:16 GMT""}]","2009-11-06"
"quant-ph/0012145","Xiaodong Xu","Mingjun Shi, Jiangfeng Du","Remarks on Lewenstein-Sanpera Decomposition",,,"10.1016/S0375-9601(01)00350-4",,"quant-ph",,"  We discuss in this letter Lewenstein-Sanpera (L-S) decomposition for a
specific Werner state. Compared with the optimal case, we propose a
quasi-optimal one which in the view of concurrence leads to the same
entanglement measure for the entangled mixed state discussed. We think that in
order to obtain entanglement of given state the optimal L-S decomposition is
not necessary.
","[{""version"":""v1"",""created"":""Thu, 28 Dec 2000 11:09:47 GMT""}]","2009-11-06"
