"hep-th/0012270","Naoki Sasakura","Naoki Sasakura (YITP, Kyoto Univ.)","Low-energy propagation modes on string network","LaTeX, 10 pages, 3 figures, a wrong factor corrected","JHEP 0102:033,2001","10.1088/1126-6708/2001/02/033","SU-ITP 00-37, YITP-00-72","hep-th",,"  We study low-energy propagation modes on string network lattice.
Specifically, we consider an infinite two-dimensional regular hexagonal string
network and analyze the low frequency propagation modes on it. The fluctuation
modes tangent to the two-dimensional plane respect the spatial rotational
symmetry on the plane, and are described by Maxwell theory. The gauge symmetry
comes from the marginal deformation of changing the sizes of the loops of the
lattice. The effective Lorentz symmetry respected at low energy will be
violated at high energy.
","[{""version"":""v1"",""created"":""Fri, 29 Dec 2000 23:58:41 GMT""},{""version"":""v2"",""created"":""Tue, 9 Jan 2001 20:09:26 GMT""},{""version"":""v3"",""created"":""Fri, 9 Feb 2001 19:37:26 GMT""}]","2010-02-03"
"hep-th/0101001","Zachary Guralnik","Z. Guralnik and S. Ramgoolam","On the Polarization of Unstable D0-Branes into Non-Commutative Odd
  Spheres","18 pages, Tex","JHEP 0102:032,2001","10.1088/1126-6708/2001/02/032","CTP-MIT-3069, Brown Het-1251","hep-th",,"  We consider the polarization of unstable type IIB D0-branes in the presence
of a background five-form field strength. This phenomenon is studied from the
point of view of the leading terms in the non-abelian Born Infeld action of the
unstable D0-branes. The equations have SO(4) invariant solutions describing a
non-commutative 3-sphere, which becomes a classical 3-sphere in the large N
limit. We discuss the interpretation of these solutions as spherical D3-branes.
The tachyon plays a tantalizingly geometrical role in relating the fuzzy S^3
geometry to that of a fuzzy S^4.
","[{""version"":""v1"",""created"":""Sat, 30 Dec 2000 05:16:43 GMT""}]","2010-02-03"
"hep-th/0101002","Takao Suyama","Takao Suyama","BPS Vortices in Brane-Antibrane Effective Theory","11 pages, 2 figures",,,"OU-HET 375","hep-th",,"  We investigate an action which resembles the effective action of
brane-antibrane system derived from boundary string field theory. We find that
the action has smooth vortex solutions which saturate the Bogomol'nyi bound.
","[{""version"":""v1"",""created"":""Sat, 30 Dec 2000 06:31:00 GMT""}]","2007-05-23"
"hep-th/0101003","Shin'ichi Nojiri","Shin'ichi Nojiri, Octavio Obregon, Sergei D. Odintsov, and Vladimir I.
  Tkach","String versus Einstein frame in an AdS/CFT induced quantum dilatonic
  brane-world universe","LaTeX file, 24 pages, minor changes to match with published version","Phys.Rev.D64:043505,2001","10.1103/PhysRevD.64.043505",,"hep-th",,"  AdS/CFT induced quantum dilatonic brane-world where 4d boundary is flat or de
Sitter (inflationary) or Anti-de Sitter brane is considered. The classical
brane tension is fixed but boundary QFT produces the effective brane tension
via the account of corresponding conformal anomaly induced effective action.
This results in inducing of brane-worlds in accordance with AdS/CFT set-up as
warped compactification. The explicit, independent construction of quantum
induced dilatonic brane-worlds in two frames: string and Einstein one is done.
It is demonstrated their complete equivalency for all quantum cosmological
brane-worlds under discussion, including several examples of classical
brane-world black holes. This is different from quantum corrected 4d dilatonic
gravity where de Sitter solution exists in Einstein but not in Jordan (string)
frame. The role of quantum corrections on massive graviton perturbations around
Anti-de Sitter brane is briefly discussed.
","[{""version"":""v1"",""created"":""Sat, 30 Dec 2000 08:19:22 GMT""},{""version"":""v2"",""created"":""Wed, 9 May 2001 23:45:58 GMT""}]","2009-09-17"
"hep-th/0101004","German Sharov","E. G. Vorontsova, G. S. Sharov","Black Hole Horizon in Superstring Inspired D-Dimensional Dilaton Gravity","5 pages, LaTeX, 1 gif figure. Talk given at XVth International
  Workshop QFTHEP'2000 Tver, Russia, 14-20 September 2000",,,"TSU-00-40","hep-th",,"  In $D$-dimensional dilaton gravitational model stationary Schwarzschild type
solutions (centrally symmetrical solutions in vacuum) are obtained. They
contain the two-parameter set of solutions: the first parameter is proportional
to a central mass and the second one describes intensity of the dilaton field.
If the latter parameter equals zero we have pure Schwarzschild solution with
the black hole and constant dilaton field. But when the mentioned parameter is
non-zero and the dilaton is non-constant, the black hole horizon vanishes.
","[{""version"":""v1"",""created"":""Sat, 30 Dec 2000 08:49:16 GMT""}]","2007-05-23"
"math/0012266","Dmitrii V. Pasechnik","A.A. Ivanov, D.V. Pasechnik and S.V. Shpectorov","Extended F_4-buildings and the Baby Monster","to appear in Inventiones Mathematicae","Invent. Math. 144(2001) 399-433","10.1007/PL00005804","00P/003","math.GR math.CO",,"  The Baby Monster group B acts naturally on a geometry E(B) with diagram
c.F_4(t) for t=4 and the action of B on E(B) is flag-transitive. It possesses
the following properties:
  (a) any two elements of type 1 are incident to at most one common element of
type 2, and
  (b) three elements of type 1 are pairwise incident to common elements of type
2 iff they are incident to a common element of type 5.
  It is shown that E(B) is the only (non-necessary flag-transitive)
c.F_4(t)-geometry, satisfying t=4, (a) and (b), thus obtaining the first
characterization of B in terms of an incidence geometry, similar in vein to one
known for classical groups acting on buildings. Further, it is shown that E(B)
contains subgeometries E(^2E_6(2)) and E(Fi22) with diagrams c.F_4(2) and
c.F_4(1). The stabilizers of these subgeometries induce on them flag-transitive
actions of ^2E_6(2):2 and Fi22:2, respectively. Three further examples for t=2
with flag-transitive automorphism groups are constructed. A complete list of
possibilities for the isomorphism type of the subgraph induced by the common
neighbours of a pair of vertices at distance 2 in an arbitrary c.F_4(t)
satisfying (a) and (b) is obtained.
","[{""version"":""v1"",""created"":""Fri, 29 Dec 2000 16:16:36 GMT""}]","2009-10-31"
"math/0012267","Nils Berglund","Nils Berglund and Barbara Gentz","A sample-paths approach to noise-induced synchronization: Stochastic
  resonance in a double-well potential","46 pages, 5 figures","Ann. Appl. Probab. 12:1419-1470 (2002)","10.1214/aoap/1037125869",,"math.PR math-ph math.MP nlin.CD",,"  Additive white noise may significantly increase the response of bistable
systems to a periodic driving signal. We consider two classes of double-well
potentials, symmetric and asymmetric, modulated periodically in time with
period $1/\eps$, where $\eps$ is a moderately (not exponentially) small
parameter. We show that the response of the system changes drastically when the
noise intensity $\sigma$ crosses a threshold value. Below the threshold, paths
are concentrated near one potential well, and have an exponentially small
probability to jump to the other well. Above the threshold, transitions between
the wells occur with probability exponentially close to 1/2 in the symmetric
case, and exponentially close to 1 in the asymmetric case. The transition zones
are localised in time near the points of minimal barrier height. We give a
mathematically rigorous description of the behaviour of individual paths, which
allows us, in particular, to determine the power-law dependence of the critical
noise intensity on $\eps$ and on the minimal barrier height, as well as the
asymptotics of the transition and non-transition probabilities.
","[{""version"":""v1"",""created"":""Fri, 29 Dec 2000 17:35:28 GMT""}]","2007-05-23"
"math/0012268","Andrei Sobolevskii","Grigori Litvinov, Victor Maslov, Grigori Shpiz","Linear functionals on idempotent spaces: an algebraic approach","6 pages, no figures","Doklady Mathematics 58:3 (1998) 389-391",,,"math.FA",,"  In this paper, we present an algebraic approach to idempotent functional
analysis, which is an abstract version of idempotent analysis. The basic
concepts and results are expressed in purely algebraic terms. We consider
idempotent versions of certain basic results of linear functional analysis,
including the theorem on the general form of a linear functional and the
Hahn-Banach and Riesz-Fischer theorems.
","[{""version"":""v1"",""created"":""Fri, 29 Dec 2000 20:22:49 GMT""}]","2007-05-23"
"math/0101001","Jinqiao Duan","Jinqiao Duan and Bjorn Schmalfuss","The 3D Quasigeostrophic Fluid Dynamics under Random Forcing on Boundary",,,,,"math.AP math-ph math.DS math.MP math.PR physics.ao-ph physics.data-an physics.flu-dyn physics.geo-ph",,"  The three-dimensional baroclinic quasigeostrophic flow model has been widely
used to study basic mechanisms in oceanic flows and climate dynamics. In this
paper, we consider this flow model under random wind forcing and time-periodic
fluctuations on fluid boundary (the interface between the oceans and the
atmosphere). The time-periodic fluctuations are due to periodic rotation of the
earth and thus periodic exposure of the earth to the solar radiation. After
establishing the well-posedness of the baroclinic quasigeostrophic flow model
in the state space, we demonstrate the existence of the random attractors,
again in the state space. We also discuss the relevance of our result to
climate modeling.
","[{""version"":""v1"",""created"":""Sat, 30 Dec 2000 00:12:21 GMT""}]","2016-09-07"
"math/0101002","Nicolau C. Saldanha","Nicolau C. Saldanha","Singular polynomials of generalized Kasteleyn matrices","15 pages, 4 figures","Journal of Algebraic Combinatorics, 16(2): 195-207; Sep 2002",,,"math.CO",,"  Kasteleyn counted the number of domino tilings of a rectangle by considering
a mutation of the adjacency matrix: a Kasteleyn matrix K. In this paper we
present a generalization of Kasteleyn matrices and a combinatorial
interpretation for the coefficients of the characteristic polynomial of KK^\ast
(which we call the singular polynomial), where K is a generalized Kasteleyn
matrix for a planar bipartite graph. We also present a q-version of these ideas
and a few results concerning tilings of special regions such as rectangles.
","[{""version"":""v1"",""created"":""Sat, 30 Dec 2000 14:01:53 GMT""}]","2007-05-23"
"nlin/0012067","Prot Pakonski","Prot Pakonski (Cracow), Jakub Zakrzewski (Cracow)","Kepler Map for H atom driven by microwaves with arbitrary polarization","LaTeX 12 pages, 7 figures included, published version","Acta Phys. Pol. B 32 (2001) 2801-2812",,,"nlin.CD",,"  Dynamics of hydrogen atom driven by microwave field of arbitrary polarization
is approximated by the discrete mapping. The map describes the change of
dynamical variables from an aphelion or a perihelion to the next one. The
results are compared with numerical simulation and previous approximations.
","[{""version"":""v1"",""created"":""Fri, 29 Dec 2000 16:16:50 GMT""},{""version"":""v2"",""created"":""Thu, 25 Oct 2001 08:40:40 GMT""}]","2007-05-23"
"nucl-th/0101001","Heui-Seol Roh","Heui-Seol Roh","Quantum Nucleardynamics as an SU(2)_N x U(1)_Z Gauge Theory","REVTeX, 18 pages, 1 postscript figure",,,,"nucl-th hep-ph",,"  It is illustrated that quantum nucleardynamics (QND) as an SU(2)_N x U(1)_Z
gauge theory, which is generated from quantum chromodynamics (QCD) as an
SU(3)_C gauge theory through dynamical spontaneous symmetry breaking,
successfully describes nuclear phenomena at low energies. The proton and
neutron assigned as a strong isospin doublet are identified as a colorspin plus
weak isospin doublet. Massive gluon mediates strong interactions with the
effective coupling constant G_R/\sqrt{2} = g_n^2/8 M_G^2 \simeq 10 GeV^{-2}
just like Fermi weak constant G_F/\sqrt{2} = g_w^2/8 M_W^2 \simeq 10^{-5}
GeV^{-2} in the Glashow-Weinberg-Salam model where g_n and g_w are the coupling
constants and M_G and M_W are the gauge boson masses. Several explicit
evidences such as cross sections, lifetimes, nucleon-nucleon scattering,
magnetic dipole moment, nuclear potential, gamma decay, etc. are shown in
support of QND. The baryon number conservation is the consequence of the U(1)_Z
gauge theory and the proton number conservation is the consequence of the
U(1)_f gauge theory.
","[{""version"":""v1"",""created"":""Sat, 30 Dec 2000 02:50:25 GMT""}]","2007-05-23"
"physics/0101001","Stefan Hobai","St. Hobai, Zita Fazakas","Determination of some solubilization parameters with surfactants of
  egg-yolk lecithin multilamellar vesicles by static light-scattering
  measurements","30 pages, 20 figures, 19 tables",,,,"physics.chem-ph",,"  Effective surfactant:phospholipid ratios (i.e. molar ratios in the mixed
aggregates, vesicles or micelles) have been determined by static
light-scattering for the interaction of egg-yolk lecithin (EYL) multilamellar
vesicles (MLV) with Triton X-100 (TX-100), sodium deoxycholate (DOCNa) and
cetyltrimethylammonium bromide (CTMB). The suspension of MLV-EYL was mixed with
appropriate volumes of surfactant solution and was left overnight to reaches
thermodynamic equilibrium. Rectan-gular optic diffusion data were used to
compute the solubilization parameters: total surfactant concentrations, at
saturation and solubilization Dtsat and Dtsol respectively, and effective molar
ratios, Resat and Resol respectively. From the Resat value ob-tained
graphically for interaction of vesicles with TX-100 resulted that in vesicle
bilayers a surfactant molecule is surrounded with seven phospholipid molecules
and the Resol value suggests that in mixed micelles ten lipid molecules with
about fifteen surfactant molecules coexist. The values of Resat and Resol in
case of MLV solubilization with DOCNa are 0.07 and 1.1 re-spectively. In case
of vesicles solubilization with CTMB, Resat =0.25 and Resol =3.6 These data
show that the solubilization power at thermodynamic equilibrium for the three
surfactants is in the sequence: CTMB<TX-100<DOCNa.
","[{""version"":""v1"",""created"":""Sat, 30 Dec 2000 11:30:05 GMT""}]","2007-05-23"
"physics/0101002","Gafiychuk","I. A. Lubashevsky, V. V. Gafiychuk and A. V. Priezzhev","Laser Induced Heat Diffusion Limited Tissue Coagulation: Problem and
  General Properties",,,,,"physics.med-ph physics.comp-ph q-bio",,"  Previously we have developed a free boundary model for local thermal
coagulation induced by laser light absorption when the tissue region affected
directly by laser light is sufficiently small and heat diffusion into the
surrounding tissue governs the necrosis growth. In the present paper surveying
the obtained results we state the point of view on the necrosis formation under
these conditions as the basis of an individual laser therapy mode exhibiting
specific properties. In particular, roughly speaking, the size of the resulting
necrosis domain is determined by the physical characteristics of the tissue and
its response to local heating, and by the applicator form rather than the
treatment duration and the irradiation power.
","[{""version"":""v1"",""created"":""Sat, 30 Dec 2000 15:50:01 GMT""}]","2007-05-23"
"quant-ph/0012150","Jiangbin Gong","Jiangbin Gong and Paul Brumer","Coherent Control of Quantum Chaotic Diffusion","4 pages, 4 figures, to appear in Phys. Rev. Lett","Phys. Rev. Lett. 86, 1741 (2001)","10.1103/PhysRevLett.86.1741",,"quant-ph nlin.CD",,"  Extensive coherent control over quantum chaotic diffusion using the kicked
rotor model is demonstrated and its origin in deviations from random matrix
theory is identified. Further, the extent of control in the presence of
external decoherence is established. The results are relevant to both areas of
quantum chaos and coherent control.
","[{""version"":""v1"",""created"":""Fri, 29 Dec 2000 19:31:52 GMT""}]","2009-11-06"
"quant-ph/0012151","O. B. Zaslavskii","S. N. Dolya and O. B. Zaslavskii","General approach to potentials with two known levels","14 pages, REVTeX 3.0. In v.2 misprints and inaccuracies in
  presentation corrected, discussion of 3-dim. case added. In v.3 misprint in
  eq. 41, several typos and inaccuracies in English corrected. To be published
  in J. of Phys. A: Math. Gen","J.Phys.A34:1981-1990,2001","10.1088/0305-4470/34/10/303",,"quant-ph hep-th math-ph math.MP",,"  We present the general form of potentials with two given energy levels
$E_{1}$, $E_{2}$ and find corresponding wave functions. These entities are
expressed in terms of one function $\xi (x)$ and one parameter $\Delta
E=E_{2}$-$E_{1}$. We show how the quantum numbers of both levels depend on
properties of the function $\xi (x)$. Our approach does not need resorting to
the technique of supersymmetric (SUSY) quantum mechanics but automatically
generates both the potential and superpotential.
","[{""version"":""v1"",""created"":""Fri, 29 Dec 2000 20:05:42 GMT""},{""version"":""v2"",""created"":""Thu, 8 Feb 2001 21:10:56 GMT""},{""version"":""v3"",""created"":""Tue, 20 Feb 2001 09:13:25 GMT""}]","2008-11-26"
