"cond-mat/0012517","J. E. Hirsch","J.E. Hirsch","Consequences of charge imbalance in superconductors within the theory of
  hole superconductivity",,"Phys. Lett. A281, p.44-47 (2001)","10.1016/S0375-9601(01)00101-3",,"cond-mat.supr-con cond-mat.str-el",,"  The theory of hole superconductivity proposes that the fundamental asymmetry
between electrons and holes in solids is responsible for superconductivity.
Here we point out a remarkable consequence of this theory: a tendency for
negative charge to be expelled from the bulk of the superconductor towards the
surface. Experimentally observable consequences of this physics are discussed.
","[{""version"":""v1"",""created"":""Fri, 29 Dec 2000 23:58:10 GMT""}]","2009-10-31"
"cond-mat/0101001","Katarzyna Sznajd-Weron","K. Sznajd-Weron, R. Weron","A simple model of price formation","Version 2: 4 pages, 4 figures; added more stringent statistical
  analysis; to appear in Int. J. Modern Physics C, Vol. 13, No. 1 (2002)","Int. J. Modern Physics C, Vol. 13, No. 1 (2002) 115-123","10.1142/S0129183102003000",,"cond-mat.stat-mech q-fin.ST",,"  A simple Ising spin model which can describe the mechanism of price formation
in financial markets is proposed. In contrast to other agent-based models, the
influence does not flow inward from the surrounding neighbors to the center
site, but spreads outward from the center to the neighbors. The model thus
describes the spread of opinions among traders. It is shown via standard Monte
Carlo simulations that very simple rules lead to dynamics that duplicate those
of asset prices.
","[{""version"":""v1"",""created"":""Sat, 30 Dec 2000 13:04:49 GMT""},{""version"":""v2"",""created"":""Wed, 7 Nov 2001 12:29:30 GMT""}]","2009-11-07"
"gr-qc/0012110","Sascha Husa","Sascha Husa, Manuela Campanelli, Roberto Gomez, Jeffrey Winicour and
  Yosef Zlochower","Colliding black holes from a null point of view: the close limit","2 pages, contribution to the 9th Marcel Grossmann meeting (MG9),
  Rome, July 2000",,,,"gr-qc",,"  We present a characteristic algorithm for computing the perturbations of a
Schwarzschild spacetime by means of solving the Teukolsky equations. Our
methods and results are expected to have direct bearing on the study of binary
black holes presently underway using a fully {\em nonlinear} characteristic
code \cite{Gomez98a}.
","[{""version"":""v1"",""created"":""Fri, 29 Dec 2000 17:23:47 GMT""}]","2007-05-23"
"gr-qc/0012111","Daniel M. Sforza","Daniel M. Sforza","Quantization of Generally Covariant Systems","129 pages, Latex file. PhD Thesis (Spanish version)",,,,"gr-qc",,"  Finite dimensional models that mimic the constraint structure of Einstein's
General Relativity are quantized in the framework of BRST and Dirac's canonical
formalisms. The first system to be studied is one featuring a constraint
quadratic in the momenta (the ""super-Hamiltonian"") and a set of constraints
linear in the momenta (the ""supermomentum"" constraints). The starting point is
to realize that the ghost contributions to the supermomentum constraint
operators can be read in terms of the natural volume induced by the constraints
in the orbits. This volume plays a fundamental role in the construction of the
quadratic sector of the nilpotent BRST charge. It is shown that the quantum
theory is invariant under scaling of the super-Hamiltonian. As long as the
system has an intrinsic time, this property translates in a contribution of the
potential to the kinetic term. In this aspect, the results substantially differ
from other works where the scaling invariance is forced by introducing a
coupling to the curvature. The contribution of the potential, far from being
unnatural, is beautifully justified in the light of the Jacobi's principle.
Then, it is shown that the obtained results can be extended to systems with
extrinsic time. In this case, if the metric has a conformal temporal Killing
vector and the potential exhibits a suitable behavior with respect to it, the
role played by the potential in the case of intrinsic time is now played by the
norm of the Killing vector. Finally, the results for the previous cases are
extended to a system featuring two super-Hamiltonian constraints. This step is
extremely important due to the fact that General Relativity features an
infinite number of such constraints satisfying a non trivial algebra among
themselves.
","[{""version"":""v1"",""created"":""Fri, 29 Dec 2000 18:44:12 GMT""},{""version"":""v2"",""created"":""Mon, 19 Feb 2001 21:28:31 GMT""}]","2007-05-23"
"gr-qc/0012112","David Blaschke","Danilo Behnke, David Blaschke, Victor Pervushin, Denis Proskurin","Conformal Cosmology and Supernova Data","9 pages revtex, 1 figure, Contribution to the Proceedings of the
  workshop ""Quark Matter in Astro- and Particle Physics"", Rostock, Nov 27 - 29,
  2000, Eds: D. Blaschke, G. Burau, S.M. Schmidt",,,"MPG-VT-UR 211/00","gr-qc",,"  We define the cosmological parameters $H_{c,0}$, $\Omega_{m,c}$ and
$\Omega_{\Lambda, c}$ within the Conformal Cosmology as obtained by the
homogeneous approximation to the conformal-invariant generalization of
Einstein's General Relativity theory. We present the definitions of the age of
the universe and of the luminosity distance in the context of this approach. A
possible explanation of the recent data from distant supernovae Ia without a
cosmological constant is presented.
","[{""version"":""v1"",""created"":""Fri, 29 Dec 2000 22:17:43 GMT""}]","2007-05-23"
"gr-qc/0101001","Heui-Seol Roh","Heui-Seol Roh","Toward Quantum Gravity I: Newton Gravitation Constant, Cosmological
  Constant, and Classical Tests","REVTeX, 14 pages",,,,"gr-qc hep-ph",,"  This study toward quantum gravity (QG) introduces an SU(N) gauge theory with
the \Theta vacuum term as a trial theory. Newton gravitation constant G_N is
realized as the effective coupling constant for a massive graviton, G_N
/\sqrt{2} = g_f g_g^2/8 M_G^2 \simeq 10^{-38} GeV^{-2} with the gauge boson
mass M_G = M_{Pl} \simeq 10^{19} GeV, the gravitational coupling constant g_g,
and the gravitational factor g_f. This scheme postulates the effective
cosmological constant as the effective vacuum energy represented by massive
gauge bosons, \Lambda_e = 8 \pi G_N M_G^4, and provides a plausible explanation
for the small cosmological constant at the present epoch \Lambda_0 \simeq
10^{-84} GeV^2 and the large value at the Planck epoch \Lambda_{Pl} \simeq
10^{38} GeV^2; the condensation of the singlet gauge field <\phi> triggers the
current anomaly and subtracts the gauge boson mass, M_G^2 = M_{Pl}^2 - g_f
g_g^2 <\phi>^2 = g_f g_g^2 (A_{0}^2 - <\phi>^2), as the vacuum energy.
Relations among QG, general relativity, and Newtonian mechanics are discussed.
","[{""version"":""v1"",""created"":""Sat, 30 Dec 2000 04:26:29 GMT""}]","2007-05-23"
"gr-qc/0101002","Heui-Seol Roh","Heui-Seol Roh","Toward Quantum Gravity II: Quantum Tests","REVTeX, 22 pages",,,,"gr-qc hep-ph",,"  This study toward quantum gravity (QG) introduces an SU(N) gauge theory with
the \Theta vacuum term for gravitational interactions, which leads to a group
SU(2)_L x U(1)_Y x SU(3)_C for weak and strong interactions through dynamical
spontaneous symmetry breaking (DSSB). Newton gravitation constant G_N and the
effective cosmological constant are realized as the effective coupling constant
and the effective vacuum energy, respectively, due to massive gauge bosons. A
gauge theory relevant for the non-zero gauge bosons, 10^{-12} GeV, and the
massless gauge boson (photon) is predicted as a new dynamics for the universe
expansion: this is supported by the repulsive force, indicated in BUMERANG-98
and MAXIMA-1 experiments, and cosmic microwave background radiation. Under the
constraint of the flat universe, \Omega = 1 - 10^{-61}, the large cosmological
constant in the early universe becomes the source of the exponential expansion
in 10^{30} order as expected in the inflation theory, nearly massless gauge
bosons are regarded as strongly interacting mediators of dark matter, and the
baryon asymmetry is related to the DSSB mechanism.
","[{""version"":""v1"",""created"":""Sat, 30 Dec 2000 05:06:57 GMT""}]","2007-05-23"
"gr-qc/0101003","David Wiltshire","D.L. Wiltshire","An introduction to quantum cosmology","60 pages, harvmac, 11 figures, epsf. These summer school lecture
  notes have been available for 5 years; but are being placed on the archive to
  make them more easily accessible. Published in ""Cosmology: the Physics of the
  Universe"", eds B. Robson, N. Visvanathan and W.S. Woolcock (World Scientific,
  Singapore, 1996) pp 473-531; v2 reference added, typo fixed",,,"ADP-95-11/M28","gr-qc",,"  This is an introductory set of lecture notes on quantum cosmology, given in
1995 to an audience with interests ranging from astronomy to particle physics.
Topics covered: 1. Introduction: 1.1 Quantum cosmology and quantum gravity; 1.2
A brief history of quantum cosmology. 2. Hamiltonian formulation of general
relativity: 2.1 The 3+1 decomposition; 2.2 The action. 3. Quantisation: 3.1
Superspace; 3.2 Canonical quantisation; 3.3 Path integral quantisation; 3.4
Minisuperspace; 3.5 The WKB approximation; 3.6 Probability measures; 3.7
Minisuperspace for the Friedmann universe with massive scalar field. 4.
Boundary Conditions: 4.1 The no-boundary proposal; 4.2 The tunneling proposal.
5. The predictions of quantum cosmology: 5.1 The period of inflation; 5.2 The
origin of density perturbations; 5.3 The arrow of time.
","[{""version"":""v1"",""created"":""Sat, 30 Dec 2000 07:25:47 GMT""},{""version"":""v2"",""created"":""Wed, 3 Sep 2003 07:38:56 GMT""}]","2007-05-23"
"gr-qc/0101004","Victor Berezin","Victor Berezin","Notes on a quantum gravitational collaps","The Ninth Marcel Grossmann Meeting",,,,"gr-qc",,"  Everybody knows what the classical black holes are. In short, this is a
spacetime region beyond the so-called event horizon. The notion of the event
horizon is mathematically well defined. The situation with a definition of
quantum black hole is not so clear. The problem is that the classical event
horizon can be defined only globally, i.e. in order to be sure we have a black
hole we would need an infinite time interval. But, in classical physics we have
trajectories off all the particles and equations of motion for all the fields
and can, in principle, construct some ideal models for the gravitational
collapse and study the black hole formation under different conditions.
","[{""version"":""v1"",""created"":""Sat, 30 Dec 2000 15:28:55 GMT""}]","2007-05-23"
"hep-ph/0012377","Nicolao Fornengo","A. Bottino, N. Fornengo, S. Scopel (Torino U.)","Implications of a possible 115 GeV supersymmetric Higgs boson on
  detection and cosmological abundance of relic neutralinos","15 pages, 6 figures, typeset with ReVTeX. The new version containes
  extended analysis. In order to reduce size, the version on the archive has
  low-resolution figures. The paper with high-resolution figures can be found
  at http://www.to.infn.it/~fornengo/papers/","Nucl.Phys. B608 (2001) 461-474","10.1016/S0550-3213(01)00273-5","DFTT 51/2000","hep-ph",,"  We show that a supersymmetric neutral Higgs boson with a mass of about 115
GeV and with the other prerequisites required by the LEP Higgs events would be
compatible with the detection of relic neutralinos in current set-ups for WIMP
direct search. Thus this putative Higgs would fit remarkably well in an
interpretation in terms of relic neutralinos of the annual-modulation effect
recently measured in a WIMP direct experiment. We also show that the
cosmological abundance of the relevant neutralinos reaches values of
cosmological interest.
","[{""version"":""v1"",""created"":""Fri, 29 Dec 2000 16:13:06 GMT""},{""version"":""v2"",""created"":""Mon, 14 May 2001 15:27:44 GMT""}]","2009-10-31"
"hep-ph/0012378","Tony Gherghetta","Tony Gherghetta and Alex Pomarol","A Warped Supersymmetric Standard Model","22 pages, LaTeX; v2: references and more comments on AdS/CFT
  correspondence added","Nucl.Phys. B602 (2001) 3-22","10.1016/S0550-3213(01)00127-4","UNIL-IPT-00-28","hep-ph hep-th",,"  We study the breaking of supersymmetry in five-dimensional (5d) warped
spaces, using the Randall-Sundrum model as a prototype. In particular, we
present a supersymmetry-breaking mechanism which has a geometrical origin, and
consists of imposing different boundary conditions between the fermions and
bosons living in the 5d bulk. The scale of supersymmetry breaking is
exponentially small due to the warp factor of the AdS metric. We apply this
mechanism to a supersymmetric standard model where supersymmetry breaking is
transmitted through the AdS bulk to matter fields confined on the Planck-brane.
This leads to a predictable superparticle mass spectrum where the gravitino
mass is $10^{-3}$eV and scalar particles receive masses at the one-loop level
via bulk gauge interactions. We calculate the mass spectrum in full detail
using the 5d AdS propagators. The AdS/CFT correspondence suggests that our 5d
warped model is dual to the ordinary 4d MSSM with a strongly coupled CFT sector
responsible for the breaking of supersymmetry.
","[{""version"":""v1"",""created"":""Fri, 29 Dec 2000 19:25:55 GMT""},{""version"":""v2"",""created"":""Wed, 24 Jan 2001 16:09:59 GMT""}]","2009-10-31"
"hep-ph/0012379","Howard Georgi","Howard Georgi, Aaron K. Grant, Girma Hailu","Brane Couplings from Bulk Loops","10 pages, Latex with pictex figures","Phys.Lett.B506:207-214,2001","10.1016/S0370-2693(01)00408-7","HUTP-00/A030","hep-ph",,"  We compute loop corrections to the effective action of a field theory on a
five-dimensional $S_1/Z_2$ orbifold. We find that the quantum loop effects of
interactions in the bulk produce infinite contributions that require
renormalization by four-dimensional couplings on the orbifold fixed planes.
Thus bulk couplings give rise to renormalization group running of brane
couplings.
","[{""version"":""v1"",""created"":""Fri, 29 Dec 2000 19:29:44 GMT""},{""version"":""v2"",""created"":""Mon, 8 Jan 2001 01:06:44 GMT""}]","2009-09-11"
"hep-ph/0012380","B. G. Shaikhatdenov","I.Akushevich (TJNAF), E. Kuraev, B. Shaikhatdenov (JINR)","Single-spin asymmetry in DVCS: fragmentation region of polarised lepton","6 pp, 1 fig, uses RevTeX package; some corrections, typos fixed",,"10.1103/PhysRevD.64.094010",,"hep-ph",,"  For the kinematical region when a hard photon is emitted predominantly close
to the direction of motion of a longitudinally polarized initial electron and
relatively small momentum transfer to a proton we calculate the azimuthal
asymmetry of photon emission. It arises from the interference of the
Bethe-Heitler amplitude and those which are described by a heavy photon impact
factor. Azimuthal asymmetry does not decrease in the limit of infinite cms
energy. Lowest order expression for the impact factor of a heavy photon is
presented.
","[{""version"":""v1"",""created"":""Fri, 29 Dec 2000 20:03:06 GMT""},{""version"":""v2"",""created"":""Fri, 9 Mar 2001 07:01:10 GMT""}]","2013-05-29"
"hep-ph/0012381","Alan Kostelecky","Alan Kostelecky and Agnes Roberts","Analogue Models for T and CPT Violation in Neutral-Meson Oscillations","9 pages","Phys.Rev.D63:096002,2001","10.1103/PhysRevD.63.096002","IUHET 428, December 2000","hep-ph",,"  Analogue models for CP violation in neutral-meson systems are studied in a
general framework. No-go results are obtained for models in classical mechanics
that are nondissipative or that involve one-dimensional oscillators. A complete
emulation is shown to be possible for a two-dimensional oscillator with
rheonomic constraints, and an explicit example with spontaneous T and CPT
violation is presented. The results have implications for analogue models with
electrical circuits.
","[{""version"":""v1"",""created"":""Fri, 29 Dec 2000 21:19:25 GMT""}]","2009-09-25"
"hep-ph/0012382","Turko","Dariusz Prorok and Ludwik Turko","J/Psi suppression in colliding nuclei: statistical model analysis","14 pages, 13 figures. Accepted for publication in Phys. Rev. C","Phys.Rev. C64 (2001) 044903","10.1103/PhysRevC.64.044903",,"hep-ph",,"  We consider the $J/\Psi$ suppression at a high energy heavy ion collision. An
ideal gas of massive hadrons in thermal and chemical equilibrium is formed in
the central region. The finite-size gas expands longitudinally in accordance
with Bjorken law. The transverse expansion in a form of the rarefaction wave is
taken into account. We show that $J/\Psi$ suppression in such an environment,
when combined with the disintegration in nuclear matter, gives correct
evaluation of NA38 and NA50 data in a broad range of initial energy densities.
","[{""version"":""v1"",""created"":""Fri, 29 Dec 2000 21:58:16 GMT""},{""version"":""v2"",""created"":""Mon, 9 Jul 2001 10:09:05 GMT""}]","2009-10-31"
"hep-ph/0012383","David Blaschke","D.M. Sedrakian, D. Blaschke, K.M. Shahabasyan, D.N. Voskresensky","Meissner effect for color superconducting quark matter","13 pages, no figures, version accepted for publication in Astrofizika","Astrofiz.44:443-454,2001; Astrophys.44:359-368,2001","10.1023/A:1012823913050","MPG-VT-UR 213/00","hep-ph astro-ph",,"  The behaviour of the magnetic field inside the superconducting quark matter
core of a neutron star is investigated in the framework of the Ginzburg-Landau
theory. We take into account the simultaneous coupling of the diquark
condensate field to the usual magnetic and to the gluomagnetic gauge fields. We
solve the problem for three different physical situations: a semi-infinite
region with a planar boundary, a spherical region, and a cylindrical region. We
show that Meissner currents near the quark core boundary effectively screen the
external static magnetic field.
","[{""version"":""v1"",""created"":""Fri, 29 Dec 2000 22:41:45 GMT""},{""version"":""v2"",""created"":""Wed, 3 Jan 2001 15:49:35 GMT""},{""version"":""v3"",""created"":""Sun, 21 Jan 2001 23:38:39 GMT""}]","2014-11-17"
"hep-ph/0101001","Heui-Seol Roh","Heui-Seol Roh","Quantum Weakdynamics as an SU(3)_I Gauge Theory: Grand Unification of
  Strong and Electroweak Interactions","REVTeX, 20 pages, corrected typographic errors, revised Section II","Eur.Phys.J.C22:359-377,2001","10.1007/s100520100803",,"hep-ph",,"  Quantum weakdynamics (QWD) as an SU(3)_I gauge theory with the Theta vacuum
term is considered to be the unification of the electroweak interaction as an
SU(2)_L x U(1)_Y gauge theory. The grand unification of SU(3)_I x SU(3)_C
beyond the standard model SU(3)_C x SU(2)_L x U(1)_Y is established by the
group SU(3)_I. The grand unified interactions break down to weak and strong
interactions at a new grand unification scale 10^{3} GeV, through dynamical
spontaneous symmetry breaking (DSSB); the weak and strong coupling constants
are the same, alpha_i = alpha_s ~ 0.12, at this scale. DSSB is realized by the
condensation of scalar fields, postulated to be spatially longitudinal
components of gauge bosons, instead of Higgs particles. Quark and lepton family
generation, the Weinberg angle sin^2 theta_W = 1/4, and the Cabbibo angle sin
theta_C = 1/4 are predicted. The electroweak coupling constants are alpha_z =
alpha_i/3, alpha_w = alpha_i/4, alpha_y = alpha_i/12, and alpha_e = alpha_i/16
= 1/137; there are symmetric isospin interactions.
","[{""version"":""v1"",""created"":""Sat, 30 Dec 2000 05:03:29 GMT""},{""version"":""v2"",""created"":""Thu, 10 Jan 2002 07:10:21 GMT""}]","2008-11-26"
"hep-ph/0101002","Liao Wei","Chao-Shang Huang, Tianjun Li, Liao Wei and Qi-Shu Yan","CP Violation and Extra Dimensions","Latex, 7 pages","Eur.Phys.J.C23:195-199,2002","10.1007/s100520100833",,"hep-ph",,"  It is shown that the new sources of CP violation can be generated in the
models with more than one extra dimensions. In the supersymmetric models on the
space-time $M^4\times T^2/Z_2$, where the radius moduli have auxiliary vacuum
expectation values and the supersymmetry breaking is mediated by the
Kaluza-Klein states of gauge supermultiplets, we analyze the gaugino masses and
trilinear couplings for two scenarios and obtain that there exist relative CP
violating phases among the gaugino masses and trilinear couplings.
","[{""version"":""v1"",""created"":""Sat, 30 Dec 2000 08:02:16 GMT""},{""version"":""v2"",""created"":""Sun, 21 Jan 2001 18:53:40 GMT""}]","2008-11-26"
"hep-ph/0101003","Victor S. Fadin","V.S. Fadin (Novosibirsk)","Non-Forward BFKL at Next-to-Leading Approximation","Talk given at DIFFRACTION 2000: International Workshop on Diffraction
  in High-energy and Nuclear Physics, Cetraro, Cosenza, Italy, 2-7 Sep 2000","Nucl.Phys.Proc.Suppl. 99A (2001) 204-212","10.1016/S0920-5632(01)01335-4",,"hep-ph",,"  Representation of non-forward scattering amplitudes in the BFKL approach is
discussed and the results obtained in the next-to leading order are briefly
reviewed.
","[{""version"":""v1"",""created"":""Sat, 30 Dec 2000 12:58:10 GMT""}]","2009-11-07"
"hep-th/0012266","Enrique F. Moreno","G.S. Lozano, E.F. Moreno, F.A. Schaposnik","Self-dual Chern-Simons solitons in noncommutative space","15 pages, 4 figures","JHEP 0102:036,2001","10.1088/1126-6708/2001/02/036",,"hep-th",,"  We construct exact soliton solutions to the Chern-Simons-Higgs system in
noncommutative space, for non-relativistic and relativistic models. In both
cases we find regular vortex-like solutions to the BPS equations which approach
the ordinary selfdual non-topological and topological solitons when the
noncommutative parameter $\theta$ goes to zero.
","[{""version"":""v1"",""created"":""Fri, 29 Dec 2000 18:36:20 GMT""}]","2010-02-03"
"hep-th/0012267","Guillermo A. Silva","Guillermo A. Silva","Born-Infeld action and Supersymmetry (in spanish)","PhD Thesis, 149 pages, 4 figures",,,,"hep-th",,"  In the thesis we analize different problems related to the supersymmetric
extension of the Dirac-Born-Infeld action. In chapter 2 we introduce the DBI
action and show how it appears in string theory, we discuss also it's
connection with Dp-branes. Chapter 3 is a self contained introduction to
supersymmetry, with emphasis on BPS states. In chapter 4 we construct the N=2
supersymmetric extension of the Born-Infeld-Higgs in three space-time
dimensions and discuss it's BPS states and Bogomol'nyi bounds. In chapter 5 we
construct the N=1 supersymmetric extension of the non-abelian Born-Infeld
theory in four space-time dimensions. Chapter 6 deals with the analisis of BPS
and non-BPS solutions of the Dirac-Born-Infeld action and their interpretation
in superstring theory. Chapter 7 is devoted to the conclusions. Three appendix
complete the work.
","[{""version"":""v1"",""created"":""Fri, 29 Dec 2000 19:50:47 GMT""}]","2007-05-23"
"hep-th/0012268","Adrian Rene Lugo","Adri\'an R. Lugo","Correlation functions in the non-commutative Wess-Zumino-Witten model","21 pages, latex, no figures, shortened version to appear in Physics
  Letters B","Phys.Lett. B511 (2001) 101-111","10.1016/S0370-2693(01)00627-X","Th-00/07, La Plata University","hep-th",,"  We develop a systematic perturbative expansion and compute the one-loop
two-points, three-points and four-points correlation functions in a
non-commutative version of the U(N) Wess-Zumino-Witten model in different
regimes of the $\theta$-parameter showing in the first case a kind of phase
transition around the value $\theta_c = \frac{\sqrt{p^2 + 4 m^2}}{\Lambda^2
p}$, where $\Lambda$ is a ultraviolet cut-off in a Schwinger regularization
scheme. As a by-product we obtain the functions of the renormalization group,
showing they are essentially the same as in the commutative case but applied to
the whole U(N) fields; in particular there exists a critical point where they
are null, in agreement with a recent background field computation of the
beta-function, and the anomalous dimension of the Lie algebra-valued field
operator agrees with the current algebra prediction. The non-renormalization of
the level $k$ is explicitly verified from the four-points correlator, where a
left-right non-invariant counter-term is needed to render finite the theory,
that it is however null on-shell. These results give support to the equivalence
of this model with the commutative one.
","[{""version"":""v1"",""created"":""Fri, 29 Dec 2000 22:52:00 GMT""}]","2016-08-15"
"hep-th/0012269","Carlos M. Naon","An\'ibal Iucci, Kang Li, Carlos M. Na\'on","Non local Thirring model with spin flipping interactions","Latex, elsart, 18 pags., no figures","Nucl.Phys. B601 (2001) 607-619","10.1016/S0550-3213(01)00078-5","La Plata-Th 00/14","hep-th cond-mat.str-el",,"  We extend a non local and non covariant version of the Thirring model in
order to describe a many-body system with spin-flipping interactions By
introducing a model with two fermion species we are able to avoid the use of
non abelian bosonization which is needed in a previous approach. We obtain a
bosonized expression for the partition function, describing the dynamics of the
collective modes of this system. By using the self-consistent harmonic
approximation we found a formula for the gap of the spin-charge excitations as
functional of arbitrary electron-electron potentials.
","[{""version"":""v1"",""created"":""Fri, 29 Dec 2000 22:57:10 GMT""}]","2016-08-15"
