"math/0002167","Jean-Paul Dufour","Jean-Paul Dufour and Mikhail Zhitomirskii","Nambu structures and integrable 1-forms","LaTeX, 12 pages",,,,"math.DG",,"  Some years ago Mosh\'e Flato pointed up that it could be interesting to
develop the Nambu's idea to generalize Hamiltonian mechanic. An interesting new
formalism in that direction was proposed by T. Takhtajan.
  His theory gave new perspectives concerning deformation quantization, and
many authors have developed its mathematical features.
  The purpose of this paper is to show that this theory, at first designated to
physic, gives a new point of view for the study of singularities of integrable
1-forms. Namely, we will prove that any integrable 1-form which vanishes at a
point and has a non-zero linear part at this point is, up to multiplication by
a non-vanishing function, the formal pull-back of a two dimensional 1-form. We
also obtain a classification of quadratic integrable 1-forms.
","[{""version"":""v1"",""created"":""Mon, 21 Feb 2000 10:50:51 GMT""},{""version"":""v2"",""created"":""Thu, 2 Mar 2000 15:56:39 GMT""}]","2016-09-07"
"math/0002169","Marco Maggesi","Carla Dionisi and Marco Maggesi","Minimal resolution of general stable vector bundles on $\PP^2$","8 pages, amslatex",,,,"math.AG",,"  We study the general elements of the moduli spaces (\MM_{\PP^2} (r, c_1, c_2)
) of stable holomorphic vector bundle on $\PP^2$ and their minimal free
resolution. Incidentally, a quite easy proof of the irreducibility of
(\MM_{\PP^2} (r, c_1, c_2)) is shown.
","[{""version"":""v1"",""created"":""Mon, 21 Feb 2000 15:08:40 GMT""}]","2007-05-23"
"nlin/0002032","Barbara Drossel","Barbara Drossel, Paul G. Higgs and Alan J. McKane","The Influence of Predator-Prey Population Dynamics on the Long-term
  Evolution of Food Web Structure","40 pages, preprint format",,,,"nlin.AO q-bio",,"  We develop a set of equations to describe the population dynamics of many
interacting species in food webs. Predator-prey interactions are non-linear,
and are based on ratio-dependent functional responses. The equations account
for competition for resources between members of the same species, and between
members of different species. Predators divide their total hunting/foraging
effort between the available prey species according to an evolutionarily stable
strategy (ESS). The ESS foraging behaviour does not correspond to the
predictions of optimal foraging theory. We use the population dynamics
equations in simulations of the Webworld model of evolving ecosystems. New
species are added to an existing food web due to speciation events, whilst
species become extinct due to coevolution and competition. We study the
dynamics of species-diversity in Webworld on a macro-evolutionary timescale.
Coevolutionary interactions are strong enough to cause continuous overturn of
species, in contrast to our previous Webworld simulations with simpler
population dynamics. Although there are significant fluctuations in species
diversity because of speciation and extinction, very large scale extinction
avalanches appear to be absent from the dynamics, and we find no evidence for
self-organised criticality.
","[{""version"":""v1"",""created"":""Sun, 20 Feb 2000 16:06:55 GMT""}]","2007-05-23"
"nlin/0002033","Tatsuya Uezu","Satoko Itaya and Tatsuya Uezu","Analysis of immune network dynamical system model with small number of
  degrees of freedom","21 pages, 42 figures. All figures are gif formats",,"10.1143/PTP.104.903",,"nlin.CD q-bio",,"  We numerically study a dynamical system model of an idiotypic immune network
with a small number of degrees of freedom. The model was originally introduced
by Varela et.al., and describes antibodies interacting in a body in order to
prepare for the invasion of external antigens.
  The main purpose of this paper is to investigate the direction of change in
the network system when antigens invade it. We investigate three models,
original model, a modified model and a modified model with a threshold of
concentration over which each antibody can recognize other antibodies. In all
these models, both chaotic and periodic states exist. In particular, we find
peculiar states organized in the network, the clustering state.
","[{""version"":""v1"",""created"":""Mon, 21 Feb 2000 06:25:53 GMT""}]","2009-10-31"
"nlin/0002034","Yan Fyodorov","Yan V. Fyodorov","Spectra of Random Matrices Close to Unitary and Scattering Theory for
  Discrete-Time Systems","4 pages, latex, no figures, a few misprints are corrected",,"10.1063/1.1358183",,"nlin.CD cond-mat math-ph math.MP",,"  We analyze statistical properties of complex eigenvalues of random matrices
$\hat{A}$ close to unitary. Such matrices appear naturally when considering
quantized chaotic maps within a general theory of open linear stationary
systems with discrete time. Deviation from unitarity are characterized by rank
$M$ and eigenvalues $T_i, i=1,...,M$ of the matrix $\hat{T}=\hat{{\bf
1}}-\hat{A}^{\dagger}\hat{A}$. For the case M=1 we solve the problem completely
by deriving the joint probability density of eigenvalues and calculating all
$n-$ point correlation functions. For a general case we present the correlation
function of secular determinants.
","[{""version"":""v1"",""created"":""Mon, 21 Feb 2000 15:18:02 GMT""},{""version"":""v2"",""created"":""Tue, 22 Feb 2000 11:59:55 GMT""}]","2009-10-31"
"nlin/0002035","Frank Schmueser","F. Schmuser, W. Just and H. Kantz","Relation between coupled map lattices and kinetic Ising models","15 pages, figures included, Phys. Rev. E in press",,"10.1103/PhysRevE.61.3675",,"nlin.CD cond-mat.stat-mech",,"  A spatially one dimensional coupled map lattice possessing the same
symmetries as the Miller Huse model is introduced. Our model is studied
analytically by means of a formal perturbation expansion which uses weak
coupling and the vicinity to a symmetry breaking bifurcation point. In
parameter space four phases with different ergodic behaviour are observed.
Although the coupling in the map lattice is diffusive, antiferromagnetic
ordering is predominant. Via coarse graining the deterministic model is mapped
to a master equation which establishes an equivalence between our system and a
kinetic Ising model. Such an approach sheds some light on the dependence of the
transient behaviour on the system size and the nature of the phase transitions.
","[{""version"":""v1"",""created"":""Mon, 21 Feb 2000 15:55:58 GMT""}]","2015-06-26"
"nucl-th/0002047","Katsuhiko Suzuki","K. Suzuki (RCNP, Osaka Univ.), E. Hiyama (RIKEN), H. Toki (RCNP, Osaka
  Univ), M. Kamimura(Kyushu)","Roles of quark-pair correlations in baryon structure and non-leptonic
  weak transitions of hyperon","5 pages, 2 figures, talk presented at 1st Asia-Pacific conference on
  ``Few-body problems in physics'', Noda/Kashiwa, Japan, August 23-28 (1999),
  to be published in Few-body supplement","Few Body Syst.Suppl.12:209-213,2000",,,"nucl-th",,"  Roles of quark-pair correlations in the baryon structure and the hyperon
non-leptonic weak decay are studied within the non-relativistic constituent
quark model. We construct the SU(3) ground state baryons by solving the three
body problem rigorously with the confinement force and the short range
spin-dependent attraction. We emphasize the importance of the $s=0$ quark-quark
correlation to reproduce the $\Delta I=1/2$ enhancement of the hyperon decay,
and demonstrate that resulting static properties as well as the decay
amplitudes agree with the experiments, if we deal with the $s=0$ correlation
properly. Special attention is also put on the consequences of the SU(6)
spin-flavor symmetry breaking due to the $s=0$ correlation. Calculated magnetic
moments are the almost same as the naive SU(6) predictions in spite of the
existence of the strong correlations.
","[{""version"":""v1"",""created"":""Mon, 21 Feb 2000 11:13:41 GMT""}]","2011-04-15"
"physics/0002038","Jan M. Rost","Gerd van de Sand and Jan M Rost","Semiclassical description of multiphoton processes","10 pages, 11 figures","Phys Rev A 62, 053403 (2000)","10.1103/PhysRevA.62.053403",,"physics.atom-ph physics.optics",,"  We analyze strong field atomic dynamics semiclassically, based on a full
time-dependent description with the Hermann-Kluk propagator. From the
properties of the exact classical trajectories, in particular the accumulation
of action in time, the prominent features of above threshold ionization (ATI)
and higher harmonic generation (HHG) are proven to be interference phenomena.
They are reproduced quantitatively in the semiclassical approximation.
Moreover, the behavior of the action of the classical trajectories supports the
so called strong field approximation which has been devised and postulated for
strong field dynamics.
","[{""version"":""v1"",""created"":""Sun, 20 Feb 2000 17:13:45 GMT""}]","2009-11-06"
"physics/0002039","Georg Pabst","Georg Pabst, Michael Rappolt, Heinz Amenitsch and Peter Laggner","Structural information from multilamellar liposomes at full hydration:
  full q-range fitting with high quality X-ray data","37 pages, from MS Word, includes references, 2 tables, figure
  captions & 6 figures. Paper submitted to Phys. Rev. E (Nov. 1999)",,"10.1103/PhysRevE.62.4000","ibr-00-01","physics.bio-ph",,"  We present a novel method for analyzing Small Angle X-ray Scattering data on
multilamellar phospholipid bilayer systems at full hydration. The method
utilizes a modified Caille' theory structure factor in combination with a
Gaussian model representation of the electron density profile such that it
accounts also for the diffuse scattering between Bragg peaks. Thus, the method
can retrieve structural information even if only a few orders of diffraction
are observed. We further introduce a new procedure to derive fundamental
parameters, such as area per lipid, membrane thickness, and number of water
molecules per lipid, directly from the electron density profile without the
need of additional volumetric measurements. The theoretical apparatus is
applied to experimental data on
1-palmitoyl-2-oleoyl-sn-glycero-3-phosphocholine and
1,2-dipalmitoyl-sn-glycero-3-phosphoethanolamine liposome preparations.
","[{""version"":""v1"",""created"":""Mon, 21 Feb 2000 11:33:13 GMT""}]","2009-11-06"
"physics/0002040","Georg Pabst","Georg Pabst, Michael Rappolt, Heinz Amenitsch, Sigrid Bernstorff, and
  Peter Laggner","X-Ray Kinematography of Temperature-Jump Relaxation Probes the Elastic
  Properties of Fluid Bilayers","40 pages, from MS Word, 9 figures. Paper submitted for publication to
  Biophys. J. (Dec. 1999)",,,"ibr-00-02","physics.bio-ph",,"  The response kinetics of liquid crystalline phosphatidylcholine bilayer
stacks to rapid, IR-laser induced temperature jumps has been studied by
millisecond time-resolved x-ray diffraction. The system reacts on the fast
temperature change by a discrete bilayer compression normal to its surface and
a lateral bilayer expansion. Since water cannot diffuse from the excess phase
into the interbilayer water region within the 2 ms duration of the laser pulse,
the water layer has to follow the bilayer expansion, by an anomalous thinning.
Structural analysis of a 20 ms diffraction pattern from the intermediate phase
indicates that the bilayer thickness remains within the limits of isothermal
equilibrium values. Both, the intermediate structure and its relaxation into
the original equilibrium L_(alpha)-phase, depend on the visco-elastic
properties of the bilayer/water system. We present an analysis of the
relaxation process by an overdamped one-dimensional oscillation model revealing
the concepts of Hooke's law for phospholipid bilayers on a supramolecular
basis. The results yield a constant bilayer repulsion and viscosity within
Hooke's regime suggesting that the hydrocarbon chains act as a buffer for the
supplied thermal energy. The bilayer compression is a function of the initial
temperature and the temperature amplitude, but is independent of the chain
length.
","[{""version"":""v1"",""created"":""Mon, 21 Feb 2000 12:03:16 GMT""}]","2007-05-23"
"quant-ph/0002055","A. P. Balachandran","A.P. Balachandran","Classical Topology and Quantum States","19 pages, Latex. Talk presented at the Winter Institute on
  Foundations of Quantum Theory and Quantum Optics,S.N.Bose National Centre for
  Basic Sciences,Calcutta,January 1-13,2000. A hep-th number in a reference has
  been corrected","Pramana 56:223-237,2001","10.1007/s12043-001-0120-y","SU-4240-716","quant-ph gr-qc hep-th",,"  Any two infinite-dimensional (separable) Hilbert spaces are unitarily
isomorphic. The sets of all their self-adjoint operators are also therefore
unitarily equivalent. Thus if all self-adjoint operators can be observed, and
if there is no further major axiom in quantum physics than those formulated for
example in Dirac's `Quantum Mechanics', then a quantum physicist would not be
able to tell a torus from a hole in the ground. We argue that there are indeed
such axioms involving observables with smooth time evolution: they contain
commutative subalgebras from which the spatial slice of spacetime with its
topology (and with further refinements of the axiom, its $C^K-$ and $C^\infty-$
structures) can be reconstructed using Gel'fand - Naimark theory and its
extensions. Classical topology is an attribute of only certain quantum
observables for these axioms, the spatial slice emergent from quantum physics
getting progressively less differentiable with increasingly higher excitations
of energy and eventually altogether ceasing to exist. After formulating these
axioms, we apply them to show the possibility of topology change and to discuss
quantized fuzzy topologies. Fundamental issues concerning the role of time in
quantum physics are also addressed.
","[{""version"":""v1"",""created"":""Sun, 20 Feb 2000 21:31:45 GMT""},{""version"":""v2"",""created"":""Fri, 3 Mar 2000 20:16:35 GMT""}]","2009-11-06"
"quant-ph/0002056","G. Andrei Mezincescu","G. Andrei Mezincescu","Some properties of eigenvalues and eigenfunctions of the cubic
  oscillator with imaginary coupling constant","6 pages, submitted to J. Phys. A","J.Phys.A33:4911-4916,2000","10.1088/0305-4470/33/27/308",,"quant-ph cond-mat hep-th math-ph math.MP",,"  Comparison between the exact value of the spectral zeta function,
$Z_{H}(1)=5^{-6/5}[3-2\cos(\pi/5)]\Gamma^2(1/5)/\Gamma(3/5)$, and the results
of numeric and WKB calculations supports the conjecture by Bessis that all the
eigenvalues of this PT-invariant hamiltonian are real. For one-dimensional
Schr\""odinger operators with complex potentials having a monotonic imaginary
part, the eigenfunctions (and the imaginary parts of their logarithmic
derivatives) have no real zeros.
","[{""version"":""v1"",""created"":""Mon, 21 Feb 2000 09:40:11 GMT""}]","2008-11-26"
