"cond-mat/0002321","Michael Brunner","Michael Brunner, Fakher F. Assaad, Alejandro Muramatsu","Single hole dynamics in the t-J model on a square lattice",,"Phys. Rev. B 62, 15480 (2000)","10.1103/PhysRevB.62.15480",,"cond-mat.str-el",,"  We present quantum Monte Carlo (QMC) simulations for a single hole in a t-J
model from J=0.4t to J=4t on square lattices with up to 24 x 24 sites. The
lower edge of the spectrum is directly extracted from the imaginary time
Green's function. In agreement with earlier calculations, we find flat bands
around $(0,\pm\pi)$, $(\pm\pi,0)$ and the minimum of the dispersion at
$(\pm\pi/2,\pm\pi/2)$. For small J both self-consistent Born approximation and
series expansions give a bandwidth for the lower edge of the spectrum in
agreement with the simulations, whereas for J/t > 1, only series expansions
agree quantitatively with our QMC results. This band corresponds to a coherent
quasiparticle. This is shown by a finite size scaling of the quasiparticle
weight $Z(\vec k)$ that leads to a finite result in the thermodynamic limit for
the considered values of $J/t$. The spectral function $A(\vec k, \omega)$ is
obtained from the imaginary time Green's function via the maximum entropy
method. Resonances above the lowest edge of the spectrum are identified, whose
J-dependence is quantitatively described by string excitations up to J/t=2.
","[{""version"":""v1"",""created"":""Mon, 21 Feb 2000 09:11:24 GMT""}]","2009-10-31"
"cond-mat/0002322","J. M. Pitarke","I. Campillo, V. M. Silkin, J. M. Pitarke, E. V. Chulkov, A. Rubio, and
  P. M. Echenique","First-principles calculations of hot-electron lifetimes in metals","8 pages, 10 figures, to appear in Phys. Rev. B","Phys. Rev. B 61, 13484 (2000)","10.1103/PhysRevB.61.13484",,"cond-mat.mtrl-sci",,"  First-principles calculations of the inelastic lifetime of low-energy
electrons in Al, Mg, Be, and Cu are reported. Quasiparticle damping rates are
evaluated from the knowledge of the electron self-energy, which we compute
within the GW approximation of many-body theory. Inelastic lifetimes are then
obtained along various directions of the electron wave vector, with full
inclusion of the band structure of the solid. Average lifetimes are also
reported, as a function of the electron energy. In Al and Mg, splitting of the
band structure over the Fermi level yields electron lifetimes that are smaller
than those of electrons in a free-electron gas. Larger lifetimes are found in
Be, as a result of the characteristic dip that this material presents in the
density of states near the Fermi level. In Cu, a major contribution from $d$
electrons participating in the screening of electron-electron interactions
yields electron lifetimes which are well above those of electrons in a
free-electron gas with the electron density equal to that of valence ($4s^1$)
electrons.
","[{""version"":""v1"",""created"":""Mon, 21 Feb 2000 11:53:06 GMT""}]","2009-10-31"
"cond-mat/0002323","Andres Santos","J. M. Montanero, A. Santos","Computer simulation of uniformly heated granular fluids","18 pages (LaTex), 10 figures (eps); to be published in Granular
  Matter","Granular Matter 2, 53-64 (2000)","10.1007/s100350050035",,"cond-mat.stat-mech cond-mat.soft",,"  Direct Monte Carlo simulations of the Enskog-Boltzmann equation for a
spatially uniform system of smooth inelastic spheres are performed. In order to
reach a steady state, the particles are assumed to be under the action of an
external driving force which does work to compensate for the collisional loss
of energy. Three different types of external driving are considered: (a) a
stochastic force, (b) a deterministic force proportional to the particle
velocity and (c) a deterministic force parallel to the particle velocity but
constant in magnitude. The Enskog-Boltzmann equation in case (b) is fully
equivalent to that of the homogeneous cooling state (where the thermal velocity
monotonically decreases with time) when expressed in terms of the particle
velocity relative to the thermal velocity. Comparison of the simulation results
for the fourth cumulant and the high energy tail with theoretical predictions
derived in cases (a) and (b) [T. P. C. van Noije and M. H. Ernst, Gran. Matt.
1, 57 (1998)] shows a good agreement. In contrast to these two cases, the
deviation from the Maxwell-Boltzmann distribution is not well represented by
Sonine polynomials in case (c), even for low dissipation. In addition, the high
energy tail exhibits an underpopulation effect in this case.
","[{""version"":""v1"",""created"":""Mon, 21 Feb 2000 12:49:24 GMT""}]","2016-08-31"
"cond-mat/0002324","Stefan Scheidl","G. K. Leaf, S. Obukhov, S. Scheidl, and V. M. Vinokur","Transient Dynamics of Pinning","4 pages with figures",,,,"cond-mat.dis-nn cond-mat.stat-mech",,"  We study the evolution of an elastic string into the pinned state at driving
forces slightly below the depinning threshold force $F_c$. We quantify the
temporal evolution of the string by an {\it activity function} $A(t)$
representing the fraction of active nodes at time $t$ and find three distinct
dynamic regimes. There is an initial stage of fast decay of the activity; in
the second, intermediate, regime, an exponential decay of activity is observed;
and, eventually, the fast collapse of the string towards its final pinned state
results in an decay in the activity with $\Am \sim (t_p-t)^{\psi}$, where $t_p$
is the pinning time in the finite system involved.
","[{""version"":""v1"",""created"":""Mon, 21 Feb 2000 13:01:58 GMT""}]","2007-05-23"
"cond-mat/0002325","M. Jouravlev","M. Ye. Zhuravlev, H. O. Lutz, A. V. Vedyayev","The theory of GMR and TMR in segmented magnetic nanowires","9 pages, 8 figures",,,,"cond-mat.mes-hall",,"  We calculate the resistivity and Giant Magnetoresistance (GMR) of a segmented
nanowire consisting of two ferromagnetic segments separated by a thin
paramagnetic spacer. The quantization of the electron motion due to the small
nanowire cross-section is taken into account; s-d electron scattering gives
rise to different mean free paths for spin-up and spin-down s-electrons. The
calculated resistivity and GMR oscillate as a function of nanowire
cross-section due to the difference in Fermi momenta of d-electrons with
opposite spins. The GMR can reach values much higher than those which are
obtained for ""wires"" of infinite cross-section (i.e., a multilayer). Similarly
we have calculated the Tunneling Magnetoresistance (TMR) by replacing the
paramagnetic spacer with an insulator spacer.
","[{""version"":""v1"",""created"":""Mon, 21 Feb 2000 15:13:57 GMT""}]","2007-05-23"
"cond-mat/0002327","Victor Martin-Mayor","E. Marinari, V. Mart\'in-Mayor and A. Pagnani","Spin Glass Ordering in Diluted Magnetic Semiconductors: a Monte Carlo
  Study","4 pages plus 3 postscript figures","Phys. Rev. B, 62 (2000) 4999","10.1103/PhysRevB.62.4999",,"cond-mat.dis-nn cond-mat.stat-mech",,"  We study the temperature-dilution phase diagram of a site-diluted Heisenberg
antiferromagnet on a fcc lattice, with and without the Dzyaloshinskii-Moriya
anisotropic term, fixed to realistic microscopic parameters for $IIB_{1-x} Mn_x
Te$ (IIB=Cd, Hg, Zn). We show that the dipolar Dzyaloshinskii-Moriya anisotropy
induces a finite-temperature phase transition to a spin glass phase, at
dilutions larger than 80%. The resulting probability distribution of the order
parameter P(q) is similar to the one found in the cubic lattice
Edwards-Anderson Ising model. The critical exponents undergo large finite size
corrections, but tend to values similar to the ones of the
Edwards-Anderson-Ising model.
","[{""version"":""v1"",""created"":""Mon, 21 Feb 2000 15:59:48 GMT""},{""version"":""v2"",""created"":""Fri, 25 Feb 2000 14:44:39 GMT""}]","2016-08-15"
"hep-ex/0002053","Stefano Scopel","A. Morales (1), C.E. Aalseth (2), F.T. Avignone III (2), R. L.
  Brodzinski (3), S. Cebrian (1), E. Garcia (1), D. Gonzalez (1), W. K. Hensley
  (3), I. G. Irastorza (1), I. V. Kirpichnikov (4), A. A. Klimenko (5), H. S.
  Miley (3), J. Morales (1), A. Ortiz de Solorzano (1), S. B. Osetrov (5), V.
  S. Pogosov (6), J. Puimedon (1), J. H. Reeves (3), M. L. Sarsa (1), S. Scopel
  (1), A. A. Smolnikov (5), A. G. Tamanyan (6), A. A. Vasenko (5), S. I.
  Vasiliev (5), J. A. Villar(1) ((1) Zaragoza U., (2) South Carolina U., (3)
  Pacific Northwest National Laboratory, Richland (4) Inst. of Theor. and Exp.
  Physics, Moscow,(5) Baksan Neutrino Observ., (6) Yerevan U.)","New constraints on WIMPs from the Canfranc IGEX dark matter search","7 pages, 2 figures, submitted to Physics Letters","Phys.Lett.B489:268-272,2000","10.1016/S0370-2693(00)00956-4",,"hep-ex astro-ph hep-ph",,"  The IGEX Collaboration enriched 76Ge double-beta decay detectors are
currently operating in the Canfranc Underground Laboratory with an overburden
of 2450 m.w.e. A recent upgrade has made it possible to use them in a search
for WIMPs. A new exclusion plot has been derived for WIMP-nucleon
spin-independent interaction. To obtain this result, 30 days of data from one
IGEX detector, which has an energy threshold of ~4 keV, have been considered.
These data improve the exclusion limits derived from other germanium diode
experiments in the ~50 GeV DAMA region, and show that with a moderate
improvement of the background below 10 keV, the DAMA region may be tested with
an additional 1 kg-year of exposure.
","[{""version"":""v1"",""created"":""Mon, 21 Feb 2000 13:01:15 GMT""}]","2008-11-26"
"hep-ex/0002054","Peter Hristov","EXCHARM Collaboration","Spin alignment of $K^*(892)^\pm$ mesons produced in neutron-carbon
  interactions","8 pages, LaTeX, 3 eps figures","Phys.Lett.B485:334-340,2000","10.1016/S0370-2693(00)00704-8","JINR E1-99-178","hep-ex",,"  A new precise measurements of spin density matrix element $\rho_{00}$ of
$K^*(892)^{\pm}$ mesons produced inclusively in neutron-carbon interactions at
\~60 GeV have been carried out in the EXCHARM experiment at the Serpukhov
accelerator. The values of $\rho_{00}$ obtained in the transversity frame are
$0.424\pm0.011(stat)\pm0.018(sys)$ for $K^*(892)^+$ and
$0.393\pm0.025(stat)\pm0.018(sys)$ for $K^*(892)^-$. Significant $P_T$
dependence of $\rho_{00}$ has been observed in $K^*(892)^+$ production.
","[{""version"":""v1"",""created"":""Mon, 21 Feb 2000 12:47:29 GMT""}]","2012-08-27"
"hep-lat/0002024","Yoichi Iwasaki","Y. Iwasaki","The CP-PACS Project and Lattice QCD Results","10 pages, 5 figures, Talk at the 5th International Conference on
  Computational Physics (ICCP5), 11-13 October, 1999, Kanazawa, to appear in
  Prog. Theor. Phys. (Suppl.) No. 138 (2000)","Prog.Theor.Phys.Suppl.138:1-10,2000","10.1143/PTPS.138.102","UTHEP-418, UTCCP-P-81","hep-lat",,"  The aim of the CP-PACS project was to develop a massively parallel computer
for performing numerical research in computational physics with primary
emphasis on lattice QCD. The CP-PACS computer with a peak speed of 614 GFLOPS
with 2048 processors was completed in September 1996, and has been in full
operation since October 1996. We present an overview of the CP-PACS project and
describe characteristics of the CP-PACS computer. The CP-PACS has been mainly
used for hadron spectroscopy studies in lattice QCD. Main results in lattice
QCD simulations are given.
","[{""version"":""v1"",""created"":""Mon, 21 Feb 2000 08:45:35 GMT""}]","2015-06-25"
"hep-lat/0002025","Damir Becirevic","D.Becirevic, D.Meloni, A.Retico, V.Gimenez, L.Giusti, V.Lubicz,
  G.Martinelli","Mixing of B mesons and Decay Constants with the Non-Perturbatively
  Improved Action","21 pages (LaTeX2e), 5 PostScript figures","Nucl.Phys. B618 (2001) 241-258","10.1016/S0550-3213(01)00482-5","BUHEP-00-3, FTUV-IFIC-00-0216, LPT/00-19, RM3-TH/00-3, ROMA-1285/00","hep-lat hep-ex hep-ph",,"  Several quantities relevant to phenomenological studies of the mixing of
neutral B mesons are computed on the lattice. Our main results are: f_{Bd}
sqrt(B_{Bd})=206(28)(7) MeV, f_{Bs} sqrt(B_{Bs})/f_{Bd}sqrt(B_{Bd})=1.16(7). We
also obtain the related quantities f_{Bs}sqrt(B{Bs})=237(18)(8) MeV, f_{Bd}=
174(22)(+7-0)(-4-0) MeV, f_{Bs}= 204(15)(+7-0)(+3-0) MeV,
f_{Bs}/f_{Bd}=1.17(4)(+0-1), f_{Bd}/f_{Ds}=0.74(5). After combining our results
with the experimental world average (Delta m_d), we predict (Delta
m_s)=15.8(2.1)(3.3) ps^{-1}. We have also computed the relevant parameters for
mixing of neutral D mesons which may be useful in some extensions of the
Standard Model. All the quantities were obtained from a quenched simulation
with a non-perturbatively improved Clover action at beta=6.2, corresponding to
a lattice spacing 1/a=2.7(1) GeV, on a sample of 200 gauge-field
configurations. A discussion of the main systematic errors is also presented.
","[{""version"":""v1"",""created"":""Mon, 21 Feb 2000 15:57:15 GMT""}]","2009-10-31"
"hep-ph/0002217","Manmohan Gupta","Monika Randhawa, V. Bhatnagar, P.S. Gill and M. Gupta","Implications of the Unitarity Triangle `uc' for J, $\delta$ and
  $|V_{CKM}|$ elements","14 pages, 3 figures (eps), updated in the light of latest PDG2000
  data","Mod.Phys.Lett.A15:2363-2372,2000","10.1142/S0217732300002462",,"hep-ph",,"  The Jarlskog rephasing invariant parameter $|J|$ is evaluated using one of
the six Unitarity Triangles involving well known CKM matrix elements \vud,
\vus,~\rub, ~\vcd, ~\vcs~ and ~\vcb. With PDG2000 values of \vud~ etc. as
input, we obtain $|J|=(2.71 \pm 1.12) \times 10^{-5}$, which in the PDG
representation of CKM matrix leads to the range $21^o~to~159^o$ for the CP
violating phase $\delta$. The CKM matrix elements evaluated using this range of
$\delta$ are in agreement with the PDG CKM matrix. The implications of
refinements in the input on $|J|$, $\delta$ and CKM matrix elements have also
been studied.
","[{""version"":""v1"",""created"":""Mon, 21 Feb 2000 08:03:18 GMT""},{""version"":""v2"",""created"":""Tue, 8 Aug 2000 11:30:53 GMT""}]","2014-11-17"
"hep-ph/0002218","Katsuhiko Suzuki","K. Suzuki","T-odd quark fragmentation function and transverse spin asymmetries in
  the pion production","8 pages, 7 figures talk presented at Circum-Pan-Pacific RIKEN
  Symposium on ``High Energy Spin Physics'' Saitama, Japan, November 3-6 (1999)","RIKEN Rev.28:105-109,2000",,,"hep-ph",,"  We study the time-reversal odd quark fragmentation function and its
consequences on the hard processes. T-odd quark fragmentation function may
arise, although QCD is T-invariant, from the non-perturbative dynamics in the
fragmentation process. Assuming the factorization, we extract the T-odd
fragmentation function from the inclusive pion production in the transversely
polarized proton-proton collision. We then estimate the single spin asymmetry
$A_{OT}$ of the semi-inclusive deep inelastic scattering with unpolarized
lepton and the transversely polarized proton. We also discuss the meson cloud
effects on the transversity distribution $h_1(x)$ of the nucleon. Asymmetry for
the $\pi^-$ production is found to be much smaller than the naive expectation,
since the $d$-quark transversity is considerably suppressed by the pion cloud
effects
","[{""version"":""v1"",""created"":""Mon, 21 Feb 2000 10:45:32 GMT""}]","2011-04-15"
"hep-ph/0002219","Surya Narayan Nayak","S.N. Nayak and U.A. Yajnik","Baryogenesis through axion domain wall","6 pages",,,"IITB-TPH-0001","hep-ph",,"  Generic axion models give rise to axion domain walls in the early Universe
and they have to disappear not to overclose the universe, thus limiting the
nature of discrete symmetry allowed in these type of models. Through QCD
sphalerons, net chiral charge can be created by these collapsing walls which in
turn can result the observed baryon assymmetry.
","[{""version"":""v1"",""created"":""Mon, 21 Feb 2000 12:39:31 GMT""}]","2007-05-23"
"hep-th/0002161","Csaba Csaki","Csaba Csaki, Joshua Erlich and Timothy J. Hollowood","Quasi-Localization of Gravity by Resonant Modes","8 pages, 3 figures included. Requires JHEP.cls. Typos fixed, note and
  references added. Added expression for width of resonance","Phys.Rev.Lett.84:5932-5935,2000","10.1103/PhysRevLett.84.5932",,"hep-th astro-ph gr-qc hep-ph",,"  We examine the behaviour of gravity in brane theories with extra dimensions
in a non-factorizable geometry. We find that for metrics which are
asymptotically flat far from the brane there is a resonant graviton mode at
zero energy. The presence of this resonance ensures quasi-localization of
gravity, whereby at intermediate scales the gravitational laws on the brane are
approximately four dimensional. However, for scales larger than the lifetime of
the graviton resonance the five dimensional laws of gravity will be reproduced
due to the decay of the four dimensional graviton. We also present a simple
classification of the possible types of effective gravity theories on the brane
that can appear for general non-factorizable background theories.
","[{""version"":""v1"",""created"":""Mon, 21 Feb 2000 03:54:46 GMT""},{""version"":""v2"",""created"":""Tue, 7 Mar 2000 18:41:48 GMT""}]","2008-11-26"
"hep-th/0002163","Nathan F. Lepora","Nathan F. Lepora","On the Spectrum and Representation Theory of Non-Abelian Monopoles","withdrawn by the author. Some material included in hep-th/0106254",,,,"hep-th hep-ph",,"  This manuscript has been withdrawn by the author. Some of the material has
been included in the manuscript 'Embedded Monopoles' at hep-th/0106254.
","[{""version"":""v1"",""created"":""Sun, 20 Feb 2000 18:17:59 GMT""},{""version"":""v2"",""created"":""Tue, 7 Aug 2001 15:51:34 GMT""}]","2007-05-23"
"hep-th/0002164","Stefan Foerste","Stefan Forste, Zygmunt Lalak, Stephane Lavignac and Hans Peter Nilles","A Comment on Self-Tuning and Vanishing Cosmological Constant in the
  Brane World","7 pages, Latex, final version to appear in Phys. Lett. B","Phys.Lett. B481 (2000) 360-364","10.1016/S0370-2693(00)00468-8",,"hep-th gr-qc hep-ph",,"  In this note we elaborate on various five dimensional contributions to the
effective 4D cosmological constant in brane systems. In solutions with
vanishing 5D cosmological constant we describe a non-local mechanism of
cancellation of vacuum energy between the brane and the singularities. We
comment on a hidden fine tuning which is implied by this observation.
","[{""version"":""v1"",""created"":""Sun, 20 Feb 2000 21:55:10 GMT""},{""version"":""v2"",""created"":""Fri, 7 Apr 2000 12:00:26 GMT""}]","2009-10-31"
"hep-th/0002165","Kwek LC","B.E. Baaquie and L.C. Kwek","Superstrings, Gauge Fields and Black Holes","Lecture notes for talk delivered at NUS in 1997-1998. Some recent
  updates added. The material may be somewhat outdated but it could still be
  useful for physicists new to the field","Int.J.Mod.Phys.A16:2605-2664,2001","10.1142/S0217751X01004268",,"hep-th",,"  There has been spectacular progress in the development of string and
superstring theories since its inception thirty years ago. Development in this
area has never been impeded by the lack of experimental confirmation. Indeed,
numerous bold and imaginative strides have been taken and the sheer elegance
and logical consistency of the arguments have served as a primary motivation
for string theorists to push their formulations ahead. In fact the development
in this area has been so rapid that new ideas quickly become obsolete. On the
other hand, this rapid development has proved to be the greatest hindrance for
novices interested in this area. These notes serve as a gentle introduction to
this topic. In these elementary notes, we briefly review the RNS formulation of
superstring theory, GSO projection, $D$-branes, bosonic strings, dualities,
dynamics of $D$-branes and the microscopic description of Bekenstein entropy of
a black hole.
","[{""version"":""v1"",""created"":""Mon, 21 Feb 2000 06:08:35 GMT""}]","2014-11-18"
"hep-th/0002166","Finn Larsen","Finn Larsen","Kaluza-Klein Black Holes in String Theory","11 pages; to appear in the proceedings of PASCOS'99",,"10.1142/9789812792433_0006",,"hep-th",,"  Non-supersymmetric black holes carrying both electric and magnetic charge
with respect to a single Kaluza-Klein gauge field have much in common with
supersymmetric black holes. Angular momentum conservation and other general
physics principles underlies some of their basic features. Kaluza-Klein black
holes are interpreted in string theory as bound states of D6-branes and
D0-branes. The microscopic theory reproduces the full nonlinear mass formula of
the extremal black holes.
","[{""version"":""v1"",""created"":""Mon, 21 Feb 2000 10:49:18 GMT""}]","2016-11-03"
"hep-th/0002167","Thomas Pisar","F. Gieres, J. Grimstrup, T. Pisar and M. Schweda","Vector supersymmetry in topological field theories","19 pages","JHEP 0006 (2000) 018","10.1088/1126-6708/2000/06/018","REF.TUW 99-18, LYCEN 2000-03","hep-th",,"  We present a simple derivation of vector supersymmetry transformations for
topological field theories of Schwarz- and Witten-type. Our method is similar
to the derivation of BRST-transformations from the so-called horizontality
conditions or Russian formulae. We show that this procedure reproduces in a
concise way the known vector supersymmetry transformations of various
topological models and we use it to obtain some new transformations of this
type for 4d topological YM-theories in different gauges.
","[{""version"":""v1"",""created"":""Mon, 21 Feb 2000 14:17:28 GMT""}]","2009-10-31"
"math-ph/0002040","Bernd Kuckert","Bernd Kuckert (University of Amsterdam)","Localization Regions of Local Observables","32 pages, no figures","Commun.Math.Phys. 215 (2000) 197-216","10.1007/s002200000313",,"math-ph math.MP quant-ph",,"  Exploiting the properties of the Jost-Lehmann-Dyson representation, it is
shown that in 1+2 or more spacetime dimensions, a nonempty smallest
localization region can be associated with each local observable (except for
the c-numbers) in a theory of local observables in the sense of Araki, Haag,
and Kastler. Necessary and sufficient conditions are given that observables
with spacelike separated localization regions commute (locality of the net
alone does not yet imply this).
","[{""version"":""v1"",""created"":""Mon, 21 Feb 2000 15:54:48 GMT""},{""version"":""v2"",""created"":""Thu, 18 May 2000 12:20:03 GMT""}]","2009-10-31"
"math/0002162","Charles Livington","Charles Livingston","Maps of surface groups to finite groups with no simple loops in the
  kernel",,"Journal of Knot Theory and its Ramifications 9 (2000), 1029-1036",,,"math.GT",,"  Let $F_g$ denote the closed orientable surface of genus $g$. What is the
least order finite group, $G_g$, for which there is a homomorphism $\psi$ from
$\pi_1(F_g)$ to $G_g$ so that no nontrivial simple closed curve on $F_g$
represents an element in Ker($\psi$)? For the torus it is easily seen that $G_1
= Z_2 \times Z_2$ suffices. We prove here that $G_2$ is a group of order 32 and
that an upper bound for the order of $G_g$ is given by $g^{2g +1}$. The
previously known upper bound was greater than $2^{g{2^{2g}}}$.
","[{""version"":""v1"",""created"":""Sun, 20 Feb 2000 16:37:35 GMT""}]","2010-07-15"
"math/0002163","Sukhov","Alexandre Sukhov","Segre varieties, CR geometry and Lie symmetries of second order PDE
  systems",,,,,"math.CV",,"  We show that biholomorphic automorphisms of a real analytic CR manifold can
be considered as (pointwise) Lie symmetries of a holomorphic second order PDE
system defining its Segre family. This allows to use general methods of the
geometric PDE theory in order to study the CR geometry of real analytic
manifolds.
","[{""version"":""v1"",""created"":""Mon, 21 Feb 2000 01:25:32 GMT""}]","2007-05-23"
"math/0002164","Ezra Getzler","Ezra Getzler (RIMS and Northwestern)","A Darboux theorem for Hamiltonian operators in the formal calculus of
  variations",,,,,"math.DG math-ph math.MP math.SG nlin.SI",,"  We prove a Darboux theorem for formal deformations of Hamiltonian operators
of hydrodynamic type (Dubrovin-Novikov). Not all deformations are equivalent to
the original operator: there is a moduli 2-stack of normal forms.
  The paper utilizes three main concepts:
  1) dg Lie algebras concentrated in degrees [-1,\infty) such as the Schouten
algebra - these give a convenient language for describing deformation problems;
  2) the Deligne 2-groupoid associated to such a dg Lie algebra, which
represents the moduli of formal deformations;
  3) a refined version of the Schouten bracket in the formal calculus of
variations, due to V. O. Soloviev (hep-th/9305133).
","[{""version"":""v1"",""created"":""Mon, 21 Feb 2000 08:00:18 GMT""},{""version"":""v2"",""created"":""Thu, 10 Aug 2000 04:13:46 GMT""}]","2007-05-23"
"math/0002165","Alexander Molev","A. I. Molev and G. I. Olshanski","Degenerate affine Hecke algebras and centralizer construction for the
  symmetric groups","45 pages","J. Algebra 237 (2001), 302--341.",,"University of Sydney SMS-00-05","math.RT math.RA",,"  In our recent papers the centralizer construction was applied to the series
of classical Lie algebras to produce the quantum algebras called (twisted)
Yangians. Here we extend this construction to the series of the symmetric
groups S(n). We study the `stable' properties of the centralizers of S(n-m) in
the group algebra C[S(n)] as n increases with m fixed. We construct a limit
centralizer algebra A and describe its algebraic structure. The algebra A turns
out to be closely related with the degenerate affine Hecke algebras. We also
show that the so-called tame representations of the infinite symmetric group
yield a class of natural A-modules.
","[{""version"":""v1"",""created"":""Mon, 21 Feb 2000 07:04:56 GMT""},{""version"":""v2"",""created"":""Tue, 22 Feb 2000 02:16:45 GMT""}]","2007-05-23"
