"hep-ph/0004106","Dimitar Stamenov","E. Leader, A. V. Sidorov, D. B. Stamenov","On the Sensitivity of the Polarized Parton Densities to Flavour SU(3)
  Symmetry Breaking","7 pages, LaTeX, 5 ps figures","Phys.Lett. B488 (2000) 283-288","10.1016/S0370-2693(00)00895-9",,"hep-ph",,"  Motivated by the possibility that it may be misleading to assume SU(3)
symmetry in the analysis of hyperon \beta-decays, we study the sensitivity of
the polarized parton densities, derived from the world data on inclusive
polarized deep inelastic lepton-nucleon scattering, to variation of the value
of the nonsinglet axial charge a_8 from its SU(3) value of 3F-D.
","[{""version"":""v1"",""created"":""Wed, 12 Apr 2000 06:54:40 GMT""}]","2009-10-31"
"hep-ph/0004107","Dr. Otto C. W. Kong","Otto C.W. Kong (Institute of Physics, Taiwan)","LR Scalar Mixings and One-loop Neutrino Masses","19 pages in JHEP style, with 8 figures incoporated; modified with
  extended discussion and a new appendix. Version to be published in JHEP","JHEP 0009:037,2000","10.1088/1126-6708/2000/09/037",,"hep-ph",,"  Within the framework of the complete theory of supersymmetry without
R-parity, where all possible R-parity violating terms are admitted, we perform
a systematic analytical study of all sources of neutrino masses up to ``direct
one-loop"" (defined explicitly below) level. In the passing, we present the full
result for squark and slepton masses. In particular, there are interesting $LR$
squark and slepton mixings, which involve both bilinear and trilinear R-parity
violating parameters. The existence and important phenomenological implications
of such terms have been largely overlooked in previous studies. In particular,
in the studies under which either one type of the couplings is assumed to
vanish or neglected, the terms would not show up. The $LR$ mixings play a
central role in neutrino mass generation. Our results look straight forward to
be obtained, which, in our opinion, is an illustration of the effectiveness of
our formulation adopted.
","[{""version"":""v1"",""created"":""Wed, 12 Apr 2000 09:09:05 GMT""},{""version"":""v2"",""created"":""Thu, 13 Apr 2000 12:27:53 GMT""},{""version"":""v3"",""created"":""Fri, 30 Jun 2000 10:03:07 GMT""},{""version"":""v4"",""created"":""Thu, 19 Oct 2000 21:42:31 GMT""}]","2014-11-17"
"hep-ph/0004108","Gautam Bhattacharyya","Gautam Bhattacharyya, Subhendu Rakshit, Amitava Raychaudhuri","Cosmological constraints on R-parity violation from neutrino decay","13 pages, Latex, uses axodraw.sty; version to appear in Physical
  Review D","Phys.Rev. D62 (2000) 093007","10.1103/PhysRevD.62.093007","SINP/TNP/00-7, CUPP-00/2","hep-ph",,"  If the neutrino mass is non-zero, as hinted by several experiments, then
R-parity-violating supersymmetric Yukawa couplings can drive a heavy neutrino
decay into lighter states. The heavy neutrino may either decay radiatively into
a lighter neutrino, or it may decay into three light neutrinos through a
Z-mediated penguin. For a given mass of the decaying neutrino, we calculate its
lifetime for the various modes, each mode requiring certain pairs of
R-parity-violating couplings be non-zero. We then check whether the calculated
lifetimes fall in zones allowed or excluded by cosmological requirements. For
the latter case, we derive stringent new constraints on the corresponding
products of R-parity-violating couplings for given values of the decaying
neutrino mass.
","[{""version"":""v1"",""created"":""Wed, 12 Apr 2000 09:54:17 GMT""},{""version"":""v2"",""created"":""Mon, 17 Apr 2000 09:55:15 GMT""},{""version"":""v3"",""created"":""Fri, 30 Jun 2000 17:27:21 GMT""}]","2009-10-31"
"hep-ph/0004109","Anna M. Stasto","J. Kwiecinski, A.D. Martin, A.M. Stasto","Ultrahigh energy neutrino physics","Talk given at Cracow Epiphany Conference on neutrinos in physics and
  astrophysics, 6-9 January 2000, Cracow,Poland; 14 pages, 7 figures","Acta Phys.Polon. B31 (2000) 1273-1285",,,"hep-ph astro-ph",,"  We discuss a problem concerning the ultrahigh energy neutrino propagation
through the Earth. We present calculation of the neutrino-nucleon cross section
at high energies, based on the unifed evolution equation at small x.
  We also show the solution of the transport equation for different neutrino
fluxes originating from active galactic nuclei, gamma ray bursts and top-down
model.
","[{""version"":""v1"",""created"":""Wed, 12 Apr 2000 10:26:49 GMT""}]","2016-09-06"
"hep-ph/0004110","Dr. Otto C. W. Kong","Y.-Y. Keum and Otto C. W. Kong (Inst. of Phys., Taiwan)","R-parity Violating Contribution to Neutron EDM at One-loop Order","11 Revtex pages with 2 figures incoporated; original discussion
  compressed with some further result (beyond gluino diagram) included; version
  accepted to be published in Phys. Rev. Lett","Phys.Rev.Lett. 86 (2001) 393-396","10.1103/PhysRevLett.86.393",,"hep-ph",,"  We present the full result for the down squark mass-squared matrix in the
complete theory of supersymmetry without R-parity where all kind of R-parity
violating terms are admitted without bias. An optimal parametrization, the
single-VEV parametrization, is used. The major result is a new contribution to
$LR$ squark mixing, involving both bilinear and trilinear R-parity violating
couplings. Among other things, the latter leads to neutron electric dipole
moment at one-loop level. Similiar mechanism leading to electron electric
dipole moment at the same level. We present here a short report on major
features of neutron electric dipole moment from supersymmetry without R-parity
and give the interesting constraints obtained.
","[{""version"":""v1"",""created"":""Wed, 12 Apr 2000 10:17:25 GMT""},{""version"":""v2"",""created"":""Wed, 3 Jan 2001 01:13:46 GMT""}]","2009-10-31"
"hep-ph/0004111","Rusko Ruskov","Alexander P. Bakulev (Dubna, JINR), Rusko Ruskov (Dubna, JINR), Klaus
  Goeke (Ruhr U., Bochum), N.G. Stefanis (Ruhr U., Bochum)","Parton Skewed Distributions in the Pion and Quark-Hadron Duality","16 pages, LaTeX, 9 eps figures, revtex, aps, floats, psbox.tex,
  corrected typos, changed slightly text, version to be published in Phys.Rev.D","Phys.Rev.D62:054018,2000","10.1103/PhysRevD.62.054018","JINR-E2-2000-78, RUB-TPII-05/00","hep-ph",,"  Applying arguments based on the operator product expansion for a three-point
correlator and relying on quark-hadron duality, we derive an expression for the
skewed (non-forward) parton distribution in the pion in the case of a
zero-skewedness parameter, {\cal F}^{\psi|\pi}_{\zeta=0}(X;t). We expect that
our result is relevant for moderately large momentum transfers 1 < t < 10
GeV^2. In addition, we construct a purely phenomenological factorized model for
the same quantity in close analogy to Radyushkin's model, originally proposed
for skewed distributions of quarks in the nucleon. Though the quark-hadron
duality approach supports theoretically the factorized model, the two models
exhibit a different behavior in the parton momentum fraction X at any fixed t.
The relevant process to distinguish between the two options seems to be the
WACS off the pion that measures (to leading t/s-order) the inverse moment
<X^{-1}> of the skewed distribution. Even after the inclusion of the first
order kinematic t/s-corrections, the predictions for the cross section \frac{d
\sigma}{d t}(s,t) at c.m.s. scattering angles \vartheta=30^{\circ} and
90^{\circ} differ by factors 3.5--3.9 and 2.9--7.5, respectively, so that a
discrimination appears possible.
","[{""version"":""v1"",""created"":""Wed, 12 Apr 2000 12:03:38 GMT""},{""version"":""v2"",""created"":""Wed, 24 May 2000 18:06:20 GMT""}]","2009-08-25"
"hep-ph/0004112","Elvio Disalvo","Elvio Di Salvo, Michail P. Rekalo, Egle Tomasi-Gustafsson","The $\eta_c\gamma \gamma ^*$ transition form factor in the decay
  $\eta_c\to \gamma \ell^+\ell^-$ and in the crossed channels $\gamma e^-\to
  \eta_c e^- $ and $e^+e^-\to\eta_c\gamma","20 pages, 9 figures","Eur.Phys.J.C16:295-302,2000","10.1007/s100520050022","GEF-Th-3/2000","hep-ph",,"  The Dalitz distribution and the effective mass spectrum of the lepton pair
produced in the decay $\eta_c\to \gamma \ell^+ \ell^-$, as well as the
differential cross sections for the crossed channels $\gamma e^-\to \eta_c e^-
$ and $e^+ e^-\to \eta_c \gamma$, are calculated in terms of the sole
electromagnetic transition form factor for the vertex $\eta_c\to\gamma
\gamma^*$, where $\gamma^*$ is a virtual photon with a space-like (for $\gamma
e^- \to \eta_c e^- $) or a time-like (for $e^+ e^-\to \eta_c \gamma$ and
$\eta_c\to\gamma \ell^+\ell^-$) four-momentum. Explicit parametrisations of the
transition form factor are found in two different approaches, namely in Vector
Dominance Model and in a QCD-inspired consideration on the basis of the process
$c \bar{c}\to \gamma \ell^+ \ell^-$, with zero relative three-momentum of the
annihilating quarks.
","[{""version"":""v1"",""created"":""Wed, 12 Apr 2000 14:14:39 GMT""}]","2011-09-13"
"hep-ph/0004113","Vivian de la Incera","E. J. Ferrer and V. de la Incera","Magnetic Catalysis in the Presence of Scalar Fields","7 pages, revtex. To appear in Phys. Let. B","Phys.Lett. B481 (2000) 287-294","10.1016/S0370-2693(00)00482-2",,"hep-ph",,"  The influence of scalar field interactions in the magnetic catalysis
phenomenom is studied in a gauge theory with scalar and fermion fields. It is
shown that the external magnetic field catalyzes the appearance of a
fermion-antifermion condensate along with a non-zero scalar vev, hence
generating a fermion dynamical mass and breaking the discrete chiral symmetry
of the theory. The model does not require the introduction of a scalar mass
term with a wrong sign in the original Lagrangian to generate the scalar vev,
nor does it exhibit dimensional transmutation ''a la Coleman-Weinberg.'' The
scalar vev noticeably enhances the dynamically generated fermion mass. Possible
cosmological applications of these results are suggested.
","[{""version"":""v1"",""created"":""Wed, 12 Apr 2000 15:13:55 GMT""}]","2009-10-31"
"hep-th/0004068","Clifford V. Johnson","Clifford V. Johnson","Enhancons, Fuzzy Spheres and Multi-Monopoles","25 pages, latex, 3 primary figures, psfig (v2: Omission of references
  to important early work on multi-monopoles is fixed. Note added on possible
  relations to certain other recent work on large N, monopoles, and
  non-commutativity. A few typos fixed.) (v3: Extensive revision. Statements
  about role of Atiyah-Hitchin manifold and instanton corrections refined.
  Speculation about location of Higgs zeros removed. Discussion improved in
  many places.)","Phys.Rev. D63 (2001) 065004","10.1103/PhysRevD.63.065004","DTP/00/29","hep-th",,"  We study the `enhancon', a spherical hypersurface apparently made of
D-branes, which arises in string theory studies of large N SU(N) pure gauge
theories with eight supercharges. When the gauge theory is 2+1 dimensional, the
enhancon is an S^2. A relation to charge N BPS multi-monopoles is exploited to
uncover many of its detailed properties. It is simply a spherical slice through
an Atiyah-Hitchin-like submanifold of the charge $N$ BPS monopole moduli space.
In the form of Nahm data, it is built from the N dimensional irreducible
representation of SU(2). In this sense the enhancon is a non-commutative
sphere, reminiscent of the spherical `dielectric' branes of Myers.
","[{""version"":""v1"",""created"":""Tue, 11 Apr 2000 22:58:29 GMT""},{""version"":""v2"",""created"":""Fri, 14 Apr 2000 20:14:04 GMT""},{""version"":""v3"",""created"":""Tue, 22 Aug 2000 23:33:14 GMT""}]","2009-10-31"
"hep-th/0004076","Matthias Staudacher","Werner Krauth and Matthias Staudacher","Yang-Mills Integrals for Orthogonal, Symplectic and Exceptional Groups","16 pages, LaTeX, REVTEX","Nucl.Phys. B584 (2000) 641-655","10.1016/S0550-3213(00)00382-5","AEI-2000-022","hep-th",,"  We apply numerical and analytic techniques to the study of Yang-Mills
integrals with orthogonal, symplectic and exceptional gauge symmetries. The
main focus is on the supersymmetric integrals, which correspond essentially to
the bulk part of the Witten index for susy quantum mechanical gauge theory. We
evaluate these integrals for D=4 and group rank up to three, using Monte Carlo
methods. Our results are at variance with previous findings. We further compute
the integrals with the deformation technique of Moore, Nekrasov and
Shatashvili, which we adapt to the groups under study. Excellent agreement with
all our numerical calculations is obtained. We also discuss the convergence
properties of the purely bosonic integrals.
","[{""version"":""v1"",""created"":""Tue, 11 Apr 2000 16:18:25 GMT""}]","2009-10-31"
"hep-th/0004077","Dietmar Klemm","S. Cacciatori, D. Klemm, W. A. Sabra, and D. Zanon","Entropy of Black Holes in D=5, N=2 Supergravity and AdS Central Charges","25 pages, Latex, no figures, references added","Nucl.Phys. B587 (2000) 277-298","10.1016/S0550-3213(00)00461-2","IFUM 657/FT, CAMS/00-04","hep-th",,"  We consider general black holes in D=5, N=2 supergravity coupled to vector
multiplets, and discuss the issue of microstate counting from various
viewpoints. The statistical entropy is computed for the near-extremal case
using the central charge of the $AdS_2$ factor appearing in the near-horizon
geometry. Furthermore, we explicitly construct the duality transformation
connecting electrically charged black holes to magnetically charged black
strings, under which the $AdS_2 \times S^3$ near horizon geometry becomes
$AdS_3 \times S^2$. For $AdS_3$ the counting of microstates correctly
reproduces the Bekenstein-Hawking entropy, thus resolving the discrepancy
previously found for $AdS_2$.
","[{""version"":""v1"",""created"":""Tue, 11 Apr 2000 17:28:55 GMT""},{""version"":""v2"",""created"":""Tue, 2 May 2000 10:15:09 GMT""}]","2009-10-31"
"hep-th/0004078","Pedro Castelo Ferreira","P. Castelo Ferreira, Ian I. Kogan and Bayram Tekin","Toroidal Compactification in String Theory from Chern-Simons Theory","32+2 pages, 9 figures. Comments added and minor changes in section 3.
  Content not altered","Nucl.Phys.B589:167-195,2000","10.1016/S0550-3213(00)00407-7","OUTP-00-14P","hep-th",,"  A detailed study of the charge spectrum of three dimensional Abelian
Topological Massive Gauge Theory (TMGT) is given. When this theory is defined
on a manifold with two disconnected boundaries there are induced chiral
Conformal Field Theories (CFT's) on the boundaries which can be interpreted as
the left and right sectors of closed strings. We show that Narain constraints
on toroidal compactification (integer, even, self-dual momentum lattice) have a
natural interpretation in purely three dimensional terms. This is an important
result which is necessary to construct toroidal compactification and heterotic
string from Topological Membrane (TM) approach to string theory. We also derive
the block structure of $c=1$ Rational Conformal Field Theory (RCFT) from the
three dimensional gauge theory.
","[{""version"":""v1"",""created"":""Tue, 11 Apr 2000 22:43:38 GMT""},{""version"":""v2"",""created"":""Wed, 21 Jun 2000 18:02:17 GMT""}]","2014-11-18"
"hep-th/0004079",,"C.R. Hagen","Reply to comment on Casimir energy for spherical boundaries","3 pages, no figures, latex",,,,"hep-th quant-ph",,"  It is shown that the recent criticism of Brevik et al. (hep-th/0004041) is in
error.
","[{""version"":""v1"",""created"":""Tue, 11 Apr 2000 18:53:26 GMT""}]","2007-05-23"
"hep-th/0004080","Miguel Vazquez Mozo","G. Arcioni, J.L.F. Barbon, Joaquim Gomis and M.A. Vazquez-Mozo","On the stringy nature of winding modes in noncommutative thermal field
  theories","24 pages, harvmac, epsf. 5 postscript figures included","JHEP 0006 (2000) 038","10.1088/1126-6708/2000/06/038","CERN-TH/2000-114, DFTT 15/2000, SPIN-2000/13, UB-ECM-PF-00/06,
  ITFA-2000-08","hep-th",,"  We show that thermal noncommutative field theories admit a version of
`channel duality' reminiscent of open/closed string duality, where non-planar
thermal loops can be replaced by an infinite tower of tree-level exchanges of
effective fields. These effective fields resemble closed strings in three
aspects: their mass spectrum is that of closed-string winding modes, their
interaction vertices contain extra moduli, and they can be regarded as
propagating in a higher-dimensional `bulk' space-time. In noncommutative models
that can be embedded in a D-brane, we show the precise relation between the
effective `winding fields' and closed strings propagating off the D-brane. The
winding fields represent the coherent coupling of the infinite tower of
closed-string oscillator states. We derive a sum rule that expresses this
effective coupling in terms of the elementary couplings of closed strings to
the D-brane. We furthermore clarify the relation between the effective
propagating dimension of the winding fields and the true codimension of the
D-brane.
","[{""version"":""v1"",""created"":""Tue, 11 Apr 2000 18:53:34 GMT""},{""version"":""v2"",""created"":""Tue, 11 Apr 2000 23:20:10 GMT""}]","2009-10-31"
"hep-th/0004081","Christian Hilmoine","Christian Hilmoine, Rune Niclasen","The Microscopic Spectral Density of the Dirac Operator derived from
  Gaussian Orthogonal and Symplectic Ensembles","35 pages, 8 figures, Some equations simplified","Phys.Rev. D62 (2000) 096013","10.1103/PhysRevD.62.096013",,"hep-th",,"  The microscopic spectral correlations of the Dirac operator in Yang-Mills
theories coupled to fermions in (2+1) dimensions can be related to three
universality classes of Random Matrix Theory. In the microscopic limit the
Orthogonal Ensemble (OE) corresponds to a theory with 2 colors and fermions in
the fundamental representation and the Symplectic Ensemble (SE) corresponds to
an arbitrary number of colors and fermions in the adjoint representation. Using
a new method of Widom, we derive an expression for the two scalar kernels which
through quaternion determinants give all spectral correlation functions in the
Gaussian Orthogonal Ensemble (GOE) and in the the Gaussian Symplectic Ensemble
(GSE) with all fermion masses equal to zero. The result for the GOE is valid
for an arbitrary number of fermions while for the GSE we have results for an
even number of fermions.
","[{""version"":""v1"",""created"":""Tue, 11 Apr 2000 19:45:19 GMT""},{""version"":""v2"",""created"":""Fri, 12 May 2000 11:09:48 GMT""}]","2009-10-31"
"hep-th/0004082","R. Kantowski","H. T. Cho and R. Kantowski","Vilkovisky-DeWitt Effective Action for Einstein Gravity on Kaluza-Klein
  Spacetimes $M^4\times S^N$","37 pages, no figures","Phys.Rev. D62 (2000) 124003","10.1103/PhysRevD.62.124003",,"hep-th",,"  We evaluate the divergent part of the Vilkovisky-DeWitt effective action for
Einstein gravity on even-dimensional Kaluza-Klein spacetimes of the form
$M^{4}\times S^{N}$. Explicit results are given for $N$=2, 4, and 6. Trace
anomalies for gravitons are also given for these cases. Stable Kaluza-Klein
configurations are sought, unsuccessfully, assuming the divergent part of the
effective action dominates the dynamics.
","[{""version"":""v1"",""created"":""Tue, 11 Apr 2000 19:40:56 GMT""},{""version"":""v2"",""created"":""Wed, 16 Aug 2000 01:58:56 GMT""}]","2009-10-31"
"hep-th/0004083","Marty Stock","R. Jackiw and A.P. Polychronakos","Supersymmetric Fluid Mechanics","12 pages, REVtex, amssym macros; publication version for Phys Rev D;
  email to jackiw@mitlns.mit.edu","Phys.Rev. D62 (2000) 085019","10.1103/PhysRevD.62.085019","MIT-CTP-2943","hep-th math-ph math.MP physics.flu-dyn",,"  When anticommuting Grassmann variables are introduced into a fluid dynamical
model with irrotational velocity and no vorticity, the velocity acquires a
nonvanishing curl and the resultant vorticity is described by Gaussian
potentials formed from the Grassmann variables. Upon adding a further specific
interaction with the Grassmann degrees of freedom, the model becomes
supersymmetric.
","[{""version"":""v1"",""created"":""Tue, 11 Apr 2000 20:36:35 GMT""},{""version"":""v2"",""created"":""Tue, 2 May 2000 20:31:27 GMT""},{""version"":""v3"",""created"":""Mon, 17 Jul 2000 20:17:40 GMT""}]","2009-10-31"
"hep-th/0004084","Marty Stock","R. Jackiw, V.P. Nair, So-Young Pi","Chern-Simons Reduction and non-Abelian Fluid Mechanics","12 pages, REVTeX; revised for publication in Phys Rev D; email to
  jackiw@mitlns.mit.edu","Phys.Rev.D62:085018,2000","10.1103/PhysRevD.62.085018","MIT-CTP-2971, BU HEP-00-06","hep-th hep-ph math-ph math.MP physics.flu-dyn",,"  We propose a non-Abelian generalization of the Clebsch parameterization for a
vector in three dimensions. The construction is based on a group-theoretical
reduction of the Chern-Simons form on a symmetric space. The formalism is then
used to give a canonical (symplectic) discussion of non-Abelian fluid
mechanics, analogous to the way the Abelian Clebsch parameterization allows a
canonical description of conventional fluid mechanics.
","[{""version"":""v1"",""created"":""Tue, 11 Apr 2000 20:44:57 GMT""},{""version"":""v2"",""created"":""Tue, 2 May 2000 20:25:24 GMT""},{""version"":""v3"",""created"":""Mon, 17 Jul 2000 20:30:08 GMT""}]","2014-11-18"
"hep-th/0004085","Frederic Zamora","Frederic Zamora","On the Operator Product Expansion in Noncommutative Quantum Field Theory","15 pages, six figures. LaTeX, JHEP class. Minor improvements, typos
  corrected. To be published in JHEP","JHEP 0005 (2000) 002","10.1088/1126-6708/2000/05/002","UTTG-06-00","hep-th",,"  Motivated by the mixing of UV and IR effects, we test the OPE formula in
noncommutative field theory. First we look at the renormalization of local
composite operators, identifying some of their characteristic IR/UV
singularities. Then we find that the product of two fields in general cannot be
described by a series expansion of single local operator insertions.
","[{""version"":""v1"",""created"":""Tue, 11 Apr 2000 22:18:30 GMT""},{""version"":""v2"",""created"":""Mon, 1 May 2000 19:00:44 GMT""}]","2009-10-31"
"hep-th/0004086","C. M. Hull","C.M. Hull","BPS Supermultiplets in Five Dimensions","Pages, Tex, Phyzzx Macro. Minor corrections, extra reference","JHEP 0006 (2000) 019","10.1088/1126-6708/2000/06/019","RUNHETC-2000-11, QMW-00-02","hep-th",,"  BPS representations of 5-dimensional supersymmetry algebras are classified.
For BPS states preserving 1/2 the supersymmetry, there are two distinct classes
of multiplets for N=4 supersymmetry and three classes for N=8 supersymmetry.
For N=4 matter theories, the two 1/2 supersymmetric BPS multiplets are the
massive vector multiplet and the massive self-dual 2-form multiplet. Some
applications to super-Yang-Mills, supergravity and little string theories are
considered.
","[{""version"":""v1"",""created"":""Tue, 11 Apr 2000 22:39:39 GMT""},{""version"":""v2"",""created"":""Wed, 5 Jul 2000 14:18:49 GMT""}]","2009-10-31"
"hep-th/0004087","Arkady Vainshtein","A. Gorsky, A. Vainshtein, and A. Yung","Deconfinement at the Argyres-Douglas point in SU(2) gauge theory with
  broken N=2 supersymmetry","LaTeX file, 21 pages, no figures. Dependence of monopole condensate
  on Yukawa coupling is corrected, references added","Nucl.Phys. B584 (2000) 197-215","10.1016/S0550-3213(00)00349-7","TPI-MINN-00/13, UMN-TH-1847/00, ITEP-TH-16/00","hep-th",,"  We consider chiral condensates in SU(2) gauge theory with broken N=2
supersymmetry. The matter sector contains an adjoint multiplet and one
fundamental flavor. Matter and gaugino condensates are determined by
integrating out the adjoint field. The only nonperturbative input is the
Affleck-Dine-Seiberg (ADS) superpotential generated by one instanton plus the
Konishi anomaly. These results are consistent with those obtained by the
`integrating in' procedure, including a reproduction of the Seiberg-Witten
curve from the ADS superpotential. We then calculate monopole, dyon, and charge
condensates using the Seiberg-Witten approach. We show that the monopole and
charge condensates vanish at the Argyres-Douglas point where the monopole and
charge vacua collide. We interpret this phenomenon as a deconfinement of
electric and magnetic charges at the Argyres-Douglas point.
","[{""version"":""v1"",""created"":""Wed, 12 Apr 2000 01:38:58 GMT""},{""version"":""v2"",""created"":""Wed, 19 Apr 2000 22:46:25 GMT""}]","2009-10-31"
"hep-th/0004088","Albert Schwarz","Albert Schwarz (UCDavis)","Noncommutative Algebraic Equations and Noncommutative Eigenvalue Problem","8 pages. Misprints corrected, references added","Lett.Math.Phys. 52 (2000) 177-184",,,"hep-th math.RA",,"  We analyze the perturbation series for noncommutative eigenvalue problem
$AX=X\lambda$ where $\lambda$ is an element of a noncommutative ring, $ A$ is a
matrix and $X$ is a column vector with entries from this ring. As a corollary
we obtain a theorem about the structure of perturbation series for Tr $x^r$
where $x$ is a solution of noncommutative algebraic equation (for $r=1$ this
theorem was proved by Aschieri, Brace, Morariu, and Zumino, hep-th/0003228, and
used to study Born-Infeld lagrangian for the gauge group $U(1)^k$).
","[{""version"":""v1"",""created"":""Wed, 12 Apr 2000 05:12:38 GMT""},{""version"":""v2"",""created"":""Thu, 27 Apr 2000 06:48:48 GMT""}]","2007-05-23"
