"cond-mat/0004182","Hans A. Engel","Guido Burkard, Hans-Andreas Engel, and Daniel Loss","Spintronics and Quantum Dots for Quantum Computing and Quantum
  Communication","Prepared for Fortschritte der Physik special issue, Experimental
  Proposals for Quantum Computation. 15 pages, 5 figures; typos corrected,
  references added",,"10.1002/1521-3978(200009)48:9/11<965::AID-PROP965>3.0.CO;2-V",,"cond-mat.mes-hall",,"  Control over electron-spin states, such as coherent manipulation, filtering
and measurement promises access to new technologies in conventional as well as
in quantum computation and quantum communication. We review our proposal of
using electron spins in quantum confined structures as qubits and discuss the
requirements for implementing a quantum computer. We describe several
realizations of one- and two-qubit gates and of the read-in and read-out tasks.
We discuss recently proposed schemes for using a single quantum dot as
spin-filter and spin-memory device. Considering electronic EPR pairs needed for
quantum communication we show that their spin entanglement can be detected in
mesoscopic transport measurements using metallic as well as superconducting
leads attached to the dots.
","[{""version"":""v1"",""created"":""Tue, 11 Apr 2000 17:42:40 GMT""},{""version"":""v2"",""created"":""Thu, 8 Jun 2000 13:19:52 GMT""}]","2015-06-24"
"cond-mat/0004183","Mark O. Robbins","Belita Koiller and Mark O. Robbins","Morphology transitions in three-dimensional domain growth with Gaussian
  random fields","8 pages, 10 figures, submitted to Phys. Rev. B",,"10.1103/PhysRevB.62.5771",,"cond-mat.dis-nn cond-mat.stat-mech",,"  We study the morphology of magnetic domain growth in disordered three
dimensional magnets. The disordered magnetic material is described within the
random-field Ising model with a Gaussian distribution of local fields with
width $\Delta$. Growth is driven by a uniform applied magnetic field, whose
value is kept equal to the critical value $H_c(\Delta)$ for the onset of steady
motion. Two growth regimes are clearly identified. For low $\Delta$ the growing
domain is compact, with a self-affine external interface. For large $\Delta$ a
self-similar percolation-like morphology is obtained. A multi-critical point at
$(\Delta_c$, $H_c(\Delta_c))$ separates the two types of growth. We extract the
critical exponents near $\Delta_c$ using finite-size scaling of different
morphological attributes of the external domain interface. We conjecture that
the critical disorder width also corresponds to a maximum in $H_c(\Delta)$.
","[{""version"":""v1"",""created"":""Tue, 11 Apr 2000 18:41:20 GMT""}]","2009-10-31"
"cond-mat/0004184","Stefano Sanvito","Stefano Sanvito and Nicola A. Hill","Can half metallic zincblende MnAs be grown?","11 pages, 12 figures",,,,"cond-mat.mes-hall cond-mat.mtrl-sci",,"  In this paper we investigate theoretically the ground state NiAs-type
structure of MnAs and we compare the magnetic and structural properties with an
hypothetical zincblende structure. A zincblende structure can be obtained, in
principle, from the diluted magnetic semiconductor Ga$_{1-x}$Mn$_x$As in the
limit $x=1$. Using density functional calculations within the local
spin-density approximation (LSDA), we show that the zincblende structure,
although showing half metallic behavior which is very attractive for
spintronics, can not be stabilized at equilibrium. We perform a tight-binding
analysis of the Mn-As bond in the tetrahedral coordination to investigate the
nature of the bonding in diluted magnetic semiconductors.
","[{""version"":""v1"",""created"":""Tue, 11 Apr 2000 19:08:28 GMT""}]","2007-05-23"
"cond-mat/0004185","J. R. Kirtley","C.C. Tsuei and J.R. Kirtley (IBM Yorktown Heights)","d-wave pairing symmetry in cuprate superconductors","4 pages, M2S 2000 conference proceedings",,"10.1016/S0921-4534(00)01486-6",,"cond-mat.supr-con",,"  Phase-sensitive tests of pairing symmetry have provided strong evidence for
predominantly d-wave pairing symmetry in both hole- and electron-doped high-Tc
cuprate superconductors. Temperature dependent measurements in YBCO indicate
that the d-wave pairing dominates, with little if any imaginary component, at
all temperatures from 0.5K through Tc. In this article we review some of this
evidence and discuss the implications of the universal d-wave pairing symmetry
in the cuprates.
","[{""version"":""v1"",""created"":""Tue, 11 Apr 2000 20:15:40 GMT""}]","2009-10-31"
"cond-mat/0004186","Charles Buhler","Charles Buhler, Seiji Yunoki, Adriana Moreo","Effect of Non-Magnetic Impurities (Zn,Li) in a Hole Doped Spin-Fermion
  Model for Cuprates","Four pages with four figures embedded in text",,"10.1103/PhysRevB.62.R3620",,"cond-mat.str-el",,"  The effect of adding non-magnetic impurities (NMI), such as Zn or Li, to
high-Tc cuprates is studied applying Monte Carlo techniques to a spin-fermion
model. It is observed that adding Li is qualitatively similar to doping with
equal percentages of Sr and Zn. The mobile holes (MH) are trapped by the NMI
and the system remains insulating and commensurate with antiferromagnetic (AF)
correlations. This behavior persists in the region %NMI > %MH. On the other
hand, when %NMI < %MH magnetic and charge incommensurabilities are observed.
The vertical or horizontal hole-rich stripes, present when % NMI=0 upon hole
doping, are pinned by the NMI and tend to become diagonal, surrounding finite
AF domains. The %MH-%NMI plane is investigated. Good agreement with
experimental results is found in the small portion of this diagram where
experimental data are available. Predictions about the expected behavior in the
remaining regions are made.
","[{""version"":""v1"",""created"":""Tue, 11 Apr 2000 20:21:54 GMT""}]","2009-10-31"
"cond-mat/0004187","Chris Pethick","C. J. Pethick (NORDITA, Denmark) and L. P. Pitaevskii (Trento, Italy
  and Moscow, Russia)","On the criterion for Bose-Einstein condensation for particles in traps","2 pages, RevTex, Submitted to Phys. Rev. A","Phys.Rev.A62:033609,2000","10.1103/PhysRevA.62.033609","NORDITA preprint - 2000/31 CM","cond-mat",,"  We consider the criterion for Bose condensation for particles in a harmonic
trap. For a fixed angular momentum, the lowest energy state for a cloud of
bosons with attractive interactions is the ground state of the cloud with all
the angular momentum in the center-of-mass motion, and the one-particle reduced
density matrix generally does not have a single large eigenvalue, but a number
of them, suggesting that the state is an example of a fragmented condensate
(Wilkin, Gunn, and Smith, Phys. Rev. Lett. 80, 2265 (1998)). We show that a
convenient way to describe correlations in the system is by defining an
internal one-particle reduced density matrix, in which the center-of-mass
motion is eliminated, and that this has a single eigenvalue equal to the number
of particles for the problem considered here. Our considerations indicate that
care is necessary in formulating a criterion for Bose-Einstein condensation.
","[{""version"":""v1"",""created"":""Wed, 12 Apr 2000 15:23:11 GMT""}]","2009-02-05"
"cond-mat/0004188","Alessandro Vezzani","R. Burioni, D. Cassi, A. Vezzani","The Type-problem on the Average for random walks on graphs","10 pages, 3 figures. to appear on EPJ B",,"10.1007/s100510051170",,"cond-mat.stat-mech",,"  When averages over all starting points are considered, the Type Problem for
the recurrence or transience of a simple random walk on an inhomogeneous
network in general differs from the usual ""local"" Type Problem. This difference
leads to a new classification of inhomogeneous discrete structures in terms of
{\it recurrence} and {\it transience} {\it on the average}, describing their
large scale topology from a ""statistical"" point of view. In this paper we
analyze this classification and the properties connected to it, showing how the
average behavior affects the thermodynamic properties of statistical models on
graphs.
","[{""version"":""v1"",""created"":""Wed, 12 Apr 2000 08:33:59 GMT""}]","2009-10-31"
"cond-mat/0004189","luis Brey","L.Brey and F.Guinea","Phase Diagram of Diluted Magnetic Semiconductor Quantum Wells","4 pages, 3 figures included",,"10.1103/PhysRevLett.85.2384",,"cond-mat.mes-hall cond-mat.str-el",,"  The phase diagram of diluted magnetic semiconductor quantum wells is
investigated. The interaction between the carriers in the hole gas can lead to
first order ferromagnetic transitions, which remain abrupt in applied fields.
These transitions can be induced by magnetic fields or, in double-layer systems
by electric fields. We make a number of precise experimental predictions for
observing these first order phase transitions.
","[{""version"":""v1"",""created"":""Wed, 12 Apr 2000 08:53:06 GMT""}]","2009-10-31"
"cond-mat/0004190","Oded Agam","Oded Agam and Boris L. Altshuler","""Scars"" in parametrically excited surface waves","4 pages, figures included","Physica A 302 (2001) 310-317","10.1016/S0378-4371(01)00453-8",,"cond-mat nlin.CD nlin.PS",,"  We consider the Faraday surface waves of a fluid in a container with a
non-integrable boundary shape. We show that, at sufficiently low frequencies,
the wave patterns are ``scars'' selected by the instability of the
corresponding periodic orbits, the dissipation at the container side walls, and
interaction effects which reflect the nonlinear nature of the Faraday waves.
The results explain the observation of a limited number of scars with anomalous
strengths in recent experiments by Kudrolli, Abraham and Gollub.
","[{""version"":""v1"",""created"":""Wed, 12 Apr 2000 09:01:41 GMT""}]","2009-10-31"
"cond-mat/0004191","Raffaella Burioni","R. Burioni, D. Cassi, C. Destri","Spectral partitions on infinite graphs","8 pages, to appear on Journal of Physics A",,"10.1088/0305-4470/33/19/301",,"cond-mat.stat-mech",,"  Statistical models on infinite graphs may exhibit inhomogeneous thermodynamic
behaviour at macroscopic scales. This phenomenon is of geometrical origin and
may be properly described in terms of spectral partitions into subgraphs with
well defined spectral dimensions and spectral weights. These subgraphs are
shown to be thermodynamically homogeneous and effectively decoupled.
","[{""version"":""v1"",""created"":""Wed, 12 Apr 2000 09:02:01 GMT""}]","2015-06-24"
"cond-mat/0004192","M. C. Gordillo","M.C. Gordillo, J. Boronat and J. Casulleras","Zero-temperature equation of state of quasi-one dimensional H2","5 pages, 4 figures, 2 Tables",,"10.1103/PhysRevLett.85.2348",,"cond-mat",,"  We have studied molecular hydrogen in a pure 1D geometry and inside a narrow
carbon nanotube by means of the diffusion Monte Carlo method. The
one-dimensionality of H2 in the nanotube is well maintained in a large density
range, this system being closer to an ideal 1D fluid than liquid 4He in the
same setup. H2 shares with 4He the existence of a stable liquid phase and a
quasi-continuous liquid-solid transition at very high linear densities.
","[{""version"":""v1"",""created"":""Wed, 12 Apr 2000 09:16:29 GMT""}]","2009-10-31"
"cond-mat/0004193","Hiroshi Frusawa","H. Frusawa, R. Hayakawa (Univ. of Tokyo)","Generalizing the Debye-Huckel equation in terms of density functional
  integral","5 pages, RevTex, to be published in Phys. Rev. E",,"10.1103/PhysRevE.61.R6079",,"cond-mat.soft cond-mat.stat-mech",,"  We discuss the validity of generalized Debye-H\""uckel (GDH) equation proposed
by Fisher {\itshape et al.} from the functional integral point of view. The GDH
theory considers fluctuations around prescribed densities of positive and
negative charges. Hence we first formulate a density functional integral
expression for the canonical system of Coulomb gas, and also demonstrate that
this is a dual form to the Sine-Gordon theory. Our formalism reveals the
following: (i) The induced charge distribution around supposed density favors
not only the cancellation of additional electrostatic potential like the
original DH theory, but also the countervailing of chemical potential
difference between imposed and equilibrium value. (ii) As a consequence
apparent charge, absent in the GDH equation, comes out in our generalized
equation. (iii) That is, the GDH equation holds only in special cases.
","[{""version"":""v1"",""created"":""Wed, 12 Apr 2000 09:42:04 GMT""},{""version"":""v2"",""created"":""Thu, 13 Apr 2000 06:19:03 GMT""}]","2009-10-31"
"cond-mat/0004194","Martin Rost","Martin Rost","Growth enhanced surface diffusion and elastic instability on amorphous
  solids","4 pages, 1 figure",,,,"cond-mat.stat-mech cond-mat.mtrl-sci",,"  A continuum model for growth of solids is developed, considering adatom
deposition, surface diffusion, and configuration dependent incorporation rate.
For amorphous solids it is related to surface energy densities. The high adatom
density leads to growth enhanced dynamics of (a) Mullins' classical equation
[J. Appl. Phys. {\bf 28}, 333 (1957)] without, and (b) of the
Asaro-Tiller-Grinfeld-Srolovitz instability with lateral stress in the growing
film. The latter mechanism is attributed to morphologies found in recent
experiments.
","[{""version"":""v1"",""created"":""Wed, 12 Apr 2000 11:07:31 GMT""},{""version"":""v2"",""created"":""Tue, 18 Apr 2000 07:59:40 GMT""}]","2007-05-23"
"cond-mat/0004195","Georg Foltin","Georg Foltin","The crumpling transition of membranes driven by quantum fluctuations in
  a D=epsilon expansion","5 pages, no figure, published version","J.Phys.A34:7511-7515,2001","10.1088/0305-4470/34/37/306",,"cond-mat.soft",,"  We consider a D-dimensional fluid membrane in a D+1-dimensional embedding
space, subject to quantum fluctuations. The corresponding action is invariant
under coordinate transformations and depends only on the shape of the membrane
and its variation, neglecting tangential degrees of freedom. We calculate the
resulting field theory to one loop order in a D=epsilon expansion and find a
quantum transition even at T=0.
","[{""version"":""v1"",""created"":""Wed, 12 Apr 2000 12:53:58 GMT""},{""version"":""v2"",""created"":""Wed, 31 May 2000 12:23:32 GMT""},{""version"":""v3"",""created"":""Mon, 24 Sep 2001 09:18:59 GMT""}]","2008-11-26"
"cond-mat/0004196","Damien Challet","Damien Challet and Matteo Marsili","Relevance of memory in Minority Games","10 pages, 9 figures, using RevTex",,"10.1103/PhysRevE.62.1862",,"cond-mat.stat-mech cond-mat.dis-nn",,"  By considering diffusion on De Bruijn graphs, we study in details the
dynamics of the histories in the Minority Game, a model of competition between
adaptative agents. Such graphs describe the structure of temporal evolution of
$M$ bits strings, each node standing for a given string, i.e. a history in the
Minority Game. We show that the frequency of visit of each history is not given
by $1/2^M$ in the limit of large $M$ when the transition probabilities are
biased. Consequently all quantities of the model do significantly depend on
whether the histories are real, or uniformly and randomly sampled. We expose a
self-consistent theory of the case of real histories, which turns out to be in
very good agreement with numerical simulations.
","[{""version"":""v1"",""created"":""Wed, 12 Apr 2000 13:10:06 GMT""}]","2009-10-31"
"cond-mat/0004197","Peter Samuelsson","P. Samuelsson and H. Schomerus","Large sample-to-sample fluctuations of the nonequilibrium critical
  current through mesoscopic Josephson junctions","4 pages, 3 figures","Phys. Rev. B 63, 054512 (2001)","10.1103/PhysRevB.63.054512",,"cond-mat.supr-con",,"  We present a theory for the nonequilibrium current in a mesoscopic Josephson
junction which is coupled to a normal electron reservoir, and apply it to a
chaotic junction. Large sample-to-sample fluctuations of the critical current
$I_{\rm c}$ are found, with ${rms} I_{\rm c} \simeq \sqrt{N}e\Delta/\hbar$,
when the voltage difference eV between the electron reservoir and the junction
exceeds the superconducting gap $\Delta$ and the number of modes N connecting
the junction to the superconducting electrodes is large.
","[{""version"":""v1"",""created"":""Wed, 12 Apr 2000 13:44:02 GMT""}]","2007-05-23"
"cond-mat/0004199","Nelson Augusto Alves","Nelson A. Alves, J. R. Drugowich de Felicio, Ulrich H.E. Hansmann","Partition function zeros and leading order scaling correction of the 3D
  Ising model from multicanonical simulations","22 pages, Latex, package graphicx, with 5 eps figures","J.Phys.A33:7489-7498,2000","10.1088/0305-4470/33/42/302",,"cond-mat.stat-mech hep-lat",,"  The density of states for the three-dimensional Ising model is calculated
with high-precision from multicanonical simulations. This allows us to estimate
the leading partition function zeros for lattice sizes up to L=32. Combining
previous statistics for smaller lattice sizes, we have evaluated the correction
to scaling and the critical exponent $\nu$ through out an analysis of a
multi-parameter fit and of Bulirsch-Stoer (BST) extrapolation algorithm. The
performance of the BST algorithm is also explored in case of the 2D Ising
model, where the exact partition function zeros are known.
","[{""version"":""v1"",""created"":""Wed, 12 Apr 2000 14:41:39 GMT""}]","2008-11-26"
"gr-qc/0004032","Piotr Chrusciel","Piotr T. Chrusciel, Walter Simon","Towards the classification of static vacuum spacetimes with negative
  cosmological constant","the discussion of our results includes now some solutions of Horowitz
  and Myers; typos corrected here and there; a shortened version of this
  version will appear in Journal of Mathematical Physics","J.Math.Phys.42:1779-1817,2001","10.1063/1.1340869",,"gr-qc",,"  We present a systematic study of static solutions of the vacuum Einstein
equations with negative cosmological constant which asymptotically approach the
generalized Kottler (``Schwarzschild--anti-de Sitter'') solution, within
(mainly) a conformal framework. We show connectedness of conformal infinity for
appropriately regular such space-times. We give an explicit expression for the
Hamiltonian mass of the (not necessarily static) metrics within the class
considered; in the static case we show that they have a finite and well defined
Hawking mass. We prove inequalities relating the mass and the horizon area of
the (static) metrics considered to those of appropriate reference generalized
Kottler metrics. Those inequalities yield an inequality which is opposite to
the conjectured generalized Penrose inequality. They can thus be used to prove
a uniqueness theorem for the generalized Kottler black holes if the generalized
Penrose inequality can be established.
","[{""version"":""v1"",""created"":""Tue, 11 Apr 2000 16:39:20 GMT""},{""version"":""v2"",""created"":""Sun, 26 Nov 2000 09:45:57 GMT""}]","2011-05-12"
"gr-qc/0004033","Alfonso F. Agnew","Alfonso F. Agnew and Tevian Dray","Distributional Modes for Scalar Field Quantization","15 pages, RevTeX","Gen.Rel.Grav. 33 (2001) 429-453","10.1023/A:1010236506377","MATH-SMU-00-06","gr-qc",,"  We propose a mode-sum formalism for the quantization of the scalar field
based on distributional modes, which are naturally associated with a slight
modification of the standard plane-wave modes. We show that this formalism
leads to the standard Rindler temperature result, and that these modes can be
canonically defined on any Cauchy surface.
","[{""version"":""v1"",""created"":""Tue, 11 Apr 2000 20:59:54 GMT""}]","2015-06-25"
"gr-qc/0004034","Jerry B. Griffiths","G. A. Alekseev and J. B. Griffiths","Infinite hierarchies of exact solutions of the Einstein and
  Einstein-Maxwell equations for interacting waves and inhomogeneous
  cosmologies","7 pages, minor correction and reduction to conform with published
  version","Phys.Rev.Lett.84:5247-5250,2000","10.1103/PhysRevLett.84.5247",,"gr-qc",,"  For space-times with two spacelike isometries, we present infinite
hierarchies of exact solutions of the Einstein and Einstein--Maxwell equations
as represented by their Ernst potentials. This hierarchy contains three
arbitrary rational functions of an auxiliary complex parameter. They are
constructed using the so called `monodromy transform' approach and our new
method for the solution of the linear singular integral equation form of the
reduced Einstein equations. The solutions presented, which describe
inhomogeneous cosmological models or gravitational and electromagnetic waves
and their interactions, include a number of important known solutions as
particular cases.
","[{""version"":""v1"",""created"":""Wed, 12 Apr 2000 08:59:40 GMT""},{""version"":""v2"",""created"":""Tue, 27 Jun 2000 11:37:11 GMT""}]","2008-11-26"
"hep-ex/0004015","Yuichi Oyama","Yuichi Oyama (for K2K collaboration)","Current status of K2K long-baseline neutrino-oscillation experiment","8 pages, 5 figures, Talk at XXXV Rencontres de Moriond ""Electroweak
  interactions and unified theories"", Les Arcs, Savoie, France, March 11-18,
  2000",,,"KEK Preprint 2000-7","hep-ex",,"  The K2K (KEK to Kamioka) long-baseline neutrino-oscillation experiment was
successfully started in early 1999. A total intensity of 7.20 x 10^18 protons
on target, which is about 7% of the goal of the experiment, was accumulated in
39.4 days of data-taking in 1999. We obtained 3 neutrino events in the fiducial
volume of the Super-Kamiokande detector, whereas the expectation based on
observations in the front detectors is 12.3 +1.7/-1.9. An analysis of
oscillation searches from the view points of absolute event numbers, distortion
of neutrino energy spectrum, and nu_e/nu_mu ratio is in progress.
","[{""version"":""v1"",""created"":""Wed, 12 Apr 2000 07:18:37 GMT""}]","2007-05-23"
"hep-lat/0004007","Massimo Di Pierro","Massimo Di Pierro","Matrix Distributed Processing: A set of C++ Tools for implementing
  generic lattice computations on parallel systems","Minor esthetical modifications from previous versions","Comput.Phys.Commun. 141 (2001) 98-148","10.1016/S0010-4655(01)00297-1","FERMILAB-PUB-00-079-T","hep-lat cs.DC cs.MS physics.comp-ph",,"  We present a set of programming tools (classes and functions written in C++
and based on Message Passing Interface) for fast development of generic
parallel (and non-parallel) lattice simulations. They are collectively called
MDP 1.2.
  These programming tools include classes and algorithms for matrices, random
number generators, distributed lattices (with arbitrary topology), fields and
parallel iterations. No previous knowledge of MPI is required in order to use
them.
  Some applications in electromagnetism, electronics, condensed matter and
lattice QCD are presented.
","[{""version"":""v1"",""created"":""Tue, 11 Apr 2000 22:59:10 GMT""},{""version"":""v2"",""created"":""Tue, 11 Apr 2000 23:10:00 GMT""},{""version"":""v3"",""created"":""Thu, 26 Apr 2001 19:58:03 GMT""},{""version"":""v4"",""created"":""Tue, 14 Aug 2001 22:19:11 GMT""}]","2009-10-31"
"hep-lat/0004008","Oleg Mogilevsky","O. Mogilevsky","Non-perturbative beta-function in SU(2) lattice gauge fields
  thermodynamics","6 pages, Latex",,,,"hep-lat",,"  The new method of nonperturbative calculation of the beta function in the
lattice gauge theory is proposed. The method is based on the finite size
scaling hypothesis.
","[{""version"":""v1"",""created"":""Wed, 12 Apr 2000 11:38:58 GMT""}]","2007-05-23"
"hep-ph/0004103","Zoltan Kunszt","Zoltan Kunszt (ETH,Zurich)","Bread and Butter Standard Model",,,"10.1142/9789812811585_0006","ETH-TH/2000-06, Apr, 2000. 37pp","hep-ph",,"  Lectures given at the International School of Subnuclear Physics: 37th
Course: Basics and Highlights of Fundamental Physics, Erice, Italy, 29 Aug - 7
Sep 1999.
","[{""version"":""v1"",""created"":""Tue, 11 Apr 2000 17:41:46 GMT""}]","2017-08-23"
"hep-ph/0004104","Wojciech Broniowski","Wojciech Broniowski and Wojciech Florkowski (INP, Cracow)","Different Hagedorn temperatures for mesons and baryons from experimental
  mass spectra, compound hadrons, and combinatorial saturation","powers in Eqs. (7,8) corrected and a reference added","Phys.Lett.B490:223-227,2000","10.1016/S0370-2693(00)00992-8",,"hep-ph hep-th nucl-th",,"  We analyze the light-flavor particle mass spectra and show that in the region
up to ~1.8GeV the Hagedorn temperature for baryons is about 30% smaller than
for mesons, reflecting the fact that the number of baryon states grows more
rapidly with the mass. We also show that the spectra are well reproduced in a
model where hadrons are compound objects of quanta, whose available number
increases with mass. The rapid growth of number of hadronic states is a
combinatorial effect. We also point out that an upper limit on the excitation
energy of these quanta results in a maximum number of hadron states that can be
formed. According to this combinatorial saturation, no more light-flavor hadron
resonances exist above a certain mass.
","[{""version"":""v1"",""created"":""Tue, 11 Apr 2000 20:42:27 GMT""},{""version"":""v2"",""created"":""Wed, 12 Apr 2000 20:17:31 GMT""}]","2011-08-17"
"hep-ph/0004105","Salah Nasri","D. Black, A. H. Fariborz, S. Nasri, J. Schechter","Complementary Ansatz for the neutrino mass matrix","15 pages, RevteX, submitted to Phys. Rev. D","Phys.Rev.D62:073015,2000","10.1103/PhysRevD.62.073015","SU-4240-719","hep-ph",,"  We propose a simple Ansatz for the three generation neutrino mass matrix
$M_\nu$ which is motivated from an SO(10) grand unified theory. The Ansatz can
be combined with information from neutrino oscillation experiments and bounds
on neutrinoless double beta decay to determine the neutrino masses themselves
and to reconstruct, with some assumptions, the matrix $ M_\nu $ .
","[{""version"":""v1"",""created"":""Tue, 11 Apr 2000 21:16:27 GMT""}]","2011-03-17"
