"cond-mat/0004436","JozefT. Devreese","J. Tempere and J. T. Devreese (TFVS, Universiteit Antwerpen)","Optical Absorption of an Interacting Many-Polaron Gas","24 pages, 5 figures; revised and expanded version","Phys. Rev. B 64, 104504 (2001)","10.1103/PhysRevB.64.104504",,"cond-mat.str-el",,"  The optical absorption of a many (continuum) polaron gas is derived in the
framework of a variational approach at zero temperature and weak or
intermediate electron-phonon coupling strength. We derive a compact formula for
the optical conductivity of the many-polaron system taking into account
many-body effects in the electron or hole system. Within the method presented
here, these effects are contained completely in the dynamical structure factor
of the electron or hole system. This allows to build on well-established
studies of the interacting electron gas. Based on this approach a novel feature
in the absorption spectrum of the many-polaron gas, related to the emission of
a plasmon together with a phonon, is identified. As an application and
illustration of the technique, we compare the theoretical many-polaron optical
absorption spectrum as derived in the present work with the `d-band' absorption
feature in Nd$_{2}$CuO$_{2}$. Similarities are shown between the theoretically
and the experimentally derived first frequency moment of the optical absorption
of a family of differently doped Nd$_{2-x}$Ce$_{x}$CuO$_{4-y}$ materials.
","[{""version"":""v1"",""created"":""Wed, 26 Apr 2000 15:22:05 GMT""},{""version"":""v2"",""created"":""Wed, 28 Jun 2000 19:36:18 GMT""},{""version"":""v3"",""created"":""Wed, 6 Dec 2000 13:50:21 GMT""}]","2009-10-31"
"cond-mat/0004437","A. Mourachkine","A. Mourachkine (Brussels)","Phenomenological model of high-Tc superconductivity","2 pages, will appear in Physica C (proceedings of M2S-HTSC-VI
  Conference in Houston); see also cond-mat/9910449","Physica C 341-348 (2000) 283",,,"cond-mat.supr-con cond-mat.str-el",,"  We present a phenomenological model of high-Tc superconductivity in
hole-doped cuprates: a Magnetic Coupling between Stripes (MCS) model. The MCS
model is based upon experimental facts, namely, the presence of (i) stripes,
(ii) spin fluctuations, and (iii) two order parameters (for pairing and
long-range phase coherence) in hole-doped cuprates. We discuss also the
superconductivity in electron-doped cuprates.
","[{""version"":""v1"",""created"":""Wed, 26 Apr 2000 15:50:26 GMT""}]","2007-05-23"
"cs/0004014","Mark Baker","Mark Baker (University of Portsmouth, UK), et al","Cluster Computing White Paper","119 page white paper - Edited by Mark Baker (University of
  Portsmouth), version 2.0",,,,"cs.DC cs.AR cs.NI",,"  Cluster computing is not a new area of computing. It is, however, evident
that there is a growing interest in its usage in all areas where applications
have traditionally used parallel or distributed computing platforms. The
growing interest has been fuelled in part by the availability of powerful
microprocessors and high-speed networks as off-the-shelf commodity components
as well as in part by the rapidly maturing software components available to
support high performance and high availability applications.
  This White Paper has been broken down into eleven sections, each of which has
been put together by academics and industrial researchers who are both experts
in their fields and where willing to volunteer their time and effort to put
together this White Paper. The status of this paper is draft and we are at the
stage of publicizing its presence and making a Request For Comments (RFC).
","[{""version"":""v1"",""created"":""Tue, 25 Apr 2000 18:55:40 GMT""},{""version"":""v2"",""created"":""Thu, 11 Jan 2001 22:14:41 GMT""}]","2019-08-17"
"gr-qc/0004075","T. Damour","Thibault Damour and Alexander Vilenkin","Gravitational wave bursts from cosmic strings","4 pages, revtex, 2 figures, submitted to Phys. Rev. Letters","Phys.Rev.Lett.85:3761-3764,2000","10.1103/PhysRevLett.85.3761","IHES/P/00/32","gr-qc astro-ph hep-ph hep-th",,"  Cusps of cosmic strings emit strong beams of high-frequency gravitational
waves (GW). As a consequence of these beams, the stochastic ensemble of
gravitational waves generated by a cosmological network of oscillating loops is
strongly non Gaussian, and includes occasional sharp bursts that stand above
the rms GW background. These bursts might be detectable by the planned GW
detectors LIGO/VIRGO and LISA for string tensions as small as $G \mu \sim
10^{-13}$. The GW bursts discussed here might be accompanied by Gamma Ray
Bursts.
","[{""version"":""v1"",""created"":""Wed, 26 Apr 2000 09:47:22 GMT""}]","2008-11-26"
"gr-qc/0004076","Reinhard Prix","Reinhard Prix","Covariant Vortex In Superconducting-Superfluid-Normal Fluid Mixtures
  with Stiff Equation of State","14 pages, uses RevTeX and amssymb, submitted","Phys.Rev. D62 (2000) 103005","10.1103/PhysRevD.62.103005",,"gr-qc astro-ph cond-mat.supr-con",,"  The integrals of motion for a cylindrically symmetric stationary vortex are
obtained in a covariant description of a mixture of interacting
superconductors, superfluids and normal fluids. The relevant integrated
stress-energy coefficients for the vortex with respect to a vortex-free
reference state are calculated in the approximation of a ``stiff'', i.e. least
compressible, relativistic equation of state for the fluid mixture. As an
illustration of the foregoing general results, we discuss their application to
some of the well known examples of ``real'' superfluid and superconducting
systems that are contained as special cases. These include Landau's two-fluid
model, uncharged binary superfluid mixtures, rotating conventional
superconductors and the superfluid neutron-proton-electron plasma in the outer
core of neutron stars.
","[{""version"":""v1"",""created"":""Wed, 26 Apr 2000 15:55:49 GMT""}]","2009-10-31"
"hep-ex/0004023","C. Andrew Miller","HERMES Collaboration: A. Airapetian, et al","Exclusive Leptoproduction of rho^0 Mesons from Hydrogen at Intermediate
  Virtual Photon Energies","10 pages, 6 embedded figures, LaTeX for SVJour(epj) document class.
  Revisions: curves added to Fig. 1, several clarifications added to text","Eur.Phys.J.C17:389-398,2000","10.1007/s100520000483","DESY-00-058","hep-ex",,"  Measurements of the cross section for exclusive virtual-photoproduction of
rho^0 mesons from hydrogen are reported. The data were collected by the HERMES
experiment using 27.5 GeV positrons incident on a hydrogen gas target in the
HERA storage ring. The invariant mass W of the photon-nucleon system ranges
from 4.0 to 6.0 GeV, while the negative squared four-momentum Q^2 of the
virtual photon varies from 0.7 to 5.0 GeV^2. The present data together with
most of the previous data at W > 4 GeV are well described by a model that
infers the W-dependence of the cross section from the dependence on the Bjorken
scaling variable x of the unpolarized structure function for deep-inelastic
scattering. In addition, a model calculation based on Off-Forward Parton
Distributions gives a fairly good account of the longitudinal component of the
rho^0 production cross section for Q^2 > 2 GeV^2.
","[{""version"":""v1"",""created"":""Tue, 25 Apr 2000 19:15:22 GMT""},{""version"":""v2"",""created"":""Sat, 21 Oct 2000 02:12:36 GMT""}]","2008-11-26"
"hep-ex/0004026","P. C. Rowson","SLD Collaboration","A High-Precision Measurement of the Left-Right Z Boson Cross-Section
  Asymmetry",,"Phys.Rev.Lett.84:5945-5949,2000","10.1103/PhysRevLett.84.5945","SLAC-PUB-8401","hep-ex",,"  We present a measurement of the left-right cross-section asymmetry (ALR) for
Z boson production by e+e- collisions. The measurement includes the final data
taken with the SLD detector at the SLAC Linear Collider (SLC) during the period
1996-1998. Using a sample of 383,487 Z decays collected during the 1996-1998
runs we measure the pole-value of the asymmetry, ALR0, to be 0.15056+-0.00239
which is equivalent to an effective weak mixing angle of sin2th(eff) =
0.23107+-0.00030. Our result for the complete 1992-1998 dataset comprising 537
thousand Z decays is sin2th(eff) = 0.23097+-0.00027.
","[{""version"":""v1"",""created"":""Tue, 25 Apr 2000 16:32:40 GMT""}]","2012-08-27"
"hep-ex/0004027","Robert Cropp","The CDF collaboration, T. Affolder, et al","Measurement of J/Psi and Psi(2S) Polarization in ppbar Collisions at
  sqrt(s) = 1.8 TeV","Revised version, accepted for publication in Physical Review Letters","Phys.Rev.Lett.85:2886-2891,2000","10.1103/PhysRevLett.85.2886","FERMILAB-PUB-00/090-E","hep-ex",,"  We have measured the polarization of J/Psi and Psi(2S) mesons produced in
p\bar{p} collisions at \sqrt{s} = 1.8 TeV, using data collected at CDF during
1992-95.
  The polarization of promptly produced J/Psi [Psi(2S)] mesons is isolated from
those produced in B-hadron decay, and measured over the kinematic range 4[5.5]
< P_T < 20 GeV/c and |y| < 0.6. For P_T \gessim 12 GeV/c we do not observe
significant polarization in the prompt component.
","[{""version"":""v1"",""created"":""Tue, 25 Apr 2000 19:41:08 GMT""},{""version"":""v2"",""created"":""Thu, 17 Aug 2000 15:53:37 GMT""}]","2010-05-12"
"hep-ex/0004028","Edward E. Johnson","R. A. Briere, et al, CLEO Collaboration","Measurements of Charm Fragmentation into $D_s^{*+}$ and $D_s^+$ in
  $e^+e^-$ Annihilations at $\sqrt{s}$=10.5 GeV","21 pages, 6 figures","Phys.Rev.D62:072003,2000","10.1103/PhysRevD.62.072003","CLNS 00/1667, CLEO 00-5","hep-ex",,"  A study of charm fragmentation into $D_s^{*+}$ and $D_s^+$ in $e^+e^-$
annihilations at $\sqrt{s}$=10.5 GeV is presented. This study using $4.72 \pm
0.05$ fb$^{-1}$ of CLEO II data reports measurements of the cross-sections
$\sigma(D_s^{*+})$ and $\sigma(D_s^+)$ in momentum regions above $x=0.44$,
where $x$ is the $D_s$ momentum divided by the maximum kinematically allowed
$D_s$ momentum. The $D_s$ vector to vector plus pseudoscalar production ratio
is measured to be $P_V(x(D_s^+)>0.44)=0.44\pm0.04$
","[{""version"":""v1"",""created"":""Tue, 25 Apr 2000 20:35:16 GMT""}]","2010-04-08"
"hep-ex/0004029","Kirk T. McDonald","M.R. Convery, K.T. McDonald","Noncontact measurement of the tension of a wire","v2 corrects the affiliation of M. Convery",,,,"hep-ex",,"  We present a scheme for noncontact measurement of the tension of a wire, such
as that in a drift chamber or straw tube detector.
","[{""version"":""v1"",""created"":""Tue, 25 Apr 2000 20:20:42 GMT""},{""version"":""v2"",""created"":""Mon, 29 May 2000 21:07:56 GMT""}]","2007-05-23"
"hep-ph/0004229","Leonid Glozman","L.Ya. Glozman","Chiral aspects of baryon structure in the quark model","Discussion of the axial vector charge of the nucleon has been
  slightly modified","Phys.Lett. B494 (2000) 58-62","10.1016/S0370-2693(00)01170-9",,"hep-ph hep-lat nucl-th",,"  The implications of chiral symmetry for the quark model are discussed. In
particular its connection with the meson-baryon approach is outlined. It is
stressed that in the closure approximation, where the intermediate baryon
states are used instead of the original quark basis, it is imperative to take
into account the whole infinite tower of the radially excited states in order
that the crucially important effects related to the short-range part of the
meson-exchange interaction be preserved. It is shown that the chiral
constituent quark model is able to explain the nucleon axial vector coupling
constant and automatically incorporates all the necessary loop corrections.
","[{""version"":""v1"",""created"":""Tue, 25 Apr 2000 18:52:38 GMT""},{""version"":""v2"",""created"":""Sat, 29 Apr 2000 16:29:12 GMT""}]","2009-10-31"
"hep-ph/0004230","Matthew F. Parry","A. Sornborger and M. Parry","Pattern Formation in the Early Universe","9 pages, 11 figures","Phys.Rev. D62 (2000) 083511","10.1103/PhysRevD.62.083511","Fermilab Preprint: Pub-98/231-A; BROWN-HET-1201;
  Imperial/TP/99-0/006","hep-ph astro-ph gr-qc hep-th nlin.PS",,"  Systems that exhibit pattern formation are typically driven and dissipative.
In the early universe, parametric resonance can drive explosive particle
production called preheating. The fields that are populated then decay quantum
mechanically if their particles are unstable. Thus, during preheating, a
driven-dissipative system exists. We have shown previously that pattern
formation can occur in two dimensions in a self-coupled inflaton system
undergoing parametric resonance. In this paper, we provide evidence of pattern
formation for more realistic initial conditions in both two and three
dimensions. In the one-field case, we have the novel interpretation that these
patterns can be thought of as a network of domain walls. We also show that the
patterns are spatio-temporal, leading to a distinctive, but probably
low-amplitude peak in the gravitational wave spectrum. In the context of a
two-field model, we discuss putting power from resonance into patterns on
cosmological scales, in particular to explain the observed excess power at 100
h^{-1}Mpc, but why this seems unlikely in the absence of a period of
post-preheating inflation. Finally we note our model is similar to that of the
decay of DCCs and therefore pattern formation may also occur at RHIC and LHC.
","[{""version"":""v1"",""created"":""Tue, 25 Apr 2000 16:37:16 GMT""}]","2016-09-06"
"hep-ph/0004231","Allan Widom","A. Widom, Y.N. Srivastava","Higgs Decay into Gravitons: Trees and Loops","3 Pages, RevTeX 3.1 format, 3 pages, 2 figures *.eps",,,,"hep-ph",,"  The decay of the Higgs particle into two gravitons was previously calculated
by us using a Born term from the Einstein field equations. Subsequently, others
computed the same decay via one loop diagrams but omitting the Born terms. Here
all of the diagrams up to one loop are discussed, and it is shown that the Born
term is overwhelmingly dominant in agreement with our original results.
","[{""version"":""v1"",""created"":""Tue, 25 Apr 2000 17:43:15 GMT""}]","2007-05-23"
"hep-ph/0004232","Ed Stoeffhaas","M. M. Block, F. Halzen, T. Stanev","Extending the Frontiers - Reconciling Accelerator and Cosmic Ray p-p
  Cross Sections","6 pages, Latex, uses epsfig.sty, 5 postscript figures","Phys.Rev.D62:077501,2000","10.1103/PhysRevD.62.077501","NUHEP 706, MADPH-00-1172","hep-ph",,"  We simultaneously fit a QCD-inspired parameterization of all accelerator data
on forward proton-proton and antiproton-proton scattering amplitudes, together
with cosmic ray data (using Glauber theory), to predict proton-air and
proton-proton cross sections at energies near \sqrt s \approx 30 TeV. The p-air
cosmic ray measurements provide a strong constraint on the inclusive particle
production cross section, as well as greatly reducing the errors on the fit
parameters---in turn, greatly reducing the errors in the high energy
proton-proton and proton-air cross section predictions.
","[{""version"":""v1"",""created"":""Tue, 25 Apr 2000 20:53:55 GMT""}]","2011-05-12"
"hep-ph/0004233","Debajyoti Choudhury","Debajyoti Choudhury, Dileep P. Jatkar, Uma Mahanta and Subrata Sur","On Stability of the Three 3-brane Model","plain tex; 12 pages, 3 embedded figures (postscript)","JHEP 0009 (2000) 021","10.1088/1126-6708/2000/09/021","MRI-PHY/P20000412","hep-ph",,"  We show that the Goldberger-Wise mechanism for the three 3-brane scenario
proposed by Kogan et al. stabilizes the radion. We find that the system of
3-branes stabilizes in such a way that the loss in the scale factor is
insignificant. That is, the negative tension brane chooses to stay close to the
visible brane.
","[{""version"":""v1"",""created"":""Wed, 26 Apr 2000 06:40:37 GMT""}]","2009-10-31"
"hep-ph/0004234","Stephane Peigne'","Nils Marchal, Stephane Peigne and Paul Hoyer","Quarkonium Production through Hard Comover Scattering. II","7 pages, revtex","Phys.Rev. D62 (2000) 114001","10.1103/PhysRevD.62.114001","NORDITA-2000/43 HE, LAPTH-793/00","hep-ph",,"  We extend to large transverse momentum pt an approach to quarkonium
hadroproduction previously suggested for low pt. The dynamics involves a
perturbative rescattering of the heavy quark pair off a comoving color field
which originates from gluon radiation prior to the heavy quark production
vertex. Assuming simple properties of the comoving field we find the
rescattering scenario to be in reasonable agreement with data. At large pt,
psi' is predicted to be unpolarized, and chi1 production is favoured compared
to chi2. We predict the chi1 polarization to be transverse at low pt, and to
get a longitudinal component at large pt.
","[{""version"":""v1"",""created"":""Wed, 26 Apr 2000 10:13:19 GMT""}]","2009-10-31"
"hep-ph/0004235","Jos Vermaseren","J.A.M. Vermaseren and S. Moch (NIKHEF, Amsterdam)","Mathematics for structure functions","6 pages LaTeX, uses axodraw.sty and npb.sty (included)","Nucl.Phys.Proc.Suppl. 89 (2000) 131-136","10.1016/S0920-5632(00)00834-3","NIKHEF-00-008","hep-ph",,"  We show some of the mathematics that is being developed for the computation
of deep inelastic structure functions to three loops. These include harmonic
sums, harmonic polylogarithms and a class of difference equations that can be
solved with the use of harmonic sums.
","[{""version"":""v1"",""created"":""Wed, 26 Apr 2000 11:26:27 GMT""}]","2009-10-31"
"hep-ph/0004236","Antonio Mihara","A. Mihara and A. A. Natale","Dynamical gluon mass corrections in heavy quarkonia decays","10 pages","Phys.Lett. B482 (2000) 378-382","10.1016/S0370-2693(00)00546-3","IFT-P.043/2000","hep-ph",,"  Using the expression of the dynamical gluon mass obtained through the
operator product expansion we discuss the relevance of gluon mass effects in
the decays V -> hadrons (V = J/Psi, Upsilon). Relativistic and radiative
corrections are also introduced to calculate alpha_s(m_c) and alpha_s(m_b)
comparing them with other values available in the literature. The effects of
dynamical gluon masses are negligible for Upsilon decay but important for J/Psi
decay.
","[{""version"":""v1"",""created"":""Wed, 26 Apr 2000 14:17:22 GMT""}]","2009-10-31"
"hep-ph/0004237","Carlos Merino Gayoso","A.B. Kaidalov (ITEP-Moscow), C. Merino (U. of Santiago de Compostela),
  D. Pertermann (U. GH-Siegen)","On the Behavior of F2 and its Logarithmic Slopes","16 pages, 10 figures","Eur.Phys.J.C20:301-311,2001","10.1007/s100520100648",,"hep-ph",,"  It is shown that the CKMT model for the nucleon structure function F2, taken
as the initial condition for the NLO evolution equations in perturbative QCD,
provides a good description of the HERA data when presented in the form of the
logarithmic slopes of F2 vs x and Q2 (Caldwell-plot), in the whole available
kinematic ranges. Also the results obtained for the behavior of the gluon
component of a nucleon are presented.
","[{""version"":""v1"",""created"":""Wed, 26 Apr 2000 15:33:00 GMT""}]","2009-01-07"
"hep-th/0004176","Langmann Edwin","Harald Grosse and Edwin Langmann","Chiral Schwinger models without gauge anomalies","18 pages","Nucl.Phys. B587 (2000) 568-584","10.1016/S0550-3213(00)00481-8",,"hep-th",,"  We find a large class of quantum gauge models with massless fermions where
the coupling to the gauge fields is not chirally symmetric and which
nevertheless do not suffer from gauge anomalies. To be specific we study two
dimensional Abelian models in the Hamiltonian framework which can be
constructed and solved by standard techniques. The general model describes
$\Np$ photon fields and $\Nf$ flavors of Dirac fermions with $2\Nf\Np$
different coupling constants i.e. the chiral component of each fermion can be
coupled to the gauge fields differently. We construct these models and find
conditions so that no gauge anomaly appears. If these conditions hold it is
possible to construct and solve the model explicitly, so that gauge- and
Lorentz invariance are manifest.
","[{""version"":""v1"",""created"":""Tue, 25 Apr 2000 17:58:05 GMT""}]","2009-10-31"
"hep-th/0004177","Mauricio Cataldo Monsalves","Mauricio Cataldo, Alberto Garcia","Regular (2+1)-dimensional black holes within non-linear Electrodynamics","5 pages, Latex, 2 figures","Phys.Rev. D61 (2000) 084003","10.1103/PhysRevD.61.084003",,"hep-th gr-qc",,"  (2+1)-regular static black hole solutions with a nonlinear electric field are
derived. The source to the Einstein equations is an energy momentum tensor of
nonlinear electrodynamics, which satisfies the weak energy conditions and in
the weak field limit becomes the (2+1)-Maxwell field tensor. The derived class
of solutions is regular; the metric, curvature invariants and electric field
are regular everywhere. The metric becomes, for a vanishing parameter, the
(2+1)-static charged BTZ solution. A general procedure to derive solutions for
the static BTZ (2+1)-spacetime, for any nonlinear Lagrangian depending on the
electric field is formulated; for relevant electric fields one requires the
fulfillment of the weak energy conditions.
","[{""version"":""v1"",""created"":""Tue, 25 Apr 2000 16:21:45 GMT""}]","2009-10-31"
"hep-th/0004178","Ralf Hofmann","Ralf Hofmann","BPS Saturated Vacua Interpolation along One Compact Dimension","8 pages, 4 figures","Phys.Rev. D62 (2000) 065012","10.1103/PhysRevD.62.065012",,"hep-th",,"  A class of generalized Wess-Zumino models with distinct vacua is
investigated. These models allow for BPS saturated vacua interpolation along
one compact spatial dimension. The properties of these interpolations are
studied.
","[{""version"":""v1"",""created"":""Wed, 26 Apr 2000 01:18:33 GMT""},{""version"":""v2"",""created"":""Thu, 8 Jun 2000 19:22:06 GMT""}]","2009-10-31"
"hep-th/0004179","Madoka Nishimura","Madoka Nishimura","Conformal Supergravity from the AdS/CFT Correspondence","15 pages, Latex","Nucl.Phys. B588 (2000) 471-482","10.1016/S0550-3213(00)00472-7","OCHA-PP-153","hep-th",,"  Construction of a five dimensional conformal supergravity (D=5 CSG) is
attempted by applying the AdS/CFT correspondence to the F(4) AdS supergravity
in six dimensions. As a first step, local transformation laws of D=5 CSG have
been established, from which the Weyl weights of the various fields in D=5 can
be predicted.
","[{""version"":""v1"",""created"":""Wed, 26 Apr 2000 11:20:59 GMT""},{""version"":""v2"",""created"":""Wed, 31 May 2000 19:13:01 GMT""}]","2009-10-31"
"hep-th/0004180","Balog Janos","J. Balog, P. Forgacs and L. Palla","A two-dimensional integrable axionic sigma-model and T-duality","11 pages, LaTeX","Phys.Lett. B484 (2000) 367-374","10.1016/S0370-2693(00)00645-6",,"hep-th",,"  An $S$-matrix is proposed for the two dimensional O(3) $\sigma$-model with a
dynamical $\theta$-term (axion model). Exploiting an Abelian T-duality
transformation connecting the axion model to an integrable SU(2)$\times$U(1)
symmetric principal $\sigma$-model, strong evidence is presented for the
correctness of the proposed $S$-matrix by comparing the perturbatively
calculated free energies with the ones based on the Thermodynamical Bethe
Ansatz. This T-duality transformation also leads to a new Lax-pair for both
models. The quantum non-integrability of the O(3) $\sigma$-model with a {\sl
constant} $\theta$-term, in contradistinction to the axion model, is
illustrated by calculating the $2\to3$ particle production amplitude to lowest
order in $\theta$.
","[{""version"":""v1"",""created"":""Wed, 26 Apr 2000 11:45:14 GMT""}]","2009-10-31"
"hep-th/0004181","Gabor Takacs","Z. Bajnok, L. Palla, G. Takacs, F. Wagner","The k-folded sine-Gordon model in finite volume","36 pages, 11 eps figures, LaTeX2e with amssymb.sty. A reference and a
  preprint number added","Nucl.Phys. B587 (2000) 585-618","10.1016/S0550-3213(00)00441-7","ITP--Budapest Report No. 557, KCL--MTH--00--21","hep-th",,"  We consider the k-folded sine-Gordon model, obtained from the usual version
by identifying the scalar field after k periods of the cosine potential. We
examine (1) the ground state energy split, (2) the lowest lying multi-particle
state spectrum and (3) vacuum expectation values of local fields in finite
spatial volume, combining the Truncated Conformal Space Approach, the method of
the Destri-de Vega nonlinear integral equation (NLIE) and semiclassical
instanton calculations. We show that the predictions of all these different
methods are consistent with each other and in particular provide further
support for the NLIE method in the presence of a twist parameter. It turns out
that the model provides an optimal laboratory for examining instanton
contributions beyond the dilute instanton gas approximation. We also provide
evidence for the exact formula for the vacuum expectation values conjectured by
Lukyanov and Zamolodchikov.
","[{""version"":""v1"",""created"":""Wed, 26 Apr 2000 12:01:32 GMT""},{""version"":""v2"",""created"":""Mon, 8 May 2000 13:40:08 GMT""}]","2009-10-31"
"hep-th/0004184","Kentaroh Yoshida","Kentaroh Yoshida","The Effect of the Boundary Conditions in the Reformulation of QCD_4","9 pages, 2 figures; typos corrected; to appear in JHEP","JHEP 0007 (2000) 007","10.1088/1126-6708/2000/07/007","KUCP-0150","hep-th",,"  We discuss the phase structure of QCD_4 as a perturbative deformation of the
Topological Quantum Field Theory (TQFT). When we choose a special Maximal
Abelian gauge (MAG) as the gauge fixing, the TQFT sector is equivalent to a 2D
O(3) non-linear sigma model (NLSM). We consider the finite temperature case,
and investigate the effect of the boundary conditions and the phase structure
of the TQFT sector. It can have a deconfining phase under the twisted boundary
conditions. However, this phase is screened once pertubative parts are added.
We conclude that the information about the phase structure is encoded in the
U(1) background in the case of the MAG.
","[{""version"":""v1"",""created"":""Wed, 26 Apr 2000 14:41:49 GMT""},{""version"":""v2"",""created"":""Mon, 10 Jul 2000 06:10:55 GMT""}]","2009-10-31"
