"cond-mat/0004415","Laurent Proville","Laurent Proville and Serge Aubry","Mobile Bipolarons in the Adiabatic Holstein-Hubbard Model in 1 and 2
  dimensions",,"Physica D (1998) vol.113 pp.307-317","10.1016/S0167-2789(97)00283-2",,"cond-mat.str-el cond-mat.supr-con",,"  The bound states of two electrons in the adiabatic Holstein-Hubbard model are
studied numerically in one and two dimensions from the anticontinuous limit.
This model involves a competition between a local electron-phonon coupling
(with a classical lattice) which tends to form pairs of electrons and the
repulsive Hubbard interaction $U \geq 0$ which tends to break them.
  In 1D, the ground-state always consists in a pair of localized polarons in a
singlet state. They are located at the same site for U=0. Increasing U, there
is a first order transition at which the bipolaron becomes a spin singlet pair
of two polarons bounded by a magnetic interaction. The pinning mode of the
bipolaron soften in the vicinity of this transition leading to a higher
mobility of the bipolaron which is tested numerically.
  In 2D, and for any $U$, the electron-phonon coupling needs to be large enough
in order to form small polarons or bipolarons instead of extended electrons. We
calculate the phase diagram of the bipolaron involving first order transitions
lines with a triple point. A pair of polarons can form three types of
bipolarons: a) on a single site at small $U$, b) a spin singlet state on two
nearest neighbor sites for larger $U$ as in 1D and c) a new intermediate state
obtained as the resonant combination of four 2-sites singlet states sharing a
central site, called quadrisinglet.
  The breathing and pinning internal modes of bipolarons in 2D generally only
weakly soften and thus, they are practically not mobile. On the opposite, in
the vicinity of the triple point involving the quadrisinglet, both modes
exhibit a significant softening. However, it was not sufficient for allowing
the existence of a classical mobile bipolaron (at least in that model).
","[{""version"":""v1"",""created"":""Tue, 25 Apr 2000 16:45:15 GMT""},{""version"":""v2"",""created"":""Fri, 28 Apr 2000 10:28:01 GMT""}]","2009-10-31"
"cond-mat/0004416","Laurent Proville","Laurent Proville and Serge Aubry","Small Bipolarons in the 2-dimensional Holstein-Hubbard Model. I The
  Adiabatic Limit",,"Eur. Phys. J. B. (1999) vol.11, pp.41-58","10.1007/s100510050915",,"cond-mat.supr-con cond-mat.str-el",,"  The spatially localized bound states of two electrons in the adiabatic
two-dimensional Holstein-Hubbard model on a square lattice are investigated
both numerically and analytically. The interplay between the electron-phonon
coupling g, which tends to form bipolarons and the repulsive Hubbard
interaction $\upsilon \geq 0$, which tends to break them, generates many
different ground-states. There are four domains in the $g,\upsilon$ phase
diagram delimited by first order transition lines. Except for the domain at
weak electron-phonon coupling (small g) where the electrons remain free, the
electrons form bipolarons which can 1) be mostly located on a single site
(small $\upsilon$, large g); 2) be an anisotropic pair of polarons lying on two
neighboring sites in the magnetic singlet state (large $\upsilon$, large g); or
3) be a ""quadrisinglet state"" which is the superposition of 4 electronic
singlets with a common central site. This quadrisinglet bipolaron is the most
stable in a small central domain in between the three other phases. The pinning
modes and the Peierls-Nabarro barrier of each of these bipolarons are
calculated and the barrier is found to be strongly depressed in the region of
stability of the quadrisinglet bipolaron.
","[{""version"":""v1"",""created"":""Tue, 25 Apr 2000 16:59:33 GMT""}]","2009-10-31"
"cond-mat/0004417","Laurent Proville","Laurent Proville and Serge Aubry","Small Bipolarons in the 2-dimensional Holstein-Hubbard Model. II Quantum
  Bipolarons","accepted Eur. Phys. J. B (january 2000) Ref. B9602",,"10.1007/s100510051142",,"cond-mat.supr-con cond-mat.str-el",,"  We study the effective mass of the bipolarons and essentially the possibility
to get both light and strongly bound bipolarons in the Holstein-Hubbard model
and some variations in the vicinity of the adiabatic limit. Several approaches
to investigate the quantum mobility of polarons and bipolarons are proposed for
this model. It is found that the bipolaron mass generally remains very large
except in the vicinity of the triple point of the phase diagram, where the
bipolarons have several degenerate configurations at the adiabatic limit
(single site (S0), two sites (S1) and quadrisinglet (QS)), while the polarons
are much lighter. This degeneracy reduces the bipolaron mass significantly. The
triple point of the phase diagram is washed out by the lattice quantum
fluctuations which thus suppress the light bipolarons. We show that some model
variations, for example a phonon dispersion may increase the stability of the
(QS) bipolaron against the quantum lattice fluctuations. The triple point of
the phase diagram may be stable to quantum lattice fluctuations and a very
sharp mass reduction may occur, leading to bipolaron masses of the order of 100
bare electronic mass for realistic parameters. Thus such very light bipolarons
could condense as a superconducting state at relatively high temperature when
their interactions are not too large, that is, their density is small enough.
This effect might be relevant for understanding the origin of the high Tc
superconductivity of doped cuprates far enough from half filling.
","[{""version"":""v1"",""created"":""Tue, 25 Apr 2000 17:17:46 GMT""}]","2009-10-31"
"cond-mat/0004418","Vandewalle","N.Lecocq and N.Vandewalle","Stripes ordering in self-stratification experiments of binary and
  ternary granular mixtures","4 pages, 5 figures. submitted for pubication, guess where",,"10.1103/PhysRevE.62.8241",,"cond-mat.soft",,"  The self-stratification of binary and ternary granular mixtures has been
experimentally investigated. Ternary mixtures lead to a particular ordering of
the strates which was not accounted for in former explanations. Bouncing grains
are found to have an important effect on strate formation. A complementary
mechanism for self-stratification of binary and ternary granular mixtures is
proposed.
","[{""version"":""v1"",""created"":""Tue, 25 Apr 2000 17:21:51 GMT""}]","2009-10-31"
"cond-mat/0004419","Vladimir Stephanovich","V.A.Stephanovich, (Institute of Mathematics, University of Opole,
  Opole, Poland and Institute of Semiconductor Physics NAS of Ukraine, Kiev,
  Ukraine)","Griffiths phase manifestation in disordered dielectrics","5 pages, 4 embedded postscript figures",,"10.1007/s100510070072",,"cond-mat.dis-nn",,"  We predict the existence of Griffith phase in the dielectrics with
concentrational crossover between dipole glass (electric analog of spin glass)
and ferroelectricity. The peculiar representatives of above substances are
$KTaO_3:Li$, $Nb$, $Na$ or relaxor ferroelectrics like
$Pb_{1-x}La_xZr_{0.65}Ti_{0.35}O_3$. Since this phase exists above
ferroelectric phase transition temperature (but below that temperature for
ordered substance), we call it ""para-glass phase"". We assert that the
difference between paraelectric and para-glass phase of above substances is the
existence of clusters (inherent to ""ordinary"" Griffiths phase in Ising magnets)
of correlated dipoles. We show that randomness play a decisive role in
Griffiths (para-glass) phase formation; this phase does not exist in a mean
field approximation.
","[{""version"":""v1"",""created"":""Tue, 25 Apr 2000 17:30:02 GMT""}]","2009-10-31"
"cond-mat/0004420","Nikos Stefanakis","N. Stefanakis, N. Flytzanis","Critical currents in Josephson junctions, with unconventional pairing
  symmetry: $d_{x^2-y^2}+is$ versus $d_{x^2-y^2}+id_{xy}$","11 pages with 11 figures, Changed content","Phys. Rev. B, 64 (2001) 024527","10.1103/PhysRevB.64.024527",,"cond-mat.supr-con",,"  Phenomenological Ginzburg-Landau theory is used to calculate the possible
spontaneous vortex states that may exist at corner junctions of
$d_{x^2-y^2}+ix$-wave, (where $x=s$ or $x=d_{xy}$) and s-wave superconductors.
We study the magnetic flux and the critical current modulation with the
junction orientation angle $\theta$, the magnitude of the order parameter, and
the magnetic field $H$. It is seen that the critical current $I_c$ versus the
magnetic flux $\Phi$ relation is symmetric / asymmetric for $x=d_{xy}/s$ when
the orientation is exactly such that the lobes of the dominant
$d_{x^2-y^2}$-wave order parameter points towards the two junctions, which are
at right angles for the corner junction. The conclusion is that a measurement
of the $I_c(\Phi)$ relation may distinguish which symmetry ($d_{x^2-y^2}+is$ or
$d_{x^2-y^2}+id_{xy}$) the order parameter has.
","[{""version"":""v1"",""created"":""Tue, 25 Apr 2000 18:13:35 GMT""},{""version"":""v2"",""created"":""Tue, 26 Jun 2001 09:35:40 GMT""}]","2009-10-31"
"cond-mat/0004421","Badalyan","S. M. Badalyan","Carrier Scattering in Quantum Nanosystems","42 figs, 5 tbls, 241 p",,,,"cond-mat.mes-hall",,"  Carrier interaction with phonons, photons, impurities, and electrons have
been addressed in semiconductor nanoscale systems with carrier confinement in
one and two dimensions subjected to a quantizing magnetic field and without it.
","[{""version"":""v1"",""created"":""Tue, 25 Apr 2000 19:12:29 GMT""}]","2007-05-23"
"cond-mat/0004422","Zhitong Matthew Zhang","S. N. Coppersmith, Leo P. Kadanoff, Zhitong Zhang","Reversible Boolean Networks I: Distribution of Cycle Lengths","28 pages, 9 figures, Research paper sumbitted",,"10.1016/S0167-2789(00)00198-6",,"cond-mat.dis-nn math.DS nlin.CD nlin.CG physics.comp-ph",,"  We consider a class of models describing the dynamics of $N$ Boolean
variables, where the time evolution of each depends on the values of $K$ of the
other variables. Previous work has considered models with dissipative dynamics.
Here we consider time-reversible models, which necessarily have the property
that every possible point in the state-space is an element of one and only one
cycle.
  As in the dissipative case, when K is large, typical orbit lengths grow
exponentially with N, whereas for small enough K, typical orbit lengths grow
much more slowly with N. The numerical data are consistent with the existence
of a phase transition at which the average orbit length grows as a power of N
at a value of K between 1.4 and 1.7. However, in the reversible models the
interplay between the discrete symmetry and quenched randomness can lead to
enormous fluctuations of orbit lengths and other interesting features that are
unique to the reversible case.
  The orbits can be classified by their behavior under time reversal. The
orbits that transform into themselves under time reversal have properties quite
different from those that do not; in particular, a significant fraction of
latter-type orbits have lengths enormously longer than orbits that are time
reversal-symmetric. For large K and moderate N, the vast majority of points in
the state-space are on one of the time reversal singlet orbits, and a random
hopping model gives an accurate description of orbit lengths. However, for any
finite K, the random hopping approximation fails qualitatively when N is large
enough ($N\gg 2^{(2^K)}$).
","[{""version"":""v1"",""created"":""Tue, 25 Apr 2000 21:51:02 GMT""}]","2009-10-31"
"cond-mat/0004423","David K. Lubensky","David K. Lubensky and David R. Nelson (Harvard Univ.)","Pulling Pinned Polymers and Unzipping DNA","4 pages, 1 EPS figure; revised references and very brief discussion
  of order of the transition added; to appear in Phys. Rev. Lett","Phys. Rev. Lett. _85_, 1572 (2000)","10.1103/PhysRevLett.85.1572",,"cond-mat.soft cond-mat.dis-nn physics.bio-ph q-bio.BM",,"  We study a class of micromanipulation experiments, exemplified by the pulling
apart of the two strands of double-stranded DNA (dsDNA). When the pulling force
is increased to a critical value, an ``unzipping'' transition occurs. For
random DNA sequences with short-ranged correlations, we obtain exact results
for the number of monomers liberated and the specific heat, including the
critical behavior at the transition. Related systems include a random
heteropolymer pulled away from an adsorbing surface and a vortex line in a type
II superconductor tilted away from a fragmented columnar defect.
","[{""version"":""v1"",""created"":""Wed, 26 Apr 2000 04:31:13 GMT""},{""version"":""v2"",""created"":""Wed, 2 Aug 2000 23:20:33 GMT""}]","2009-10-31"
"cond-mat/0004424","Mitsuaki Takigawa","Mitsuaki Takigawa, Masanori Ichioka and Kazushige Machida","Site-selective nuclear magnetic relaxation time in a superconducting
  vortex state","14Pages, 26 figures, revtex","J. Phys. Soc. Jpn. Vol. 69 No. 12, 3943 (2000)","10.1143/JPSJ.69.3943",,"cond-mat.supr-con",,"  The temperature and field dependences of the site-selective nuclear spin
relaxation time T_1 around vortices are studied comparatively both for s-wave
and d-wave superconductors, based on the microscopic Bogoliubov-de Gennes
theory. Reflecting low energy electronic excitations associated with the vortex
core, the site selective temperature dependences deviate from those of the
zero-field case, and T_1 becomes faster with approaching the vortex core. In
the core region, T_1^{-1} has a new peak below the superconducting transition
temperature T_c. The field dependence of the overall T_1(T) behaviors for
s-wave and d-wave superconductors is investigated and analyzed in terms of the
local density of states. The NMR study by the resonance field dependence may be
a new method to probe the spatial resolved vortex core structure in various
conventional and unconventional superconductors.
","[{""version"":""v1"",""created"":""Wed, 26 Apr 2000 05:28:13 GMT""}]","2009-10-31"
"cond-mat/0004425","Skipetrov Serguei E.","S.E. Skipetrov, R. Maynard","Nonuniversal correlations in multiple scattering","15 pages, 3 postscript figures, accepted to Phys. Rev. B","Phys. Rev. B 62, 886 (2000)","10.1103/PhysRevB.62.886",,"cond-mat.dis-nn cond-mat.soft physics.optics",,"  We show that intensity of a wave created by a source embedded inside a
three-dimensional disordered medium exhibits a non-universal space-time
correlation which depends explicitly on the short-distance properties of
disorder, source size, and dynamics of disorder in the immediate neighborhood
of the source. This correlation has an infinite spatial range and is
long-ranged in time. We suggest that a technique of ""diffuse microscopy"" might
be developed employing spatially-selective sensitivity of the considered
correlation to the disorder properties.
","[{""version"":""v1"",""created"":""Wed, 26 Apr 2000 07:21:10 GMT""}]","2009-10-31"
"cond-mat/0004426","Holger Fehske","Holger Fehske, Michael Holicki, Alexander Wei{\ss}e","Lattice dynamical effects on the Peierls transition in one-dimensional
  metals and spin chains","16 pages, 5 figures, Fruehjahrstagung des Arbeitskreises
  Festkoerperphysik der Deutschen Physikalischen Gesellschaft; to appear in
  Advances in Solid State Physics 2000","Advances in Solid State Physics 40, 235 (2000)","10.1007/BFb0108357",,"cond-mat.str-el",,"  The interplay of charge, spin and lattice degrees of freedom is studied for
quasi-one-dimensional electron and spin systems coupled to quantum phonons.
Special emphasis is put on the influence of the lattice dynamics on the Peierls
transition. Using exact diagonalization techniques the ground-state and
spectral properties of the Holstein model of spinless fermions and of a
frustrated Heisenberg model with magneto-elastic coupling are analyzed on
finite chains. In the non-adiabatic regime a (T=0) quantum phase transition
from a gapless Luttinger-liquid/spin-fluid state to a gapped dimerized phase
occurs at a nonzero critical value of the electron/spin-phonon interaction. To
study the nature of the spin-Peierls transition at finite temperatures for the
infinite system, an alternative Green's function approach is applied to the
magnetostrictive XY model. With increasing phonon frequency the structure
factor shows a remarkable crossover from soft-mode to central-peak behaviour.
The results are discussed in relation to recent experiments on $\rm CuGeO_3$.
","[{""version"":""v1"",""created"":""Wed, 26 Apr 2000 07:58:04 GMT""}]","2009-10-31"
"cond-mat/0004427","Wu Congjun","Xiaoqing Yu, Congjun Wu, Chui-lin Wang and Zhao-Bin Su","Electronic and Structural Properties of C$_{36}$ Molecule","15 pages, 4 figures, 4 Tables","Int. J. Mod. Phys. B, V 13, 1513(1999)","10.1142/S0217979299001557",,"cond-mat.mtrl-sci cond-mat.soft",,"  The extended SSH model and Bogoliubov-de Gennes(BdeG) formalism are applied
to investigate the electronic properties and stable lattice configurations of
C$_{36}$. We focus the problem on the molecule's unusual $D_{6h}$ symmetry. The
electronic part of the Hamiltonian without Coulomb interaction is solved
analytically. We find that the gap between HOMO and LUMO is small due to the
long distance hopping between the 2nd and 5th layers. The charge densities of
HOMO and LUMO are mainly distributed in the two layers, that causes a large
splitting between the spin triplet and singlet excitons. The differences of
bond lengths, angles and charge densities among the molecule and polarons are
discussed.
","[{""version"":""v1"",""created"":""Wed, 26 Apr 2000 09:24:15 GMT""},{""version"":""v2"",""created"":""Thu, 27 Apr 2000 01:21:51 GMT""}]","2007-05-23"
"cond-mat/0004428","Yuri M. Galperin","O. Entin-Wohlman, Y. Levinson, and Yu. M. Galperin","Acoustoelectric effect in a finite-length ballistic quantum channel","7 pages, 2 figures",,"10.1103/PhysRevB.62.7283",,"cond-mat.mes-hall",,"  The dc current induced by a coherent surface acoustic wave (SAW) of wave
vector q in a ballistic channel of length L is calculated. The current contains
two contributions, even and odd in q. The even current exists only in a
asymmetric channel, when the electron reflection coefficients r_1 and r_2 at
both channel ends are different. The direction of the even current does not
depend on the direction of the SAW propagation, but is reversed upon
interchanging r_1 and r_2. The direction of the odd current is correlated with
the direction of the SAW propagation, but is insensitive to the interchange of
r_1 and r_2. It is shown that both contributions to the current are non zero
only when the electron reflection coefficients at the channel ends are energy
dependent. The current exhibits geometric oscillations as function of qL. These
oscillations are the hallmark of the coherence of the SAW and are completely
washed out when the current is induced by a flux of non-coherent phonons. The
results are compared with those obtained previously by different methods and
under different assumptions.
","[{""version"":""v1"",""created"":""Wed, 26 Apr 2000 10:45:55 GMT""}]","2009-10-31"
"cond-mat/0004429","Julien Kockelkoren","Julien Kockelkoren, Ana\""el Lema\^itre, and Hugues Chat\'e","Phase-ordering and persistence: relative effects of
  space-discretization, chaos, and anisotropy","13 pages, to be published in Physica A",,"10.1016/S0378-4371(00)00430-1",,"cond-mat.stat-mech nlin.CD",,"  The peculiar phase-ordering properties of a lattice of coupled chaotic maps
studied recently (A. Lema\^\i tre & H. Chat\'e, {\em Phys. Rev. Lett.} {\bf
82}, 1140 (1999)) are revisited with the help of detailed investigations of
interface motion. It is shown that ``normal'', curvature-driven-like domain
growth is recovered at larger scales than considered before, and that the
persistence exponent seems to be universal. Using generalized persistence
spectra, the properties of interface motion in this deterministic, chaotic,
lattice system are found to ``interpolate'' between those of the two canonical
reference systems, the (probabilistic) Ising model, and the (deterministic),
space-continuous, time-dependent Ginzburg-Landau equation.
","[{""version"":""v1"",""created"":""Wed, 26 Apr 2000 11:47:56 GMT""}]","2016-08-15"
"cond-mat/0004430","Thomas Winiecki","T. Winiecki, B. Jackson, J. F. McCann, and C. S. Adams","Vortex shedding and drag in dilute Bose-Einstein condensates","10 pages, 5 figures. submitted to J. Phys. B for the special issue on
  Coherent Matter Waves",,"10.1088/0953-4075/33/19/317",,"cond-mat",,"  Above a critical velocity, the dominant mechanism of energy transfer between
a moving object and a dilute Bose-Einstein condensate is vortex formation. In
this paper, we discuss the critical velocity for vortex formation and the link
between vortex shedding and drag in both homogeneous and inhomogeneous
condensates. We find that at supersonic velocities sound radiation also
contributes significantly to the drag force.
","[{""version"":""v1"",""created"":""Wed, 26 Apr 2000 11:48:46 GMT""}]","2009-10-31"
"cond-mat/0004431","Julien Kockelkoren","Julien Kockelkoren and Hugues Chat\'e","Comment on ``Phase ordering in chaotic map lattices with conserved
  dynamics''","3 pages, to be published in Phys. Rev. E",,"10.1103/PhysRevE.62.3004",,"cond-mat nlin.CD",,"  Angelini, Pellicoro, and Stramaglia [Phys. Rev. E {\bf 60}, R5021 (1999),
cond-mat/9907149] (APS) claim that the phase ordering of two-dimensional
systems of sequentially-updated chaotic maps with conserved ``order parameter''
does not belong, for large regions of parameter space, to the expected
universality class. We show here that these results are due to a slow crossover
and that a careful treatment of the data yields normal dynamical scaling.
Moreover, we construct better models, i.e. synchronously-updated coupled map
lattices, which are exempt from these crossover effects, and allow for the
first precise estimates of persistence exponents in this case.
","[{""version"":""v1"",""created"":""Wed, 26 Apr 2000 12:24:08 GMT""}]","2009-10-31"
"cond-mat/0004432","Maria Elisa Sarraf Borelli","M.E.S. Borelli, H. Kleinert and Adriaan M.J. Schakel","Vertical Melting of a Stack of Membranes","8 pages, 2 figures","Eur. Phys. J. E 4, 217 (2001)","10.1007/s101890170131",,"cond-mat",,"  A stack of tensionless membranes with nonlinear curvature energy and vertical
harmonic interaction is studied. At low temperatures, the system forms a
lamellar phase. At a critical temperature, the stack disorders vertically in a
melting-like transition.
","[{""version"":""v1"",""created"":""Wed, 26 Apr 2000 12:45:14 GMT""}]","2009-10-31"
"cond-mat/0004433","Shigeki Fujiyama","S. Fujiyama, M. Takigawa, N. Motoyama, H. Eisaki and S. Uchida","Nuclear Spin Relaxation in Hole Doped Two-Leg Ladders","4 pages. to appear in J. Phys. Soc. Jpn. Vol. 69",,"10.1143/JPSJ.69.1610",,"cond-mat.str-el cond-mat.supr-con",,"  The nuclear spin-lattice relaxation rate ($1/T_{1}$) has been measured in the
single crystals of hole doped two-leg ladder compounds
Sr$_{14-x}$Ca$_{x}$Cu$_{24}$O$_{41}$ and in the undoped parent material
La$_6$Ca$_8$Cu$_{24}$O$_{41}$. Comparison of $1/T_{1}$ at the Cu and the two
distinct oxygen sites revealed that the major spectral weight of low frequency
spin fluctuations is located near $q \sim (\pi, \pi)$ for most of the
temperature and doping ranges investigated. Remarkable difference in the
temperature dependence of $1/T_1$ for the two oxygen sites in the heavily doped
$x$=12 sample revealed reduction of singlet correlations between two legs in
place of growing antiferromagnetic correlations along the leg direction with
increasing temperature. Such behavior is most likely caused by the dissociation
of bound hole pairs.
","[{""version"":""v1"",""created"":""Wed, 26 Apr 2000 13:22:07 GMT""}]","2009-10-31"
"cond-mat/0004434","Jose Ferreira Mendes","S.N. Dorogovtsev, J.F.F. Mendes and A.N. Samukhin (Departamento de
  Fisica, Universidade do Porto, Portugal)","Structure of Growing Networks: Exact Solution of the Barabasi--Albert's
  Model","4 pages revtex (twocolumn, psfig), 1 figure","Phys. Rev. Lett. 85, 4633 (2000)","10.1103/PhysRevLett.85.4633",,"cond-mat",,"  We generalize the Barab\'{a}si--Albert's model of growing networks accounting
for initial properties of sites and find exactly the distribution of
connectivities of the network $P(q)$ and the averaged connectivity
$\bar{q}(s,t)$ of a site $s$ in the instant $t$ (one site is added per unit of
time). At long times $P(q) \sim q^{-\gamma}$ at $q \to \infty$ and
$\bar{q}(s,t) \sim (s/t)^{-\beta}$ at $s/t \to 0$, where the exponent $\gamma$
varies from 2 to $\infty$ depending on the initial attractiveness of sites. We
show that the relation $\beta(\gamma-1)=1$ between the exponents is universal.
","[{""version"":""v1"",""created"":""Wed, 26 Apr 2000 13:24:22 GMT""}]","2009-10-31"
"cond-mat/0004435","JozefT. Devreese","J. Tempere and J. T. Devreese (TFVS, Universiteit Antwerpen)","Sum Rule for the Optical Absorption of an Interacting Many-Polaron Gas","16 pages, 3 figures, revised version; new results added","Eur. Phys. J. B 20 (2001) 27","10.1007/PL00011092","TFVS06-12-2000a","cond-mat.str-el",,"  A sum rule for the first frequency moment of the optical absorption of a
many-polaron system is derived, taking into account many-body effects in the
system of constituent charge carriers of the many-polaron system. In our
expression for the sum rule, the electron-phonon coupling and the many-body
effects in the electron (or hole) system formally decouple, so that the
many-body effects can be treated to the desired level of approximation by the
choice of the dynamical structure factor of the electron (hole) gas. We
calculate correction factors to take into account both low and high
experimental cutoff frequencies.
","[{""version"":""v1"",""created"":""Wed, 26 Apr 2000 14:36:23 GMT""},{""version"":""v2"",""created"":""Wed, 6 Dec 2000 13:52:23 GMT""}]","2009-10-31"
