"hep-ph/0011066","Dmitri Antonov","Dmitri Antonov (INFN, Pisa)","A Possible Universal Treatment of the Field Strength Correlator in the
  Abelian-Projected SU(2)-Theory","9 pages, LaTeX2e, no figures, new discussions of the obtained results
  are added, to appear in Phys. Lett. B","Phys.Lett. B506 (2001) 303-310","10.1016/S0370-2693(01)00239-8",,"hep-ph",,"  An integral relation between two functions parametrizing the bilocal field
strength correlator within the Stochastic Vacuum Model is obtained in the
effective Abelian-projected SU(2)-theory. This relation is independent of the
concrete properties of the ensemble of vortex loops, which are present in the
theory under study. By virtue of the lattice result stating that the infrared
asymptotic behaviours of these functions should have the same functional form,
the obtained relation enables one to find these behaviours, as well as the
infrared asymptotics of the bilocal correlator of densities of the vortex
loops. Those turn out to be exponentials, decreasing at the inverse mass of the
dual vector boson, times certain polynomials in the inverse integer powers of
the distance. This result agrees with the general predictions and the existing
lattice data better than the results of previous calculations, where these
powers were found to be half-integer ones.
","[{""version"":""v1"",""created"":""Sun, 5 Nov 2000 08:59:36 GMT""},{""version"":""v2"",""created"":""Mon, 12 Feb 2001 13:02:24 GMT""}]","2009-10-31"
"hep-th/0011025","Bertfried Fauser","Bertfried Fauser and Heinz Dehnen","Regularization of Non-Linear Spinor Field Models by Discrete Symmetries","6 pages, no figures, talk at GROUP23 conference, DUBNA",,,,"hep-th",,"  We generalize a regularization method of Stumpf 1984 in the case of
non-linear spinor field models to fourth order theories and to non-scalar
interactions. The involved discrete symmetries can be connected with C,P,T
transformations.
","[{""version"":""v1"",""created"":""Sat, 4 Nov 2000 21:01:29 GMT""}]","2007-05-23"
"hep-th/0011026","Bertfried Fauser","Bertfried Fauser","Quantum Clifford Hopf Gebra for Quantum Field Theory","10 pages, talk at the Symposium on Quantum Groups, GROUP23
  Conference, DUBNA, 2000","Adv.Appl.Clifford Algebras 13 (2003) 115-125",,,"hep-th",,"  We give arguments for the necessity to employ Quantum Clifford Hopf Gebras in
quantum field theory. The role of the antipode is examined, Feynman diagrams
are re-interpreted as tangles of graphical calculus. Regularization due to the
design of convolution Hopf gebras is given as a program for further research.
","[{""version"":""v1"",""created"":""Sat, 4 Nov 2000 21:08:47 GMT""}]","2007-05-23"
"math/0011033","Zoltan I. Szabo","Z. I. Szabo","Isospectral pairs of metrics on balls, spheres, and other manifolds with
  different local geometries","43 pages. After retrieving source, read README file or type tex whole
  to typeset (in Unix)",,,,"math.DG math.MG math.SP",,"  The first isospectral pairs of metrics are constructed on balls and spheres.
This long standing problem, concerning the existence of such pairs, has been
solved by a new method called ""Anticommutator Technique."" Among the wide range
of such pairs, the most striking examples are provided on (4k-1)-dimensional
spheres, where k > 2. One of these metrics is homogeneous (since it is the
metric on the geodesic sphere of a 2-point homogeneous space), while the other
is locally inhomogeneous. These examples demonstrate the surprising fact that
no information about the isometries is encoded in the spectrum of Laplacian
acting on functions. In other words, ""The group of isometries, even the local
homogeneity property, is lost to the ""Non-Audible"" in the debate of ""Audible
versus Non-Audible Geometry"".""
","[{""version"":""v1"",""created"":""Sun, 5 Nov 2000 00:07:40 GMT""}]","2007-05-23"
"math/0011034","Zoltan I. Szabo","Z. I. Szabo","A cornucopia of isospectral pairs of metrics on spheres with different
  local geometries","The paper has been completely revised. Accepted for publication in
  Annals of Mathematics",,,,"math.DG math.MG math.SP",,"  This article concludes the comprehensive study started in [Sz5], where the
first non-trivial isospectral pairs of metrics are constructed on balls and
spheres. These investigations incorporate 4 different cases since these balls
and spheres are considered both on 2-step nilpotent Lie groups and on their
solvable extensions. In [Sz5] the considerations are completely concluded in
the ball-case and in the nilpotent-case. The other cases were mostly outlined.
In this paper the isospectrality theorems are completely established on
spheres. Also the important details required about the solvable extensions are
concluded in this paper.
  A new so called anticommutator technique is developed for these
constructions. This tool is completely different from the other methods applied
in the field so far. It brought a wide range of new isospectrality examples.
Those constructed on geodesic spheres of certain harmonic manifolds are
particularly striking. One of these spheres is homogeneous (since it is the
geodesic sphere of a 2-point homogeneous space) while the other spheres,
although isospectral to the previous one, are not even locally homogeneous.
This shows how little information is encoded about the geometry (for instance,
about the isometries) in the spectrum of Laplacian acting on functions.
","[{""version"":""v1"",""created"":""Sun, 5 Nov 2000 00:42:27 GMT""},{""version"":""v2"",""created"":""Wed, 5 Mar 2003 00:13:58 GMT""}]","2007-05-23"
"nucl-th/0011014",,"W. C. Haxton (Washington), John Bahcall (IAS, Princeton), A. Baha
  Balantekin (Wisconsin), Stuart Freedman (Berkeley and LBNL), Kevin Lesko
  (LBNL), Hamish Robertson (Washington), Bob Lanou (Brown), George Fuller
  (UCSD), Ken Lande (Penn), Tony Mezzacappa (ORNL), Frank Avignone (South
  Carolina), Bill Louis (LANL), Petr Vogel (Caltech), Todd Haines (LANL), John
  Wilkerson (Washington)","Nuclear Physics Neutrino PreTown Meeting: Summary and Recommendations","Latex, 31 pages. This version has been updated to include final
  Comments from the working groups",,,,"nucl-th",,"  In preparation for the nuclear physics Long Range Plan exercise, a group of
104 neutrino physicists met in Seattle September 21-23 to discuss both the
present state of the field and the new opportunities of the next decade. This
report summarizes the conclusions of that meeting and presents its
recommendations. Further information is available at the workshop's web site.
This report will be further reviewed at the upcoming Oakland Town Meeting.
","[{""version"":""v1"",""created"":""Sun, 5 Nov 2000 10:42:41 GMT""},{""version"":""v2"",""created"":""Wed, 8 Nov 2000 00:29:21 GMT""}]","2007-05-23"
"physics/0011012","Pavel L. Chapovsky","P.L. Chapovsky","Coherent control of enrichment and conversion of molecular spin isomers","REVTEX, 13 pages + 6 eps figures","Phys. Rev. A v.63, 063402-(1-7) (2001)","10.1103/PhysRevA.63.063402",,"physics.chem-ph physics.optics",,"  A theoretical model of nuclear spin conversion in molecules controlled by an
external electromagnetic radiation resonant to rotational transition has been
developed. It has been shown that one can produce an enrichment of spin isomers
and influence their conversion rates in two ways, through coherences and
through level population change induced by radiation. Influence of conversion
is ranged from significant speed up to almost complete inhibition of the
process by proper choice of frequency and intensity of the external field.
","[{""version"":""v1"",""created"":""Sun, 5 Nov 2000 04:35:28 GMT""}]","2009-11-06"
