"cond-mat/0011084","Francesco Ancilotto","Pier Luigi Silvestrelli, Flavio Toigo, and Francesco Ancilotto","Acetylene on Si(100) from first principles: adsorption geometries,
  equilibrium coverages and thermal decomposition","8 pages, 3 figures (submitted to J. Chem. Phys",,"10.1063/1.1366713",,"cond-mat",,"  Adsorption of acetylene on Si(100) is studied from first principles. We find
that, among a number of possible adsorption configurations, the lowest-energy
structure is a ``bridge'' configuration, where the C$_2$H$_2$ molecule is
bonded to two Si atoms. Instead, ``pedestal'' configurations, recently proposed
as the lowest-energy structures, are found to be much higher in energy and,
therefore, can represent only metastable adsorption sites. We have calculated
the surface formation energies for two different saturation coverages, namely
0.5 and 1 monolayer, both observed in experiments. We find that although, in
general, the full monolayer coverage is favored, a narrow range of temperatures
exists in which the 0.5 monolayer coverage is the most stable one, where the
acetylene molecules are adsorbed in a $2\times 2$ structure. This result
disagrees with the conclusions of a recent study and represents a possible
explanation of apparently controversial experimental findings. The crucial role
played by the use of a gradient-corrected density functional is discussed.
Finally, we study thermal decomposition of acetylene adsorbed on Si(100) by
means of finite-temperature Molecular Dynamics, and we observe an unexpected
behavior of dehydrogenated acetylene molecules.
","[{""version"":""v1"",""created"":""Mon, 6 Nov 2000 10:13:09 GMT""}]","2009-10-31"
"cond-mat/0011085","Pierre-Gilles de Gennes","Pierre-Gilles de Gennes","""Young"" soap films","9 pages, 3 EPS figures, submitted Langmuir, 27/10/00",,,,"cond-mat.soft",,"  If we pull out rapidly a metallic frame out of a surfactant solution, we
arrive at a ""young"" soap film with relatively simple features, as noticed first
by Lucassen. The weight of the film is equilibrated by a vertical gradient of
surface tension. At each level, the local solution concentration equilibrates
with the local monolayers. A detailed analysis of the young films was started
by us in 1987. We present here an approach which is more illuminating a) the
concentration profiles decay exponentially at large heights, with a
characteristic length in the range of meters b) the surface is protected up to
a different (larger) height c) we also review the dynamic requirements. The
surfactant must reach the surface in a time shorter than the free fall time of
a pure water film.
","[{""version"":""v1"",""created"":""Mon, 6 Nov 2000 11:12:03 GMT""}]","2007-05-23"
"cond-mat/0011086","Guido Caldarelli","G. Caldarelli (INFM and Dip. Fisica, Universita' di Roma1, Roma Italy)","Cellular Models for River Networks","7 pages, revtex style, 14 figures",,"10.1103/PhysRevE.63.021118",,"cond-mat.stat-mech",,"  A cellular model introduced for the evolution of the fluvial landscape is
revisited using extensive numerical and scaling analyses. The basic network
shapes and their recurrence especially in the aggregation structure are then
addressed. The roles of boundary and initial conditions are carefully analyzed
as well as the key effect of quenched disorder embedded in random pinning of
the landscape surface. It is found that the above features strongly affect the
scaling behavior of key morphological quantities. In particular, we conclude
that randomly pinned regions (whose structural disorder bears much physical
meaning mimicking uneven landscape-forming rainfall events, geological
diversity or heterogeneity in surficial properties like vegetation, soil cover
or type) play a key role for the robust emergence of aggregation patterns
bearing much resemblance to real river networks.
","[{""version"":""v1"",""created"":""Mon, 6 Nov 2000 14:03:04 GMT""}]","2009-10-31"
"cond-mat/0011087","Arkadiusz Wojs","John J. Quinn, Arkadiusz Wojs, Jennifer J. Quinn, and Arthur T.
  Benjamin","Transformation of Statistics in Fractional Quantum Hall Systems","4 pages, 1 figure, poster at ARW in Queenstown, New Zealand (2001)","Physica E 11, 182 (2001)","10.1016/S1386-9477(01)00199-0",,"cond-mat.mes-hall",,"  A Fermion to Boson transformation is accomplished by attaching to each
Fermion a tube carrying a single quantum of flux oriented opposite to the
applied magnetic field. When the mean field approximation is made in Haldane's
spherical geometry, the Fermion angular momentum l_F is replaced by
l_B=l_F-(N-1)/2. The set of allowed total angular momentum multiplets is
identical in the two different pictures. The Fermion and Boson energy spectra
in the presence of many body interactions are identical only if the
pseudopotential V (interaction energy as a function of pair angular momentum
L_12) increases as L_12(L_12+1). Similar bands of low energy states occur in
the two spectra if V increases more quickly than this.
","[{""version"":""v1"",""created"":""Mon, 6 Nov 2000 12:05:27 GMT""}]","2009-10-31"
"cond-mat/0011088","Didier Sornette","D. Sornette (Univ. Nice/CNRS and UCLA)","Fokker-Planck equation of distributions of financial returns and power
  laws","11 pages, in press in Physica A","Physica A 290 (1-2), 211-217 (2001)","10.1016/S0378-4371(00)00571-9",,"cond-mat.stat-mech q-fin.ST",,"  Our purpose is to relate the Fokker-Planck formalism proposed by [Friedrich
et al., Phys. Rev. Lett. 84, 5224 (2000)] for the distribution of stock market
returns to the empirically well-established power law distribution with an
exponent in the range 3-5. We show how to use Friedrich et al.'s formalism to
predict that the distribution of returns is indeed asymptotically a power law
with an exponent mu that can be determined from the Kramers-Moyal coefficients
determined by Friedrich et al. However, with their values determined for the
U.S. dollar-German mark exchange rates, the exponent mu predicted from their
theory is found around 12, in disagreement with the often-quoted value between
3 and 5. This could be explained by the fact that the large asymptotic value of
12 does not apply to real data that lie still far from the stationary state of
the Fokker-Planck description. Another possibility is that power laws are
inadequate. The mechanism for the power law is based on the presence of
multiplicative noise across time-scales, which is different from the
multiplicative noise at fixed time-scales implicit in the ARCH models developed
in the Finance literature.
","[{""version"":""v1"",""created"":""Mon, 6 Nov 2000 14:04:39 GMT""}]","2009-10-31"
"cond-mat/0011089","Toni Ramsak","P. Prelovsek and A. Ramsak (Faculty of Mathematics and Physics, J.
  Stefan Institute, Ljubljana, Slovenia)","Spectral functions and pseudogap in the t-J model","Minor corrections; to appear in Phys. Rev. B (RC)","Phys. Rev. B, 63 (2001) 180506(R)","10.1103/PhysRevB.63.180506",,"cond-mat.str-el",,"  We calculate spectral functions within the t-J model as relevant to cuprates
in the regime from low to optimum doping. On the basis of equations of motion
for projected operators an effective spin-fermion coupling is derived. The self
energy due to short-wavelength transverse spin fluctuations is shown to lead to
a modified selfconsistent Born approximation, which can explain strong
asymmetry between hole and electron quasiparticles. The coupling to
long-wavelength longitudinal spin fluctuations governs the low-frequency
behavior and results in a pseudogap behavior, which at low doping effectively
truncates the Fermi surface.
","[{""version"":""v1"",""created"":""Mon, 6 Nov 2000 14:43:46 GMT""},{""version"":""v2"",""created"":""Wed, 28 Feb 2001 16:34:10 GMT""}]","2009-10-31"
"cs/0011005","Michiel Ronsse","Michiel Ronsse and Koen De Bosschere","Non-intrusive on-the-fly data race detection using execution replay","In M. Ducasse (ed), proceedings of the Fourth International Workshop
  on Automated Debugging (AAdebug 2000), August 2000, Munich. cs.SE/0010035",,,,"cs.SE cs.PL",,"  This paper presents a practical solution for detecting data races in parallel
programs. The solution consists of a combination of execution replay (RecPlay)
with automatic on-the-fly data race detection. This combination enables us to
perform the data race detection on an unaltered execution (almost no probe
effect). Furthermore, the usage of multilevel bitmaps and snooped matrix clocks
limits the amount of memory used. As the record phase of RecPlay is highly
efficient, there is no need to switch it off, hereby eliminating the
possibility of Heisenbugs because tracing can be left on all the time.
","[{""version"":""v1"",""created"":""Mon, 6 Nov 2000 13:03:11 GMT""}]","2007-05-23"
"cs/0011006","Michiel Ronsse","Michiel Ronsse, Koen De Bosschere and Jacques Chassin de Kergommeaux","Execution replay and debugging","In M. Ducasse (ed), proceedings of the Fourth International Workshop
  on Automated Debugging (AADebug 2000), August 2000, Munich. cs.SE/0010035",,,,"cs.SE cs.PL",,"  As most parallel and distributed programs are internally non-deterministic --
consecutive runs with the same input might result in a different program flow
-- vanilla cyclic debugging techniques as such are useless. In order to use
cyclic debugging tools, we need a tool that records information about an
execution so that it can be replayed for debugging. Because recording
information interferes with the execution, we must limit the amount of
information and keep the processing of the information fast. This paper
contains a survey of existing execution replay techniques and tools.
","[{""version"":""v1"",""created"":""Mon, 6 Nov 2000 13:24:32 GMT""}]","2007-05-23"
"cs/0011007","Khalil Sima'an","Khalil Sima'an","Tree-gram Parsing: Lexical Dependencies and Structural Relations","8 pages. Appeared in Proceedings of the 38th Annual Meeting of the
  Association for Computational Linguistics (ACL'00), Hong Kong, China",,,,"cs.CL cs.AI cs.HC",,"  This paper explores the kinds of probabilistic relations that are important
in syntactic disambiguation. It proposes that two widely used kinds of
relations, lexical dependencies and structural relations, have complementary
disambiguation capabilities. It presents a new model based on structural
relations, the Tree-gram model, and reports experiments showing that structural
relations should benefit from enrichment by lexical dependencies.
","[{""version"":""v1"",""created"":""Mon, 6 Nov 2000 13:56:42 GMT""}]","2007-05-23"
"cs/0011008","Manfred Schmidt-Schauss","Manfred Schmidt-Schau{\ss} and Michael Huber","A Lambda-Calculus with letrec, case, constructors and non-determinism",,,,,"cs.PL cs.AI cs.SC",,"  A non-deterministic call-by-need lambda-calculus \calc with case,
constructors, letrec and a (non-deterministic) erratic choice, based on
rewriting rules is investigated. A standard reduction is defined as a variant
of left-most outermost reduction. The semantics is defined by contextual
equivalence of expressions instead of using $\alpha\beta(\eta)$-equivalence. It
is shown that several program transformations are correct, for example all
(deterministic) rules of the calculus, and in addition the rules for garbage
collection, removing indirections and unique copy.
  This shows that the combination of a context lemma and a meta-rewriting on
reductions using complete sets of commuting (forking, resp.) diagrams is a
useful and successful method for providing a semantics of a functional
programming language and proving correctness of program transformations.
","[{""version"":""v1"",""created"":""Mon, 6 Nov 2000 14:52:33 GMT""}]","2007-05-23"
"gr-qc/0011016","Yavuz Nutku","A. N. Aliev and Y. Nutku","Impulsive spherical gravitational waves",,"Class.Quant.Grav. 18 (2001) 891-906","10.1088/0264-9381/18/5/308",,"gr-qc",,"  Penrose's identification with warp provides the general framework for
constructing the continuous form of impulsive gravitational wave metrics. We
present the 2-component spinor formalism for the derivation of the full family
of impulsive spherical gravitational wave metrics which brings out the power in
identification with warp and leads to the simplest derivation of exact
solutions. These solutions of the Einstein vacuum field equations are obtained
by cutting Minkowski space into two pieces along a null cone and re-identifying
them with warp which is given by an arbitrary non-linear holomorphic
transformation. Using 2-component spinor techniques we construct a new metric
describing an impulsive spherical gravitational wave where the vertex of the
null cone lies on a world-line with constant acceleration.
","[{""version"":""v1"",""created"":""Mon, 6 Nov 2000 13:39:45 GMT""}]","2009-10-31"
"hep-ex/0011021","David E. Jaffe","David E. Jaffe","Search for CP violation at CLEO","7 pages, 5 figures, contribution to the proceedings of CPconf 2000,
  International Conference On CP Violation Physics, September 18-22, 2000,
  Ferrara, ITALY. Replacement version with typos and grammar corrections","Nucl.Phys.Proc.Suppl. 99B (2001) 174-180","10.1016/S0920-5632(01)01376-7",,"hep-ex",,"  Recent results from CLEO on the search for CP violation in beauty and charm
meson decays are reviewed.
","[{""version"":""v1"",""created"":""Mon, 6 Nov 2000 14:30:01 GMT""},{""version"":""v2"",""created"":""Thu, 21 Dec 2000 20:05:48 GMT""}]","2009-10-31"
"hep-lat/0011033","Roberto De Pietri","R. De Pietri","Matrix model formulation of four dimensional gravity","Lattice 2000 (Gravity), 4 pages,4 figures, uses espcrc2.sty","Nucl.Phys.Proc.Suppl. 94 (2001) 697-700","10.1016/S0920-5632(01)00880-5",,"hep-lat",,"  The attempt of extending to higher dimensions the matrix model formulation of
two-dimensional quantum gravity leads to the consideration of higher rank
tensor models. We discuss how these models relate to four dimensional quantum
gravity and the precise conditions allowing to associate a four-dimensional
simplicial manifold to Feynman diagrams of a rank-four tensor model.
","[{""version"":""v1"",""created"":""Mon, 6 Nov 2000 02:19:09 GMT""}]","2009-10-31"
"hep-ph/0011067","Pietro Antonio Grassi","P.A. Grassi (New York Univ.), T. Hurth (CERN), and M. Steinhauser
  (Hamburg Univ., Inst. Theo. Phys. II)","Non-invariant two-loop counterterms for the three-gauge-boson vertices","Some minor corrections and improved discussion in the one-loop
  section","JHEP 0011 (2000) 037","10.1088/1126-6708/2000/11/037","CERN-TH/2000-304, DESY 00-157, NYU-TH/00/01/03, November 2000. 19pp","hep-ph hep-th",,"  Some practical applications of algebraic renormalization are discussed. In
particular we consider the two-loop QCD corrections to the three-gauge-boson
vertices involving photons, Z and W bosons. For this purpose also the
corresponding two-point functions have to be discussed. A recently developed
procedure is used to analyze the breaking terms of the functional identities
and explicit formulae for the universal counterterms are provided. Special
attention is devoted to the treatment of infra-red divergences.
","[{""version"":""v1"",""created"":""Mon, 6 Nov 2000 00:00:58 GMT""},{""version"":""v2"",""created"":""Tue, 14 Nov 2000 22:27:23 GMT""}]","2009-10-31"
"hep-ph/0011068","Nicole Fiona Bell","Nicole F. Bell, R. F. Sawyer and Raymond R. Volkas","Synchronisation and MSW sharpening of neutrinos propagating in a flavour
  blind medium","8 pages, 3 figures, accepted for publication in Phys. Lett. B","Phys.Lett.B500:16-21,2001","10.1016/S0370-2693(01)00050-8",,"hep-ph quant-ph",,"  We consider neutrino oscillations in a medium in which scattering processes
are blind to the neutrino flavour. We present an analytical derivation of the
synchronised behaviour obtained in the limit where the average scattering rate
is much larger than the oscillation frequency. We also examine MSW transitions
in these circumstances, and show that a sharpening of the transition can
result.
","[{""version"":""v1"",""created"":""Mon, 6 Nov 2000 00:26:50 GMT""},{""version"":""v2"",""created"":""Fri, 5 Jan 2001 02:06:09 GMT""}]","2008-11-26"
"hep-ph/0011069","K. Oganessyan","K.A. Oganessyan, N. Bianchi, E. De Sanctis, W.-D. Nowak","Single Spin Asymmetries in Semi-Inclusive Electroproduction: Access to
  Transversity","5 pages, Latex using aipproc.sty (included), to appear in proceedings
  of ""Second Workshop on Physics with an Electron Polarized Light Ion
  Collider"", Sept. 14-16, 2000, MIT, Cambridge, USA","AIP Conf.Proc. 588 (2001) 260-264","10.1063/1.1413165",,"hep-ph",,"  We discuss the quark transversity distribution function and a possible way to
access it through the measurement of single spin azimuthal asymmetry in
semi-inclusive single pion electroproduction on a transversely polarized
target.
","[{""version"":""v1"",""created"":""Mon, 6 Nov 2000 08:59:23 GMT""}]","2016-09-06"
"hep-ph/0011070","Yoshio Koide","Yoshio Koide and Hideo Fusaoka","Evolution of the Yukawa coupling constants and seesaw operators in the
  universal seesaw model","21 pages, RevTex, 10 figures","Phys.Rev.D64:053014,2001","10.1103/PhysRevD.64.053014","US-00-10 and AMU-00-10","hep-ph",,"  The general features of the evolution of the Yukawa coupling constants and
seesaw operators in the universal seesaw model with det M_F=0 are investigated.
Especially, it is checked whether the model causes bursts of Yukawa coupling
constants, because in the model not only the magnitude of the Yukawa coupling
constant (Y_L^u)_{33} in the up-quark sector but also that of (Y_L^d)_{33} in
the down-quark sector is of the order of one, i.e., (Y_L^u)_{33} \sim
(Y_L^d)_{33} \sim 1. The requirement that the model should be calculable
perturbatively puts some constraints on the values of the intermediate mass
scales and tan\beta (in the SUSY model).
","[{""version"":""v1"",""created"":""Mon, 6 Nov 2000 11:55:19 GMT""},{""version"":""v2"",""created"":""Fri, 18 May 2001 11:55:49 GMT""}]","2014-11-17"
"hep-ph/0011071","Shro Oleg Ivanovich","A. F. Krutov, O. I. Shro and V. E. Troitsky","Isgur--Wise function in a relativistic model of constituent quarks","10 pages, latex, 1 figure as eps-file","Phys.Lett.B502:140-146,2001","10.1016/S0370-2693(00)01377-0",,"hep-ph",,"  The integral representation for Isgur -- Wise function (IWF) is obtained in
the framework of instant--form relativistic Hamiltonian dynamics for mesons
with one heavy quark. The upper and lower limits are calculated for the slope
parameter of IWF $\rho^2$ by the model independent way. IWF is calculated for
different wave functions of quarks in the meson. The difference between the
limits of $\rho^2$ equals 1/3. The constraint on the slope parameter is in a
good agreement with experiments. The weak dependence of IWF on the choice of
wave functions is found.
","[{""version"":""v1"",""created"":""Mon, 6 Nov 2000 10:26:16 GMT""},{""version"":""v2"",""created"":""Wed, 8 Nov 2000 07:56:23 GMT""}]","2014-11-17"
"hep-ph/0011072","Hungchong Kim","Hungchong Kim, Su Houng Lee and Makoto Oka","Proper construction of the continuum in light-cone QCD sum rules","12 pages including 3 figures, substantially revised, version to be
  published in Progress of Theoretical Physics","Prog.Theor.Phys. 109 (2003) 371-381","10.1143/PTP.109.371",,"hep-ph nucl-th",,"  A proper way of subtracting the continuum contributions in light-cone QCD sum
rules (LCQSR) is demonstrated. Specifically, we calculate the continuum
corresponding to a typical OPE appearing in LCQSR by properly combining the
double dispersion relation with QCD duality. We demonstrate how the subtraction
terms can spuriously contribute to the sum rules. In the limit of zero external
momentum, taking out the spurious continuum is found to yield the sum rules
using the single-variable dispersion relation. The continuum factor constructed
in this way differs from the one appearing in usual LCQSR. The difference
substantially affects the extraction of hadronic parameters from the
correlation function involving baryon currents.
","[{""version"":""v1"",""created"":""Mon, 6 Nov 2000 10:31:22 GMT""},{""version"":""v2"",""created"":""Tue, 17 Apr 2001 06:27:15 GMT""},{""version"":""v3"",""created"":""Thu, 27 Feb 2003 01:51:17 GMT""}]","2009-10-31"
"hep-ph/0011073","Tomislav Prokopec","Tomislav Prokopec","Electrogenesis in a scalar field dominated epoch",,,"10.1142/9789812799913_0039","HD-THEP-00-56","hep-ph astro-ph gr-qc hep-th",,"  In this talk I discuss models in which a homogeneous scalar field is used to
modify standard cosmology above the nucleosynthesis scale to provide an
explanation for the observed matter-antimatter asymmetry of the Universe.
","[{""version"":""v1"",""created"":""Mon, 6 Nov 2000 11:39:08 GMT""}]","2017-08-23"
"hep-ph/0011074","Carlo Giunti","C. Giunti, C.W. Kim","Quantum Mechanics of Neutrino Oscillations","13 pages, no figures","Found.Phys.Lett. 14 (2001) 213-229",,"KIAS-P00070","hep-ph astro-ph hep-ex",,"  We present a simple but general treatment of neutrino oscillations in the
framework of quantum mechanics using plane waves and intuitive wave packet
principles when necessary. We attempt to clarify some confusing statements that
have recently appeared in the literature.
","[{""version"":""v1"",""created"":""Mon, 6 Nov 2000 13:32:49 GMT""}]","2007-05-23"
"hep-ph/0011075","Stefan Groote","M. Fischer, S. Groote, J.G. K\""orner and M.C. Mauser","Longitudinal, transverse-plus and transverse-minus W-bosons in
  unpolarized top quark decays at O(alpha_s)","5 pages in REVTeX, including 5 encapsulated Postscript figures,
  version to appear in Phys. Rev. D63 (3rd issue), rapid communications","Phys.Rev.D63:031501,2001","10.1103/PhysRevD.63.031501","MZ-TH/00-50","hep-ph",,"  We consider the O(alpha_s) radiative corrections to the decay of an
unpolarized top quark into a bottom quark and a W-gauge boson where the
helicities of the W are specified as longitudinal, transverse-plus and
transverse-minus. The O(alpha_s) radiative corrections lower the normalized
longitudinal rate Gamma_L/Gamma by 1.06% and increase the the normalized
transverse-minus rate Gamma_-/Gamma by 2.17%. We find that the normalized
transverse-plus rate Gamma_+/Gamma, which vanishes at the Born term level for
m_b->0, receives radiative correction contributions at the sub-percent level.
We discuss m_b!=0 effects for the Born term and the alpha_s-contributions but
find these to be small. Our results are discussed in the light of recent
measurements of the helicity content of the W in top quark decays by the CDF
Collaboration.
","[{""version"":""v1"",""created"":""Mon, 6 Nov 2000 14:30:32 GMT""},{""version"":""v2"",""created"":""Tue, 19 Dec 2000 12:56:53 GMT""}]","2009-12-31"
"hep-ph/0011076","Christof Wetterich","C.Wetterich","Instantons and color symmetry breaking in the vacuum","8 pages,LaTex,modified instanton vertex,improved mass of eta'","Phys.Lett. B525 (2002) 277-282","10.1016/S0370-2693(01)01445-9","HD-THEP-00-54","hep-ph nucl-th",,"  The instanton interaction in QCD generates an effective potential for scalar
quark-antiquark condensates in the color singlet and octet channels. For three
light quark flavors the cubic term in this potential induces an octet
condensate and ``spontaneous breaking'' of color in the vacuum. Realistic
masses of the rho- and eta'-mesons are compatible with
renormalization-group-improved instanton perturbation theory.
","[{""version"":""v1"",""created"":""Mon, 6 Nov 2000 14:11:08 GMT""},{""version"":""v2"",""created"":""Tue, 5 Dec 2000 13:56:28 GMT""}]","2009-10-31"
"hep-ph/0011077","Marc Sher","Shuquan Nie and Marc Sher (William and Mary)","t-channel production of heavy charged leptons","Increased discussion of experimental signatures. Version accepted by
  PRD","Phys.Rev.D63:053001,2001","10.1103/PhysRevD.63.053001","WM-00-113","hep-ph",,"  We study the pair production of heavy charged exotic leptons at e+ e-
colliders in the SU(2)_L x SU(2)_I x U(1)_Y model. This gauge group is a
subgroup of the grand unification group E6; SU(2)_I commutes with the electric
charge operator, and the three corresponding gauge bosons are electrically
neutral. In addition to the standard photon and Z boson contributions, we also
include the contributions from extra neutral gauge bosons. A t-channel
contribution due to W_I-boson exchange, which is unsuppressed by mixing angles,
is quite important. We calculate the left-right and forward-backward
asymmetries, and discuss how to differentiate different models.
","[{""version"":""v1"",""created"":""Mon, 6 Nov 2000 14:47:54 GMT""},{""version"":""v2"",""created"":""Mon, 11 Dec 2000 15:29:06 GMT""}]","2011-03-23"
