"hep-th/0011027",,"A. Losev, M. Shifman, A. Vainshtein","Single State Supermultiplet in 1+1 Dimensions","LaTex, 42 pages, no figures. Contribution to the Michael Marinov
  Memorial Volume, ``Multiple facets of quantization and supersymmetry'' (eds.
  M.Olshanetsky and A. Vainshtein, to be publish by World Scientific). The
  paper is drastically revised compared to the first version. We add sections
  treating the following issues: (i) a new index counting one-state
  supermultiplets; (ii) analysis of hybrid models of general type; (iii)
  generalization of the anomaly in the central charge accounting for the target
  space metric","NewJ.Phys.4:21,2002","10.1088/1367-2630/4/1/321","TPI-MINN-59/01, UMN-TH-2040/01","hep-th",,"  We consider multiplet shortening for BPS solitons in N=1 two-dimensional
models. Examples of the single-state multiplets were established previously in
N=1 Landau-Ginzburg models. The shortening comes at a price of loosing the
fermion parity $(-1)^F$ due to boundary effects. This implies the disappearance
of the boson-fermion classification resulting in abnormal statistics. We
discuss an appropriate index that counts such short multiplets.
  A broad class of hybrid models which extend the Landau-Ginzburg models to
include a nonflat metric on the target space is considered. Our index turns out
to be related to the index of the Dirac operator on the soliton reduced moduli
space (the moduli space is reduced by factoring out the translational modulus).
The index vanishes in most cases implying the absence of shortening. In
particular, it vanishes when there are only two critical points on the compact
target space and the reduced moduli space has nonvanishing dimension.
  We also generalize the anomaly in the central charge to take into account the
target space metric.
","[{""version"":""v1"",""created"":""Sun, 5 Nov 2000 23:22:22 GMT""},{""version"":""v2"",""created"":""Thu, 24 Jan 2002 07:48:06 GMT""}]","2008-11-26"
"hep-th/0011028","Hiroshi Itoyama","H. Itoyama","Note on Open String/D-brane System and Noncommutative Soliton","13 pages, Latex",,,"OU-HET-368","hep-th",,"  This is a summary of a series of papers hep-th/9910263,0005283,0010066
written with B. Chen, T. Matsuo and K. Murakami on a p-p', (p<p^{\prime}) open
string with B_{ij} field, which has led us to the explicit identification of
the Dp-brane with the noncommutative projector soliton via the gaussian damping
factor. A lecture given at Summer Institute 2000, FujiYoshida, Yamanashi,
Japan, at August 7-14, 2000.
","[{""version"":""v1"",""created"":""Mon, 6 Nov 2000 03:22:53 GMT""}]","2007-05-23"
"hep-th/0011029","Kluson Josef","J. Kluson","Matrix Model and String Field Theory","23 pages, Revised paper, new proofs of the properties of BRST
  operator included, relation with cubic string field theory discussed,
  reference added",,,,"hep-th",,"  In this short note we would like to show the relation between the cubic
string field theory for N D-instantons and the string field theory in the
presence of the background B field.
","[{""version"":""v1"",""created"":""Mon, 6 Nov 2000 05:16:53 GMT""},{""version"":""v2"",""created"":""Fri, 18 May 2001 07:14:47 GMT""}]","2007-05-23"
"hep-th/0011030","Ilya Shapiro","J.C. Fabris, A.M. Pelinson and I.L. Shapiro","Anomaly-Induced Effective Action and Inflation","4 pages, LaTeX. Contribution to the Proceedings of the EuroConference
  on Frontiers in Particle Astrophysics and Cosmology, 30 September - 5 October
  2000. San Feliu, Spain","Nucl.Phys.Proc.Suppl. 95 (2001) 78-81","10.1016/S0920-5632(01)01060-X","DF/UFJF-00/08","hep-th",,"  In the early Universe matter can be described as a conformal invariant
ultra-relativistic perfect fluid, which does not contribute, on classical
level, to the evolution of the isotropic and homogeneous metric. If we suppose
that there is some desert in the particle spectrum just below the Planck mass,
then the effect of conformal trace anomaly is dominating at the corresponding
energies. With some additional constraints on the particle content of the
underlying gauge model (which favor extended or supersymmetric versions of the
Standard Model rather than the minimal one), one arrives at the stable
inflation. We review the model and report about the calculation of the
gravitational waves on the background of the anomaly-induced inflation. The
result for the perturbation spectrum is close to the one for the conventional
inflaton model, and is in agreement with the existing Cobe data (see also
[hep-th/0009197]).
","[{""version"":""v1"",""created"":""Mon, 6 Nov 2000 13:48:46 GMT""}]","2009-10-31"
"hep-th/0011031","Michael Faux","M. Faux, D.Lust and B.A. Ovrut","Twisted Sectors and Chern-Simons Terms in M-Theory Orbifolds","21 pages, LaTeX","Int.J.Mod.Phys.A18:2995-3014,2003","10.1142/S0217751X03015738","CU-TP-988, HU-EP 00/47, UPR-909T","hep-th",,"  It is shown that the twisted sector spectrum, as well as the associated
Chern-Simons interactions, can be determined on M-theory orbifold fixed planes
that do not admit gravitational anomalies. This is demonstrated for the
seven-planes arising within the context of an explicit $R^6 \times S^1/Z_2
\times T^4/Z_2$ orbifold, although the results are completely general. Local
anomaly cancellation in this context is shown to require fractional anomaly
data that can only arise from a twisted sector on the seven-planes, thus
determining the twisted spectrum up to a small ambiguity. These results open
the door to the construction of arbitrary M-theory orbifolds, including those
containing fixed four-planes which are of phenomenological interest.
","[{""version"":""v1"",""created"":""Mon, 6 Nov 2000 15:10:20 GMT""}]","2009-10-07"
"hep-th/0011032","Plamen Bozhilov","P. Bozhilov","Null p-Branes","125 pages, LaTeX, no figures, Ph.D. Thesis, Institute for Nuclear
  Research and Nuclear Energy, Bulgarian Academy of Sciences, Sofia, Bulgaria.
  arXiv admin note: substantial text overlap with hep-th/9702201 by other
  author",,,,"hep-th",,"  The dissertation is devoted to the description and further investigation of
the properties of null p-branes.
","[{""version"":""v1"",""created"":""Mon, 6 Nov 2000 15:24:06 GMT""}]","2015-07-24"
"math-ph/0011006","Robert Coquereaux","Robert Coquereaux (1 and 2) ((1) CERN, TH Division, Geneva,
  Switzerland, (2) CPT, CNRS, Marseille, France)","Notes on the quantum tetrahedron","45 pages, LaTeX, 10 eps figures. Revised version: several
  improvements taking into account remarks of the referee","Moscow Math.J. 2N1 (2002) 41-80",,"CERN-TH/2000-179, CPT-2000/P.4077","math-ph hep-th math.MP math.QA",,"  This is a set of notes describing several aspects of the space of paths on
ADE Dynkin diagrams, with a particular attention paid to the graph E6. Many
results originally due to A. Ocneanu are here described in a very elementary
way (manipulation of square or rectangular matrices). We recall the concept of
essential matrices (intertwiners) for a graph and describe their module
properties with respect to right and left actions of fusion algebras. In the
case of the graph E6, essential matrices build up a right module with respect
to its own fusion algebra but a left module with respect to the fusion algebra
of A11. We present two original results: 1) Our first contribution is to show
how to recover the Ocneanu graph of quantum symmetries of the Dynkin diagram E6
from the natural multiplication defined in the tensor square of its fusion
algebra (the tensor product should be taken over a particular subalgebra); this
is the Cayley graph for the two generators of the twelve dimensional algebra E6
\otimes_A3 E6 and E6 refer to the commutative fusion algebras of the
corresponding graphs). 2) To every point of the graph of quantum symmetries one
can associate a particular matrix describing the `` torus structure'' of the
chosen Dynkin diagram; following Ocneanu, one obtains in this way, in the case
of E6, twelve such matrices of dimension 11x11, one of them is a modular
invariant and encodes the partition function of the corresponding conformal
field theory. Our own next contribution is to provide a simple algorithm for
the determination of these matrices.
","[{""version"":""v1"",""created"":""Mon, 6 Nov 2000 15:39:05 GMT""},{""version"":""v2"",""created"":""Thu, 9 Nov 2000 10:33:08 GMT""},{""version"":""v3"",""created"":""Fri, 26 Jan 2001 17:32:13 GMT""},{""version"":""v4"",""created"":""Thu, 15 Feb 2001 14:53:02 GMT""},{""version"":""v5"",""created"":""Thu, 20 Dec 2001 15:51:28 GMT""}]","2007-05-23"
"math/0011032","Alexander Polishchuk","Alexander Polishchuk and Arkady Vaintrob","Algebraic construction of Witten's top Chern class","23 pages, AMSLatex",,,,"math.AG",,"  We give a construction of Witten's ""top Chern class"" on the compactified
moduli space of curves with higher spin structures and show that it satisfies
most of the axioms proposed in math.AG/9905034.
","[{""version"":""v1"",""created"":""Mon, 6 Nov 2000 14:10:54 GMT""}]","2007-05-23"
"math/0011035","Nik. A. Tyurin","Andrei Tyurin","Three mathematical faces of SU(2) - spin networks","Latex2e, 20 pages without figures",,,,"math.DG math.AG",,"  Spin networks are at the core of quantum gravity. Our aim is to plug the
mathematical community at large into the procedures turn to create a finite
quantum theory of general relativity. For this, because of the different
cultural backgraund, we would like to change the tack: to relate discrete
(combinatorial) objects to the standard ""contineous"" geometry.
","[{""version"":""v1"",""created"":""Sun, 5 Nov 2000 16:23:09 GMT""}]","2007-05-23"
"math/0011037","Jacob A. Siehler","Jacob A. Siehler","Braided Near-group Categories","8 pages, no figures",,,,"math.QA math.AT",,"  A near-group category is an additively semisimple category with a product
such that all but one of the simple objects is invertible. We classify braided
structures on near-group categories, and give explicit numerical formulas for
their associativity and commutativity morphisms.
","[{""version"":""v1"",""created"":""Mon, 6 Nov 2000 15:03:57 GMT""}]","2007-05-23"
"nlin/0011010","Olshanet","M.Olshanetsky","W-geometry and Isomonodromic Deformations","15 pages, Talk given at the CRM Workshop on Isomonodromic
  Deformations and Applications in Physics, Montreal, May, 2000",,,"ITEP-TH-60/00","nlin.SI hep-th",,"  We introduce new times in the monodromy preserving equations. While the usual
times related to the moduli of complex structures of Riemann curves such as
coordinates of marked points, we consider the moduli of generalized complex
structures ($W$-structures) as the new times. We consider linear differential
matrix equations depending on $W$-structures on an arbitrary Riemann curve. The
monodromy preserving equations have a Hamiltonian form. They are derived via
the symplectic reduction procedure from a free gauge theory as well as the
associate linear problems. The quasi-classical limit of isomonodromy problem
leads to integrable hierarchies of the Hitchin type. In this way the
generalized complex structures parametrized the moduli of these hierarchies.
","[{""version"":""v1"",""created"":""Sun, 5 Nov 2000 16:46:57 GMT""}]","2007-05-23"
"nlin/0011011","M. C. Nucci","M.C. Nucci and P.G.L. Leach","The harmony in the Kepler and related problems",,"J. Math. Phys. 42 (2001) 746-764","10.1063/1.1337614",,"nlin.SI math-ph math.MP",,"  The technique of reduction of order developed by Nucci ({\it J Math Phys}
{\bf 37} (1996) 1772-1775) is used to produce nonlocal symmetries additional to
those reported by Krause ({\it J Math Phys} {\bf 35} (1994) 5734-5748) in his
study of the complete symmetry group of the Kepler Problem. The technique is
shown to be applicable to related problems containing a drag term which have
been used to model the motion of low altitude satellites in the Earth's
atmosphere and further generalisations. A consequence of the application of
this technique is the demonstration of the group theoretical relationship
between the simple harmonic oscillator and the Kepler and related problems.
","[{""version"":""v1"",""created"":""Mon, 6 Nov 2000 12:45:10 GMT""}]","2009-10-31"
"nucl-th/0011015","Lie-Wen Chen","Feng-Shou Zhang, Lie-Wen Chen, Zhi-Yuan Zhu","Isospin effects on squeeze-out flow in heavy-ion collisions","4 pages in REVTex, 3 figures, 1 table","Eur.Phys.J. A9 (2000) 149-152","10.1007/s100500070029",,"nucl-th",,"  The squeeze-out flow in reactions of $^{124}$Sn + $^{124}$Sn and $^{124}$Ba +
$^{124}$Ba at different incident energies for different impact parameters is
investigated by means of an isospin-dependent quantum molecular dynamics model.
For the first time, it is found that the more neutron-rich system ($% ^{124}$Sn
+ $^{124}$Sn) exhibits weaker squeeze-out flow. This isospin dependence of the
squeeze-out flow is shown to mainly result from the isospin dependence of
nucleon-nucleon cross section and the symmetry energy.
","[{""version"":""v1"",""created"":""Mon, 6 Nov 2000 07:17:54 GMT""}]","2009-11-06"
"nucl-th/0011016","Lie-Wen Chen","Lie-Wen Chen, Feng-Shou Zhang, Wen-Fei Li","Finite range effects of nuclear force in intermediate energy heavy ion
  collisions","7 Pgaes in REVTex, 4 Figures, 1 Table",,,,"nucl-th",,"  Within the framework of an isospin-dependent quantum molecular dynamics
model, the zero-range 2-body part of the Skyrme interaction is replaced by a
finite-range Gaussian 2-body interaction. From the transverse momentum analysis
in the reaction of system $^{93}$Nb + $^{93}$Nb at energy of 400 MeV/nucleon
and impact parameter $b$=3 fm, it is shown that the finite-range nuclear force
enhances the transverse momentum of the reaction system and it can partly
replace the momentum dependent part of the nucleon-nucleon interaction.
","[{""version"":""v1"",""created"":""Mon, 6 Nov 2000 06:26:30 GMT""}]","2007-05-23"
"nucl-th/0011017","Lie-Wen Chen","Feng-Shou Zhang, Lie-Wen Chen","Proton fraction in neutron stars","4 Pgaes in REVTex, 2 Figures, 1 Table","Chinese Physics Letters 18 (1), 142-144 (2001)","10.1088/0256-307X/18/1/350",,"nucl-th",,"  The proton fraction in ${\sl \beta}$-stable neutron stars is investigated
within the framework of the Skyrme-Hartree-Fock theory using the extended
Skyrme effective interaction for the first time. The calculated results show
that the proton fraction disappears at high density, which implies that the
pure neutron matter may exist in the interior of neutron stars. The
incompressibility of the nuclear equation of state is shown to be more
important to determine the proton fraction. Meanwhile, it is indicated that the
addition of muons in neutron stars will change the proton fraction. It is also
found that the higher-order terms of the nuclear symmetry energy have obvious
effects on the proton fraction and the parabolic law of the nuclear symmetry
energy is not enough to determine the proton fraction.
","[{""version"":""v1"",""created"":""Mon, 6 Nov 2000 06:36:36 GMT""}]","2009-11-06"
"nucl-th/0011018","Shishu Wu","S. S. Wu, H. X. Zhang, Y. J. Yao (Jilin University, Changchun, China)","Coupled Dyson-Schwinger Equations and Effects of Self-Consistency","20 pages (include 5 tables), 17 figures (PostScript file)","Nucl.Phys. A694 (2001) 489-510","10.1016/S0375-9474(01)01077-6",,"nucl-th",,"  Using the $\sigma -\omega$ model as an effective tool, the effects of
self-consistency are studied in some detail. A coupled set of Dyson-Schwinger
equations for the renormalized baryon and meson propagators in the $\sigma
-\omega$ model is solved self-consistently according to the dressed
Hartree-Fock scheme, where the hadron propagators in both the baryon and meson
self-energies are required to also satisfy this coupled set of equations. It is
found that the self-consistency affects the baryon spectral function
noticeably, if only the interaction with $\sigma$ mesons is considered.
However, there is a cancellation between the effects due to the $\sigma$ and
$\omega$ mesons and the additional contribution of $\omega$ mesons makes the
above effect insignificant. In both the $\sigma$ and $\sigma -\omega$ cases the
effects of self-consistency on meson spectral function are perceptible, but
they can nevertheless be taken account of without a self-consistent
calculation. Our study indicates that to include the meson propagators in the
self-consistency requirement is unnecessary and one can stop at an early step
of an iteration procedure to obtain a good approximation to the fully
self-consistent results of all the hadron propagators in the model, if an
appropriate initial input is chosen. Vertex corrections and their effects on
ghost poles are also studied.
","[{""version"":""v1"",""created"":""Mon, 6 Nov 2000 09:24:48 GMT""},{""version"":""v2"",""created"":""Sun, 28 Jan 2001 04:03:19 GMT""},{""version"":""v3"",""created"":""Sun, 29 Apr 2001 08:24:39 GMT""}]","2009-11-06"
"nucl-th/0011019","Eulogio Oset","E. Oset, M.J. Vicente Vacas, H. Toki, A. Ramos","Test of phi renormalization in nuclei through phi photoproduction","10 pages, 3 figures","Phys.Lett.B508:237-242,2001","10.1016/S0370-2693(01)00542-1","FTUV-00-1106, IFIC-00-1106","nucl-th",,"  We propose an experimental procedure to find out the medium modifications of
the $\phi$ meson. The reaction is inclusive $\phi$ photoproduction in nuclei,
looking for $K^+ K^-$ pairs from the $\phi$ decay with total momentum smaller
than 100-150 $MeV/c$, which are made possible at energies of present
laboratories from center of mass $\phi$ backward production and the help of
Fermi motion. We have conducted a many body calculation of the mass
distribution of the $\phi$ adapted to the experimental set up of a recent JLAB
experiment where the backwards $\phi$ photoproduction has been measured. Using
recent results for the in medium properties of the $\phi$, we find that the
width of the invariant mass distribution for photoproduction on medium to heavy
nuclei is larger than the free $\phi$ width by a factor of two or more.
","[{""version"":""v1"",""created"":""Mon, 6 Nov 2000 10:56:22 GMT""},{""version"":""v2"",""created"":""Mon, 9 Apr 2001 17:44:03 GMT""}]","2014-11-18"
"nucl-th/0011020","Pierre Wagner","J.M. Carmona, J. Richert and P. Wagner","Microscopic systems with and without Coulomb interaction, fragmentation
  and phase transitions in finite nuclei","8 pages, 9 figures. New comments concerning the effect of the Coulomb
  interaction on the caloric curve. Justification of the criterion which
  defines bound clusters. Further comments about the identification of the
  order of the transition. To be published in Eur. Phys. J. A","Eur.Phys.J. A11 (2001) 87-93","10.1007/s100500170098","IReS-01-09","nucl-th",,"  We test the influence of the Coulomb interaction on the thermodynamic and
cluster generation properties of a system of classical particles described by
different lattice models. Numerical simulations show that the Coulomb
interaction produces essentially a shift in temperature of quantities like the
specific heat but not qualitative changes. We also consider a cellular model.
The thermodynamic properties of the system are qualitatively unaltered.
","[{""version"":""v1"",""created"":""Mon, 6 Nov 2000 14:33:58 GMT""},{""version"":""v2"",""created"":""Wed, 23 May 2001 14:46:37 GMT""}]","2009-11-06"
"physics/0011013","Dmitri Khokhlov","D.L. Khokhlov","Neutrino flux in the rotating reference frame","2 pages, LaTeX",,,,"physics.gen-ph",,"  It is considered neutrino flux in the rotating reference frame. Due to the
rotation of the frame, neutrino is observed as a superposition of two states
P-transformed one from another. Since P-transformation is forbidden for
neutrino, in the rotating reference frame one can detect a half of neutrino
flux. Due to the rotation of the earth, the detector of neutrinos can measure a
half of the solar neutrino flux predicted by the SSM that may provide a
solution for the solar neutrino puzzle.
","[{""version"":""v1"",""created"":""Mon, 6 Nov 2000 15:58:16 GMT""}]","2007-05-23"
"quant-ph/0011019","Zijian Diao","Goong Chen, Zijian Diao","Quantum Multi-object Search Algorithm with the Availability of Partial
  Information","17 pages, 1 figure",,"10.1515/zna-2001-1215",,"quant-ph",,"  Consider the unstructured search of an unknown number l of items in a large
unsorted database of size N. The multi-object quantum search algorithm consists
of two parts. The first part of the algorithm is to generalize Grover's
single-object search algorithm to the multi-object case and the second part is
to solve a counting problem to determine l.
  In this paper, we study the multi-object quantum search algorithm (in
continuous time), but in a more structured way by taking into account the
availability of partial information. The modeling of available partial
information is done simply by the combination of several prescribed, possibly
overlapping, information sets with varying weights to signify the reliability
of each set. The associated statistics is estimated and the algorithm
efficiency and complexity are analyzed.
  Our analysis shows that the search algorithm described here may not be more
efficient than the unstructured (generalized) multi-object Grover search if
there is ``misplaced confidence''. However, if the information sets have a
``basic confidence'' property in the sense that each information set contains
at least one search item, then a quadratic speedup holds on a much smaller data
space, which further expedite the quantum search for the first item.
","[{""version"":""v1"",""created"":""Mon, 6 Nov 2000 02:06:21 GMT""},{""version"":""v2"",""created"":""Fri, 10 Nov 2000 19:35:37 GMT""}]","2015-06-26"
"quant-ph/0011020","Joseph V. Emerson","J. Emerson and L.E. Ballentine","Characteristics of Quantum-Classical Correspondence for Two Interacting
  Spins","New introduction, accepted in Phys Rev A (May 2001 issue), 12 latex
  figures, 3 ps figures","Phys. Rev. A 63, 052103 (2001); Erratum in PRA 64, 029901 (2001).","10.1103/PhysRevA.63.052103",,"quant-ph",,"  The conditions of quantum-classical correspondence for a system of two
interacting spins are investigated. Differences between quantum expectation
values and classical Liouville averages are examined for both regular and
chaotic dynamics well beyond the short-time regime of narrow states. We find
that quantum-classical differences initially grow exponentially with a
characteristic exponent consistently larger than the largest Lyapunov exponent.
We provide numerical evidence that the time of the break between the quantum
and classical predictions scales as log(${\cal J}/ \hbar$), where ${\cal J}$ is
a characteristic system action. However, this log break-time rule applies only
while the quantum-classical deviations are smaller than order hbar. We find
that the quantum observables remain well approximated by classical Liouville
averages over long times even for the chaotic motions of a few
degree-of-freedom system. To obtain this correspondence it is not necessary to
introduce the decoherence effects of a many degree-of-freedom environment.
","[{""version"":""v1"",""created"":""Mon, 6 Nov 2000 10:38:41 GMT""},{""version"":""v2"",""created"":""Mon, 12 Mar 2001 22:12:49 GMT""}]","2009-11-06"
"quant-ph/0011021","Richard Szabo","David D. Song and Richard J. Szabo","Duality and Decoherence Free Subspaces","14 pages LaTeX, 1 figure, uses epsf.tex; Typos corrected and some
  clarifying comments added",,,"HWM00-25","quant-ph gr-qc hep-th math-ph math.MP",,"  Quantum error avoiding codes are constructed by exploiting a geometric
interpretation of the algebra of measurements of an open quantum system. The
notion of a generalized Dirac operator is introduced and used to naturally
construct families of decoherence free subspaces for the encoding of quantum
information. The members of the family are connected to each other by the
discrete Morita equivalences of the algebra of observables, which render
possible several choices of noiseless code in which to perform quantum
computation. The construction is applied to various examples of discrete and
continuous quantum systems.
","[{""version"":""v1"",""created"":""Mon, 6 Nov 2000 15:13:09 GMT""},{""version"":""v2"",""created"":""Wed, 13 Dec 2000 17:49:52 GMT""}]","2007-05-23"
