"physics/0009007","Victor P. Ruban","E.A.Kuznetsov and V.P.Ruban (L.D.Landau Institute, Russia)","Breaking of vortex lines - a new mechanism of collapse in hydrodynamics","revtex, 9 pages, no figures",,,,"physics.flu-dyn",,"  A new mechanism of the collapse in hydrodynamics is suggested, due to
breaking of continuously distributed vortex lines. Collapse results in
formation of the point singularities of the vorticity field $|{\bf\Omega}|$. At
the collapse point, the value of the vorticity blows up as $(t_0-t)^{-1}$ where
$t_0$ is a collapse time. The spatial structure of the collapsing distribution
approaches a pancake form: contraction occurs by the law $l_1\sim(t_0-t)^{3/2}$
along the ""soft"" direction, the characteristic scales vanish like
$l_2\sim(t_0-t)^{1/2}$ along two other (""hard"") directions. This scenario of
the collapse is shown to take place in the integrable three-dimensional
hydrodynamics with the Hamiltonian ${\cal H}=\int|{\bf\Omega}|d{\bf r}$. Most
numerical studies of collapse in the Euler equation are in a good agreement
with the proposed theory.
","[{""version"":""v1"",""created"":""Sat, 2 Sep 2000 08:07:18 GMT""}]","2007-05-23"
"quant-ph/0009004","Andris Ambainis","Andris Ambainis, Arnolds Kikusts, Maris Valdats","On the class of languages recognizable by 1-way quantum finite automata","18 pages, 16 figures, extends quant-ph/0001005",,,,"quant-ph",,"  It is an open problem to characterize the class of languages recognized by
quantum finite automata (QFA). We examine some necessary and some sufficient
conditions for a (regular) language to be recognizable by a QFA. For a subclass
of regular languages we get a condition which is necessary and sufficient.
  Also, we prove that the class of languages recognizable by a QFA is not
closed under union or any other binary Boolean operation where both arguments
are significant.
","[{""version"":""v1"",""created"":""Fri, 1 Sep 2000 17:41:45 GMT""}]","2007-05-23"
"quant-ph/0009005","Shepelyansky D.","Pil Hun Song and Dima L. Shepelyansky (MPI, Dresden & CNRS, Toulouse)","Quantum computing of quantum chaos and imperfection effects","revtex, 4 pages, 4 figures","Phys. Rev. Lett. v.86 (2001) p. 2162","10.1103/PhysRevLett.86.2162",,"quant-ph cond-mat nlin.CD",,"  We study numerically the imperfection effects in the quantum computing of the
kicked rotator model in the regime of quantum chaos. It is shown that there are
two types of physical characteristics: for one of them the quantum computation
errors grow exponentially with the number of qubits in the computer while for
the other the growth is polynomial. Certain similarity between classical and
quantum computing errors is also discussed.
","[{""version"":""v1"",""created"":""Fri, 1 Sep 2000 20:33:12 GMT""}]","2009-11-06"
"quant-ph/0009006","WonYoung Hwang","W.Y. Hwang, D. Ahn, S.W. Hwang","Eavesdropper's Optimal Information in Variations of Bennett-Brassard
  1984 Quantum Key Distribution in the Coherent Attacks","no correction, 7 pages, 1 figure, RevTex","Phys. Lett. A 279 (2001) 133","10.1016/S0375-9601(00)00825-2",,"quant-ph",,"  We calculate eavesdropper's optimal information on raw bits in
Bennett-Brassard 1984 quantum key distribution (BB84 QKD) and six-state scheme
in coherent attacks, using a formula by Lo and Chau [Science 283 (1999) 2050]
with single photon assumption. We find that eavesdropper's optimal information
in QKD without public announcement of bases [Phys. Lett. A 244 (1998) 489] is
the same as that of a corresponding QKD WITH it in the coherent attack. We
observe a sum-rule concerning each party's information.
","[{""version"":""v1"",""created"":""Sat, 2 Sep 2000 03:20:33 GMT""},{""version"":""v2"",""created"":""Thu, 14 Sep 2000 06:33:35 GMT""},{""version"":""v3"",""created"":""Sat, 25 Nov 2000 05:51:46 GMT""},{""version"":""v4"",""created"":""Thu, 21 Dec 2000 05:38:10 GMT""},{""version"":""v5"",""created"":""Sat, 3 Feb 2001 02:41:05 GMT""}]","2009-11-06"
"quant-ph/0009007","Hans Halvorson","Hans Halvorson","The Einstein-Podolsky-Rosen state maximally violates Bell's inequalities","11 pages, LaTeX","Lett. Math. Phys. 53 (2000) 321-329","10.1023/A:1007609031556",,"quant-ph math-ph math.MP",,"  In their well-known argument against the completeness of quantum theory,
Einstein, Podolsky, and Rosen (EPR) made use of a state that strictly
correlates the positions and momenta of two particles. We prove the existence
and uniqueness of the EPR state as a normalized, positive linear functional of
the Weyl algebra for two degrees of freedom. We then show that the EPR state
maximally violates Bell's inequalities.
","[{""version"":""v1"",""created"":""Sat, 2 Sep 2000 15:09:06 GMT""}]","2007-05-23"
"quant-ph/0009008","Surajit Sen","Mihir Ranjan Nath and Surajit Sen","Remarks on the semi-classical theory of three state system","12 pages, 4 postscript figures",,,,"quant-ph",,"  The semi-classical solution of the three state system is considered to study
the population inversion at and away from resonance. At resonance, it is shown
that if the system is initially populated either in the upper or in the lower
level, then the population oscillation occurs in a way which is quite different
from that if it is initially populated in the middle state. At off resonance,
there is gradual suppression of the population in the excited states and in the
asymptotic limit of the detuning, the system returns to its initial state.
","[{""version"":""v1"",""created"":""Sat, 2 Sep 2000 12:36:54 GMT""}]","2007-05-23"
