"hep-ex/0009004","Salvatore Mele","Salvatore Mele (CERN, On behalf of the four LEP Collaborations)","ZZ Cross Section Measurements","To appear in the proceedings of ICHEP 2000, Osaka, Japan, July
  27th-August 2nd, 2000",,,,"hep-ex",,"  Results on the cross section measurement of Z boson pair-production at LEP
are presented. The more general case of neutral-current four-fermion production
and the particular case of ZZ events enriched in b quarks are also discussed.
All the results agree with the Standard Model predictions.
","[{""version"":""v1"",""created"":""Fri, 1 Sep 2000 20:38:28 GMT""}]","2007-05-23"
"hep-lat/0009002","Rainer Pullirsch","Elmar Bittner, Harald Markum, Rainer Pullirsch","Quantum chaos and chiral symmetry at the QCD and QED phase transition","5 pages, 11 figures, talk presented at QCD 00 (Montpellier, France,
  2000-07-06 -- 2000-07-13)","Nucl.Phys.Proc.Suppl. 96 (2001) 189-193","10.1016/S0920-5632(01)01130-6",,"hep-lat hep-ph hep-th",,"  We investigate the eigenvalue spectrum of the staggered Dirac matrix in SU(3)
gauge theory and in full QCD as well as in quenched U(1) theory. As a measure
of the fluctuation properties of the eigenvalues, we consider the
nearest-neighbor spacing distribution. We find that in all regions of their
phase diagrams, compact lattice gauge theories have bulk spectral correlations
given by random matrix theory, which is an indication for quantum chaos. In the
confinement phase, the low-lying Dirac spectrum of these quantum field theories
is well described by random matrix theory, exhibiting universal behavior.
Related results for gauge theories with minimal coupling are now discussed also
in the chirally symmetric phase.
","[{""version"":""v1"",""created"":""Fri, 1 Sep 2000 16:29:05 GMT""}]","2009-10-31"
"hep-ph/0009010","Victor Elias","V. Elias","Infrared Consistency of NSVZ and DRED Supersymmetric Gluodynamics","LaTeX, 15 pages","J.Phys.G27:217-226,2001","10.1088/0954-3899/27/2/307",,"hep-ph",,"  Pade approximant methods are applied to known terms of the DRED beta-
function for N = 1 supersymmetric SU(3) Yang-Mills theory. Each of the [N|M]
approximants with N + M less than or equal to 4 (M not equal to zero)
constructed from this series exhibits a positive pole which precedes any zeros
of the approximant, consistent with the same infrared-attractor pole behaviour
known to characterise the exact NSVZ beta-function. A similar Pade-approximant
analysis of truncations of the NSVZ series is shown consistently to reproduce
the geometric-series pole of the exact NSVZ beta function.
","[{""version"":""v1"",""created"":""Fri, 1 Sep 2000 16:35:22 GMT""}]","2008-11-26"
"hep-ph/0009011","Magno Valerio Trindade Machado","M. B. Gay Ducati, M. V. T. Machado (IF-Ufrgs)","Truncated BFKL Series and Hadronic Collisions","17pp, 6 figures, uses jhep.cls. Some text modifications, 2 figures
  added. Version to appear in Physical Review D","Phys.Rev. D63 (2001) 094018","10.1103/PhysRevD.63.094018",,"hep-ph",,"  A truncated BFKL series is studied and applied to hadronic processes. The
proton-(anti)proton cross sections are described with good agreement with data
and in a way consistent with the unitarity bound. The elastic scattering
amplitude is calculated at momentum transfer $t$ different from zero,
introducing two distinct ansatze for the proton impact factor. The elastic
differential cross section is obtained at small $t$ approximation and compared
with the data.
","[{""version"":""v1"",""created"":""Fri, 1 Sep 2000 18:22:22 GMT""},{""version"":""v2"",""created"":""Mon, 15 Jan 2001 16:20:34 GMT""}]","2009-10-31"
"hep-ph/0009012","Gabriel Karl","G.Karl and V.Novikov","Optical activity of a neutrino sea in the Standard Model","7 pages, 3 figures",,,,"hep-ph",,"  We present the Standard Model calculation of the optical activity of a
neutrino sea
","[{""version"":""v1"",""created"":""Fri, 1 Sep 2000 21:32:38 GMT""}]","2007-05-23"
"hep-ph/0009013","Nikolaos Kidonakis","Nikolaos Kidonakis","Top quark total and differential cross sections at NNLO and NNLL","4 pages LaTeX, 2 figures; presented at DPF2000, to appear in the
  Proceedings","Int.J.Mod.Phys.A16S1A:363-365,2001","10.1142/S0217751X01006930","FSU-HEP-20000901","hep-ph",,"  I present recent NNLO-NNLL results for top quark hadroproduction at the
Tevatron. The total cross section as well as transverse momentum and rapidity
distributions are shown.
","[{""version"":""v1"",""created"":""Fri, 1 Sep 2000 21:30:39 GMT""}]","2009-10-31"
"hep-ph/0009014","Oleg Yakovlev","Oleg Yakovlev, Stefan Groote","Top quark production near threshold at NLC","24 pages, LaTeX, 7 figures, Talk given by O. Yakovlev at the
  Conference `Phenomenology-2000', Madison, Wisconsin, April 15-17, 2000",,,"UM-TH-00-22, CLNS-00/1690","hep-ph",,"  In this talk we discuss the process e+e- -> t t-bar near threshold. In
particular we discuss a quark mass definition which is a generalization of the
static PS mass. The new definition allows us to calculate recoil corrections to
the static PS mass. Using this result we calculate the cross section of e+e- ->
t t-bar near threshold at NNLO accuracy adopting three alternative approaches,
namely (1) fixing the pole mass, (2) fixing the PS mass, and (3) fixing the new
mass which we call the PS-bar mass. We demonstrate that perturbative
predictions for the cross section become much more stable if we use the PS or
the PS-bar mass for the calculations. A careful analysis suggests that the top
quark mass can be extracted from a threshold scan at NLC with an accuracy of
about 100-200 MeV.
","[{""version"":""v1"",""created"":""Fri, 1 Sep 2000 23:58:29 GMT""}]","2007-05-23"
"hep-th/0009004","Nikolai Mitov","Nikolay M. Nikolov and Ivan T. Todorov","Rationality of conformally invariant local correlation functions on
  compactified Minkowski space","20 pages, LATEX, amsfonts, latexsym","Commun.Math.Phys. 218 (2001) 417-436","10.1007/s002200100414",,"hep-th math-ph math.DG math.MP math.QA",,"  Rationality of the Wightman functions is proven to follow from energy
positivity, locality and a natural condition of global conformal invariance
(GCI) in any number D of space-time dimensions. The GCI condition allows to
treat correlation functions as generalized sections of a vector bundle over the
compactification of Minkowski space and yields a strong form of locality valid
for all non-isotropic intervals if assumed true for space-like separations.
","[{""version"":""v1"",""created"":""Fri, 1 Sep 2000 17:30:40 GMT""},{""version"":""v2"",""created"":""Mon, 4 Sep 2000 05:15:34 GMT""},{""version"":""v3"",""created"":""Tue, 17 Oct 2000 14:02:08 GMT""},{""version"":""v4"",""created"":""Mon, 23 Oct 2000 09:42:32 GMT""}]","2007-05-23"
"hep-th/0009010","Christopher Gordon","Christopher Gordon (Portsmouth) and Roy Maartens (Portsmouth)","Density perturbations in the brane-world","Additional arguments and minor corrections; version accepted by Phys.
  Rev. D","Phys.Rev. D63 (2001) 044022","10.1103/PhysRevD.63.044022",,"hep-th astro-ph gr-qc hep-ph",,"  In Randall-Sundrum-type brane-world cosmologies, density perturbations
generate Weyl curvature in the bulk, which in turn backreacts on the brane via
stress-energy perturbations. On large scales, the perturbation equations
contain a closed system on the brane, which may be solved without solving for
the bulk perturbations. Bulk effects produce a non-adiabatic mode, even when
the matter perturbations are adiabatic, and alter the background dynamics. As a
consequence, the standard evolution of large-scale fluctuations in general
relativity is modified. The metric perturbation on large-scales is not constant
during high-energy inflation. It is constant during the radiation era, except
at most during the very beginning, if the energy is high enough.
","[{""version"":""v1"",""created"":""Fri, 1 Sep 2000 19:15:51 GMT""},{""version"":""v2"",""created"":""Fri, 22 Sep 2000 17:20:43 GMT""},{""version"":""v3"",""created"":""Fri, 24 Nov 2000 17:27:04 GMT""}]","2009-10-31"
"hep-th/0009011","Gordon W. Semenoff","Gordon W. Semenoff","Worldsheet of the discrete light front string","5 pages, Proceedings of ICHEP2000",,,,"hep-th",,"  Some aspects of light-like compactifications of superstring theory and their
implications for the matrix model of M-theory are discussed.
","[{""version"":""v1"",""created"":""Fri, 1 Sep 2000 21:20:43 GMT""},{""version"":""v2"",""created"":""Tue, 5 Sep 2000 16:56:34 GMT""}]","2007-05-23"
"hep-th/0009012","Juan Fernando Ospina Giraldo","Juan Ospina","y-Deformed BPS Dp- branes On a Surface In a Calabi-Yau Threefold","10 pages on Latex",,,,"hep-th",,"  Using y-deformed algebraic geometric techniques the y-deformed Mukay vector
of RR-charges of the y-deformed BPS Dp-branes localized on a surface in a
Calabi-Yau threefold. The formulas that are obtained here are generalizations
of the formulas of the fourth section of the preprint hep-th/0007243 .
","[{""version"":""v1"",""created"":""Fri, 1 Sep 2000 21:34:38 GMT""}]","2007-05-23"
"hep-th/0009013","Bianca Letizia Cerchiai","Bianca L.Cerchiai, Bruno Zumino","Properties of perturbative solutions of unilateral matrix equations","latex, 10 pages","Lett.Math.Phys.54:33-42,2000","10.1023/A:1007690508610","UCB-PTH-00/27, LBNL-46775","hep-th math.RA",,"  A left-unilateral matrix equation is an algebraic equation of the form $$
a_0+a_1 x+a_2 x^2+... +a_n x^n=0 $$ where the coefficients $a_r$ and the
unknown $x$ are square matrices of the same order and all coefficients are on
the left (similarly for a right-unilateral equation). Recently certain
perturbative solutions of unilateral equations and their properties have been
discussed. We present a unified approach based on the generalized Bezout
theorem for matrix polynomials. Two equations discussed in the literature,
their perturbative solutions and the relation between them are described. More
abstractly, the coefficients and the unknown can be taken as elements of an
associative, but possibly noncommutative, algebra.
","[{""version"":""v1"",""created"":""Sat, 2 Sep 2000 00:03:03 GMT""}]","2014-11-18"
"hep-th/0009014","Jorge Mahecha","Carlos Castro and Jorge Mahecha","Comments on the Riemann conjecture and index theory on Cantorian fractal
  space-time","Revised Latex file. 22 pages. Remarks on the recent developments in
  the proof of the Riemann conjecture are made. Plots were included","Chaos Solitons Fractals 13 (2002) 1407",,,"hep-th",,"  An heuristic proof of the Riemman conjecture is proposed. It is based on the
old idea of Polya-Hilbert. A discrete/fractal derivative self adjoint operator
whose spectrum may contain the nontrivial zeroes of the zeta function is
presented. To substantiate this heuristic proposal we show using generalized
index-theory arguments, corresponding to the (fractal) spectral dimensions of
fractal branes living in Cantorian-fractal space-time, how the required
$negative$ traces associated with those derivative operators naturally agree
with the zeta function evaluated at the spectral dimensions. The $\zeta (0) = -
1/2$ plays a fundamental role. Final remarks on the recent developments in the
proof of the Riemann conjecture are made.
","[{""version"":""v1"",""created"":""Sat, 2 Sep 2000 07:03:28 GMT""},{""version"":""v2"",""created"":""Tue, 12 Sep 2000 09:13:44 GMT""},{""version"":""v3"",""created"":""Sun, 8 Apr 2001 18:06:23 GMT""}]","2007-05-23"
"hep-th/0009015","Shin'ichi Nojiri","Shin'ichi Nojiri, Sergei D. Odintsov, Sachiko Ogushi","Scheme-dependence of holographic conformal anomaly in d5 gauged
  supergravity with non-trivial bulk potential","LaTeX file 13 pages, minor corrections","Phys.Lett.B494:318-324,2000","10.1016/S0370-2693(00)01214-4","OCHA-PP-163, NDA-FP-81","hep-th",,"  Bosonic sector of d5 gauged supergravity with specific parametrization of
full scalar coset is considered (multi-dilaton gravity). Using holographic RG
in the form suggested by de Boer-Verlinde-Verlinde the holographic d4 conformal
anomaly (in the sector of curvature invariants) is found when bulk potential is
not constant. Its comparison with the earlier calculation done in the scheme
where expansion of metric and dilaton over radial coordinate of AdS space is
used demonstrates scheme dependence of holographic conformal anomaly. In
AdS/CFT correspondence where dilatons play role of coupling constants it
coincides with multi-loop conformal anomaly which depends on regularization
scheme in interacting dual QFT. Hence, scheme dependence of holographic
conformal anomaly is consistent with dual QFT expectations.
","[{""version"":""v1"",""created"":""Sat, 2 Sep 2000 14:56:46 GMT""},{""version"":""v2"",""created"":""Thu, 14 Sep 2000 15:28:54 GMT""},{""version"":""v3"",""created"":""Tue, 19 Sep 2000 02:01:14 GMT""},{""version"":""v4"",""created"":""Fri, 6 Oct 2000 14:48:02 GMT""}]","2009-09-17"
"hep-th/0009016","Philip Cowdall","P.M. Cowdall","Novel Domain Wall and Minkowski Vacua of D=9 Maximal SO(2) Gauged
  Supergravity","28 pages, 1 figure, Latex2e",,"10.1016/S0550-3213(01)00043-8","KCL-TH-00-51","hep-th",,"  We show that a generalised reduction of D=10 IIB supergravity leads, in a
certain limit, to a maximally extended SO(2) gauged supergravity in D=9. We
show the scalar potential of this model allows both Minkowski and a new type of
domain wall solution to the Bogomol'nyi equations. We relate these vacua to
type IIB D-branes.
","[{""version"":""v1"",""created"":""Sat, 2 Sep 2000 15:00:54 GMT""}]","2009-10-31"
"math-ph/0009002","Bruno Nachtergaele","Bruno Nachtergaele, Shannon Starr","Droplet States in the XXZ Heisenberg Chain","50 pages, 2 figures (embedded eps files). A few descriptive
  paragraphs are added plus some minor corrections","Commun. Math. Phys., 218 (2001) 567-607","10.1007/s002200100421","UC Davis Math 2000-16","math-ph cond-mat math.MP",,"  We consider the ground states of the ferromagnetic XXZ chain with spin up
boundary conditions in sectors with a fixed number of down spins. This forces
the existence of a droplet of down spins in the system. We find the exact
energy and the states that describe these droplets in the limit of an infinite
number of down spins. We prove that there is a gap in the spectrum above the
droplet states. As the XXZ Hamiltonian has a gap above the fully magnetized
ground states as well, this means that the droplet states (for sufficiently
large droplets) form an isolated band. The width of this band tends to zero in
the limit of infinitely large droplets. We also prove the analogous results for
finite chains with periodic boundary conditions and for the infinite chain.
","[{""version"":""v1"",""created"":""Fri, 1 Sep 2000 23:55:24 GMT""},{""version"":""v2"",""created"":""Thu, 16 Nov 2000 22:08:30 GMT""}]","2009-10-31"
"math/0009013","Alexei Rosly","Boris Khesin and Alexei Rosly","Symplectic geometry on moduli spaces of holomorphic bundles over complex
  surfaces","15 pages","FieldsInst.Commun.24:311-323,1999",,"ITEP-TH-63/98","math.AG hep-th math.DG math.SG",,"  We give a comparative description of the Poisson structures on the moduli
spaces of flat connections on real surfaces and holomorphic Poisson structures
on the moduli spaces of holomorphic bundles on complex surfaces. The symplectic
leaves of the latter are classified by restrictions of the bundles to certain
divisors. This can be regarded as fixing a ""complex analogue of the holonomy""
of a connection along a ""complex analogue of the boundary"" in analogy with the
real case.
","[{""version"":""v1"",""created"":""Fri, 1 Sep 2000 16:17:24 GMT""}]","2008-11-26"
"math/0009014","Paolo Lisca","Paolo Lisca, Andras I. Stipsicz","A note on the Legendrian isotopy problem","this paper has been withdrawn by the authors",,,,"math.GT",,"  This paper has been withdrawn by the authors, due to a mistake pointed out by
Lenny Ng and Josh Sabloff.
","[{""version"":""v1"",""created"":""Fri, 1 Sep 2000 17:05:57 GMT""},{""version"":""v2"",""created"":""Thu, 28 Jun 2001 09:13:03 GMT""},{""version"":""v3"",""created"":""Mon, 2 Jul 2001 19:38:05 GMT""}]","2007-05-23"
"math/0009015","Alexei Rosly","Boris Khesin and Alexei Rosly","Polar Homology","19 pages","Canad. J. Math., vol. 55, no. 5 (2003) 1100-1120",,"ITEP-TH-46/00","math.AG hep-th math.GT",,"  For complex projective manifolds we introduce polar homology groups, which
are holomorphic analogues of the homology groups in topology. The polar
k-chains are subvarieties of complex dimension k with meromorphic forms on
them, while the boundary operator is defined by taking the polar divisor and
the Poincare residue on it.
","[{""version"":""v1"",""created"":""Fri, 1 Sep 2000 17:01:41 GMT""}]","2007-05-23"
"math/0009016","John W. Barrett","John W. Barrett","Unlinked Embedded Graphs","amstex, 5 pages",,,,"math.QA",,"  This paper is a self-contained development of an invariant of graphs embedded
in three-dimensional Euclidean space using the Jones polynomial and skein
theory. Some examples of the invariant are computed. An unlinked embedded graph
is one that contains only trivial knots or links. Examples show that the
invariant is sufficiently powerful to distinguish some different unlinked
embeddings of the same graph.
","[{""version"":""v1"",""created"":""Fri, 1 Sep 2000 17:50:32 GMT""}]","2007-05-23"
"math/0009017","Michael Spiess","M. Spiess and T. Szamuely","On the Albanese map for smooth quasi-projective varieties","Latex, 16 pages",,,,"math.AG",,"  Let k be an algebraically closed field and X a smooth projective k-variety. A
famous theorem of A. A. Roitman states that the canonical map from the degree
zero part of the Chow group of zero cycles on X to the group of k-points of its
Albanese variety induces an isomorphism on torsion prime to the characteristic
of k. In the present paper we prove a generalisation to quasi-projective
varieties admitting a smooth compactification. As was first observed by
Ramachandran, for such a generalisation one should replace the Chow group of
zero cycles by Suslin's 0-th algebraic singular homology group and the Albanese
variety by the generalised Albanese of Serre. The method of proof is new even
in the projective case and makes the motivic nature of the Albanese
transparent. We also prove that the generalised Albanese map is an isomorphism
if k is the algebraic closure of a finite field.
","[{""version"":""v1"",""created"":""Fri, 1 Sep 2000 18:34:59 GMT""}]","2007-05-23"
"math/0009018","Ioannis Kontoyiannis","Amir Dembo and Ioannis Kontoyiannis","Critical Behavior in Lossy Source Coding","2 figures",,,,"math.PR cs.IT math.IT",,"  The following critical phenomenon was recently discovered. When a memoryless
source is compressed using a variable-length fixed-distortion code, the fastest
convergence rate of the (pointwise) compression ratio to the optimal $R(D)$
bits/symbol is either $O(\sqrt{n})$ or $O(\log n)$. We show it is always
$O(\sqrt{n})$, except for discrete, uniformly distributed sources.
","[{""version"":""v1"",""created"":""Fri, 1 Sep 2000 18:43:46 GMT""}]","2007-07-13"
"math/0009019","Jorge Vitorio Pereira","Jorge Vitorio Pereira","An analogous of Jouanolou's Theorem in positive characteristic","5 pages, LaTeX","Journal of Pure and Applied Algebra, 171 2-3, pp.295-301, 2002.","10.1016/S0022-4049(01)00150-5",,"math.AG",,"  We show that a generic vector field on an affine space of positive
characteristic admits an invariant algebraic hypersurface. This contrast with
Jouanolou's Theorem that shows that in characteristic zero the situation is
completely opposite. That is a generic vector field in the complex plane does
not admit any invariant algebraic curve.
","[{""version"":""v1"",""created"":""Sat, 2 Sep 2000 03:19:57 GMT""}]","2010-04-20"
"math/0009020","Jorge Vitorio Pereira","Jaume Llibre and Jorge Vitorio Pereira","Multiplicity of Invariant Algebraic Curves and Darboux Integrability","16 pages, LaTeX",,,,"math.DS",,"  We define four different kinds of multiplicity of an invariant algebraic
curve for a given polynomial vector field and investigate their relationships.
After taking a closer look at the singularities and at the line of infinity, we
improve the Darboux theory of integrability using these new notions of
multiplicity.
","[{""version"":""v1"",""created"":""Sat, 2 Sep 2000 03:28:07 GMT""}]","2007-05-23"
"math/0009021","Ronald Brown","R. Brown and O. Mucuk","Covering groups of non-connected topological groups revisited","13 pages, A4, Paul Taylors' diagrams. archived here for availability
  Some improvements to diagrams and new and updated references","Math. Proc. Camb. Phil. Soc. 115 (1994) 97-110",,"University of Wales Math Preprint 93.03","math.AT math.CT",,"  In general a universal covering of a non connected topological group need not
admit a topological group structure such that the covering map is a morphism of
topological groups. This result is due to R.L. Taylor (1953). We generalise
this result and relate it to the theory of obstructions to group extensions.
The methods use: the equivalence between covering maps of X and covering
groupoids of the fundamental groupoid of X; the equivalence between group
groupoids and crossed modules; and descriptions of cohomology in terms of
crossed complexes.
","[{""version"":""v1"",""created"":""Sat, 2 Sep 2000 11:59:48 GMT""},{""version"":""v2"",""created"":""Mon, 18 Dec 2006 15:43:24 GMT""}]","2007-05-23"
"math/0009022","K. E. Feldman","K.E. Feldman","A new proof of the Frobenius conjecture on the dimensions of real
  algebras without zero divisors","3 pages, some English has been corrected","Bulletin of Moscow University, Ser. 1, Math. Mech. (2000) 61",,,"math.AT math.KT math.RA",,"  A new simple way to prove the Frobenius conjecture on the dimensions of real
algebras without zero divisors is given.
","[{""version"":""v1"",""created"":""Sat, 2 Sep 2000 12:49:16 GMT""},{""version"":""v2"",""created"":""Tue, 16 Oct 2001 13:18:07 GMT""}]","2007-05-23"
"nlin/0009004","Ron Donagi","Ron Y. Donagi and Emma Previato","Abelian solitons",,,,,"nlin.SI",,"  We describe a new algebraically completely integrable system, whose integral
manifolds are co-elliptic subvarieties of Jacobian varieties. This is a
multi-periodic extension of the Krichever-Treibich-Verdier system, which
consists of elliptic solitons.
","[{""version"":""v1"",""created"":""Fri, 1 Sep 2000 19:21:43 GMT""}]","2007-05-23"
"nucl-ex/0009001","David J. Rowe","D.J. Rowe","Restoration of particle number as a good quantum number in BCS theory","21 pages, 2 figures, epsf.def style file for printing figures","Nucl.Phys. A691 (2001) 691-709","10.1016/S0375-9474(01)00588-7",,"nucl-ex",,"  As shown in previous work, number projection can be carried out analytically
for states defined in a quasi-particle scheme when the states are expressed in
a coherent state representation. The wave functions of number-projected states
are well-known in the theory of orthogonal polynomials as Schur functions.
Moreover, the functions needed in pairing theory are a particularly simple
class of Schur functions that are easily constructed by means of recursion
relations. It is shown that complete sets of states can be projected from
corresponding quasi-particle states and that such states retain many of the
properties of the quasi-particle states from which they derive. It is also
shown that number projection can be used to construct a complete set of
orthogonal states classified by generalized seniority for any nucleus.
","[{""version"":""v1"",""created"":""Fri, 1 Sep 2000 17:24:48 GMT""}]","2009-10-31"
"physics/0009005","Linda Hendrickson","L. Hendrickson, N. Phinney, P. Raimondi, T. Raubenheimer, A. Seryi, P.
  Tenenbaum","Beam-based Feedback Simulations for the NLC Linac","3 pages. Linac2000 conference","eConfC000821:MOA15,2000",,"moa15","physics.acc-ph",,"  Extensive beam-based feedback systems are planned as an integral part of the
Next Linear Collider (NLC) control system. Wakefield effects are a significant
influence on the feedback design, imposing both architectural and algorithmic
constraints. Studies are in progress to assure the optimal selection of devices
and to refine and confirm the algorithms for the system design. We show the
results of initial simulations, along with evaluations of system response for
various conditions of ground motion and other operational disturbances.
","[{""version"":""v1"",""created"":""Fri, 1 Sep 2000 21:16:05 GMT""}]","2008-11-26"
"physics/0009006","Kalashnikov","V. L. Kalashnikov","Theory of sub-10 fs Generation in Kerr-lens Mode-locked Solid-State
  Lasers with a Coherent Semiconductor Absorber","revised version, 18 pages, 6 figures, LaTeX, Maple program is
  available on http://www.geocities.com/optomaplev","Optics Communications, v.192/3-6, pp.323-331 (2001)","10.1016/S0030-4018(01)01168-3",,"physics.optics",,"  The results of the study of ultra-short pulse generation in continuous-wave
Kerr-lens mode-locked (KLM) solid-state lasers with semiconductor saturable
absorbers are presented. The issues of extremely short pulse generation are
addressed in the frames of the theory that accounts for the coherent nature of
the absorber-pulse interaction. We developed an analytical model that bases on
the coupled generalized Landau-Ginzburg laser equation and Bloch equations for
a coherent absorber. We showed, that in the absence of KLM semiconductor
absorber produces 2pi - non-sech-pulses of self-induced transparency, while the
KLM provides an extremely short sech-shaped pulse generation. 2pi- and
pi-sech-shaped solutions and variable-area chirped pulses have been found. It
was shown, that the presence of KLM removes the limitation on the minimal
modulation depth in absorber. An automudulational stability and self-starting
ability were analyzed, too.
","[{""version"":""v1"",""created"":""Sat, 2 Sep 2000 03:53:07 GMT""},{""version"":""v2"",""created"":""Sun, 14 Jan 2001 13:09:17 GMT""}]","2009-11-06"
