"astro-ph/0009022","Kristen Menou","Kristen Menou (Princeton Univ.)","Viscosity Mechanisms in Accretion Disks","7 pages, 2 figures, accepted for publication in Science","Science 288, 2022 (2000)","10.1126/science.288.5473.2022",,"astro-ph",,"  The self-sustained turbulence which develops in magnetized accretion disks is
suppressed in the weakly-ionized, quiescent disks of close binary stars.
Because accretion still proceeds during quiescence, another viscosity mechanism
operates in these systems. An anticorrelation of the recurrence times of SU UMa
dwarf novae with their mass ratio supports spiral waves or shock-waves tidally
induced by the companion star as the main process responsible for accretion in
the quiescent disks. Other weakly-ionized gaseous disks in systems lacking a
massive companion have to rely on yet another transport mechanism or they could
be essentially passive.
","[{""version"":""v1"",""created"":""Fri, 1 Sep 2000 16:21:20 GMT""}]","2009-10-31"
"astro-ph/0009023","Vik Dhillon","V. S. Dhillon and C. A. Watson (University of Sheffield)","Imaging the secondary stars in cataclysmic variables","25 pages, 15 figures, to appear in the Proceedings of the
  Astro-tomography Workshop, Brussels, July 2000, eds. H. Boffin, D. Steeghs,
  Springer-Verlag Lecture Notes in Physics. A version with higher quality
  figures, is available at
  http://www.shef.ac.uk/~phys/people/vdhillon/papers/rochey.ps.gz",,,,"astro-ph",,"  The secondary, Roche-lobe filling stars in cataclysmic variables (CVs) are
key to our understanding of the origin, evolution and behaviour of this class
of interacting binary. We review the basic properties of the secondary stars in
CVs and the observational and analysis methods required to detect them. We then
describe the various astro-tomographic techniques which can be used to map the
surface intensity distribution of the secondary star, culminating in a detailed
explanation of Roche tomography. We conclude with a summary of the most
important results obtained to date and future prospects.
","[{""version"":""v1"",""created"":""Fri, 1 Sep 2000 16:56:43 GMT""}]","2007-05-23"
"astro-ph/0009024","Kirsten Kraiberg Knudsen","K.K. Knudsen, P.P. van der Werf and W. Jaffe (Leiden Observatory)","A Submillimeter Selected Quasar in the Field of Abell 478","4 pages, 3 figures, in ""Deep Millimeter Surveys: Implications for
  Galaxy Formation and Evolution"", ed. J. Lowenthal and D. Hughes, World
  Scientific Publishers",,"10.1142/9789812811738_0026",,"astro-ph",,"  We report the discovery of a z=2.83 quasar in the field of the cooling flow
galaxy cluster Abell 478. This quasar was first detected in a submm survey of
star forming galaxies at high redshifts, as the brightest source. We discuss
the optical spectrum and far-IR spectral energy distribution (SED) of this
object.
","[{""version"":""v1"",""created"":""Fri, 1 Sep 2000 17:26:53 GMT""}]","2017-08-23"
"astro-ph/0009025","Paul Vreeswijk","P.M. Vreeswijk, A. Fruchter, L. Kaper, E. Rol, T.J. Galama, J. van
  Paradijs, C. Kouveliotou, R.A.M.J. Wijers, E. Pian, E. Palazzi, N. Masetti,
  F. Frontera, S. Savaglio, K. Reinsch, F.V. Hessman, K. Beuermann, H. Nicklas,
  E.P.J. van den Heuvel","VLT spectroscopy of GRB 990510 and GRB 990712; probing the faint and
  bright end of the GRB host galaxy population","9 pages; accepted for publication in the Astrophysical Journal","ApJ, 546, 672 (2001)","10.1086/318308",,"astro-ph",,"  We present time-resolved optical spectroscopy of the afterglows of the
gamma-ray bursts GRB 990510 and GRB 990712. Through the identification of
several absorption lines in the first epoch GRB 990510 spectrum, we determine
the redshift for this burst at z >= 1.619. No clear emission lines are
detected. The strength of the MgI feature is indicative of a dense environment,
most likely the host galaxy of GRB 990510. Although the host is extremely faint
(V >~ 28), the GRB afterglow allows us to probe its interstellar medium and -
in principle - to measure its metallicity. The optical spectrum of GRB 990712
(whose host galaxy is the brightest of the known GRB hosts at cosmological
redshifts), shows clear features both in emission and absorption, at a redshift
of z = 0.4331 +/- 0.0004. On the basis of several line emission diagnostic
diagrams, we conclude that the host galaxy of GRB 990712 is most likely an HII
galaxy. We derive a unreddened [OII] star formation rate of 2.7 +/- 0.8
Msun/yr. Correcting for the measured extinction intrinsic to the host galaxy
(A(V) = \gpm{3.4}{2.4}{1.7}), this value increases to \gpm{35}{178}{25}
Msun/yr. The [OII] equivalent width, compared to that of field galaxies at z <=
1, also suggests that the host of GRB 990712 is vigorously forming stars. We
employ the oxygen and Hbeta emission-line intensities to estimate the global
oxygen abundance for the host of GRB 990712: log(O/H) = -3.7 +- 0.4, which is
slightly below the lowest metallicity one finds in nearby spiral galaxies. For
both GRBs we study the time evolution of the absorption lines, whose equivalent
width might be expected to change with time if the burst resides in a dense
compact medium. We find no evidence for a significant change in the MgII width.
","[{""version"":""v1"",""created"":""Fri, 1 Sep 2000 19:53:58 GMT""}]","2014-11-25"
"astro-ph/0009026","Shoko Sakai","Shoko Sakai (UCLA), Robert Kennicutt (Steward), Chris Moss (Liverpool)","A Deep, Wide-Field H-alpha Survey of Nearby Clusters of Galaxies","2 pages, 1 figure. To appear in ASP Conference Series, ""Galaxy Disks
  and Disk Galaxies"", J.G. Funes S.J. and E.M. Corsini, eds",,,,"astro-ph",,"  We present a progress report on an ongoing H-alpha imaging survey of nearby
clusters of galaxies. Four clusters have been surveyed to date: A1367, A1656,
A347 and A569. A preliminary comparison of H-alpha luminosity functions
obtained from our imaging survey with those from the prism survey reveals a
significant level of incompleteness in the latter. This in turn is due to a
combination of insensitivity to low-luminosity emission-line galaxies and to
brighter galaxies with weak extended H-alpha emission. The survey has also
revealed a unique population of clustered dwarf emission-line objects which may
be the results of recent tidal encounters between larger gas-rich galaxies.
","[{""version"":""v1"",""created"":""Fri, 1 Sep 2000 20:00:10 GMT""}]","2007-05-23"
"astro-ph/0009027","Schuyler D. Van Dyk","S.D. Van Dyk, C.Y. Peng, J.Y. King, A.V. Filippenko, R.R. Treffers,
  W.D. Li, M.W. Richmond","SN 1997bs in M66: Another Extragalactic Eta Carinae Analog?","15 pages, 8 figures, to appear in the PASP (2000 Dec issue)",,"10.1086/317727",,"astro-ph",,"  We report on SN 1997bs in NGC 3627 (M66), the first supernova discovered by
the Lick Observatory Supernova Search using the 0.75-m Katzman Automatic
Imaging Telescope (KAIT). Based on its early-time optical spectrum, SN 1997bs
was classified as Type IIn. However, from the BVRI light curves obtained by
KAIT early in the supernova's evolution, and F555W and F814W light curves
obtained from Hubble Space Telescope archival WFPC2 images at late times, we
question the identification of SN 1997bs as a bona fide supernova. We believe
that it is more likely a super-outburst of a very massive luminous blue
variable star, analogous to Eta Carinae, and similar to SN 1961V in NGC 1058
(Filippenko et al. 1995 [AJ, 110, 2261]) and SN 1954J (``Variable 12'') in NGC
2403 (Humphreys & Davidson 1994 [PASP, 106, 1025]). The progenitor may have
survived the outburst, since the SN is seen in early 1998 at m_F555W=23.4,
about 0.5 mag fainter than the progenitor identified by Van Dyk et al. (1999,
[AJ, 118, 2331]) in a pre-discovery image. Based on analysis of its environment
in the Hubble Space Telescope images, the progenitor was not in an H II region
or association of massive stars. The recent discovery of additional objects
with properties similar to those of SN 1997bs suggests that the heterogeneous
class of Type IIn supernovae consists in part of ``impostors.''
","[{""version"":""v1"",""created"":""Fri, 1 Sep 2000 21:29:58 GMT""}]","2009-10-31"
"astro-ph/0009028","Omar Lopez-Cruz","Omar Lopez-Cruz (1), Enrique Gaztanaga (1) ((1) INAOE-Tonantzintla)","Clusters of Galaxies at High Redshift: The LMT/GTM Perspective","8 pages, 4 figures, needs newpasp.sty. To be published in the
  proceedings of the conference ""Mapping the Hidden Universe"" held in
  Guanjuato, Mexico (February 23-29, 2000), R.C. Kraan-Korteweg, P.A. Henning,
  and H. Andernach, eds. ASP Conf. Ser",,,,"astro-ph",,"  The lack of reliable cluster samples at intermediate and high redshift has
motivated many optical/infrared and X-ray cluster searches. The motivation of
such searches is well justified: the abundance of massive collapsed regions
gives a direct constraint on Omega(matter). Alternatively, the
Sunyaev-Zeldovich effect (SZE) offers a robust method for the detection of
clusters which is, almost, independent of redshift. In this paper we comment on
the possibility of mapping the SZE at high resolution in the millimeter regime
using the Large Millimeter Telescope/Gran Telescopio Milimetrico (LMT/GTM) and
the bolometer array BOLOCAM. The construction of the LMT/GTM facility is
underway atop Cerro La Negra (latitude=18deg 59min; height=4600 m) in Mexico.
","[{""version"":""v1"",""created"":""Sat, 2 Sep 2000 11:50:01 GMT""}]","2007-05-23"
"astro-ph/0009029","Omar Lopez-Cruz","Omar Lopez-Cruz (1,2) ((1) INAOE-Tonantzintla, (2) Department of
  Astronomy, U of Toronto)","Photometric Properties of Low-Redshift Galaxy Clusters (LOCOS)","6 pages, 5 figures, uses rmaa.cls and rmaacite.sty. Invited Ph.D.
  Thesis presentation to appear in the proceedings of IX RRLA of the IAU/UAI
  held in Tonantzintla, Mexico (November 9-13, 1998), L. Aguilar & A.
  Carraminana, eds., Rev. Mex. A & A Serie Conferencias",,,,"astro-ph",,"  A comprehensive multicolor survey was undertaken to investigate global
optical properties of Abell clusters of galaxies. This survey was christened
the ""Low-Redshift Cluster Optical Survey"" (LOCOS). LOCOS was devised to search
for patterns of galaxy evolution induced by the environment. The generated data
base contains accurate deep CCD photometric measurements (Kron-Cousins R,,B and
I) for a sample of 46 low-redshift (0.04 <= z <= 0.18) Abell clusters. This is
one of the few large surveys that included the contribution due to dwarf
galaxies (about 5.5 mag deeper than the R characteristic magnitude (M*); Ho=50
km/s/Mpc, qo=0). Due to space restrictions only the main results concerning the
variations at the bright-end of the luminosity function (LF) are presented
here. Other results are presented elsewhere (Lopez-Cruz & Yee 2000a,b). We have
detected clear variations at both the bright end and the faint end of the LF.
The nature of the variations at the bright end revealed that poor cD clusters
have dimmer M*. We can explain these variations as a result of dynamical
friction. On the other hand, non-cD clusters seem to have unaffected LFs. A
third class termed as binary clusters seems to be a transition class that might
have resulted from cluster-cluster mergers.
","[{""version"":""v1"",""created"":""Sat, 2 Sep 2000 11:41:02 GMT""}]","2007-05-23"
"astro-ph/0009030","Omar Lopez-Cruz","Omar Lopez-Cruz (1), H.K.C. Yee (2) ((1) INAOE-Tonantzintla, (2)
  Department of Astronomy, U. of Toronto)","Dwarf Galaxies in Clusters: the Effects of a Violent Environment","4 pages, 2 figures. Published in the proceedings of the International
  Symposium on Astrophysics Research and Science Education, Castel Gandolfo,
  Italy, June 14-21, 1998. edited by C. Impey","O. Lopez-Cruz and H.K.C. Yee. 1999, in Symposium on Astrophys.
  Research and Sci. Edu., edited by C. Impey, (Vatican City: Libreria Editrice
  Vaticana) pp. 262-266",,,"astro-ph",,"  Recent observations suggest that dwarf galaxies pervade the universe, for
they have been encountered in large numbers in all the environments. However,
we present evidence that suggests dwarf galaxies may be subject to strong
dynamical processes in high density environments, the combined effects of
multiple encounters and the tidal effects due to the potential well of rich
clusters could result in the effective disruption of dwarf galaxies in the
clusters' central regions. Alternatively, the lack of dwarf galaxies in rich
environments has been interpreted in terms of a ""density-morphology relation"":
dwarf galaxies prefer low density environments (Phillipps et al. 1998). We
argue that such an explanation cannot account for the relationship between the
cD halo luminosity and the gas mass in the ICM, whereas the dwarf disruption
scenario proposed by Lopez-Cruz et al. (1997) addresses this naturally.
","[{""version"":""v1"",""created"":""Sat, 2 Sep 2000 11:27:37 GMT""}]","2007-05-23"
"cond-mat/0009016","Gernot Muenster","Gernot M\""unster (1) and Sergei B. Rutkevich (2) ((1) University of
  Muenster, (2) Institute of Physics of Solids & Semiconductors, Minsk)","Semiclassical calculation of the nucleation rate for first order phase
  transitions in the 2-dimensional phi^4-model beyond the thin wall
  approximation","13 pages, 3 Postscript figures, LaTeX2e, typos corrected, Poster
  presented at the ``XIII International Congress on Mathematical Physics'',
  July 17-22, 2000, London, UK",,,"MS-TPI-00-5","cond-mat.stat-mech",,"  In many systems in condensed matter physics and quantum field theory, first
order phase transitions are initiated by the nucleation of bubbles of the
stable phase. Traditionally, this process is described by the semiclassical
nucleation theory developed by Langer and, in the context of quantum field
theory, by Callan and Coleman. They have shown that the nucleation rate
$\Gamma$ can be written in the form of the Arrhenius law:
$\Gamma=\mathcal{A}e^{-\mathcal{H}_{c}}$. Here $\mathcal{H}_{c}$ is the energy
of the critical bubble, and the prefactor $\mathcal{A}$ can be expressed in
terms of the determinant of the operator of fluctuations near the critical
bubble state. It is not possible to find explicit expressions for the constants
$\mathcal{A}$ and $\mathcal{H}_{c}$ in the general case of a finite difference
$\eta$ between the energies of the stable and metastable vacua. For small
$\eta$, the constant $\mathcal{A}$ can be determined within the leading
approximation in $\eta$, which is an extension of the ``thin wall
approximation''. We have calculated the leading approximation of the prefactor
for the case of a model with a real-valued order parameter field in two
dimensions.
","[{""version"":""v1"",""created"":""Fri, 1 Sep 2000 16:55:18 GMT""},{""version"":""v2"",""created"":""Tue, 12 Sep 2000 18:22:56 GMT""}]","2007-05-23"
"cond-mat/0009017","Haim Diamant","H. Diamant and M. E. Cates (Tel Aviv University, University of
  Edinburgh, University of Chicago)","Swelling kinetics of the onion phase","13 pages, 10 PS figures, LaTeX using SVJour, submitted to Eur Phys J
  E","Eur. Phys. J. E 4, 223 (2001)","10.1007/s101890170132",,"cond-mat.soft physics.chem-ph",,"  A theory is presented for the behavior of an array of multi-lamellar vesicles
(the onion phase) upon addition of solvent. A unique feature of this system is
the possibility to sustain pressure gradients by tension in the lamellae.
Tension enables the onions to remain stable beyond the unbinding point of a
flat lamellar stack. The model accounts for various concentration profiles and
interfaces developing in the onion as it swells. In particular, densely packed
`onion cores' are shown to appear, as observed in experiments. The formation of
interfaces and onion cores may represent an unusual example of stabilization of
curved interfaces in confined geometry.
","[{""version"":""v1"",""created"":""Fri, 1 Sep 2000 20:54:30 GMT""}]","2009-10-31"
"cond-mat/0009018","Daniel L. Cox","R.G. Endres, D.L. Cox, R.R.P. Singh (U.C. Davis), S.K. Pati (JNCASR,
  Bangalore)","Mediation of Long Range Charge Transfer by Kondo Bound States","Revised content (broadened scope, vibrations added), submitted to
  Phys Rev Lett, added author",,,,"cond-mat.str-el cond-mat.soft",,"  We present a theory of non-equilibrium long range charge transfer between
donor and acceptor centers in a model polymer mediated by magnetic exciton
(Kondo) bound states. Our model produces electron tunneling lengths easily
exceeding 10$\AA$, as observed recently in DNA and organic charge transfer
systems. This long ranged tunneling is effective for weak to intermediate
donor-bridge coupling, and is enhanced both by weak to intermediate strength
Coulomb hole-electron attraction (through the orthogonality catastrophe) and by
coupling to local vibrational modes.
","[{""version"":""v1"",""created"":""Fri, 1 Sep 2000 20:58:57 GMT""},{""version"":""v2"",""created"":""Tue, 15 Jan 2002 20:05:03 GMT""},{""version"":""v3"",""created"":""Wed, 16 Jan 2002 00:18:09 GMT""}]","2007-05-23"
"cond-mat/0009019","Z. Matthew Zhang","S. N. Coppersmith, Leo P. Kadanoff, Zhitong Zhang","Reversible boolean networks II: Phase transition, oscillation, and local
  structures","31 pages, 15 figures, 2 tables",,"10.1016/S0167-2789(01)00286-X",,"cond-mat.dis-nn cond-mat.stat-mech math.DS nlin.AO nlin.CG physics.comp-ph",,"  We continue our consideration of a class of models describing the reversible
dynamics of $N$ Boolean variables, each with $K$ inputs. We investigate in
detail the behavior of the Hamming distance as well as of the distribution of
orbit lengths as $N$ and $K$ are varied. We present numerical evidence for a
phase transition in the behavior of the Hamming distance at a critical value
$K_c\approx 1.65$ and also an analytic theory that yields the exact bounds on
$1.5 \le K_c \le 2.$
  We also discuss the large oscillations that we observe in the Hamming
distance for $K<K_c$ as a function of time as well as in the distribution of
cycle lengths as a function of cycle length for moderate $K$ both greater than
and less than $K_c$. We propose that local structures, or subsets of spins
whose dynamics are not fully coupled to the other spins in the system, play a
crucial role in generating these oscillations. The simplest of these structures
are linear chains, called linkages, and rings, called circuits. We discuss the
properties of the linkages in some detail, and sketch the properties of
circuits. We argue that the observed oscillation phenomena can be largely
understood in terms of these local structures.
","[{""version"":""v1"",""created"":""Fri, 1 Sep 2000 21:17:10 GMT""},{""version"":""v2"",""created"":""Tue, 12 Sep 2000 20:16:48 GMT""}]","2016-08-31"
"cond-mat/0009020","Nicola Scafetta","Nicola Scafetta (1), Patti Hamilton (2), Paolo Grigolini (1,3,4)((1)
  Center for Nonlinear Science, University of North Texas, Denton, Texas; (2)
  Center for Nonlinear Science, Texas Womans University; (3)Istituto di
  Biofisica CNR, Area della Ricerca di Pisa, Ghezzano-Pisa, Italy;
  (4)Dipartimento di Fisica dell'Universita' di Pisa and INFM, Pisa, Italy)","The Thermodynamics of Social Processes: The Teen Birth Phenomenon","34 pages; 8 eps figures; latex-revtex",,,,"cond-mat.stat-mech",,"  We argue that a process of social interest is a balance of order and
randomness, thereby producing a departure from a stationary diffusion process.
The strength of this effect vanishes if the order to randomness intensity ratio
vanishes, and this property allows us to reveal, although in an indirect way,
the existence of a finite order to randomness intensity ratio. We aim at
detecting this effect. We introduce a method of statistical analysis
alternative to the compression procedures, with which the limitations of the
traditional Kolmogorov-Sinai approach are bypassed. We prove that this method
makes it possible for us to build up a memory detector, which signals the
presence of even very weak memory, provided that this is persistent over large
time intervals. We apply the analysis to the study of the teen birth phenomenon
and we find that the unmarried teen births are a manifestation of a social
process with a memory more intense than that of the married teens. We attempt
to give a social interpretation of this effect.
","[{""version"":""v1"",""created"":""Fri, 1 Sep 2000 22:48:45 GMT""}]","2007-05-23"
"cond-mat/0009021","J. Williams","J. E. Williams and A. Griffin","Damped Bogoliubov excitations of a condensate interacting with a static
  thermal cloud","9 pages, 3 figures included. Submitted to PRA",,"10.1103/PhysRevA.64.013606",,"cond-mat",,"  We calculate the damping of condensate collective excitations at finite
temperatures arising from the lack of equilibrium between the condensate and
thermal atoms. We neglect the non-condensate dynamics by fixing the thermal
cloud in static equilibrium. We derive a set of generalized Bogoliubov
equations for finite temperatures that contain an explicit damping term due to
collisional exchange of atoms between the two components. We have numerically
solved these Bogoliubov equations to obtain the temperature dependence of the
damping of the condensate modes in a harmonic trap. We compare these results
with our recent work based on the Thomas-Fermi approximation.
","[{""version"":""v1"",""created"":""Fri, 1 Sep 2000 23:43:06 GMT""},{""version"":""v2"",""created"":""Wed, 25 Oct 2000 04:37:36 GMT""}]","2009-10-31"
"cond-mat/0009022","Jonathan D. Denlinger","J. D. Denlinger, J. A. Clack, J. W. Allen, G.-H. Gweon, D. M. Poirier,
  C. G. Olson, J. L. Sarrao and Z. Fisk","Bandgap recovery and electron doping on cleaved [100] surfaces of
  divalent semi-metal hexaborides","This paper is withdrawn and has been superceded by cond-mat/0107429,
  showing the band gap to be a bulk property",,,,"cond-mat.str-el",,"  This paper has been withdrawn by the authors due to new theoretical evidence
and experimental proof that the semiconducting bandgap reported in this paper
and ascribed to a surface region is in fact a bulk property of divalent
hexaborides. As reported in J. D. Denlinger et al., cond-mat/0107429, which
supercedes this paper, bulk-sensitive boron K-edge soft x-ray emission provides
a complementary confirmation of the X-point band gap identified by
angle-resolved photoemission.
","[{""version"":""v1"",""created"":""Sat, 2 Sep 2000 02:45:26 GMT""},{""version"":""v2"",""created"":""Fri, 7 Jun 2002 06:32:51 GMT""}]","2007-05-23"
"cond-mat/0009023","Arup Banerjee","Arup Banerjee and Manoranjan P. Singh","A study of trapped Bose gas beyond mean-field theory","14 pages including 1 figure",,,,"cond-mat",,"  We study the ground-state properties of dilute Bose gas confined to both
isotropic and anisotropic traps to assess the accuracy of Gross-Pitaevskii (GP)
theory. To go beyond GP approximation we use Huang-Yang theory of interatomic
interaction energy for hard-sphere Bose gas and use a variational method to
solve the resulting modified GP equation. We also make an analytic estimate of
the corrections due to higher-order terms in the interatomic interaction
energy. We find that the corrections are of the order of 1 percent. However,
there is a qualitative change in the density profile due to presence of
logarithimic term in the interaction energy for large N (number of atoms)
","[{""version"":""v1"",""created"":""Sat, 2 Sep 2000 05:57:59 GMT""}]","2007-05-23"
"cond-mat/0009024","Izmailian","N.Sh. Izmailian and Chin-Kun Hu","Exact Ampitude Ratio and Finite-Size Corrections for the M x N Square
  Lattice Ising Model The :","18 pages, 4 figures, to be published in Phys. Rev. E 65, 1 February
  2002","Phys. Rev. E65, 036103 (2002).","10.1103/PhysRevE.65.036103",,"cond-mat.stat-mech",,"  Let f, U and C represent, respectively, the free energy, the internal energy
and the specific heat of the critical Ising model on the square M x N lattice
with periodic boundary conditions. We find that N f and U are well-defined odd
function of 1/N. We also find that ratios of subdominant (N^(-2 i - 1))
finite-size corrections amplitudes for the internal energy and the specific
heat are constant. The free energy and the internal energy at the critical
point are calculated asymtotically up to N^(-5) order, and the specific heat up
to N^(-3) order.
","[{""version"":""v1"",""created"":""Sat, 2 Sep 2000 12:30:01 GMT""},{""version"":""v2"",""created"":""Wed, 5 Dec 2001 09:56:16 GMT""}]","2009-10-31"
"gr-qc/0009004","John G. Ratcliffe","John G. Ratcliffe and Steven T. Tschantz","On the Growth of the Number of Hyperbolic Gravitational Instantons with
  respect to Volume","9 pages and 2 tables","Class.Quant.Grav. 17 (2000) 2999-3007","10.1088/0264-9381/17/15/310",,"gr-qc",,"  In this paper, we show that the number of hyperbolic gravitational instantons
grows superexponentially with respect to volume. As an application, we show
that the Hartle-Hawking wave function for the universe is infinitely peaked at
a certain closed hyperbolic 3-manifold.
","[{""version"":""v1"",""created"":""Fri, 1 Sep 2000 21:24:49 GMT""}]","2009-10-31"
"hep-ex/0009003","Kimball A. Milton","K. A. Milton, G. R. Kalbfleisch, M. G. Strauss, L. Gamberg, W. Luo,
  and E. H. Smith","New Limits on the Production of Magnetic Monopoles at Fermilab","3 pages, 2 eps figures, ICHEP2000 talk, uses ws-p10x7.cls",,,"OKHEP-00-09","hep-ex",,"  First results from an experiment (Fermilab E882) searching for magnetically
charged particles bound to elements from the CDF and D{\O}detectors are
reported. The experiment is described, and limits on magnetic monopole pair
production cross sections for magnetic charges 1, 2, 3, and 6 times the Dirac
pole strength are presented. These limits ($\sim1$ pb), hundreds of times
smaller than those found in previous direct accelerator-based searches, use
simple model assumptions for the photonic production of monopoles, as does the
extraction of mass limits in the hundreds of GeV range.
","[{""version"":""v1"",""created"":""Fri, 1 Sep 2000 17:54:07 GMT""}]","2007-05-23"
