"cond-mat/0009171","Schoenenberger","M. Krueger, M. R. Buitelaar, T. Nussbaumer, C. Schoenenberger, L.
  Forro","The Electrochemical Carbon Nanotube Field-Effect Transistor",,,"10.1063/1.1350427",,"cond-mat.mes-hall",,"  We explore the electric-field effect of carbon nanotubes (NTs) in
electrolytes. Due to the large gate capacitance, Fermi energy shifts of order
+/- 1 V can be induced, enabling to tune NTs from p to n-type. Consequently,
large resistance changes are measured. At zero gate voltage the NTs are hole
doped in air with E_F ? 0.3-0.5 eV, corresponding to a doping level of ?
10^{13} cm^{-2}. Hole-doping increases in the electrolyte. This hole doping
(oxidation) is most likely caused by the adsorption of oxygen in air and
cations in the electrolyte.
","[{""version"":""v1"",""created"":""Tue, 12 Sep 2000 13:24:31 GMT""}]","2016-08-31"
"cond-mat/0009172","Falcon Eric","Eric Falcon (1), Stephan Fauve (2) and Claude Laroche (1) ((1) ENS
  Lyon France, (2) ENS Paris France)","Experimental study of a granular gas fluidized by vibrations","10 pages, 8 figures","Lecture Notes in Physics, S. Luding and T. Poschel (Eds.),
  Granular Gases, Springer-Verlag, pp. 182 - 191 (2000)",,,"cond-mat.stat-mech cond-mat.soft",,"  We report experimental results on the behavior of an ensemble of
inelastically colliding particles, excited by a vibrated piston in a vertical
cylinder. When the particle number is increased, we observe a transition from a
regime where the particles have erratic motions (granular ""gas"") to a
collective behavior where all the particles bounce like a nearly solid body. In
the gaslike regime, we measure the pressure at constant volume, and the bed
expansion at constant external pressure, as a function of the number N of
particles. We also measure the density of particles as a function of the
altitude, and find that the ""atmosphere"" is exponential far enough from the
piston. From these three independent measurements, we determine a ""state
equation"" between pressure, volume, particle number and the vibration amplitude
and frequency.
","[{""version"":""v1"",""created"":""Tue, 12 Sep 2000 10:46:12 GMT""}]","2007-05-23"
"cond-mat/0009173","Annalisa Fierro","Annalisa Fierro, Antonio de Candia and Antonio Coniglio","Glass transition in the quenched and annealed version of the frustrated
  lattice gas model","8 pages, 14 figures","Phys. Rev. E 62, 7715 (2000)","10.1103/PhysRevE.62.7715",,"cond-mat.dis-nn",,"  In this paper we study the 3d frustrated lattice gas model in the annealed
version, where the disorder is allowed to evolve in time with a suitable
kinetic constraint. Although the model does not exhibit any thermodynamic
transition it shows a diverging peak at some characteristic time in the
dynamical non-linear susceptibility, similar to the results on the p-spin model
in mean field and Lennard-Jones mixture recently found by Donati et al.
[cond-mat/9905433]. Comparing these results to those obtained in the model with
quenched interactions, we conclude that the critical behavior of the dynamical
susceptibility is reminiscent of the thermodynamic transition present in the
quenched model, and signaled by the divergence of the static non-linear
susceptibility, suggesting therefore a similar mechanism also in supercooled
glass-forming liquids.
","[{""version"":""v1"",""created"":""Tue, 12 Sep 2000 11:29:31 GMT""},{""version"":""v2"",""created"":""Thu, 12 Dec 2002 11:07:50 GMT""}]","2009-10-31"
"cond-mat/0009174","Sekkar Manna","S. S. Manna (Satyendra Nath Bose National Centre for Basic Sciences,
  Calcutta)","Self-Organization in a Granular Medium by Internal Avalanches","A short review of 10 pages (Revtex), 14 eps figures (included)","Phase Transitions, 75, 529 (2002)",,"SNB/00-07-09","cond-mat.soft",,"  Internal avalanches of grain displacements can be created inside a granular
material kept in a bin in two ways: (i) By removing a radomly selected grain at
the bottom of the bin (ii) By breaking a stable arch of grains clogging a hole
at the bottom of the bin. Repeated generations of such avalanches lead the
system to a steady state. The question asked, is this state a critical state as
that in Self-Organized Criticality? We review here some of the recent studies
on this problem using cellular automata as well as hard disc models.
","[{""version"":""v1"",""created"":""Tue, 12 Sep 2000 12:16:14 GMT""}]","2007-05-23"
"cond-mat/0009175","Armando A. Aligia","A. A. Aligia (Centro Atomico Bariloche, Argentina)","Magnetization jump in the XXZ chain with next-nearest-neighbor exchange","9 pages, 8 figures, submitted to Phys. Rev. B","Phys. Rev. B 63, 14 402 (2001)","10.1103/PhysRevB.63.014402",,"cond-mat.str-el",,"  We study the dependence of the magnetization M with magnetic field B at zero
temperature in the spin-1/2 XXZ chain with nearest-neighbor (NN) J1 and next-NN
J2 exchange interactions, with anisotropies Delta1 and Delta2 respectively. The
region of parameters for which a jump in M(B) exists is studied using numerical
diagonalization, and analytical results for two magnons on a ferromagnetic
background in the thermodynamic limit. We find a line in the parameter space
(J2/J1, Delta1/J1, Delta2/J2) (determined by two simple equations) at which the
ground state is highly degenerate. M(B) has a jump near this line, and at or
near the isotropic case with ferromagnetic J1 and antiferromagnetic J2, with
|J2/J1| near 1/4. These results are relevant for some systems containing CuO
chains with edge-sharing CuO4 units.
","[{""version"":""v1"",""created"":""Tue, 12 Sep 2000 12:52:23 GMT""}]","2009-10-31"
"cond-mat/0009176","Pierre-Gilles de Gennes","Pierre-Gilles de Gennes","Glass transitions of freely suspended polymer films","11 pages, 4 EPS figures",,,,"cond-mat.soft",,"  We present a modified version of our ""sliding model"", where chain arcs,
between two contacts at the surface, may move if all the barriers along the arc
are weaker than a certain threshold.An important advance of the revised model
is that the high limiting chain lengths N* observed in the experiments are
naturally accoundted for. In this model, a film of thickness h, smaller than
the coil size, can show either a ""sandwich"" structure with two mobile sublayers
(at low temperatures T<T(h)), or a single mobile layer at T>T(h). But the
accident occurring at T=T(h), does not necessarily coincide with the apparent
glass transition, determined by the intersection of two tangents in a plot of
thickness versus temperature.
","[{""version"":""v1"",""created"":""Tue, 12 Sep 2000 13:02:23 GMT""}]","2007-05-23"
"cond-mat/0009177","Marcello Borromeo","M.Borromeo, F.Marchesoni","AC Driven Jumps Distribution on a Periodic Substrate","4 pages, 4 figures, RevTeX, to be published in Surface Science
  Letters",,"10.1016/S0039-6028(00)00780-9",,"cond-mat.stat-mech",,"  A driven Brownian particle (e.g. an adatom on a surface) diffusing on a
low-viscosity, periodic substrate may execute multiple jumps. In the presence
of an additional periodic drive, the jump lengths and time durations become
statistically modulated according to a syncronyzation mechanism reminiscent of
asymmetric stochastic resonance. Here, too, bistability plays a key role, but
in a dynamical sense, inasmuch as a particle switches between locked and
running states.
","[{""version"":""v1"",""created"":""Tue, 12 Sep 2000 13:08:01 GMT""}]","2016-08-31"
"cond-mat/0009178","Guido Caldarelli","G. Caldarelli (1), R. Marchetti (1), L. Pietronero (1) ((1) INFM and
  Dip. di Fisica Roma1, Rome Italy)","The Fractal Properties of Internet","6 pages,2 figures, epl style, to be published on Europhysics Letters",,"10.1209/epl/i2000-00450-8",,"cond-mat.stat-mech",,"  In this paper we show that the Internet web, from a user's perspective,
manifests robust scaling properties of the type $P(n)\propto n^{-\tau}$ where n
is the size of the basin connected to a given point, $P$ represents the density
of probability of finding n points downhill and $\tau=1.9 \pm 0.1$ s a
characteristic universal exponent. This scale-free structure is a result of the
spontaneous growth of the web, but is not necessarily the optimal one for
efficient transport. We introduce an appropriate figure of merit and suggest
that a planning of few big links, acting as information highways, may
noticeably increase the efficiency of the net without affecting its robustness.
","[{""version"":""v1"",""created"":""Tue, 12 Sep 2000 13:43:55 GMT""}]","2009-10-31"
"cond-mat/0009179","Oded Farago","Oded Farago and Yacov Kantor","Entropic Elasticity of Phantom Percolation Networks","submitted to the Europhys. Lett., 7 pages, 5 figures","Europhys. Lett., 52 (2000) 413","10.1209/epl/i2000-00453-y",,"cond-mat.stat-mech cond-mat.soft",,"  A new method is used to measure the stress and elastic constants of purely
entropic phantom networks, in which a fraction $p$ of neighbors are tethered by
inextensible bonds. We find that close to the percolation threshold $p_c$ the
shear modulus behaves as $(p-p_c)^f$, where the exponent $f\approx 1.35$ in two
dimensions, and $f\approx 1.95$ in three dimensions, close to the corresponding
values of the conductivity exponent in random resistor networks. The components
of the stiffness tensor (elastic constants) of the spanning cluster follow a
power law $\sim(p-p_c)^g$, with an exponent $g\approx 2.0$ and 2.6 in two and
three dimensions, respectively.
","[{""version"":""v1"",""created"":""Tue, 12 Sep 2000 14:00:33 GMT""}]","2009-10-31"
"cond-mat/0009181","Gustavo R. Gonzalez-Martin","Gustavo R. Gonzalez-Martin (Univ. Simon Bolivar)","Charge to Magnetic Flux Ratios","7 pages. Related articles may be seen at
  http://prof.usb.ve/ggonzalm/invstg/pblc/public.htm",,,"SB/F/273-99","cond-mat.mes-hall",,"  It is shown that if the carriers in the fractional quantum Hall effect are
taken as geometrical excitations with quanta of charge e and magnetic flux
h/2e, as proposed in a previous publication, the calculated results are
compatible with the series of fractions obtained experimentally.
","[{""version"":""v1"",""created"":""Tue, 12 Sep 2000 15:15:48 GMT""}]","2007-05-23"
"cond-mat/0009182","Anthony Maggs","A.C. Maggs","Writhing Geometry at Finite Temperature: Random Walks and Geometric
  phases for Stiff Polymers","11 pages with 5 figures. Latex2e",,"10.1063/1.1353545",,"cond-mat.soft cond-mat.stat-mech",,"  We study the geometry of a semiflexible polymer at finite temperatures. The
writhe can be calculated from the properties of Gaussian random walks on the
sphere. We calculate static and dynamic writhe correlation functions. The
writhe of a polymer is analogous to geometric or Berry phases studied in optics
and wave mechanics. Our results can be applied to confocal microscopy studies
of stiff filaments and to simulations of short DNA loops
","[{""version"":""v1"",""created"":""Tue, 12 Sep 2000 15:30:56 GMT""},{""version"":""v2"",""created"":""Mon, 9 Oct 2000 13:24:41 GMT""}]","2009-10-31"
"gr-qc/0009033","D. V. Ahluwalia","D. V. Ahluwalia","Principle of equivalence and wave-particle duality in quantum gravity","Invited talk at the III Workshop of DGFM-SMF, Nov. 28-Dec. 03, 1999,
  Leon, Mexico","Memorias del III Taller de la DGFM-SMF, 2000. ``Aspectos de
  Gravitacion y Fisica-Matematica,'' Editors: N. Breton, O. Pimentel, J.
  Socorro",,,"gr-qc",,"  This talk presents: (a) A quantum-mechanically induced violation of the
principle of equivalence, and (b) Gravitationally-induced modification to the
wave particle duality. In this context I note that the agreement between the
predictions of general relativity and observations of the energy loss due to
gravitational waves emitted by binary pulsars is just as impressive as the
agreement between prediction of quantum electrodynamics and the measured value
of Lamb shift in atoms. However, general relativity has not yet yielded to a
successful quantised theory. There is a widespread belief that the two thories
are incompatible at some deep level. The question is: where? Here, I show that
the conceptual foundations of the theory of general relativity and quantum
mechanics are so rich that they suggest concrete modifications into each other
in the interface region. Specifically, I consider quantum states that have no
classical counterpart and show that such states must carry an inherent
violation of the principle of equivalence. On the other hand, I show that when
gravitational effects are incorporated into the quantum measurement process one
must induce a gravitationally induced modification to the de Broglie's
wave-particle duality. The reported changes into the foundations of the two
theories are far from in-principle modifications. These are endowed with
serious implications for the understanding of the early universe and, in
certain instances, can be explored in terrestrial laboratories.
","[{""version"":""v1"",""created"":""Mon, 11 Sep 2000 16:38:09 GMT""}]","2007-05-23"
"gr-qc/0009034","Gilles Esposito-Farese","G. Esposito-Farese and D. Polarski","Scalar-tensor gravity in an accelerating universe","37 pages, LaTeX 2.09, REVTeX 3.0, uses epsf.tex to include 6
  postscript figures","Phys.Rev. D63 (2001) 063504","10.1103/PhysRevD.63.063504","CPT-2000/PE.4053","gr-qc astro-ph",,"  We consider scalar-tensor theories of gravity in an accelerating universe.
The equations for the background evolution and the perturbations are given in
full generality for any parametrization of the Lagrangian, and we stress that
apparent singularities are sometimes artifacts of a pathological choice of
variables. Adopting a phenomenological viewpoint, i.e., from the observations
back to the theory, we show that the knowledge of the luminosity distance as a
function of redshift up to z ~ (1-2), which is expected in the near future,
severely constrains the viable subclasses of scalar-tensor theories. This is
due to the requirement of positive energy for both the graviton and the scalar
partner. Assuming a particular form for the Hubble diagram, consistent with
present experimental data, we reconstruct the microscopic Lagrangian for
various scalar-tensor models, and find that the most natural ones are obtained
if the universe is (marginally) closed.
","[{""version"":""v1"",""created"":""Mon, 11 Sep 2000 16:40:25 GMT""}]","2009-10-31"
"gr-qc/0009035","Andri M. Gretarsson","Steven D. Penn, Gregory M. Harry, Andri M. Gretarsson, Scott E.
  Kittelberger, Peter R. Saulson, John J. Schiller, Joshua R. Smith, and Sol O.
  Swords","High quality factor measured in fused silica","Preprint - Under review by LSC publications committee","Rev.Sci.Instrum. 72 (2001) 3670-3673","10.1063/1.1394183",,"gr-qc",,"  We have measured the mechanical dissipation in a sample of fused silica drawn
into a rod. The sample was hung from a multiple-bob suspension, which isolated
it from rubbing against its support, from recoil in the support structure, and
from seismic noise. The quality factor, Q, was measured for several modes with
a high value of 57 million found for mode number 2 at 726 Hz. This result is
about a factor 2 higher than previous room temperature measurements. The
measured Q was strongly dependent on handling, with a pristine flame-polished
surface yielding a Q 3-4 times higher than a surface which had been knocked
several times against a copper tube.
","[{""version"":""v1"",""created"":""Mon, 11 Sep 2000 18:48:52 GMT""}]","2009-10-31"
"gr-qc/0009037","Ghanashyam Date","G. Date","Notes on Isolated Horizons","45 pages, Latex, no figures. Explained approach better. To appear in
  Class. Quant. Grav","Class.Quant.Grav.17:5025-5046,2000","10.1088/0264-9381/17/24/307","IMSc/2000/09/52","gr-qc hep-th",,"  A general analysis for characterizing and classifying `isolated horizons' is
presented in terms of null tetrads and spin coefficients. The freely
specifiable spin coefficients corresponding to isolated horizons are identified
and specific symmetry classes are enumerated. For isolated horizons admitting
at least one spatial isometry, a standard set of spherical coordinates are
introduced and associated metric is obtained. An angular momentum is also
defined.
","[{""version"":""v1"",""created"":""Tue, 12 Sep 2000 05:26:03 GMT""},{""version"":""v2"",""created"":""Tue, 19 Sep 2000 04:13:09 GMT""},{""version"":""v3"",""created"":""Sun, 19 Nov 2000 11:31:47 GMT""}]","2008-11-26"
"gr-qc/0009038","Bertfried Fauser","Heinz Dehnen and Sergiu I. Vacaru","Nonlinear Connections and Nearly Autoparallel Maps in General Relativity","41 pages","Gen.Rel.Grav. 35 (2003) 807-850","10.1023/A:1022943120161",,"gr-qc",,"  We apply the method of moving anholonomic frames, with associated nonlinear
connections, in (pseudo) Riemannian spaces and examine the conditions when
various types of locally anisotropic (la) structures (Lagrange, Finsler like
and more general ones) could be modeled in general relativity. New classes of
solutions of the Einstein equations with generic local anisotropy are
constructed. We formulate the theory of nearly autoparallel (na) maps and
introduce the tensorial na-integration as the inverse operation to both
covariant derivation and deformation of connections by na-maps. The problem of
redefinition of the Einstein gravity theory on na-backgrounds, provided with a
set of na-map invariant conditions and local conservation laws, is analyzed.
There are illustrated some examples of generation of vacuum Einstein fields by
Finsler like metrics and chains of na-maps.
","[{""version"":""v1"",""created"":""Tue, 12 Sep 2000 07:16:42 GMT""}]","2015-06-25"
"gr-qc/0009039","Bertfried Fauser","Sergiu I. Vacaru and Heinz Dehnen","Locally Anisotropic Structures and Nonlinear Connections in Einstein and
  Gauge Gravity","37 pages","Gen.Rel.Grav. 35 (2003) 209-250","10.1023/A:1022388909622",,"gr-qc",,"  We analyze local anisotropies induced by anholonomic frames and associated
nonlinear connections in general relativity and extensions to affine Poincare
and de Sitter gauge gravity and different types of Kaluza-Klein theories. We
construct some new classes of cosmological solutions of gravitational field
equations describing Friedmann-Robertson-Walker like universes with rotation
(ellongated and flattened) ellipsoidal or torus symmetry.
","[{""version"":""v1"",""created"":""Tue, 12 Sep 2000 07:25:59 GMT""}]","2015-06-25"
"gr-qc/0009040","Julio Cesar Fabris","A.B. Batista, J.C. Fabris and S.V.B. Goncalves (Departamento de
  Fisica, Universidade Federal do Espirito Santo, Brazil)","On the consistency of a repulsive gravity phase in the early Universe","Latex file, 15 pages, 7 figures. There is a new figure, a new section
  and some other minor corrections","Class.Quant.Grav. 18 (2001) 1389","10.1088/0264-9381/18/7/319",,"gr-qc",,"  We exploit the possibility of existence of a repulsive gravity phase in the
evolution of the Universe. A toy model with a free scalar field minimally
coupled to gravity, but with the ""wrong sign"" for the energy and negative
curvature for the spatial section, is studied in detail. The background
solutions display a bouncing, non-singular Universe. The model is well-behaved
with respect to tensor perturbations. But, it exhibits growing models with
respect to scalar perturbations whose maximum occurs in the bouncing. Hence,
large inhomogeneties are produced. At least for this case, a repulsive phase
may destroy homogeneity, and in this sense it may be unstable. A newtonian
analogous model is worked out; it displays qualitatively the same behaviour.
The generality of this result is discussed. In particular, it is shown that the
addition of an attractive radiative fluid does not change essentially the
results. We discuss also a quantum version of the classical repulsive phase,
through the Wheeler-de Witt equation in mini-superspace, and we show that it
displays essentially the same scenario as the corresponding attractive phase.
","[{""version"":""v1"",""created"":""Tue, 12 Sep 2000 15:09:15 GMT""},{""version"":""v2"",""created"":""Wed, 7 Feb 2001 14:09:11 GMT""}]","2009-10-31"
"hep-ex/0009028","Craig Peters","C. Peters, S. Yu, S. Eylon, W. Ghiorso, E. Henestroza","Design and Construction of the 3.2 Mev Cathode Assembly for Darht II","3 pages, 4 figures, LINAC2000","eConf C000821 (2000) TUB05",,,"hep-ex",,"  A 3.2 MeV injector has been designed and built for the Darht II Project at
Los Alamos Lab. The installation of the complete injector system is nearing
completion at this time. The requirements for the injector are to produce a 3.2
MeV, 2000 ampere electron pulse with a flattop width of at least 2-microseconds
and emittance of less than 0.15 p cm-rad normalized. A 16.5 cm diameter hot
emitter cathode is used. This paper will describe the design and fabrication of
major Cathode Assembly components and test performance of subsystems to date.
Mechanical and thermal issues will be emphasized. More detailed discussion of
the active alignment system used to maintain the stringent cathode alignment
requirement.
","[{""version"":""v1"",""created"":""Mon, 11 Sep 2000 22:41:03 GMT""},{""version"":""v2"",""created"":""Thu, 28 Sep 2000 17:16:33 GMT""}]","2007-05-23"
"hep-ex/0009030","Leo Bellantoni","A.Alavi-Harati, et.al","Search for the Decay Kl -> pi0 e+ e-","13 pages, 2 figures","Phys.Rev.Lett.86:397-401,2001","10.1103/PhysRevLett.86.397",,"hep-ex",,"  We report on a search for the decay Kl -> pi0 e+ e- carried out by the
KTeV/E799 experiment at Fermilab. This decay is expected to have a significant
CP violating contribution and the measurement of its branching ratio could
support the CKM mechanism for CP violation or could point to new physics. Two
events were observed in the 1997 data with an expected background of 1.06
+-0.41 events, and we set an upper limit Br(Kl -> pi0 e+ e-) < 5.1 x 10^-10 at
the 90% confidence level.
","[{""version"":""v1"",""created"":""Tue, 12 Sep 2000 00:03:51 GMT""}]","2008-11-26"
"hep-ex/0009031","Elena Demidova","M.P.Besuglov, B.M.Bobchenko, E.V.Byistritskaya, A.A.Vasenko,
  M.E.Vishnevsky, N.D.Galanina, K.E.Gusev, V.S.Demidov, E.V.Demidova,
  V.V.Zchurkin, I.V.Kirpichnikov, V.A.Kuznetsov, V.N.Markizov, M.A.Martemianov,
  A.A.Nedosekin, B.N.Pavlov, V.A.Sadyukov, A.Yu.Sokolov, A.S.Starostin,
  N.A.Khaldeeva","Quasi-coherent interaction of protons with Si28 at Tp=1GeV","24 pages, 16 figures, published in ITEP (M., Preprint ITEP, 1999,
  N30-99)",,,,"hep-ex nucl-ex physics.ins-det",,"  The total, elastic and inelastic cross-sections for quasi-coherent
interactions of protons with Si28 have been measured using hadron-gamma
coincidence method at the energy 1 GeV. The limits for the existence of
long-lived excited states of the Si28 nucleus have been obtained in the range
of energies from 0 to 0.8 GeV.
","[{""version"":""v1"",""created"":""Tue, 12 Sep 2000 13:26:50 GMT""}]","2007-05-23"
"hep-lat/0009014","Benjamin Svetitsky","Benjamin Svetitsky and Alec Schramm","Exact topological density in the lattice Skyrme model","Presented at the International Workshop on Strong and Electroweak
  Matter (SEWM 2000), Marseille, France, 14-17 June 2000. 6 pp. LaTeX2e, uses
  ws-p8-50x6-00.cls (enclosed), 3 figures",,"10.1142/9789812799913_0049",,"hep-lat",,"  We propose using the Skyrme model on a lattice as an effective field theory
of meson-baryon interactions. To this end we construct a local topological
density that involves the volumes of tetrahedra in the target space S^3 and we
make use of Coxeter's formula for the Schlafli function to implement it. We
calculate the mean-square radius of a skyrmion in the three-dimensional Skyrme
model, and find some surprises.
","[{""version"":""v1"",""created"":""Tue, 12 Sep 2000 15:25:41 GMT""}]","2017-08-23"
"hep-ph/0009130","Adrian Kent","Adrian Kent","Problems with empirical bounds for strangelet production at RHIC","6 pages, LaTeX",,,"DAMTP-2000-12","hep-ph",,"  Recent papers by Busza et al. and Dar et al. have considered empirical bounds
on the risk of producing a hypothetical stable negatively charged strangelet at
the Brookhaven relativistic heavy ion collider (RHIC) experiments, and thereby
destroying the Earth. We examine here ways in which these bounds could,
hypothetically, be evaded. We find several,some of which have not previously
been considered. These possible flaws do not affect the theoretical arguments
against the existence of negatively charged strangelets or the possibility of
producing them at RHIC if they were to exist.
","[{""version"":""v1"",""created"":""Mon, 11 Sep 2000 17:18:56 GMT""},{""version"":""v2"",""created"":""Mon, 11 Sep 2000 23:33:20 GMT""}]","2007-05-23"
