"hep-th/0009092","Peter Horvathy","M. Hassa\""ine and P. A. Horv\'athy","Symmetries of fluid dynamics with polytropic exponent","10 pages, LaTex, no figures. Revised version: A new proof of the
  Schrodinger symmetry and two more references added. To appear in Phys. Lett.
  A","Phys.Lett. A279 (2001) 215-222","10.1016/S0375-9601(00)00834-3",,"hep-th",,"  The symmetries of the general Euler equations of fluid dynamics with
polytropic exponent are determined using the Kaluza-Klein type framework of
Duval et $\it{al}$. In the standard polytropic case the recent results of
O'Raifeartaigh and Sreedhar are confirmed and generalized. Similar results are
proved for polytropic exponent $\gamma=-1$, which corresponds to the
dimensional reduction of $d$-branes. The relation between the duality
transformation used in describing supernova explosion and Cosmology is
explained.
","[{""version"":""v1"",""created"":""Tue, 12 Sep 2000 12:48:24 GMT""},{""version"":""v2"",""created"":""Fri, 15 Sep 2000 09:58:13 GMT""},{""version"":""v3"",""created"":""Fri, 29 Sep 2000 10:24:26 GMT""},{""version"":""v4"",""created"":""Tue, 28 Nov 2000 13:04:25 GMT""},{""version"":""v5"",""created"":""Tue, 19 Dec 2000 10:03:11 GMT""}]","2016-08-15"
"hep-th/0009093","Fernando T. Brandt","F. T. Brandt, Ashok Das and J. Frenkel","Behavior of the thermal gluon self-energy in the Coulomb gauge","8 pages, 2 figures, correction of a minor typo","Phys.Rev.D62:127702,2000","10.1103/PhysRevD.62.127702",,"hep-th hep-ph",,"  We study, to one loop order, the behavior of the gluon self-energy in the non
covariant Coulomb gauge at finite temperature. The cancellation of the peculiar
energy divergences, which arise in such a gauge, is explicitly verified in the
complete two point function of the Yang-Mills theory. At high temperatures, the
leading T^2 term is determined to be transverse and nonlocal, in agreement with
the results obtained in covariant gauges. The coefficient of the sub-leading
ln(T) contribution, is non transverse but local and coincides (up to a
multiplicative constant) with that of the ultraviolet pole term of the zero
temperature amplitude.
","[{""version"":""v1"",""created"":""Tue, 12 Sep 2000 13:09:06 GMT""},{""version"":""v2"",""created"":""Wed, 13 Sep 2000 12:54:00 GMT""}]","2008-11-26"
"hep-th/0009094","Stephan Durr","Stephan D\""urr","The phase transition in the multiflavour Schwinger model","6 pages, talk given at International Conference on Quantization,
  Gauge Theory, and Strings: Conference Dedicated to the Memory of Professor
  Efim Fradkin, 5-10 June 2000, Moscow, Russia",,,,"hep-th",,"  A summary is given of a quantization of the multiflavour Schwinger model on a
finite-temperature cylinder with chirality-breaking boundary conditions at its
spatial ends, and it is shown that the analytic expression for the chiral
condensate implies that the theory exhibits a second order phase transition
with $T_c = 0$.
","[{""version"":""v1"",""created"":""Tue, 12 Sep 2000 14:12:23 GMT""}]","2007-05-23"
"hep-th/0009095","Martin Gremm","Martin Gremm","Compactified NCOS and duality","16 pages, references corrected","JHEP 0108:052,2001","10.1088/1126-6708/2001/08/052","PUPT-1951","hep-th",,"  We study four-dimensional U(1) on a non-commutative T^2 with rational Theta.
This theory has dual descriptions as ordinary SYM or as NCOS. We identify a set
of massive non-interacting KK states in the SYM theory and track them through
the various dualities. They appear as stretched strings in the non-commutative
U(1) providing another example of the IR/UV mixing in non-commutative field
theories. In the NCOS these states appear as D-strings with winding and
momentum. They form an unconventional type of 1/4 BPS state with the 3-brane.
To obtain a consistent picture of S-duality for compactified theories it is
essential to keep track of both the NS and the RR B-fields.
","[{""version"":""v1"",""created"":""Tue, 12 Sep 2000 15:38:51 GMT""},{""version"":""v2"",""created"":""Wed, 20 Sep 2000 14:59:34 GMT""}]","2010-02-03"
"math-ph/0009017","Jean-Luc Thiffeault","Jean-Luc Thiffeault","Classification, Casimir Invariants, and Stability of Lie-Poisson Systems","Ph.D. dissertation (Physics Department, University of Texas at
  Austin, 1998) 151 pages with index, 9 figures. LaTeX. Uses arXiv_diss.sty
  (included), xypic, amsmath/symb, epic macros, and makeindex",,,"IFSR-847 (Institute for Fusion Studies)","math-ph math.MP math.SG",,"  We classify Lie-Poisson brackets that are formed from Lie algebra extensions.
The problem is relevant because many physical systems owe their Hamiltonian
structure to such brackets. A classification involves reducing all brackets to
a set of normal forms, independent under coordinate transformations, and is
achieved with the techniques of Lie algebra cohomology. For extensions of order
less than five, we find that the number of normal forms is small and they
involve no free parameters. A special extension, known as the Leibniz
extension, is shown to be the unique ``maximal'' extension.
  We derive a general method of finding Casimir invariants of Lie-Poisson
bracket extensions. The Casimir invariants of all brackets of order less than
five are explicitly computed, using the concept of `coextension.' We obtain the
Casimir invariants of Leibniz extensions of arbitrary order. We also offer some
physical insight into the nature of the Casimir invariants of compressible
reduced magnetohydrodynamics.
  We make use of the methods developed to study the stability of extensions for
given classes of Hamiltonians. This helps to elucidate the distinction between
semidirect extensions and those involving cocycles. For compressible reduced
magnetohydrodynamics, we find the cocycle has a destabilizing effect on the
steady-state solutions.
","[{""version"":""v1"",""created"":""Mon, 11 Sep 2000 19:09:05 GMT""}]","2007-05-23"
"math-ph/0009018","Matthias Schmidt","Gerd Rudolph, Matthias Schmidt, Igor P. Volobuev","Partial Ordering of Gauge Orbit Types for SU(n)-Gauge Theories","35 pages, LaTeX","J.Geom.Phys. 42 (2002) 106-138","10.1016/S0393-0440(01)00080-8",,"math-ph math.DG math.MP",,"  The natural partial ordering of the orbit types of the action of the group of
local gauge transformations on the space of connections in space-time dimension
d<=4 is investigated. For that purpose, a description of orbit types in terms
of cohomology elements of space-time, derived earlier, is used. It is shown
that, on the level of these cohomology elements, the partial ordering relation
is characterized by a system of algebraic equations. Moreover, operations to
generate direct successors and direct predecessors are formulated. The latter
allow to successively reconstruct the set of orbit types, starting from the
principal type.
","[{""version"":""v1"",""created"":""Tue, 12 Sep 2000 10:45:10 GMT""}]","2015-06-26"
"math/0009109","Eyal Markman","Eyal Markman","Generators of the cohomology ring of moduli spaces of sheaves on
  symplectic surfaces","Latex, 23 pages. The introduction is expanded, the coefficient in
  part 3 of Theorem 1 is corrected, plus several other minor changes","Journal fur die reine und angewandte Mathematik 544 (2002), 61-82",,,"math.AG",,"  Let M be a moduli space of stable sheaves on a K3 or Abelian surface S. We
express the class of the diagonal in the cartesian square of M in terms of the
Chern classes of a universal sheaf. Consequently, we obtain generators of the
cohomology ring of M. When S is a K3 and M is the Hilbert scheme of length n
subschemes, this set of generators is sufficiently small in the sense that
there aren't any relations among them in the stable cohomology ring.
  When S is the cotangent bundle of a Riemann surface, we recover the result of
T. Hausel and M. Thaddeus: The cohomology ring of the moduli spaces of Higgs
bundles is generated by the universal classes.
","[{""version"":""v1"",""created"":""Mon, 11 Sep 2000 18:03:12 GMT""},{""version"":""v2"",""created"":""Mon, 18 Sep 2000 13:31:26 GMT""},{""version"":""v3"",""created"":""Tue, 5 Dec 2000 21:01:09 GMT""},{""version"":""v4"",""created"":""Sat, 21 Apr 2001 16:10:14 GMT""}]","2007-05-23"
"math/0009110","Abdellatif Koukkous","A. Koukkous, H. Guiol","Large deviations for a zero mean asymmetric zero range process in random
  media","24 pages",,,"IMECC-UNICAMP RP16/00","math.PR math-ph math.MP",,"  We consider an asymmetric zero range process in infinite volume with zero
mean and random jump rates starting from equilibrium. We investigate the large
deviations from the hydrodynamical limit of the empirical distribution of
particles and prove an upper and a lower bound for the large deviation
principle. Our main argument is based on a super-exponential estimate in
infinite volume. For this we extend to our case a method developed by Kipnis &
al. (1989) and Benois & al. (1995).
","[{""version"":""v1"",""created"":""Mon, 11 Sep 2000 16:45:53 GMT""}]","2007-05-23"
"math/0009111","Michael Entov","Michael Entov","K-area, Hofer metric and geometry of conjugacy classes in Lie groups","Corrected final version, accepted for publication in Inventiones
  Mathematicae",,"10.1007/s002220100161",,"math.SG math.DG",,"  Given a closed symplectic manifold $(M,\omega)$ we introduce a certain
quantity associated to a tuple of conjugacy classes in the universal cover of
the group ${\hbox{\it Ham}} (M,\omega)$ by means of the Hofer metric on
${\hbox{\it Ham}} (M,\omega)$. We use pseudo-holomorphic curves involved in the
definition of the multiplicative structure on the Floer cohomology of a
symplectic manifold $(M,\omega)$ to estimate this quantity in terms of actions
of some periodic orbits of related Hamiltonian flows. As a corollary we get a
new way to obtain Agnihotri-Belkale-Woodward inequalities for eigenvalues of
products of unitary matrices. As another corollary we get a new proof of the
geodesic property (with respect to the Hofer metric) of Hamiltonian flows
generated by certain autonomous Hamiltonians. Our main technical tool is K-area
defined for Hamiltonian fibrations over a surface with boundary in the spirit
of L.Polterovich's work on Hamiltonian fibrations over $S^2$.
","[{""version"":""v1"",""created"":""Mon, 11 Sep 2000 17:12:19 GMT""},{""version"":""v2"",""created"":""Wed, 4 Oct 2000 15:46:16 GMT""},{""version"":""v3"",""created"":""Sun, 18 Feb 2001 19:54:04 GMT""},{""version"":""v4"",""created"":""Tue, 20 Feb 2001 11:14:37 GMT""},{""version"":""v5"",""created"":""Wed, 16 May 2001 15:21:19 GMT""}]","2009-10-31"
"math/0009112","Allen Knutson","Allen Knutson","Descent-cycling in Schubert calculus","10 pages, 2 figures, see also
  http://www.math.berkeley.edu/~allenk/java/DCApplet.html","Experiment. Math. 10 (2001), no. 3, 345--353",,,"math.CO math.AG",,"  We prove two lemmata about Schubert calculus on generalized flag manifolds
G/B, and in the case of the ordinary flag manifold GL_n/B we interpret them
combinatorially in terms of descents, and geometrically in terms of missing
subspaces. One of them gives a symmetry of Schubert calculus that we
christen_descent-cycling_. Computer experiment shows that these lemmata suffice
to determine all of GL_n Schubert calculus through n=5, and 99.97%+ at n=6. We
use them to give a quick proof of Monk's rule. The lemmata also hold in
equivariant (``double'') Schubert calculus for Kac-Moody groups G.
","[{""version"":""v1"",""created"":""Mon, 11 Sep 2000 20:18:35 GMT""}]","2010-04-26"
"math/0009113","Catherine Yan","R.L. Graham, J.C. Lagarias, C.L. Mallows, A.R. Wilks, and C.H. Yan","Apollonian Circle Packings: Number Theory","53 pages, 4 figures","J. Number Theory 100 (2003), 1--45",,,"math.NT",,"  Apollonian circle packings arise by repeatedly filling the interstices
between mutually tangent circles with further tangent circles. It is possible
for every circle in such a packing to have integer radius of curvature, and we
call such a packing an {\em integral Apollonian circle packing.} This paper
studies number-theoretic properties of the set of integer curvatures appearing
in such packings. Each Descartes quadruple of four tangent circles in the
packing gives an integer solution to the {\em Descartes equation}, which
relates the radii of curvature of four mutually tangent circles: $2 (x^2 + y^2
+ z^2 + w^2) - (x + y + z + w)^2 = 0.$ Each integral Apollonian circle packing
is classified by a certain {\em root quadruple} of integers that satisfies the
Descartes equation, and that corresponds to a particular quadruple of circles
appearing in the packing. We determine asymptotics for the number of root
quadruples of size below $T$. We study which integers occur in a given integer
packing, and determine congruence restrictions which sometimes apply. Finally,
we present evidence suggesting that the set of integer radii of curvatures that
appear in an integral Apollonian circle packing has positive density, and in
fact represents all sufficiently large integers not excluded by congruence
conditions. In a series of companion papersr ``Apollonian Circle Packings:
Geometry and Group Theory,'' we investigate a variety of group-theoretic
properties of these configurations, as well as various extensions to higher
dimensions and other spaces, such as hyperbolic space.
","[{""version"":""v1"",""created"":""Mon, 11 Sep 2000 22:54:40 GMT""},{""version"":""v2"",""created"":""Fri, 17 Oct 2003 22:08:05 GMT""}]","2007-05-23"
"math/0009114","Bjorn Birnir","Bjorn Birnir and Hoskuldur A. Hauksson","Basic Dynamical Systems Control of Aeroengine Flow","6pages",,,,"math.DS",,"  The notions of basic controllability and basic control are defined using
dynamical systems theory of partial differential equations. A quadratic optimal
control of the linearized viscous Moore-Greitzer equation is presented and it
is confirmed that stall is uncontrollable in this model. A basic control is
constructed for the nonlinear viscous Moore-Greitzer equation which can control
both surge and stall. Numerical simulations of the basic control are presented.
","[{""version"":""v1"",""created"":""Tue, 12 Sep 2000 00:39:58 GMT""}]","2007-05-23"
"math/0009116","Helmut Prodinger","Helmut Prodinger","Combinatorics of geometrically distributed random variables: Value and
  position of large left-to-right maxima","Several other new papers (by this author) can be found out at
  http://www.wits.ac.za/helmut/paperlst.htm",,,,"math.CO",,"  For words of length n, generated by independent geometric random variables,
we consider the average value and the average position of the r-th
left-to-right maximum counted from the right, for fixed r and n->oo. This
complements previous research where the analogous questions were considered for
the r-th left-to-right maximum counted from the left.
","[{""version"":""v1"",""created"":""Tue, 12 Sep 2000 07:40:10 GMT""}]","2007-05-23"
"math/0009117","Mircea Neagu","Mircea Neagu","Metrical Multi-Time Lagrange Geometry of Physical Fields","19 pages, A version of this paper was presented at Workshop on
  Differential Geometry, Global Analysis and Lie Algebras, Aristotle University
  of Thessaloniki, Greece, Aug. 28-Sept. 2, 2000","""Riemann-Lagrange geometrical background for multi-time physical
  fields"", Balkan J. of Geom. and Appl., 6, 2 (2001), 49-71",,,"math.DG math.MG",,"  The author exposes the metrical multi-time Lagrange geometry of physical
fields which naturally generalizes the classical Lagrangian developped by Miron
and Anastasiei. In other words, one constructs a natural theory of physical
fields on the 1-jet fibre bundle, attached to a Kronecker h-regular multi-time
Lagrangian with partial derivatives of order one.
","[{""version"":""v1"",""created"":""Tue, 12 Sep 2000 10:13:27 GMT""},{""version"":""v2"",""created"":""Tue, 31 Oct 2000 08:25:12 GMT""}]","2010-07-29"
"math/0009118","Robert Ghrist","A. Abrams and R. Ghrist","Finding topology in a factory: configuration spaces","16 pages, 7 figures",,,,"math.HO math.GT",,"  This expository article describes applications of topological configuration
spaces to the control of robotic systems. In particular, we review recent work
by the authors on configuration spaces of graphs. These are lovely spaces: we
show for example that the configuration space of two points on the complete
graph of five vertices is a closed orientable surface of genus six.
","[{""version"":""v1"",""created"":""Tue, 12 Sep 2000 10:44:58 GMT""}]","2007-05-23"
"math/0009119","Nicolas Andruskiewitsch","Nicolas Andruskiewitsch and Hans-Jurgen Schneider","Finite quantum groups over abelian groups of prime exponent","26 pages","Ann. Sci. Ec. Norm. Super. 35 (2002), 1--26.",,,"math.QA math.RA",,"  Since the discovery of quantum groups (Drinfeld, Jimbo) and finite
dimensional variations thereof (Lusztig, Manin), these objects were studied
from different points of view and had many applications. The present paper is
part of a series where we intend to show that important classes of Hopf
algebras are quantum groups and therefore belong to Lie theory. One of our main
results is the explicit construction of a general family of pointed Hopf
algebras from Dynkin diagrams. All the Frobenius-Lusztig kernels and their
parabolic subalgebras belong to this family, but in addition we get many new
examples. We show that any finite dimensional pointed Hopf algebra with group
of prime exponent (greater than 17) is indeed in this family. An important step
in the proof follows from a another result, where we show that a wide family of
finite dimensional pointed Hopf algebras is generated by group-like and
skew-primitive elements, giving additional support to a conjecture in our
previous paper ""Finite quantum groups and Cartan matrices"", Adv. Math. 154
(2000), 1--45.
","[{""version"":""v1"",""created"":""Tue, 12 Sep 2000 14:22:11 GMT""}]","2007-05-23"
"math/0009120","Peter F. Stadler","E. Brian Davies, Josef Leydold, Peter F. Stadler","Discrete Nodal Domain Theorems",,,,,"math.SP",,"  We give a detailed proof for two discrete analogues of Courant's Nodal Domain
Theorem.
","[{""version"":""v1"",""created"":""Tue, 12 Sep 2000 14:25:36 GMT""}]","2007-05-23"
"nlin/0009021","Christopher G. Jesudason","Christopher G. Jesudason","General Non-Applicability of the Liouville Equation in Statistical
  Mechanics and a New \mu-space Stochastic Equation for Dynamical Systems","11 pages, submitted to WCNA-2000 Proceedings (Nonlinear Analysis via
  Prof. Sengupta, IIT(Kanpur), India)",,,,"nlin.CD",,"  By examining both the divergence of the velocity vector in orthogonal
Cartesian coordinate space $\mathbf{\Gamma} $ of dimension $\R^{\textrm {2fN}}$
and the structure of the Hamiltonian determining a system trajectory, it is
shown that the standard Liouville equation cannot describe anything more than
linear motion for typical Hamiltonians with separated momentum and space
variables and some significant consequences such as the Poincare recurrence
theorem do not obtain for such Hamiltonians. A new stochastic equation which is
everywhere in principle discontinuous is developed for dynamical systems
described by a general Hamiltonian which is a functional of the space and
momentum variables, and where the average trajectory of a system point is
proven to be orthogonal to any constant energy surface consonant with the
system energy at equilibrium. This equation does not assume the presence of
binary collision only, as required in the standard first-order Boltzmann
equation, and is therefore suitable to describe dense systems as well, and may
be viewed as an alternative to the latter. Some new macroscopic variational
principles for non-equilibrium thermodynamical systems are proposed, where one
object for future work would be to relate the microscopic description given
here with the macroscopic principles.
","[{""version"":""v1"",""created"":""Tue, 12 Sep 2000 06:59:15 GMT""}]","2007-05-23"
"nlin/0009022","Robert Conte","Robert Conte (CEA, Saclay) and Micheline Musette (VUB, Brussels)","Analytic expressions of hydrothermal waves","LaTeX, 12 pages, no figure, to appear, Reports on Math. Physics","Reports on mathematical physics {\bf 46} (2000) 77--88","10.1016/S0034-4877(01)80010-0","SPEC S1999/054","nlin.SI nlin.PS",,"  When subjected to a horizontal temperature difference, a fluid layer with a
free surface becomes unstable and hydrothermal waves develop in the bulk. Such
a system is modelized by two coupled amplitude equations of the
one-dimensional, complex, cubic Ginzburg-Landau type. By transposing the method
developed for one CGL3 equation, we obtain several new exact solutions
expressed by closed form, singlevalued, analytic expressions. Some of them are
the analogue of the famous amplitude hole solution of Bekki and Nozaki.
","[{""version"":""v1"",""created"":""Tue, 12 Sep 2000 14:31:37 GMT""}]","2014-06-26"
"nlin/0009023","Cristobal Lopez","Cristobal Lopez, Emilio Hernandez-Garcia, Oreste Piro, Angelo Vulpiani
  and Enrico Zambianchi","Population dynamics advected by chaotic flows: a discrete-time map
  approach","22 pages, 5 figures","CHAOS 11, 397 (2001)","10.1063/1.1371285",,"nlin.CD q-bio",,"  A discrete-time model of reacting evolving fields, transported by a
bidimensional chaotic fluid flow, is studied. Our approach is based on the use
of a Lagrangian scheme where {\it fluid particles} are advected by a $2d$
symplectic map possibly yielding Lagrangian chaos. Each {\it fluid particle}
carries concentrations of active substances which evolve according to its own
reaction dynamics. This evolution is also modeled in terms of maps. Motivated
by the question, of relevance in marine ecology, of how a localized
distribution of nutrients or preys affects the spatial structure of predators
transported by a fluid flow, we study a specific model in which the population
dynamics is given by a logistic map with space-dependent coefficient, and
advection is given by the standard map. Fractal and random patterns in the
Eulerian spatial concentration of predators are obtained under different
conditions. Exploiting the analogies of this coupled-map (advection plus
reaction) system with a random map, some features of these patterns are
discussed.
","[{""version"":""v1"",""created"":""Tue, 12 Sep 2000 15:54:21 GMT""}]","2019-08-17"
"nucl-ex/0009010","Garth Huber","G.M. Huber, G.J. Lolos, Z. Papandreou, J. Hovdebo, S.I.H. Naqvi, D.F.
  Ottewell, P.L. Walden, G. Jones, X. Aslanoglou","Study of Two-Step Mechanisms in Pion Absorption on 6Li, 12C via Deuteron
  Emission","23 pages, 12 figures","Nucl.Phys. A705 (2002) 367-395","10.1016/S0375-9474(02)00678-4",,"nucl-ex",,"  The (pi+,pd), and (pi+,dd) reactions were investigated with pions of 100 and
165 MeV kinetic energy on 6Li and 12C targets. In comparison with previously
published (pi+,pp) data on the same targets and at the same beam energies,
kinematic regions were identified in which the neutron pickup process n+p->d
dominated the observed deuteron yield. The importance of this mechanism
increases with energy, contributing half of the observed cross section at 165
MeV. The contribution of direct quasi-triton absorption is significant only at
100 MeV.
","[{""version"":""v1"",""created"":""Mon, 11 Sep 2000 19:51:23 GMT""}]","2009-10-31"
"nucl-th/0009031","Jiunn-Wei Chen","Jiunn-Wei Chen, Thomas D. Cohen and Chung Wen Kao","Parity Violation in Polarized-Gamma Proton Compton Scattering","12 pages, 4 figures","Phys.Rev. C64 (2001) 055206","10.1103/PhysRevC.64.055206","DOE/ER/40762-215, UMD-PP-01-008","nucl-th",,"  Polarized beam gamma p Compton scattering provides a theoretically clean way
to extract the isovector parity violating pion-nucleon coupling constant
$h_{\pi NN}^{(1)}$. This channel is more tractable experimentally than the
recently proposed extraction of $h_{\pi NN}^{(1)}$ from the Bedaque-Savage
process --- polarized target gamma p compton scattering. The leading parity
violating effect is calculated using Heavy Baryon Chiral Perturbation Theory.
The size of the asymmetry is estimated to be ~ 4 10^{-8} for 120 MeV photon
energy.
","[{""version"":""v1"",""created"":""Mon, 11 Sep 2000 18:02:22 GMT""}]","2009-11-06"
"nucl-th/0009032","Joseph Kapusta","Sangyong Jeon and Joseph Kapusta","Interpretation of the First Data on Central Au+Au Collisions at
  Square-Root of s = 56 and 130 A GeV","8 pages, RevTex format, 1 figure","Phys.Rev. C63 (2001) 011901","10.1103/PhysRevC.63.011901",,"nucl-th",,"  We compare three semi-microscopic theories to the first data on particle
production in central Au+Au collisions taken at RHIC by the PHOBOS
collaboration as well as to existing data on central Pb+Pb collisions taken at
the SPS by the NA49 collaboration. LEXUS represents the SPS data quite well but
not the RHIC data, whereas the wounded nucleon model does the opposite. The
collective tube model fails to describe any of the data. This suggests a
transition in the dynamics of particle production between \sqrt{s} = 17 and 56
A GeV as one goes from the SPS to RHIC.
","[{""version"":""v1"",""created"":""Mon, 11 Sep 2000 19:10:08 GMT""}]","2009-11-06"
