"astro-ph/0009181","Jari Kotilainen","Renato Falomo (Padova Observatory, Italy), Jari Kotilainen (Tuorla
  Observatory, Finland), Aldo Treves (University of Insubria, Como, Italy)","Near-infrared imaging of the host galaxies of three radio-loud quasars
  at z = 1.5","11 pages, 2 figures. Accepted for publication in Astrophysical
  Journal",,"10.1086/318370",,"astro-ph",,"  We present high spatial resolution near-infrared H-band (1.65 microns)
images, taken with ISAAC on UT1 of ESO VLT, of three radio-loud quasars at z =
1.5, as a pilot study for imaging of a larger sample of radio-loud and
radio-quiet quasars in the redshift range 1 < z < 2. We are able to clearly
detect the host galaxy in two quasars (PKS 0000-177 and PKS 0348-120) and
marginally in the third (PKS 0402-362). The host galaxies appear compact
(average bulge scale-length R(e) = 4 kpc) and luminous (average M(H) =
-27.6+-0.1). They are 2.5 mag more luminous than the typical galaxy luminosity
(M*(H) = -25.0+-0.2), and are comparable to the hosts of low redshift
radio-loud quasars (M(H) = -26), taking into account passive stellar evolution.
Their luminosities are also similar to those of high redshift radio galaxies.
All three quasars have at least one close companion galaxy at a projected
distance < 50 kpc from the quasar, assuming they are at the same redshift.
","[{""version"":""v1"",""created"":""Tue, 12 Sep 2000 14:51:39 GMT""}]","2009-10-31"
"cond-mat/0009152","Hajime Yshinoo","Hajime Yoshino, Anael Lemaitre, Jean-Philippe Bouchaud (CEA-Saclay)","Multiple Domain Growth and Memory in the Droplet Model for Spin-Glasses","43 pages, 28 figures, revised and extended version to appear in
  European Physical Journal B",,"10.1007/s100510170257",,"cond-mat.dis-nn",,"  We study domain growth dynamics when the target state is suddenly changed on
all length scales. This procedure mimics the `chaos' effect postulated by the
droplet theory of spin-glasses, and allows us to investigate in details its
various dynamical consequences. We study the problem by a variety of methods,
including scaling arguments, analytical solution of the spherical Mattis model,
and Monte Carlo simulations of a 2-dimensional Ising Mattis model. We show that
successive coarsening with respect to different equilibrium states imprints
multiple domain structures on top of each other, plus extra noise due to random
interferences. We demonstrate that the domain structures can be retrieved by an
additional series of coarsening in the reversed order which removes the noises.
We discuss the rejuvenation (chaos) and memory effects observed in
temperature-cycling experiments in glassy systems from the present point of
view, and discuss some open problems and alternative descriptions.
","[{""version"":""v1"",""created"":""Mon, 11 Sep 2000 17:41:29 GMT""},{""version"":""v2"",""created"":""Tue, 6 Feb 2001 01:27:19 GMT""}]","2009-10-31"
"cond-mat/0009153","Anna Painelli","Y. Anusooya-Pati (1), Z.G. Soos (1), A.Painelli (2) ((1) Princeton
  Univ., (2) Parma Univ.)","Symmetry crossover and excitation thresholds at the neutral-ionic
  transition of the modified Hubbard model","12 pages, including 8 figures","Phys.Rev.B 63, 205118 (2001)","10.1103/PhysRevB.63.205118",,"cond-mat.str-el",,"  Exact ground states, charge densities and excitation energies are found using
valence bond methods for N-site modified Hubbard models with uniform spacing.
At the neutral-ionic transition (NIT), the ground state has a symmetry
crossover in 4n, 4n+2 rings with periodic and antiperiodic boundary conditions,
respectively. The modified Hubbard model has a continuous NIT between a
diamagnetic band insulator on the paired side and a paramagnetic Mott insulator
on the covalent side. The singlet-triplet (ST), singlet-singlet (SS) and charge
gaps for finite N indicate that the ST and SS gaps close at the NIT with
increasing U and that the charge gap vanishes only there. Finite-N excitations
constrain all singularities to about 0.1t of the symmetry crossover. The NIT is
interpreted as a localized ground state (gs) with finite gaps on the paired
side and an extended gs with vanishing ST and SS gaps on the covalent side. The
charge gap and charge stiffness indicate a metallic gs at the transition that,
however, is unconditionally unstable to dimerization.
","[{""version"":""v1"",""created"":""Mon, 11 Sep 2000 16:06:59 GMT""},{""version"":""v2"",""created"":""Thu, 31 May 2001 12:38:50 GMT""}]","2009-10-31"
"cond-mat/0009154","Hannu Hakkinen","H. Hakkinen, R. N. Barnett, A. G. Scherbakov and U. Landman","Nanowire Gold Chains: Formation Mechanisms and Conductance","RevTex, 2 figures, letter in J. Phys. Chem. B., in print (2000)",,,,"cond-mat.mtrl-sci",,"  Structural transformations, electronic spectra and ballistic transport in
pulled gold nanowires are investigated with ab initio simulations, and
correlated with recent measurements. Strain-induced yield of an initial
double-strand wire results first in formation of a bent-chain which transforms
upon further elongation to a linear atomic chain exhibiting dimerized atomic
configurations. These structures are stabilized by directional local bonding
with spd-hybridization. The conductance of the initial double-stranded contact
is close to 2g_0 and it drops sharply to 1g_0 during the transformation to a
single chain, exhibiting subsequently a 1g_0 plateau extending over an
elongation well above typical Au-Au distances.
","[{""version"":""v1"",""created"":""Mon, 11 Sep 2000 16:19:50 GMT""}]","2007-05-23"
"cond-mat/0009155","Daniel Boese","Michele Governale (1,2) and Daniel Boese (1) ((1) TFP, U Karlsruhe,
  (2) IET, U Pisa)","A magnetic barrier in confined two-dimensional electron gases:
  Nanomagnetometers and magnetic switches","4 pages, 5 figures included, to be published in Applied Physics
  Letters","Appl. Phys. Lett. 77, 3215 (2000).","10.1063/1.1325396",,"cond-mat.mes-hall",,"  We investigate the conductance properties of a hybrid
ferromagnet-semiconductor structure consisting of a confined two-dimensional
electron gas and a transverse ferromagnetic strip on top. Within the framework
of the Landauer-B\""uttiker model, we develop an alternative way to consider
magnetic fields. Our method describes devices ranging from a recently realized
nanomagnetometer down to quasi one-dimensional quantum wires. We provide a
rigorous way to relate the measured resistance to the actual magnetization of
the strip. Regarding the quasi one-dimensional wires we propose a new device
application, a tunable magnetic switch.
","[{""version"":""v1"",""created"":""Mon, 11 Sep 2000 16:10:04 GMT""}]","2009-10-31"
"cond-mat/0009156","Diego Porras","D. Porras, J. Fernandez-Rossier and C. Tejedor","Fermi-edge singularities in linear and non-linear ultrafast spectroscopy","long version; 9 pages, 4 figures","Phys. Rev. B 63, 245321 (2001)","10.1103/PhysRevB.63.245321",,"cond-mat.mes-hall",,"  We discuss Fermi-edge singularity effects on the linear and nonlinear
transient response of an electron gas in a doped semiconductor. We use a
bosonization scheme to describe the low energy excitations, which allows to
compute the time and temperature dependence of the response functions. Coherent
control of the energy absorption at resonance is analyzed in the linear regime.
It is shown that a phase-shift appears in the coherent control oscillations,
which is not present in the excitonic case. The nonlinear response is
calculated analytically and used to predict that four wave-mixing experiments
would present a Fermi-edge singularity when the exciting energy is varied. A
new dephasing mechanism is predicted in doped samples that depends linearly on
temperature and is produced by the low-energy bosonic excitations in the
conduction band.
","[{""version"":""v1"",""created"":""Mon, 11 Sep 2000 16:57:12 GMT""},{""version"":""v2"",""created"":""Thu, 15 Feb 2001 18:28:16 GMT""}]","2007-10-30"
"cond-mat/0009157","Francisco C. Alcaraz","F.C.Alcaraz and R. Z. Bariev","Exact Solution of Asymmetric Diffusion With N Classes of Particles of
  Arbitrary Size and Hierarchical Order","27 pages, 1 figure","Braz. Journal of Physics, vol 30, pg 655-666 (2000)","10.1590/S0103-97332000000400004",,"cond-mat.stat-mech",,"  The exact solution of the asymmetric exclusion problem with N distinct
classes of particles (c = 1,2,...,N), with hierarchical order is presented.
  In this model the particles (size 1) are located at lattice points, and
diffuse with equal asymmetric rates, but particles in a class c do not
distinguish those in the classes c' >c from holes (empty sites). We generalize
and solve exactly this model by considering the molecules in each distinct
class c =1,2,...,N with sizes s_c (s_c = 0,1,2,...), in units of lattice
spacing. The solution is derived by a Bethe ansatz of nested type.
","[{""version"":""v1"",""created"":""Mon, 11 Sep 2000 19:27:42 GMT""}]","2015-06-24"
"cond-mat/0009158","V. Kiryukhin","V. Kiryukhin, Y. J. Kim, K. J. Thomas, F. C. Chow, R. W. Erwin, Q.
  Huang, M. A. Kastner, R. J. Birgeneau","Magnetic properties of the S=1/2 quasi-one-dimensional antiferromagnet
  CaCu2O3","12 pages, 10 embedded figures",,"10.1103/PhysRevB.63.144418",,"cond-mat",,"  We report single crystal growth and magnetic susceptibility and neutron
diffraction studies of the S=1/2 quasi-1D antiferromagnet CaCu2O3. The
structure of this material is similar to that of the prototype two-leg
spin-ladder compound SrCu2O3. However, the Cu-O-Cu bond angle in the ladder
rungs in CaCu2O3 is equal to 123 deg, and therefore the magnetic interaction
along the rungs is expected to be much weaker in this material. At high
temperatures, the magnetic susceptibility of CaCu2O3 can be decomposed into a
contribution from 1D antiferromagnetic chains of finite-size chain segments
together with a weak Curie contribution. The intrachain magnetic exchange
constant, determined from the magnetic susceptibility measurements, is 2000 K.
CaCu2O3 undergoes a Neel transition at T_N=25 K with ordering wavevector of
(0.429(5), 0.5, 0.5). The magnetic structure is incommensurate in the direction
of the frustrated interchain interaction. Weak commensurate (0.5, 0.5, 0.5)
magnetic peaks are also observed below T_N. Application of a magnetic field
induces a metamagnetic transition at which the incommensurability of the
magnetic structure is substantially reduced. The material possesses only
short-range magnetic order above the transition field.
","[{""version"":""v1"",""created"":""Mon, 11 Sep 2000 19:27:55 GMT""}]","2009-10-31"
"cond-mat/0009159","Zhang Yang","Zhang Yang","New approach to Monte Carlo calculation of buckling of supercoiled DNA
  loops","4 pages, 3 PS figures, to appear at Phys. Rev. E as a Rapid
  Communication","Phys.Rev.E62:5923-5926,2000","10.1103/PhysRevE.62.5923",,"cond-mat.soft cond-mat.stat-mech hep-ph physics.bio-ph physics.comp-ph q-bio",,"  The short supercoiled circular DNA molecules are shown to be glassy systems
and canonical Metropolis Monte Carlo simulations of the systems tend to get
stuck in local metastable energy basins. A novel Monte Carlo algorithm is
developed to alleviate the problem of ``ergodicity breaking'' of the glassy
systems, in which the Markov process is driven by an explicitly analytic weight
factor with enhanced probability in both low- and high-energy regions. To
characterize the degree of puckering of the supercoiled DNA loops, a new
quantity of aplanarity is introduced as the shortest principal axis of
configurational ellipsoid of DNA. With the suggested Monte Carlo method, the
quantitative correlation between supercoiling degree and buckling of DNA is
attained. With supercoiling stress increasing, the conformational transition
from a circle to mono-, diplo- or triple interwound superhelical structure will
take place in a successive but decreasingly abrupt mode.
","[{""version"":""v1"",""created"":""Mon, 11 Sep 2000 19:49:12 GMT""}]","2016-08-31"
"cond-mat/0009160","Dimitre Andonov Dimitrov","D. A. Dimitrov, H. Roder, and A. R. Bishop","Peak positions and shapes in neutron pair correlation functions from
  powders of highly anisotropic crystals",,,"10.1103/PhysRevB.64.014303",,"cond-mat.mtrl-sci",,"  The effect of the powder average on the peak shapes and positions in neutron
pair distribution functions of polycrystalline materials is examined. It is
shown that for highly anisotropic crystals, the powder average leads to shifts
in peak positions and to non-Gaussian peak shapes. The peak shifts can be as
large as several percent of the lattice spacing.
","[{""version"":""v1"",""created"":""Mon, 11 Sep 2000 20:30:35 GMT""}]","2009-10-31"
"cond-mat/0009161","Xin Wan","Xin Wan and R. N. Bhatt","Ferromagnetism in Insulating, Doped Diluted Magnetic Semiconductors",,,,,"cond-mat.mtrl-sci cond-mat.dis-nn",,"  We report results of a Monte Carlo study of doped, diluted magnetic
semiconductors in the low carrier density (insulating) regime. We find that the
system undergoes a transition from a paramagnet at high temperatures to a
ferromagnet at low temperatures. However, in strong contrast to uniform
systems, disorder effects dominate the entire collective behavior, leading to
very unconventional properties such as (1) magnetization curves that cannot be
described by theories based on critical fluctuations, or on spin wave analysis
over any significant fraction of the phase diagram; (2) a large peak in
susceptibilty well below the ordering temperature; and (3) specific heat curves
that point out the inadequacy of a classical Heisenberg model for spin-5/2 Mn
ions. A picture of percolating magnetic polarons appears to describe the data
well, and leads to a prescription for correcting the unphysical results of the
classical continuous spin model in terms of a discrete vector model.
","[{""version"":""v1"",""created"":""Mon, 11 Sep 2000 20:57:06 GMT""}]","2007-05-23"
"cond-mat/0009162","Paulo Roberto de Araujo Campos","D. Alves, P. R. A. Campos, A. T. C. Silva and J. F.Fontanari","Group selection models in prebiotic evolution","22 pages, 10 figures",,"10.1103/PhysRevE.63.011911",,"cond-mat.stat-mech q-bio",,"  The evolution of enzyme production is studied analytically using ideas of the
group selection theory for the evolution of altruistic behavior. In particular,
we argue that the mathematical formulation of Wilson's structured deme model
({\it The Evolution of Populations and Communities}, Benjamin/Cumings, Menlo
Park, 1980) is a mean-field approach in which the actual environment that a
particular individual experiences is replaced by an {\it average} environment.
That formalism is further developed so as to avoid the mean-field approximation
and then applied to the problem of enzyme production in the prebiotic context,
where the enzyme producer molecules play the altruists role while the molecules
that benefit from the catalyst without paying its production cost play the
non-altruists role. The effects of synergism (i.e., division of labor) as well
as of mutations are also considered and the results of the equilibrium analysis
are summarized in phase diagrams showing the regions of the space of parameters
where the altruistic, non-altruistic and the coexistence regimes are stable. In
general, those regions are delimitated by discontinuous transition lines which
end at critical points.
","[{""version"":""v1"",""created"":""Mon, 11 Sep 2000 22:04:49 GMT""}]","2009-10-31"
"cond-mat/0009163","Alec Maassen van den Brink","Alec Maassen van den Brink","Quantum-efficient charge detection using a single-electron transistor","REVTeX, 4 pages, no figures; discussion expanded, $\epsilon$-$\eta$
  relation corrected below (10); subm. to PRL","Europhys. Lett._58_, 562 (2002)","10.1209/epl/i2002-00432-x",,"cond-mat.mes-hall quant-ph",,"  We evaluate the detector nonideality (and energy sensitivity) of a
normal-state single-electron transistor (SET) in the cotunneling regime in a
two-charge-state approximation. For small conductances and at zero temperature,
the SET's performance as a charge-qubit readout device is characterized by a
universal one-parameter function. The result shows that near-ideal,
quantum-limited measurement is possible for a wide range of small bias
voltages. However, near the threshold voltage for crossover to sequential
tunneling, the device becomes strongly nonideal. The (symmetrized)
current-charge cross-correlation vanishes for low frequencies, causing two
different definitions of detector nonideality to agree. Interpretations of
these findings are discussed.
","[{""version"":""v1"",""created"":""Mon, 11 Sep 2000 22:18:13 GMT""},{""version"":""v2"",""created"":""Tue, 12 Sep 2000 00:21:43 GMT""},{""version"":""v3"",""created"":""Mon, 2 Oct 2000 21:08:52 GMT""}]","2015-06-24"
"cond-mat/0009164","Igor Herbut","Igor F. Herbut (Simon Fraser University)","The effect of a parallel magnetic field on the Boltzmann conductivity
  and the Hall coefficient of a disordered two dimensional Fermi liquid","RevTex, 4 pages, 3 ps figures included; references added and updated,
  added a fit to exp data of Okamoto et. al. (Fig. 2) and a discussion on
  differences and similarities with Dolgopolov and Gold theory; added a
  calculation of the Hall coefficient and the discussion of the Vitkalov et.
  al. experiment","Physical Review B, vol. 63, 113102 (2001)","10.1103/PhysRevB.63.113102",,"cond-mat.str-el cond-mat.dis-nn",,"  Screening of an external random potential by a two dimensional (2D) Fermi
liquid may be strongly dependent on the degree of its polarization. This is
considered as a possible mechanism for the observed strong magnetoresistance of
the 2D electron liquid in the magnetic field parallel to the electron plane. A
Hartree-Fock calculation for the weakly disordered Hubbard model which
qualitatively describes the experiments on the diagonal and the Hall
resisitivity in the finite-temperature metallic state in the high mobility Si
inversion layers is presented.
","[{""version"":""v1"",""created"":""Mon, 11 Sep 2000 22:42:49 GMT""},{""version"":""v2"",""created"":""Tue, 19 Sep 2000 21:00:07 GMT""},{""version"":""v3"",""created"":""Thu, 28 Sep 2000 05:32:13 GMT""}]","2009-10-31"
"cond-mat/0009165","Ilya M. Nemenman","Ilya Nemenman and William Bialek","Occam factors and model-independent Bayesian learning of continuous
  distributions","publication revisions: extended introduction, new references, other
  minor corrections; 6 pages, 6 figures, revtex","Phys. Rev. E, 65 (2), 2002","10.1103/PhysRevE.65.026137",,"cond-mat cs.LG nlin.AO physics.data-an",,"  Learning of a smooth but nonparametric probability density can be regularized
using methods of Quantum Field Theory. We implement a field theoretic prior
numerically, test its efficacy, and show that the data and the phase space
factors arising from the integration over the model space determine the free
parameter of the theory (""smoothness scale"") self-consistently. This persists
even for distributions that are atypical in the prior and is a step towards a
model-independent theory for learning continuous distributions. Finally, we
point out that a wrong parameterization of a model family may sometimes be
advantageous for small data sets.
","[{""version"":""v1"",""created"":""Mon, 11 Sep 2000 22:51:53 GMT""},{""version"":""v2"",""created"":""Tue, 5 Feb 2002 00:04:38 GMT""}]","2007-05-23"
"cond-mat/0009166","Robert M. Konik","Robert M. Konik, Hubert Saleur, and Andreas W. W. Ludwig","Interplay of the Scaling Limit and the Renormalization Group:
  Implications for Symmetry Restoration","20 pages, 11 figures, RevTeX",,"10.1103/PhysRevB.66.075105",,"cond-mat.str-el hep-th",,"  Symmetry restoration is usually understood as a renormalization group induced
phenomenon. In this context, the issue of whether one-loop RG equations can be
trusted in predicting symmetry restoration has recently been the subject of
much debate. Here we advocate a more pragmatic point of view and expand the
definition of symmetry restoration to encompass all situations where the
physical properties have only a weak dependence upon an anisotropy in the bare
couplings. Moreover we concentrate on universal properties, and so take a
scaling limit where the physics is well described by a field theory. In this
context, we find a large variety of models that exhibit, for all practical
purposes, symmetry restoration: even if symmetry is not restored in a strict
sense, physical properties are surprisingly insensitive to the remaining
anisotropy.
  Although we have adopted an expanded notion of symmetry restoration, we
nonetheless emphasize that the scaling limit also has implications for symmetry
restoration as a renormalization group induced phenomenon. In all the models we
considered, the scaling limit turns out to only permit bare couplings which are
nearly isotropic and small. Then the one-loop beta-function should contain all
the physics and higher loop orders can be neglected. We suggest that this
feature generalizes to more complex models. We exhibit a large class of
theories with current-current perturbations (of which the SO(8) model of
interest in two-leg Hubbard ladders/armchair carbon nanotubes is one) where the
one-loop beta-functions indicates symmetry restoration and so argue that these
results can be trusted within the scaling limit.
","[{""version"":""v1"",""created"":""Tue, 12 Sep 2000 01:04:53 GMT""}]","2013-05-29"
"cond-mat/0009167","Sarasij","Madan Rao, Sarasij R C","Active Fusion and Fission Processes on a Fluid Membrane","4 pages, 3 figures; text shortened and 1 figure deleted to meet the
  requirements of the journal, an additional calculation has been included",,"10.1103/PhysRevLett.87.128101",,"cond-mat.soft q-bio",,"  We investigate the steady states and dynamical instabilities resulting from
``particles'' depositing on (fusion) and pinching off (fission) a fluid
membrane. These particles could be either small lipid vesicles or isolated
proteins. In the stable case, such fusion/fission events suppress long
wavelength fluctuations of the membrane. In the unstable case, the membrane
shoots out long tubular structures reminiscent of endosomal compartments or
folded structures as in internal membranes like the endoplasmic reticulum or
Golgi. We argue that these fusion/fission events should be strongly affected by
tension.
","[{""version"":""v1"",""created"":""Tue, 12 Sep 2000 02:01:34 GMT""},{""version"":""v2"",""created"":""Mon, 26 Feb 2001 06:33:28 GMT""}]","2009-10-31"
"cond-mat/0009168","A. Lamura","F. Corberi, G. Gonnella and A. Lamura","Phase-separation of binary fluids in shear flow: a numerical study","6 pages, 11 figures in .gif format",,"10.1103/PhysRevE.62.8064",,"cond-mat",,"  The phase-separation kinetics of binary fluids in shear flow is studied
numerically in the framework of the continuum convection-diffusion equation
based on a Ginzburg-Landau free energy. Simulations are carried out for
different temperatures both in d=2 and in d=3. Our results confirm the
qualitative picture put forward by the large-N limit equations studied in
\cite{noi}. In particular, the structure factor is characterized by the
presence of four peaks whose relative oscillations give rise to a periodic
modulation of the behavior of the rheological indicators and of the average
domains sizes. This peculiar pattern of the structure factor corresponds to the
presence of domains with two characteristic thicknesses whose relative
abundance changes with time.
","[{""version"":""v1"",""created"":""Tue, 12 Sep 2000 06:15:26 GMT""}]","2009-10-31"
"cond-mat/0009169","Wolfgang B. Thimm","Wolfgang Thimm, Christian Friedrich, Tobias Roths, Stefan Trinkle,
  Josef Honerkamp","Characterization of long-chain branching effects in linear rheology","submitted to Journal of Rheology",,,,"cond-mat.mtrl-sci cond-mat.soft",,"  This is the last part of a series of five articles published in Journal of
Rheology (Maier et al. (1998), Thimm et al. (1999a), Thimm et al. (2000a),
Thimm et al. (2000c)) in which progress on the determination of binary
molecular weight distributions from rheological data has been reported. In this
article is discussed in how far the developed methods can also be used to
characterize long-chain branching effects.
  Monomodal samples which contain long-chain branches will show two relaxation
processes in the rheological examination, which are converted to two peaks in a
corresponding molecular weight distribution. But these samples will show only
one peak in a molecular weight distribution determined by a size-exclusion
chromatography examination. This difference can be used to characterize
long-chain branched materials as will be explained in this article.
  The usefulness of this method is demonstrated by examining polymers, which
contain definite long-chain branches specified from the way, they were made.
","[{""version"":""v1"",""created"":""Tue, 12 Sep 2000 06:49:19 GMT""}]","2007-05-23"
"cond-mat/0009170","Ferran Mazzanti Castrillejo","F.Mazzanti and A.Polls","Finite temperature dynamic structure function of the free Bose gas","To appear in Phys.Lett.A, seven figures",,"10.1016/S0375-9601(00)00607-1",,"cond-mat",,"  A detailed calculation of the finite temperature dynamic structure function
of the free Bose gas is presented and discussed. After a short derivation of
the expressions describing the exact response $S(q,\omega;T)$ and the Impulse
Approximation (IA) $S_{IA}(q,\omega;t)$, their main properties and their
evolution with q and T are analyzed. The lowest order energy weighted sum rules
of both $S(q,\omega;T)$ and $S_{IA}(q,\omega;T)$ are also derived and
commented. Finally, the $q\to\infty$ asymptotic behavior is analyzed and
discussed in terms of scaling laws.
","[{""version"":""v1"",""created"":""Tue, 12 Sep 2000 07:37:07 GMT""}]","2009-10-31"
