"math/0009218","Alexei Tsygvintsev","Alexei Tsygvintsev","The meromorphic non-integrability of the three-body problem","17 pages, submitted to Crelle's Journal",,,,"math.DS",,"  We study the planar three-body problem and prove the absence of a complete
set of complex meromorphic first integrals in a neighborhood of the Lagrangian
solution. We use the Ziglin's method and study the monodromy group of the
corresponding normal variational equations.
","[{""version"":""v1"",""created"":""Mon, 25 Sep 2000 10:32:16 GMT""}]","2007-05-23"
"math/0009219","Martin Schlichenmaier","Martin Schlichenmaier","Berezin-Toeplitz quantization and Berezin transform","17 pages",,"10.1142/9789812794598_0015","Mannheimer Manuskripte 257","math.QA math-ph math.CV math.DG math.MP math.SG quant-ph",,"  In this lecture results on the Berezin-Toeplitz quantization of arbitrary
compact quantizable Kaehler manifolds are presented.
  These results are obtained in joint work with M. Bordemann and E. Meinrenken.
The existence of the Berezin-Toeplitz deformation quantization is also covered.
Recent results obtained in joint work with A. Karabegov on the asymptotic
expansion of the Berezin transform for arbitrary quantizable compact Kaehler
manifolds are explained. As an application the asymptotic expansion of the
Fubini-Study fundamental form under the coherent state embedding is considered.
Some comments on the dynamics of the quantum operators are given. (This is an
extended write-up of an invited lecture presented at the workshop ``Asymptotic
properties of time evolutions in classical and quantum systems'', September
13-17, 1999, Bologna, Italy.)
","[{""version"":""v1"",""created"":""Mon, 25 Sep 2000 10:41:02 GMT""}]","2017-08-23"
"math/0009220","Silvia Anjos","Silvia Anjos","Homotopy type of symplectomorphism groups of S^2 X S^2","Published in Geometry and Topology at
  http://www.maths.warwick.ac.uk/gt/GTVol6/paper7.abs.html","Geom. Topol. 6 (2002) 195-218","10.2140/gt.2002.6.195",,"math.SG",,"  In this paper we discuss the topology of the symplectomorphism group of a
product of two 2-dimensional spheres when the ratio of their areas lies in the
interval (1,2]. More precisely we compute the homotopy type of this
symplectomorphism group and we also show that the group contains two finite
dimensional Lie groups generating the homotopy. A key step in this work is to
calculate the mod 2 homology of the group of symplectomorphisms. Although this
homology has a finite number of generators with respect to the Pontryagin
product, it is unexpected large containing in particular a free noncommutative
ring with 3 generators.
","[{""version"":""v1"",""created"":""Mon, 25 Sep 2000 14:02:39 GMT""},{""version"":""v2"",""created"":""Thu, 2 May 2002 19:40:34 GMT""}]","2014-11-11"
"math/0009221","Gabriel Nagy","Gabriel Nagy (Kansas State University)","A note on idempotents in finite AW*-factors","LaTeX 7",,,,"math.OA",,"  We prove that the value of the quasi-trace on an idempotent element in a
AW*-factor of type II_1 is the same as the dimension of its left (or right)
support.
","[{""version"":""v1"",""created"":""Mon, 25 Sep 2000 14:09:41 GMT""}]","2007-05-23"
"nlin/0009044","Tsiganov","Andrey Tsiganov","The Maupertuis principle and integrable systems","23 pages, LaTeX, a review for J.Nonlinear Math. Phys",,,,"nlin.SI hep-th math-ph math.MP",,"  We discuss some special classes of canonical transformations of the extended
phase space, which relate integrable systems with a common Lagrangian
submanifold. Various parametric forms of trajectories are associated with
different integrals of motion, Lax equations, separated variables and
action-angles variables. In this review we will discuss namely these induced
transformations instead of the various parametric form of the geometric
objects.
","[{""version"":""v1"",""created"":""Mon, 25 Sep 2000 15:16:08 GMT""}]","2007-05-23"
"nucl-th/0009071","Theodore Liolios","Theodore E. Liolios","Atomic effects in astrophysical nuclear reactions","14 RevTex pages + 2 ps (revised) figures. Phys.Rev.C (in production)","Phys.Rev. C63 (2001) 045801","10.1103/PhysRevC.63.045801",,"nucl-th astro-ph nucl-ex physics.atom-ph",,"  Two models are presented for the description of the electron screening
effects that appear in laboratory nuclear reactions at astrophysical energies.
The two-electron screening energy of the first model agrees very well with the
recent LUNA experimental result for the break-up reaction $%
He3(He3,2p)He^{4}$, which so far defies all available theoretical models.
Moreover, multi-electron effects that enhance laboratory reactions of the CNO
cycle and other advanced nuclear burning stages, are also studied by means of
the Thomas-Fermi model, deriving analytical formulae that establish a lower and
upper limit for the associated screening energy. The results of the second
model, which show a very satisfactory compatibility with the adiabatic
approximation ones, are expected to be particularly useful in future
experiments for a more accurate determination of the CNO astrophysical factors.
","[{""version"":""v1"",""created"":""Mon, 25 Sep 2000 07:15:16 GMT""},{""version"":""v2"",""created"":""Sat, 6 Jan 2001 10:01:31 GMT""}]","2009-11-06"
"physics/0009071","Vladimir I. Korobov","V.I. Korobov","Relativistic corrections to the dipole polarizability of the ground
  state of the molecular ion H_2^+","4 pages, submitted to Phys. Rev. A (Breif Reports)",,"10.1103/PhysRevA.63.044501",,"physics.atom-ph",,"  The recently reported precise experimental determination of the dipole
polarizability of the H_2^+ molecular ion ground state [P.L. Jacobson, R.A.
Komara, W.G. Sturrus, and S.R. Lundeen, Phys. Rev. A 62, 012509 (2000)] reveals
a discrepancy between theory and experiment of about 0.0007a_0^3, which has
been attributed to relativistic and QED effects. In present work we analyze an
influence of the relativistic effects on the scalar dipole polarizability of an
isolated H_2^+ molecular ion. Our conclusion is that it accounts for only 1/5
of the measured discrepancy.
","[{""version"":""v1"",""created"":""Mon, 25 Sep 2000 08:39:20 GMT""}]","2009-11-06"
"quant-ph/0009099","Andytonya","V.V'yurkov and L.Y.Gorelik","Charge based quantum computer without charge transfer","9 pages, 1 figure",,,,"quant-ph",,"  A novel implementation of a charge based quantum computer is proposed. There
is no charge transfer during calculation, therefore, uncontrollable
entanglement between qubits due to long-range Coulomb forces is suppressed.
High-speed computation with 1ps per an operation looks as feasible.
","[{""version"":""v1"",""created"":""Sun, 24 Sep 2000 16:33:52 GMT""}]","2007-05-23"
"quant-ph/0009100","Bob Coecke","Bob Coecke, David J. Moore and Isar Stubbe","Quantaloids Describing Causation and Propagation of Physical Properties","13 pages (+ 5 pages with respect to previous version) - extended
  physical discussion and reference update. Camera ready version","Foundations of Physics Letters 14, p.133-145 (2001)",,,"quant-ph math-ph math.CT math.LO math.MP",,"  A general principle of `causal duality' for physical systems, lying at the
base of representation theorems for both compound and evolving systems, is
proved; formally it is encoded in a quantaloidal setting. Other particular
examples of quantaloids and quantaloidal morphisms appear naturally within this
setting; as in the case of causal duality, they originate from primitive
physical reasonings on the lattices of properties of physical systems.
Furthermore, an essentially dynamical operational foundation for studying
physical systems is outlined; complementary as it is to the existing static
operational foundation, it leads to the natural axiomatization of `causal
duality' in operational quantum logic.
","[{""version"":""v1"",""created"":""Mon, 25 Sep 2000 14:00:41 GMT""},{""version"":""v2"",""created"":""Thu, 4 Jan 2001 14:09:00 GMT""},{""version"":""v3"",""created"":""Tue, 1 May 2001 20:19:11 GMT""}]","2007-05-23"
