"cond-mat/0009377","Andre Guerin Moreira","Andre G. Moreira and Roland R. Netz","Binding of Similarly Charged Plates: A Global Analysis","4 pages, 4 figures",,,,"cond-mat.soft cond-mat.stat-mech",,"  Similarly and highly charged plates in the presence of multivalent counter
ions attract each other, leading to electrostatically bound states. Using
Monte-Carlo simulations we obtain the inter-plate pressure in the global
parameter space. The equilibrium plate separation, where the pressure changes
from attractive to repulsive, exhibits a novel unbinding transition. A
systematic and asymptotically exact strong-coupling field-theory yields the
bound state from a competition between counter-ion entropy and electrostatic
attraction, in agreement with simple scaling arguments.
","[{""version"":""v1"",""created"":""Mon, 25 Sep 2000 14:10:31 GMT""}]","2007-05-23"
"cond-mat/0009378","Thomas Vojta","Rudolf A. Roemer, Michael Schreiber, Thomas Vojta","Disorder and Two-Particle Interaction in Low-Dimensional Quantum Systems","8 pages, 4 eps figures, Proc. of the Int. Workshop on Dynamics of
  Complex Systems, MPI Dresden, 1999, to appear in Physica E","Physica E 9, 397 (2001)","10.1016/S1386-9477(00)00236-8",,"cond-mat.dis-nn cond-mat.str-el",,"  We review some of the recent results on two-interacting particles (TIP) in
low-dimensional disordered quantum models. Special attention is given to the
mapping of the problem onto random band matrices. In particular, we construct
two simple, seemingly closely related examples for which an analogous mapping
leads to incorrect results. We briefly discuss possible reasons for this
discrepancy based on the physical differences between the TIP problem and our
examples.
","[{""version"":""v1"",""created"":""Mon, 25 Sep 2000 14:10:43 GMT""}]","2009-10-31"
"cond-mat/0009379","Martin H. Muser","Philipp Schoffel and Martin H. Muser","Elastic Constants of Quantum Solids by Path Integral Simulations","9 pages doublecolumn, 6 figures, submitted to PRB",,"10.1103/PhysRevB.63.224108","KOMA-00-19","cond-mat.mtrl-sci cond-mat.stat-mech",,"  Two methods are proposed to evaluate the second-order elastic constants of
quantum mechanically treated solids. One method is based on path-integral
simulations in the (NVT) ensemble using an estimator for elastic constants. The
other method is based on simulations in the (NpT) ensemble exploiting the
relationship between strain fluctuations and elastic constants. The strengths
and weaknesses of the methods are discussed thoroughly. We show how one can
reduce statistical and systematic errors associated with so-called primitive
estimators. The methods are then applied to solid argon at atmospheric
pressures and solid helium 3 (hcp, fcc, and bcc) under varying pressures. Good
agreement with available experimental data on elastic constants is found for
helium 3. Predictions are made for the thermal expectation value of the kinetic
energy of solid helium 3.
","[{""version"":""v1"",""created"":""Mon, 25 Sep 2000 14:53:34 GMT""}]","2013-05-29"
"cond-mat/0009380","Reinhold Brueckner","Reinhold Brueckner","Some Aspects regarding Renormalisation Theory of Critical Phenomena","html file, 5 pages, with equations embedded, total of 8 files when
  downloaded (1 text + 7 equations)",,,,"cond-mat.stat-mech",,"  Concerning renormalisation group theory applied to phase transitions, we
examine the value of positive numerical and analytical evidence, the divergent
short-wavelength behaviour of classical free fields and the absence of
UV-divergences in quantum field theories with proper mathematical handling. We
conclude as to the inadequacy of the conceptual and mathematical framework of
renormalisation theory of critical phenomena.
","[{""version"":""v1"",""created"":""Mon, 25 Sep 2000 15:23:36 GMT""}]","2007-05-23"
"cond-mat/0009381","Daniel Boese","D. Boese (1), M. Lischka (2), L.E. Reichl (3) ((1) TFP, U Karlsruhe,
  (2) TU M\""unchen, (3) U of TX, Austin)","Scaling behavior in a quantum wire with scatterers","7 pages, 7 figures included; to be published in Phys. Rev. B","Phys. Rev. B 62, 16933 (2000).","10.1103/PhysRevB.62.16933",,"cond-mat.mes-hall",,"  We study the conductance properties of a straight two-dimensional quantum
wire with impurities modeled by $s$-like scatterers. Their presence can lead to
strong inter-channel coupling. It was shown that such systems depend
sensitively on the number of transverse modes included. Based on a poor man's
scaling technique we include the effect of higher modes in a renormalized
coupling constant. We therefore show that the low-energy behavior of the wire
is dominated by only a few modes, which hence is a way to reduce the necessary
computing power. The technique is successfully applied to the case of one and
two $s$-like scatterers.
","[{""version"":""v1"",""created"":""Mon, 25 Sep 2000 15:51:17 GMT""}]","2009-10-31"
"gr-qc/0009082","Tekin Dereli","T. Dereli, O. Sarioglu (METU, Ankara)","Topologically massive gravity and black holes in three dimensions","4 pages REVTEX file, no figures",,,,"gr-qc",,"  We obtain a general class of exact solutions to topologically massive gravity
with or without a negative cosmological constant. In the first case, we show
that the solution is supersymmetric and asymptotically approaches the extremal
BTZ black hole solution, while in the latter case it goes to flat space-time.
","[{""version"":""v1"",""created"":""Mon, 25 Sep 2000 11:30:15 GMT""}]","2007-05-23"
"gr-qc/0009083","Elizabeth Winstanley","David D. Song and Elizabeth Winstanley","Information Erasure and the Generalized Second Law of Black Hole
  Thermodynamics","Latex, 9 pages","Int.J.Theor.Phys.47:1692-1698,2008","10.1007/s10773-007-9610-0",,"gr-qc quant-ph",,"  We consider the generalized second law of black hole thermodynamics in the
light of quantum information theory, in particular information erasure and
Landauer's principle (namely, that erasure of information produces at least the
equivalent amount of entropy). A small quantum system outside a black hole in
the Hartle-Hawking state is studied, and the quantum system comes into thermal
equilibrium with the radiation surrounding the black hole. For this scenario,
we present a simple proof of the generalized second law based on quantum
relative entropy. We then analyze the corresponding information erasure
process, and confirm our proof of the generalized second law by applying
Landauer's principle.
","[{""version"":""v1"",""created"":""Mon, 25 Sep 2000 11:59:10 GMT""}]","2008-11-26"
"gr-qc/0009084","Carlos F. Sopuerta","Carlos F Sopuerta","Cosmological models with flat spatial geometry","12 pages, LaTeX2e, IOP style. To appear in Classical and Quantum
  Gravity","Class.Quant.Grav.17:4685-4696,2000","10.1088/0264-9381/17/22/309",,"gr-qc astro-ph",,"  The imposition of symmetries or special geometric properties on submanifolds
is less restrictive than to impose them in the full space-time. Starting from
this idea, in this paper we study irrotational dust cosmological models in
which the geometry of the hypersurfaces generated by the fluid velocity is
flat, which supposes a relaxation of the restrictions imposed by the
Cosmological Principle. The method of study combines covariant and tetrad
methods that exploits the geometrical and physical properties of these models.
This procedure will allow us to determine all the space-times within this class
as well as to study their properties. Some important consequences and
applications of this study are also discussed.
","[{""version"":""v1"",""created"":""Mon, 25 Sep 2000 14:53:16 GMT""}]","2014-11-17"
"gr-qc/0009085","Rafael A. Vera","Rafael A. Vera","Conflict between the Gravitational Field Energy and the Experiments","Standard Latex, 24 pages. Submitted to Physical Reviews D Minor but
  important changes are made up to prevent any arguments based in
  non-experimental facts",,,,"gr-qc",,"  From the equivalence principle and true gravitational (G) time dilation
experiments it is concluded that ``matter is not invariable after a change of
relative position with respect to other bodies''. As a general principle (GP),
such variations cannot be locally detected because the basic parameters of all
of the 'well-defined parts' of the instruments change, lineally, in the same
proportion with respect to their original values''. Only observers that don't
change of position can detect them. Thus, to relate quantities measured by
observers in different G potentials they must be previously transformed after
Lorenz and G transformations derived from experiments. They are account for all
of the ``G tests''. However ``they are not consistent with the presumed energy
exchange between the field and the bodies''. The lack of energy of the G field
is justified from the GP, according to which particles models made up of
photons in stationary state obey same inertial and G laws as particle. Such
model has been previously tested with relativistic quantum-mechanics and all of
the G tests.
  PACS: 04.80.cc, 04.20.Cv, 04.80.-y, 98.80.Cq
","[{""version"":""v1"",""created"":""Mon, 25 Sep 2000 14:37:47 GMT""},{""version"":""v2"",""created"":""Wed, 7 Feb 2001 08:25:54 GMT""}]","2007-05-23"
"hep-ex/0009052","Catherine Bourge","Aleph, CDF, Delphi, L3, Opal, SLD Collaborations","Combined results on b-hadron production rates, lifetimes, oscillations
  and semileptonic decays","63 pages",,,"SLAC-PUB-8492, CERN-EP-2000-096","hep-ex hep-ph",,"  Combined results on b-hadron lifetimes, b-hadron production rates, B^0_d -
\bar{B^0_d} and B^0_s -\bar{B^0_s} oscillations, the decay width difference
between the mass eigenstates of the B^0_s -\bar{B^0_s} system, and the values
of the CKM matrix elements | V_cb | and \Vert V_ub | are obtained from
published and preliminary measurements available in Summer 99 from the ALEPH,
CDF, DELPHI, L3, OPAL and SLD Collaborations.
","[{""version"":""v1"",""created"":""Mon, 25 Sep 2000 13:01:05 GMT""}]","2007-05-23"
"hep-ph/0009280","Gilad Perez","Gilad Perez","Lepton Masses and Mixing Angles with Spontaneously Broken O(3) Flavor
  Symmetry","8 pages, LaTeX2e, published version, typos corrected and some of the
  notations were improved","JHEP 0012 (2000) 027","10.1088/1126-6708/2000/12/027","WIS/19/00-SEPT-DPP","hep-ph",,"  We present a model based on an O(3) flavor symmetry and a minimal extension
of the scalar sector to induce hierarchical breaking, O(3) -> O(2) -> SO(2) ->
nothing. The model naturally accounts for all the known lepton parameters and
yields various interesting predictions for others: (i) Neutrinos are nearly
degenerate, m_\nu \sim 0.1 eV; (ii) The solar neutrino problem is solved by the
MSW small mixing angle solution; (iii) The MNS mixing angle theta_{13} is
unobservably small, theta_{13} = O(10^{-5}).
","[{""version"":""v1"",""created"":""Mon, 25 Sep 2000 08:18:07 GMT""},{""version"":""v2"",""created"":""Thu, 11 Jan 2001 10:05:46 GMT""}]","2009-10-31"
"hep-ph/0009281",,"Chueng-Ryong Ji (NCSU) and Ho-Meoyng Choi (CMU)","New effective treatment of the light-front nonvalence contribution in
  timelike exclusive processes","10 pages including 5 figures; Changes: 1-added some sentences;
  2-enlarged the figures; 3-added some references","Phys.Lett. B513 (2001) 330","10.1016/S0370-2693(01)00481-6",,"hep-ph",,"  We discuss a necessary nonvalence contribution in timelike exclusive
processes. Following a Schwinger-Dyson type of approach, we relate the
nonvalence contribution to an ordinary light-front wave function that has been
extensively tested in the spacelike exclusive processes. A complicate four-body
energy denominator is exactly cancelled in summing the light-front time-ordered
amplitudes. Applying our method to $K_{\ell3}$ and $D^0\to K^- \ell^+ \nu_l$
where a rather substantial nonvalence contribution is expected, we find not
only an improvement in comparing with the experimental data but also a
covariance(i.e. frame-independence) of existing light-front constituent quark
model.
","[{""version"":""v1"",""created"":""Sun, 24 Sep 2000 22:10:35 GMT""},{""version"":""v2"",""created"":""Thu, 28 Dec 2000 22:40:07 GMT""},{""version"":""v3"",""created"":""Thu, 15 Feb 2001 20:53:36 GMT""}]","2009-10-31"
"hep-ph/0009283","Roberto Florean","F. Benatti and R. Floreanini","Effective dissipative dynamics for polarized photons","15 pages, plain-TeX, no figures","Phys.Rev.D62:125009,2000","10.1103/PhysRevD.62.125009",,"hep-ph hep-th quant-ph",,"  In the framework of open quantum systems, the propagation of polarized
photons can be effectively described using quantum dynamical semigroups. These
extended time-evolutions induce irreversibility and dissipation. Planned, high
sensitive experiments, both in the laboratory and in space, will be able to put
stringent bounds on these non-standard effects.
","[{""version"":""v1"",""created"":""Mon, 25 Sep 2000 11:41:01 GMT""}]","2008-11-26"
"hep-ph/0009284","Luca Silvestrini","L. Silvestrini","epsilon'/epsilon and Rare K Decays in the Standard Model and
  Supersymmetry","6 pages, talk given at the 4th International Conference On Hyperons,
  Charm And Beauty Hadrons, 27-30 June 2000, Valencia, Spain","Nucl.Phys.Proc.Suppl. 93 (2001) 247-252","10.1016/S0920-5632(00)01112-9","ROME1-1301/00","hep-ph",,"  After briefly reviewing the status of epsilon'/epsilon in the Standard Model,
I discuss SUSY contributions to epsilon'/epsilon, K^+ to pi^+ nu bar nu, K_L to
pi^0 nu bar nu and K_L to pi^0 e^+ e^-. While in the simplest case of the MSSM
with Minimal Flavour Violation the main effect is a suppression of these
transitions with respect to the Standard Model, large enhancements are possible
in more general SUSY models, with interesting correlations among the different
processes.
","[{""version"":""v1"",""created"":""Mon, 25 Sep 2000 12:33:31 GMT""}]","2009-10-31"
"hep-ph/0009285","Andrea Barducci","A. Barducci, R. Casalbuoni, R. Gatto and G. Pettini","Chiral Meson Masses at Finite Temperature and Density","17 pages, 2 figures","Phys.Rev. D63 (2001) 074002","10.1103/PhysRevD.63.074002",,"hep-ph",,"  The ratio of the sigma mass to the pion mass at finite temperatures and
densities provides for a quantitative signal of chiral symmetry breaking. We
calculate this ratio by using an extension to finite chemical potential of the
field theoretic composite operator formalism as applied to QCD. The calculation
is limited to regions of the phase diagram where only quark-antiquark
condensates dominate (no quark-quark condensates) and it confirms the expected
behaviours. In particular the sigma becomes an essentially stable particle in a
narrow region bordering the transition line from broken to restored chirality .
This pattern is qualitatively the same both for the region where the transition
is of second order as for the region where it is of first order (apart from the
discontinuities expected in the latter case).
","[{""version"":""v1"",""created"":""Mon, 25 Sep 2000 13:19:54 GMT""}]","2009-10-31"
"hep-th/0009186","Luciano Vanzo","G. Catelani, L. Vanzo","On the sqrt{2} puzzle in AdS_2/CFT_1","6 pages, LaTeX document; typos corrected, one reference added,
  improved discussion of anomaly term and central charge",,,,"hep-th",,"  In this letter we analyze the Hamiltonian formulation of the
Jackiw-Teitelboim model of 2D gravity and calculate the central charge
associated with the asymptotic symmetries, taking care of boundary terms. For
black hole solutions, we show that there is no sqrt{2} discrepancy between the
thermodynamical entropy and the statistical one obtained via Cardy's formula.
","[{""version"":""v1"",""created"":""Mon, 25 Sep 2000 14:16:10 GMT""},{""version"":""v2"",""created"":""Thu, 28 Sep 2000 09:40:52 GMT""},{""version"":""v3"",""created"":""Tue, 7 Nov 2000 14:21:52 GMT""}]","2007-05-23"
"hep-th/0009189","Kluson Josef","J.Kluson","D-Branes from N non-BPS D0-Branes","22 pages, corrected the third section and some typos, reference added","JHEP 0011 (2000) 016","10.1088/1126-6708/2000/11/016",,"hep-th",,"  In this paper we would like to show that from N non-BPS D0-branes in type IIB
theory we can obtain all BPS and non-BPS D-branes through the tachyon
condensation in the large N limit.
","[{""version"":""v1"",""created"":""Mon, 25 Sep 2000 04:28:07 GMT""},{""version"":""v2"",""created"":""Mon, 2 Oct 2000 04:08:01 GMT""}]","2009-10-31"
"hep-th/0009190","Akira Kokado","Akira Kokado, Gaku Konisi and Takesi Saito","Constrained Quantization of Charged Strings in Background B Field and
  g-Factors","21 pages, no figures, LaTeX","Prog.Theor.Phys.104:1289-1308,2000","10.1143/PTP.104.1289",,"hep-th",,"  The Dirac quantization is performed for the constrained system of the open
string with different charges located at both ends in the constant background B
field. Noncommutativity reveals to commutators [X, X], [P, P] and also [X,P] at
both ends of the string. We consider a dependence on the change of the
""cyclotron frequency"" of the charged string. The g-factor of the charged string
is also calculated in the framework of our formulation.
","[{""version"":""v1"",""created"":""Mon, 25 Sep 2000 12:19:47 GMT""}]","2014-11-18"
"hep-th/0009192","Silvia","S.J. Gates, Jr., M.T. Grisaru, M.E. Knutt, S. Penati, H. Suzuki","Supersymmetric Gauge Anomaly with General Homotopic Paths","36 pages, plain Latex, no figures","Nucl.Phys. B596 (2001) 315-347","10.1016/S0550-3213(00)00676-3","Bicocca-FT-00-13, BRX TH-479, IU-MSTP/41, McGill 00-28, UMDEPP
  01-098","hep-th",,"  We use the method of Banerjee, Banerjee and Mitra and minimal homotopy paths
to compute the consistent gauge anomaly for several superspace models of SSYM
coupled to matter. We review the derivation of the anomaly for N=1 in four
dimensions and then discuss the anomaly for two-dimensional models with (2,0)
supersymmetry.
","[{""version"":""v1"",""created"":""Mon, 25 Sep 2000 15:22:41 GMT""}]","2012-08-27"
"hep-th/0009193","Jan Plefka","Jan Plefka","Vertex Operators for the Supermembrane and Background Field Matrix
  Theory","10 pages, Talk given at the E.S. Fradkin Memorial Conference, Moscow
  2000 and Strings 2000, University of Michigan, Ann-Arbor","Int.J.Mod.Phys. A16 (2001) 660-668","10.1142/S0217751X01003780","AEI-2000-056","hep-th",,"  We derive the vertex operators that are expected to govern the emission of
the massless d=11 supermultiplet from the supermembrane in the light cone
gauge. Our results immediately imply the linear coupling of matrix theory to an
arbitrary supergravity background to all orders in anticommuting coordinates.
Finally we address the definition of n-point tree level and one-loop scattering
amplitudes. The resulting 3-point tree level amplitudes turn out to agree with
d=11 supergravity and are completely fixed by supersymmetry and the existence
of a normalizable ground state.
","[{""version"":""v1"",""created"":""Mon, 25 Sep 2000 15:58:25 GMT""}]","2016-12-21"
"math/0009211","Vladislav Goldberg","Maks A. Akivis, Vladislav V. Goldberg","An affine analogue of the Hartman-Nirenberg cylinder theorem","AMS-LaTeX, 9 pages; revised version (the main theorem refined, and
  its conditions are given in terms of the second fundamental form of a variety
  in question)","Math. Ann., 322 (2002) no. 3 573-582",,,"math.DG",,"  Let X be a smooth, complete, connected submanifold of dimension n < N in a
complex affine space A^N (C), and r is the rank of its Gauss map \gamma, \gamma
(x) = T_x (X). The authors prove that if 2 \leq r \leq n - 1, N - n \geq 2, and
in the pencil of the second fundamental forms of X, there are two forms
defining a regular pencil all eigenvalues of which are distinct, then the
submanifold X is a cylinder with (n-r)-dimensional plane generators erected
over a smooth, complete, connected submanifold Y of rank r and dimension r.
This result is an affine analogue of the Hartman-Nirenberg cylinder theorem
proved for X \subset R^{n+1} and r = 1. For n \geq 4 and r = n - 1, there exist
complete connected submanifolds X \subset A^N (C) that are not cylinders.
","[{""version"":""v1"",""created"":""Sun, 24 Sep 2000 23:44:45 GMT""},{""version"":""v2"",""created"":""Sun, 22 Apr 2001 13:18:27 GMT""},{""version"":""v3"",""created"":""Wed, 30 May 2001 12:31:40 GMT""}]","2007-05-23"
"math/0009212","Yoshio Uwano","Yoshio Uwano","The inverse problem of the Birkhoff-Gustavson normalization and ANFER,
  Algorithm of Normal Form Expansion and Restoration","LaTeX2.09, 19 pages",,,"formerly math.SC/0009212","math.NA",,"  In the series of papers [1-4], the inverse problem of the Birkhoff-Gustavson
normalization was posed and studied. To solve the inverse problem, the
symbolic-computing program named ANFER (Algorithm of Normal Form Expansion and
Restoration) is written up, with which a new aspect of the Bertrand and Darboux
integrability condition is found \cite{Uwano2000}. In this paper, the procedure
in ANFER is presented in mathematical terminology, which is organized on the
basis of the composition of canonical transformations.
","[{""version"":""v1"",""created"":""Mon, 25 Sep 2000 05:40:28 GMT""}]","2007-05-23"
"math/0009213","Rachel Taillefer","Rachel Taillefer","Cyclic homology of Hopf algebras","16 pages, 1 figure",,,,"math.QA",,"  A cyclic cohomology theory adapted to Hopf algebras has been introduced
recently by Connes and Moscovici. In this paper, we consider this object in the
homological framework, in the spirit of Loday-Quillen and Karoubi's work on the
cyclic homology of associative algebras. In the case of group algebras, we
interpret the decomposition of the classical cyclic homology of a group algebra
in terms of this homology. We also compute both cyclic homologies for truncated
quiver algebras.
","[{""version"":""v1"",""created"":""Mon, 25 Sep 2000 07:05:57 GMT""},{""version"":""v2"",""created"":""Thu, 13 Sep 2001 14:03:14 GMT""}]","2007-05-23"
"math/0009214","Rachel Taillefer","Rachel Taillefer","Cyclic homology of the Taft algebras and of their Auslander algebras","11 pages, 3 figures",,,,"math.QA",,"  In this paper, we compute the cyclic homology of the Taft algebras and of
their Auslander algebras. Given a Hopf algebra $\Lambda,$ the Grothendieck
groups of projective $\Lambda -$modules and of all $\Lambda -$modules are
endowed with a ring structure, which in the case of the Taft algebras is
commutative (\cite{C2}, \cite{G}). We also describe the first Chern character
for these algebras.
","[{""version"":""v1"",""created"":""Mon, 25 Sep 2000 07:25:11 GMT""}]","2007-05-23"
"math/0009215","Witold Jarnicki","Witold Jarnicki","Kobayashi-Royden vs. Hahn pseudometric in ${\Bbb C}^2$","5 pages","Ann. Polon. Math. 75 (2000), 289-294.",,,"math.CV",,"  For a domain $D\subset{\Bbb C}$ the Kobayashi--Royden $\kappa$ and Hahn $h$
pseudometrics are equal iff $D$ is simply connected. Overholt showed that for
$D\subset{\Bbb C}^n$, $n\geq3$, we have $h_D\equiv\kappa_D$. Let
$D_1,D_2\subset{\Bbb C}$. The aim of this paper is to show that $h_{D_1\times
D_2}\equiv\kappa_{D_1\times D_2}$ iff at least one of $D_1$, $D_2$ is simply
connected or biholomorphic to ${\Bbb C}\setminus\{0\}$. In particular, there
are domains $D\subset{\Bbb C}^2$ for which $h_D\not\equiv\kappa_D$.
","[{""version"":""v1"",""created"":""Mon, 25 Sep 2000 09:08:18 GMT""},{""version"":""v2"",""created"":""Tue, 24 Oct 2000 08:14:50 GMT""}]","2007-05-23"
"math/0009216","Simon A. King","Simon A. King","How to make a triangulation of S^3 polytopal","24 pages, 17 figures. Final version","Trans. AMS. 356 (2004), 4519--4542",,,"math.GT",,"  We introduce a numerical isomorphism invariant p(T) for any triangulation T
of S^3. Although its definition is purely topological (inspired by the bridge
number of knots), p(T) reflects the geometric properties of T.
  Specifically, if T is polytopal or shellable then p(T) is `small' in the
sense that we obtain a linear upper bound for p(T) in the number n=n(T) of
tetrahedra of T.
  Conversely, if p(T) is `small' then T is `almost' polytopal, since we show
how to transform T into a polytopal triangulation by O((p(T))^2) local
subdivisions. The minimal number of local subdivisions needed to transform T
into a polytopal triangulation is at least $\frac{p(T)}{3n}-n-2$.
  Using our previous results [math.GT/0007032], we obtain a general upper bound
for p(T) exponential in n^2. We prove here by explicit constructions that there
is no general subexponential upper bound for p(T) in n. Thus, we obtain
triangulations that are `very far' from being polytopal.
  Our results yield a recognition algorithm for S^3 that is conceptually
simpler, though somewhat slower, as the famous Rubinstein-Thompson algorithm.
","[{""version"":""v1"",""created"":""Mon, 25 Sep 2000 10:03:56 GMT""},{""version"":""v2"",""created"":""Tue, 27 Nov 2001 14:21:15 GMT""},{""version"":""v3"",""created"":""Thu, 19 Dec 2002 13:14:24 GMT""},{""version"":""v4"",""created"":""Tue, 17 Aug 2004 14:50:57 GMT""}]","2016-09-07"
"math/0009217","Alexei Tsygvintsev","Alexei Tsygvintsev","The meromorphic non-integrability of the planar three-body problem","4 pages, French","C.R. Acad. Sci. Paris, t. 331, Serie I, p. 241-244","10.1016/S0764-4442(00)01623-2",,"math.DS",,"  We study the planar three-body problem and prove the absence of a complete
set of complex meromorphic first integrals in a neighborhood of the Lagrangian
solution.
","[{""version"":""v1"",""created"":""Mon, 25 Sep 2000 10:14:37 GMT""},{""version"":""v2"",""created"":""Tue, 26 Sep 2000 09:46:51 GMT""}]","2015-06-26"
