"astro-ph/0005242","Carolin Crawford","C. S. Crawford, A. C. Fabian, P. Gandhi, R. J. Wilman and R. M.
  Johnstone","Infrared observations of serendipitous hard Chandra X-ray sources","Submitted to MNRAS. 15 pages, 10 figures (2 of which are included as
  separate files)","Mon.Not.Roy.Astron.Soc.324:427,2001","10.1046/j.1365-8711.2001.04335.x",,"astro-ph",,"  We present observations of a sample of optically-faint, hard X-ray sources of
the kind likely to be responsible for much of the hard X-ray background. We
confirm that such sources are easily detected in the near-infrared, and find
that they have a featureless continuum suggesting that the active nucleus is
heavily obscured. The infrared colours of the majority of the targets observed
are consistent with absorbed elliptical host galaxies at z=1-2. It is likely
that we are observing some of the brighter members of the important new class
of X-ray Type II quasars.
","[{""version"":""v1"",""created"":""Thu, 11 May 2000 09:54:39 GMT""}]","2009-09-17"
"astro-ph/0005243","Bruce Elmegreen","D.M. Elmegreen (1), B.G. Elmegreen (2), F.R. Chromey (1), M.S.
  Fine(1,3)((1)Vassar College, (2) IBM Watson Research Center, (3) Colgate
  University)","Dust Streamers in the Virgo Galaxy M86 from Ram Pressure Stripping of
  its Companion VCC 882","22 pages, 7 figures, Astronomical Journal, August 2000, in press",,"10.1086/301469",,"astro-ph",,"  The giant elliptical galaxy M86 in Virgo has a ~28 kpc long dust trail inside
its optical halo that points toward the nucleated dwarf elliptical galaxy, VCC
882. The trail seems to be stripped material from the dwarf. Extinction
measurements suggest that the ratio of the total gas mass in the trail to the
blue luminosity of the dwarf is about unity, which is comparable to such ratios
in dwarf irregular galaxies. The ram pressure experienced by the dwarf galaxy
in the hot gaseous halo of M86 was comparable to the internal gravitational
binding energy density of the presumed former gas disk in VCC 882. Published
numerical models of this case are consistent with the overall trail-like
morphology observed here. Three concentrations in the trail may be evidence for
the predicted periodicity of the mass loss. The evaporation time of the trail
is comparable to the trail age obtained from the relative speed of the galaxies
and the trail length. Thus the trail could be continuously formed from stripped
replenished gas if the VCC 882 orbit is bound. However, the high gas mass and
the low expected replenishment rate suggest that this is only the first
stripping event. Implications for the origin of nucleated dwarf ellipticals are
briefly discussed.
","[{""version"":""v1"",""created"":""Thu, 11 May 2000 12:39:44 GMT""}]","2009-10-31"
"astro-ph/0005244","Rosalba Perna","Rosalba Perna and Tiziana Di Matteo (Harvard-Smithsonian Center for
  Astrophysics)","Synchrotron Emission from Hot Accretion Flows and the Cosmic Microwave
  Background Anisotropy","10 pages, 4 figures, accepted for publication in ApJ",,"10.1086/309544",,"astro-ph",,"  Current estimates of number counts of radio sources in the frequency range
where the most sensitive Cosmic Microwave Background (CMB) experiments are
carried out significantly under-represent sources with strongly inverted
spectra. Hot accretion flows around supermassive black holes in the nuclei of
nearby galaxies are expected to produce inverted radio spectra by thermal
synchrotron emission. We calculate the temperature fluctuations and power
spectra of these sources in the Planck Surveyor 30 GHz energy channel, where
their emission is expected to peak. We find that their potential contribution
is generally comparable to the instrumental noise, and approaches the CMB
anisotropy level at small angular scales. Forthcoming CMB missions, which will
provide a large statistical sample of inverted-spectra sources, will be crucial
for determining the distribution of hot accretion flows in nearby quiescent
galactic nuclei. Detection of these sources in different frequency channels
will help constrain their spectral characteristics, hence their physical
properties.
","[{""version"":""v1"",""created"":""Thu, 11 May 2000 13:52:23 GMT""}]","2009-10-31"
"astro-ph/0005245","Simon Portegies Zwart","Edward P.J. van den Heuvel (Amsterdam), Simon F. Portegies Zwart (BU),
  Dipankar Bhattacharya (Bangalore), Lex Kaper (Amsterdam)","On the origin of the difference between the runaway velocities of the
  OB-supergiant X-ray Binaries and the Be/X-ray Binaries","reduced abstract, 13 pages, accepted by A&A",,,,"astro-ph",,"  The recent finding by Chevalier & Ilovaisky (1998) that OB-supergiant X-ray
binaries have relatively large runaway velocities whereas Be/X-ray binaries
have low runaway velocities, provides confirmation of the current models for
the formation of these two types of systems. These predict a difference in
runaway velocity of an order of magnitude. This difference basically results
from the variation of the fractional helium core mass as a function of stellar
mass, in combination with the conservation of orbital angular momentum during
the mass transfer phase that preceded the formation of the compact object in
the system. This combination results into: (i) Systematically narrower
pre-supernova orbits in the OB-supergiant systems than in the Be-systems, and
(ii) A larger fractional amount of mass ejected in the supernovae in high-mass
systems relative to systems of lower mass. Regardless of possible kick
velocities imparted to neutron stars at birth, this combination leads to a
considerable difference in average runaway velocity between these two groups.
The observed low runaway velocities of the Be/X-ray binaries confirm that in
most cases not more than 1 to 2Msun was ejected in the supernovae that produced
their neutron stars. This, in combination with the --on average-- large orbital
eccentricities of these systems, indicates that their neutron stars must have
received a velocity kick in the range 60 - 250 km/s at birth.
","[{""version"":""v1"",""created"":""Thu, 11 May 2000 14:47:07 GMT""}]","2007-05-23"
"astro-ph/0005246","Michael L. Norman","Michael L. Norman, Tom Abel, and Greg Bryan","First Structure Formation and the First Stars","11 pages, 4 figures (see
  http://logy.harvard.edu/tabel/Homepage/trans.html for color postscripts of
  Fig. 3.) to appear in ""The First Stars"", Eds. A. Weiss, T. Abel & V. Hill,
  Proceedings of the MPA/ESO Workshop, Garching, Germany 4-6 August 1999,
  (Springer Verlag, Heidelberg)",,"10.1007/10719504_46",,"astro-ph",,"  We discuss the results of recent 3D simulations of first structure formation
in relationship to the formation of the first stars. On the basis of a new,
high-resolution AMR simulation (spatial dynamic range = 30,000,000), we
conclude that the first stars are likely to be massive.
","[{""version"":""v1"",""created"":""Thu, 11 May 2000 15:05:39 GMT""}]","2009-10-31"
"astro-ph/0005247","Wei Zheng","W. Zheng, Z. I. Tsvetanov, D. P. Schneider, X. Fan, R. H. Becker, M.
  Davis, R. L. White, M. A. Strauss, J. Annis, N. A. Bahcall, A. J. Connolly,
  I. Csabai, A. F. Davidsen, M. Fukugita, J. E. Gunn, T. M. Heckman, G. S.
  Hennessy, Z. Ivezic, G. R. Knapp, E. Peng, A. S. Szalay, A. R. Thakar, B.
  Yanny, and D. G. York","Five High-Redshift Quasars Discovered in Commissioning Imaging Data of
  the Sloan Digital Sky Survey","13 pages in LaTex format, two postscirpt figures. Submitted to the
  Astronomical Journal","Astron.J. 120 (2000) 1607","10.1086/301570",,"astro-ph",,"  We report the discovery of five quasars with redshifts of 4.67 - 5.27 and
z'-band magnitudes of 19.5-20.7 M_B ~ -27. All were originally selected as
distant quasar candidates in optical/near-infrared photometry from the Sloan
Digital Sky Survey (SDSS), and most were confirmed as probable high-redshift
quasars by supplementing the SDSS data with J and K measurements. The quasars
possess strong, broad Lyman-alpha emission lines, with the characteristic sharp
cutoff on the blue side produced by Lyman-alpha forest absorption. Three
quasars contain strong, broad absorption features, and one of them exhibits
very strong N V emission. The amount of absorption produced by the Lyman-alpha
forest increases toward higher redshift, and that in the z=5.27 object (D_A ~
0.7) is consistent with a smooth extrapolation of the absorption seen in lower
redshift quasars. The high luminosity of these objects relative to most other
known objects at z >~ 5 makes them potentially valuable as probes of early
quasar properties and of the intervening intergalactic medium.
","[{""version"":""v1"",""created"":""Thu, 11 May 2000 15:18:24 GMT""}]","2009-10-31"
"astro-ph/0005248","Simon Portegies Zwart","Simon F. Portegies Zwart (BU), Stephen L. W. McMillan (Drexel), Piet
  Hut (IAS), Junichiro Makino (Tokyo)","Star cluster ecology IVa: Dissection of an open star
  cluster---photometry","reduced abstract, 33 pages (three separate color .jpg figures),
  submitted to MNRAS","Mon.Not.Roy.Astron.Soc. 321 (2001) 199","10.1046/j.1365-8711.2001.03976.x",,"astro-ph",,"  The evolution of star clusters is studied using N-body simulations in which
the evolution of single stars and binaries are taken self-consistently into
account. Initial conditions are chosen to represent relatively young Galactic
open clusters, such as the Pleiades, Praesepe and the Hyades. The calculations
include a realistic mass function, primordial binaries and the external
potential of the parent Galaxy. Our model clusters are generally significantly
flattened in the Galactic tidal field, and dissolve before deep core collapse
occurs. The binary fraction decreases initially due to the destruction of soft
binaries, but increases later because lower mass single stars escape more
easily than the more massive binaries. At late times, the cluster core is quite
rich in giants and white dwarfs. There is no evidence for preferential
evaporation of old white dwarfs, on the contrary the formed white dwarfs are
likely to remain in the cluster. Stars tend to escape from the cluster through
the first and second Lagrange points, in the direction of and away from the
Galactic center. Mass segregation manifests itself in our models well within an
initial relaxation time. As expected, giants and white dwarfs are much more
strongly affected by mass segregation than main-sequence stars. Open clusters
are dynamically rather inactive. However, the combined effect of stellar mass
loss and evaporation of stars from the cluster potential drives its dissolution
on a much shorter timescale than if these effects are neglected. The often-used
argument that a star cluster is barely older than its relaxation time and
therefore cannot be dynamically evolved is clearly in error for the majority of
star clusters.
","[{""version"":""v1"",""created"":""Thu, 11 May 2000 15:19:13 GMT""}]","2015-06-24"
"astro-ph/0005249","Jesper Sommer-Larsen","Thommy I. Larsen, Jesper Sommer-Larsen & Bernard E.J. Pagel","The chemical evolution of gas-rich dwarf galaxies","22 pages, 25 figures, MNRAS LaTeX format","Mon.Not.Roy.Astron.Soc. 323 (2001) 555","10.1046/j.1365-8711.2001.04142.x",,"astro-ph",,"  A numerical double burst model of the chemical evolution of gas-rich dwarf
galaxies has been developed. The model is fitted to a sample of N/O, O/H, Y and
gas fraction observations, where N/O and O/H are the relative abundances by
number of nitrogen to oxygen and oxygen to hydrogen, respectively. Y is the
abundance by mass of helium. Closed models as well as models including enriched
outflow, ordinary outflow and ordinary outflow combined with inflow are
considered.The bursts are assumed to be instantaneous but ordered in pairs to
explain the scatter in N/O-O/H. The method of gas fraction fitting is revised,
and it is found that it is very important to specify whether dwarf irregulars
(dIrrs) or blue compact galaxies (BCGs) are considered. Effective enriched
winds fail when fitting N/O, whereas closed models, models with ordinary winds
or a combination of ordinary winds and inflow are all viable.
","[{""version"":""v1"",""created"":""Thu, 11 May 2000 15:26:22 GMT""}]","2015-06-24"
"cond-mat/0005166","Ujsaghy Orsolya","O. \'Ujs\'aghy, J. Kroha, L. Szunyogh, and A. Zawadowski","Theory of the Fano Resonance in the STM Tunneling Density of States due
  to a Single Kondo Impurity","4 pages, ReVTeX + 4 figures (Encapsulated Postscript), submitted to
  PRL","Phys. Rev. Lett. 85, 2557 (2000)","10.1103/PhysRevLett.85.2557",,"cond-mat.str-el",,"  The conduction electron density of states nearby single magnetic impurities,
as measured recently by scanning tunneling microscopy (STM), is calculated,
taking into account tunneling into conduction electron states only. The Kondo
effect induces a narrow Fano resonance in the conduction electron density of
states, while scattering off the d-level generates a weakly energy dependent
Friedel oscillation. The line shape varies with the distance between STM tip
and impurity, in qualitative agreement with experiments, but is very sensitive
to details of the band structure. For a Co impurity the experimentally observed
width and shift of the Kondo resonance are in accordance with those obtained
from a combination of band structure and strongly correlated calculations.
","[{""version"":""v1"",""created"":""Wed, 10 May 2000 20:03:49 GMT""}]","2009-10-31"
"cond-mat/0005180",,"A. J. Bray and S. J. O'Donoghue","Unusual Dynamical Scaling in the Spatial Distribution of Persistent
  Sites in 1D Potts Models","RevTex, 11 pages","Phys. Rev. E 62, 3366 (2000)","10.1103/PhysRevE.62.3366",,"cond-mat.stat-mech",,"  The distribution, n(k,t), of the interval sizes, k, between clusters of
persistent sites in the dynamical evolution of the one-dimensional q-state
Potts model is studied using a combination of numerical simulations, scaling
arguments, and exact analysis. It is shown to have the scaling form n(k,t) =
t^{-2z} f(k/t^z), with z= max(1/2,theta), where theta(q) is the persistence
exponent which characterizes the fraction of sites which have not changed their
state up to time t. When theta > 1/2, the scaling length, t^theta, for the
interval-size distribution is larger than the coarsening length scale, t^{1/2},
that characterizes spatial correlations of the Potts variables.
","[{""version"":""v1"",""created"":""Wed, 10 May 2000 18:02:44 GMT""}]","2009-10-31"
"cond-mat/0005181","Dror Orgad","D. Orgad","Spectral Functions for the Tomonaga-Luttinger and Luther-Emery Liquids","Published version","Philos. Mag. B 81, 375 (2001)","10.1080/136428100110036680",,"cond-mat.str-el",,"  We calculate the finite temperature single hole spectral function and the
spin dynamic structure factor of spinfull one-dimensional Tomonaga-Luttinger
liquid. Analytical expressions are obtained for a number of special cases. We
also calculate the single hole spectral function of a spin gapped Luther-Emery
liquid and obtain exact results at the free fermion point K_s=1/2. These
results may be applied to the analysis of angle resolved photoemission and
neutron scattering experiments on quasi-one-dimensional materials.
","[{""version"":""v1"",""created"":""Wed, 10 May 2000 19:29:37 GMT""},{""version"":""v2"",""created"":""Sun, 6 May 2001 19:52:05 GMT""}]","2009-10-31"
"cond-mat/0005182","Hans Fogedby","Hans C. Fogedby","Dynamical pinning and non-Hermitian mode transmutation in the Burgers
  equation","4 pages, Revtex file, 2 figures, submitted to Phys. Rev. Lett","Eur. Phys. J. B 20, 153 (2001)","10.1007/PL00011097",,"cond-mat.stat-mech cond-mat.soft nlin.PS",,"  We discuss the mode spectrum in both the deterministic and noisy Burgers
equations in one dimension. Similar to recent investigations of vortex
depinning in superconductors, the spectrum is given by a non-Hermitian
eigenvalue problem which is related to a `quantum' problem by a complex gauge
transformation. The soliton profile in the Burgers equation serves as a complex
gauge field engendering a {\em mode transmutation} of diffusive modes into
propagating modes and giving rise to a {\em dynamical pinning} of localized
modes about the solitons.
","[{""version"":""v1"",""created"":""Wed, 10 May 2000 20:03:17 GMT""}]","2014-10-07"
"cond-mat/0005183","Zhen Ye","Zhen Ye and Emile Hoskinson","Band Gaps and Localization in Acoustic Propagation in Water with
  Air-cylinders","10 pages, 4 figures","Appl. Phys. Lett. 77, 4428-4430 (2000)","10.1063/1.1334941",,"cond-mat.dis-nn cond-mat.soft",,"  Multiple scattering of waves leads to many peculiar phenomena such as
complete band gaps in periodic structures and wave localization in disordered
media. Within a band gap excitations are evanescent; when localized they remain
confined in space until dissipated. Here we report acoustic band gap and
localization in a 2D system of air-cylinders in water. Exact numerical
calculations reveal the unexpected result that localization is relatively
independent of the precise location or organization of the scatterers.
Localization occurs within a finite region of frequencies, coincident with the
complete band gap predicted by a conventional band structure calculation for a
periodic lattice of scatterers. Inside the gap or localization regime, a
previously uninvestigated stable collective behavior of the cylinders appears.
","[{""version"":""v1"",""created"":""Thu, 11 May 2000 01:55:49 GMT""}]","2009-10-31"
"cond-mat/0005185","Donald J. Priour","D. J. Priour Jr (1), M. P. Gelfand (2), and S. L. Sondhi (1) ((1)
  Princeton, (2) Colorado State University, Fort Collins)","Disorder from Disorder in a Strongly Frustrated Transverse Field Ising
  Chain","8 pages, RevTex, 7 Figures",,"10.1103/PhysRevB.64.134424",,"cond-mat.stat-mech cond-mat.dis-nn",,"  We study a one-dimensional chain of corner-sharing triangles with
antiferromagnetic Ising interactions along its bonds. Classically, this system
is highly frustrated with an extensive entropy at T = 0 and exponentially
decaying spin correlations. We show that the introduction of a quantum
dynmamics via a transverse magnetic field removes the entropy and opens a gap,
but leaves the ground state disordered at all values of the transverse field,
thereby providing an analog of the ""disorder by disorder"" scenario first
proposed by Anderson and Fazekas in their search for resonating valence bond
states. Our conclusion relies on exact diagonalization calculations as well as
on the analysis of a 14th order series expansion about the large transverse
field limit. This test suggests that the series method could be used to search
for other instances of quantum disordered states in frustrated transverse field
magnets in higher dimensions.
","[{""version"":""v1"",""created"":""Thu, 11 May 2000 04:41:59 GMT""}]","2009-10-31"
"cond-mat/0005186","V. K. Jindal","K. Dharamvir, Shuchi, V.K. Jindal","Dynamics of a Bunch of Carbon Nano-tubes","Reported in National Seminar on Materials Science: Trends & Future
  (MSTF-2000), To appear in Ind. J. Engg. & Mat. Sc",,,,"cond-mat.mtrl-sci",,"  Nano-diameter tubules made of folded graphitic sheets have drawn the
attention of physicists ever since the advent of fullerene research. These are
interesting because of their conductivity (depends upon chirality) as well as
their mechanical properties. Bunches of such tubes, single-walled and each of
same diameter (~14A), have been produced in the laboratory. In this work we
explore the mechanical properties of the bunch (hexagonal packing), having
assumed, for simplicity, uniform continuous distribution of carbon atoms on
each tube. The atom-atom potential (6-exp) is of Kitaigorodsky type where only
inter-tube interactions are considered. Intra-tube interactions are not
considered (implying a rigid tube model). This approximation works very well
for pure C60 solid. We find that the range of external modes is not well
separated from the radial mode frequency of the single tube as indicated by
measured data. Therefore interpretation of experimentally observed frequencies
needs to be done in terms of total modes of the bunch, including internal as
well as external modes. We have also studied pressure dependent deformations of
such a bunch which is found to be very interesting and is likely to provide
information about their mechanical strength.
","[{""version"":""v1"",""created"":""Thu, 11 May 2000 07:34:45 GMT""}]","2007-05-23"
"cond-mat/0005187","Jean-Philippe Bouchaud","Irene Giardina, Jean-Philippe Bouchaud and Marc Mezard (CEA-Saclay and
  LPTMS Orsay)","Population dynamics in a random environment","4 pages, 4 .eps figures. Submitted to Physical Review Letters
  Corrected sign in flow equation, one figure changed, abstract changed. S",,,,"cond-mat",,"  We investigate the competition between barrier slowing down and proliferation
induced superdiffusion in a model of population dynamics in a random force
field. Numerical results in $d=1$ suggest that a new intermediate diffusion
behaviour appears. We introduce the idea of proliferation assisted barrier
crossing and give a Flory like argument to understand qualitatively this non
trivial diffusive behaviour. A one loop RG analysis close to the critical
dimension d_c=2 confirms that the random force fixed point is unstable and
flows towards an uncontrolled strong coupling regime.
","[{""version"":""v1"",""created"":""Thu, 11 May 2000 08:19:35 GMT""},{""version"":""v2"",""created"":""Wed, 12 Jul 2000 18:09:29 GMT""}]","2007-05-23"
"cond-mat/0005188","Wolfgang Belzig","W. Belzig, Arne Brataas, Yu. V. Nazarov, and Gerrit E.W. Bauer","Spin-accumulation and Andreev-reflection in a mesoscopic ferromagnetic
  wire","15 pages, 12 figures included, submitted to PRB","Phys. Rev. B 62, 9726 (2000).","10.1103/PhysRevB.62.9726",,"cond-mat.supr-con",,"  The electron transport though ferromagnetic metal-superconducting hybrid
devices is considered in the non-equilibrium Green's function formalism in the
quasiclassical approximation. Attention if focused on the limit in which the
exchange splitting in the ferromagnet is much larger than the superconducting
energy gap. Transport properties are then governed by an interplay between
spin-accumulation close to the interface and Andreev reflection at the
interface. We find that the resistance can either be enhanced or lowered in
comparison to the normal case and can have a non-monotonic temperature and
voltage dependence. In the non-linear voltage regime electron heating effects
may govern the transport properties, leading to qualitative different behaviour
than in the absence of heating effects. Recent experimental results on the
effect of the superconductor on the conductance of the ferromagnet can be
understood by our results for the energy-dependent interface resistance
together with effects of spin- accumulation without invoking long range pairing
correlations in the ferromagnet.
","[{""version"":""v1"",""created"":""Thu, 11 May 2000 08:23:35 GMT""}]","2009-10-31"
"cond-mat/0005190","Christian Bernhard","C. Bernhard, T. Holden, A. Golnik, C.T. Lin, and M. Cardona
  (Max-Planck-Institut f\""ur Festk\""orperforschung)","Far-infrared c-axis conductivity of flux-grown
  Y$_{1-x}$Pr$_{x}$Ba$_{2}$Cu$_{3}$O$_{7}$ single crystals studied by spectral
  ellipsometry","submitted to PRB on 5.4.2000",,"10.1103/PhysRevB.62.9138",,"cond-mat.supr-con",,"  The far-infrared c-axis conductivity of flux-grown
Y$_{1-x}$Pr$_{x}$Ba$_{2}$Cu$_{3}$O$_{7}$ single crystals with 0.2$\leq $x$\leq
$0.5 has been studied by sepectral ellipsometry. We find that the c-axis
response exhibits spectral features similar to deoxygenated underdoped
YBa$_{2}$Cu$_{3}$O$_{7-\delta}$, i.e., a pseudogap develops in the normal
state, the phonon mode at 320 cm$^{-1}$ exhibits an anomalous T-dependence and
an additional absorption peak forms at T. This suggests that the T$_{c}$
suppression in flux grown Pr-substituted crystals is caused by a decrease of
the hole content and/or by carrier localization rather than by pair breaking.
","[{""version"":""v1"",""created"":""Thu, 11 May 2000 12:11:59 GMT""}]","2009-10-31"
"cond-mat/0005191","Marcus Mueller","L. Gonz\'alez MacDowell (1), M. Mueller (2), C. Vega (1), K. Binder
  (2) ((1) Dpto. de Qu\'imica F\'isica, Universidad Complutense, Madrid, Spain
  (2) J. Gutenberg Universitaet, Mainz, Germany)","Equation of state and critical behavior of polymer models: A
  quantitative comparison between Wertheim's thermodynamic perturbation theory
  and computer simulations","to appear in J.Chem.Phys",,"10.1063/1.481807",,"cond-mat.stat-mech cond-mat.soft",,"  We present an application of Wertheim's Thermodynamic Perturbation Theory
(TPT1) to a simple coarse grained model made of flexibly bonded Lennard-Jones
monomers. We use both the Reference Hyper-Netted-Chain (RHNC) and Mean
Spherical approximation (MSA) integral equation theories to describe the
properties of the reference fluid. The equation of state, the density
dependence of the excess chemical potential, and the critical points of the
liquid--vapor transition are compared with simulation results and good
agreement is found. The RHNC version is somewhat more accurate, while the MSA
version has the advantage of being almost analytic. We analyze the scaling
behavior of the critical point of chain fluids according to TPT1 and find it to
reproduce the mean field exponents: The critical monomer density is predicted
to vanish as $n^{-1/2}$ upon increasing the chain length $n$ while the critical
temperature is predicted to reach an asymptotic finite temperature that is
attained as $n^{-1/2}$. The predicted asymptotic finite critical temperature
obtained from the RHNC and MSA versions of TPT1 is found to be in good
agreement with the $\Theta$ point of our polymer model as obtained from the
temperature dependence of the single chain conformations.
","[{""version"":""v1"",""created"":""Thu, 11 May 2000 12:16:03 GMT""}]","2016-08-15"
