"cond-mat/0005192","Roland Faller","Roland Faller and Florian Mueller-Plathe","Chain stiffness intensifies the reptation characteristics of polymer
  dynamics in the melt","10 pages revtex, 5 figures, partly color","ChemPhysChem 2(3) 180-184 (2001)",,,"cond-mat.soft cond-mat.mtrl-sci",,"  The reptation concept in polymer dynamics is studied for model chains with
added stiffness. The main idea of a chain diffusing inside a tube can be
transferred from fully flexible chains. However, the picture, which
renormalizes the chain of locally stiff Kuhn segments onto a flexible chain of
fewer segments fails. The entanglement length shrinks with increasing
persistence length. If entanglement length and persistence length come to the
same order of magnitude the picture of a tight tube is better suited, in which
chain segments can move only along the contour, any transverse motion being
much reduced. Thus, as stiffness increases, the monomers loose their freedom to
perform random walks inside the tube, the ``Rouse-like'' part of their
dynamics. As a result, for persistence lengths of more than five monomers no
length scale can be described by the Rouse model.
","[{""version"":""v1"",""created"":""Thu, 11 May 2000 12:19:34 GMT""},{""version"":""v2"",""created"":""Mon, 12 Feb 2001 17:55:37 GMT""}]","2007-05-23"
"cond-mat/0005193","Masato Kubota","M. Kubota, Y. Oohara, H. Yoshizawa, H. Fujioka, K. Shimizu, K. Hirota,
  Y. Moritomo, Y. Endoh","Influence of Quasi-Bi-Stripe Charge Order on the Resistivity and
  Magnetism in a Bilayer Manganite La$_{2-2x}$Sr$_{1+2x}$Mn$_{2}$O$_{7}$","11 pages, 5 figures",,"10.1143/JPSJ.69.1986",,"cond-mat.str-el",,"  The charge ordering in the bilayer manganite system
La$_{2-2x}$Sr$_{1+2x}$Mn$_{2}$O$_{7}$ with $0.30 \le x \le 0.50$ has been
studied by neutron diffraction. The charge order is characterized by the
propagation vector parallel to the [1 0 0] direction (MnO$_2$ direction), but
the correlation length is short-ranged and extremely anisotropic, being $\sim
0.02a^{*}$ and $\sim 0.2a^{*}$ parallel and perpendicular to the modulation
direction, respectively. The observed charge order can be viewed as a
quasi-bi-stripe order, and accounts well for the $x$ dependence of the
resistivity. The quasi-bistripe order is stable within the ferromagnetic (FM)
MnO$_2$ layers in the A-type antiferromagnetic order, but is instabilized by
the 3 dimensional FM order.
","[{""version"":""v1"",""created"":""Thu, 11 May 2000 12:48:33 GMT""}]","2009-10-31"
"cond-mat/0005194","Ayan Guha","Ayan Guha, N.Khare, A.K.Raychaudhuri and C.N.R Rao","Magnetic Field resulting from non-linear electrical transport in single
  crystals of charge-ordered Pr$_{0.63}$ Ca$_{0.37}$ MnO$_{3}$}","4 pages LateX, 4 eps figures",,"10.1103/PhysRevB.62.R11941",,"cond-mat.str-el cond-mat.mtrl-sci",,"  In this letter we report that the current induced destabilization of the
charge ordered (CO) state in a rare-earth manganite gives rise to regions with
ferromagnetic correlation. We did this experiment by measurement of the I-V
curves in single crystal of the CO system
  Pr$_{0.63}$Ca$_{0.37}$MnO$_{3}$ and simultanously measuring the magnetization
of the current carrying conductor using a high T$_c$ SQUID working at T = 77K.
We have found that the current induced destabilization of the CO state leads to
a regime of negative differential resistance which leads to a small enhancement
of the magnetization of the sample, indicating ferromagnetically aligned
moments.
","[{""version"":""v1"",""created"":""Thu, 11 May 2000 15:14:40 GMT""}]","2016-08-31"
"cond-mat/0005195","Ramin Abolfath","M. Abolfath, Kieran Mullen, and H.T.C. Stoof","Massive skyrmions in quantum Hall ferromagnets","6 pages and 2 figures","Phys.Rev.B63:075315,2001","10.1103/PhysRevB.63.075315",,"cond-mat",,"  We apply the theory of elasticity to study the effects of skyrmion mass on
lattice dynamics in quantum Hall systems. We find that massive Skyrme lattices
behave like a Wigner crystal in the presence of a uniform perpendicular
magnetic field. We make a comparison with the microscopic Hartree-Fock results
to characterize the mass of quantum Hall skyrmions at $\nu=1$ and investigate
how the low temperature phase of Skyrme lattices may be affected by the
skyrmion mass.
","[{""version"":""v1"",""created"":""Thu, 11 May 2000 15:37:08 GMT""},{""version"":""v2"",""created"":""Thu, 16 Nov 2000 21:44:20 GMT""}]","2014-10-13"
"cs/0005017","Stephan Tobies","Ian Horrock and Ulrike Sattler and Stephan Tobies","Reasoning with Individuals for the Description Logic SHIQ","To appear at CADE-17",,,,"cs.LO cs.AI",,"  While there has been a great deal of work on the development of reasoning
algorithms for expressive description logics, in most cases only Tbox reasoning
is considered. In this paper we present an algorithm for combined Tbox and Abox
reasoning in the SHIQ description logic. This algorithm is of particular
interest as it can be used to decide the problem of (database) conjunctive
query containment w.r.t. a schema. Moreover, the realisation of an efficient
implementation should be relatively straightforward as it can be based on an
existing highly optimised implementation of the Tbox algorithm in the FaCT
system.
","[{""version"":""v1"",""created"":""Thu, 11 May 2000 08:16:21 GMT""}]","2007-05-23"
"cs/0005018","Sabina Rossi","Annalisa Bossi, Nicoletta Cocco, Sandro Etalle and Sabina Rossi","On Modular Termination Proofs of General Logic Programs","29 pages. To appear in Theory and Practice of Logic Programming",,,"University of Venice Technical Report CS2000-8","cs.LO cs.PL",,"  We propose a modular method for proving termination of general logic programs
(i.e., logic programs with negation). It is based on the notion of acceptable
programs, but it allows us to prove termination in a truly modular way. We
consider programs consisting of a hierarchy of modules and supply a general
result for proving termination by dealing with each module separately. For
programs which are in a certain sense well-behaved, namely well-moded or
well-typed programs, we derive both a simple verification technique and an
iterative proof method. Some examples show how our system allows for greatly
simplified proofs.
","[{""version"":""v1"",""created"":""Thu, 11 May 2000 15:27:49 GMT""},{""version"":""v2"",""created"":""Mon, 30 Jul 2001 09:31:17 GMT""}]","2007-05-23"
"gr-qc/0005030","Theodore C. Quinn","Theodore C. Quinn","Axiomatic approach to radiation reaction of scalar point particles in
  curved spacetime","17 pages, 1 figure","Phys.Rev. D62 (2000) 064029","10.1103/PhysRevD.62.064029",,"gr-qc",,"  Several different methods have recently been proposed for calculating the
motion of a point particle coupled to a linearized gravitational field on a
curved background. These proposals are motivated by the hope that the point
particle system will accurately model certain astrophysical systems which are
promising candidates for observation by the new generation of gravitational
wave detectors. Because of its mathematical simplicity, the analogous system
consisting of a point particle coupled to a scalar field provides a useful
context in which to investigate these proposed methods. In this paper, we
generalize the axiomatic approach of Quinn and Wald in order to produce a
general expression for the self force on a point particle coupled to a scalar
field following an arbitrary trajectory on a curved background. Our equation
includes the leading order effects of the particle's own fields, commonly
referred to as ``self force'' or ``radiation reaction'' effects. We then
explore the equations of motion which follow from this expression in the
absence of non-scalar forces.
","[{""version"":""v1"",""created"":""Wed, 10 May 2000 16:16:58 GMT""}]","2009-10-31"
"gr-qc/0005031","Clarissa-Marie Claudel","Clarissa-Marie Claudel","Black holes and closed trapped surfaces: a revision of a classic theorem","15 pages, 4 figures. Uses the following packages: amsmath,amsthm,
  amssymb, amsfonts, mathrsfs, enumerate, graphicx",,,,"gr-qc",,"  It is standard assertion in relativity that, subject to an energy condition
and the cosmic censorship hypothesis, closed trapped surfaces are not visible
from future null infinity. A proof given by Hawking & Ellis in ''The Large
Scale Structure of Space-Time'' is flawed since it is formulated in terms of an
inadequate definition of a weakly asymptotically simple and empty space-time. A
new proof is given based on a more restrictive definition of a weakly
asymptotically simple and empty space-time.
","[{""version"":""v1"",""created"":""Wed, 10 May 2000 20:26:43 GMT""},{""version"":""v2"",""created"":""Fri, 7 Jul 2000 09:12:08 GMT""}]","2007-05-23"
"gr-qc/0005032","Jorge L. Cervantes-Cota","Jorge L. Cervantes-Cota and Marcos Nahmad","Isotropization of Bianchi type models and a new FRW solution in
  Brans-Dicke theory","15 pages, 4 postscript figures, to appear in Gen. Rel. Grav., special
  issue dedicated in honour of Prof. H. Dehnen","Gen.Rel.Grav. 33 (2001) 767-780","10.1023/A:1010295422047",,"gr-qc",,"  Using scaled variables we are able to integrate an equation valid for
isotropic and anisotropic Bianchi type I, V, IX models in Brans-Dicke (BD)
theory. We analyze known and new solutions for these models in relation with
the possibility that anisotropic models asymptotically isotropize, and/or
possess inflationary properties. In particular, a new solution of curve
($k\neq0$) Friedmann-Robertson-Walker (FRW) cosmologies in Brans-Dicke theory
is analyzed.
","[{""version"":""v1"",""created"":""Wed, 10 May 2000 17:10:09 GMT""}]","2015-06-25"
"gr-qc/0005033","Poghos F. Kazarian","Poghos F. Kazarian","On the Tensor Field Inflation in the GR Homogeneous Cosmological Model","Accepted for publication in Phys Rev D; referee's comments and
  suggestions considered",,,"YSU preprint 20/03/2000","gr-qc",,"  The homogeneous cosmological model in GR is proposed, where the vacuum
energy, which can cause the inflation, is described by tensor field rather than
by commonly used in inflationary scenarios scalar field. It is shown that if
the initial values of the field are sufficiently big (comparable with the
Planck units), under the condition of the tensor field's slow change in the
beginning the regime of the quasiexponential inflation can exist. Numerical
solutions for the inflationary stage are obtained that confirm the validity of
the approximate solutions. Inflation takes place under wide range of initial
conditions provided that the tensor field satisfies the condition imposed on
the initial values of the tensor field ${\phi^0}_0(0)\approx -{\phi^i}_i(0)$
(i=1,2,3). That condition also arises from the requirement to satisfy existing
observational data.
","[{""version"":""v1"",""created"":""Wed, 10 May 2000 16:57:39 GMT""},{""version"":""v2"",""created"":""Sun, 24 Dec 2000 01:11:25 GMT""},{""version"":""v3"",""created"":""Sun, 18 Feb 2001 21:30:11 GMT""}]","2007-05-23"
"gr-qc/0005034","Piotr Jaranowski","Thibault Damour, Piotr Jaranowski, and Gerhard Schaefer","On the determination of the last stable orbit for circular general
  relativistic binaries at the third post-Newtonian approximation","REVTeX, 25 pages, 3 figures, submitted to Phys. Rev. D","Phys.Rev. D62 (2000) 084011","10.1103/PhysRevD.62.084011",,"gr-qc",,"  We discuss the analytical determination of the location of the Last Stable
Orbit (LSO) in circular general relativistic orbits of two point masses. We use
several different ``resummation methods'' (including new ones) based on the
consideration of gauge-invariant functions, and compare the results they give
at the third post-Newtonian (3PN) approximation of general relativity. Our
treatment is based on the 3PN Hamiltonian of Jaranowski and Sch\""afer. One of
the new methods we introduce is based on the consideration of the (invariant)
function linking the angular momentum and the angular frequency. We also
generalize the ``effective one-body'' approach of Buonanno and Damour by
introducing a non-minimal (i.e. ``non-geodesic'') effective dynamics at the 3PN
level. We find that the location of the LSO sensitively depends on the
(currently unknown) value of the dimensionless quantity $\oms$ which
parametrizes a certain regularization ambiguity of the 3PN dynamics. We find,
however, that all the analytical methods we use numerically agree between
themselves if the value of this parameter is $\oms\simeq-9$. This suggests that
the correct value of $\oms$ is near -9 (the precise value
$\oms^*\equiv-{47/3}+{41/64}\pi^2=-9.3439...$ seems to play a special role). If
this is the case, we then show how to further improve the analytical
determination of various LSO quantities by using a ``Shanks'' transformation to
accelerate the convergence of the successive (already resummed) PN estimates.
","[{""version"":""v1"",""created"":""Wed, 10 May 2000 17:47:24 GMT""}]","2009-10-31"
"gr-qc/0005035","Gennadii Varzugin","G. G. Varzugin","The interaction force between rotating black holes at equilibrium","LaTeX, 14 pages, no figures","Theor.Math.Phys. 116 (1998) 1024",,,"gr-qc",,"  We study the previously constructed Riemann problem whose solutions
correspond to equilibrium configurations of black holes. We evaluate the metric
coefficients at the symmetry axis and the interaction force between the black
holes.
","[{""version"":""v1"",""created"":""Wed, 10 May 2000 20:50:39 GMT""}]","2007-05-23"
"gr-qc/0005036","Farhad Darabi","F. Darabi, W. N. Sajko, P. S. Wesson","Quantum cosmology of 5D non-compactified Kaluza-Klein theory","14 pages, LaTeX","Class.Quant.Grav. 17 (2000) 4357-4364","10.1088/0264-9381/17/21/301",,"gr-qc",,"  We study the quantum cosmology of a five dimensional non-compactified
Kaluza-Klein theory where the 4D metric depends on the fifth coordinate,
$x^4\equiv l$. This model is effectively equivalent to a 4D non-minimally
coupled dilaton field in addition to matter generated on hypersurfaces
l=constant by the extra coordinate dependence in the four-dimensional metric.
We show that the Vilenkin wave function of the universe is more convenient for
this model as it predicts a new-born 4D universe on the $l\simeq0$ constant
hypersurface.
","[{""version"":""v1"",""created"":""Wed, 10 May 2000 23:28:20 GMT""}]","2009-10-31"
"gr-qc/0005037","Hiroshi Umetsu","Hiroshi Umetsu","A Conserved Energy Integral for Perturbation Equations in the Kerr-de
  Sitter Geometry","13 pages, LaTeX","Prog.Theor.Phys. 104 (2000) 743-755","10.1143/PTP.104.743","EPHOU 00-004","gr-qc",,"  The analytic proof of mode stability of the Kerr black hole was provided by
Whiting. In his proof, the construction of a conserved quantity for unstable
mode was crucial. We extend the method of the analysis for the Kerr-de Sitter
geometry. The perturbation equations of massless fields in the Kerr-de Sitter
geometry can be transformed into Heun's equations which have four regular
singularities. In this paper we investigate differential and integral
transformations of solutions of the equations. Using those we construct a
conserved quantity for unstable modes in the Kerr-de Sitter geometry, and
discuss its property.
","[{""version"":""v1"",""created"":""Thu, 11 May 2000 05:46:46 GMT""}]","2009-10-31"
"gr-qc/0005038","Dirk Puetzfeld","Alberto Garcia, Alfredo Macias, Dirk Puetzfeld, Jose Socorro","Plane-fronted waves in metric-affine gravity","14 pages, submitted to Phys. Rev. D","Phys.Rev. D62 (2000) 044021","10.1103/PhysRevD.62.044021",,"gr-qc",,"  We study plane-fronted electrovacuum waves in metric-affine gravity theories
(MAG) with cosmological constant. Their field strengths are, on the
gravitational side, curvature $R_{\alpha}{}^{\beta}$, nonmetricity
$Q_{\alpha\beta}$, torsion $T^{\alpha}$ and, on the matter side, the
electromagnetic field strength $F$. Our starting point is the work by
Ozsv\'ath, Robinson, and R\'ozga on type N gravitational fields in general
relativity as coupled to null electromagnetic fields.
","[{""version"":""v1"",""created"":""Thu, 11 May 2000 10:00:11 GMT""}]","2009-04-03"
"gr-qc/0005039","Murat Ozer","M. \""Ozer and M. O. Taha","On Proper Time in General Relativity","This paper was written in a rush when M. O. Taha was very sick.
  Proper Time was defined erroneously in the original submission. The revised
  version does not have anything new and the paper is to be withdrawn",,,,"gr-qc",,"  It is shown how the relation $ds=cd\tau$ between the proper distance $s$ and
the proper time $\tau$ is obtained in general relativity. A general relation in
curved spacetime between $d\tau$ and $dt$ is given. This relation reduces to
the special relativistic one for flat spacetime.
","[{""version"":""v1"",""created"":""Thu, 11 May 2000 14:53:03 GMT""},{""version"":""v2"",""created"":""Fri, 9 Mar 2001 21:25:06 GMT""},{""version"":""v3"",""created"":""Wed, 29 May 2002 00:11:37 GMT""},{""version"":""v4"",""created"":""Mon, 9 Dec 2019 14:29:54 GMT""}]","2019-12-10"
"gr-qc/0005040","Martin Tajmar","C.J. de Matos, M. Tajmar","Advance of Mercury Perihelion Explained by Cogravity","13 pages",,"10.1142/9789812810021_0036",,"gr-qc",,"  The theory of General Relativity explaines the advance of Mercury perihelion
using space curvature and the Schwartzschild metric. We demonstrate that this
phenomena can also be interpreted due to the cogravitational field produced by
the apparent motion of the Sun around Mercury giving exactly the same estimate
as derived from the Schwartzschild metric in general relativity theory. This is
a surprising result because the estimate from both theoretical approaches match
exactly the measured value. The discussion and implications of this result is
out of the scope of the present work.
","[{""version"":""v1"",""created"":""Thu, 11 May 2000 15:34:49 GMT""}]","2017-08-23"
"hep-ex/0005017","Vladimir N. Ivanchenko","M.N.Achasov, S.E.Baru, K.I.Beloborodov, A.V.Berdyugin, A.V.Bozhenok,
  A.D.Bukin, D.A.Bukin, S.V.Burdin, T.V.Dimova, A.A.Drozdetsky, V.P.Druzhinin,
  M.S.Dubrovin, I.A.Gaponenko, V.B.Golubev, V.N.Ivanchenko, A.A.Korol,
  I.A.Koop, S.V.Koshuba, G.A.Kukartsev, A.A.Mamutkin, E.V.Pakhtusova,
  A.A.Salnikov, S.I.Serednyakov, V.V.Shary, Yu.M.Shatunov, V.A.Sidorov,
  Z.K.Silagadze, A.N.Skrinsky, A.A.Valishev, A.V.Vasiljev","The $\phi(1020)\to\pi^0\pi^0\gamma$ decay","15 pages, 5 figure, 4 table, Submitted to Phys. Lett. B","Phys.Lett.B485:349-356,2000","10.1016/S0370-2693(00)00705-X",,"hep-ex",,"  In the SND experiment at VEPP-2M $e^+e^-$ collider the
$\phi(1020)\to\pi^0\pi^0\gamma$ decay was studied and its branching ratio was
measured: $B(\phi\to\pi^0\pi^0\gamma)=(1.221\pm 0.098\pm0.061)\cdot10^{-4}$. It
was shown, that $f_0(980)\gamma$ intermediate state dominates in this decay and
the $f_0(980)$-meson parameters were obtained.
","[{""version"":""v1"",""created"":""Thu, 11 May 2000 05:56:14 GMT""}]","2008-11-26"
"hep-ex/0005018","Christoph Amelung","ZEUS Collaboration","Measurement of the Proton Structure Function F_2 at Very Low Q^2 at HERA","23 pages including 4 figures. Revised version (v2) has a corrected
  author list and implements comments from the referee. Accepted by Phys. Lett.
  B","Phys.Lett.B487:53-73,2000","10.1016/S0370-2693(00)00793-0","DESY-00-071","hep-ex",,"  A measurement of the proton structure function F_2(x,Q^2) is presented in the
kinematic range 0.045 GeV^2 < Q^2 < 0.65 GeV^2 and 6*10^{-7} < x < 1*10^{-3}.
The results were obtained using a data sample corresponding to an integrated
luminosity of 3.9pb^-1 in e^+p reactions recorded with the ZEUS detector at
HERA. Information from a silicon-strip tracking detector, installed in front of
the small electromagnetic calorimeter used to measure the energy of the
final-state positron at small scattering angles, together with an enhanced
simulation of the hadronic final state, has permitted the extension of the
kinematic range beyond that of previous measurements. The uncertainties in F_2
are typically less than 4%. At the low Q^2 values of the present measurement,
the rise of F_2 at low x is slower than observed in HERA data at higher Q^2 and
can be described by Regge theory with a constant logarithmic slope. The
dependence of F_2 on Q^2 is stronger than at higher Q^2 values, approaching, at
the lowest Q^2 values of this measurement, a region where F_2 becomes nearly
proportional to Q^2.
","[{""version"":""v1"",""created"":""Thu, 11 May 2000 13:38:40 GMT""},{""version"":""v2"",""created"":""Wed, 5 Jul 2000 10:34:01 GMT""}]","2012-08-27"
"hep-lat/0005007","John Kogut","J. B. Kogut, D. K. Sinclair","Tricritical scaling at the N_t=6 chiral phase transition for 2 flavour
  lattice QCD with staggered quarks","12 pages, 3 postscript figures Letter has been rewritten to reflect a
  reinterpretation of our results as indicating tricritical critical indices
  rather than those predicted by standard universality arguments. Some
  additional analysis which supports this interpretation is included. The
  comparison of our methods with those of others has been expanded",,"10.1016/S0370-2693(00)01050-9","ANL-HEP-PR-00-049","hep-lat cond-mat.stat-mech hep-ph physics.comp-ph",,"  We have simulated lattice QCD directly in the chiral limit of zero quark mass
by adding an additional, irrelevant 4-fermion interaction to the standard
action. Using lattices having temporal extent of six and spatial extents of
twelve and eighteen, we find that the theory with 2 massless staggered quark
flavors has a second order finite temperature phase transition. The critical
exponents $\beta_{mag}$, $\delta$ and $\nu$ are measured and favour tricritical
behaviour over that expected by universality arguments. The pion screening mass
is consistent with zero below the transition, but is degenerate with the
nonzero $\sigma(f_0)$ mass above the transition, indicating the restoration of
chiral symmetry.
","[{""version"":""v1"",""created"":""Wed, 10 May 2000 17:21:54 GMT""},{""version"":""v2"",""created"":""Tue, 18 Jul 2000 21:57:38 GMT""}]","2009-10-31"
"hep-lat/0005008","Stefano Capitani","Stefano Capitani (MIT)","Perturbative renormalization of the first two moments of non-singlet
  quark distributions with overlap fermions","23 pages, 1 Postscript figure, uses elsevier style. Small corrections
  made in eqs. (6), (7), (13), (15), (17), (19), (20), (21) and (A.8), with no
  influence on the results","Nucl.Phys. B592 (2001) 183-202","10.1016/S0550-3213(00)00576-9","MIT-CTP-2978","hep-lat",,"  Using the overlap-Dirac operator proposed by Neuberger, we have computed in
lattice QCD the one-loop renormalization factors of ten operators which measure
the lowest two moments of unpolarized and polarized non-singlet quark
distributions. These factors are necessary to extract physical numbers from
Monte Carlo simulations made with overlap fermions.
  An exact chiral symmetry is maintained in all our results, and the
renormalization constants of corresponding unpolarized and polarized operators
which differ by a $\gamma_5$ matrix have the same value. We have considered two
lattice representations for each continuum operator. The computations have been
carried out using the symbolic language FORM, in a general covariant gauge. In
some simple cases they have also been checked by hand.
","[{""version"":""v1"",""created"":""Wed, 10 May 2000 22:11:25 GMT""},{""version"":""v2"",""created"":""Mon, 29 May 2000 21:55:50 GMT""}]","2015-06-25"
"hep-ph/0005093","Smaragda Lola","Smaragda Lola (CERN)","Renormalisation effects of neutrino masses and interactions","19 pages, 6 figures. Invited talk at the Cracow Epiphany Conference
  on Neutrinos in Physics and Astrophysics, January 2000. Proceedings to appear
  in Acta Physica Polonica B","Acta Phys.Polon. B31 (2000) 1253-1271",,"CERN-TH-2000-137","hep-ph",,"  1. Data and implications. 2. Neutrino threshold effects. 3. Renormalisation
of the neutrino mass operator and stability properties of neutrino textures. 4.
Neutrino thresholds effects and Yukawa unification. 5. Renormalisation-induced
lepton-flavour-violating processes from non-zero neutrino masses. 6. Summary.
","[{""version"":""v1"",""created"":""Wed, 10 May 2000 19:50:00 GMT""}]","2007-05-23"
"hep-ph/0005094","Dany Page","Dany Page (1), Madappa Prakash (2), James M. Lattimer (2) and Andrew
  Steiner (2) ((1) Instituto de Astronomia, UNAM, Mexico (2) Department of
  Physics & Astronomy, SUNY at Stony Brook, Stony Brook, USA)","Prospects of Detecting Baryon and Quark Superfluidity from Cooling
  Neutron Stars","4 pages, 3 ps figures, uses RevTex(aps,prl). Submitted to Phys. Rev.
  Lett","Phys.Rev.Lett.85:2048-2051,2000","10.1103/PhysRevLett.85.2048","SUSB-NT6-00-10","hep-ph astro-ph nucl-th",,"  Baryon and quark superfluidity in the cooling of neutron stars are
investigated. Observations could constrain combinations of the neutron or
Lambda-hyperon pairing gaps and the star's mass. However, in a hybrid star with
a mixed phase of hadrons and quarks, quark gaps larger than a few tenths of an
MeV render quark matter virtually invisible for cooling. If the quark gap is
smaller, quark superfluidity could be important, but its effects will be nearly
impossible to distinguish from those of other baryonic constituents.
","[{""version"":""v1"",""created"":""Wed, 10 May 2000 18:55:28 GMT""}]","2011-05-05"
