"astro-ph/0005210","Manoj Kaplinghat","M. Kaplinghat, L. Knox and M.S. Turner","Annihilating Cold Dark Matter","Matches version accepted for publication in Physical Review Letters.
  Included the effect of adiabatic expansion. Some changes in the abstract.
  Conclusions unchanged","Phys.Rev.Lett.85:3335,2000","10.1103/PhysRevLett.85.3335",,"astro-ph",,"  Structure formation with cold dark matter (CDM) predicts halos with a central
density cusp, which are observationally disfavored. If CDM particles have an
annihilation cross section sigma*v ~ 10**(-29) (m/GeV) cm**2, then
annihilations will soften the cusps. We discuss plausible scenarios for
avoiding the early Universe annihilation catastrophe that could result from
such a large cross section. The predicted scaling of core density with halo
mass depends upon the velocity dependence of sigma*v, and s-wave annihilation
leads to a core density nearly independent of halo mass, which seems consistent
with observations.
","[{""version"":""v1"",""created"":""Wed, 10 May 2000 20:27:37 GMT""},{""version"":""v2"",""created"":""Tue, 29 Aug 2000 19:52:09 GMT""}]","2010-04-06"
"astro-ph/0005212","Revnivtsev Mikhail","M.Revnivtsev (1,2), R.Sunyaev (2,1), K.Borozdin (3,1) ((1) Space
  Research Institute, Moscow, Russia, (2) MPA, Garching, Germany, (3) Los
  Alamos National Laboratory, NM, USA)","Discovery of 0.08 Hz QPO in the power spectrum of black hole candidate
  XTE J1118+480","3 pages, 2 figures, submitted in A&A Letters","Astron.Astrophys.361:L37-L39,2000",,,"astro-ph",,"  We found a strong QPO feature at 0.085+/-0.002 Hz in the power spectrum of
X-ray transient XTE J1118+480. The QPO was detected in PCA/RXTE data with an
amplitude close to 10% rms, and the width 0.034+/-0.006 Hz. The shape of the
power spectrum is typical for black hole candidates: almost flat at frequencies
lower than 0.03 Hz, roughly power law with slope ~1.2 from 0.03 to 1 Hz, with a
following steepening to ~1.6 at higher frequencies. The hard energy spectrum
detected up to ~150 keV and the absence of significant X-ray variability at the
high frequencies above 100 Hz strongly support the identification of XTE
J1118+480 as black hole transient.
","[{""version"":""v1"",""created"":""Wed, 10 May 2000 17:48:44 GMT""}]","2011-05-23"
"astro-ph/0005215","Christopher Palma","Christopher Palma (1), William E. Kunkel (2), and Steven R. Majewski
  (1) ((1) University of Virginia, (2) Las Campanas Observatory)","Spectroscopy of Giant Stars in the Pyxis Globular Cluster","22 pages, 5 figures, aaspp4 style, accepted for publication in
  October, 2000 issue of the PASP","Publ.Astron.Soc.Pac.112:1305-1314,2000","10.1086/316625",,"astro-ph",,"  The Pyxis globular cluster is a recently discovered globular cluster that
lies in the outer halo (R_{gc} ~ 40 kpc) of the Milky Way. Pyxis lies along one
of the proposed orbital planes of the Large Magellanic Cloud (LMC), and it has
been proposed to be a detached LMC globular cluster captured by the Milky Way.
We present the first measurement of the radial velocity of the Pyxis globular
cluster based on spectra of six Pyxis giant stars. The mean heliocentric radial
velocity is ~ 36 km/sec, and the corresponding velocity of Pyxis with respect
to a stationary observer at the position of the Sun is ~ -191 km/sec. This
radial velocity is a large enough fraction of the cluster's expected total
space velocity, assuming that it is bound to the Milky Way, that it allows
strict limits to be placed on the range of permissible transverse velocities
that Pyxis could have in the case that it still shares or nearly shares an
orbital pole with the LMC. We can rule out that Pyxis is on a near circular
orbit if it is Magellanic debris, but we cannot rule out an eccentric orbit
associated with the LMC. We have calculated the range of allowed proper motions
for the Pyxis globular cluster that result in the cluster having an orbital
pole within 15 degrees of the present orbital pole of the LMC and that are
consistent with our measured radial velocity, but verification of the tidal
capture hypothesis must await proper motion measurement from the Space
Interferometry Mission or HST. A spectroscopic metallicity estimate of [Fe/H] =
-1.4 +/- 0.1 is determined for Pyxis from several spectra of its brightest
giant; this is consistent with photometric determinations of the cluster
metallicity from isochrone fitting.
","[{""version"":""v1"",""created"":""Wed, 10 May 2000 18:52:23 GMT""}]","2009-09-28"
"astro-ph/0005228","Tim Robinson","T. G. Robinson (1), C. N. Tadhunter (1), D. J. Axon (2) and A.
  Robinson (2) ((1) University of Sheffield, (2) University of Hertfordshire)","Testing the photoionization models of powerful radio galaxies: Mixed
  line-emitting media in 3C 321","Accepted for publication in MNRAS","Mon.Not.Roy.Astron.Soc. 317 (2000) 922","10.1046/j.1365-8711.2000.03719.x",,"astro-ph",,"  The photoionization models for the narrow emission line regions of powerful
radio galaxies have yet to be tested in depth. To this end, we present
high-quality long-slit spectroscopy of the powerful double-nucleus radio galaxy
3C 321. The data have good enough spatial resolution to be able to trace the
variation in emission-line properties on kpc scales. Continuum modelling and
subtraction enables the faint emission line fluxes to be measured in several
regions across the emission line nebula. We plot diagnostic line-ratio diagrams
and compare them with the predictions of various photoionization models,
finding that the data is best fit by models which assume a mixture of optically
thin and thick clouds illuminated by a power-law continuum.
  The emission line kinematics, line ratios and deduced physical conditions
show remarkably little variation across the source. We deduce a mean electron
density of 400 +/- 120 cm-3 and a mean temperature of 11500 +/- 1500 K.
Assuming a single population of optically thick line-emitting clouds, we
calculate a mean photoionization parameter of (1.1 +/- 0.5) x 10e-2 and hence a
photoionizing photon luminosity of Q ~ 10e55 -- 10e56 photon/s/sr. This
indicates a central engine as luminous as that of the powerful quasar 3C 273,
yet there is no evidence for such an energetically prolific central engine at
either far-infrared or radio wavelengths. We therefore conclude that the
mixed-media models, which give Q ~ 5 x 10e53 -- 5 x 10e54, represent a more
likely scenario.
  As a by-product of the continuum subtraction we infer that young stellar
populations account for ~ 0.4% of the visible stellar mass in the galaxy, and
that these populations are spatially extended.
","[{""version"":""v1"",""created"":""Wed, 10 May 2000 17:49:30 GMT""}]","2009-10-31"
"astro-ph/0005229","Adam G. Riess","Adam G. Riess (Space Telescope Science Institute)","The Case for an Accelerating Universe from Supernovae","To appear as an Invited Review for PASP 20 pages, 13 figures","Publ.Astron.Soc.Pac.112:1284,2000","10.1086/316624",,"astro-ph",,"  The unexpected faintness of high-redshift Type Ia supernovae (SNe Ia), as
measured by two teams, has been interpreted as evidence that the expansion of
the Universe is accelerating. We review the current challenges to this
interpretation and seek to answer whether the cosmological implications are
compelling. We discuss future observations of SNe Ia which could offer
extraordinary evidence to test acceleration.
","[{""version"":""v1"",""created"":""Wed, 10 May 2000 18:49:29 GMT""}]","2008-11-26"
"astro-ph/0005230","J. Robert Buchler","Michael Feuchtinger, J. Robert Buchler & Zoltan Kollath","Hydrodynamical Survey of First Overtone Cepheids","ApJ, 12 pages, (slightly) revised","Astrophysical Journal, Vol. 544, p. 1056-1066","10.1086/317260",,"astro-ph physics.flu-dyn",,"  A hydrodynamical survey of the pulsational properties of first overtone
Galactic Cepheids is presented. The goal of this study is to reproduce their
observed light- and radial velocity curves. The comparison between the models
and the observations is made in a quantitative manner on the level of the
Fourier coefficients. Purely radiative models fail to reproduce the observed
features, but convective models give good agreement.
  It is found that the sharp features in the Fourier coefficients are indeed
caused by the P1/P4 = 2 resonance, despite the very large damping of the 4th
overtone. For the adopted mass-luminosity relation the resonance center lies
near a period of 4.2d +/- 0.2 as indicated by the observed radial velocity
data, rather than near 3.2d as the light-curves suggest.
","[{""version"":""v1"",""created"":""Wed, 10 May 2000 19:17:27 GMT""},{""version"":""v2"",""created"":""Fri, 30 Jun 2000 10:24:43 GMT""}]","2009-10-31"
"astro-ph/0005231","N. Bouche","N. Bouche, S.E. Schneider","IR-TF Relation In The Zone Of Avoidance With 2MASS","8 pages, Latex using newpasp.sty. Matches version to appear in
  Mapping the Hidden Universe: The Universe Behind the Milky Way - The Universe
  in HI, ASP Conference Series 2000, eds R.C.Kraan-Korteweg, P.A. Henning and
  H. Andernach (matched to published version; abstract bug in v2 fixed)",,,,"astro-ph",,"  Using the Tully-Fisher relation, one can map the peculiar velocity field and
estimate the mass in regions such as the Great Attractor. 2MASS is surveying
the full sky in J, H and K bands and has the great advantage that it allows us
to detect galaxies more uniformly to lower Galactic latitude than optical
surveys. This study shows the feasibility of using 2MASS and the TF relation to
probe large scale structure. We found that (i) we can use axis ratio $b/a$ up
to 0.5; (ii) intrinsic extinction is present (up to 0.5mag at J, 0.1 mag at K);
(iii) the zero-point of the TF relation is independent of the 2MASS magnitude
measurement and is consistent with the HST Key-Project value; (iv) the 2MASS
K-band 20th mag/arcsec$^2$ isophotal aperture magnitude produces the best TF
relation; and (v) there is no type dependence of the residuals
","[{""version"":""v1"",""created"":""Wed, 10 May 2000 20:17:33 GMT""},{""version"":""v2"",""created"":""Wed, 9 Aug 2000 19:01:22 GMT""},{""version"":""v3"",""created"":""Tue, 21 Nov 2000 19:24:37 GMT""}]","2007-05-23"
"astro-ph/0005232","Dr. Michael A. Nowak","Michael A. Nowak","Are There Three Peaks in the Power Spectra of GX 339-4 and Cyg X-1?","8 pages, 7 figures, to appear in MNRAS","Mon.Not.Roy.Astron.Soc. 318 (2000) 361","10.1046/j.1365-8711.2000.03668.x",,"astro-ph",,"  Among the variability behaviour exhibited by neutron star systems are the
so-called ``horizontal branch oscillations'' (HBO, with frequencies ~50 Hz),
the ``lower-frequency kHz quasi-periodic oscillation'' (QPO) and the
``upper-frequency kHz QPO'', with the latter two features being separated in
frequency by an amount comparable to, but varying slightly from, the suspected
spin-frequency of the neutron star. Recently, Psaltis, Belloni, & van der Klis
(1999) have suggested that there exists a correlation between these three
frequencies that, when certain identifications of variability features are
made, even encompasses black hole sources. We consider this hypothesis by
reanalyzing a set of GX 339-4 observations. The power spectral density (PSD)
constructed from a composite of 7 separate, but very similar, observations
shows evidence for three broad peaks in the PSD. If the peak frequencies of
these features are identified with ``QPO'', then their frequencies
approximately fit the correlations suggested by Psaltis, Belloni, & van der
Klis (1999). We also reanalyze a Cyg X-1 observation and show that the
suggested QPO correlation may also hold, but that complications arise when the
``QPOs'' (which, in reality, are fairly broad features) are considered as a
function of energy band. These fits suggest the existence of at least three
separate, independent physical processes in the accretion flow, a hypothesis
that is also supported by consideration of the Fourier frequency-dependent time
lags and coherence function between variability in different energy bands.
","[{""version"":""v1"",""created"":""Wed, 10 May 2000 20:36:29 GMT""}]","2009-10-31"
"astro-ph/0005233","Chung-Pei Ma","Chung-Pei Ma (U. Penn.), J. N. Fry (U. Florida)","What Does It Take to Stabilize Gravitational Clustering?","Final version appeared in ApJ Lett. (August 1 2000); Minor revisions;
  10 pages, 2 inserted postscript figures","Astrophys. J. 538 (2000) L107-L111","10.1086/312819",,"astro-ph",,"  An analytical understanding of the strongly nonlinear regime of gravitational
collapse has been difficult to achieve. The only insight has been the stable
clustering hypothesis, which assumes that the number of neighbors for objects
averaged over small length scales is constant in time. Our recently proposed
analytic halo model for N-point correlation functions now provides a tool for
calculating gravitational clustering properties in the strongly nonlinear
regime. This model also provides a new physical framework for an independent
evaluation of the validity of the stable clustering hypothesis. We derive the
asymptotic nonlinear behavior of the N-point correlation functions and pairwise
peculiar velocities in terms of dark matter halo properties. We show that these
statistics exhibit stable clustering only when the halo mass function and halo
density profile obey specific relations. The long-cherished stable clustering
hypothesis therefore is not necessarily realized in practice.
","[{""version"":""v1"",""created"":""Wed, 10 May 2000 23:00:43 GMT""},{""version"":""v2"",""created"":""Tue, 22 Aug 2000 00:18:47 GMT""}]","2009-10-31"
"astro-ph/0005234","Rob Ivison","Rob J. Ivison (UCL), James S. Dunlop (Edinburgh), Ian Smail (Durham),
  Arjun Dey (NOAO), Michael C. Liu (Berkeley), James R. Graham (Berkeley)","An excess of submm sources near 4C41.17: a candidate proto-cluster at
  z=3.8?","7 pages, 3 figures (1 in colour), accepted for ApJ","ApJ, 542, 27 (2000)","10.1086/309536",,"astro-ph",,"  Biased galaxy-formation theories predict that massive galaxies at high
redshifts should act as signposts to high-density environments in the early
Universe, which subsequently evolve into the cores of the richest clusters seen
at the present day. These regions are characterised by over-densities of young
galaxies, perhaps including a population of dusty, interaction-driven
starbursts - the progenitors of massive cluster ellipticals. By searching for
this population at submm wavelengths we can therefore test both galaxy- and
structure-formation models. We have undertaken such a search in the field of a
z=3.8 radio galaxy, 4C41.17, with the SCUBA submm camera. Our extremely deep
450- and 850-micron maps reveal an order-of-magnitude over-density of luminous
submm galaxies compared to typical fields (the likelihood of finding such an
over-density in a random field is <2E-3). The SCUBA galaxies have bolometric
luminosities, >10^13 L(solar), which imply star-formation rates consistent with
those required to form a massive galaxy in only a few 10^8 years. We also note
that this field exhibits an over-density of extremely red objects (EROs), some
of which may be associated with the submm sources, and Lyman-break galaxies. We
propose that the over-densities of both submm and ERO sources in this field
represent young dusty, starburst galaxies forming within a proto-cluster
centered on the radio galaxy at z=3.8, which is also traced by a less-obscured
population of Lyman-break galaxies.
","[{""version"":""v1"",""created"":""Wed, 10 May 2000 23:04:35 GMT""}]","2009-10-31"
"astro-ph/0005235","Dr Jon Bell","J. F. Bell, R. D. Ekers, J. D. Bunton","E&F White conference on Radio Frequency Interference Mitigation
  Strategies","8 pages, postscript only, accepted for publication in Publication of
  the Astronomical Society of Australia, online version hyperlinked to
  proceedings is available at http://www.atnf.csiro.au/SKA/intmit/atnf/conf/",,,,"astro-ph",,"  The conference brought together expertise on a range of interference
mitigation techniques from CSIRO, Australian and international industry and
universities. Key goals were to: enhance the understanding of techniques and
their inter-relationship, increase awareness of advanced technologies such as
software radios and photonics, and foster a cooperative approach to the
development of interference mitigation techniques. The foremost application in
mind was the square kilometre array (SKA) and the need to find ways to develop
an hierarchical scheme for removing unwanted signals from astronomical data.
This paper gives an overview of the topics discussed at the conference and
summarises some of the key ideas and results that were presented.
  Many of the interference challenges we face can be overcome with technical
solutions. There will always be a place for regulatory and legal approaches to
spectrum management, but too much reliance has been placed on these in the
past. The strategy of avoidance has worked well in the past and will continue
to be useful in the future, but is now limited by the growth of space based
communications systems, which are visible everywhere on Earth. There is no
technical solution which is likely to provide a silver bullet. Rather a
hierarchical approach will be required, combining a range of techniques. We
have just begun exploring technical solutions and their toxicity to
astronomical data. We need to continue on this path, determining which
techniques are best and how they interact in order to develop a flexible and
powerful system for interference suppression.
","[{""version"":""v1"",""created"":""Wed, 10 May 2000 23:34:38 GMT""}]","2007-05-23"
"astro-ph/0005237","John M. Carpenter","John M. Carpenter, Mark H. Heyer, and Ronald L. Snell","Embedded Stellar Clusters in the W3/W4/W5 Molecular Cloud Complex","to appear in ApJS, see http://astro.caltech.edu/~jmc/papers/w3","Astrophys.J.Suppl. 130 (2000) 381-402","10.1086/317352",,"astro-ph",,"  We analyze the embedded stellar content in the vicinity of the W3/W4/W5 HII
regions using the FCRAO Outer Galaxy 12CO(J=1-0) Survey, the IRAS Point Source
Catalog, published radio continuum surveys, and new near-infrared and molecular
line observations. Thirty-four IRAS Point Sources are identified that have
far-infrared colors characteristic of embedded star forming regions, and we
have obtained K' mosaics and 13CO(J=1-0) maps for 32 of them. Ten of the IRAS
sources are associated with an OB star and 19 with a stellar cluster, although
three OB stars are not identified with a cluster. Half of the embedded stellar
population identified in the K' images is found in just the 5 richest clusters,
and 61% is contained in IRAS sources associated with an embedded OB star. Thus
rich clusters around OB stars contribute substantially to the stellar
population currently forming in the W3/W4/W5 region. Approximately 39% of the
cluster population is embedded in small clouds with an average mass of ~130 Mo
that are located as far as 100 pc from the W3/W4/W5 cloud complex. We speculate
that these small clouds are fragments of a cloud complex dispersed by previous
episodes of massive star formation. Finally, we find that 4 of the 5 known
embedded massive star forming sites in the W3 molecular cloud are found along
the interface with the W4 HII region despite the fact that most of the
molecular mass is contained in the interior regions of the cloud. These
observations are consistent with the classical notion that the W4 HII region
has triggered massive star formation along the eastern edge of the W3 molecular
cloud.
","[{""version"":""v1"",""created"":""Thu, 11 May 2000 05:28:33 GMT""}]","2009-10-31"
"astro-ph/0005238","Jochen Greiner","J. Greiner (Astrophys. Inst. Potsdam, Germany)","Catalog of supersoft X-ray sources","publ. in New Astr. 5, 137; full electronic version of the catalog at
  http://www.aip.de/People/JGreiner/sss/ssscat.html",,"10.1016/S1384-1076(00)00018-X",,"astro-ph",,"  This catalog comprises an up-to-date (December 1999) list of luminous (>10^36
erg/s), binary supersoft X-ray sources. This electronic version (including the
accompannying Web-pages) supersedes the printed version of Greiner (1996).
","[{""version"":""v1"",""created"":""Thu, 11 May 2000 06:50:40 GMT""}]","2009-10-31"
"astro-ph/0005239","David T. Frayer","D. T. Frayer (1), Ian Smail (2), R. J. Ivison (3), N. Z. Scoville (1)
  ((1) Caltech, (2) Univ. of Durham, (3) Univ. College London)","The Identification of the Submillimeter Galaxy SMM J00266+1708","7 pages, includes 3 figures, submitted to AJ (minor revisions after
  referee's report)",,"10.1086/301571",,"astro-ph",,"  We report the detection of 1.3mm continuum and near-infrared K-band
(2.2-micron) emission from the submillimeter galaxy SMM J00266+1708. Although
this galaxy is among the brightest sub-mm sources detected in the blank-sky
surveys (L~10^{13} L[sun]), SMM J00266+1708 had no reliable
optical/near-infrared counter-part. We used sensitive interferometric 1.3mm
observations with the Owens Valley Millimeter Array to accurately determine the
position of the sub-mm galaxy. Follow-up near-infrared imaging with the Keck I
telescope uncovered a new faint red galaxy at K=22.5 mag which is spatially
coincident with the 1.3mm emission. This is currently the faintest confirmed
counter-part of a sub-mm galaxy. Although the redshift of SMM J00266+1708 is
still unknown, its high sub-mm/radio spectral index suggests that the system is
at high redshift (z>2). Approximately 50% or more of the sub-mm galaxies are
faint/red galaxies similar to that of SMM J00266+1708. These ultraluminous
obscured galaxies account for a significant fraction of the total amount of
star-formation at high redshift despite being missed by optical/ultraviolet
surveys.
","[{""version"":""v1"",""created"":""Thu, 11 May 2000 06:55:00 GMT""},{""version"":""v2"",""created"":""Sat, 17 Jun 2000 00:22:58 GMT""}]","2009-10-31"
"astro-ph/0005240","Oleg V. Verkhodanov","Yu.N. Parijskij (1), W.M. Goss (2), A.I.Kopylov (1), N.S. Soboleva
  (3), A.V. Temirova (3), O.V. Verkhodanov (1), O.P. Zhelenkova (1) ((1) SAO,
  Russia (2) NRAO, USA; (3) St.Petersburg branch, SAO, Russia)","RATAN-600 - VLA - BTA-6m (""BIG TRIO"") Project: multicolour studying of
  distant radio galaxies","8 pages, 3 figures, uses psfig.sty. This was the poster as presented
  on Gamow Memorial Intern. Conf. GMIC'99 ""Early Universe: Cosmological
  Problems and Instrumental Technologies"" in St.Petersburg, 23-27 Aug., 1999.
  Submitted to Proceedings, to be published in A&A Transactions. Partly
  presented as a Poster on IAU Symp.199, Puna, India",,"10.1080/10556790008238579",,"astro-ph",,"  Powerful radio galaxies belong to the population of massive stellar systems
that can be picked at high redshifts. With measured redshift, morphology and
age determination these objects can help greatly in understanding of the way of
formation and evolution of giant elliptical galaxies with massive Black Holes
in the Early Universe. We presents some recent results of study of the sample
of 105 faint steep spectrum radio sources from RATAN-600 RC catalogue.
  All the objects has been mapped with the VLA and optical identification have
been carried out with the 6m BTA telescope. Using multicolour CCD photometry in
B,V,R_c,I_c bands photometric redshift and age of stellar population are
estimated for a subsample of 50 FRII and CSS radio galaxies. RC J0105+0501 is a
very probable candidate for radio galaxy at z ~ 3.5.
  Distribution of objects on colour-colour and magnitude-redshift diagrams
shows a rough agreement with expectations of theoretical models of SED
evolution for giant elliptical galaxies. On the [m_R - z_{phot}] diagram two
populations of faint (m_R = 22^m-24^m) radio galaxies are possibly revealed.
The first population at z~ 1 consists of mainly old (a half with age >= 5 Gyr)
and large (LAS~20"") objects, the second one at z = 1.5 - 3.5 includes both
younger (<= 3 Gyr) and smaller (LAS ~ 5"") objects.
  There are 12 more faint or still undetected (m_R >= 24.5^m) sources in the
sample which may presumably be a very distant radio galaxies (z>3.5) or
intermediate redshift old or dusty ones.
","[{""version"":""v1"",""created"":""Thu, 11 May 2000 08:18:27 GMT""}]","2009-10-31"
"astro-ph/0005241","Ronald Drimmel","R. Drimmel","Evidence for a two-armed spiral in the Milky Way","4 pages, 2 figures, accepted for publication by A&A Letters",,,,"astro-ph",,"  Emission profiles of the Galactic plane in K and at $240\micron$ are
presented, and features associated with the tangents of the spiral arms are
identified. In the K band, which traces stellar emission and suffers little
from absorbtion, features associated with the arm tangents indicate that a
two-armed logarithmic spiral dominates the nonaxisymmetric structure of the
Milky Way. In contrast, the $240\micron$ emission from dust entrained in the
interstellar gas is consistent with a four-armed model, in concordance with
radio data and optical spiral tracers. This suggests that the non-axisymmetric
mass perturbation responsible for the four-armed spiral structure in the gas
has a two rather than four-armed structure.
","[{""version"":""v1"",""created"":""Thu, 11 May 2000 08:37:41 GMT""}]","2007-05-23"
