"cond-mat/0005231","Yitzhak Rabin","S. Panyukov and Y. Rabin","Thermal Fluctuations of Elastic Filaments with Spontaneous Curvature and
  Torsion","1 figure",,"10.1103/PhysRevLett.85.2404",,"cond-mat.soft cond-mat.stat-mech",,"  We study the effects of thermal flucutations on thin elastic filaments with
spontaneous curvature and torsion. We derive analytical expressions for the
orientational correlation functions and for the persistence length of helices,
and find that this length varies non-monotonically with the strength of thermal
fluctuations. In the weak fluctuation regime, the persistence length of a
spontaneously twisted helix has three resonance peaks as a function of the
twist rate. In the limit of strong fluctuations, all memory of the helical
shape is lost.
","[{""version"":""v1"",""created"":""Sun, 14 May 2000 21:50:21 GMT""}]","2009-10-31"
"cond-mat/0005232","Robert Shrock","Shu-Chiuan Chang and Robert Shrock","Structural Properties of Potts Model Partition Functions and Chromatic
  Polynomials for Lattice Strips","53 pages, latex","Physica A 296, 131-182 (2001)","10.1016/S0378-4371(01)00150-9",,"cond-mat.stat-mech math.CO",,"  partial abstract: The $q$-state Potts model partition function (equivalent to
the Tutte polynomial) for a lattice strip of fixed width $L_y$ and arbitrary
length $L_x$ has the form
$Z(G,q,v)=\sum_{j=1}^{N_{Z,G,\lambda}}c_{Z,G,j}(\lambda_{Z,G,j})^{L_x}$, where
$v$ is a temperature-dependent variable. The special case of the
zero-temperature antiferromagnet ($v=-1$) is the chromatic polynomial $P(G,q)$.
Using coloring and transfer matrix methods, we give general formulas for
$C_{X,G}=\sum_{j=1}^{N_{X,G,\lambda}}c_{X,G,j}$ for $X=Z,P$ on cyclic and
M\""obius strip graphs of the square and triangular lattice. Combining these
with a general expression for the (unique) coefficient $c_{Z,G,j}$ of degree
$d$ in $q$: $c^{(d)}=U_{2d}(\frac{\sqrt{q}}{2})$, where $U_n(x)$ is the
Chebyshev polynomial of the second kind, we determine the number of
$\lambda_{Z,G,j}$'s with coefficient $c^{(d)}$ in $Z(G,q,v)$ for these cyclic
strips of width $L_y$ to be $n_Z(L_y,d)=(2d+1)(L_y+d+1)^{-1} {2L_y \choose
L_y-d}$ for $0 \le d \le L_y$ and zero otherwise. For both cyclic and M\""obius
strips of these lattices, the total number of distinct eigenvalues
$\lambda_{Z,G,j}$ is calculated to be $N_{Z,L_y,\lambda}={2L_y \choose L_y}$.
We point out that $N_{Z,L_y,\lambda}=2N_{DA,tri,L_y}$ and
$N_{P,L_y,\lambda}=2N_{DA,sq,L_y}$, where $N_{DA,\Lambda,n}$ denotes the number
of directed lattice animals on the lattice $\Lambda$.
","[{""version"":""v1"",""created"":""Mon, 15 May 2000 00:54:49 GMT""}]","2009-10-31"
"cond-mat/0005233","P. Mohanty","Pritiraj Mohanty","Electromagnetic Field Correlation inside a Sonoluminescing Bubble","4 pages, 1 figure",,,,"cond-mat.mes-hall quant-ph",,"  We consider the correlation of the electromagnetic field to determine spatial
coherence inside a sonoluminescing bubble. We explicitly calculate the first
order correlation function for two limiting cases of the excitation field: a
blackbody spectrum and a discrete multifrequency spectrum. The correlation
length for blackbody fields at temperatures between 3000 K and 10000 K is found
to be on the order of the optical wavelength, increasing with decreasing
temperatures. We predict spectral lines in the emission spectrum of single
bubble sonoluminescence in cooler bubbles with interior temperatures below
10000 K.
","[{""version"":""v1"",""created"":""Mon, 15 May 2000 01:08:49 GMT""}]","2007-05-23"
"cond-mat/0005234","P. Mohanty","Pritiraj Mohanty, Richard A. Webb","Low Temperature Anomaly in Mesoscopic Kondo Wires","Four pages, five figures","Phys. Rev. Lett. 84, 4481 (2000)","10.1103/PhysRevLett.84.4481",,"cond-mat.mes-hall cond-mat.str-el",,"  We report the observation of an anomalous magnetoresistance in extremely
dilute quasi-one-dimensional AuFe wires at low temperatures, along with a
hysteretic background at low fields. The Kondo resistivity does not show the
unitarity limit down to the lowest temperature, implying uncompensated spin
states. We suggest that the anomalous magnetoresistance may be understood as
the interference correction from the accumulation of geometric phase in the
conduction electron wave function around the localized impurity spin.
","[{""version"":""v1"",""created"":""Mon, 15 May 2000 01:16:47 GMT""}]","2009-10-31"
"cond-mat/0005235","William Bialek","William Bialek","Stability and noise in biochemical switches",,,,,"cond-mat.soft cond-mat.dis-nn nlin.AO physics.bio-ph q-bio.MN",,"  Many processes in biology, from the regulation of gene expression in bacteria
to memory in the brain, involve switches constructed from networks of
biochemical reactions. Crucial molecules are present in small numbers, raising
questions about noise and stability. Analysis of noise in simple reaction
schemes indicates that switches stable for years and switchable in milliseconds
can be built from fewer than one hundred molecules. Prospects for direct tests
of this prediction, as well as implications, are discussed.
","[{""version"":""v1"",""created"":""Mon, 15 May 2000 02:29:51 GMT""}]","2007-05-23"
"cond-mat/0005236","Robert Shrock","Shu-Chiuan Chang and Robert Shrock","Ground State Entropy of the Potts Antiferromagnet with
  Next-Nearest-Neighbor Spin-Spin Couplings on Strips of the Square Lattice","39 pages, latex, 8 figures","Phys. Rev. E62, 4650-4664 (2000)","10.1103/PhysRevE.62.4650",,"cond-mat.stat-mech math.CO",,"  We present exact calculations of the zero-temperature partition function
(chromatic polynomial) and $W(q)$, the exponent of the ground-state entropy,
for the $q$-state Potts antiferromagnet with next-nearest-neighbor spin-spin
couplings on square lattice strips, of width $L_y=3$ and $L_y=4$ vertices and
arbitrarily great length $L_x$ vertices, with both free and periodic boundary
conditions. The resultant values of $W$ for a range of physical $q$ values are
compared with each other and with the values for the full 2D lattice. These
results give insight into the effect of such non-nearest neighbor couplings on
the ground state entropy. We show that the $q=2$ (Ising) and $q=4$ Potts
antiferromagnets have zero-temperature critical points on the $L_x \to \infty$
limits of the strips that we study. With the generalization of $q$ from
${\mathbb Z}_+$ to ${\mathbb C}$, we determine the analytic structure of $W(q)$
in the $q$ plane for the various cases.
","[{""version"":""v1"",""created"":""Mon, 15 May 2000 03:29:20 GMT""}]","2009-10-31"
"cond-mat/0005237","Tsunehiro Kobayashi","T. Kobayashi and T. Shimbori","Statistical Mechanics for States with Complex Eigenvalues and
  Quasi-stable Semiclassical Systems","13 pages, LaTeX2e, 4 figures",,,"UTHEP-423","cond-mat.stat-mech",,"  Statistical mechanics for states with complex eigenvalues, which are
described by Gel'fand triplet and represent unstable states like resonances,
are discussed on the basis of principle of equal ${\it a priori}$ probability.
A new entropy corresponding to the freedom for the imaginary eigenvalues
appears in the theory. In equilibriums it induces a new physical observable
which can be identified as a common time scale. It is remarkable that in spaces
with more than 2 dimensions we find out existence of stable and quasi-stable
systems, even though all constituents are unstable. In such systems all
constituents are connected by stationary flows which are generally observable
and then we can say that they are semiclassical systems. Examples for such
semiclassical systems are constructed in parabolic potential barriers. The
flexible structure of the systems is also pointed out.
","[{""version"":""v1"",""created"":""Mon, 15 May 2000 06:05:36 GMT""}]","2016-08-31"
"cond-mat/0005238","Han-Yong Choi","Jung-Woo Yoo and Han-Yong Choi","Optical conductivity in the normal state fullerene superconductors","6 pages, 4 figures. To be published in Physical Review B, July 15",,"10.1103/PhysRevB.62.4440",,"cond-mat.str-el",,"  We calculate the optical conductivity, $\sigma(\omega)$, in the normal state
fullerene superconductors by self-consistently including the impurity
scatterings, the electron-phonon and electron-electron Coulomb interactions.
The finite bandwidth of the fullerenes is explicitely considered, and the
vertex corection is included $a$ $la$ Nambu in calculating the renormalized
Green's function. $\sigma(\omega)$ is obtained by calculating the
current-current correlation function with the renormalized Green's function in
the Matsubara frequency and then performing analytic continuation to the real
frequency at finite temperature. The Drude weight in $\sigma(\omega)$ is
strongly suppressed due to the interactions and transfered to the mid-infrared
region around and above 0.06 eV which is somewhat less pronounced and much
broader compared with the expermental observation by DeGiorgi $et$ $al$.
","[{""version"":""v1"",""created"":""Mon, 15 May 2000 06:39:38 GMT""}]","2009-10-31"
"cond-mat/0005239","Leonid Prigozhin","Leonid Prigozhin and Boris Zaltzman","On two continuous models for the dynamics of sandpile surfaces","6 pages",,"10.1103/PhysRevE.63.041505",,"cond-mat.soft",,"  We consider a modified BCRE model for pile surface dynamics (Bouchaud, Cates,
Ravi Prakash, and Edwards, J. Phys. I France, v. 4, p. 1383, 1994) and show
that in the long-scale limit this model converges to a quasistationary model of
pile growth in the form of an evolutionary variational inequality (Prigozhin,
Phys. Rev. E, v. 49, p. 1161, 1994).
","[{""version"":""v1"",""created"":""Mon, 15 May 2000 07:35:43 GMT""}]","2009-10-31"
"cond-mat/0005240","Gerrit E. W. Bauer","Mark I. Visscher, Behzad Rejaei, and Gerrit E.W. Bauer","Strong Effects of Weak Localization in Charge Density Wave/Normal Metal
  Hybrids","To be published in Physical Review B",,"10.1103/PhysRevB.62.6873",,"cond-mat.mes-hall",,"  Collective transport through a multichannel disordered conductor in contact
with charge-density-wave electrodes is theoretically investigated. The
statistical distribution function of the threshold potential for charge-density
wave sliding is calculated by random matrix theory. In the diffusive regime
weak localization has a strong effect on the sliding motion.
","[{""version"":""v1"",""created"":""Mon, 15 May 2000 09:43:28 GMT""}]","2009-10-31"
"cond-mat/0005241","Ora Entin-Wohlman","A. Aharony and O. Entin-Wohlman (Tel Aviv University), Y. Imry and Y.
  Levinson (The Weizmann Institute of Science)","Charge occupancy of two interacting electrons on artificial molecules -
  exact results","12 pages, 7 figures",,"10.1103/PhysRevB.62.13561","TAU-2000","cond-mat.mes-hall",,"  We present exact solutions for two interacting electrons on an artificial
atom and on an artificial molecule made by one and two (single level) quantum
dots connected by ideal leads. Specifically, we calculate the accumulated
charge on the dots as function of the gate voltage, for various strengths of
the electron-electron interaction and of the hybridization between the dots and
the (one-dimensional) leads. With increasing of the (negative) gate voltage,
the accumulated charge in the two-electron ground state increases in gradual
steps from 0 to 1 and then to 2. The value 0 represents an ""insulating"" state,
where both electrons are bound to shallow states on the impurities. The value
of 1 corresponds to a ""metal"", with one electron localized on the dots and the
other extended on the leads. The value of 2 corresponds to another ""insulator"",
with both electrons strongly localized. The width of the ""metallic"" regime
diverges with strength of the electron-electron interaction for the single dot,
but remains very narrow for the double dot. These results are contrasted with
the simple Coulomb blockade picture.
","[{""version"":""v1"",""created"":""Mon, 15 May 2000 10:57:53 GMT""}]","2009-10-31"
"cond-mat/0005242","Michele Cini","Michele Cini, Adalberto Balzarotti, Raffaella Brunetti, Maria Gimelli
  and Gianluca Stefanucci","Canonical Transformation of the Hubbard Model and W=0 Pairing:
  Comparison with Exact Diagonalization Results","6 pages, presented to the SATT10 Conference, Frascati (Rome) 2000",,,,"cond-mat.supr-con cond-mat.str-el",,"  We have recently developed a canonical transformation of the Hubbard and
related models, valid for systems of arbitrary size and for the full plane;
this is particularly suited to study hole pairing. In this work we show that
exact diagonalization results of the one band Hubbard model for small clusters
with periodic boundary conditions agree well with the analytical ones obtained
by means of our canonical transformation. In the presence of a pairing
instability, the analytic approach allows us to identify the Cooper pairs. They
are W=0 pairs, that is, singlet two-hole eigenstates of the Hubbard Hamiltonian
with vanishing on-site repulsion. Indeed, we find that the Coulomb interaction
effects on W=0 pairs are dynamically small, and repulsive or attractive,
depending on the filling.
","[{""version"":""v1"",""created"":""Mon, 15 May 2000 11:53:33 GMT""}]","2007-05-23"
"cond-mat/0005243","Andrey E. Muryshev","Yu. Kagan and A. E. Muryshev","The spectral properties of non-condensate particles in Bose-condensed
  atomic hydrogen","revised, 4 pages, RevTeX, 2 figures",,"10.1016/S0375-9601(00)00754-4",,"cond-mat.stat-mech cond-mat.soft",,"  The strong spin-dipole relaxation, accompanying BEC in a gas of atomic
hydrogen, determines the formation of a quasistationary state with a flux of
particles in energy space to the condensate. This state is characterized by a
significant enhancement of the low-energy distribution of non-condensate
particles resulting in a growth of their spatial density in the trap. This
growth leads to the anomalous reconstruction of the optical spectral properties
of non-condensate particles.
","[{""version"":""v1"",""created"":""Mon, 15 May 2000 12:06:49 GMT""},{""version"":""v2"",""created"":""Mon, 13 Nov 2000 11:33:12 GMT""}]","2009-10-31"
"gr-qc/0005052","Antonio Teixeira","A.F.F. Teixeira (Centro Brasileiro de Pesquisas Fisicas)","Cosmic crystallography in a circle","13 pages, 16 figures, corrected commands for graphics",,,"CBPF-NF-032/00","gr-qc astro-ph",,"  In a circle (an S^1) with circumference 1 assume m objects distributed
pseudo-randomly. In the universal covering R^1 assume the objects replicated
accordingly, and take an interval L>1. In this interval, make the normalized
histogram of the pair separations which are not an integer. The theoretical
(expected) such histogram is obtained in this report, as well as its difference
to a similar histogram for non-replicated objects. The whole study is of
interest for the cosmic crystallography.
","[{""version"":""v1"",""created"":""Mon, 15 May 2000 13:43:33 GMT""},{""version"":""v2"",""created"":""Tue, 11 Jul 2000 23:43:48 GMT""},{""version"":""v3"",""created"":""Tue, 18 Jul 2000 23:09:39 GMT""},{""version"":""v4"",""created"":""Thu, 5 Oct 2000 03:07:08 GMT""}]","2007-05-23"
"gr-qc/0005053","Abel Camacho Quintana","Abel Camacho (Astrophysikalisches Institut Potsdam)","Quantum Zeno effect and the detection of gravitomagnetism","Essay awarded with an ``honorable mention'' in the Annual Essay
  Competition of the Gravity Research Foundation for the year 2000, four new
  references, discussion enlarged, 9 pages. Accepted in International Journal
  of Modern Physics D","Int.J.Mod.Phys.D10:9-14,2001","10.1142/S0218271801000949",,"gr-qc quant-ph",,"  In this work we introduce two experimental proposals that could shed some
light upon the inertial properties of intrinsic spin. In particular we will
analyze the role that the gravitomagnetic field of the Earth could have on a
quantum system with spin 1/2. We will deduce the expression for Rabi
transitions, which depend, explicitly, on the coupling between the spin of the
quantum system and the gravitomagnetic field of the Earth. Afterwards, the
continuous measurement of the energy of the spin 1/2 system is considered, and
an expression for the emerging quantum Zeno effect is obtained. Thus, it will
be proved that gravitomagnetism, in connection with spin 1/2 systems, could
induce not only Rabi transitions but also a quantum Zeno effect.
","[{""version"":""v1"",""created"":""Mon, 15 May 2000 14:11:07 GMT""},{""version"":""v2"",""created"":""Tue, 7 Nov 2000 10:01:23 GMT""}]","2011-09-13"
"hep-ex/0005022","Renoult","M. Kado (CERN)","Cornering Higgs Bosons at LEP","7 pages, 14 figures, submitted to Moriond conference, March 2000",,,,"hep-ex",,"  The most recent results of the searches for Higgs bosons in the data taken at
LEP in 1999 and their interpretation in a variety of theoretical framework are
reviewed.
","[{""version"":""v1"",""created"":""Mon, 15 May 2000 07:28:45 GMT""}]","2007-05-23"
"hep-ex/0005023","Salvatore Mele","L3 Collaboration","Measurements of the bb~ production cross section and forward backward
  asymmetry at centre-of-mass energies above the Z pole at LEP",,"Phys.Lett.B485:71-84,2000","10.1016/S0370-2693(00)00676-6","CERN-EP/2000-054","hep-ex",,"  The measurements of Rb = sigma(e+e- -> bb~)/sigma(e+e- -> qq~) and of the b
quark forward-backward charge asymmetry, A^b_fb, at centre-of-mass energies
above the Z pole are described. The measurement of Rb is performed at \root{s}
between 130 and 189 GeV using a b-tagging method that exploits the relatively
large decay length of b-hadrons. The measurement of A^b_fb is performed using
the large statistics event sample collected at \root{s}=189 GeV with a
lepton-tag analysis based on the selection of prompt muons and electrons. The
results at \root{s}=189 GeV are: Rb = 0.163 +/- 0.013 (stat.) +/- 0.005
(syst.), A^b_fb = 0.61 +/- 0.18 (stat.) +/- 0.09 (syst.).
","[{""version"":""v1"",""created"":""Mon, 15 May 2000 07:48:41 GMT""}]","2012-08-27"
"hep-ex/0005024","Salvatore Mele","L3 Collaboration","Search for Anomalous ZZgamma and Zgammagamma couplings in the process
  e+e- -> Zgamma at LEP",,"Phys.Lett.B489:55-64,2000","10.1016/S0370-2693(00)00886-8","CERN-EP-2000-057","hep-ex",,"  We search for anomalous trilinear gauge couplings in the ZZgamma and
Zgammagamma vertices using data collected with the L3 detector at LEP at a
centre-of-mass energy \sqrt{s}=189 GeV. No evidence is found and limits on
these couplings and on new physics scales are derived from the analysis of the
process e+e- -> Zgamma.
","[{""version"":""v1"",""created"":""Mon, 15 May 2000 08:06:58 GMT""}]","2012-08-27"
"hep-lat/0005012","George Koutsoumbas","P.Dimopoulos, K.Farakos and G.Koutsoumbas","Decoupling of Layers in the Three-dimensional Abelian Higgs Model","23 pages, 12 figures, plain latex","Phys.Rev. D63 (2001) 054507","10.1103/PhysRevD.63.054507","NTUA-93/00","hep-lat cond-mat hep-ph",,"  The Abelian Higgs model with anisotropic couplings in 2+1 dimensions is
studied in both the compact and non-compact formulations. Decoupling of the
space-like planes takes place in the extreme anisotropic limit, so charged
particles and gauge fields are presumably localized within these planes. The
behaviour of the model under the influence of an external magnetic field is
examined in the compact case and yields further characterization of the phases.
","[{""version"":""v1"",""created"":""Mon, 15 May 2000 12:00:22 GMT""}]","2009-10-31"
"hep-ph/0005133","Nagashima Makiko","Mayumi Aoki, Eri Asakawa, Makiko Nagashima, Noriyuki Oshimo, Akio
  Sugamoto","Contributions of vector-like quarks to radiative B meson decay","11 pages, LATEX file with 3 EPS figures","Phys.Lett. B487 (2000) 321-326","10.1016/S0370-2693(00)00818-2","OCHA-PP-155, KEK-TH-693","hep-ph",,"  We study the decay B\to X_s\gamma in a minimal extension of the standard
model with extra up- and down-type quarks whose left- and right-handed
components are both SU(2) singlets. Constraints on the extended
Cabibbo-Kobayashi-Maskawa matrix are obtained from the experimental results for
the branching ratio. Even if the extra quarks are too heavy to be detected in
near-future colliders, the branching ratio could have a value which is
non-trivially different from the prediction of the standard model.
","[{""version"":""v1"",""created"":""Mon, 15 May 2000 07:08:49 GMT""},{""version"":""v2"",""created"":""Tue, 16 May 2000 04:16:28 GMT""},{""version"":""v3"",""created"":""Thu, 15 Jun 2000 07:57:24 GMT""}]","2009-10-31"
"hep-ph/0005134","Osamu Yasuda","Osamu Yasuda","Phenomenology of Neutrino Oscillations at a Neutrino Factory","12 pages, 6 sets of figures, uses epsfig. Talk presented at KEK
  International Workshop on High Intensity Muon Sources (HIMUS99), to appear in
  Proceedings published by World Scientific Publishing Co",,"10.1142/9789812791849_0009","TMUP-HEL-0008","hep-ph",,"  It is shown in the three flavor framework that neutrino factories enable us
to measure some of the oscillation parameters, such as the sign of $\Delta
m_{32}^2$, $\theta_{13}$, $\delta$. Some efforts are made to determine the
parameters (the muon energy and the neutrino path length) of a neutrino factory
to optimize the signals.
","[{""version"":""v1"",""created"":""Mon, 15 May 2000 04:04:34 GMT""}]","2016-11-23"
"hep-ph/0005135","Osamu Yasuda","Osamu Yasuda","Neutrino oscillations in high energy cosmic neutrino flux","4 pages, 4 figures, uses epsfig. Talk presented at Workshop on
  Neutrino Oscillations and Their Origin, Fujiyoshida, Japan, February 11-13,
  2000, to appear in Proceedings published by Universal Academy Press, Tokyo",,,"TMUP-HEL-0009","hep-ph",,"  I discuss the effects of neutrino oscillations on high energy cosmic
neutrinos which come from cosmologically distant astrophysical sources. I
incorporate all the up-to-date constraints from the solar, atmospheric,
reactor, accelerator data and give the possible pattern for the ratio of the
high energy cosmic neutrinos in the cases of three and four neutrino schemes.
","[{""version"":""v1"",""created"":""Mon, 15 May 2000 05:23:04 GMT""}]","2007-05-23"
"hep-ph/0005136","Koshiro Suzuki","T. Asaka, K. Hamaguchi, and Koshiro Suzuki","Cosmological Gravitino Problem in Gauge-Mediated Supersymmetry Breaking
  Models","15 pages, 3 eps figures; reviced version to be published in Physics
  Letters B","Phys.Lett. B490 (2000) 136-146","10.1016/S0370-2693(00)00959-X",,"hep-ph",,"  We investigate the cosmological gravitino problem in gauge-mediated
supersymmetry breaking models, where the gravitino becomes in general the
lightest supersymmetric particle (LSP). In order to avoid the overclosure of
the stable gravitino, the reheating temperature of inflation $T_R$ should be
low enough. Furthermore, if the gravitino mass is larger than about 100 MeV,
the decay of the next-to-LSP (NLSP) into the gravitino may modify disastrously
the abundances of the light elements predicted by the big-bang nucleosynthesis
(BBN). We consider the case in which the lighter stau is the NLSP and derive
cosmological constraints from the BBN on the stau NLSP decay. We obtain a lower
bound on the mass of stau $m_{\staul}$, which is more stringent than the
current experimental limit $m_{\staul} > 90$ GeV for the gravitino mass region
$m_{3/2} \gsim 5$ GeV. This lower bound, together with the overclosure
constraint on the stable gravitino, gives an upper bound on $T_{R}$. We find
that the reheating temperature can be as high as $10^9$--$10^{10}$ GeV for
$m_{3/2} \simeq 5$--100 GeV.
","[{""version"":""v1"",""created"":""Mon, 15 May 2000 09:41:17 GMT""},{""version"":""v2"",""created"":""Tue, 15 Aug 2000 10:17:45 GMT""}]","2009-10-31"
"hep-ph/0005137","Yoshio Koide","Yoshio Koide","Quark and Lepton Mass Matrices with a Cyclic Permutation Invariant Form","11 pages + 1 table, latex, no figures",,,"US-00-03","hep-ph",,"  As an attempt to give an unified description of quark and lepton mass
matrices M_f, the following mass matrix form is proposed: the form of the mass
matrices are invariant under a cyclic permutation (f_1 \to f_2, f_2 \to f_3,
f_3 \to f_1) among the fermions f_i. The model naturally leads to the maximal
mixing between \nu_\mu and \nu_\tau, and with an additional ansatz, it leads to
the well-satisfied relations |V_{us}| \simeq \sqrt{m_d/m_s} and |V_{cb}| \simeq
\sqrt{m_d/m_b}.
","[{""version"":""v1"",""created"":""Mon, 15 May 2000 11:43:58 GMT""}]","2007-05-23"
"hep-ph/0005138","Wit","K. Fialkowski and R. Wit","Modelling Bose-Einstein effect from asymmetric sources in Monte Carlo
  generators","4 pages, 1 figure, latex, XXXV Rencontre de Moriond",,,,"hep-ph",,"  We present some results concerning the Bose-Einstein effect in asymmetric
sources in Monte Carlo generators. A comparison of LEP data, standard JETSET
predictions and results from the weight method is given. Possible
generalization of the weight factors to an asymmetric form is considered.
","[{""version"":""v1"",""created"":""Mon, 15 May 2000 12:12:26 GMT""}]","2007-05-23"
