"hep-ph/0005139","Robert Harlander","K.G. Chetyrkin, R.V. Harlander, J.H. Kuehn","Quartic mass corrections to R_had at order \alpha_s^3","LaTeX, 20 pages, 9 figures (38 PostScript files). Error affecting
  Eqs. (9), (10) and Table 2 corrected. The numerical effect of this error is
  negligible and not visible in any of the Figures. The paper is also available
  via www at http://www-ttp.physik.uni-karlsruhe.de/Preprints/. The results are
  available in Mathematica format at
  http://www-ttp.physik.uni-karlsruhe.de/Progdata/ttp00/ttp00-09/","Nucl.Phys. B586 (2000) 56-72; Erratum-ibid. B634 (2002) 413-414","10.1016/S0550-3213(00)00393-X","TTP00-09, HET-BNL-00/8","hep-ph",,"  The total cross section for the production of massive quarks in electron
positron annihilation can be predicted in perturbative QCD. After expansion in
m^2/s the quartic terms, i.e. those proportional to m^4/s^2, are calculated up
to order \alpha_s^3 for vector and axial current induced rates. Predictions
relevant for charm, bottom and top quarks production are presented. The
\alpha_s^3 corrections are shown to be comparable to terms of order \alpha_s
and \alpha_s^2. As a consequence, the predictions exhibit a sizeable dependence
on the renormalization scale. The stability of the prediction is improved and,
at the same time, the relative size of the large order terms decreases by
replacing the running mass \bar{m}(\mu) with the scheme independent invariant
one \hat{m}. By combining these results with the prediction for massless case
and the quadratic mass terms the cross section for massive quark production at
electron positron colliders is put under control in order \alpha_s^3 from the
high energy region down to fairly low energies.
","[{""version"":""v1"",""created"":""Mon, 15 May 2000 13:41:15 GMT""},{""version"":""v2"",""created"":""Wed, 2 Aug 2000 14:47:08 GMT""},{""version"":""v3"",""created"":""Wed, 24 Apr 2002 08:46:48 GMT""}]","2009-10-31"
"hep-ph/0005140","Piet Mulders","A. Bacchetta, M. Boglione, A. Henneman and P.J. Mulders","The full spin structure of quarks in the nucleon","10 pages with figures, LaTex, uses epsfig.sty. Invited talk by P.J.
  Mulders at the workshop on Nucleon Structure in the High x-Bjorken Region
  (HiX2000), Temple University, Philadelphia, PA, USA; March 30 - April 1, 2000",,,,"hep-ph",,"  We discuss bounds on the distribution and fragmentation functions that appear
at leading order in deep inelastic 1-particle inclusive leptoproduction or in
Drell-Yan processes. These bounds simply follow from positivity of the
quark-hadron scattering matrix elements and are an important guide in
estimating the magnitude of the azimuthal and spin asymmetries in these
processes. We focus on an example relevant for deep inelastic scattering at
relatively low energies.
","[{""version"":""v1"",""created"":""Mon, 15 May 2000 15:05:00 GMT""}]","2007-05-23"
"hep-ph/0005141","Blazenka Melic","J.G. Korner and B. Melic","Exclusive-Inclusive Ratio of Semileptonic Lambda_b-Decays","RevTeX, 18 pages, 4 figures","Phys.Rev. D62 (2000) 074008","10.1103/PhysRevD.62.074008","MZ-TH/99-12, IRB-TH-3/00","hep-ph",,"  We present theoretical evidence that the exclusive/inclusive ratio of
semileptonic $\Lambda_b$-decays exceeds that of semileptonic B-decays where the
experimental exclusive/inclusive ratio amounts to about 66%. We start from the
observation that the spectator quark model provides a lower bound on the
leading order Isgur-Wise function of the $\Lambda_b \to \Lambda_c$ transition
in terms of the corresponding $B \to D,D^*$ mesonic Isgur-Wise function. Using
experimental data for the $B \to D,D^*$ mesonic Isgur-Wise functions this bound
is established. Applying a Bethe-Salpeter model including spectator quark
interactions and a QCD sum rule estimate of the $\Lambda_b \to \Lambda_c$
transition form factor which satisfy the spectator quark model bound we predict
the exclusive/inclusive ratio of semileptonic $\Lambda_b$ decay rates to lie in
a range between 0.81 and 0.92. We also provide an upper bound on the baryonic
Isgur-Wise function which is determined from the requirement that the exclusive
rate should not exceed the inclusive rate.
","[{""version"":""v1"",""created"":""Mon, 15 May 2000 15:34:52 GMT""}]","2016-09-06"
"hep-th/0005124","Andrea Gregori","Andrea Gregori","On the strong coupling behavior of heterotic and type I orbifolds","17 pages, latex, revised version with some rewriting and new comments
  added","JHEP 0103 (2001) 024","10.1088/1126-6708/2001/03/024","BICOCCA-FT-00-06","hep-th",,"  We study the bulk effective theory of a class of orbifolds of the type IIB
string with D5-branes, compactified to four dimensions. These constructions are
connected, in a region of their moduli space, to some orbifolds of the type I
and heterotic string. We compare the effective actions through the coupling of
the R^2 term, and we argue that these orbifolds provide non-perturbative
deformations of the latter, in which the gauge group is entirely
non-perturbative.
","[{""version"":""v1"",""created"":""Mon, 15 May 2000 10:33:43 GMT""},{""version"":""v2"",""created"":""Wed, 11 Oct 2000 12:25:20 GMT""}]","2009-10-31"
"hep-th/0005128","Lori D. Paniak","L.D. Paniak (Princeton) and R.J. Szabo (NBI)","Fermionic Quantum Gravity","59 pages LaTeX, 1 eps figure. Uses epsf. References and
  acknowledgments added","Nucl.Phys. B593 (2001) 671-725","10.1016/S0550-3213(00)00631-3","PUPT-1931, NBI-HE-00-23","hep-th cond-mat.stat-mech math-ph math.MP nlin.SI",,"  We study the statistical mechanics of random surfaces generated by NxN
one-matrix integrals over anti-commuting variables. These Grassmann-valued
matrix models are shown to be equivalent to NxN unitary versions of generalized
Penner matrix models. We explicitly solve for the combinatorics of 't Hooft
diagrams of the matrix integral and develop an orthogonal polynomial
formulation of the statistical theory. An examination of the large N and double
scaling limits of the theory shows that the genus expansion is a Borel summable
alternating series which otherwise coincides with two-dimensional quantum
gravity in the continuum limit. We demonstrate that the partition functions of
these matrix models belong to the relativistic Toda chain integrable hierarchy.
The corresponding string equations and Virasoro constraints are derived and
used to analyse the generalized KdV flow structure of the continuum limit.
","[{""version"":""v1"",""created"":""Sun, 14 May 2000 18:27:07 GMT""},{""version"":""v2"",""created"":""Tue, 23 May 2000 16:11:03 GMT""},{""version"":""v3"",""created"":""Sat, 21 Oct 2000 20:43:51 GMT""}]","2009-10-31"
"hep-th/0005129","Jaume Gomis","Jaume Gomis and Thomas Mehen (Caltech)","Space-Time Noncommutative Field Theories And Unitarity","15 pages, 2 figures, harvmac; references added","Nucl.Phys. B591 (2000) 265-276","10.1016/S0550-3213(00)00525-3",,"hep-th",,"  We study the perturbative unitarity of noncommutative scalar field theories.
Field theories with space-time noncommutativity do not have a unitary S-matrix.
Field theories with only space noncommutativity are perturbatively unitary.
This can be understood from string theory, since space noncommutative field
theories describe a low energy limit of string theory in a background magnetic
field. On the other hand, there is no regime in which space-time noncommutative
field theory is an appropriate description of string theory. Whenever
space-time noncommutative field theory becomes relevant massive open string
states cannot be neglected.
","[{""version"":""v1"",""created"":""Sun, 14 May 2000 23:40:00 GMT""},{""version"":""v2"",""created"":""Tue, 1 Aug 2000 04:25:48 GMT""}]","2009-10-31"
"hep-th/0005130","Harold Blas","Harold Blas","Reduction of affine two-loop WZNW model, the Toda system coupled to the
  matter and topological confinement","31 pages, LaTex",,,,"hep-th hep-ph nlin.SI",,"  The conformal affine Toda model coupled to the matter field (CATM) is
obtained through a classical reduction of the $sl(2)^{(1)}$ affine two-loop
WZNW model. After spontaneously broken the conformal symmetry by means of BRST
analysis, we end up with an effective theory, the so called affine Toda model
coupled to the matter (ATM). Further, using a bosonization technique we recover
from this theory the sine-Gordon model plus a free massless scalar field. The
ATM model is considered as a QCD-motivated integrable field theory, since it
describes various features in the baryonic sector of the low-energy effective
Lagrangian of QCD in two dimensions with one flavor and two colors. Imposing
the equivalence of the Noether and topological currrents as a constraint, it is
shown that the intercharge ``quark''- ``anti-quark'' static potential reveals a
linear confinement behavior for large intercharge separation.
","[{""version"":""v1"",""created"":""Mon, 15 May 2000 00:52:44 GMT""}]","2007-05-23"
"hep-th/0005131","Makoto Nakamura","Sinji Hamamoto (Toyama Univ), Makoto Nakamura (Toyama Univ)","Path-Integral Measures in Higher-Derivative Gravities","11 pages, no figures","Prog.Theor.Phys. 104 (2000) 691-702","10.1143/PTP.104.691","TOYAMA-103","hep-th",,"  A simple method of obtaining path-integral measures in higher-derivative
gravities is presented. The measures are nothing but the generalized Lee-Yang
terms.
","[{""version"":""v1"",""created"":""Mon, 15 May 2000 06:13:46 GMT""}]","2009-10-31"
"hep-th/0005132","Euro Spallucci","S. Ansoldi, C.Castro, E. Spallucci","On the WKB quantum equivalence between diverse p-brane actions","11 pages, Revtex, no figures, final version to appear in Class.&
  Q.Grav.; Title slightly changed, added disussions and references","Class.Quant.Grav.17:L97-L103,2000","10.1088/0264-9381/17/16/101",,"hep-th",,"  We consider an action for a closed, bosonic, p-brane, where the brane tension
is not an assigned parameter but rather it is induced by a maximal rank gauge
p-form. This model is classically equivalent to the Nambu--Goto/Howe-Tucker
model. We investigate how this classical equivalence can be implemented in the
path integral framework. For this purpose we adopt a ``first order''
integration procedure over gauge p-forms and a ``shortened'' Fadeev-Popov
procedure.
","[{""version"":""v1"",""created"":""Mon, 15 May 2000 11:45:13 GMT""},{""version"":""v2"",""created"":""Thu, 27 Jul 2000 12:39:01 GMT""}]","2010-04-06"
"hep-th/0005133","Klaus Kirsten","Klaus Kirsten","Spectral functions in mathematics and physics","51 pages, Invited talk at 2nd La Plata Meeting on Trends in
  Theoretical Physics, Buenos Aires, Argentina, November-December 1998,
  Published in AIP Conference Proceedings 484, page 106, Edited by H. Falomir,
  R.E. Gamboa Saravi and F.A. Schaposnik",,"10.1063/1.59656",,"hep-th",,"  Spectral functions relevant in the context of quantum field theory under the
influence of spherically symmetric external conditions are analysed. Examples
comprise heat-kernels, determinants and spectral sums needed for the analysis
of Casimir energies. First, we summarize that a convenient way of handling them
is to use the associated zeta function. A way to determine all its needed
properties is derived. Using the connection with the mentioned spectral
functions, we provide: i.) a method for the calculation of heat-kernel
coefficients of Laplace-like operators on Riemannian manifolds with smooth
boundaries and ii.) an analysis of vacuum energies in the presence of
spherically symmetric boundaries and external background potentials.
","[{""version"":""v1"",""created"":""Mon, 15 May 2000 12:45:57 GMT""}]","2015-06-25"
"math-ph/0005016","M. A. jafarizadeh","M.A.Jafarizadeh and S. J. Akhtarshenas","Generalized Master Function Approach to Quasi-Exactly Solvable Models","21 Pages",,"10.1063/1.1286879","qs-2000-4","math-ph math.MP",,"  By introducing the generalized master function of order up to four together
with corresponding weight function, we have obtained all quasi-exactly solvable
second order differential equations. It is shown that these differntial
equations have solutions of polynomial type with factorziation properties, that
is polynomial solutions Pm(E) can be factorized in terms of polynomial Pn(E)
for m not equal to n. All known quasi-exactly quantum solvable models can be
obtained from these differential equations, where roots of polynomial Pn(E) are
corresponding eigen-values.
","[{""version"":""v1"",""created"":""Mon, 15 May 2000 09:16:24 GMT""}]","2015-06-26"
"math/0005139","Noam D. Elkies","Noam D. Elkies (Harvard University)","Rational points near curves and small nonzero |x^3-y^2| via lattice
  reduction","31 pages, including 2 numerical tables; invited talk at ANTS-IV (4th
  Algorithmic Number Theory Symposium, Leiden 7/2000). Similar results and
  methods for integer points near curves and higher-dimensional varieties will
  appear elsewhere",,,,"math.NT math.AG math.NA",,"  We give a new algorithm using linear approximation and lattice reduction to
efficiently calculate all rational points of small height near a given plane
curve C. For instance, when C is the Fermat cubic, we find all integer
solutions of |x^3+y^3-z^3|<M with 0<x<=y<z<N in heuristic time << L(N) M [where
L(X):= (log X)^O(1)] provided M>>N, using only O(log N) space. Since the number
of solutions should be asymptotically proportional to M log N (as long as
M<N^3), the computational costs are essentially as low as possible. Moreover
the algorithm readily parallelizes. It not only yields new numerical examples
but leads to theoretical results, difficult open questions, and natural
generalizations. We also adapt our algorithm to investigate Hall's conjecture:
we find all integer solutions of 0<|x^3-y^2|<<x^(1/2) with x<X in time
O(X^(1/2) L(X)). By implementing this algorithm with X=10^18 we shattered the
previous record for x^(1/2)/|x^3-y^2|. The O(X^{1/2} L(X)) bound is rigorous;
its proof also yields new estimates on the distribution mod 1 of sqrt(cx^3) for
any positive rational c.
","[{""version"":""v1"",""created"":""Sun, 14 May 2000 19:00:46 GMT""}]","2007-05-23"
"math/0005140","Noam D. Elkies","Noam D. Elkies (Harvard University)","Explicit towers of Drinfeld modular curves","10 pages. For mini-symposium on ""curves over finite fields and codes""
  at the 3rd European Congress in Barcelona 7/2000 Revised to correct minor
  typographical and grammatical errors",,,,"math.NT math.AG",,"  We give explicit equations for the simplest towers of Drinfeld modular curves
over any finite field, and observe that they coincide with the asymptotically
optimal towers of curves constructed by Garcia and Stichtenoth.
","[{""version"":""v1"",""created"":""Sun, 14 May 2000 20:55:26 GMT""},{""version"":""v2"",""created"":""Wed, 24 May 2000 20:12:29 GMT""}]","2007-05-23"
"math/0005141","Igor Bayak","I.V. Bayak","A lemma on the minimal surfaces","PostScript, 2 pages",,,,"math.GM",,"  Stated lemma contains the assertions about isomorphism of exact m-forms and
exterior differentials of regular m-maps, of linearly harmonic m-forms and
exterior differentials of regular harmonic m-maps, of global minimal
(n-m)-surfaces and level (n-m)-surfaces of regular minimal m-maps. It hold in
n-dimensional Euclidean space.
","[{""version"":""v1"",""created"":""Sun, 14 May 2000 22:04:41 GMT""}]","2007-05-23"
"math/0005142","Alessandro Arsie","Alessandro Arsie","On two simple criteria for recognizing complete intersections in
  codimension 2","10 pages, LaTeX; some hypotheses simplified; due to a
  misunderstanding with Lascu, I apologize for having announced a ""work in
  progress"" in the references, which, unfortunately does not exist!",,,,"math.AG math.AC math.RA",,"  Developing a previous idea of Faltings, we characterize the complete
intersections of codimension 2 in P^n, n>=3, over an algebraically closed field
of any characteristic, among l.c.i. X, as those that are subcanonical and
scheme-theoretically defined by p<=n-1 equations. Moreover, we give some other
results assuming that the normal bundle of X extends to a numerically split
bundle on P^n, p<=n and the characteristic of the base field is zero. Finally,
we give a (partial) answer to a question posed recently by Franco, Kleiman and
Lascu on self-linking and complete intersections in positive characteristic.
","[{""version"":""v1"",""created"":""Mon, 15 May 2000 10:20:27 GMT""},{""version"":""v2"",""created"":""Sat, 20 May 2000 15:50:57 GMT""}]","2007-05-23"
"math/0005143","Yuri I. Manin","Yu. I. Manin","Mirror symmetry and quantization of abelian varieties","24 pp., amstex file, no figures",,,,"math.AG",,"  The paper consists of two sections. The first section provides a new
definition of mirror symmetry of abelian varieties making sense also over
$p$-adic fields. The second section introduces and studies quantized
theta-functions with two-sided multipliers, which are functions on
non-commutative tori. This is an extension of an earlier work by the author. In
the Introduction and in the Appendix the constructions of this paper are put
into a wider context.
","[{""version"":""v1"",""created"":""Mon, 15 May 2000 13:11:28 GMT""}]","2007-05-23"
"math/0005144","Yuri I. Manin","Yuri I. Manin","Moduli, Motives, Mirrors (Plenary talk at the 3rd ECM, Barcelona, July
  10-14, 2000)","22 pages, amstex file, no figures. This version contains some
  corrections, revisions and additions, especially in the subsections 1.5,
  1.5.1, and 2.4",,,,"math.AG",,"  This talk is dedicated to various aspects of Mirror Symmetry. It summarizes
some of the mathematical developments that took place since M. Kontsevich's
report at the Z\""urich ICM and provides an extensive, although not exhaustive,
bibliography.
","[{""version"":""v1"",""created"":""Mon, 15 May 2000 13:26:49 GMT""},{""version"":""v2"",""created"":""Thu, 18 May 2000 14:48:08 GMT""}]","2007-05-23"
"math/0005145","Jerzy Lukierski","S.M. Khoroshkin (Inst. Theor. and Exp. Phys. Moscow, Russia), J.
  Lukierski (Inst. Theor. Phys. Wroclaw University), V.N. Tolstoy (Inst. Nucl.
  Phys. Moscow, Russia)","Quantum Affine (Super)Algebras $U_q(A_{1}^{(1)})$ and $U_q(C(2)^{(2)})$","22 pages, LaTeX","Commun.Math.Phys. 220 (2001) 537-560","10.1007/s002200100461",,"math.QA hep-th",,"  We show that the quantum affine algebra $U_{q}(A_{1}^{(1)})$ and the quantum
affine superalgebra $U_{q}(C(2)^{(2)})$ admit a unified description. The
difference between them consists in the phase factor which is equal to 1 for
$U_{q}(A_{1}^{(1)})$ and it is equal to -1 for $U_{q}(C(2)^{(2)})$. We present
such a description for the actions of the braid group, for the construction of
Cartan-Weyl generators and their commutation relations, as well for the
extremal projector and the universal R-matrix. We give also a unified
description for the 'new realizations' of these algebras together with explicit
calculations of corresponding R-matrices.
","[{""version"":""v1"",""created"":""Mon, 15 May 2000 13:57:59 GMT""}]","2009-10-31"
"math/0005146","Janos Kollar","J\'anos Koll\'ar (Princeton Univ.)","Unirationality of cubic hypersurfaces","11 pages, LaTeX",,,,"math.AG",,"  Segre proved that a smooth cubic surface over Q is unirational iff it has a
rational point. We prove that the result also holds for cubic hypersurfaces
over any field, including finite fields.
","[{""version"":""v1"",""created"":""Mon, 15 May 2000 14:58:19 GMT""}]","2007-05-23"
"nlin/0005027","Yoshio Uwano","Yoshio Uwano","From the Birkhoff-Gustavson normalization to the Bertrand-Darboux
  integrability condition","23 pages, LaTeX (iop.sty), typos and Appendix added","Journal of Physics A, vol.33, 6635-6653 (2000)","10.1088/0305-4470/33/37/315",,"nlin.SI math.DS",,"  The Bertrand-Darboux integrability condition for a certain class of perturbed
harmonic oscillators is studied from the viewpoint of the
Birkhoff-Gustavson(BG)-normalization: By solving an inverse problem of the
BG-normalization on computer algebra, it is shown that if the perturbed
harmonic oscillators with a homogeneous-{\it cubic} polynomial potential and
with a homogeneous-{\it quartic} polynomial potentials admit the same
BG-normalization up to degree-4 then both oscillators satisfy the
Bertrand-Darboux integrability condition.
","[{""version"":""v1"",""created"":""Mon, 15 May 2000 06:52:26 GMT""},{""version"":""v2"",""created"":""Fri, 9 Jun 2000 07:15:05 GMT""},{""version"":""v3"",""created"":""Tue, 8 Aug 2000 07:30:13 GMT""}]","2009-10-31"
"nlin/0005028","Andrey A. Sukhorukov","Andrey A. Sukhorukov, Yuri S. Kivshar, Ole Bang, and Costas M.
  Soukoulis","Parametric localized modes in quadratic nonlinear photonic structures","9 pages, 8 figures","Phys. Rev. E 63, 016615(1-9) (2001)","10.1103/PhysRevE.63.016615",,"nlin.PS",,"  We analyze two-color spatially localized modes formed by parametrically
coupled fundamental and second-harmonic fields excited at quadratic (or chi-2)
nonlinear interfaces embedded into a linear layered structure --- a
quasi-one-dimensional quadratic nonlinear photonic crystal. For a periodic
lattice of nonlinear interfaces, we derive an effective discrete model for the
amplitudes of the fundamental and second-harmonic waves at the interfaces (the
so-called discrete chi-2 equations), and find, numerically and analytically,
the spatially localized solutions --- discrete gap solitons. For a single
nonlinear interface in a linear superlattice, we study the properties of
two-color localized modes, and describe both similarities and differences with
quadratic solitons in homogeneous media.
","[{""version"":""v1"",""created"":""Mon, 15 May 2000 12:46:18 GMT""}]","2007-05-23"
"nlin/0005029","Krzysztof Sacha","Krzysztof Sacha","Non-resonant driving of H atom with broken time-reversal symmetry","4 pages, 2 figures, accepted for publication in J. Phys. B","J. Phys. B, 33, 2617 (2000)","10.1088/0953-4075/33/13/320",,"nlin.CD physics.atom-ph",,"  The dynamics of atomic hydrogen placed in a static electric field and
illuminated by elliptically polarized microwaves is studied in the range of
small field amplitudes where perturbation calculations are applicable. For a
general configuration of the fields any generalized time-reversal symmetry is
broken and, as the classical dynamics is chaotic, the level statistics obeys
the random matrices prediction of Gaussian unitary ensemble.
","[{""version"":""v1"",""created"":""Mon, 15 May 2000 10:06:24 GMT""}]","2009-10-31"
"nucl-ex/0005003","Carlos Bertulani","C.A. Bertulani and D.T. de Paula","The stopping of swift protons in matter and its implication for
  astrophysical fusion reactions","4 figures","Phys.Rev. C62 (2000) 045802","10.1103/PhysRevC.62.045802",,"nucl-ex astro-ph nucl-th physics.atom-ph quant-ph",,"  The velocity dependence of the stopping power of swift protons and deuterons
in low energy collisions is investigated. At low projectile energies the
stopping is mainly due to nuclear stopping and charge exchange of the electron.
The second mechanism dominates after Ep >=200 eV. A dynamical treatment of the
charge exchange mechanism based on two-center electronic wavefunctions yields
very transparent results for the exchange probability. We predict that the
stopping cross sections vary approximately as v to the 1.35 power for
projectile protons on hydrogen targets in the 1 keV energy region.
","[{""version"":""v1"",""created"":""Sun, 14 May 2000 23:03:44 GMT""}]","2009-10-31"
"nucl-ex/0005004","Andreas Wagner","A.Wagner, C.Muentz, H.Oeschler, C.Sturm, R.Barth, M.Cieslak,
  M.Debowski, E.Grosse, P.Koczon, F.Laue, M.Mang, D.Miskowiec, E.Schwab,
  P.Senger, P.Beckerle, D.Brill, Y.Shin, H.Stroebele, W.Walus, B.Kohlmeyer,
  F.Puehlhofer, J.Speer, I.K.Yoo","The Emission Pattern of High-Energy Pions: A New Probe for the Early
  Phase of Heavy Ion Collisions","accepted for publication in Phys. Rev. Lett","Phys.Rev.Lett.85:18-21,2000","10.1103/PhysRevLett.85.18",,"nucl-ex",,"  The emission pattern of charged pions has been measured in Au+Au collisions
at 1 GeV/nucleon incident energy. In peripheral collisions and at target
rapidities, high-energy pions are emitted preferentially towards the target
spectator matter. In contrast, low-energy pions are emitted predominantly in
the opposite direction. The corresponding azimuthal anisotropy is explained by
the interaction of pions with projectile and target spectator matter. This
interaction with the spectator matter causes an effective shadowing which
varies with time during the reaction. Our observations show that high-energy
pions stem from the early stage of the collision whereas low-energy pions
freeze out later.
","[{""version"":""v1"",""created"":""Mon, 15 May 2000 15:33:02 GMT""}]","2008-11-26"
"nucl-th/0005036","Kyrill Bugaev","K. A. Bugaev, M.I. Gorenstein, I.N. Mishustin and W. Greiner","Exactly Soluble Model for Nuclear Liquid-Gas Phase Transition","15 pages","Phys.Rev. C62 (2000) 044320","10.1103/PhysRevC.62.044320",,"nucl-th cond-mat",,"  Thermodynamical properties of nuclear matter undergoing multifragmentation
are studied within a simplified version of the statistical model. An exact
analytical solution has been found for the grand canonical ensemble. Excluded
volume effects are taken into account in the thermodynamically self-consistent
way. In thermodynamic limit the model exhibits a first order liquid-gas phase
transition with specific mixed phase properties. An extension of the model
including the Fisher's term is also studied. The possibility of the second
order phase transition at or above the critical point is demonstrated. The
fragment mass distributions in the different regions of the phase diagram are
discussed.
","[{""version"":""v1"",""created"":""Sun, 14 May 2000 17:26:53 GMT""}]","2009-11-06"
