"astro-ph/0001173","Santi Garcia-Burillo","S.Garcia-Burillo (OAN), J.Martin-Pintado (OAN), A.Fuente (OAN),
  R.Neri(IRAM)","Large-scale shocks in the starburst galaxy NGC253. Interferometer
  mapping of a 600 pc SiO/H13CO+ circumnuclear disk","10 pages (.tex) 8 figures (.fx) 1 table (.t1)","Astron.Astrophys.355:499,2000",,"OAN-2000-02","astro-ph",,"  This paper presents the first high-resolution SiO map made in an external
galaxy. The nucleus of the nearby barred spiral NGC253 has been observed
simultaneously in the v=0, J=2-1 line of SiO and in the J=1-0 line of H13CO+
with the IRAM interferometer, with a resolution of 7.5""x2.6"". Emission from SiO
and H13CO+ is extended in the nucleus of NGC253. The bulk of the SiO/H13CO+
emission arises from a 600pcx250pc circumnuclear disk (CND) with a double
ringed structure. The inner ring, of radius r=60pc, viewed edge-on along
PA=51deg, hosts the nuclear starburst; the outer pseudo-ring opens out as a
spiral-like arc up to r=300pc. The kinematics of the gaseous disk,
characterized by strong non-circular motions, is interpreted in terms of the
resonant response of the gas to the barred potential. The inner ring would
correspond to the inner Inner Lindblad Resonance(iILR), whereas the outer
region is linked to the onset of a trailing spiral wave across the outer ILR
(oILR). Most notably, we report the detection of a molecular gas counterpart of
the giant outflow of hot gas, previously seen in X-ray and optical lines, and
tentatively identified as a dust chimney in the the 450mu continuum band.The
SiO shows a high average fractional abundance in the CND of X(SiO)=1.5x10E-10.
This is more than an order of magnitude above the predicted value of a PDR.
Moreover, X(SiO) varies at least by an order of magnitude between the inner
starburst region, which dominates the global emission, where we derive
X(SiO)=1--2x10E-10, and the outer region, where X(SiO) reaches a few 10E-9. SiO
abundance is also significantly enhanced in the outflow (X(SiO)=3--5x10E-10).
Different mechanisms are explored to explain the unlike chemical processing of
molecular gas within the nucleus.
","[{""version"":""v1"",""created"":""Tue, 11 Jan 2000 12:12:51 GMT""}]","2011-05-23"
"astro-ph/0001174","Naoyuki Tamura","Naoyuki Tamura (1), Chiaki Kobayashi (2), Nobuo Arimoto (2), Tadayuki
  Kodama(3), and Kouji Ohta(1) ((1)Kyoto University, (2)University of Tokyo,
  (3)University of Durham)","Origin of Color Gradients in Elliptical Galaxies","25 pages LaTeX, 9 PostScript figures, accepted for publication in The
  Astronomical Journal",,"10.1086/301333",,"astro-ph",,"  The origin of color gradients in elliptical galaxies is examined by comparing
model gradients with those observed in the Hubble Deep Field. The models are
constructed so as to reproduce color gradients in local elliptical galaxies
either by a metallicity gradient or by an age gradient. By looking back a
sequence of color gradient as a function of redshift, the age - metallicity
degeneracy is solved. The observed color gradients in elliptical galaxies at
$z=0.1-1.0$ agree excellently with those predicted by the metallicity gradient,
while they deviates significantly from those predicted by the age gradient even
at $z \sim 0.3$ and the deviation is getting larger with increasing redshift.
This result does not depend on cosmological parameters and parameters for an
evolutionary model of galaxy within a reasonable range. Thus our results
clearly indicate that the origin of color gradients is not the age but the
stellar metallicity.
","[{""version"":""v1"",""created"":""Tue, 11 Jan 2000 11:56:02 GMT""}]","2009-10-31"
"astro-ph/0001175","Jose F. Gomez","Jose F. Gomez (1), Joaquin Trapero (1), Sergio Pascual (2), Nimesh
  Patel (3), Carmen Morales (1), Jose M. Torrelles (4) ((1) LAEFF-INTA, Madrid,
  Spain, (2) Univ. Complutense, Madrid, Spain, (3) CfA, USA, (4) IEEC-CSIC,
  Barcelona, Spain, and IAA-CSIC, Granada, Spain)","Ammonia observations of the nearby molecular cloud MBM 12","8 pages, 3 figures, accepted by MNRAS",,"10.1046/j.1365-8711.2000.03346.x",,"astro-ph",,"  We present NH3(1,1) and NH3(2,2) observations of MBM 12, the closest known
molecular cloud (65 pc distance), aimed to find evidence for on-going star
formation processes. No local temperature (with a T_rot upper limit of 12 K)
nor linewidth enhancement is found, which suggests that the area of the cloud
we mapped (~ 15' size) is not currently forming stars. Therefore, this close
``starless'' molecular gas region is an ideal laboratory to study the physical
conditions preceding new star formation.
  A radio continuum source was found in Very Large Array archive data, close
but outside the NH3 emission. This source is likely to be a background object.
","[{""version"":""v1"",""created"":""Tue, 11 Jan 2000 11:58:05 GMT""}]","2009-10-31"
"astro-ph/0001176","AC Fabian","A. C. Fabian (Institute of Astronomy, University of Cambridge)","X-rays and Cosmology","6 pages. To appear in proceedings of the ``Large Scale Structure in
  the X-ray Universe'' conference, held in Santorini, Greece, September 1999,
  eds. M. Plionis and I. Georgantopoulos (Editions Frontieres)",,,,"astro-ph",,"  The role of X-ray observations for cosmological studies and conclusions is
briefly explored. X-rays currently yield cosmologically interesting results on
the abundances, evolution and gas content of clusters of galaxies, on the
clustering and evolution of active galaxies and on the X-ray Background. They
are unlikely in the long term future to give the most precise values of the
cosmological parameters, although in the short term the baryon fraction of
clusters and the Sunyaev-Zeldovich effect will remain important determinants
and checks for some parameters. X-rays will however continue to play an
important role in studying the astrophysics of the formation and growth of
black holes, galaxies, groups and clusters. It is possible that this role will
be crucial, if winds from active galaxies are responsible for breaking the
simple gravitational scaling laws for clusters.
","[{""version"":""v1"",""created"":""Tue, 11 Jan 2000 12:34:42 GMT""}]","2007-05-23"
"astro-ph/0001177","Hans J. Deeg","Laurance R. Doyle, Hans J. Deeg, Valerij P. Kozhevnikov, Brian
  Oetiker, Eduardo L. Martin, J. Ellen Blue, Lee Rottler, Remington P.S. Stone,
  Zoran Ninkov, Jon M. Jenkins, Jean Schneider, Edward W. Dunham, Moira F.
  Doyle, Efthimious Paleologou","Observational Limits on Terrestrial-Sized Inner Planets Around the CM
  Draconis System Using the Photometric Transit Method with a Matched-Filter
  Algorithm","text in html format; 2 gif files for equations; 9 gif files for
  figures","Astrophys.J. 535 (2000) 338","10.1086/308830","SETI 01/2000","astro-ph",,"  A lightcurve of the eclipsing binary CM Draconis has been analyzed for the
presence of transits of planets of size >= 2.5 Earth-radii (Re), with periods
of 60 days or less, and in co-planar orbits around the binary system. About 400
million model lightcurves, representing transits from planets with periods
ranging from 7 to 60 days, have been matched/correlated against these data.
This process we call the ""transit detection algorithm"" or TDA. The resulting
`transit-statistics' for each planet candidate allow the quantification of
detection probabilities, and of false alarm rates.
  Our current lightcurve of CM Dra has a coverage of 1014 hours with 26,043
individual points, at a photometric precision between 0.2% and 0.7%. Planets
significantly larger then 3Re would constitute a `supra-noise' detection, and
for periods of 60 days or less, they would have been detected with a
probability of 90%. `Subnoise' detections of smaller planets are more
constrained. For example, 2.5 Re planets with 10-day periods or less would have
been detected with an 80% probability. The necessity for predicted observations
is illustrated with the nine top planet candidates that emerged from our TDA
analysis. They are the planet candidates with the highest transit-statistics
from the 1994-1998 observing seasons and, for them, transits for the 1999
observing season were predicted. Of the seven candidates that were then
observationally tested in 1999, all were ruled out except one, which needs
further observational confirmation. We conclude that the photometric transit
method is a viable way to search for relatively small, inner extrasolar planets
with moderate-sized telescopes using CCD photometry with a matching-filter
analysis.
","[{""version"":""v1"",""created"":""Tue, 11 Jan 2000 12:39:40 GMT""}]","2009-10-31"
"astro-ph/0001178","AC Fabian","A. C. Fabian (Institute of Astronomy, University of Cambridge)","The Energy Output of the Universe","8 pages. Bologna 99 conference",,"10.1063/1.1434622",,"astro-ph",,"  The total energy emitted by the growth of massive black holes is large and
can be 10-50 per cent of that emitted by stars in the universe. I show how the
X-ray Background provides a good measure of this energy and also why most
accretion power is absorbed and re-emitted in the far infrared band. A model
for the obscured growth of massive black holes is presented which accounts for
both the high absorption and the observed black hole to galaxy spheroid mass
correlation. Future missions should detect the obscured X-ray sources
associated with the growth of massive black holes.
","[{""version"":""v1"",""created"":""Tue, 11 Jan 2000 12:54:19 GMT""}]","2009-10-31"
"astro-ph/0001179","I. Georgantopoulos","A.J. Blair, G.C. Stewart, I. Georgantopoulos, B.J. Boyle, R.E.
  Griffiths, T. Shanks, O. Almaini","A deep ROSAT survey XV. the average QSO spectrum and its evolution","7 pages, to appear in the MNRAS",,"10.1046/j.1365-8711.2000.03352.x",,"astro-ph",,"  Using a sample of 165 X-ray selected QSOs from seven deep ROSAT fields we
investigate the X-ray spectral properties of an ``average''radio-quiet broad
line QSO as a function of redshift. The QSO stacked spectra, in the observers
0.1-2 keV band, in five redshift bins over the range 0.1<z<3.2 apparently
harden from an equivalent photon index of 2.6 at z=0.4 to ~2.1 at z=2.4 as seen
in other QSO samples. In contrast, the spectra in the 0.5-2 keV band show no
significant variation in spectral index with redshift. This suggests the
presence of a spectral upturn at low energies (<0.5 keV). Indeed, while at high
redshifts (z>1.0) the single power-law model gives an acceptable fit to the
data over the full energy band, at lower redshifts the spectra need a second
component at low energies, a `soft excess'. Inclusion of a simple model for the
soft excess, i.e. a black-body component (kT~100 eV), results in a significant
improvement to the model fit, and yields power-law slopes of 1.8-1.9, for all
redshift bins. This power-law is not inconsistent, within the error bars, with
those of nearby AGN in the 2-10 keV band, suggesting that the same intrinsic
power-law slope may continue from 10 keV down to below 0.5 keV. We caution that
there is a possibility that the spectral upturn observed may not represent a
real physical component but could be due to co-adding spectra with a large
dispersion in spectral indices. Regardless of the origin of the soft excess,
the average QSO spectrum has important consequences for the origin of the X-ray
background: the average spectra of the typical, faint, high redshift QSO are
significantly steeper than the spectrum of the X-ray background extending the
spectral paradox into the soft 0.1-2 keV X-ray band.
","[{""version"":""v1"",""created"":""Tue, 11 Jan 2000 12:51:31 GMT""}]","2009-10-31"
"astro-ph/0001180","Simon Goodwin","Simon Goodwin (Sussex), Frazer Pearce (Durham) & Peter Thomas (Sussex)","Simulating Supernovae Remnants in Gas Clouds","47 pages ApJ style, 13 figures, submitted to ApJ",,,,"astro-ph",,"  The Hydra $N$-body hydrodynamics code has been modified to model, from the
end of the Sedov phase, the effects of supernovae on the surrounding medium.
The motivation is to investigate the feedback of energy into the
interstellar/intergalactic medium. We compare our results for supernova
remnants (SNRs) in a uniform medium to previous detailed work on the late
evolution of SNRs. The code is found to reproduce the bulk characteristics of
SNRs well. Results on the effects of a single central SNR on Plummer clouds are
presented. The feedback of kinetic energy and the percentage mass loss can be
parameterised in terms of the cloud mass and characteristic radius in a simple
way. The kinetic energy fraction returned to the ISM from a SNR is $<3$ per
cent. The removal of gas from the cold, dense phase and the addition of energy
due to the lowering of the potential energy of a cloud is at least as
significant, if not much more so, than the kinetic energy leaving a cloud.
","[{""version"":""v1"",""created"":""Tue, 11 Jan 2000 13:47:29 GMT""}]","2007-05-23"
"astro-ph/0001181","David Khechinashvili","Janusz Gil, David Khechinashvili, and George Melikidze","On the optical pulsations from the Geminga pulsar","4 pages, 2 figures, submitted to MNRAS",,"10.1086/320216",,"astro-ph",,"  We present a model for generation mechanisms of the optical pulsations
recently detected from the Geminga pulsar. We argue that this is just a
synchrotron radiation emitted along open magnetic field lines at altitudes of a
few light cylinder radii (which requires that Geminga is an almost aligned
rotator), where charged particles acquire non-zero pitch-angles as a result of
the cyclotron absorption of radio waves in the magnetized pair plasma. This
explains self-consistently both the lack of apparent radio emission, at least
at frequencies higher than about 100 MHz, and the optical pulsations from the
Geminga pulsar. From our model it follows that the synchrotron radiation is a
maximum in the infrared band, which suggests that Geminga should also be a
source of a pulsed infrared emission.
","[{""version"":""v1"",""created"":""Tue, 11 Jan 2000 15:00:57 GMT""}]","2009-10-31"
"astro-ph/0001183","Boris Gaensicke","K. Beuermann, P. Wheatley, G. Ramsay, F. Euchner, B.T. Gaensicke","Evidence for a substellar secondary in the magnetic cataclysmic binary
  EF Eridani","4 pages A&A-Latex, 2 Figures, accepted for publication in A&A Letters",,,,"astro-ph",,"  Low-state spectrophotometry of the short-period polar EF Eridani (Porb=81
min) found the system at V=18.0 with no trace of the companion (Wheatley and
Ramsay 1998). We show that the lack of such spectral features implies that the
companion to the white dwarf in EF Eri has a spectral type later than M9 and is
either a transition object at the brink of hydrogen burning or a brown dwarf.
The optical low state spectrum indicates a temperature of the white dwarf of
Teff=9500+-500K. This is one of the coldest white dwarfs in cataclysmic
variables, implying a cooling age t_cool>=10e9 yrs or accretional heating at a
rate as given by gravitational radiation. The large age of the system excludes
a warm brown dwarf as companion. EF Eri has either just passed through the
period minimum of cataclysmic variable stars or has started mass transfer from
an old brown dwarf secondary.
","[{""version"":""v1"",""created"":""Tue, 11 Jan 2000 15:52:18 GMT""}]","2007-05-23"
"astro-ph/0001184","Manolis Plionis","Vaggelis Kolokotronis, Spyros Basilakos, Manolis Plionis, Ioannis
  Georgantopoulos","Testing for substructure in optical and X-ray clusters","To be published in the proceedings of the ""Large-Scale Structure in
  the X-ray Universe"" meeting, Santorini 1999",,,,"astro-ph",,"  We present a detailed study of the morphological features of 22 rich galaxy
clusters. We systematically compare cluster images and morphological parameters
in an attempt to reliably identify possible substructure in both optical and
X-ray images. To this end, we compute moments of the surface-brightness
distribution to estimate ellipticities, center-of-mass shifts and orientations.
We find important correlations between the optical and X-ray morphological
shape parameters. Most of our clusters (17) have a good 1-to-1 correspondence
between the optical and the X-ray images and at least 9 appear to have strong
indications of substructure. This corresponds to a percentage of about 40% in
good accordance with other similar analyses. Finally, 4 out of 22 systems seem
to have distinct subclumps in the optical which are not verified in the X-ray
images, and thus are suspect of being due to optical projection effects. We
assess the significance of results using Monte Carlo simulations.
","[{""version"":""v1"",""created"":""Tue, 11 Jan 2000 15:48:12 GMT""}]","2007-05-23"
"cond-mat/0001105","Loison","D. Loison, A. I. Sokolov, B. Delamotte, S. A. Antonenko, K. D. Schotte
  and H. T. Diep","Critical behavior of frustrated systems: Monte Carlo simulations versus
  Renormalization Group","RevTex, 10 pages, 3 Postscript figures","JETP Letters 76 (2000) 337","10.1134/1.1328451",,"cond-mat.stat-mech",,"  We study the critical behavior of frustrated systems by means of Pade-Borel
resummed three-loop renormalization-group expansions and numerical Monte Carlo
simulations. Amazingly, for six-component spins where the transition is second
order, both approaches disagree. This unusual situation is analyzed both from
the point of view of the convergence of the resummed series and from the
possible relevance of non perturbative effects.
","[{""version"":""v1"",""created"":""Mon, 10 Jan 2000 16:44:30 GMT""}]","2009-10-31"
"cond-mat/0001110","Peeters Francois","V.A. Schweigert and F.M. Peeters","Paramagnetic Meissner effect in mesoscopic samples","4 pages, 6 figures",,,,"cond-mat.supr-con",,"  Using the non-linear Ginzburg-Landau (GL) theory, we study the magnetic
response of different shaped samples in the field-cooled regime (FC). For high
external magnetic fluxes, the conventional diamagnetic response under cooling
down can be followed by the paramagnetic Meissner effect (PME). A second-order
transition from a giant vortex state to a multi-vortex state, with the same
vorticity, occurs at the second critical field which leads to the suppression
of PME.
","[{""version"":""v1"",""created"":""Mon, 10 Jan 2000 17:27:52 GMT""}]","2007-05-23"
"cond-mat/0001111","Juan M. Lopez","JJ Ramasco, JM Lopez, MA Rodriguez","Generic Dynamic Scaling in Kinetic Roughening","4 pages, 2 eps figures, uses epfs. To appear in Phys. Rev. Lett","Phys. Rev. Lett. 84, 2199 (2000)","10.1103/PhysRevLett.84.2199",,"cond-mat.stat-mech",,"  We study the dynamic scaling hypothesis in invariant surface growth. We show
that the existence of power-law scaling of the correlation functions (scale
invariance) does not determine a unique dynamic scaling form of the correlation
functions, which leads to the different anomalous forms of scaling recently
observed in growth models. We derive all the existing forms of anomalous
dynamic scaling from a new generic scaling ansatz. The different scaling forms
are subclasses of this generic scaling ansatz associated with bounds on the
roughness exponent values. The existence of a new class of anomalous dynamic
scaling is predicted and compared with simulations.
","[{""version"":""v1"",""created"":""Mon, 10 Jan 2000 18:03:28 GMT""}]","2009-10-31"
"cond-mat/0001112","Victor Kurasov","V.Kurasov (Saint-Petersburg State University)","Decay on several sorts of heterogeneous centers: Special monodisperse
  approximation in the situation of strong unsymmetry. 3. Numerical results for
  the special monodisperse approximation","LATEX",,,,"cond-mat.stat-mech",,"  The situation of the metastable phase decay on the several types of
heterogeneous centers is considered. This publication directly continues ""
cond-mat@xxx.lanl.gov get 0001104 "", "" cond-mat@xxx.lanl.gov get 0001108 "".
Here we present the numerical results for the floating monodisperse
approximation.
","[{""version"":""v1"",""created"":""Mon, 10 Jan 2000 18:14:25 GMT""}]","2007-05-23"
"cond-mat/0001113","Jaime Ferrer","J. S\'anchez-Ca\~nizares, J. Ferrer, and F. Sols","Non-Linear and Non-Local Meissner Effect in Superconducting Wires","4 pages, 4 postscript figures enclosed",,"10.1103/PhysRevB.63.134504",,"cond-mat.supr-con cond-mat.mes-hall",,"  The structure of the Meissner effect in a current-carrying cylindrical wire
with arbitrary disorder is studied using a numerical procedure that is exact
within the semiclassical approximation. A distribution of currents is found
that is non-monotonous as a function of the radial coordinate. For high
currents, a robust gapless superconducting state develops at the surface of
both clean and dirty leads. Our calculation provides a quantitative theory of
the critical current in realistic wires.
","[{""version"":""v1"",""created"":""Mon, 10 Jan 2000 18:41:53 GMT""}]","2009-10-31"
"cond-mat/0001114","Victor Kurasov","V.Kurasov (Saint-Petersburg State University)","Decay on several sorts of heterogeneous centers: Special monodisperse
  approximation in the situation of strong unsymmetry. 4. Numerical results for
  the approximation of essential asymptotes","LATEX",,,,"cond-mat.stat-mech",,"  The situation of the metastable phase decay on the several types of
heterogeneous centers is considered. This publication directly continues ""
cond-mat@xxx.lanl.gov get 0001104 "", "" cond-mat@xxx.lanl.gov get 0001108"" and ""
cond-mat@xxx.lanl.gov get 0001112 "" . In this section the approximation od the
essential asymptotes is formulated. This approximation is more simple than the
floating monodisperse approximation and the special monodisperse approximation.
The evident advantage of this approximation is the absence of the exponential
nonlinearity.
","[{""version"":""v1"",""created"":""Mon, 10 Jan 2000 18:57:44 GMT""}]","2007-05-23"
"cond-mat/0001115","Donald Candela","Xiaoyu Yang and D. Candela","Potential Energy in a Three-Dimensional Vibrated Granular Medium
  Measured by NMR Imaging","4 pages, 3 figures",,"10.1103/PhysRevLett.85.298",,"cond-mat.soft cond-mat.stat-mech",,"  Fast NMR imaging was used to measure the density profile of a
three-dimensional granular medium fluidized by vertical vibrations of the
container. For container acceleration much larger than gravity, the rise in
center of mass of the granular medium is found to scale as (v0^alpha)/(N^beta)
with alpha = 1.0 +/-0.2 and beta = 0.5 +/- 0.1, where v0 is the vibration
velocity and N is the number of grains in the container. This value for alpha
is significantly less than found previously for experiments and simulations in
one dimension (alpha = 2) and two dimensions (alpha = 1.3-1.5).
","[{""version"":""v1"",""created"":""Mon, 10 Jan 2000 19:13:55 GMT""}]","2009-10-31"
"cond-mat/0001116","Galina V. Shpatakovskaya","G.V.Shpatakovskaya (Institute for Mathematical
  Modelling,RAS,Russia,Moscow)","Semiclassical description of electronic supershells in simple metal
  clusters","6 pages, 1 Postscript figure, Latex","Pis'ma Zh. Eksp. Teor. Fiz. 70 (1999), 333-337",,,"cond-mat.mes-hall",,"  A semiclassical approach for calculating shell effects, that has been used in
atomic and plasma physics, is applied to describe the electronic supershells in
metal clusters. Using the spherical jellium model we give the analytical
expression for the oscillating part of the binding energy of electrons as an
explicit sum of contributions from supershells with quantum numbers 2n_r+l,
3n_r+l, 4n_r+l, ... This expression is written in terms of the classical
characteristics of the motion of an electron with the Fermi energy in a
self-consistent potential. The conditions under which a new supershell appears
and the relative contribution of this shell are studied as a function of the
cluster size and form of the potential. Specific calculations are performed for
a square well.
","[{""version"":""v1"",""created"":""Mon, 10 Jan 2000 19:28:00 GMT""}]","2007-05-23"
"cond-mat/0001117",,"Karl Strobl","On the Consistency of the Deterministic Local Volatility Function Model
  ('implied tree')","LaTeX, 28 pages, no figures. submitted to Intl. J. of Theor. and
  Appl. Finance",,,,"cond-mat.stat-mech math.AP physics.data-an q-fin.ST",,"  We show that the frequent claim that the implied tree prices exotic options
consistently with the market is untrue if the local volatilities are subject to
change and the market is arbitrage-free. In the process, we analyse -- in the
most general context -- the impact of stochastic variables on the P&L of a
hedged portfolio, and we conclude that no model can a priori be expected to
price all exotics in line with the vanilla options market. Calibration of an
assumed underlying process from vanilla options alone must not be overly
restrictive, yet still unique, and relevant to all exotic options of interest.
For the implied tree we show that the calibration to real-world prices allows
us to only price vanilla options themselves correctly. This is usually
attributed to the incompleteness of the market under traditional stochastic
(local) volatility models. We show that some `weakly' stochastic volatility
models without quadratic variation of the volatilities avoid the incompleteness
problems, but they introduce arbitrage. More generally, we find that any
stochastic tradable either has quadratic variation -- and therefore a
$\Ga$-like P&L on instruments with non-linear exposure to that asset -- or it
introduces arbitrage opportunities.
","[{""version"":""v1"",""created"":""Mon, 10 Jan 2000 19:31:34 GMT""}]","2008-12-10"
