"cond-mat/0001118","Mark Newman","M. E. J. Newman (Santa Fe Institute)","Models of the Small World: A Review","9 pages including 3 postscript figures, bibliography updated and
  minor corrections to text in this version","J. Stat. Phys. 101, 819-841 (2000)",,"Santa Fe Institute working paper 99-12-080","cond-mat.stat-mech cond-mat.dis-nn nlin.AO",,"  It is believed that almost any pair of people in the world can be connected
to one another by a short chain of intermediate acquaintances, of typical
length about six. This phenomenon, colloquially referred to as the ``six
degrees of separation,'' has been the subject of considerable recent interest
within the physics community. This paper provides a short review of the topic.
","[{""version"":""v1"",""created"":""Mon, 10 Jan 2000 20:16:35 GMT""},{""version"":""v2"",""created"":""Tue, 9 May 2000 16:55:09 GMT""}]","2007-05-23"
"cond-mat/0001119","Victor Kurasov","V.Kurasov (Saint-Petersburg State University)","Different approaches in the theory of the metastable phase decay on
  several types of heterogeneous centers","LATEX",,,,"cond-mat.stat-mech",,"  The situation of the metastable phase decay on the several types of
heterogeneous centers is considered. The iteration procedure is formulated and
with the help of the avalanche consumption property all iterations can be
calculated. The same procedure is done for the monodisperse approximation. Here
the avalnche consumption is also used to calculate iterations. It is shown that
all iterations with a high number have one and the same structure. It allows to
obtain the functional form of solution and to formulate directly an equation on
the parameter of this functional form.
","[{""version"":""v1"",""created"":""Mon, 10 Jan 2000 20:25:47 GMT""}]","2007-05-23"
"cond-mat/0001120","Enrico Scalas","Enrico Scalas, Rudolf Gorenflo and Francesco Mainardi","Fractional calculus and continuous-time finance","11 pages, no figures, LaTeX2e, submitted to Physica A",,"10.1016/S0378-4371(00)00255-7",,"cond-mat.dis-nn q-fin.ST",,"  In this paper we present a rather general phenomenological theory of
tick-by-tick dynamics in financial markets. Many well-known aspects, such as
the L\'evy scaling form, follow as particular cases of the theory. The theory
fully takes into account the non-Markovian and non-local character of financial
time series. Predictions on the long-time behaviour of the waiting-time
probability density are presented. Finally, a general scaling form is given,
based on the solution of the fractional diffusion equation.
","[{""version"":""v1"",""created"":""Mon, 10 Jan 2000 20:37:03 GMT""}]","2009-10-31"
"cond-mat/0001121","Vilen Melik-Alaverdian","V. Melik-Alaverdian, G. Ortiz, N. E. Bonesteel","Quantum Projector Method on Curved Manifolds","28 pages, 6 figures",,,,"cond-mat.stat-mech",,"  A generalized stochastic method for projecting out the ground state of the
quantum many-body Schr\""odinger equation on curved manifolds is introduced.
This random-walk method is of wide applicability to any second order
differential equation (first order in time), in any spatial dimension. The
technique reduces to determining the proper ``quantum corrections'' for the
Euclidean short-time propagator that is used to build up their path-integral
Monte Carlo solutions. For particles with Fermi statistics the ``Fixed-Phase''
constraint (which amounts to fixing the phase of the many-body state) allows
one to obtain stable, albeit approximate, solutions with a variational
property. We illustrate the method by applying it to the problem of an electron
moving on the surface of a sphere in the presence of a Dirac magnetic monopole.
","[{""version"":""v1"",""created"":""Mon, 10 Jan 2000 21:12:54 GMT""}]","2007-05-23"
"cond-mat/0001122","Loison","D. Loison","""Quasi Universality classes"" in 2D frustrated XY spin systems","34 pages, 28 figures",,,,"cond-mat.stat-mech",,"  Classical XY spins on a two dimensional triangular lattice with
antiferromagnetic interactions are reconsidered. We find that the
Kosterlitz-Thouless transition associated to the U(1) symmetry appears at a
temperature 0.0020(2) below the Ising transition at 0.5122(1) associated to the
Z_2 symmetry. The Ising transition has critical exponents different from the
standard ones. Using extensive Monte Carlo simulations for equilibrium and
dynamical properties we show that the lack of universality observed in previous
studies is due to finite size corrections not taken account. Likewise the
Kosterlitz-Thouless transition has a critical exponent \eta\approx0.36 larger
than the corresponding standard value 0.25. Also the helicity jump at the
critical temperature is smaller than in the ferromagnetic case in disagreement
with theoretical predictions. We try using the concept of an ""quasi
Universality class"" to reconcile the standard critical behavior observable at
higher temperatures with the different quasi universal one close to the
critical region.
","[{""version"":""v1"",""created"":""Mon, 10 Jan 2000 21:28:01 GMT""}]","2007-05-23"
"cond-mat/0001123","Alberto G. Rojo","M. Danckwerts A. R. Goni, C.Thomsen, K.Eberl, and A.G. Rojo","Enhanced vortex damping by eddy currents in superconductor-semiconduc
  tor hybrids","4 figures",,,,"cond-mat.supr-con",,"  An enhancement of vortex-motion damping in thin Pb/In superconducting films
is obtained through coupling to an adjacent two-dimensional electron gas formed
in a modulation-doped GaAs/AlGaAs heterostructure. This effect is observed by
monitoring the power dissipation at the superconductor in the vortex state
while increasing the density of the electron gas using a gate voltage.
Quantitative agreement is found with calculations based on a viscous model of
vortex damping which considers generation of eddy currents in the electron gas
by moving flux lines. In the regime of filamentary and channel vortex flow,
eddy-current damping leads to striking dissipation breakdown due to stopping of
entire vortex channels.
","[{""version"":""v1"",""created"":""Mon, 10 Jan 2000 22:18:25 GMT""}]","2007-05-23"
"cond-mat/0001124","David Collins","G. D. Sanders, K. W. Kim, and W. C. Holton (Department of Electrical
  and Computer Engineering, North Carolina State University)","A scalable solid-state quantum computer based on quantum dot pillar
  structures","11 figures",,"10.1103/PhysRevB.61.7526",,"cond-mat",,"  We investigate an optically driven quantum computer based on electric dipole
transitions within coupled single-electron quantum dots. Our quantum register
consists of a freestanding n-type pillar containing a series of pair wise
coupled asymmetric quantum dots, each with a slightly different energy
structure, and with grounding leads at the top and bottom of the pillar.
Asymmetric quantum wells confine electrons along the pillar axis and a
negatively biased gate wrapped around the center of the pillar allows for
electrostatic confinement in the radial direction. We self-consistently solve
coupled Schrodinger and Poisson equations and develop a design for a
three-qubit quantum register. Our results indicate that a single gate electrode
can be used to localize a single electron in each of the quantum dots. Adjacent
dots are strongly coupled by electric dipole-dipole interactions arising from
the dot asymmetry, thus enabling rapid computation rates. The dots are tailored
to minimize dephasing due to spontaneous emission and phonon scattering and to
maximize the number of computation cycles. The design is scalable to a large
number of qubits.
","[{""version"":""v1"",""created"":""Mon, 10 Jan 2000 22:19:52 GMT""}]","2009-10-31"
"cond-mat/0001125","Artem G. Abanov","Ar. Abanov and Andrey V. Chubukov","SIN and SIS tunneling in cuprates","5 pages, 3 figures","PHYS. REV. B, v61, pR9241 (2000)","10.1103/PhysRevB.61.R9241",,"cond-mat.supr-con cond-mat.str-el",,"  We calculate the SIN and SIS tunneling conductances for the spin-fermion
model. We argue that at strong spin-fermion coupling, relevant to cuprates,
both conductances have dip features near the threshold frequencies when a
tunneling electron begin emitting propagating spin excitation. We argue that
the resonance spin frequency measured in neutron scattering can be inferred
from the tunneling data by analyzing the derivatives of SIN and SIS
conductances.
","[{""version"":""v1"",""created"":""Mon, 10 Jan 2000 23:10:12 GMT""}]","2009-10-31"
"cond-mat/0001126","Koji Hukushima","H. Kawamura and K. Hukushima","Dynamical aspects of a three-dimensional Heisenberg spin glass","9 pages, 8 figures, proceedings of the US-Japan bilateral seminar on
  `Understanding and Conquering L ong Time Scales in Computer Simulations',
  July 1999, to appear in Int. J. Mod. Phys. C",,,,"cond-mat.dis-nn",,"  Spin-glass and chiral-glass orderings of a three-dimensional isotropic
Heisenberg spin glass are studied both by equilibrium and off-equilibrium Monte
Carlo simulations with emphasis on their dynamical aspects. The model is found
to exhibit a finite-temperature chiral-glass transition without the
conventional spin-glass order. Although chirality is an Ising-like quantity
from symmetry, universality class of the chiral-glass transition appears to be
different from that of the standard Ising spin glass. In the off-equilibrium
simulation, while the spin autocorrelation exhibits only an interrupted aging,
the chirality autocorrelation persists to exhibit a pronounced aging effect
reminiscent of the one observered in the mean-field model.
","[{""version"":""v1"",""created"":""Tue, 11 Jan 2000 03:19:36 GMT""}]","2007-05-23"
"cond-mat/0001127","Koji Hukushima","K. Hukushima and H. Kawamura","Chiral-glass transition and replica symmetry breaking of a
  three-dimensional Heisenberg spin glass","4 pages, 4 figures, to appear in Phys.Rev.E",,"10.1103/PhysRevE.61.R1008",,"cond-mat.dis-nn",,"  Extensive equilibrium Monte Carlo simulations are performed for a
three-dimensional Heisenberg spin glass with the nearest-neighbor Gaussian
coupling to investigate its spin-glass and chiral-glass orderings. The
occurrence of a finite-temperature chiral-glass transition without the
conventional spin-glass order is established. Critical exponents characterizing
the transition are different from those of the standard Ising spin glass. The
calculated overlap distribution suggests the appearance of a peculiar type of
replica-symmetry breaking in the chiral-glass ordered state.
","[{""version"":""v1"",""created"":""Tue, 11 Jan 2000 04:02:53 GMT""}]","2009-10-31"
"cond-mat/0001128","Jae Dong Noh","Jae Dong Noh","Roughening and preroughening transitions in crystal surfaces with
  double-height steps","4 pages, 5 figures","Phys. Rev. E Vol. 61, 77 (2000)","10.1103/PhysRevE.61.77",,"cond-mat.stat-mech",,"  We investigate phase transitions in a solid-on-solid model where
double-height steps as well as single-height steps are allowed. Without the
double-height steps, repulsive interactions between up-up or down-down step
pairs give rise to a disordered flat phase. When the double-height steps are
allowed, two single-height steps can merge into a double-height step (step
doubling). We find that the step doubling reduces repulsive interaction
strength between single-height steps and that the disordered flat phase is
suppressed. As a control parameter a step doubling energy is introduced, which
is assigned to each step doubling vertex. From transfer matrix type
finite-size-scaling studies of interface free energies, we obtain the phase
diagram in the parameter space of the step energy, the interaction energy, and
the step doubling energy.
","[{""version"":""v1"",""created"":""Tue, 11 Jan 2000 06:36:29 GMT""}]","2009-10-31"
"cond-mat/0001129","Andrey Geim","A. K. Geim, S. V. Dubonos and J. J. Palacios","Fine Structure in Magnetization of Individual Fluxoid States","in PDF format; 12 pages including 3 pages of figures. Slightly
  extended version of Phys. Rev. Lett. 85, 1528-1531 (2000)","Phys. Rev. Lett. 85, 1528-1531 (2000)","10.1103/PhysRevLett.85.1528",,"cond-mat.supr-con cond-mat.mes-hall",,"  Each time a vortex enters or exits a small superconductor, a different
fluxoid state develops. We have observed splitting and sharp kinks on
magnetization curves of such individual states. The features are the
manifestation of first and second order transitions, respectively, and reveal
the existence of distinct vortex phases within a superconducting state with a
fixed number of fluxoids. We show that the kinks indicate the merger of
individual vortices into a single giant vortex while the splitting is
attributed to transitions between different arrays of the same number of
vortices.
","[{""version"":""v1"",""created"":""Tue, 11 Jan 2000 09:56:58 GMT""}]","2009-10-31"
"cond-mat/0001130","Ralf Stubner","R. Stubner, R. Winkler, O. Pankratov","Generalization of k.p theory for periodic perturbations","minor changes, better typography (9 pages, 5 figures)","Phys. Rev. B 62, 1843 (2000)","10.1103/PhysRevB.62.1843",,"cond-mat",,"  We extend standard k.p theory to take into account periodic perturbations
which are rapidly oscillating with a wavelength of a few lattice constants. Our
general formalism allows us to explicitly consider the Bragg reflections due to
the perturbation-induced periodicity. As an example we calculate the effective
masses in the lowest two conduction bands of spontaneously ordered GaInP_2 as a
function of the degree of ordering. Comparison of our results for the lowest
conduction band to available experimental data and to first principle
calculations shows good agreement.
","[{""version"":""v1"",""created"":""Tue, 11 Jan 2000 10:44:04 GMT""},{""version"":""v2"",""created"":""Fri, 21 Jul 2000 16:40:48 GMT""}]","2009-10-31"
"cond-mat/0001131","Mahesh Chandran","Mahesh Chandran (Tata Institute of Fundamental Research, Mumbai)","Magnetic relaxation in hard type-II superconductors","7 Pages (in Europhys format, .sty included), 5 Figures. To appear in
  Europhysics Letters","Europhys. Lett. Vol. 49 (4), 494-500 (2000).","10.1209/epl/i2000-00176-1",,"cond-mat.supr-con",,"  Magnetic relaxation in a type-II superconductor is simulated for a range of
temperatures (T) in a simple model of 2D Josephson junction array (JJA) with
finite screening. The high-T phase, that is characterised by a single time
scale \tau_{\alpha}, crosses over to an intermediate phase at a lower
temperature T_{cr} wherein a second time scale \tau_{\beta}<<\tau_{\alpha}
emerges. The relaxation in the time window set by \tau_{\beta} follows power
law which is attributed to self-organization of the magnetic flux during
relaxation. Consequently, for T<T_{cr}, a transition from super-critical
(current density J>J_{c}) to sub-critical (J<J_{c}) state separated by an
intermediate state with frozen dynamics is observed. Both \tau_{\alpha} and
\tau_{\beta} diverges at T_{sc}<T_{cr}, marking the transition into a state
with true persistent current.
","[{""version"":""v1"",""created"":""Tue, 11 Jan 2000 10:58:32 GMT""}]","2009-10-31"
"cond-mat/0001132","Roland Hayn","L. Siurakshina, D. Ihle, R. Hayn","Theory of magnetic order in the three-dimensional spatially anisotropic
  Heisenberg model","10 pages, 7 figures",,"10.1103/PhysRevB.61.14601",,"cond-mat.str-el",,"  A spin-rotation-invariant Green's-function theory of long-range and
short-range order (SRO) in the $S=1/2$ antiferromagnetic Heisenberg model with
spatially anisotropic couplings on a simple cubic lattice is presented. The
staggered magnetization, the two-spin correlation functions, the correlation
leng spin-rotation-invariant Green's-function theory of long-range and
short-range order (SRO) in the $S=1/2$ antiferromagnetic Heisenberg model with
spatially anisotropic couplings on a simple cubic lattice is presented. The
staggered magnetization, the two-spin correlation functions, the correlation
lengths, and the static spin susceptibility are calculated self-consistently
over the whole temperature region, where the effects of spatial anisotropy are
explored. As compared with previous spin-wave approaches, the N\'{e}el
temperature is reduced by the improved description of SRO. The maximum in the
temperature dependence of the uniform static susceptibility is shifted with
anisotropy and is ascribed to the decrease of SRO with increasing temperature.
Comparing the theory with experimental data for the magnetization and
correlation length of La$_2$CuO$_4$, a good agreement in the temperature
dependences is obtained.
","[{""version"":""v1"",""created"":""Tue, 11 Jan 2000 13:09:21 GMT""}]","2009-10-31"
"cond-mat/0001133","Gianluca Col\`o","N. Breda, R.A. Broglia, G. Colo`, G. Onida, D. Provasi and E. Vigezzi
  (Dipartimento di Fisica and INFN, Milano, Italy)","Room Temperature Organic Superconductor?","10 pages, 2 figures",,"10.1103/PhysRevB.62.130",,"cond-mat.supr-con",,"  The electron--phonon coupling in fullerene C28 has been calculated from first
principles. The value of the associated coupling constant lambda/N(0) is found
to be a factor three larger than that associated with C60. Assuming similar
values of the density of levels at the Fermi surface N(0) and of the Coulomb
pseudopotential for C28-based solids as those associated with alkali-doped
fullerides A3C60, one obtains Tc(C28) \approx 8 Tc(C60).
","[{""version"":""v1"",""created"":""Tue, 11 Jan 2000 14:08:22 GMT""}]","2009-10-31"
"cond-mat/0001134","Loison","D. Loison and K.D. Schotte","First and second order transition in frustrated XY systems","19 pages, 10 figures","Euro. Phys. J. B 5 (1998) 735","10.1007/s100510050497",,"cond-mat.stat-mech",,"  The nature of the phase transition for the XY stacked triangular
antiferromagnet (STA) is a controversial subject at present. The field
theoretical renormalization group (RG) in three dimensions predicts a first
order transition. This prediction disagrees with Monte Carlo (MC) simulations
which favor a new universality class or a tricritical transition. We simulate
by the Monte Carlo method two models derived from the STA by imposing the
constraint of local rigidity which should have the same critical behavior as
the original model. A strong first order transition is found. Following Zumbach
we analyze the second order transition observed in MC studies as due to a fixed
point in the complex plane. We review the experimental results in order to
clarify the different critical behavior observed.
","[{""version"":""v1"",""created"":""Tue, 11 Jan 2000 14:45:25 GMT""}]","2009-10-31"
"cond-mat/0001135","Loison","D. Loison and K.D. Schotte","First and second order transition of frustrated Heisenberg spin systems","31 pages, 13 figures, to be published in Euro. J. Phys. B",,"10.1007/s100510050113",,"cond-mat.stat-mech",,"  Starting from the hypothesis of a second order transition we have studied
modifications of the original Heisenberg antiferromagnet on a stacked
triangular lattice (STA-model) by the Monte Carlo technique. The change is a
local constraint restricting the spins at the corners of selected triangles to
add up to zero without stopping them from moving freely (STAR-model). We have
studied also the closely related dihedral and trihedral models which can be
classified as Stiefel models. We have found indications of a first order
transition for all three modified models instead of a universal critical
behavior. This is in accordance with the renormalization group investigations
but disagrees with the Monte Carlo simulations of the original STA-model
favoring a new universality class. For the corresponding x-y antiferromagnet
studied before, the second order nature of the transition could also not be
confirmed.
","[{""version"":""v1"",""created"":""Tue, 11 Jan 2000 15:08:00 GMT""}]","2009-10-31"
"cond-mat/0001136","Loison","D. Loison","Phase transitions in generalized chiral or Stiefel's models","9 pages, 8 figures",,"10.1007/PL00011048",,"cond-mat.stat-mech",,"  We study the phase transition in generalized chiral or Stiefel's models using
Monte Carlo simulations. These models are characterized by a breakdown of
symmetry O(N)/O(N-P). We show that the phase transition is clearly first order
for N >= 3 when P=N and P=N-1, contrary to predictions based on the
Renormalization Group in 4-\epsilon expansion but in agreement with a recent
non perturbative Renormalization Group approach.
","[{""version"":""v1"",""created"":""Tue, 11 Jan 2000 14:53:36 GMT""}]","2015-06-24"
"cond-mat/0001137","Martin Weigt","Martin Weigt and Alexander K. Hartmann","The number of guards needed by a museum: A phase transition in vertex
  covering of random graphs","4 pages, 3 eps-figures, new version to be published in Phys. Rev. Let","Phys. Rev. Lett. 84, 6118 (2000)","10.1103/PhysRevLett.84.6118",,"cond-mat.dis-nn cond-mat.stat-mech cs.CC",,"  In this letter we study the NP-complete vertex cover problem on finite
connectivity random graphs. When the allowed size of the cover set is
decreased, a discontinuous transition in solvability and typical-case
complexity occurs. This transition is characterized by means of exact numerical
simulations as well as by analytical replica calculations. The replica
symmetric phase diagram is in excellent agreement with numerical findings up to
average connectivity $e$, where replica symmetry becomes locally unstable.
","[{""version"":""v1"",""created"":""Tue, 11 Jan 2000 14:58:56 GMT""},{""version"":""v2"",""created"":""Wed, 3 May 2000 07:08:43 GMT""}]","2009-10-31"
"cond-mat/0001138","Sergei Nechaev","R. Voituriez and S. Nechaev","Multifractality of entangled random walks and non-uniform hyperbolic
  spaces","28 pages, 11 eps-figures (enclosed)","J. Phys. A 33 (2000) 5631-5652","10.1088/0305-4470/33/32/302",,"cond-mat.stat-mech",,"  Multifractal properties of the distribution of topological invariants for a
model of trajectories randomly entangled with a nonsymmetric lattice of
obstacles are investigated. Using the equivalence of the model to random walks
on a locally nonsymmetric tree, statistical properties of topological
invariants, such as drift and return probabilities, have been studied by means
of a renormalization group (RG) technique. The comparison of the analytical
RG--results with numerical simulations as well as with the rigorous results of
P.Gerl and W.Woess demonstrates clearly the validity of our approach. It is
shown explicitly by direct counting for the discrete version of the model and
by conformal methods for the continuous version that multifractality occurs
when local uniformity of the phase space (which has an exponentially large
number of states) has been broken.
","[{""version"":""v1"",""created"":""Tue, 11 Jan 2000 15:06:39 GMT""},{""version"":""v2"",""created"":""Tue, 6 Mar 2001 17:17:26 GMT""}]","2009-10-31"
"cs/0001007","Stefaan De Cnodder","Stefaan De Cnodder, Omar Elloumi, Kenny Pauwels","RED behavior with different packet sizes","13 pages, submitted to IEEE symposium on computer communications
  (ISCC2000)",,"10.1109/ISCC.2000.860741",,"cs.NI",,"  We consider the adaptation of random early detection (RED) as a buffer
management algorithm for TCP traffic in Internet gateways where different
maximum transfer units (MTUs) are used. We studied the two RED variants
described in [4] and point out a weakness in both. The first variant where drop
probability is independent from the packet size discriminates connections with
smaller MTUs. The second variant results in a very high packet loss ratio
(PLR), and as a consequence low goodput, for connections with higher MTUs. We
show that fairness in terms of loss and goodput can be supplied through an
appropriate setting of the RED algorithm.
","[{""version"":""v1"",""created"":""Mon, 10 Jan 2000 16:33:15 GMT""}]","2016-11-18"
"gr-qc/0001022","Victor Flambaum","V. V. Flambaum and J. C. Berengut","Atom made from charged elementary black hole","22 pages, 4 figures","Phys.Rev.D63:084010,2001","10.1103/PhysRevD.63.084010",,"gr-qc astro-ph hep-th physics.atom-ph",,"  It is believed that there may have been a large number of black holes formed
in the very early universe. These would have quantised masses. A charged
``elementary black hole'' (with the minimum possible mass) can capture
electrons, protons and other charged particles to form a ``black hole atom''.
We find the spectrum of such an object with a view to laboratory and
astronomical observation of them, and estimate the lifetime of the bound
states. There is no limit to the charge of the black hole, which gives us the
possibility of observing Z>137 bound states and transitions at the lower
continuum. Negatively charged black holes can capture protons. For Z>1, the
orbiting protons will coalesce to form a nucleus (after beta-decay of some
protons to neutrons), with a stability curve different to that of free nuclei.
In this system there is also the distinct possibility of single quark capture.
This leads to the formation of a coloured black hole that plays the role of an
extremely heavy quark interacting strongly with the other two quarks. Finally
we consider atoms formed with much larger black holes.
","[{""version"":""v1"",""created"":""Mon, 10 Jan 2000 21:38:49 GMT""}]","2009-08-18"
"gr-qc/0001024","Gennadii Varzugin","G. G. Varzugin","The inverse scattering method for cylindrical gravitational waves","11 pages, LaTeX, no figures, discussion added, some misprints
  corrected",,,,"gr-qc",,"  The initial-value problem for cylindrical gravitational waves is studied
through the development of the inverse scattering method scheme. The inverse
scattering transform in this case can be viewed as a transformation of the
Cauchy data to the data on the symmetry axis. Riemann-Hilbert problem, which
serves as inverse transformation, is formulated in two different ways. We
consider Einstein-Rosen waves to illustrate the method.
","[{""version"":""v1"",""created"":""Mon, 10 Jan 2000 22:25:54 GMT""},{""version"":""v2"",""created"":""Mon, 7 Feb 2000 13:27:30 GMT""}]","2007-05-23"
