"astro-ph/0001377","Abdul I. Asvarov","A.I.Asvarov","Diffusive Shock Acceleration of Electrons and Radio Emission from Large
  Diameter Shell-Type Supernova Remnants","4 pages, 1 figure, in Proc.of the 26th International Cosmic Ray
  Conference, Vol.III,p.472 (OG 2.2.10), corrected some typos",,,,"astro-ph",,"  In present study I examine the capability of diffusive shock acceleration
mechanism to explain existing data on radio emission from evolved large
diameter shell-type adiabatic supernova remnants (SNRs). Time-dependent
''onion-shell'' model for the radio emission of SNRs is developed, which is
based on the assumptions: a) acceleration takes place from thermal energies and
test-particle approximation is valid; b) the problem of injection is avoided by
introducing, like Bell (1978), two injection parameters; c) to take into
consideration very late stages of SNR evolution the analytic approximation of
Cox and Andersen (1982) for the shell structure is used; c)no radiative
cooling. Constructed Surface Brightness - Diameter $(\Sigma -D)$ tracks are
compared with the empirical $\Sigma -D$ diagram. The main conclusion of the
study is that the DSA mechanism is capable of explaining all the statistics of
radio SNRs including very large diameter remnants and giant galactic loops.
","[{""version"":""v1"",""created"":""Fri, 21 Jan 2000 12:14:53 GMT""}]","2007-05-23"
"astro-ph/0001378","Norbert Christlieb","Norbert Christlieb (Hamburger Sternwarte, Germany), Timothy C. Beers
  (Department of Physics & Astronomy,Michigan State University, USA)","Ongoing Large Surveys for Metal-Poor Stars in the Galactic Halo","To appear in: M. Takada-Hidai (ed.), Proceedings of Workshop on
  Subaru HDS, held in Tokyo, December 8.--10., 1999. 19 pages, 6 figures (1 of
  which is in Level 2), 0.6MB compressed postscript",,,,"astro-ph",,"  We report on two major surveys for metal-poor stars in the galactic halo, the
HK survey, and the Hamburg/ESO survey, which have been undertaken in order to
provide targets for high-resolution spectroscopy with the Subaru HDS and other
large telescopes. We compare basic properties of these two surveys and their
current status, and add some historical remarks.
  The candidate selection procedures of both surveys are described in detail.
We evaluate the candidate selection by comparing effective yields (EYs) of the
survey techniques for the identification of metal-poor stars. It is found that
EY for stars below [Fe/H]=-2.0 in the HES can be up to 80% for stars selected
by automatic classification from machine-scanned unwidened plates, whereas in
the HK survey, where stars are selected by visual inspection of widened survey
plates, the EY is between 11% and 32%, depending on whether a pre-selection
based on BV photometry has been applied.
  Finally, we describe techniques used for determining stellar parameters of
the survey stars by means of moderate resolution follow-up spectroscopy, and
additional UBV photometry. While follow-up observations of HES stars have just
been started, the HK survey has already produced a list of ~4700 stars with
estimates of [Fe/H] typically precise to +/-0.2 dex, some 1000 of which have
[Fe/H]<-2.0, and roughly 100 of which have [Fe/H]<-3.0.
","[{""version"":""v1"",""created"":""Fri, 21 Jan 2000 14:06:09 GMT""}]","2007-05-23"
"astro-ph/0001379","Ralf Klessen","Ralf S. Klessen (Leiden Observatory, NL)","One-Point Probability Distribution Functions of Supersonic Turbulent
  Flows in Self-Gravitating Media","38 pages (incl. 17 figures), accepted for publication in ApJ, also
  available with full resolution figures at
  http://www.strw.leidenuniv.nl/~klessen/Preprints","Astrophys.J.535:869-886,2000","10.1086/308854",,"astro-ph",,"  Turbulence is essential for understanding the structure and dynamics of
molecular clouds and star-forming regions. There is a need for adequate tools
to describe and characterize the properties of turbulent flows. One-point
probability distribution functions (pdf's) of dynamical variables have been
suggested as appropriate statistical measures and applied to several observed
molecular clouds. However, the interpretation of these data requires comparison
with numerical simulations. To address this issue, SPH simulations of driven
and decaying, supersonic, turbulent flows with and without self-gravity are
presented. In addition, random Gaussian velocity fields are analyzed to
estimate the influence of variance effects. To characterize the flow
properties, the pdf's of the density, of the line-of-sight velocity centroids,
and of the line centroid increments are studied. This is supplemented by a
discussion of the dispersion and the kurtosis of the increment pdf's, as well
as the spatial distribution of velocity increments for small spatial lags. From
the comparison between different models of interstellar turbulence, it follows
that the inclusion of self-gravity leads to better agreement with the observed
pdf's in molecular clouds. The increment pdf's for small spatial lags become
exponential for all considered velocities. However, all the processes
considered here lead to non-Gaussian signatures, differences are only gradual,
and the analyzed pdf's are in addition projection dependent. It appears
therefore very difficult to distinguish between different physical processes on
the basis of pdf's only, which limits their applicability for adequately
characterizing interstellar turbulence.
","[{""version"":""v1"",""created"":""Fri, 21 Jan 2000 14:11:55 GMT""}]","2008-11-26"
"astro-ph/0001380","Montanet","F. Montanet (on behalf of the ANTARES collaboration)","Design and expected performance of the ANTARES neutrino telescope","Talk given at TAUP99, the Sixth International Workshop on Topics in
  Astroparticle and Underground Physics, College de France, Paris, France,
  September 6-10, 1999 3 pages","Nucl.Phys.Proc.Suppl. 87 (2000) 436-438","10.1016/S0920-5632(00)00715-5",,"astro-ph",,"  The ANTARES Collaboration is aiming at the construction and the operation of
a large undersea neutrino telescope for neutrino astronomy, neutrino
oscillation and indirect dark matter searches. Started 3 years ago an intensive
R&D program has shown the feasibility of such a detector in the deep waters of
the Mediterranean sea. We have now started the design and the construction of a
0.1 km(^{2}) detector for which the expected performance will be briefly
described here.
","[{""version"":""v1"",""created"":""Fri, 21 Jan 2000 15:25:05 GMT""}]","2009-10-31"
"cond-mat/0001297","You-Quan Li","You-Quan Li (Augsburg U./ZIMP Zhejiang U.) Shi-Jian Gu, Zu-JianYing
  (ZIMP Zhejiang U.), Ulrich Eckern (Augsburg U.)","One dimensional model for doubly degenerate electrons","Revtex, 21 pages including 9 figures, PRB version","Phys. Rev. B 62(8), 4866-4879 (2000)","10.1103/PhysRevB.62.4866",,"cond-mat.str-el math-ph math.MP",,"  A Hubbard-like model with SU(4) symmetry for electrons with two-fold orbital
degeneracy is studied extensively. Exact solution in one dimension is derived
by means of Bethe ansatz, where the sites are supposed to be occupied by at
most two electrons. The features of ground state and excited states for
repulsive coupling are shown. For finite N number of electrons, the
configurations of quantum numbers are given explicitly and the spectra of
excitations are obtained by solving the Bethe-ansatz equation numerically. For
infinite N, the ground state and various kinds of low-lying excitations are
obtained on the basis of thermodynamics limit.
","[{""version"":""v1"",""created"":""Thu, 20 Jan 2000 18:31:07 GMT""},{""version"":""v2"",""created"":""Wed, 20 Sep 2000 12:15:45 GMT""}]","2009-10-31"
"cond-mat/0001298","Aronson Igor","I.S. Aranson, V.A. Kalatsky, and V.M. Vinokur","Continuum field description of crack propagation","4 pages, 5 figures, submitted to Phys. Rev. Lett. Additional
  information can be obtained from http://gershwin.msd.anl.gov/theory",,"10.1103/PhysRevLett.85.118",,"cond-mat.mtrl-sci cond-mat.soft",,"  We develop continuum field model for crack propagation in brittle amorphous
solids. The model is represented by equations for elastic displacements
combined with the order parameter equation which accounts for the dynamics of
defects. This model captures all important phenomenology of crack propagation:
crack initiation, propagation, dynamic fracture instability, sound emission,
crack branching and fragmentation.
","[{""version"":""v1"",""created"":""Thu, 20 Jan 2000 19:28:02 GMT""}]","2016-08-31"
"cond-mat/0001299",,"Alan J. Bray and Andrea Cavagna","Coarsening Dynamics of a Nonconserved Field Advected by a Uniform Shear
  Flow","RevTex, 4 pages","J. Phys. A: Math. Gen. 33, L305 (2000).","10.1088/0305-4470/33/33/101",,"cond-mat.stat-mech",,"  We consider the ordering kinetics of a nonconserved scalar field advected by
a uniform shear flow. Using the Ohta-Jasnow-Kawasaki approximation, modified to
allow for shear-induced anisotropy, we calculate the asymptotic time dependence
of the characteristic length scales, L_parallel and L_perp, that describe the
growth of order parallel and perpendicular to the mean domain orientation. In
space dimension d=3 we find, up to constants, L_parallel = gamma t^{3/2},
L_perp = t^{1/2}, where gamma is the shear rate, while for d = 2 we find
L_parallel = gamma^{1/2} t (ln t)^{1/4}, L_perp = gamma^{-1/2}(ln t)^{-1/4} .
Our predictions for d=2 can be tested by experiments on twisted nematic liquid
crystals.
","[{""version"":""v1"",""created"":""Thu, 20 Jan 2000 20:41:26 GMT""}]","2009-10-31"
"cond-mat/0001300","Ahmed A. Maarouf","Ahmed A. Maarouf, Charles L. Kane and Eugene J. Mele","Electronic Structure of Carbon Nanotube Ropes","15 pages, 10 eps figures","Phys. Rev. B 61, 11156(2000)","10.1103/PhysRevB.61.11156",,"cond-mat.mes-hall",,"  We present a tight binding theory to analyze the motion of electrons between
carbon nanotubes bundled into a carbon nanotube rope. The theory is developed
starting from a description of the propagating Bloch waves on ideal tubes, and
the effects of intertube motion are treated perturbatively in this basis.
Expressions for the interwall tunneling amplitudes between states on
neighboring tubes are derived which show the dependence on chiral angles and
intratube crystal momenta. We find that conservation of crystal momentum along
the tube direction suppresses interwall coherence in a carbon nanorope
containing tubes with random chiralities. Numerical calculations are presented
which indicate that electronic states in a rope are localized in the transverse
direction with a coherence length corresponding to a tube diameter.
","[{""version"":""v1"",""created"":""Thu, 20 Jan 2000 20:51:33 GMT""}]","2009-10-31"
"cond-mat/0001301","Dziarmaga Jacek","Diego A.R. Dalvit, Jacek Dziarmaga, and Wojciech H.Zurek","Decoherence in Bose-Einstein Condensates: towards Bigger and Better
  Schroedinger Cats","12 pages in RevTex; improved presentation; a new comment on
  decoherence-free pointer subspaces in BEC; accepted in Phys.Rev.A",,"10.1103/PhysRevA.62.013607",,"cond-mat quant-ph",,"  We consider a quantum superposition of Bose-Einstein condensates in two
immiscible internal states. A decoherence rate for the resulting Schroedinger
cat is calculated and shown to be a significant threat to this macroscopic
quantum superposition of BEC's. An experimental scenario is outlined where the
decoherence rate due to the thermal cloud is dramatically reduced thanks to
trap engineering and ""symmetrization"" of the environment which allow for the
Schroedinger cat to be an approximate pointer states.
","[{""version"":""v1"",""created"":""Thu, 20 Jan 2000 22:21:46 GMT""},{""version"":""v2"",""created"":""Wed, 5 Apr 2000 17:51:48 GMT""}]","2009-10-31"
"cond-mat/0001302","Didier Sornette","D. Sornette (UCLA and CNRS-University of Nice) and A. Sornette
  (University of Nice)","Acoustic fluidization for earthquakes?","13 pages","Bull. Seism. Soc. Am. 90 (3), 781-785 (2000)","10.1785/0119990040",,"cond-mat.stat-mech physics.geo-ph",,"  Melosh [1996] has suggested that acoustic fluidization could provide an
alternative to theories that are invoked as explanations for why some crustal
faults appear to be weak. We show that there is a subtle but profound
inconsistency in the theory that unfortunately invalidates the results. We
propose possible remedies but must acknowledge that the relevance of acoustic
fluidization remains an open question.
","[{""version"":""v1"",""created"":""Thu, 20 Jan 2000 23:45:01 GMT""}]","2015-06-24"
"cond-mat/0001304","Tomo Munehisa","T. Munehisa and Y.Munehisa","A Method to Calculate a Delta Function of the Hamiltonian by the
  Suzuki-Trotter Decomposition","13 pages, 8 figures(eps-files), latex",,,,"cond-mat.mtrl-sci",,"  We propose a new method to calculate expectation values of a delta function
of the Hamiltonian, < \Psi \mid \delta(\hat{H} - E)\mid \Psi >. Since the delta
function can be replaced with a Gaussian function, we evaluate < \Psi \mid
\sqrt{\frac{\beta}{\pi}} e^{-\beta (\hat{H} - E)^2} \mid \Psi > with large
\beta adopting the Suzuki-Trotter decomposition. Errors of the approximate
calculations with the finite Trotter number N_t are estimated to be O(1/N_t^K)
for the Kth-order decomposition. The distinct advantage of this method is that
the convergence is guaranteed even when the state \mid \Psi > contains the
eigenstates whose energies spread over the wide range. In this paper we give a
full description of our method within the quantum mechanical physics and
present the numerical results for the harmonic oscillator problems in one- and
three-dimensional space.
","[{""version"":""v1"",""created"":""Fri, 21 Jan 2000 07:09:02 GMT""}]","2007-05-23"
"cond-mat/0001305","Pragya Shukla","Pragya Shukla","Alternative Technique for ""Complex"" Spectra Analysis","20 pages, No figures, Revised Version (Minor Changes)","Physical Review E, 62, 2098, (2000)","10.1103/PhysRevE.62.2098",,"cond-mat.stat-mech",,"  . The choice of a suitable random matrix model of a complex system is very
sensitive to the nature of its complexity. The statistical spectral analysis of
various complex systems requires, therefore, a thorough probing of a wide range
of random matrix ensembles which is not an easy task. It is highly desirable,
if possible, to identify a common mathematcal structure among all the ensembles
and analyze it to gain information about the ensemble- properties. Our
successful search in this direction leads to Calogero Hamiltonian, a
one-dimensional quantum hamiltonian with inverse-square interaction, as the
common base. This is because both, the eigenvalues of the ensembles, and, a
general state of Calogero Hamiltonian, evolve in an analogous way for arbitrary
initial conditions. The varying nature of the complexity is reflected in the
different form of the evolution parameter in each case. A complete
investigation of Calogero Hamiltonian can then help us in the spectral analysis
of complex systems.
","[{""version"":""v1"",""created"":""Fri, 21 Jan 2000 07:13:09 GMT""},{""version"":""v2"",""created"":""Fri, 8 Sep 2000 03:11:59 GMT""}]","2009-10-31"
"cond-mat/0001306","Toni Ramsak","Anton Ramsak (1 and 2) and Igor Sega (1) ((1) J. Stefan Institute,
  Ljubljana, Slovenia, (2) Faculty of Mathematics and Physics, University of
  Ljubljana, Ljubljana, Slovenia)","Electron momentum distribution of a single mobile hole in the t-J model","M2S - submitted to Physica C","Physica C, 341-348 (1-4) (2000) 193","10.1016/S0921-4534(00)00443-3","IJP-TP-2000/1","cond-mat.str-el",,"  We investigate the electron momentum distribution function (EMDF) for the
two-dimensional t-J model. The results are based on the self-consistent Born
approximation (SCBA) for the self-energy and the wave function. In the Ising
limit of the model we give the results in a closed form, in the Heisenberg
limit the results are obtained numerically. An anomalous momentum dependence of
EMDF is found and the anomaly is in the lowest order in number of magnons
expressed analitycally. We interpret the anomaly as a fingerprint of an
emerging large Fermi surface coexisting with hole pockets.
","[{""version"":""v1"",""created"":""Fri, 21 Jan 2000 07:42:58 GMT""}]","2015-06-24"
"cond-mat/0001307","Toni Ramsak","Peter Prelovsek (1 and 2) and Anton Ramsak (1 and 2) ((1) J. Stefan
  Institute, Ljubljana, Slovenia, (2) Faculty of Mathematics and Physics,
  University of Ljubljana, Ljubljana, Slovenia)","Pseudo gap in the density of states in cuprates","M2S - submitted to Physica C","Physica C, 341-348 (1-4) (2000) 893","10.1016/S0921-4534(00)00722-X","IJP-TP-2000/2","cond-mat.str-el",,"  In the framework of the t-J model for cuprates we analyze the development of
a pseudo gap in the density of states (DOS), which at low doping starts to
emerge for temperatures T<J and persists up to the optimum doping. The analysis
is based on numerical results for spectral functions obtained with the
finite-temperature Lanczos method for finite two-dimensional clusters. We find
that the pseudo gap scales with J and is robust also in the presence of nearest
neighbor repulsive interaction. Numerical results are additionally compared
with the self consistent Born approximation (SCBA) results for hole-like
(photoemission) and electron-like (inverse photoemission) spectra at T=0. The
analysis is suggesting that the origin of the pseudo gap is in short-range
antiferromagnetic (AFM) spin correlations and strong asymmetry between the hole
and electron spectra in the underdoped regime.
","[{""version"":""v1"",""created"":""Fri, 21 Jan 2000 08:09:50 GMT""}]","2015-06-24"
"cond-mat/0001308","David Menashe","D. Menashe, O. Biham, B. D. Laikhtman, and A. L. Efros","Glassy properties and localization of interacting electrons in
  two-dimensional systems","10 pages, 3 ps figures, submitted to EuroPhys. Lett",,,,"cond-mat.dis-nn cond-mat.mes-hall",,"  We present a computer simulation study of a disordered two-dimensional system
of localized interacting electrons at thermal equilibrium. It is shown that the
configuration of occupied sites within the Coulomb gap persistently changes at
temperatures much less than the gap width. This is accompanied by large time
dependent fluctuations of the site energies. The observed thermal equilibration
at low temperatures suggests a possible glass transition only at T=0. We
interpret the strong fluctuations in the occupation numbers and site energies
in terms of the drift of the system between multiple energy minima. The results
also imply that interacting electrons may be effectively delocalized within the
Coulomb gap. Insulating properties, such as hopping conduction, appear as a
result of long equilibration times associated with glassy dynamics. This may
shine new light on the relation between the metal-insulator transition and
glassy behavior.
","[{""version"":""v1"",""created"":""Fri, 21 Jan 2000 08:20:37 GMT""}]","2007-05-23"
"cond-mat/0001309",,"S. Sengupta, P. Nielaba, K. Binder","Defect fugacity, Spinwave Stiffness and T_c of the 2-d Planar Rotor
  Model","7 pages, 4 figures",,"10.1209/epl/i2000-00322-3",,"cond-mat.stat-mech",,"  We obtain precise values for the fugacities of vortices in the 2-d planar
rotor model from Monte Carlo simulations in the sector with {\em no} vortices.
The bare spinwave stiffness is also calculated and shown to have significant
anharmonicity. Using these as inputs in the KT recursion relations, we predict
the temperature T_c = 0.925, using linearised equations, and $T_c = 0.899 \pm
>.005$ using next higher order corrections, at which vortex unbinding commences
in the unconstrained system. The latter value, being in excellent agreement
with all recent determinations of T_c, demonstrates that our method 1)
constitutes a stringent measure of the relevance of higher order terms in KT
theory and 2) can be used to obtain transition temperatures in similar systems
with modest computational effort.
","[{""version"":""v1"",""created"":""Fri, 21 Jan 2000 08:22:53 GMT""}]","2016-08-31"
"cond-mat/0001310","X. S. Rao","X. S. Rao, C. K. Ong and Y. P. Feng","Q-Factor Measurement of Nonlinear Superconducting Resonators","12 pages, 4 figures, to appear in Electronics Letters",,,,"cond-mat.supr-con",,"  A novel method, which combined a multi-bandwidth measurement and an
extrapolation procedure, is proposed for extracting the loaded Q-factor (Q_{L})
with improved accuracy from non-Lorentzian resonances of nonlinear
superconducting resonators.
","[{""version"":""v1"",""created"":""Fri, 21 Jan 2000 08:33:31 GMT""}]","2007-05-23"
"cond-mat/0001311","Roberto Di Leonardo","R. Di Leonardo, L. Angelani, G. Parisi, G. Ruocco","Off-Equilibrium Effective Temperature in Monatomic Lennard-Jones Glass","4 pages,4 figures","Phys. Rev. Lett. 84, 6054 (2000)","10.1103/PhysRevLett.84.6054",,"cond-mat.dis-nn cond-mat.soft",,"  The off-equilibrium dynamics of a monatomic Lennard-Jones glass is
investigated after sudden isothermal density jumps (crunch) from well
equilibrated liquid configurations towards the glassy state. The generalized
fluctuation-dissipation relation has been studied and the temperature
dependence of the violation factor m is found in agreement with the one step
replica symmetry breaking scenario, i.e. at low temperature m(T) is found
proportional to T up to an off-equilibrium effective temperature T_eff, where
m(T_eff)=1. We report T_eff as a function of the density and compare it with
the glass transition temperatures T_g as determined by equilibrium
calculations.
","[{""version"":""v1"",""created"":""Fri, 21 Jan 2000 11:03:50 GMT""}]","2009-10-31"
"cond-mat/0001312","Alexander Dzyubenko","A.B. Dzyubenko","Two-dimensional charged electron-hole complexes in magnetic fields:
  Keeping magnetic translations preserved","11 pages, 1 figure, LaTeX2e, using elsart.cls (included). To be
  published in Solid State Commun. 113, No.12, 683 (2000)",,"10.1016/S0038-1098(99)00556-6",,"cond-mat.mes-hall cond-mat.str-el",,"  Eigenstates of 2D charged electron-hole complexes in magnetic fields are
considered. The operator formalism that allows one to partially separate the
center-of-mass motion from internal degrees of freedom is presented. The scheme
using magnetic translations is developed for calculating in strong magnetic
fields the eigenspectra of negatively charged excitons X^-, a bound state of
two electrons and one hole.
","[{""version"":""v1"",""created"":""Fri, 21 Jan 2000 12:46:36 GMT""}]","2009-10-31"
"cond-mat/0001313","Xenophon Zotos","X. Wang, X. Zotos, J. Karadamoglou and N. Papanicolaou","Thermodynamics of the spin-flop transition in a quantum XYZ chain","4 pages, 6 Postscript figures",,"10.1103/PhysRevB.61.14303",,"cond-mat",,"  A special limit of an antiferromagnetic XYZ chain was recently shown to
exhibit interesting bulk as well as surface spin-flop transitions at T=0. Here
we provide a complete calculation of the thermodynamics of the bulk transition
using a transfer-matrix-renormalization-group (TMRG) method that addresses
directly the thermodynamic limit of quantum spin chains. We also shed some
light on certain spinwave anomalies at low temperature predicted earlier by
Johnson and Bonner.
","[{""version"":""v1"",""created"":""Fri, 21 Jan 2000 13:15:45 GMT""}]","2009-10-31"
"cond-mat/0001314","Masanori Yamanaka","Atsuo Satou, Masanori Yamanaka","Quantization of Hall Conductance in Double Exchange Systems: Topology
  and Lattice Gauge Field","5 pages, 2 figures, revtex, corrected some typos, accepted for
  publication in PRB",,,,"cond-mat.mes-hall cond-mat.stat-mech cond-mat.str-el",,"  We study quantization conditions of the Hall conductivity for a two
dimensional system described by a double exchange Hamiltonian with and without
an external magnetic field. This is obtained by an extension of the topological
arguments familiar from the theory of the integer quantum Hall effect. The
quantization conditions are related to spontaneous breaking of spin O(3),
time-reversal, and spin chiral symmetries. Extension to systems with higher
dimensions is briefly discussed.
","[{""version"":""v1"",""created"":""Fri, 21 Jan 2000 13:34:18 GMT""},{""version"":""v2"",""created"":""Mon, 26 Mar 2001 07:00:02 GMT""}]","2007-05-23"
"cond-mat/0001315","Parthapratim Biswas","P. Biswas, P. Cain, R.A. Roemer, and M. Schreiber","Off-diagonal disorder in the Anderson model of localization","12 pages including 4 EPS figures, accepted for publication in phys.
  stat. sol. (b)",,"10.1002/(SICI)1521-3951(200003)218:1<205::AID-PSSB205>3.3.CO;2-2",,"cond-mat.dis-nn",,"  We examine the localization properties of the Anderson Hamiltonian with
additional off-diagonal disorder using the transfer-matrix method and
finite-size scaling. We compute the localization lengths and study the
metal-insulator transition (MIT) as a function of diagonal disorder, as well as
its energy dependence. Furthermore we investigate the different influence of
odd and even system sizes on the localization properties in quasi
one-dimensional systems. Applying the finite-size scaling approach in
conjunction with a nonlinear fitting procedure yields the critical parameters
of the MIT. In three dimensions, we find that the resulting critical exponent
of the localization length agrees with the exponent for the Anderson model with
pure diagonal disorder.
","[{""version"":""v1"",""created"":""Fri, 21 Jan 2000 15:16:34 GMT""}]","2015-06-24"
