"cond-mat/0001316","Toni Ramsak","A. Ramsak (1 and 2), I. Sega (1), and P. Prelovsek (1 and 2) ((1) J.
  Stefan Institute, Ljubljana, Slovenia, (2) Faculty of Mathematics and
  Physics, University of Ljubljana, Ljubljana, Slovenia)","Electron momentum distribution in underdoped cuprates","5 pages, submitted to PRB","Phys. Rev. B 61, 4389 (2000)","10.1103/PhysRevB.61.4389",,"cond-mat.str-el",,"  We investigate the electron momentum distribution function (EMD) in a weakly
doped two-dimensional quantum antiferromagnet (AFM) as described by the t-J
model. Our analytical results for a single hole in an AFM based on the
self-consistent Born approximation (SCBA) indicate an anomalous momentum
dependence of EMD showing 'hole pockets' coexisting with a signature of an
emerging large Fermi surface. The position of the incipient Fermi surface and
the structure of the EMD is determined by the momentum of the ground state. Our
analysis shows that this result remains robust in the presence of next-nearest
neighbor hopping terms in the model. Exact diagonalization results for small
clusters are with the SCBA reproduced quantitatively.
","[{""version"":""v1"",""created"":""Fri, 21 Jan 2000 14:24:08 GMT""}]","2009-10-31"
"cond-mat/0001317","Michel Gingras","M. J. P. Gingras, B. C. den Hertog, M. Faucher, J.S. Gardner, L.J.
  Chang, B.D. Gaulin, N.P. Raju, and J.E. Greedan","Magnetic and Thermodynamic Properties of the Collective Paramagnet-Spin
  Liquid Pyrochlore Tb2Ti2O7","8 POSTSCRIPT figures included. Submitted to Physical Review B.
  Contact: gingras@gandalf.uwaterloo.ca","Phys. Rev. B, {62}, 6496 (2000)","10.1103/PhysRevB.62.6496",,"cond-mat.dis-nn",,"  In a recent letter [Phys. Rev. Lett. {\bf 82}, 1012 (1999)] it was found that
the Tb$^{3+}$ magnetic moments in the Tb$_2$Ti$_2$O$_7$ pyrochlore lattice of
corner-sharing tetrahedra remain in a {\it collective paramagnetic} state down
to 70mK. In this paper we present results from d.c. magnetic susceptibility,
specific heat data, inelastic neutron scattering measurements, and crystal
field calculations that strongly suggest that (1) the Tb$^{3+}$ ions in
Tb$_2$Ti$_2$O$_7$ possess a moment of approximatively 5$\mu_{\rm B}$, and (2)
the ground state $g-$tensor is extremely anisotropic below a temperature of
$O(10^0)$K, with Ising-like Tb$^{3+}$ magnetic moments confined to point along
a local cubic $<111>$ diagonal (e.g. towards the middle of the tetrahedron).
Such a very large easy-axis Ising like anisotropy along a $<111>$ direction
dramatically reduces the frustration otherwise present in a Heisenberg
pyrochlore antiferromagnet. The results presented herein underpin the
conceptual difficulty in understanding the microscopic mechanism(s) responsible
for Tb$_2$Ti$_2$O$_7$ failing to develop long-range order at a temperature of
the order of the paramagnetic Curie-Weiss temperature $\theta_{\rm CW} \approx
-10^1$K. We suggest that dipolar interactions and extra perturbative exchange
coupling(s)beyond nearest-neighbors may be responsible for the lack of ordering
of Tb$_2$Ti$_2$O$_7$.
","[{""version"":""v1"",""created"":""Fri, 21 Jan 2000 15:29:12 GMT""}]","2009-10-31"
"cs/0001016","Lane A. Hemaspaandra","Lane A. Hemaspaandra","Take-home Complexity","Updated version of Complexity Theory Column 20, Sigact News
  29(2):9-13, 1998",,,,"cs.CY cs.GL",,"  We discuss the use of projects in first-year graduate complexity theory
courses.
","[{""version"":""v1"",""created"":""Fri, 21 Jan 2000 05:31:08 GMT""}]","2007-05-23"
"cs/0001017","Radoslav Hlusek","Radoslav Hlusek","Bezier Curves Intersection Using Relief Perspective","8 pages, 2 figures, to appear in Proceedings of WSCG'2000 in Plzen,
  Czech Republic",,,,"cs.CG cs.GR",,"  Presented paper describes the method for finding the intersection of class
space rational Bezier curves. The problem curve/curve intersection belongs
among basic geometric problems and the aim of this article is to describe the
new technique to solve the problem using relief perspective and Bezier
clipping.
","[{""version"":""v1"",""created"":""Fri, 21 Jan 2000 10:02:49 GMT""}]","2007-05-23"
"gr-qc/0001061","Franz Schunck","Eckehard W. Mielke and Franz E. Schunck","Boson Stars: Alternatives to primordial black holes?","14 pages, uses REVTeX, 1 postscript figure","Nucl.Phys. B564 (2000) 185-203","10.1016/S0550-3213(99)00492-7",,"gr-qc astro-ph",,"  The present surge for the astrophysical relevance of boson stars stems from
the speculative possibility that these compact objects could provide a
considerable fraction of the non-baryonic part of dark matter within the halo
of galaxies. For a very light `universal' axion of effective string models,
their total gravitational mass will be in the most likely range of \sim 0.5
M_\odot of MACHOs. According to this framework, gravitational microlensing is
indirectly ``weighing"" the axion mass, resulting in \sim 10^{-10} eV/c^2. This
conclusion is not changing much, if we use a dilaton type self-interaction for
the bosons. Moreover, we review their formation, rotation and stability as
likely candidates of astrophysical importance.
","[{""version"":""v1"",""created"":""Thu, 20 Jan 2000 23:19:32 GMT""}]","2009-10-31"
"gr-qc/0001062","Patrice Hello","T. Pradier, N. Arnaud, M.-A. Bizouard, F. Cavalier, M. Davier and P.
  Hello","About the detection of gravitational wave bursts","5 pages, proceedings of GWDAW99 (Roma, Dec. 1999), to appear in Int.
  J. Mod. Phys. D","Int.J.Mod.Phys. D9 (2000) 309-314","10.1142/S0218271800000335",,"gr-qc",,"  Several filtering methods for the detection of gravitational wave bursts in
interferometric detectors are presented. These are simple and fast methods
which can act as online triggers. All methods are compared to matched filtering
with the help of a figure of merit based on the detection of supernovae signals
simulated by Zwerger and Muller.
","[{""version"":""v1"",""created"":""Fri, 21 Jan 2000 09:14:52 GMT""}]","2009-10-31"
"gr-qc/0001063","Chamula Marian","V. Skalsky","The Planck quantum hypothesis and the Friedmannian models of flat
  universe","4 pages","Vedecke prace Materialovo-technologickej fakulty Slovenskej
  technickej univerzity v Bratislave so sidlom v Trnave, vol. 7, Slovak
  University of Technology Press, Slovakia, Bratislava 1999, ISBN
  80-227-1005-9, pp. 295-300",,,"gr-qc",,"  Only one model from an infinite number of the Friedmannian models of flat
expansive isotropic and homogeneous universe satisfies the assumptions
resulting from the Planck quantum hypothesis.
","[{""version"":""v1"",""created"":""Fri, 21 Jan 2000 09:36:42 GMT""},{""version"":""v2"",""created"":""Mon, 25 Sep 2000 21:09:02 GMT""}]","2008-12-19"
"gr-qc/0001064","Felix Finster","Felix Finster, Joel Smoller, and Shing-Tung Yau","Some Recent Progress in Classical General Relativity","25 pages, 4 figures, to appear in special issue of JMP ""Mathematical
  Physics - Past and Future""","J.Math.Phys. 41 (2000) 3943-3963","10.1063/1.533332",,"gr-qc math-ph math.MP",,"  In this short survey paper, we discuss certain recent results in classical
gravity. Our main attention is restricted to two topics: the positive mass
conjecture and its extensions to the case with horizons, including the Penrose
conjecture (Part I), and the interaction of gravity with other force fields and
quantum-mechanical particles (Part II).
","[{""version"":""v1"",""created"":""Fri, 21 Jan 2000 14:54:01 GMT""}]","2014-01-28"
"gr-qc/0001065","Folomeev V. N.","V.N. Folomeev and V.Ts. Gurovich","Quantum Evolution of the Bianchi Type I Model","Latex, 18 pages, 5 figures","Grav.Cosmol. 6 (2000) 19-26","10.1023/A:1001938620139",,"gr-qc",,"  The behaviour of the flat anisotropic model of the Universe with a scalar
field is explored within the framework of quantum cosmology. The principal
moment of the account of an anisotropy is the presence either negative
potential barrier or positive repelling wall. In the first case occur the above
barrier reflection of the wave function of the Universe, in the second one
there is bounce off a potential wall. The further evolution of the Universe
represents an exponential inflating with fast losses of an anisotropy and
approach to the standard cosmological scenario.
","[{""version"":""v1"",""created"":""Fri, 21 Jan 2000 15:00:49 GMT""},{""version"":""v2"",""created"":""Sun, 23 Jan 2000 06:01:05 GMT""}]","2015-06-25"
"hep-ex/0001047","Arie Bodek","S. Avvakumov, T. Adams, A. Alton, L. de Barbaro, P. de Barbaro, D.
  Berlin, R. H. Bernstein, A. Bodek, T. Bolton, J. Brau, D. Buchholz, H. Budd,
  L. Bugel, et al. (CCFR/NuTeV collaboration)","Performance of the NuTeV Fe-Scintillator Sampling Calorimeter and
  Implications for Thin Calorimeters","Presented at 6TH International Conference On Advanced Technology And
  Particle Physics Proceedings info: Advanced Technology And Particle Physics,
  Villa Olmo, Italy 5-9 Oct 1998","Nucl.Phys.Proc.Suppl.78:232-237,1999","10.1016/S0920-5632(99)00550-2","Univ. of Rochester UR-1562","hep-ex",,"  NuTeV is a neutrino-nucleon deep inelastic scattering experiment at Fermilab.
The NuTeV detector is a traditional heavy target neutrino detector which
consists of an iron/liquid scintillator sampling calorimeter followed by a muon
spectrometer. The calorimeter response to hadrons, muons and electrons has been
measured in an in situ calibration beam over the energy range from 4.5 to 190
GeV. The small non-linearity of the response to hadrons is compared to the
expectation from the measured ratio of responses between electrons and hadrons
combined with the energy dependence of the fractional electromagnetic energy
deposition in the form of neutral pions in hadronic showers
$f_{\pi^{0}}(E_{\pi})$. The predictions use $f_{\pi^{0}}(E_{\pi})$ from the
Monte Carlo simulations by GHEISHA, GFLUKA and GCALOR and also from the
parameterizations of Wigmans and Groom. In addition, a study based on the NuTeV
hadron calibration data of the effectiveness of a thin calorimeter is
presented. The results of this study have important consequences for the energy
resolution of calorimeters used in other applications; for example, measuring
the cosmic ray flux in space or with balloon-based experiments.
","[{""version"":""v1"",""created"":""Thu, 20 Jan 2000 20:34:34 GMT""}]","2019-08-18"
"hep-ex/0001048","Sergei Burdin","M.N.Achasov, K.I.Beloborodov, A.V.Berdyugin, A.V.Bozhenok, A.D.Bukin,
  D.A.Bukin, S.V.Burdin, T.V.Dimova, V.P.Druzhinin, M.S.Dubrovin,
  D.I.Ganyushin, I.A.Gaponenko, V.B.Golubev, V.N.Ivanchenko, P.M.Ivanov,
  A.A.Korol, S.V.Koshuba, E.V.Pakhtusova, E.A.Perevedentsev, A.A.Salnikov,
  S.I.Serednyakov, V.V.Shary, Yu.M.Shatunov, V.A.Sidorov, Z.K.Silagadze,
  A.A.Valishev, A.V.Vasiljev","Decay phi->pi+pi-","6 pages, 5 figures, to be published in Physics Letters B","Phys.Lett.B474:188-193,2000","10.1016/S0370-2693(00)01477-X",,"hep-ex",,"  The process e+e- ->pi+pi- has been studied with the SND detector at VEPP-2M
e+e- collider in the vicinity of phi(1020) resonance. From the analysis of the
energy dependence of measured cross section the branching ratio
B(phi->pi+pi-)=(7.1+-1.1+-0.9)*10^{-5} and the phase psi_pi=-(34+-4+-3)degrees
of interference with the non-resonant pi+pi- production amplitude were
obtained.
","[{""version"":""v1"",""created"":""Fri, 21 Jan 2000 10:58:29 GMT""}]","2008-11-26"
"hep-ex/0001049","Alexander I. Sukhanov","A.I. Milstein (CMD-2 collaboration)","Status of Experiments and Recent Results from CMD-2 Detector at Vepp-2M","14 pages, Latex, Talk at Int. Workshop ""Physics and Detectors for
  DAFNE""- Fraskati, Nov.16-19, 1999",,,,"hep-ex",,"  The Cryogenic Magnetic Detector (CMD-2) is shortly described. Preliminary
results for the cross sections of $e^+$ $e^-$ annihilation into hadrons and
leptons are presented in the c.m. energy range from 0.37 to 1.39 GeV. The total
integrated luminosity of about 26 ${pb}^{-1}$ has been collected. The new
results for the $\rho$ and $\omega$ meson parameters are reported. The major
decay modes of the $\phi$ meson as well as its rare decays have been observed.
","[{""version"":""v1"",""created"":""Fri, 21 Jan 2000 11:55:25 GMT""}]","2007-05-23"
"hep-ex/0001050","Alexander I. Sukhanov","A.I. Milstein","a_1\pi Contribution to e^+e^-\to 4\pi Annihilation and \tau\to
  4\pi\nu_{\tau} Decay","9 pages, Latex, Talk at Int. Workshop ""Physics and Detectors for
  DAFNE""- Fraskati, Nov.16-19, 1999",,,,"hep-ex",,"  The results of the study of the process e^+e^- \to 4\pi by the CMD-2
collaboration at VEPP-2M are presented. Analysis of the differential
distributions demonstrates the dominance of the a_1\pi and \omega\pi
intermediate states. Simple model, based on the assumption of a_1(1260)\pi and
\omega\pi dominance as intermediate states, successfully describes also the
data of CLEOII and ALEPH obtained recently for the decay \tau\to
4\pi\nu_{\tau}.
","[{""version"":""v1"",""created"":""Fri, 21 Jan 2000 12:07:53 GMT""}]","2007-05-23"
"hep-lat/0001023","Mark G. Alford","Mark Alford (MIT), R. L. Jaffe (MIT)","Insight into the Scalar Mesons from a Lattice Calculation","16 pages, revtex, with eps figures","Nucl.Phys.B578:367-382,2000","10.1016/S0550-3213(00)00155-3","MIT-CTP-2940","hep-lat hep-ex hep-ph nucl-th",,"  We study the possibility that the light scalar mesons are (qbar qbar q q)
states rather than (qbar q). We perform a lattice QCD calculation of
pseudoscalar meson scattering amplitudes, ignoring quark loops and quark
annihilation, and find indications that for sufficiently heavy quarks there is
a stable four-quark bound state with J^{PC}=0^{++} and non-exotic flavor
quantum numbers.
","[{""version"":""v1"",""created"":""Thu, 20 Jan 2000 19:30:03 GMT""}]","2008-11-26"
"hep-lat/0001024","Kazuo Fujikawa","Kazuo Fujikawa (Department of Physics, University of Tokyo)","Regularization and Anomalies in Gauge Theory","14 pages. Talk given at NATO Advanced Research Workshop ``Lattice
  Fermions and Structure of the Vacuum'', October 5-9, 1999, at Dubna, Russia
  (To be published in the Proceedings)",,,"UT-874","hep-lat hep-ph hep-th",,"  Some of the basic issues related to the regularization and anomalies in gauge
theory are reviewed, with particular emphasis on the recent development in
lattice gauge theory. The generalized Pauli-Villars regularization is discussed
from a view point of the covariant regularization of currents, and the
construction of a regularized effective action in terms of covariant currents
is compared with the lattice formulation of chiral Abelian theory.
","[{""version"":""v1"",""created"":""Fri, 21 Jan 2000 05:44:24 GMT""}]","2007-05-23"
"hep-ph/0001213","S. V. Troitsky","V. A. Rubakov and S. V. Troitsky","Trends in Grand Unification: unification at strong coupling and
  composite models","14 pages, 2 eps figures. Lecture at the Baksan School ``Particles and
  Cosmology'', Baksan Valley, April 19 - 25, 1999",,,,"hep-ph",,"  We review several problems of conventional Grand Unification and some new
approaches. In particular, we discuss strongly coupled Grand Unified Theories.
Standard Model may emerge as a low energy effective theory of composite
particles in these models. We construct a realistic model of this kind.
","[{""version"":""v1"",""created"":""Thu, 20 Jan 2000 18:37:35 GMT""}]","2007-05-23"
"hep-ph/0001214","Anatoli Efremov","A.V. Efremov","How Could the Proton Transversity be Measured","8 pages, Latex, czjphys2.sty. Talk at Int. Workshop ""PRAHA-SPIN99"",
  Prague 6-11 Sept 1999. To appear in Czech.J.Phys Suppl","Czech.J.Phys. 50S1 (2000) 95-100","10.1007/s10582-000-0011-3",,"hep-ph",,"  The perspectives of two new nonstandard methods of transversal quark
polarization measurement are considered: the jet handedness and the so-called
""Collins effect"" due to spin dependent T-odd fragmentation function responsible
for the left-right asymmetry in fragmenting of transversally polarized quarks.
Recent experimental indications in favor of these effects are observed: 1.The
correlation of the T-odd one-particle fragmentation functions found by DELPHI
in $Z\to 2$-jet decay. Integrated over the fraction of longitudinal and
transversal momenta, this correlation is of 1.6% order, which means order of
13% for the analyzing power. 2.A rather large ($\approx10%$) handedness
transversal to the production plane observed in the diffractive production of
($\pi^-\pi^+\pi^-$) triples from nuclei by the $40 {\rm GeV/c}$ $\pi^-$--beam.
It shows a clear dynamic origin and resembles the single spin asymmetry
behavior.
  All this makes us hope to use these effects in polarized DIS experiments for
transversity measurement. The first estimation of transversity was done by
using the azimuthal asymmetry in semi-inclusive DIS recently measured by HERMES
and SMC.
","[{""version"":""v1"",""created"":""Thu, 20 Jan 2000 18:30:41 GMT""}]","2009-10-31"
"hep-ph/0001215","Daniele Dominici","R. Casalbuoni, S. De Curtis, D. Dominici, R. Gatto and S. Riemann","Z' indication from new APV data in Cesium and searches at linear
  colliders","10 pages, 6 figures, Proceedings of the Second ECFA/DESY Study on
  Physics and Detectors for a Linear Electron - Positron Collider",,,"LC-TH-2000-006","hep-ph",,"  New data on parity violation in atomic cesium can be explained by a new
neutral vector boson almost unmixed with Z, with a mass in the TeV range and
sizeable couplings to the fermions. The properties of such additional Z' can be
investigated at future linear colliders.
","[{""version"":""v1"",""created"":""Thu, 20 Jan 2000 19:07:13 GMT""}]","2007-05-23"
"hep-ph/0001216","Guy Moore","Guy D. Moore","Sphaleron rate in the symmetric electroweak phase","23 pages including 4 figures, 2 appendices. Some derivations more
  careful and complete, conclusions unchanged","Phys.Rev. D62 (2000) 085011","10.1103/PhysRevD.62.085011","UW/PT 00-01","hep-ph",,"  Recently Bodeker has presented an effective infrared theory for the dynamics
of Yang-Mills theory, suitable for studying the rate of baryon number violation
in the early universe. We extend his theory to include Higgs fields, and study
how much the Higgs affects the baryon number violation rate in the symmetric
phase, at the phase coexistence temperature of a first order electroweak phase
transition. The rate is about 20% smaller than in pure Yang-Mills theory. We
also analyze the sphaleron rate in the analytic crossover regime. Our treatment
relies on the ergodicity conjecture for 3-D scalar $\phi^4$ theory.
","[{""version"":""v1"",""created"":""Thu, 20 Jan 2000 20:09:57 GMT""},{""version"":""v2"",""created"":""Tue, 16 May 2000 18:15:49 GMT""}]","2009-10-31"
"hep-ph/0001217","Andrei Afanasev","Andrei V. Afanasev (NCCU/JLab), V.D. Afanasev, S.V. Trubnikov
  (Kharkov)","Relativistic Charge Form Factor of the Deuteron from (np)-Scattering
  Phase Shifts","18 pages, 5 eps-figures; typos fixed",,,,"hep-ph nucl-th",,"  Relativistic integral representation in terms of experimental neutron-proton
scattering phase shifts is used to compute the charge form factor of the
deuteron $ G_{Cd}(Q^2)$. The results of numerical calculations of
$|G_{Cd}(Q^2)|$ are presented in the interval of the four-momentum transfers
squared $0 \leq Q^2 \leq 35 fm^{-2}$. Zero and the prominent secondary maximum
in $|G_{Cd}(Q^2)|$ are the direct consequences of the change of sign in the
experimental $^3S_1 $- phase shifts. Till the point $Q^2 \simeq 20 fm^{-2}$ the
calculated total relativistic correction to $|G_{Cd}(Q^2)|$ is positive and
reaches the maximal value of 25% at $Q^2 \simeq 14 fm^{-2}$.
","[{""version"":""v1"",""created"":""Thu, 20 Jan 2000 22:00:55 GMT""},{""version"":""v2"",""created"":""Wed, 26 Jan 2000 21:49:37 GMT""}]","2007-05-23"
"hep-ph/0001218","Elizabeth Jenkins","Ruben Flores-Mendieta, Christoph P. Hofmann, Elizabeth Jenkins, and
  Aneesh V. Manohar","On the structure of large N cancellations in baryon chiral perturbation
  theory",,"Phys.Rev.D62:034001,2000","10.1103/PhysRevD.62.034001","UCSD/PTH 99-22","hep-ph nucl-th",,"  We show how to compute loop graphs in heavy baryon chiral perturbation theory
including the full functional dependence on the ratio of the Delta--nucleon
mass difference to the pion mass, while at the same time automatically
incorporating the 1/N cancellations that follow from the large-N spin-flavor
symmetry of baryons in QCD. The one-loop renormalization of the baryon axial
vector current is studied to demonstrate the procedure. A new cancellation is
identified in the one-loop contribution to the baryon axial vector current. We
show that loop corrections to the axial vector currents are exceptionally
sensitive to deviations of the ratios of baryon-pion axial couplings from SU(6)
values.
","[{""version"":""v1"",""created"":""Thu, 20 Jan 2000 22:37:32 GMT""}]","2008-11-26"
"hep-ph/0001219","Mary K. Gaillard","Mary K. Gaillard and Joel Giedt","A D-moduli problem?","11 pages, full postscript also available from
  http://phyweb.lbl.gov/theorygroup/papers/44856.ps","Phys.Lett.B479:308-314,2000","10.1016/S0370-2693(00)00336-1","LBNL-44856, UCB-PTH-00/02","hep-ph hep-th",,"  We point out a generic problem in string-inspired supergravity models with an
anomalous $U(1)_X$. A large number of matter multiplets charged under $U(1)_X$
remain massless above the supersymmetry-breaking scale because of degeneracy of
vacua solving the D-flatness conditions. A toy model is analyzed as an
illustration of the mechanism; we find the surprising result that many scalars
remain massless after supersymmetry-breaking in a hidden sector.
","[{""version"":""v1"",""created"":""Thu, 20 Jan 2000 23:14:35 GMT""}]","2014-11-17"
"hep-ph/0001220",,"Fyodor V. Tkachov (INR RAS, Moscow)","On the structure of systematic perturbation theory with unstable fields","4pp PS; talk at QFTHEP'99, 27 May - 2 June 1999, Moscow","Proc. XIV Int.Workshop on High Energy Physics and Quantum Field
  Theory (QFTHEP'99), Moscow, May 27 - June 2, 1999, eds. B.B.Letchenko and
  V.I.Savrin (MSU-Press, Moscow, 1999), pp. 641-645",,,"hep-ph hep-th math-ph math.MP",,"  Discussed is the structure of non-trivial counterterms that occur in the
systematic gauge-invariant perturbation theory with unstable fields introduced
in [hep-ph/9802307].
","[{""version"":""v1"",""created"":""Fri, 21 Jan 2000 09:28:37 GMT""}]","2007-05-23"
"hep-ph/0001221","Karl Schilcher","N.F. Nasrallah and K. Schilcher","Delta I = 1/2 enhancement and the Glashow-Schnitzer-Weinberg sum rule","7 pages, including 2 ps figures","Phys.Lett. B484 (2000) 251-254","10.1016/S0370-2693(00)00680-8","MZ-TH/00-02","hep-ph",,"  In 1967 Glashow, Schnitzer and Weinberg derived a sum rule in the soft-pion
and soft kaon limit relating the Delta I=1/2 non-leptonic K->2pi amplitude to
integrals over strange and non-strange spectral functions. Using the recent
ALEPH data from tau-decay, we show that the sum rule, slightly modified to
reduce contributions near the cut, yields the correct magnitude decay amplitude
corresponding to the Delta I=1/2 rule.
","[{""version"":""v1"",""created"":""Fri, 21 Jan 2000 10:36:48 GMT""}]","2009-10-31"
"hep-ph/0001222","Xavier Calmet","X. Calmet (Munich U.)","One-Particle Inclusive B sub s -> D bar sub s X Decays","10 pages, 0 figure","Phys.Rev. D62 (2000) 014027","10.1103/PhysRevD.62.014027","LMU 15/99","hep-ph",,"  We discuss one-particle inclusive B sub s -> D bar sub s X decays using a QCD
based method already applied to B -> D bar X. A link between the right charm
non-perturbative form factors of the semi-leptonic decays and those of the
non-leptonic decays is established. Our results are compatible with current
experimental knowledge.
","[{""version"":""v1"",""created"":""Fri, 21 Jan 2000 11:36:16 GMT""}]","2009-10-31"
"hep-ph/0001223","Nathan F. Lepora","Nathan F. Lepora","Gauge Interactions in the Dual Standard Model","4 pages. two column style. LaTeX","JHEP 0002 (2000) 037","10.1088/1126-6708/2000/02/037","DAMTP-2000-7","hep-ph",,"  We present a geometric argument for the transformation properties of SU(5)
--> S(U(3) x U(2)) monopoles under the residual gauge symmetry. This strongly
supports the proposal that monopoles of the dual standard model interact via a
gauge theory of the standard model symmetry group, with the monopoles having
the same spectrum as the standard model fermions.
","[{""version"":""v1"",""created"":""Fri, 21 Jan 2000 15:29:33 GMT""}]","2009-10-31"
"hep-th/0001128","Andreas Fring","A. Fring and C. Korff","Colour valued Scattering Matrices","8 pages Latex, example, comment and reference added","Phys.Lett. B477 (2000) 380-386","10.1016/S0370-2693(00)00226-4",,"hep-th cond-mat",,"  We describe a general construction principle which allows to add colour
values to a coupling constant dependent scattering matrix. As a concrete
realization of this mechanism we provide a new type of S-matrix which
generalizes the one of affine Toda field theory, being related to a pair of Lie
algebras. A characteristic feature of this S-matrix is that in general it
violates parity invariance. For particular choices of the two Lie algebras
involved this scattering matrix coincides with the one related to the scaling
models described by the minimal affine Toda S-matrices and for other choices
with the one of the Homogeneous sine-Gordon models with vanishing resonance
parameters. We carry out the thermodynamic Bethe ansatz and identify the
corresponding ultraviolet effective central charges.
","[{""version"":""v1"",""created"":""Thu, 20 Jan 2000 18:33:52 GMT""},{""version"":""v2"",""created"":""Tue, 25 Jan 2000 11:20:51 GMT""},{""version"":""v3"",""created"":""Tue, 22 Feb 2000 18:24:55 GMT""}]","2009-10-31"
