"cond-mat/0001375","Ian Affleck","Ian Affleck, Jean-Sebastien Caux and Alexandre Zagoskin","Andreev scattering and Josephson current in a one-dimensional electron
  liquid","revtex, 17 pages, 5 postscript figures",,"10.1103/PhysRevB.62.1433",,"cond-mat.supr-con",,"  Andreev scattering and the Josephson current through a one-dimensional
interacting electron liquid sandwiched between two superconductors are
re-examined. We first present some apparently new results on the
non-interacting case by studying an exactly solvable tight-binding model rather
than the usual continuum model. We show that perfect Andreev scattering (i.e.
zero normal scattering) at the Fermi energy can only be achieved by fine-tuning
junction parameters. We also obtain exact results for the Josephson current,
which is generally a smooth function of the superconducting phase difference
except when the junction parameters are adjusted to give perfect Andreev
scattering, in which case it becomes a sawtooth function. We then observe that,
even when interactions are included, all low energy properties of a junction
(E<<\Delta, the superconducting gap) can be obtained by ""integrating out"" the
superconducting electrons to obtain an effective Hamiltonian describing the
metallic electrons only with a boundary pairing interaction. This boundary
model provides a suitable starting point for bosonization/renormalization
group/boundary conformal field theory analysis. We argue that total normal
reflection and total Andreev reflection correspond to two fixed points of the
boundary renormalization group. For repulsive bulk interactions the Andreev
fixed point is unstable and the normal one stable. However, the reverse is true
for attractive interactions. This implies that a generic junction Hamiltonian
(without fine-tuned junction parameters) will renormalize to the normal fixed
point for repulsive interactions but to the Andreev one for attractive
interactions. An exact mapping of our tight-binding model to the Hubbard model
with a transverse magnetic field is used to help understand this behavior.
","[{""version"":""v1"",""created"":""Tue, 25 Jan 2000 22:19:13 GMT""}]","2009-10-31"
"cond-mat/0001376","Tigran V. Shahbazyan","T.V. Shahbazyan and I.E. Perakis","Surface collective excitations in ultrafast pump-probe spectroscopy of
  metal nanoparticles","26 pages including 10 figures. Invited paper for Special Issue of
  Chemical Physics on ""Electron Dynamics in Metals""","Chem. Phys. 251, 37 (2000)","10.1016/S0301-0104(99)00311-0",,"cond-mat",,"  The role of surface collective excitations in the electron relaxation in
small metal particles is studied. It is shown that the dynamically screened
electron-electron interaction in a nanoparticle contains a size-dependent
correction induced by the surface. This leads to new channels of quasiparticle
scattering accompanied by the emission of surface collective excitations. In
noble-metal particles, the dipole collective excitations (surface plasmons)
mediate a resonant scattering of d-holes to the conduction band. The role of
this effect in the ultrafast optical dynamics of small nanoparticles is
studied. With decreasing nanoparticle size, it leads to a strong change in the
differential absorption lineshape and a strong frequency dependence of the
relaxation near the surface plasmon resonance. The experimental implications of
these results in ultrafast pump-probe spectroscopy are addressed. The
size-dependence of conduction electron scattering rates is also discussed.
","[{""version"":""v1"",""created"":""Tue, 25 Jan 2000 23:17:36 GMT""}]","2009-10-31"
"cond-mat/0001377","MSc. Roberto Mulet","R. Mulet and E. Altshuler (Univ. of Havana)","On the importance of grain boundaries in high-Tc films: simulation
  results","8 pages, 6 figures",,,,"cond-mat.supr-con",,"  The importance of the distribution and ``weakness'' of grain boundary
junctions in the magnetic field dependence of the transport critical current in
HTc films is assessed through simulations. The system is studied with the
applied field either parallel or perpendicular to the c axis of the sample. For
realistic sample parameters, it is demonstrated that the presence of ``high''
misorientation angles between grains depresses the zero - field critical
current density in both orientations, and provokes a transition from
pinning-mediated to Fraunhoffer-like field dependencies of the critical current
density. Our results also suggest that there is a threshold misorientation
angle above which the critical current density remains constant.
","[{""version"":""v1"",""created"":""Wed, 26 Jan 2000 03:02:48 GMT""}]","2007-05-23"
"cond-mat/0001378","Scott A. Crooker","S. A. Crooker, N. Samarth, D. D. Awschalom","""Quasi two-dimensional"" spin distributions in II-VI magnetic
  semiconductor heterostructures: Clustering and dimensionality","5 pages (RevTeX), 5 embedded EPS figs, published in PRB v61 p1736
  (2000)","Physical Review B, v.61, p. 1736 (2000)","10.1103/PhysRevB.61.1736",,"cond-mat.mes-hall cond-mat.mtrl-sci",,"  Spin clustering in diluted magnetic semiconductors (DMS) arises from
antiferromagnetic exchange between neighboring magnetic cations and is a strong
function of reduced dimensionality. Epitaxially-grown single monolayers and
abrupt interfaces of DMS are, however, never perfectly two-dimensional (2D) due
to the unavoidable inter-monolayer mixing of atoms during growth. Thus the
magnetization of DMS heterostructures, which is strongly modified by spin
clustering, is intermediate between that of 2D and 3D spin distributions. We
present an exact calculation of spin clustering applicable to arbitrary
distributions of magnetic spins in the growth direction. The results reveal a
surprising insensitivity of the magnetization to the form of the intermixing
profile, and identify important limits on the maximum possible magnetization.
High-field optical studies of heterostructures containing ""quasi-2D"" spin
distributions are compared with calculation.
","[{""version"":""v1"",""created"":""Wed, 26 Jan 2000 07:26:35 GMT""}]","2009-10-31"
"cond-mat/0001379","Rodrigo Ormeno","R.J. Ormeno, C.E. Gough, G. Yang","Antiferromagnetic Alignment and Relaxation Rate of Gd Spins in the High
  Temperature Superconductor GdBa_2Cu_3O_(7-delta)","4 Pages, 4 Figures. Submitted to Phys. Rev. B",,"10.1103/PhysRevB.63.104517",,"cond-mat.supr-con",,"  The complex surface impedance of a number of GdBa$_2$Cu$_3$O$_{7-\delta}$
single crystals has been measured at 10, 15 and 21 GHz using a cavity
perturbation technique. At low temperatures a marked increase in the effective
penetration depth and surface resistance is observed associated with the
paramagnetic and antiferromagnetic alignment of the Gd spins. The effective
penetration depth has a sharp change in slope at the N\'eel temperature, $T_N$,
and the surface resistance peaks at a frequency dependent temperature below 3K.
The observed temperature and frequency dependence can be described by a model
which assumes a negligibly small interaction between the Gd spins and the
electrons in the superconducting state, with a frequency dependent magnetic
susceptibility and a Gd spin relaxation time $\tau_s $ being a strong function
of temperature. Above $T_N$, $\tau_s$ has a component varying as $1 / (T -
T_N)$, while below $T_N$ it increases $\sim T^{-5}$.
","[{""version"":""v1"",""created"":""Wed, 26 Jan 2000 10:42:07 GMT""}]","2009-10-31"
"cond-mat/0001380","Joachim Ankerhold","Joachim Ankerhold and Hermann Grabert","Semiclassical time evolution of the density matrix and tunneling","27 pages, 8 figures, to be published in Phys. Rev. E","Phys. Rev. E 61, 3450-3465 (2000)","10.1103/PhysRevE.61.3450",,"cond-mat.stat-mech",,"  The time dependent density matrix of a system with potential barrier is
studied using path integrals. The characterization of the initial state, which
is assumed to be restricted to one side of the barrier, and the time evolution
of the density matrix lead to a three-fold path integral which is evaluated in
the semiclassical limit. The semiclassical trajectories are found to move in
the complex coordinate plane and barrier penetration only arises due to
fluctuations. Both the form of the semiclassical paths and the relevant
fluctuations change significantly as a function of temperature. The
semiclassical analysis leads to a detailed picture of barrier penetration in
the real time domain and the changeover from thermal activation to quantum
tunneling. Deep tunneling is associated with quasi-zero modes in the
fluctuation spectrum about the semiclassical orbits in the long time limit. The
connection between this real time description of tunneling and the standard
imaginary time instanton approach is established. Specific results are given
for a double well potential and an Eckart barrier.
","[{""version"":""v1"",""created"":""Wed, 26 Jan 2000 10:50:04 GMT""}]","2009-10-31"
"cond-mat/0001381","Petukhov","K. J. Veenstra, A. V. Petukhov, E. Jurdik and Th. Rasing","Observation of strong surface state effects in the nonlinear
  magneto-optical response of Ni(110)","REVTeX/EPS figures/Authors's single Postsript file, to appear in PRL,
  our new phase-sensitive detection technique is used (see PRB, 58, R16020
  (1998)), for more details see http://www.sci.kun.nl/tvs/people/petukhov/","Phys. Rev. Lett., 84, 2002 (2000).","10.1103/PhysRevLett.84.2002",,"cond-mat.mtrl-sci physics.optics",,"  Spectroscopic magnetization induced optical Second Harmonic Generation (MSHG)
measurements from a clean Ni(110) surface reveal strong resonance effects near
2.7 eV that can be attributed to the presence of an empty surface state. The
good agreement with model calculations shows the potential of MSHG to probe
spin polarized interface band structures.
","[{""version"":""v1"",""created"":""Wed, 26 Jan 2000 12:25:54 GMT""}]","2009-10-31"
"cond-mat/0001382","Luis Santos","T. Felbinger, L. Santos, M. Wilkens and M. Lewenstein","Time correlations of a laser-induced Bose-Einstein condensate","9 pages, 1 figure",,"10.1103/PhysRevA.62.033603",,"cond-mat",,"  We analyze the multi-time correlations of a laser-induced Bose-Einstein
condensate. We use quantum stochastic methods to obtain under certain
circumstances a Fokker-Planck equation which describes the phase-difussion
process, and obtain an analytical expression of the two-time correlations. We
perform also quantum Monte Carlo numerical simulations of the correlations,
which are in good agreement with the predicted analytical results.
","[{""version"":""v1"",""created"":""Wed, 26 Jan 2000 13:26:30 GMT""}]","2009-10-31"
"cond-mat/0001383","Marti Pi","A. Emperador, M. Pi, M. Barranco, E. Lipparini, and Ll. Serra","Far-infrared excitations in a quantum antidot at finite magnetic fields","Typeset using Revtex, 20 pages with 10 Postscript figures included","Jpn. J. Appl. Phys. 40, (2001) 518","10.1143/JJAP.40.518",,"cond-mat",,"  We have investigated the far-infrared dipole modes of a quantum antidot
submitted to a perpendicularly applied magnetic field B. The ground state of
the antidot is described within local spin-density functional theory, and the
spectrum within time-dependent local spin-density functional theory. The
results are compared with those corresponding to a quantum dot of similar
electronic surface density. The method is able to reproduce two of the more
salient experimental features, namely that main bulk and edge modes have the
same circular polarization, and that the negative B dispersion edge branch
oscillates, having minima at the B values corresponding to fully occupied
Landau levels. It fails, however, to yield the unique feature of short-period
antidot lattices that the energy of the edge magnetoplasmon approaches the
cyclotron frequency for small B. The existence of anticyclotron polarized bulk
modes is discussed, and a detailed account of the dipole spin mode is
presented.
","[{""version"":""v1"",""created"":""Wed, 26 Jan 2000 14:11:02 GMT""}]","2009-10-31"
"cond-mat/0001384","Popkov Vladislav","Vladislav Popkov and Ingo Peschel","Exactly solvable statistical model for two-way traffic","6 pages Latex, submitted to J Phys.A",,"10.1088/0305-4470/33/22/303",,"cond-mat.stat-mech",,"  We generalize a recently introduced traffic model, where the statistical
weights are associated with whole trajectories, to the case of two-way flow. An
interaction between the two lanes is included which describes a slowing down
when two cars meet. This leads to two coupled five-vertex models. It is shown
that this problem can be solved by reducing it to two one-lane problems with
modified parameters. In contrast to stochastic models, jamming appears only for
very strong interaction between the lanes.
","[{""version"":""v1"",""created"":""Wed, 26 Jan 2000 14:26:58 GMT""}]","2009-10-31"
"cond-mat/0001385","D. Foerster","D. Foerster","A planar extrapolation of the correlation problem that permits pairing","8 pages, 2 figures",,"10.1103/PhysRevB.62.13376",,"cond-mat.str-el cond-mat.stat-mech",,"  It was observed previously that an SU(N) extension of the Hubbard model is
dominated, at large N, by planar diagrams in the sense of 't Hooft, but the
possibility of superconducting pairing got lost in this extrapolation. To allow
for this possibility, we replace SU(N) by U(N,q), the unitary group in a vector
space of quaternions. At the level of the free energy, the difference between
the SU(N)and U(N,q) extrapolations appears only to first nonleading order in N.
","[{""version"":""v1"",""created"":""Wed, 26 Jan 2000 14:37:57 GMT""}]","2009-10-31"
"cond-mat/0001386","Piotr Bialas","Piotr Bialas","Matter Correlations in Branched Polymers","20 pages","Nucl.Phys. B575 (2000) 645-660","10.1016/S0550-3213(00)00202-9","BP-TP 06/99","cond-mat.stat-mech hep-lat",,"  We analyze correlation functions in a toy model of a random geometry
interacting with matter. We show that in general the connected correlator will
contain a long--range scaling part. This result supports the previously
conjectured general form of correlation functions on random geometries. We
discuss the interplay between matter and geometry and the role of the symmetry
in the matter sector.
","[{""version"":""v1"",""created"":""Wed, 26 Jan 2000 15:18:31 GMT""}]","2009-10-31"
"cond-mat/0001387","Uwe Tauber","S. Trimper (MLU Halle), U.C. Taeuber (VA Tech), G.M. Schuetz (IFF FZ
  Juelich)","Reaction-controlled diffusion","7 pages, revtex, no figures; latest revised version","Phys. Rev. E 62 (2000) 6071","10.1103/PhysRevE.62.6071",,"cond-mat.stat-mech",,"  The dynamics of a coupled two-component nonequilibrium system is examined by
means of continuum field theory representing the corresponding master equation.
Particles of species A may perform hopping processes only when particles of
different type B are present in their environment. Species B is subject to
diffusion-limited reactions. If the density of B particles attains a finite
asymptotic value (active state), the A species displays normal diffusion. On
the other hand, if the B density decays algebraically ~t^{-a} at long times
(inactive state), the effective attractive A-B interaction is weakened. The
combination of B decay and activated A hopping processes gives rise to
anomalous diffusion, with mean-square displacement < x_A(t)^2 > ~ t^{1-a} for a
< 1. Such algebraic subdiffusive behavior ensues for n-th order B annihilation
reactions (n B -> 0) with n >=3, and n = 2 for d < 2. The mean-square
displacement of the A particles grows only logarithmically with time in the
case of B pair annihilation (n = 2) and d >= 2 dimensions. For radioactive B
decay (n = 1), the A particles remain localized. If the A particles may hop
spontaneously as well, or if additional random forces are present, the A-B
coupling becomes irrelevant, and conventional diffusion is recovered in the
long-time limit.
","[{""version"":""v1"",""created"":""Wed, 26 Jan 2000 15:25:27 GMT""},{""version"":""v2"",""created"":""Fri, 24 Mar 2000 14:14:37 GMT""},{""version"":""v3"",""created"":""Tue, 23 May 2000 18:20:05 GMT""},{""version"":""v4"",""created"":""Fri, 28 Jul 2000 12:19:31 GMT""}]","2009-10-31"
"cond-mat/0001388","Manuel","M.I.Marques, J.A.Gonzalo and J.Iniguez","Universality Class of Thermally Diluted Ising Systems at Criticality","7 pages, 6 figures, RevTex",,"10.1103/PhysRevE.62.191",,"cond-mat.stat-mech",,"  The universality class of thermally diluted Ising systems, in which the
realization of the disposition of magnetic atoms and vacancies is taken from
the local distribution of spins in the pure original Ising model at
criticality, is investigated by finite size scaling techniques using the Monte
Carlo method. We find that the critical temperature, the critical exponents and
therefore the universality class of these thermally diluted Ising systems
depart markedly from the ones of short range correlated disordered systems. Our
results agree fairly well with theoretical predictions previously made by
Weinrib and Halperin for systems with long range correlated disorder.
","[{""version"":""v1"",""created"":""Wed, 26 Jan 2000 15:42:10 GMT""}]","2009-10-31"
"cs/0001023","Ciprian I. Chelba","Ciprian Chelba, Frederick Jelinek (CLSP, The Johns Hopkins University)","Structured Language Modeling for Speech Recognition","4 pages + 2 pages of ERRATA","Proceedings of NLDB'99, Klagenfurt, Austria",,,"cs.CL",,"  A new language model for speech recognition is presented. The model develops
hidden hierarchical syntactic-like structure incrementally and uses it to
extract meaningful information from the word history, thus complementing the
locality of currently used trigram models. The structured language model (SLM)
and its performance in a two-pass speech recognizer --- lattice decoding ---
are presented. Experiments on the WSJ corpus show an improvement in both
perplexity (PPL) and word error rate (WER) over conventional trigram models.
","[{""version"":""v1"",""created"":""Tue, 25 Jan 2000 19:35:01 GMT""}]","2007-05-23"
"cs/0001024","Bernd R. Schlei","B. R. Schlei, L. Prasad","A Parallel Algorithm for Dilated Contour Extraction from Bilevel Images","5 pages, including 3 figures. For additional detail check
  http://www.nis.lanl.gov/~bschlei/labvis/index.html",,,"Los Alamos Preprint LA-UR-00-309","cs.CV",,"  We describe a simple, but efficient algorithm for the generation of dilated
contours from bilevel images. The initial part of the contour extraction is
explained to be a good candidate for parallel computer code generation. The
remainder of the algorithm is of linear nature.
","[{""version"":""v1"",""created"":""Tue, 25 Jan 2000 16:09:37 GMT""}]","2007-05-23"
"gr-qc/0001080","Angelo Tartaglia","A. Tartaglia (Dip. Fisica, Politecnico, Torino, Italy)","Geometric treatment of the gravitomagnetic clock effect","14 pages, LATEX, 2 figures","Gen.Rel.Grav. 32 (2000) 1745-1756","10.1023/A:1001998505329",,"gr-qc",,"  We have developed a general geometric treatment of the GCE valid for any
stationary axisymmetric metric. The method is based on the remark that the
world lines of objects rotating along spacely circular trajectories are in any
case, for those kind of metrics, helices drawn on the flat bidimensional
surface of a cylinder. Applying the obtained formulas to the special cases of
the Kerr and weak field metric for a spinning body, known results for time
delays and synchrony defects are recovered.
","[{""version"":""v1"",""created"":""Tue, 25 Jan 2000 17:01:55 GMT""}]","2015-06-25"
"gr-qc/0001081","Jose David Sanabria Gomez","Vladimir S. Manko, Eckehard W. Mielke and Jos\'e D. Sanabria-G\'omez","Exact Solution for the Exterior Field of a Rotating Neutron Star","Accepted for publication in Phys. Rev. D as Rapid Communication. 8
  pages, 2 eps figures","Phys.Rev.D61:081501,2000","10.1103/PhysRevD.61.081501",,"gr-qc astro-ph",,"  A four-parameter class of exact asymptotically flat solutions of the
Einstein-Maxwell equations involving only rational functions is presented. It
is able to describe the exterior field of a slowly or rapidly rotating neutron
star with poloidal magnetic field.
","[{""version"":""v1"",""created"":""Tue, 25 Jan 2000 17:40:48 GMT""}]","2009-12-30"
"gr-qc/0001082","Fay","Stephane Fay","Dynamical study of the empty Bianchi type I model in generalised
  scalar-tensor theory","18 pages, 3 figures, to appear in General Relativity and Gravitation","Gen.Rel.Grav. 32 (2000) 203-220","10.1023/A:1001871024041",,"gr-qc",,"  A dynamical study of the generalised scalar-tensor theory in the empty
Bianchi type I model is made. We use a method from which we derive the sign of
the first and second derivatives of the metric functions and examine three
different theories that can all tend towards relativistic behaviours at late
time. We determine conditions so that the dynamic be in expansion and
decelerated at late time.
","[{""version"":""v1"",""created"":""Tue, 25 Jan 2000 18:24:18 GMT""}]","2015-06-25"
"gr-qc/0001083","Beverly K. Berger","Beverly K. Berger and Vincent Moncrief","Exact U(1) symmetric cosmologies with local Mixmaster dynamics","13 pages, 5 figures, uses RevTeX and psfig","Phys.Rev. D62 (2000) 023509","10.1103/PhysRevD.62.023509",,"gr-qc",,"  By applying a standard solution generating technique, we transform an
arbitrary vacuum Mixmaster solution on $S^3 \times {\bf R}$ to a new solution
which is spatially inhomogeneous. We thereby obtain a family of exact,
spatially inhomogeneous, vacuum spacetimes which exhibit Belinskii,
Khalatnikov, and Lifshitz (BKL) oscillatory behavior. The solutions are
constructed explicitly by performing the transformations on numerically
generated, homogeneous Mixmaster solutions. Their behavior is found to be
qualitatively like that seen in previous numerical simulations of generic U(1)
symmetric cosmological spacetimes on $T^3 \times {\bf R}$.
","[{""version"":""v1"",""created"":""Tue, 25 Jan 2000 23:28:48 GMT""}]","2009-10-31"
"gr-qc/0001084","Avraham E. Mayo","Avraham E. Mayo","Can one increase the luminosity of a Schwarzschild black hole?","17 pages, REVTEX, Submitted to Physical Review D",,,,"gr-qc",,"  We illustrate how Hawking's radiance from a Schwarzschild black hole is
modified by the electrostatic self-interaction of the emitted charged
particles. A W.K.B approximation shows that the probability for a
self-interacting charged particle to propagate from the interior to the
exterior of the horizon is increased relative to the corresponding probability
for neutral particles. We also demonstrate how the electric potential of a
charged test object in the black hole's vicinity gives rise to pair creation.
We analyze this phenomenon semiclassically by considering the existence of the
appropriate Klein region. Finally we discuss the possible energy source for the
process.
","[{""version"":""v1"",""created"":""Wed, 26 Jan 2000 08:29:28 GMT""}]","2007-05-23"
"hep-lat/0001029","Fujiwara","T. Fujiwara, H. Suzuki and K. Wu (Ibaraki U., Mito)","Topological Charge of Lattice Abelian Gauge Theory","20 pages, latex, nofigure","Prog.Theor.Phys. 105 (2001) 789-807","10.1143/PTP.105.789","IU-MSTP/39","hep-lat hep-th",,"  Configuration space of abelian gauge theory on a periodic lattice becomes
topologically disconnected by excising exceptional gauge field configurations.
It is possible to define a U(1) bundle from the nonexceptional link variables
by a smooth interpolation of the transition functions. The lattice analogue of
Chern character obtained by a cohomological technique based on the
noncommutative differential calculus is shown to give a topological charge
related to the topological winding number of the U(1) bundle.
","[{""version"":""v1"",""created"":""Wed, 26 Jan 2000 07:09:38 GMT""}]","2009-10-31"
"hep-ph/0001262","Edward Sarkisyan","Edward K. G. Sarkisyan (Tel Aviv University)","Description of local multiplicity fluctuations and genuine multiparticle
  correlations","15 pages, 2 ps figures","Phys.Lett. B477 (2000) 1-12","10.1016/S0370-2693(00)00223-9","TAUP 2619-2000","hep-ph",,"  Various parametrizations of the multiplicity distribution are studied using
the recently published large statistics OPAL results on multidimensional local
fluctuations and genuine correlations in e+e- -> Z -> hadrons. The measured
normalized factorial and cumulant moments are compared to the predictions of
the negative binomial distribution, the modified and generalized versions of
it, the log-normal distribution and the model of the generalized birth process
with immigration. This is the first study which uses the multiplicity
distribution parametrizations to describe high-order genuine correlations.
Although the parametrizations fit well the measured fluctuations and
correlations for low orders, they do show certain deviations at high orders. We
have shown that it is necessary to incorporate the multiparticle character of
the correlations along with the property of self-similarity to attain a good
description of the measurements.
","[{""version"":""v1"",""created"":""Tue, 25 Jan 2000 19:15:15 GMT""}]","2009-10-31"
