"astro-ph/0001445","JieHao Huang","L. Ji, Y. Chen, J. H. Huang, Q. S. Gu, S. J. Lei (Department of
  Astronomy, Nanjing University, Nanjing, China)","The FIR-Radio Correlation of Wolf-Rayet Galaxies and the Role of Star
  Formation in LINERs","9 pages, 4 figures, to be published in Astronomy & Astrophysics",,,,"astro-ph",,"  We find that a preliminary classification of LINERs' energetics may be made
in terms of the FIR-radio correlation of Wolf-Rayet galaxies. The AGN- or
starburst-supported LINERs can be distinguished by their FIR-to-radio ratio,
$Q\equiv L(1.4{\rm GHz})/$ $L(60\mu{\rm m})>$ or $<0.01$. It is interesting to
note that almost all the LINERs with inner rings might be starburst- supported,
indicating reduced AGN activities compared with those of the AGN-supported
ones. We also find that a shock-heating phase for the warm dust component might
be important for some starbursts at the burst age of $\ge 10^{7}$ yr, with
$Q<0.001$.
","[{""version"":""v1"",""created"":""Wed, 26 Jan 2000 02:39:23 GMT""}]","2007-05-23"
"astro-ph/0001446","Myeong-Gu Park","Myeong-Gu Park (1) and Jeremiah P. Ostriker (2) ((1) Kyungpook
  National University, Korea, (2) Princeton University)","Preheated Advection Dominated Accretion Flow","41 pages with 10 postscript figures (aastex5). Submitted to ApJ",,"10.1086/319042","KNUAST-00-01-01","astro-ph",,"  All high temperature accretion solutions including ADAF are physically thick,
so outgoing radiation interacts with the incoming flow, sharing as much or more
resemblance with classical spherical accretion flows as with disk flows. We
examine this interaction for the popular ADAF case. We find that without
allowance for Compton preheating, a very restricted domain of ADAF solution is
permitted and with Compton preheating included a new high temperature PADAF
branch appears in the solution space. In the absence of preheating, high
temperature flows do not exist when the mass accretion rate mdot == Mdot c^2 /
L_E >~ 10^-1.5. Below this mass accretion rate, a roughly conical region around
the hole cannot sustain high temperature ions and electrons for all flows
having mdot >~ 10^-4, which may lead to a funnel possibly filled with a tenuous
hot outgoing wind. If the flow starts at large radii with the usual equilibrium
temperature ~10^4 K, the critical mass accretion rate is much lower, mdot
\~10^-3.7 above which level no self-consistent ADAF (without preheating) can
exist. However, above this critical mass accretion rate, the flow can be
self-consistently maintained at high temperature if Compton preheating is
considered. These solutions constitute a new branch of solutions as in
spherical accretion flows. High temperature PADAF flows can exist above the
critical mass accretion rate in addition to the usual cold thin disk solutions.
We also find solutions where the flow near the equatorial plane accretes
normally while the flow near the pole is overheated by Compton preheating,
possibly becoming, a polar wind, solutions which we designate WADAF.
","[{""version"":""v1"",""created"":""Wed, 26 Jan 2000 05:24:13 GMT""}]","2009-10-31"
"astro-ph/0001447","Tomoyuki Hanawa","Tomoyuki Hanawa and Tomoaki Matsumoto","Growth of a Vortex Mode during Gravitational Collapse Resulting in Type
  II Supernova","AAS LaTeX, 14 pages including 6 figures, submitted to Astrophysical
  Journal in January",,"10.1086/309370","DPNU-00-03","astro-ph",,"  We investigate stability of a gravitationally collapsing iron core against
non-spherical perturbation. The gravitationally collapsing iron core is
approximated by a similarity solution for dynamically collapsing polytropic gas
sphere. We find that the similarity solution is unstable against non-spherical
perturbations. The perturbation grows in proportion to $ (t - t_0) ^{-\sigma} $
while the the central density increases in proportion to $ (t - t_0) ^{-2} $.
The growth rate is $ \sigma = 1/3 + \ell (\gamma - 4/3) $, where $ \gamma $ and
$ \ell $ denote the polytropic index and the parameter $ \ell $ of the
spherical harmonics, $ Y_{\ell} ^m (\theta, \phi) $, respectively. The growing
perturbation is dominated by vortex motion. Thus it excites global convection
during the collapse and may contribute to material mixing in a type II
supernova.
","[{""version"":""v1"",""created"":""Wed, 26 Jan 2000 07:21:15 GMT""}]","2009-10-31"
"astro-ph/0001448","Wolfgang Vieser","Wolfgang Vieser and Gerhard Hensler","Evaporation and Condensation Processes of Giant Molecular Clouds in a
  Hot Plasma","to appear in: 1999, Proc. ""Astrophysical Dynamics"", eds. D. Berry et
  al., Astroph. Sp. Sci., in press","Astrophys.Space Sci. 272 (2000) 189-196","10.1023/A:1002684126855",,"astro-ph",,"  2d hydrodynamical simulations are performed to examine the evaporation and
condensation processes of giant molecular clouds in the hot phase of the
interstellar medium. The evolution of cold and dense clouds is calculated in
the subsonic stream of a hot tenuous plasma. Our code includes self-gravity,
heating and cooling processes and heat conduction by electrons. Significant
differences occur between simulations with and without heat conduction.
","[{""version"":""v1"",""created"":""Wed, 26 Jan 2000 09:11:21 GMT""}]","2009-10-31"
"astro-ph/0001449","Federica Govoni","F. Govoni, R. Falomo, G. Fasano, R. Scarpa","Optical surface photometry of radio galaxies - II. Observations and data
  analysis","9 pages, plus 17 .gif figures, accepted by Astronomy and
  Astrophysics, Supplement Series",,"10.1051/aas:2000338",,"astro-ph",,"  Optical imaging observations for 50 radio galaxies are presented. For each
object isophotal contours, photometric profiles, structural parameters
(position angle, ellipticity, Fourier coefficients), and total magnitudes are
given. These observations, obtained in the Cousins R band, complement the data
presented in a previous paper and are part of a larger project aimed at
studying the optical properties of low redshift (z<0.12) radio galaxies (Govoni
et al. 1999). Comments for each individual source are reported.
","[{""version"":""v1"",""created"":""Wed, 26 Jan 2000 09:57:25 GMT""}]","2009-10-31"
"astro-ph/0001450","Marat Gilfanov","M. Gilfanov (1,2), E.Churazov (1,2) and M. Revnivtsev (2,1) ((1) MPA,
  Garching; (2)IKI, Moscow)","Frequency resolved spectroscopy of Cyg X-1: fast variability of the
  reflected emission in the soft state","submitted to MNRAS","Mon.Not.Roy.Astron.Soc. 316 (2000) 923","10.1046/j.1365-8711.2000.03686.x",,"astro-ph",,"  Using the RXTE/PCA data we study the fast variability of the reflected
emission in the soft spectral state of Cyg X-1 by means of Fourier frequency
resolved spectroscopy. We find that the rms amplitude of variations of the
reflected emission has the same frequency dependence as the primary radiation
down to time scales of <30-50 msec. This might indicate that the reflected flux
reproduces, with nearly flat response, variations of the primary emission. Such
behavior differs notably from the hard spectral state, in which variations of
the reflected flux are significantly suppressed in comparison with the primary
emission, on time scales shorter than ~0.5-1 sec. If related to the finite
light crossing time of the reflector, these results suggest that the
characteristic size of the reflector -- presumably an optically thick accretion
disk, in the hard spectral state is larger by a factor of >5-10 than in the
soft spectral state. Modeling the transfer function of the disk, we estimate
the inner radius of the accretion disk R_in~100R_g in the hard and R_in<10R_g
in the soft state for a 10M_sun black hole.
","[{""version"":""v1"",""created"":""Wed, 26 Jan 2000 11:21:00 GMT""}]","2009-10-31"
"astro-ph/0001451","Youichi Ohyama","Youichi Ohyama, Michitoshi Yoshida, Tadafumi Takata, Masatoshi
  Imanishi, Tomonori Usuda, Yoshihiko Saito, Hiroko Taguchi, Noboru Ebizuka,
  Fumihide Iwamuro, Kentaro Motohara, Tomoyuki Taguchi, Takashi Hata, Toshinori
  Maihara, Masanori Iye, Toshiyuki Sasaki, George Kosugi, Ryusuke Ogasawara,
  Junichi Noumaru, Yoshihiko Mizumoto, Masafumi Yagi, Yoshihiro Chikada","Superwind-Driven Intense H_2 Emission in NGC 6240","33 pages, 9 figures, accepted for publication in PASJ",,"10.1093/pasj/52.4.563",,"astro-ph",,"  We have performed a long-slit K band spectroscopic observation of the
luminous infrared galaxy NGC 6240. The peak position of the H_2 v=1-0 S(1)
emission in the slit is located ~0.3"" - 0.4"" north of the southern nucleus. It
is almost the midpoint between the southern nucleus and the peak position of
the ^12CO J=1-0 emission. Based on the line-ratio analyses, we suggest the
excitation mechanism of H_2 is pure thermal at most positions. In the southern
region we find the following three velocity components in the H_2 emission: the
blueshifted shell component (~-250 km s^-1 with respect to V_sys) which is
recognized as a distinct C-shape distortion in the velocity field around the
southern nucleus, the high-velocity blueshifted ``wing'' component (~-1000 km
s^-1 with respect to V_sys), and the component indicating possible line
splitting of ~500 km s^-1. The latter two components are extended to the south
from the southern nucleus. We show that the kinematic properties of these three
components can be reproduced by expanding motion of a shell-like structure
around the southern nucleus. The offset peak position of the H_2 emission can
be understood if we assume that the shell expanding to the north interacts with
the extragalactic molecular gas. At the interface between the shell and the
molecular gas concentration the cloud-crushing mechanism proposed by Cowie et
al. (1981) may work efficiently, and the intense H_2 emission is thus expected
there. All these findings lead us to propose a model that the most H_2 emission
is attributed to the shock excitation driven by the superwind activity of the
southern nucleus.
","[{""version"":""v1"",""created"":""Wed, 26 Jan 2000 11:33:35 GMT""}]","2015-06-24"
"astro-ph/0001452","Takashi Murayama","Yoshiaki Taniguchi, Takashi Murayama, Hideaki Mouri","Dusty Tori of Seyfert Nuclei","8 pages, to appear in `ASCA/ROSAT Workshop on AGN and the X-ray
  Background', Tokyo, Nov. 1-3, 1999, eds. T. Takahashi and H. Inoue",,,,"astro-ph",,"  Dusty tori around active galactic nuclei (AGNs) play an important role in the
classification of Seyfert galaxies. Therefore, physical properties of dusty
tori are of great interest. We briefly introduce three statistical studies
investigating properties of dusty tori; 1) physical sizes of dusty tori based
on water-vapor maser emission, 2) ionization condition of the inner wall of
tori based on high-ionization emission lines, and 3) viewing angle toward dusty
tori based on mid-infrared color.
","[{""version"":""v1"",""created"":""Wed, 26 Jan 2000 12:03:36 GMT""}]","2007-05-23"
"astro-ph/0001453","Angelo Loinger","A.Loinger (Dipartimento di Fisica, Universita' di Milano, Italy)","On continued gravitational collapse","5 pages, PDF, submitted to Il Nuovo Cimento",,,,"astro-ph gr-qc",,"  According to a widespread idee fixe, the spherically-symmetric collapse of a
sufficiently massive celestial body of spherical shape should generate a black
hole. I prove that this process generates simply an ordinary point mass. My
argument is model-independent.
","[{""version"":""v1"",""created"":""Wed, 26 Jan 2000 12:50:43 GMT""}]","2007-05-23"
"astro-ph/0001454","Frank Eisenhauer","F. Eisenhauer, M. Tecza, N. Thatte, S. Mengel, R. Hofmann and R.
  Genzel","Near-Infrared-Spectroscopy with Extremely Large Telescopes:
  Integral-Field- versus Multi-Object-Instruments","8 pages, 4 figures (converted to bitmap), to appear in the
  proceedings of the Workshop on Extremely Large Telescopes, Sweden, June 1-2,
  1999, uses spie.sty (V0.91) and spiebib.bst (V0.91)",,,,"astro-ph",,"  Integral-field-spectroscopy and multi-object-spectroscopy provide the high
multiplex gain required for efficient use of the upcoming generation of
extremely large telescopes. We present instrument developments and designs for
both concepts, and how these designs can be applied to cryogenic near-infrared
instrumentation. Specifically, the fiber-based concept stands out the
possibility to expand it to any number of image points, and its modularity
predestines it to become the new concept for multi-field-spectroscopy. Which of
the three concepts --- integral-field-, multi-object-, or
multi-field-spectroscopy --- is best suited for the largest telescopes is
discussed considering the size of the objects and their density on the sky.
","[{""version"":""v1"",""created"":""Wed, 26 Jan 2000 13:06:30 GMT""}]","2007-05-23"
"astro-ph/0001455","Kristy K. Dyer","Kristy K. Dyer, Stephen P. Reynolds, Kazik J. Borkowski","Low Frequency Insights Into Supernova Remnants","To appear in conference proceedings for ""The Universe at Low
  Frequencies"" IAU 199 ASP",,,,"astro-ph",,"  Low frequency observations at 330 and 74 MHz can provide new insights into
supernova remnants (SNR). We can test theoretical predictions for spectral
index variations. Nonlinear models of shock acceleration predict that the
spectra from young SNR should be slightly concave rather than power laws --
flattening toward higher energies. However, few SNR are bright and compact
enough to be studied at millimeter wavelengths, restricting studies to the
small range from 6 to 20 cm (a factor of 1.7 in electron energies).
Observations at 330 MHz increase the electron energy baseline to a factor of 4,
while providing sensitivity to larger spatial scales that are resolved out by
centimeter-wavelength interferometers. Such observations can also separate
thermal from nonthermal emission and detect excess free-free absorption
associated with cool gas in remnants. Wide field images also provide an
efficient census of both thermal and nonthermal sources over a large region.
","[{""version"":""v1"",""created"":""Wed, 26 Jan 2000 14:55:17 GMT""}]","2007-05-23"
"astro-ph/0001456","Fronefield Crawford","Fronefield Crawford (MIT), Victoria M. Kaspi (MIT), Jon F. Bell (ATNF)","A Search for Sub-millisecond Pulsations in Unidentified FIRST and NVSS
  Radio Sources","8 pages, including 2 tables and 1 figure. Accepted for publication in
  AJ","Astron.J.119:2376-2381,2000","10.1086/301329",,"astro-ph",,"  We have searched 92 unidentified sources from the FIRST and NVSS 1400 MHz
radio survey catalogs for radio pulsations at 610 MHz. The selected radio
sources are bright, have no identification with extragalactic objects, are
point-like and are more than 5% linearly polarized. Our search was sensitive to
sub-millisecond pulsations from pulsars with dispersion measures (DMs) less
than 500 pc cm-3 in the absence of scattering. We have detected no pulsations
from these sources and consider possible effects which might prevent detection.
We conclude that as a population, these sources are unlikely to be pulsars.
","[{""version"":""v1"",""created"":""Wed, 26 Jan 2000 15:29:31 GMT""}]","2008-11-26"
"astro-ph/0001457","Massimo Turatto","Massimo Turatto (Osservatorio di Padova)","The present rate of Supernovae","9 pages, Latex, 1 figure, To appear in the proceedings of the
  conference ""The Chemical Evolution of The Milky Way: Stars versus Clusters"",
  eds. F. Matteucci and F. Giovannelli, Vulcano, Italy, September 20-24 1999",,"10.1007/978-94-010-0938-6_36",,"astro-ph",,"  We present and discuss the most recent determination of the rate of
Supernovae in the local Universe. A comparison with other results shows a
general agreement on the gross values but still significant differences on the
values of the rates of various SN rates in different kinds of galaxies. The
rate of SNe, used as a probe of Star Formation, confirms the young progenitor
scenario for SNII+Ib/c. The increasing diversity of SNe reflects also in the SN
yields which may affect the chemical evolution of the Galaxy but, because of
the limited statistics, we cannot estimate the contributions of the new
subtypes yet. It is also expected that in a few years observational
determinations of the SN rates at various look-back times will be available.
","[{""version"":""v1"",""created"":""Wed, 26 Jan 2000 15:29:57 GMT""}]","2016-01-27"
"cond-mat/0001368","Damian Taras-Semchuk","D. Taras-Semchuk and K. B. Efetov","Antilocalization in a 2D Electron Gas in a Random Magnetic Field","4 pages, RevTeX","Phys. Rev. Lett. 85, 1060 (2000)","10.1103/PhysRevLett.85.1060",,"cond-mat.mes-hall",,"  We construct a supersymmetric field theory for the problem of a
two-dimensional electron gas in a random, static magnetic field. We find a new
term in the free energy, additional to those present in the conventional
unitary sigma-model, whose presence relies on the long-range nature of the
disorder correlations. Under a perturbative renormalization group analysis of
the free energy, the new term contributes to the scaling function at one-loop
order and leads to antilocalization.
","[{""version"":""v1"",""created"":""Tue, 25 Jan 2000 16:24:27 GMT""}]","2009-10-31"
"cond-mat/0001369","Michel Gingras","Byron C. den Hertog, and Michel J. P. Gingras","Dipolar Interactions and Origin of Spin Ice in Ising Pyrochlore Magnets","4 postscript figures included. Submitted to Physical Review Letters
  Contact: gingras@gandalf.uwaterloo.ca","Phys. Rev. Lett. {84}, 3430 (2000).","10.1103/PhysRevLett.84.3430",,"cond-mat.dis-nn",,"  Recent experiments suggest that the Ising pyrochlore magnets ${\rm
Ho_{2}Ti_{2}O_{7}}$ and ${\rm Dy_{2}Ti_{2}O_{7}}$ display qualitative
properties of the spin ice model proposed by Harris {\it et al.} \prl {\bf 79},
2554 (1997). We discuss the dipolar energy scale present in both these
materials and consider how they can display spin ice behavior {\it despite} the
presence of long range interactions. Specifically, we present numerical
simulations and a mean field analysis of pyrochlore Ising systems in the
presence of nearest neighbor exchange and long range dipolar interactions. We
find that two possible phases can occur, a long range ordered antiferromagnetic
one and the other dominated by spin ice features. Our quantitative theory is in
very good agreement with experimental data on both ${\rm Ho_{2}Ti_{2}O_{7}}$
and ${\rm Dy_{2}Ti_{2}O_{7}}$. We suggest that the nearest neighbor exchange in
${\rm Dy_{2}Ti_{2}O_{7}}$ is {\it antiferromagnetic} and that spin ice behavior
is induced by long range dipolar interactions.
","[{""version"":""v1"",""created"":""Tue, 25 Jan 2000 16:55:27 GMT""}]","2009-10-31"
"cond-mat/0001370","Martin Evers","Dirk Hessinger, Martin Evers, Thomas Palberg","Independent Ion Migration in Suspensions of Strongly Interacting Charged
  Colloidal Spheres","32 pages, 17 figures, 2 tables, Accepted by Physical Review E","Physical Review E 61, 5493-5506 (2000)","10.1103/PhysRevE.61.5493",,"cond-mat.soft cond-mat.mtrl-sci",,"  We report on sytematic measurements of the low frequency conductivity in
aequous supensions of highly charged colloidal spheres. System preparation in a
closed tubing system results in precisely controlled number densities between
1E16/m3 and 1E19/m^3 (packing fractions between 1E-7 and 1E-2) and electrolyte
concentrations between 1E-7 and 1E-3 mol/l. Due to long ranged Coulomb
repulsion some of the systems show a pronounced fluid or crystalline order.
Under deionized conditions we find s to depend linearily on the packing
fraction with no detectable influence of the phase transitions. Further at
constant packing fraction s increases sublinearily with increasing number of
dissociable surface groups N. As a function of c the conductivity shows
pronounced differences depending on the kind of electrolyte used. We propose a
simple yet powerful model based on independent migration of all species present
and additivity of the respective conductivity contributions. It takes account
of small ion macro-ion interactions in terms of an effectivly transported
charge. The model successfully describes our qualitatively complex experimental
observations. It further facilitates quantitative estimates of conductivity
over a wide range of particle and experimental parameters.
","[{""version"":""v1"",""created"":""Tue, 25 Jan 2000 17:59:52 GMT""}]","2009-10-31"
"cond-mat/0001371","G. Mihaly","L. Forro, R. Gaal, H. Berger, P. Fazekas, K. Penc, I. Kezsmarki and G.
  Mihaly","Pressure Induced Quantum Critical Point and Non-Fermi-Liquid Behavior in
  BaVS3","4 pages, 5 eps figures, problem with figure corrected","Phys. Rev. Lett. 85, 1938 (2000)","10.1103/PhysRevLett.85.1938",,"cond-mat.str-el cond-mat.mtrl-sci",,"  The phase diagram of BaVS3 is studied under pressure using resistivity
measurements. The temperature of the metal to nonmagnetic Mott insulator
transition decreases under pressure, and vanishes at the quantum critical point
p_cr=20kbar. We find two kinds of anomalous conducting states. The
high-pressure metallic phase is a non-Fermi liquid described by Delta rho = T^n
where n=1.2-1.3 at 1K < T < 60K. At p<p_cr, the transition is preceded by a
wide precursor region with critically increasing resistivity which we ascribe
to the opening of a soft Coulomb gap.
","[{""version"":""v1"",""created"":""Tue, 25 Jan 2000 18:24:26 GMT""},{""version"":""v2"",""created"":""Fri, 28 Jan 2000 15:16:17 GMT""}]","2009-10-31"
"cond-mat/0001372","Boris I. Belevtsev","B. I. Belevtsev, V. B. Krasovitsky, V. V. Bobkov, D. G. Naugle, K. D.
  D. Rathnayaka and A. Parasiris","Influence of high-energy electron irradiation on the transport
  properties of La_{1-x}Ca_{x}MnO_{3} films (x \approx 1/3)","RevTex, 22 pages, 3 Postscript figures, submitted to Eur. Phys. J. B","Eur. Phys. J. B, vol.15, pp 461-468 (2000)","10.1007/PL00011046",,"cond-mat.mtrl-sci",,"  The effect of crystal lattice disorder on the conductivity and colossal
magnetoresistance in La_{1-x}Ca_{x}MnO_{3} (x \approx 0.33) films has been
examined. The lattice defects are introduced by irradiating the film with
high-energy (\simeq 6 MeV) electrons with a maximal fluence of about 2\times
10^{17} cm^{-2}. This comparatively low dose of irradiation produces rather
small radiation damage in the films. The number of displacements per atom (dpa)
in the irradiated sample is about 10^{-5}. Nethertheless, this results in an
appreciable increase in the film resistivity. The percentage of resistivity
increase in the ferromagnetic metallic state (below the Curie tempetature
T_{c}) was much greater than that observed in the insulating state (above
T_{c}). At the same time irradiation has much less effect on T_{c} or on the
magnitude of the colossal magnetoresistance. A possible explanation of such
behavior is proposed.
","[{""version"":""v1"",""created"":""Tue, 25 Jan 2000 18:55:58 GMT""}]","2015-06-24"
"cond-mat/0001373","Alessio Filippetti","Alessio Filippetti and Warren E. Pickett","Double exchange-driven spin pairing at the (001) surface of manganites","6 pages, 4 figures",,"10.1103/PhysRevB.62.11571",,"cond-mat.mtrl-sci",,"  The (001) surface of La_{1-x}Ca_xMnO_3 system in various magnetic orderings
is studied by first principle calculations. A general occurrence is that z^2
dangling bond charge -- which is ``invisible'' in the formal valence picture --
is promoted to the bulk gap/Fermi level region. This drives a
double-exchange-like process that serves to align the surface Mn spin with its
subsurface neighbor, regardless of the bulk magnetic order. For heavy doping,
the locally ``ferromagnetic'' coupling is very strong and the moment enhanced
by as much as 30% over the bulk value.
","[{""version"":""v1"",""created"":""Tue, 25 Jan 2000 19:04:20 GMT""}]","2009-10-31"
"cond-mat/0001374","Andrey Zheludev","A. Zheludev, T. Masuda, I. Tsukada, Y. Uchiyama, K. Uchinokura, P.
  Boni, S.-H. Lee","Magnetic excitations in coupled Haldane spin chains near the quantum
  critical point","15 figures, Figs. 5,9, and 10 in color. Some figures in JPEG format.
  Complete PostScript and PDF available from
  http://papillon.phy.bnl.gov/publicat.htm",,"10.1103/PhysRevB.62.8921",,"cond-mat.str-el",,"  Two quasi-1-dimensional S=1 quantum antiferromagnetic materials, PbNi2V2O8
and SrNi2V2O8, are studied by inelastic neutron scattering on powder samples.
While magnetic interactions in the two systems are found to be very similar,
subtle differences in inter-chain interaction strengths and magnetic anisotropy
are detected. The latter are shown to be responsible for qualitatively
different ground state properties: magnetic long-range order in SrNi2V2O8 and
disordered ``spin liquid'' Haldane-gap state in PbNi2V2O8.
","[{""version"":""v1"",""created"":""Tue, 25 Jan 2000 21:23:23 GMT""},{""version"":""v2"",""created"":""Wed, 26 Jan 2000 16:30:41 GMT""}]","2009-10-31"
