"astro-ph/0010147","Marc Duldig","M. L. Duldig (Australian Antarctic Division)","Australian Cosmic Ray Modulation Research","47 pages, 37 figures, LaTeX, invited review, in press PASA 18(1).
  HTML version available at http://www.atnf.csiro.au/pasa/18_1/duldig/paper/","Publications of the Astronomical Society of Australia (2001)","10.1071/AS01003",,"astro-ph",,"  Australian research into variations of the cosmic ray flux arriving at the
Earth has played a pivotal role for more than 50 years. The work has been
largely led by the groups from the University of Tasmania and the Australian
Antarctic Division and has involved the operation of neutron monitors and muon
telescopes from many sites. In this paper the achievements of the Australian
researchers are reviewed and future experiments are described. Particular
highlights include: the determination of cosmic ray modulation parameters; the
development of modelling techniques of Ground Level Enhancements; the
confirmation of the Tail-In and Loss-Cone Sidereal anisotropies; the Space Ship
Earth collaboration; and the Solar Cycle latitude survey.
","[{""version"":""v1"",""created"":""Sun, 8 Oct 2000 08:25:24 GMT""}]","2009-10-31"
"astro-ph/0010154","K. J. Brooks","K. J. Brooks, M. G. Burton, J. M. Rathborne, M. C. B. Ashley, J. W. V.
  Storey","Unlocking the Keyhole - H2 and PAH emission from molecular clumps in the
  Keyhole Nebula","8 pages, 4 figures, to be published in MNRAS","Mon.Not.Roy.Astron.Soc. 319 (2000) 95","10.1046/j.1365-8711.2000.03798.x",,"astro-ph",,"  To better understand the environment surrounding CO emission clumps in the
Keyhole Nebula, we have made images of the region in H2 1-0 S(1) (2.122 um)
emission and polycyclic aromatic hydrocarbon (PAH) emission at 3.29 um. Our
results show that the H2 and PAH emission regions are morphologically similar,
existing as several clumps, all of which correspond to CO emission clumps and
dark optical features. The emission confirms the existence of photodissociation
regions (PDRs) on the surface of the clumps. By comparing the velocity range of
the CO emission with the optical appearance of the H2 and PAH emission, we
present a model of the Keyhole Nebula in which the most negative velocity
clumps are in front of the ionization region, the clumps at intermediate
velocities are in it, and those which have the least negative velocities are at
the far side. It may be that these clumps, which appear to have been swept up
from molecular gas by the stellar winds from eta Car, are now being over-run by
the ionization region and forming PDRs on their surfaces. These clumps comprise
the last remnants of the ambient molecular cloud around eta Car.
","[{""version"":""v1"",""created"":""Sun, 8 Oct 2000 10:34:18 GMT""}]","2009-10-31"
"cond-mat/0010121","Beom Jun Kim","Beom Jun Kim (Umea University)","Current-voltage characteristics of the two-dimensional XY model with
  Monte Carlo dynamics","5 pages in two columns including 5 figures, to appear in PRB","Phys. Rev. B 63, 024503 (2001)","10.1103/PhysRevB.63.024503",,"cond-mat.supr-con",,"  Current-voltage characteristics and the linear resistance of the
two-dimensional XY model with and without external uniform current driving are
studied by Monte Carlo simulations. We apply the standard finite-size scaling
analysis to get the dynamic critical exponent $z$ at various temperatures. From
the comparison with the resistively-shunted junction dynamics, it is concluded
that $z$ is universal in the sense that it does not depend on details of
dynamics. This comparison also leads to the quantification of the time in the
Monte Carlo dynamic simulation.
","[{""version"":""v1"",""created"":""Sat, 7 Oct 2000 22:36:14 GMT""}]","2007-05-23"
"cond-mat/0010122","Po-zen Wong","Hao Qi, Jian Ma, Po-zen Wong","Numerical study of multilayer adsorption on fractal surfaces","11 pages, 3 figures",,"10.1103/PhysRevE.64.041601",,"cond-mat.soft cond-mat.dis-nn",,"  We report a numerical study of van der Waals adsoprtion and capillary
condensation effects on self-similar fractal surfaces. An assembly of uncoupled
spherical pores with a power-law distributin of radii is used to model fractal
surfaces with adjustable dimensions. We find that the commonly used fractal
Frankel-Halsey-Hill equation systematically fails to give the correct dimension
due to crossover effects, consistent with the findings of recent experiments.
The effects of pore coupling and curvature dependent surface tension were also
studied.
","[{""version"":""v1"",""created"":""Sat, 7 Oct 2000 22:52:24 GMT""}]","2009-10-31"
"cond-mat/0010123","Cynthia J. Olson","C.J. Olson, C. Reichhardt, and S. Bhattacharya","Critical depinning force and vortex lattice order in disordered
  superconductors","5 pages, 6 figures","Phys. Rev. B 64, 024518 (2001)","10.1103/PhysRevB.64.024518",,"cond-mat.supr-con",,"  We simulate the ordering of vortices and its effects on the critical current
in superconductors with varied vortex-vortex interaction strength and varied
pinning strengths for a two-dimensional system. For strong pinning the vortex
lattice is always disordered and the critical depinning force only weakly
increases with decreasing vortex-vortex interactions. For weak pinning the
vortex lattice is defect free until the vortex-vortex interactions have been
reduced to a low value, when defects begin to appear with a simultaneous rapid
increase in the critical depinning force. In each case the depinning force
shows a maximum for non-interacting vortices. The relative height of the peak
increases and the peak width decreases for decreasing pinning strength in
excellent agreement with experimental trends associated with the peak effect.
We show that scaling relations exist between the distance between defects in
the vortex lattice and the critical depinning force.
","[{""version"":""v1"",""created"":""Sat, 7 Oct 2000 23:46:08 GMT""}]","2009-10-31"
"cond-mat/0010124","Zhou Xin","Xin Zhou, Hu Chen, and Ou-Yang Zhong-can","Can Electric Field Induced Energy Gaps In Metallic Carbon Nanotubes?",,,"10.1088/0953-8984/13/27/104",,"cond-mat.mes-hall",,"  The low-energy electronic structure of metallic single-walled carbon nanotube
(SWNT) in an external electric field perpendicular to the tube axis is
investigated. Based on tight-binding approximation, a field-induced energy gap
is found in all (n, n) SWNTs, and the gap shows strong dependence on the
electric field and the size of the tubes. We numerically find a universal
scaling that the gap is a function of the electric field and the radius of
SWNTs, and the results are testified by the second-order perturbation theory in
weak field limit. Our calculation shows the field required to induce a 0.1
${\rm eV}$ gap in metallic SWNTs can be easily reached under the current
experimental conditions. It indicates a kind of possibility to apply nanotubes
to electric signal-controlled nanoscale switching devices.
","[{""version"":""v1"",""created"":""Sun, 8 Oct 2000 02:36:52 GMT""},{""version"":""v2"",""created"":""Mon, 4 Jun 2001 02:23:11 GMT""}]","2009-10-31"
"cond-mat/0010125","O. M. Braun","O. M. Braun","Role of entropy barriers for diffusion in the periodic potential","9 pages, 10 Postscript figures, to be published in Phys. Rev. E
  (2000)",,"10.1103/PhysRevE.63.011102","Preprint of Inst. of Physics NASU No. 37 (2000)","cond-mat.stat-mech cond-mat.mtrl-sci",,"  Diffusion of a particle in the N-dimensional external potential which is
periodic in one dimension and unbounded in the other N-1 dimensions is
investigated. We find an analytical expression for the overdamped diffusion and
study numerically the cases of moderate and low damping. We show that in the
underdamped limit, the multi-dimensional effects lead to reduction (comparing
with the one-dimensional motion) of jump lengths between subsequent trapping of
the atom in bottoms of the external periodic potential. As application we
consider the diffusion of a dimer adsorbed on the crystal surface.
","[{""version"":""v1"",""created"":""Sun, 8 Oct 2000 03:50:06 GMT""}]","2016-08-31"
"cond-mat/0010126","O. M. Braun","O. M. Braun","Supersonic and multiple topological excitations in the driven
  Frenkel-Kontorova model with exponential interaction","6 pages, 3 Postscript figures, to be published in Phys. Rev. E (2000)",,"10.1103/PhysRevE.62.7315","Preprint of Inst. of Physics NASU No. 38 (2000)","cond-mat.mtrl-sci",,"  The criteria for the existence of supersonic and multiple topological
excitations (kinks) in the driven Frenkel-Kontorova model (a chain of atoms
placed into an external periodic potential) with anharmonic (exponential)
interatomic interactions are studied.
","[{""version"":""v1"",""created"":""Sun, 8 Oct 2000 10:55:02 GMT""}]","2009-10-31"
"gr-qc/0010026","Francisco Navarro","F. J. Chinea (Univ. Complutense, Madrid (Spain)), F. Navarro-Lerida
  (Univ. Complutense, Madrid (Spain))","Twisting type-N vacuum fields with a group $H_2$","LaTeX, 11 pages. To be published in Classical and Quantum Gravity","Class.Quant.Grav. 17 (2000) 4587-4596","10.1088/0264-9381/17/21/314",,"gr-qc",,"  We derive the equations corresponding to twisting type-N vacuum gravitational
fields with one Killing vector and one homothetic Killing vector by using the
same approach as that developed by one of us in order to treat the case with
two non-commuting Killing vectors. We study the case when the homothetic
parameter $\phi$ takes the value -1, which is shown to admit a reduction to a
third-order real ordinary differential equation for this problem, similar to
that previously obtained by one of us when two Killing vectors are present.
","[{""version"":""v1"",""created"":""Sat, 7 Oct 2000 21:28:27 GMT""}]","2009-10-31"
"gr-qc/0010027","Shrirang S. Deshingkar","S. S. Deshingkar, S. Jhingan, A. Chamorro and P. S. Joshi","Gravitational Collapse and Cosmological Constant","18 pages, no figures","Phys.Rev. D63 (2001) 124005","10.1103/PhysRevD.63.124005",,"gr-qc",,"  We consider here the effects of a non-vanishing cosmological term on the
final fate of a spherical inhomogeneous collapsing dust cloud. It is shown that
depending on the nature of the initial data from which the collapse evolves,
and for a positive value of the cosmological constant, we can have a globally
regular evolution where a bounce develops within the cloud. We characterize
precisely the initial data causing such a bounce in terms of the initial
density and velocity profiles for the collapsing cloud. In the cases otherwise,
the result of collapse is either formation of a black hole or a naked
singularity resulting as the end state of collapse. We also show here that a
positive cosmological term can cover a part of the singularity spectrum which
is visible in the corresponding dust collapse models for the same initial data.
","[{""version"":""v1"",""created"":""Sun, 8 Oct 2000 05:47:28 GMT""}]","2009-10-31"
"gr-qc/0010028","Mohammad Reza Setare","M. R. Setare and R. Mansouri","Casimir Effect for Spherical Shell in de Sitter Space","9 pages, submitted to Class. Quantum Grav","Class.Quant.Grav. 18 (2001) 2331","10.1088/0264-9381/18/12/308",,"gr-qc",,"  The Casimir stress on a spherical shell in de Sitter background for massless
scalar field satisfying Dirichlet boundary conditions on the shell is
calculated. The metric is written in conformally flat form. Although the metric
is time dependent no particles are created. The Casimir stress is calculated
for inside and outside of the shell with different backgrounds corresponding to
different cosmological constants. The detail dynamics of the bubble depends on
different parameter of the model. Specifically, bubbles with true vacuum inside
expand if the difference in the vacuum energies is small, otherwise they
collapse.
","[{""version"":""v1"",""created"":""Sun, 8 Oct 2000 11:00:40 GMT""},{""version"":""v2"",""created"":""Tue, 10 Oct 2000 14:06:17 GMT""},{""version"":""v3"",""created"":""Sun, 17 Dec 2000 10:01:17 GMT""}]","2009-10-31"
"hep-ex/0010016","Eckhard Elsen","H1 Collaboration: C. Adloff, et al","Dijet Production in Charged and Neutral Current e^+p Interactions at
  High Q^2","28 pages, 10 figures, 4 tables","Eur.Phys.J.C19:429-440,2001","10.1007/s100520100622","DESY-00-143","hep-ex",,"  Jet production in charged and neutral current events in the kinematic range
of Q^2 from 640 to 35000 GeV^2 is studied in deep-inelastic positron-proton
scattering at HERA. The measured rate of multi-jet events and distributions of
jet polar angle, transverse energy, dijet mass, and other dijet variables are
presented. Using parton densities derived from inclusive DIS cross sections,
perturbative QCD calculations in NLO are found to give a consistent description
of both the neutral and charged current dijet production. A direct, model
independent comparison of the jet distributions in charged and neutral current
events confirms that the QCD dynamics of the hadronic final state is
independent of the underlying electroweak scattering process.
","[{""version"":""v1"",""created"":""Sun, 8 Oct 2000 06:13:36 GMT""}]","2009-01-07"
"hep-ph/0010070","Badri Magradze","B.A. Magradze (Joint Institute for Nuclear Research, Dubna, and A.
  Razmadze Mathematical Institute, Tbilisi.)","QCD coupling up to third order in standard and analytic perturbation
  theories","21 pages, Latex, 12 tables. Abstract is changed. The recurrence
  formulas (18)-(20) are added. Formula (35) corrected and Table 2 is revised.
  Misprint in formula (37) is corrected. Formula (38) added","Communication of the Joint Institute for Nuclear Research,
  E2-2000-222, Dubna 2000",,"RMI-000-45","hep-ph",,"  We analyze two sets of specific functions, that/which form the basis of the
nonpower asymptotic expansions both in the timelike and spacelike regions for
single scale dependent QCD observables in the Shirkov--Solovtsov's Analytic
Perturbation Theory (APT) free of unphysical singularities. These functions are
explicitly derived up to the third order in the closed form in terms of the
Lambert-W function. As an input we used the exact two loop and the three loop
(corresponding to Pad\'e transformed beta-function) RG solutions for common
invariant coupling \alpha_s. The elegant recurrence formulas, helpful for
numerical analysis, are obtained for the both sets of the APT functions. Then
we construct the global versions of APT functions using the continuity
conditions (at the quark thresholds) on the \alpha_s in the \bar{MS} scheme and
give numerical results. For first three of these functions \mathfrak{A}_n(s)
and {\cal A}_n(Q^2); n=1,2,3 in the large interval of the momentum transfer and
energy (1 GeV <Q,{\sqrt s}< 170 GeV), numerical tables are presented. From
these we observe that, for the timelike arguments, the differences between
functions \mathfrak{A}_n(s) and the corresponding powers of the standard
iteratively approximated coupling \alpha_s^n(s) are not negligible even for
moderate energies in the five--flavor region.
","[{""version"":""v1"",""created"":""Sun, 8 Oct 2000 12:45:27 GMT""},{""version"":""v2"",""created"":""Thu, 9 Nov 2000 11:27:40 GMT""},{""version"":""v3"",""created"":""Tue, 14 Nov 2000 15:25:12 GMT""},{""version"":""v4"",""created"":""Sun, 7 Jan 2001 12:58:19 GMT""}]","2007-05-23"
"hep-ph/0010071","Stephen C. Davis","Stephen C. Davis","Cosmic Strings and Cooper Pairs","12 pages","Phys.Lett. B497 (2001) 117-124","10.1016/S0370-2693(00)01311-3","SWAT/267","hep-ph astro-ph cond-mat.supr-con hep-th",,"  It is shown that it is possible for bound fermions on a cosmic string to form
a superconducting state. Due to the attractive force between them, particles
moving in opposite directions along the string form bound pairs. This involves
a similar mechanism to superconductivity in metals at low temperatures. The
method of Gorkov is used to analyse the system. In contrast to the situation in
metals, the unusual properties of the string fermion spectrum allow a massless
Abelian gauge field to provide the required attractive force. This results in
far stronger superconductivity than usual. A massive gauge field can also be
used, in which case the standard results apply.
","[{""version"":""v1"",""created"":""Sun, 8 Oct 2000 14:42:48 GMT""}]","2009-10-31"
"hep-th/0010051","Andrei Litvintsev","Andrei Litvintsev and Peter van Nieuwenhuizen","Once more on the BPS bound for the susy kink","28 pages, 4 figures",,,"YITP-00-18","hep-th",,"  We consider a new momentum cut-off scheme for sums over zero-point energies,
containing an arbitrary function f(k) which interpolates smoothly between the
zero-point energies of the modes around the kink and those in flat space. A
term proportional to df(k)/dk modifies the result for the one-loop quantum mass
M^(1) as obtained from naive momentum cut-off regularization, which now agrees
with previous results, both for the nonsusy and susy case. We also introduce a
new regularization scheme for the evaluation of the one-loop correction to the
central charge Z^(1), with a cut-off K for the Dirac delta function in the
canonical commutation relations and a cut-off \Lambda for the loop momentum.
The result for Z^(1) depends only on whether K>\Lambda or K<\Lambda or
K=\Lambda. The last case yields the correct result and saturates the BPS bound,
M^(1)=Z^(1),in agreement with the fact that multiplet shortening does occur in
this N=(1,1) system. We show how to apply mode number regularization by
considering first a kink-antikink system, and also obtain the correct result
with this method. Finally we discuss the relation of these new schemes to
previous approaches based on the Born expansion of phase shifts and
higher-derivative regularization.
","[{""version"":""v1"",""created"":""Sat, 7 Oct 2000 21:02:37 GMT""},{""version"":""v2"",""created"":""Tue, 28 Nov 2000 22:49:26 GMT""}]","2007-05-23"
"hep-th/0010052","Giuseppe Policastro","P. A. Grassi, G. Policastro and M. Porrati","Notes on the Quantization of the Complex Linear Superfield","22 pages. A reference added","Nucl.Phys. B597 (2001) 615-632","10.1016/S0550-3213(00)00745-8","NYU-TH/00/09/11, SNS-PH/00-15","hep-th",,"  The quantization of the complex linear superfield requires an infinite tower
of ghosts. Using the Batalin-Vilkovisky technique, Grisaru, Van Proeyen, and
Zanon have been able to define a correct procedure to construct a gauge-fixed
action. We generalize their technique by introducing the Lagrange multipliers
into the non-minimal sector and we study the characteristic BRST cohomology. We
show how the physical subspace is singled out. Finally, we quantize the model
in the presence of a background and of a quantum gauge superfield.
","[{""version"":""v1"",""created"":""Sat, 7 Oct 2000 23:24:46 GMT""},{""version"":""v2"",""created"":""Tue, 14 Nov 2000 23:15:15 GMT""}]","2009-10-31"
"math/0010070","Andrzej Roslanowski","Andrzej Roslanowski and Saharon Shelah","Measured creatures",,"Israel J. Math. 151 (2006) 61-110",,"Shelah [RoSh:736]","math.LO math.CA math.GN",,"  Using forcing with measured creatures we build a universe of set theory in
which:
  (a) every sup-measurable function f:RxR-->R is measurable, and
  (b) every function f:R-->R is continuous on a non-measurable set.
  This answers a question of Balcerzak, Ciesielski and Kharazishvili and von
Weizsacker's problem (see Fremlin's list of problems).
","[{""version"":""v1"",""created"":""Sat, 7 Oct 2000 17:12:50 GMT""},{""version"":""v2"",""created"":""Thu, 8 Feb 2001 17:13:42 GMT""},{""version"":""v3"",""created"":""Sun, 23 Mar 2003 18:49:11 GMT""}]","2013-01-03"
"math/0010071","Stephen Semmes","Stephen Semmes","Real Analysis, Quantitative Topology, and Geometric Complexity","161 pages, Latex2e","Publicacions Matematiques (Barcelona) 45 (2001), 3--67, 265--333",,,"math.MG",,"  Contents
  1 Mappings and distortion
  2 The mathematics of good behavior much of the time, and the BMO frame of
mind
  3 Finite polyhedra and combinatorial parameterization problems
  4 Quantitative topology, and calculus on singular spaces
  5 Uniform rectifiability
  Appendices
  A Fourier transform calculations
  B Mappings with branching
  C More on existence and behavior of homeomorphisms
  D Doing pretty well with spaces which may not have nice coordinates
  E Some simple facts related to homology
","[{""version"":""v1"",""created"":""Sat, 7 Oct 2000 20:39:58 GMT""}]","2016-09-07"
"math/0010072","Dmitry E. Tamarkin","Dmitry E. Tamarkin","Deformation complex of a d-algebra is a (d+1)-algebra",,,,,"math.QA",,"  We prove thst the deformation complex of a d-algebra (shifted by 1-d) carries
a natural structure of (d+1)-algebra. This is a purely algebraic version of a
similkar theorem of Kontsevich.
","[{""version"":""v1"",""created"":""Sat, 7 Oct 2000 22:36:24 GMT""}]","2007-05-23"
"math/0010073","Taras Panov","Victor M. Buchstaber, Taras E. Panov","Torus actions, combinatorial topology and homological algebra","87 pages, 11 figures, LaTeX2e, to appear in Russian Math. Surveys 55
  (2000), no.5","Russian Math. Surveys 55 (2000), no.5, 825-921",,"ITEP-TH-48/00","math.AT math.AC math.AG math.CO math.GT math.RA",,"  The paper surveys some new results and open problems connected with such
fundamental combinatorial concepts as polytopes, simplicial complexes, cubical
complexes, and subspace arrangements. Particular attention is paid to the case
of simplicial and cubical subdivisions of manifolds and, especially, spheres.
We describe important constructions which allow to study all these
combinatorial objects by means of methods of commutative and homological
algebra. The proposed approach to combinatorial problems relies on the theory
of moment-angle complexes, currently being developed by the authors. The theory
centres around the construction that assigns to each simplicial complex $K$
with $m$ vertices a $T^m$-space $\zk$ with a special bigraded cellular
decomposition. In the framework of this theory, the well-known non-singular
toric varieties arise as orbit spaces of maximally free actions of subtori on
moment-angle complexes corresponding to simplicial spheres. We express
different invariants of simplicial complexes and related
combinatorial-geometrical objects in terms of the bigraded cohomology rings of
the corresponding moment-angle complexes. Finally, we show that the new
relationships between combinatorics, geometry and topology result in solutions
to some well-known topological problems.
","[{""version"":""v1"",""created"":""Sat, 7 Oct 2000 23:12:15 GMT""}]","2007-05-23"
"nucl-ex/0010006","Robert V. Cadman","R. V. Cadman, J. Brack, W. J. Cummings, J. A. Fedchak, B. D. Fox, H.
  Gao, W. Gl\""ockle, C. Grosshauser, R. J. Holt, C. E. Jones, E. R. Kinney, M.
  A. Miller, W. Nagengast, B. R. Owen, K. Rith, F. Schmidt, E. C. Schulte, J.
  Sowinski, F. Sperisen, E. L. Thorsland, R. Tobey, J. Wilbert, H. Wita{\l}a","Evidence for a three-nucleon-force effect in proton-deuteron elastic
  scattering","8 pages 2 figures Latex, submitted to Phys. Rev. Letters","Phys.Rev.Lett.86:967,2001","10.1103/PhysRevLett.86.967",,"nucl-ex",,"  Developments in spin-polarized internal targets for storage rings have
permitted measurements of 197 MeV polarized protons scattering from vector
polarized deuterons. This work presents measurements of the polarization
observables A_y, iT_11, and C_y,y in proton-deuteron elastic scattering. When
compared to calculations with and without three-nucleon forces, the
measurements indicate that three-nucleon forces make a significant contribution
to the observables. This work indicates that three-body forces derived from
static nuclear properties appear to be crucial to the description of dynamical
properties.
","[{""version"":""v1"",""created"":""Sat, 7 Oct 2000 21:25:56 GMT""}]","2011-08-19"
"nucl-th/0010026","Hideki Madokoro","Hideki Madokoro, Jie Meng, Masayuki Matsuzaki and Shuhei Yamaji","Relativistic mean field description for the shears band mechanism in
  $^{84}$Rb","5 pages, 6 eps figures included, uses REVTeX and epsf.sty, to appear
  in Phys. Rev. C","Phys.Rev.C62:061301,2000","10.1103/PhysRevC.62.061301",,"nucl-th",,"  For the first time, the Relativistic Mean Field (RMF) model is applied to the
shears band recently observed in $_{37}^{84}$Rb. Signals of the appearance of
the shears mechanism, such as smooth decreases of the shears angle and of the
$B$(M1)/$B$(E2) ratio with keeping the nearly constant tilt angle, are well
reproduced. Thus it is shown that the microscopic RMF model can nicely describe
the shears band in this nucleus.
","[{""version"":""v1"",""created"":""Sun, 8 Oct 2000 14:18:49 GMT""}]","2008-11-26"
