"nucl-th/0010071","Elena Bratkovskaya","W. Cassing, E. L. Bratkovskaya, A. Sibirtsev (Univ. Giessen)","Open charm production in relativistic nucleus-nucleus collisions","46 pages, LaTeX, including 19 postscript figures, to be published in
  Nucl. Phys. A","Nucl.Phys. A691 (2001) 753-778","10.1016/S0375-9474(01)00562-0",,"nucl-th",,"  We calculate excitation functions for open charm mesons in $Au+Au$ reactions
from AGS to RHIC energies within the HSD transport approach which is based on
string, quark, diquark ($q, \bar{q}, qq, \bar{q}\bar{q}$) and hadronic degrees
of freedom. The open charm cross sections from $pN$ and $\pi N$ reactions are
fitted to results from PYTHIA and scaled in magnitude to the available
experimental data. From our dynamical calculations we find an approximate
$m_T$-scaling for pions, kaons, $D$-mesons and $J/\Psi$ -- when discarding
final state elastic scattering of kaons and $\phi$-mesons with pions -- in
central collisions of $Au + Au$ at 160 A$\cdot$GeV (with an apparent slope of
176 MeV) without employing the assumption of a Quark-Gluon Plasma (QGP). We
demonstrate that this result is essentially due to a relative $m_T$-scaling in
$pp$ collisions at $\sqrt{s} \approx$ 17.3 GeV. At lower bombarding energies of
25 A$\cdot$GeV a suppression of $D$-mesons by a factor of $\sim$ 10 relative to
a global $m_T$-scaling with slope 143 MeV is expected. However, when
incorporating attractive $D$-meson self energies as suggested by QCD sum rules,
an approximate $m_T$-scaling is regained even at 25 A$\cdot$GeV. The effects of
$D$-meson rescattering and charmonium absorption are discussed, furthermore,
with respect to rapidity and transverse mass distributions in central
collisions of $Au + Au$ at 25, 160 A$\cdot$GeV and 21.3 A$\cdot$TeV.
","[{""version"":""v1"",""created"":""Sat, 21 Oct 2000 18:45:38 GMT""},{""version"":""v2"",""created"":""Fri, 12 Jan 2001 14:23:55 GMT""}]","2009-11-06"
"nucl-th/0010072","Nikolay Minkov","Nikolay Minkov, S. B. Drenska, P. P. Raychev, R. P. Roussev and Dennis
  Bonatsos","Ground-gamma band mixing and odd-even staggering in heavy deformed
  nuclei","25 pages, 11 postscript figures","Phys.Rev. C61 (2000) 064301","10.1103/PhysRevC.61.064301",,"nucl-th",,"  It is proposed that the odd-even staggering (OES) in the $\gamma$- bands of
heavy deformed nuclei can be reasonably characterized by a discrete
approximation of the fourth derivative of the odd-even energy difference as a
function of angular momentum $L$. This quantity exhibits a well developed
staggering pattern (zigzagging behavior with alternating signs) in rare earth
nuclei and actinides with long $\gamma$- bands ($L\geq 10$). It is shown that
the OES can be interpreted reasonably as the result of the interaction of the
$\gamma$ band with the ground band in the framework of a Vector Boson Model
with SU(3) dynamical symmetry. The model energy expression reproduces
successfully the staggering pattern in all considered nuclei up to $L=12-13$.
The general behavior of the OES effect in rotational regions is studied in
terms of the ground--$\gamma$ band-mixing interaction, showing that strong OES
effect occurs in regions with strong ground--$\gamma$ band-mixing interaction.
The approach used allows a detailed comparison of the OES in $\gamma$ bands
with the other kinds of staggering effects in nuclei and diatomic molecules.
","[{""version"":""v1"",""created"":""Sun, 22 Oct 2000 13:46:07 GMT""}]","2009-11-06"
"physics/0010052","Igor Stepanov","I. A. Stepanov (University of Latvia, Riga, Latvia)","The Law of Conservation of Energy in Chemical Reactions","e-mail me istepanov@email.com, 10 pages",,,"RAS 119-2000","physics.chem-ph",,"  Earlier it has been supposed that the law of conservation of energy in
chemical reactions has the following form: DU=DQ-PDV+SUM(muiDN) In the present
paper it has been proved by means of the theory of ordinary differential
equations that in the biggest part of the chemical reactions it must have the
following form: DU=DQ+PDV+SUM(muiDN) The result obtained allows to explain a
paradox in chemical thermodynamics: the heat of chemical processes measured by
calorimetry and by the Vant-Hoff equation differs very much from each other.
The result is confirmed by many experiments.
","[{""version"":""v1"",""created"":""Sat, 21 Oct 2000 16:17:14 GMT""}]","2007-05-23"
"quant-ph/0010077","Daniel A. Lidar","Eli Biham (1), Ofer Biham (2), David Biron (3), Markus Grassl (4),
  Daniel A. Lidar (5), and Daniel Shapira (2) ((1) Technion, (2) Hebrew
  University, (3) Weizmann Institute, (4) Karlsruhe University, (5) University
  of Toronto)","Analysis of Generalized Grover's Quantum Search Algorithms Using
  Recursion Equations","8 pages, no figures. To appear in Phys. Rev. A","Phys. Rev. A 63, 012310 (2001)","10.1103/PhysRevA.63.012310",,"quant-ph",,"  The recursion equation analysis of Grover's quantum search algorithm
presented by Biham et al. [PRA 60, 2742 (1999)] is generalized. It is applied
to the large class of Grover's type algorithms in which the Hadamard transform
is replaced by any other unitary transformation and the phase inversion is
replaced by a rotation by an arbitrary angle. The time evolution of the
amplitudes of the marked and unmarked states, for any initial complex amplitude
distribution is expressed using first order linear difference equations. These
equations are solved exactly. The solution provides the number of iterations T
after which the probability of finding a marked state upon measurement is the
highest, as well as the value of this probability, P_max. Both T and P_max are
found to depend on the averages and variances of the initial amplitude
distributions of the marked and unmarked states, but not on higher moments.
","[{""version"":""v1"",""created"":""Sat, 21 Oct 2000 20:42:06 GMT""}]","2016-09-08"
"quant-ph/0010078","Theor. Phys. Group","Qiong-gui Lin","On the partial wave amplitude of Coulomb scattering in three dimensions","revtex, 6 pages, no figure","Am. J. Phys. 68 (2000) 1056-1057","10.1119/1.1286117",,"quant-ph",,"  The partial wave series for the Coulomb scattering amplitude in three
dimensions is evaluated in a very simple way to give the closed result.
","[{""version"":""v1"",""created"":""Sun, 22 Oct 2000 09:18:38 GMT""}]","2009-11-06"
