"cond-mat/0007510","Oriol T. Valls","Klaus Halterman, Oriol T. Valls, and Igor Zutic","Angular dependence of the penetration depth in unconventional
  superconductors","16 pages plus nine figures","Phys. Rev. B63 014501 (2001)","10.1103/PhysRevB.63.014501",,"cond-mat.supr-con",,"  We examine the Meissner state nonlinear electrodynamic effects on the field
and angular dependence of the low temperature penetration depth, $\lambda$, of
superconductors in several kinds of unconventional pairing states, with nodes
or deep minima (``quasinodes'') in the energy gap. Our calculations are
prompted by the fact that, for typical unconventional superconducting material
parameters, the predicted size of these effects for $\lambda$ exceeds the
available experimental precision for this quantity by a much larger factor than
for others. We obtain expressions for the nonlinear component of the
penetration depth, $\Delta\lambda$, for different two- and three- dimensional
nodal or quasinodal structures. Each case has a characteristic signature as to
its dependence on the size and orientation of the applied magnetic field. This
shows that $\Delta\lambda$ measurements can be used to elucidate the nodal or
quasinodal structure of the energy gap. For nodal lines we find that
$\Delta\lambda$ is linear in the applied field, while the dependence is
quadratic for point nodes. For layered materials with
$\rm{YBa_2Cu_3O_{7-\delta}}$ (YBCO) type anisotropy, our results for the
angular dependence of $\Delta\lambda$ differ greatly from those for tetragonal
materials and are in agreement with experiment. For the two- and three-
dimensional quasinodal cases, $\Delta\lambda$ is no longer proportional to a
power of the field and the field and angular dependences are not separable,
with a suppression of the overall signal as the node is filled in.
","[{""version"":""v1"",""created"":""Mon, 31 Jul 2000 16:39:19 GMT""}]","2009-10-31"
"cond-mat/0007511","Shashi Paul","S.Paul and F.J Clough","Substrate Sensitivity of the Adhesion and Material Properties of
  RF-Pecvd Amorphous Carbon","6 pages, 4 figures","Materials Research Society Proceedings Vol.558, pp.149-154",,,"cond-mat.mtrl-sci",,"  Hydrogenated amorphous carbon (a-C:H), deposited by the rf-plasma enhanced
chemical vapour deposition (rf-PECVD) technique, is a promising material for
large area electronic and interlayer dielectric applications. The structural
and electronic properties of rf-PECVD a-C:H, deposited at room temperature from
CH4/He and CH4/Ar gas mixtures, are shown to be sensitive to the substrate on
which the thin film is deposited. The choice of substrate (c-Si or C7059
glass), and the existence and geometrical dimensions of any metallic pattern on
the substrate surface, can result in significant spatial variations in the
a-C:H adhesion and material properties. The observed effects are attributed to
potential variations across the metal patterned substrates which influence the
'local' dc self-bias. This leads to spatial variations in the growth conditions
and hence material properties. For electronic device and dielectric isolation
applications this effect can result in significant variations in operating
performance. The nature of the substrate and any overlying metallisation
pattern are therefore important considerations.
","[{""version"":""v1"",""created"":""Mon, 31 Jul 2000 16:40:58 GMT""}]","2007-05-23"
"cond-mat/0007512","Christian von Ferber","Christian von Ferber, Arben Jusufi, Martin Watzlawek, Christos N.
  Likos, Hartmut Lowen","Polydisperse star polymer solutions","14 pages, 7 figures","Phys.Rev. E 62 (2000) 6949","10.1103/PhysRevE.62.6949",,"cond-mat.soft",,"  We analyze the effect of polydispersity in the arm number on the effective
interactions, structural correlations and the phase behavior of star polymers
in a good solvent. The effective interaction potential between two star
polymers with different arm numbers is derived using scaling theory. The
resulting expression is tested against monomer-resolved molecular dynamics
simulations. We find that the theoretical pair potential is in agreement with
the simulation data in a much wider polydispersity range than other proposed
potentials. We then use this pair potential as an input in a many-body theory
to investigate polydispersity effects on the structural correlations and the
phase diagram of dense star polymer solutions. In particular we find that a
polydispersity of 10%, which is typical in experimental samples, does not
significantly alter previous findings for the phase diagram of monodisperse
solutions.
","[{""version"":""v1"",""created"":""Mon, 31 Jul 2000 16:55:56 GMT""}]","2009-10-31"
"cond-mat/0007513","Shashi Paul","Paul Shashi and F.J. Clough","High Reverse Breakdown A-C:H/Si Diodes Manufactured by rf-Pecvd","6 pages, 4 figures","MRS FALL MEETING -1999. Published in MRS Proceeding Vol. 593, pp.
  427-432",,,"cond-mat.mtrl-sci",,"  Thin films of hydrogenated amorphous carbon (a-C:H) deposited by radio
frequency plasma-enhanced chemical vapour deposition (rf-PECVD) have been
studied for various applications. An interesting property of these films is
their high breakdown strength (107 Vcm-1). This property of a-C:H can be
exploited in high breakdown heterostructure diodes or as passivation layers and
insulator layers in MIS devices. Reports on the applications of a-C:H/Si diodes
exist in the literature. Diodes in which the a-C:H films have been deposited by
rf-PECVD, have been reported only once. In this article the diodes produced
reportedly failed to exhibit reproducible I-V characteristics under high
voltage stress. We have investigated the process dependence of structural and
electrical properties of rf-PECVD a-C:H films deposited at room temperature
from a CH4/Ar gas mixture (at a pressure of 100 mTorr) using a capacitively
coupled rf-PECVD. We observe a clear correlation between the dc-self bias and
the rectification ratio of a-C:H/Si heterojunction diodes. Optimised diodes
show rectification ratios upto 104 and a stable reverse breakdown voltage,
typically around 850 V. I-V and C-V measurements show no evidence of hystersis.
Scanning Electron Microscopy was carried out to determine the quality of the
films deposited. Micro-Raman analysis was used to estimate the ID/IG ratio in
the films deposited under different dc-self bias.
","[{""version"":""v1"",""created"":""Mon, 31 Jul 2000 17:00:56 GMT""}]","2007-05-23"
"cond-mat/0007514","Sohrab Ismail-Beigi","Sohrab Ismail-Beigi, T. A. Arias, Phillip Marrone, Matthew Reagan,
  Jefferson W. Tester","A Priori Approach to Calculation of Energies of Solvation","6 figures, 2 tables, submitted to PRB",,,,"cond-mat.mtrl-sci cond-mat.soft",,"  We propose a systematic, {\em a priori} approach to the problem of the
calculation of solvation energies using continuum dielectric models coupled to
quantum mechanical description of reacting molecules. Our method does not rely
on empirically scaled van der Waals radii to create a dielectric cavity, but
rather uses the electron density of the reactants as the physical variable
describing the cavity. In addition, the precise choice of cavity is made by
ensuring that the dielectric reproduces the correct linear response of the
solvent to electrostatic perturbations. As a model application which is
interesting in its own right, we study the hydrolysis of methylene chloride, a
representative model waste compound in supercritical oxidation experiments, and
which has shown surprising solvation effects close to the critical point of
pure water (T=394$^o$ C, P=221 bar). Using our {\em a priori} methodology, we
find results in good agreement with available experimental reaction barriers.
We then study, in a controlled manner, the relative importance of various
further approximations that are routinely performed in the literature such as
the use of spherical cavities, the replacement of the reactant by a dipole, or
the neglect of self consistency in solving the electrostatic problem.
","[{""version"":""v1"",""created"":""Mon, 31 Jul 2000 18:31:15 GMT""}]","2007-05-23"
"cond-mat/0007515","Steven R. White","Douglas J. Scalapino and Steven R. White","Numerical Results for the Hubbard Model: Implications for the High Tc
  Pairing Mechanism","Dedicated to Martin C. Gutzwiller on the occasion of his 75th
  birthday. 13 pages, 5 figures",,,,"cond-mat.str-el cond-mat.supr-con",,"  Numerical studies of the Hubbard model and its strong-coupling form, the t-J
model, show evidence for antiferromagnetic, d_{x^2-y^2}-pairing and stripe
correlations which remind one of phenomena seen in the layered cuprate
materials. Here, we ask what these numerical results imply about various
scenarios for the pairing mechanism.
","[{""version"":""v1"",""created"":""Mon, 31 Jul 2000 21:42:49 GMT""}]","2007-05-23"
"cond-mat/0008001","Sergio O. Valenzuela","Sergio O. Valenzuela and Victoria Bekeris","Plasticity and memory effects in the vortex solid phase of twinned
  YBa2Cu3O7 single crystals",,"Phys. Rev. Lett. 84, 4200 (2000)","10.1103/PhysRevLett.84.4200",,"cond-mat.supr-con",,"  We report on marked memory effects in the vortex system of twinned YBa2Cu3O7
single crystals observed in ac susceptibility measurements. We show that the
vortex system can be trapped in different metastable states with variable
degree of order arising in response to different system histories. The pressure
exerted by the oscillating ac field assists the vortex system in ordering,
locally reducing the critical current density in the penetrated outer zone of
the sample. The robustness of the ordered and disordered states together with
the spatial profile of the critical current density lead to the observed memory
effects.
","[{""version"":""v1"",""created"":""Tue, 1 Aug 2000 00:03:25 GMT""}]","2009-10-31"
"cond-mat/0008002","Andy Schofield","R. S. Perry, L. M. Galvin, S. A. Grigera, L. Capogna, A. J. Schofield
  and A. P. Mackenzie (Birmingham), M. Chiao and S. R. Julian (Cambridge), S.
  Ikeda (Tsukuba), S. Nakatsuji and Y. Maeno (Kyoto) and C. Pfleiderer
  (Karlsruhe)","Metamagnetism and critical fluctuations in high quality single crystals
  of the bilayer ruthenate Sr3Ru2O7","4 pages, 4 figures, Revtex 3.1","Phys. Rev. Lett. 86, 2661 (2001)","10.1103/PhysRevLett.86.2661",,"cond-mat.str-el",,"  We report the results of low temperature transport, specific heat and
magnetisation measurements on high quality single crystals of the bilayer
perovskite Sr3Ru2O7, which is a close relative of the unconventional
superconductor Sr2RuO4. Metamagnetism is observed, and transport and
thermodynamic evidence for associated critical fluctuations is presented. These
relatively unusual fluctuations might be pictured as variations in the Fermi
surface topography itself. No equivalent behaviour has been observed in the
metallic state of Sr2RuO4.
","[{""version"":""v1"",""created"":""Tue, 1 Aug 2000 08:54:09 GMT""}]","2007-05-23"
"cond-mat/0008004","Yehuda Naveh","Y. Naveh (SUNY, Stony Brook) and B. Laikhtman (Hebrew University,
  Jerusalem)","Magnetotransport of coupled electron-holes","4 pages, 2 figures",,"10.1209/epl/i2001-00450-8",,"cond-mat.mes-hall cond-mat.str-el",,"  The carriers in InAs-GaSb double quantum wells are hybrid ``electron-holes''.
We study the magnetotransport properties of such particles using a
two-component Keldysh technique, which results in a semi-analytic expression
for the small-field current. We show that zero temperature current can be large
even when the Fermi energy lies within the hybridization gap, a result which
cannot be understood within a semiclassical (Boltzmann) approach. Magnetic
field dependence of the conductance is also affected significantly by the
hybridization of electrons and holes.
","[{""version"":""v1"",""created"":""Tue, 1 Aug 2000 01:56:05 GMT""}]","2009-10-31"
"cond-mat/0008005","Pudalov V. M.","B. L. Altshuler, G. W. Martin, D. L. Maslov, V. M. Pudalov, A. Prinz,
  G. Brunthaler, G. Bauer","Weak-localization type description of conduction in the ""anomalous""
  metallic state","LaTex, 9 pages with 9 figure",,,,"cond-mat.str-el",,"  This paper is devoted to the temperature dependence of the resistivity in Si-
MOS samples over the wide range of densities in the ``metallic phase'' (n>n_c)
but not too close to the critical density n_c. Three domains of different
behavior in \rho(T) are identified. These are: [i] quantum domain of
`low-temperatures', where a logarithmic T-dependence of \rho (with
$d\rho/dT<0$) dominates; [ii] semi-classical domain of `high-temperatures', in
which Drude resistivity strongly varies with T (with d\rho/dT>0); and [ii]
crossover between the former two, where a linear T-dependence dominates (with
d\rho/dT>0). In the crossover regime and at higher densities
(n>20x10^{11}/cm^2), \rho(T) goes through a minimum at temperature T_{min}.
Both the absolute value of T_{min} and its dependence on density are found to
be in an agreement with the conventional weak-localization theory. For n
smaller than \sim 20x10^{11}/cm^2, the theoretical estimate for T_{min} falls
outside the experimentally accessible temperature range. This explains the
absence of the minimum at these densities in the data. In total, over the two
decades in the temperature (domains [ii] and [iii]), the two semiclassical
effects mimic the metallic like transport properties. Our analysis shows that
the behaviour of \rho(T) in the region of \rho << h/e^2 can be described
phenomenologically in terms of the conventional weak-localization theory.
","[{""version"":""v1"",""created"":""Tue, 1 Aug 2000 06:46:06 GMT""}]","2007-05-23"
"cond-mat/0008006","Walter Kob","Peter Scheidler, Walter Kob, Arnulf Latz, Jurgen Horbach, and Kurt
  Binder (Institute of Physics, Mainz, Germany)","Frequency dependent specific heat of viscous silica","27 pages of Latex, 8 figures","Phys. Rev. B 63, 104204 (2001)","10.1103/PhysRevB.63.104204","KOMA-00-15","cond-mat.stat-mech cond-mat.dis-nn",,"  We apply the Mori-Zwanzig projection operator formalism to obtain an
expression for the frequency dependent specific heat c(z) of a liquid. By using
an exact transformation formula due to Lebowitz et al., we derive a relation
between c(z) and K(t), the autocorrelation function of temperature fluctuations
in the microcanonical ensemble. This connection thus allows to determine c(z)
from computer simulations in equilibrium, i.e. without an external
perturbation. By considering the generalization of K(t) to finite wave-vectors,
we derive an expression to determine the thermal conductivity \lambda from such
simulations. We present the results of extensive computer simulations in which
we use the derived relations to determine c(z) over eight decades in frequency,
as well as \lambda. The system investigated is a simple but realistic model for
amorphous silica. We find that at high frequencies the real part of c(z) has
the value of an ideal gas. c'(\omega) increases quickly at those frequencies
which correspond to the vibrational excitations of the system. At low
temperatures c'(\omega) shows a second step. The frequency at which this step
is observed is comparable to the one at which the \alpha-relaxation peak is
observed in the intermediate scattering function. Also the temperature
dependence of the location of this second step is the same as the one of the
$\alpha-$peak, thus showing that these quantities are intimately connected to
each other. From c'(\omega) we estimate the temperature dependence of the
vibrational and configurational part of the specific heat. We find that the
static value of c(z) as well as \lambda are in good agreement with experimental
data.
","[{""version"":""v1"",""created"":""Tue, 1 Aug 2000 06:44:50 GMT""}]","2009-10-31"
"cond-mat/0008007","Ranjini. B.","Ranjini Bandyopadhyay and A. K. Sood","Dynamical Behaviour in the Nonlinear Rheology of Surfactant Solutions","12 pages, includes 7 eps figures","""Statitical Physics"", AIP conference proceedings 519, edited by M.
  Tokuyama and H. E. Stanley, (AIP Melville, NY), 2000","10.1063/1.1291520",,"cond-mat.soft",,"  Several surfactant molecules self-assemble in solution to form long, flexible
wormlike micelles which get entangled with each other, leading to viscoelastic
gel phases. We discuss our recent work on the rheology of such a gel formed in
the dilute aqueous solutions of a surfactant CTAT. In the linear rheology
regime, the storage modulus $G^{\prime}(\omega)$ and loss modulus
$G^{\prime\prime}(\omega)$ have been measured over a wide frequency range. In
the nonlinear regime, the shear stress $\sigma$ shows a plateau as a function
of the shear rate $\dot\gamma$ above a certain cutoff shear rate
$\dot\gamma_c$. Under controlled shear rate conditions in the plateau regime,
the shear stress and the first normal stress difference show oscillatory
time-dependence. The analysis of the measured time series of shear stress and
normal stress has been done using several methods incorporating state space
reconstruction by embedding of time delay vectors.The analysis shows the
existence of a finite correlation dimension and a positive Lyapunov exponent,
unambiguously implying that the dynamics of the observed mechanical instability
can be described by that of a dynamical system with a strange attractor of
dimension varying from 2.4 to 2.9.
","[{""version"":""v1"",""created"":""Tue, 1 Aug 2000 07:21:08 GMT""}]","2009-10-31"
"cond-mat/0008008","Reinhold Egger","R. Egger, A. Bachtold, M. Fuhrer, M. Bockrath, D. Cobden, P. McEuen","Luttinger liquid behavior in metallic carbon nanotubes","Review, to appear in {\sl Interacting Electrons in Nanostructures},
  edited by R. Haug and H. Schoeller (Springer); 22 pages, 7 figures; style
  files incl",,,,"cond-mat.mes-hall cond-mat.str-el",,"  Coulomb interaction effects have pronounced consequences in carbon nanotubes
due to their 1D nature. In particular, correlations imply the breakdown of
Fermi liquid theory and typically lead to Luttinger liquid behavior
characterized by pronounced power-law suppression of the transport current and
the density of states, and spin-charge separation. This paper provides a review
of the current understanding of non-Fermi liquid effects in metallic
single-wall nanotubes (SWNTs). We provide a self-contained theoretical
discussion of electron-electron interaction effects and show that the tunneling
density of states exhibits power-law behavior. The power-law exponent depends
on the interaction strength parameter $g$ and on the geometry of the setup.
  We then show that these features are observed experimentally by measuring the
tunneling conductance of SWNTs as a function of temperature and voltage. These
tunneling experiments are obtained by contacting metallic SWNTs to two
nanofabricated gold electrodes. Electrostatic force microscopy (EFM)
measurements show that the measured resistance is due to the contact resistance
from the transport barrier formed at the electrode/nanotube junction. These EFM
measurements show also the ballistic nature of transport in these SWNTs. While
charge transport can be nicely attributed to Luttinger liquid behavior,
spin-charge separation has not been observed so far. We briefly describe a
transport experiment that could provide direct evidence for spin-charge
separation.
","[{""version"":""v1"",""created"":""Tue, 1 Aug 2000 08:19:33 GMT""}]","2016-08-31"
"cond-mat/0008009","Junko Satooka","K. Katsumata, M. Hagiwara, Z. Honda, J. Satooka, Amnon Aharony, R. J.
  Birgeneau, F. C. Chou, O. Entin-Wohlman, A. B. Harris, M. A. Kastner, Y. J.
  Kim, and Y. S. Lee","Direct Observation of the Quantum Energy Gap in S = 1/2 Tetragonal
  Cuprate Antiferromagnets","4 pages, 3 figures",,"10.1209/epl/i2001-00276-4",,"cond-mat",,"  Using an electron spin resonance spectrometer covering a wide range of
frequency and magnetic field, we have measured the low energy excitations of
the S=1/2 tetragonal antiferromagnets, Sr_{2}CuO_{2}Cl_{2} and
Sr_{2}Cu_{3}O_{4}Cl_{2}. Our observation of in-plane energy gaps of order 0.1
meV at zero external magnetic field are consistent with a spin wave
calculation, which includes several kinds of quantum fluctuations that remove
frustration. Results agree with other experiments and with exchange anisotropy
parameters determined from a five band Hubbard model.
","[{""version"":""v1"",""created"":""Tue, 1 Aug 2000 09:49:38 GMT""}]","2009-10-31"
"cond-mat/0008010","Maya Paczuski","Stefano Lise and Maya Paczuski","Self-Organized Criticality and Universality in a Nonconservative
  Earthquake Model","6 pages, 4 figures, submitted to PRE",,"10.1103/PhysRevE.63.036111",,"cond-mat.stat-mech",,"  We make an extensive numerical study of a two dimensional nonconservative
model proposed by Olami-Feder-Christensen to describe earthquake behavior. By
analyzing the distribution of earthquake sizes using a multiscaling method, we
find evidence that the model is critical, with no characteristic length scale
other than the system size, in agreement with previous results. However, in
contrast to previous claims, we find convergence to universal behaviour as the
system size increases, over a range of values of the dissipation parameter,
$\alpha$. We also find that both ``free'' and ``open'' boundary conditions tend
to the same result.
  Our analysis indicates that, as $L$ increases, the behaviour slowly converges
toward a power law distribution of earthquake sizes
  $P(s) \sim s^{-\tau}$ with exponent $\tau \simeq 1.8$. The universal value of
$\tau$ we find numerically agrees quantitatively with the empirical value
($\tau=B+1$) associated with the Gutenberg-Richter law.
","[{""version"":""v1"",""created"":""Tue, 1 Aug 2000 10:44:55 GMT""}]","2016-08-31"
"cond-mat/0008011","Noriaki Matsunaga","N. Matsunaga, A. Briggs, A. Ishikawa, K. Nomura, T.Hanajiri, J.
  Yamada, S. Nakatsuji and H. Anzai","SDW and FISDW transition of (TMTSF)$_2$ClO$_4$ at high magnetic fields","4pages,5figures(EPS), accepted for publication in PRB","Phys. Rev. B 62(13), 8611-8614, 2000","10.1103/PhysRevB.62.8611",,"cond-mat.str-el cond-mat.mtrl-sci",,"  The magnetic field dependence of the SDW transition in (TMTSF)$_2$ClO$_4$ for
various anion cooling rates has been measured, with the field up to 27T
parallel to the lowest conductivity direction $c^{\ast}$. For quenched
(TMTSF)$_2$ClO$_4$, the SDW transition temperature $T_{\rm {SDW}}$ increases
from 4.5K in zero field up to 8.4K at 27T. A quadratic behavior is observed
below 18T, followed by a saturation behavior. These results are consistent with
the prediction of the mean-field theory. From these behaviors, $T_{\rm {SDW}}$
is estimated as $T_{\rm {SDW_0}}$=13.5K for the perfect nesting case. This
indicates that the SDW phase in quenched (TMTSF)$_2$ClO$_4$, where $T_{\rm
{SDW}}$ is less than 6K, is strongly suppressed by the two-dimensionality of
the system. In the intermediate cooled state in which the SDW phase does not
appear in zero field, the transition temperature for the field-induced SDW
shows a quadratic behavior above 12T and there is no saturation behavior even
at 27T, in contrast to the FISDW phase in the relaxed state. This behavior can
probably be attributed to the difference of the dimerized gap due to anion
ordering.
","[{""version"":""v1"",""created"":""Tue, 1 Aug 2000 11:06:30 GMT""}]","2009-10-31"
"cond-mat/0008012","Kamenshchik A. Yu.","I.M. Khalatnikov and A.Yu. Kamenshchik","Diagram technique for perturbation theory calculations of the effective
  conductivity of two-dimensional systems","19 pages",,"10.1134/1.1342894",,"cond-mat.mtrl-sci math-ph math.MP",,"  The perturbation theory for calculation of the effective conductivity of the
plane consisting of pieces of different conductivities is constructed and the
convenient diagram technique for this perturbation theory is elaborated. It is
shown that for the chessboard perturbative calculations give results which are
in agreement with the well-known formula $\sigma_{eff} =
\sqrt{\sigma_1\sigma_2}$. The components of the tensor of effective
conductivity for the anisotropic three-color chessboard are calculated. It is
shown that the isotropic (symmetric) part of effective conductivity calculated
up to the sixth order of perturbation theory satisfies the Bruggeman effective
medium equation for symmetric three-color structures with equally partitioned
components. We also consider isotropic three-color chessboard with nonequal
weights of colors. In this case the perturbation theory already in fourth order
contradicts the results following from the Bruggeman equation for nonequal
weights.
","[{""version"":""v1"",""created"":""Tue, 1 Aug 2000 11:35:56 GMT""}]","2009-10-31"
