"cond-mat/0008030","Igor Yanson","I.K. Yanson","Andreev-reflection and Point-Contact Spectroscopy of Superconducting
  Rare Earth Transition Metal Borocarbides","11 pages, 8 figures Invited talk presented at the NATO_ARW ""Rare
  Earth Transition Metal Borocarbides (Nitrides): Superconducting, Magnetic and
  Normal State Properties"", 14-17 June 2000, Dresden, Germany",,,,"cond-mat.supr-con",,"  The superconducting energy gap and quasiparticle density of states (DOS) is
measured by means of Andreev-reflection spectroscopy in normal metal -
superconductor point contacts. It is found that both in paramagnetic and in
antiferromagnetically ordered states (Tm- and Dy-compounds) the DOS has the
BCS-like form while in Er- the dip in the temperature dependence of the gap is
observed at the Neel temperature. In Ho-compound, the non-BCS-like form of DOS
is observed in the temperature region where the incommensurate spin density
waves exist along the axes a and c .
  Inelastic point-contact spectroscopy performed on these compounds shows that
the low-frequency phonons are important for the superconducting state which are
strongly mixed with the magnetic excitation branches in magnetic
superconductors.
","[{""version"":""v1"",""created"":""Wed, 2 Aug 2000 10:35:35 GMT""}]","2007-05-23"
"cond-mat/0008031","R. Moradian","R. Moradian, J.F. Annett, B.L. Gyorffy, G. Litak","Superconducing Alloys with Weak and Strong Scattering: Anderson's
  Theorem and a Superconductor-Insulator Transition","28 pages, 13 figures",,"10.1103/PhysRevB.63.024501",,"cond-mat.supr-con",,"  We have studied the effects of strong impurity scattering on disordered
superconductors beyond the low impurity concentration limit. By applying the
full CPA to a superconductiong A-B binary alloy, we calculated the fluctuations
of the local order parameters $\Delta_{A}, \Delta_{B}$ and charge densities,
$n_{A}, n_{B}$ for weak and strong on site disorder. We find that for narrow
band alloy s-wav e superconductors the conditions for Anderson's theorem are
satisfied in general only for the case of particle-hole symmetry. In this case
it is satisfied regardless whether we are in the weak or strong scattering
regimes. Interestingly, we find that strong scattering leads to band splitting
and in this regime for any band filling we have a critical concentration where
a superconductor-insulator quantum phase transition occurs at T=0.
","[{""version"":""v1"",""created"":""Wed, 2 Aug 2000 10:52:31 GMT""}]","2009-10-31"
"cond-mat/0008032","Giniyat Khaliullin","G.Khaliullin and S.Maekawa","Orbital liquid in three dimensional Mott insulator: $LaTiO_3$","5 pages, 3 figures",,"10.1103/PhysRevLett.85.3950",,"cond-mat.str-el",,"  We present a theory of spin and orbital states in Mott insulator $LaTiO_3$.
The spin-orbital superexchange interaction between $d^1(t_{2g})$ ions in cubic
crystal suffers from a pathological degeneracy of orbital states at classical
level. Quantum effects remove this degeneracy and result in the formation of
the coherent ground state, in which the orbital moment of $t_{2g}$ level is
fully quenched. We find a finite gap for orbital excitations. Such a disordered
state of local degrees of freedom on unfrustrated, simple cubic lattice is
highly unusual. Orbital liquid state naturally explains observed anomalies of
$LaTiO_3$.
","[{""version"":""v1"",""created"":""Wed, 2 Aug 2000 11:55:49 GMT""}]","2009-10-31"
"cond-mat/0008034","Gunther Lang","Gunther Lang, Ulrich Weiss (University of Stuttgart, Germany)","Nonlinear Quantum Transport and Current Noise","9 pages, to appear in Ann. Phys. (Leipzig)","Ann. Phys. (Leipzig) 9, 804 (2000)","10.1002/1521-3889(200010)9:9/10<804::AID-ANDP804>3.0.CO;2-E",,"cond-mat.str-el cond-mat.mes-hall",,"  We study nonequilibrium transport and noise in a generic dissipative
tight-binding model. Within a real-time path integral approach, we derive
formally exact series expressions in the number of tunneling events for the
noise valid for arbitrary bias, frequency and temperature. At zero temperature,
the low-frequency noise can be summed in analytic form. The resulting
Shiba-like $|\omega|$-singularity is a consequence of the $1/t^2$ decay law for
the current correlation function. At finite temperature, this singularity is
smoothed out.
","[{""version"":""v1"",""created"":""Wed, 2 Aug 2000 13:37:53 GMT""}]","2017-09-27"
"cond-mat/0008035","Alexander Moskvin","A. S. Moskvin, Yu. D. Panov (Ural State University, Ekaterinburg,
  Russia)","Origin of Magnetoresistance Anomalies in Antiferromagnetic
  YBa_{2}Cu_{3}O_{6+x}","11 pages, 2 figures, elsart style","Solid State Communications, v.122, pp.253-258 (2002)","10.1016/S0038-1098(02)00127-8",,"cond-mat.str-el cond-mat.supr-con",,"  Specific d-wave angular dependence of the in-plane magnetoresistence in
antiferromagnetic tetragonal YBa_{2}Cu_{3}O_{6+x} (x~0.3) on orientation of the
external magnetic field in (a,b) plane is assigned to the effective hole
transport through low lying excited purely oxygen doublet O2pe_u state, not the
ground b_{1g}(d_{x^2-y^2}) state. External magnetic field determines the
orientation of the strong exchange field for the spin-triplet
b_{1g}e_u:{}^{3}E_u state of the hole CuO_4 center and due to the spin-orbital
coupling results in either orbital polarization of the E_u doublet giving rise
to the spatial anisotropy of the hole transport. Experimental data allow to
estimate parameter of the effective spin Hamiltonian.
","[{""version"":""v1"",""created"":""Wed, 2 Aug 2000 14:16:28 GMT""},{""version"":""v2"",""created"":""Mon, 14 Aug 2000 09:22:03 GMT""},{""version"":""v3"",""created"":""Mon, 8 Jul 2002 13:00:38 GMT""}]","2015-06-24"
"cond-mat/0008036","Carlos Rascon","A.O. Parry, E.D. Macdonald and C. Rascon (Imperial College, London)","Droplet shapes on structured substrates and conformal invariance","20 pages, 7 figures. (Submitted to J.Phys.:Cond.Mat.)",,"10.1088/0953-8984/13/3/303",,"cond-mat",,"  We consider the finite-size scaling of equilibrium droplet shapes for fluid
adsorption (at bulk two-phase co-existence) on heterogeneous substrates and
also in wedge geometries in which only a finite domain $\Lambda_{A}$ of the
substrate is completely wet. For three-dimensional systems with short-ranged
forces we use renormalization group ideas to establish that both the shape of
the droplet height and the height-height correlations can be understood from
the conformal invariance of an appropriate operator. This allows us to predict
the explicit scaling form of the droplet height for a number of different
domain shapes. For systems with long-ranged forces, conformal invariance is not
obeyed but the droplet shape is still shown to exhibit strong scaling
behaviour. We argue that droplet formation in heterogeneous wedge geometries
also shows a number of different scaling regimes depending on the range of the
forces. The conformal invariance of the wedge droplet shape for short-ranged
forces is shown explicitly.
","[{""version"":""v1"",""created"":""Wed, 2 Aug 2000 14:18:23 GMT""}]","2009-10-31"
"cond-mat/0008037","Gianpaolo Valente","Yu. M. Gufan, Al. V. Popov, G. Sartori, V. Talamini, G. Valente, E. B.
  Vinberg","Possible ground states of D-wave condensates in isotropic space","9 pages, revtex, use of texdraw.tex; misprint corrected in Table II
  ($\xi$-range for stratum $S^{(2,3)}$)",,,"DFPD 00/CM/37","cond-mat.supr-con hep-th",,"  A complete and rigorous determination of the possible ground states for
D-wave pairing Bose condensates is presented. Using an orbit space approach to
the problem, we find 15 allowed phases (besides the unbroken one), with
different symmetries, that we thoroughly determine, specifying the
group-subgroup relations between bordering phases.
","[{""version"":""v1"",""created"":""Wed, 2 Aug 2000 14:36:13 GMT""},{""version"":""v2"",""created"":""Fri, 25 Aug 2000 10:57:56 GMT""},{""version"":""v3"",""created"":""Fri, 30 Mar 2001 07:44:34 GMT""}]","2007-05-23"
"cs/0008002","Matthieu Latapy","M.Latapy, R.Mantaci, M.Morvan and H.D.Phan","Structure of some sand pile model","To appear in Theoretical Computer Science",,,"LIAFA Technical Report 99/22","cs.DM cond-mat.stat-mech cs.DS math.CO",,"  SPM (Sand Pile Model) is a simple discrete dynamical system used in physics
to represent granular objects. It is deeply related to integer partitions, and
many other combinatorics problems, such as tilings or rewriting systems. The
evolution of the system started with n stacked grains generates a lattice,
denoted by SPM(n). We study here the structure of this lattice. We first
explain how it can be constructed, by showing its strong self-similarity
property. Then, we define SPM(infini), a natural extension of SPM when one
starts with an infinite number of grains. Again, we give an efficient
construction algorithm and a coding of this lattice using a self-similar tree.
The two approaches give different recursive formulae for the cardinal of
SPM(n), where no closed formula have ever been found.
","[{""version"":""v1"",""created"":""Wed, 2 Aug 2000 14:37:34 GMT""}]","2019-06-14"
"gr-qc/0008003","Ana Nunes","Ana Nunes (U. Lisbon) and Jose P. Mimoso (U. Lisbon)","On the potentials yielding cosmological scaling solutions","RevTeX, 10 pages, no figures","Phys.Lett. B488 (2000) 423-427","10.1016/S0370-2693(00)00919-9","CFNUL/2000-1","gr-qc",,"  In the present work we perform a phase-plane analysis of the complete
dynamical system corresponding to a flat FRW cosmological models with a perfect
fluid and a self-interacting scalar field and show that every positive and
monotonous potential which is asymptotically exponential yields a scaling
solution as a global attractor.
","[{""version"":""v1"",""created"":""Tue, 1 Aug 2000 16:39:32 GMT""},{""version"":""v2"",""created"":""Thu, 3 Aug 2000 20:56:07 GMT""}]","2009-10-31"
"gr-qc/0008004","Steven L. Manly","Steven Manly and Eric Page","Experimental feasibility of measuring the gravitational redshift of
  light using dispersion in optical fibers","11 pages, 12 figures","Phys.Rev.D63:062003,2001","10.1103/PhysRevD.63.062003",,"gr-qc",,"  This paper describes a new class of experiments that use dispersion in
optical fibers to convert the gravitational frequency shift of light into a
measurable phase shift or time delay. Two conceptual models are explored. In
the first model, long counter-propagating pulses are used in a vertical fiber
optic Sagnac interferometer. The second model uses optical solitons in
vertically separated fiber optic storage rings. We discuss the feasibility of
using such an instrument to make a high precision measurement of the
gravitational frequency shift of light.
","[{""version"":""v1"",""created"":""Tue, 1 Aug 2000 18:58:10 GMT""},{""version"":""v2"",""created"":""Thu, 3 Aug 2000 16:08:42 GMT""},{""version"":""v3"",""created"":""Mon, 2 Oct 2000 00:17:35 GMT""},{""version"":""v4"",""created"":""Thu, 21 Dec 2000 18:52:36 GMT""}]","2009-12-31"
"gr-qc/0008005","Bernard J. Carr","Bernard Carr","Baryonic and Non-Baryonic Dark Matter","To appear in Proceedings of 4th RESCUE International Symposium on
  Birth and Evolution of the Universe",,,,"gr-qc astro-ph",,"  Cosmological nucleosynthesis calculations imply that there should be both
non-baryonic and baryonic dark matter. Recent data suggest that some of the
non-baryonic dark matter must be ""hot"" (i.e. massive neutrinos) and there may
also be evidence for ""cold"" dark matter (i.e. WIMPs). If the baryonic dark
matter resides in galactic halos, it is likely to be in the form of compact
objects (i.e. MACHOs) and these would probably be the remnants of a first
generation of pregalactic or protogalactic Population III stars. Many
candidates have been proposed - brown dwarfs, red dwarfs, white dwarfs or black
holes - and at various times each of these has been in vogue. We review the
many types of observations which can be used to constrain or exclude both
baryonic and non-baryonic dark matter candidates.
","[{""version"":""v1"",""created"":""Tue, 1 Aug 2000 18:04:20 GMT""}]","2007-05-23"
"gr-qc/0008006","Yutaka Hosotani","R. G. Daghigh, J. I. Kapusta, Y. Hosotani","False Vacuum Black Holes and Universes","4 pages with 2 figures. revtex",,,"NUC-MINN-00/12-T, OU-HET 354, UMN-TH-1916/00","gr-qc hep-ph hep-th",,"  We construct a black hole whose interior is the false vacuum and whose
exterior is the true vacuum of a classical field theory. From the outside the
metric is the usual Schwarzschild one, but from the inside the space is de
Sitter with a cosmological constant determined by the energy of the false
vacuum. The parameters of the field potential may allow for the false vacuum to
exist for more than the present age of the universe. A potentially relevant
effective field theory within the context of QCD results in a Schwarzschild
radius of about 200 km.
","[{""version"":""v1"",""created"":""Tue, 1 Aug 2000 18:50:44 GMT""}]","2007-05-23"
"gr-qc/0008007","Chris Clarkson","B. J. Carr (Queen Mary and Westfield College) and A. A. Coley
  (Dalhousie University)","An asymptotic analysis of spherically symmetric perfect fluid
  self-similar solutions","19 pages. Submitted to Class. Quantum Grav","Class.Quant.Grav.17:4339-4352,2000","10.1088/0264-9381/17/20/309",,"gr-qc",,"  The asymptotic properties of self-similar spherically symmetric perfect fluid
solutions with equation of state p=alpha mu (-1<alpha<1) are described. We
prove that for large and small values of the similarity variable, z=r/t, all
such solutions must have an asymptotic power-law form. Some of them are
associated with an exact power-law solution, in which case they are
asymptotically Friedmann or asymptotically Kantowski-Sachs for 1>alpha >-1 or
asymptotically static for 1>alpha >0. Others are associated with an approximate
power-law solution, in which case they are asymptotically quasi-static for
1>alpha >0 or asymptotically Minkowski for 1>alpha >1/5. We also show that
there are solutions whose asymptotic behaviour is associated with finite values
of z and which depend upon powers of ln z. These correspond either to a second
family of asymptotically Minkowski solutions for 1>alpha>1/5 or to solutions
that are asymptotically Kasner for 1>alpha>-1/3. There are some other
asymptotic power-law solutions associated with negative alpha, but the physical
significance of these is unclear. The asymptotic form of the solutions is given
in all cases, together with the number of associated parameters.
","[{""version"":""v1"",""created"":""Tue, 1 Aug 2000 20:10:50 GMT""}]","2008-11-26"
"hep-ex/0008001","Kurt Woschnagg","P. B. Price and K. Woschnagg","Role of Group and Phase Velocity in High-Energy Neutrino Observatories","To be published in Astroparticle Physics, 6 pages, uses elsart.sty","Astropart.Phys.15:97-100,2001","10.1016/S0927-6505(00)00142-0",,"hep-ex",,"  Kuzmichev recently showed that use of phase velocity rather than group
velocity for Cherenkov light signals and pulses from calibration lasers in
high-energy neutrino telescopes leads to errors in track reconstruction and
distance measurement. We amplify on his remarks and show that errors for four
cases of interest to AMANDA, IceCube, and RICE (radio Cherenkov detector) are
negligibly small.
","[{""version"":""v1"",""created"":""Tue, 1 Aug 2000 18:55:34 GMT""}]","2011-05-23"
"hep-ex/0008002","K. Eitel","K. Eitel (KARMEN collaboration)","Latest Results of the KARMEN2 Experiment","7 pages including 5 figures; contribution to the proceedings of the
  Neutrino'2000 conference, Sudbury, June 16-21, 2000","Nucl.Phys.Proc.Suppl.91:191-197,2001","10.1016/S0920-5632(00)00940-3",,"hep-ex",,"  The neutrino experiment KARMEN at the beam stop neutrino source ISIS
investigates the oscillation channel numubar->nuebar in the appearance mode by
looking for p(nuebar,e+)n reactions. An analysis of data collected from
February 1997 through March 2000 with the KARMEN2 experimental setup reveals 11
candidate events in good agreement with the background expectation of 12.3+-0.6
events. Hence, there is no indication of an oscillation signal. A maximum
likelihood analysis of the data leads to an upper limit (at 90% confidence
level) for the mixing angle of sin^2(2theta) < 1.3x10^-3 at large Dm^2 and Dm^2
< 0.049 eV^2 for sin^2(2theta)=1. The anomaly in the time spectrum of events
induced by nue and numubar seen in the KARMEN1 data could not be confirmed with
the KARMEN2 data.
","[{""version"":""v1"",""created"":""Wed, 2 Aug 2000 14:37:54 GMT""}]","2011-07-19"
"hep-lat/0008001","Chen Ying","Ying Chen, Bing He, He Lin, Ji-Min Wu","SU(2) gluon propagator on a coarse anisotropic lattice","LaTeX, 14 pages including 4 ps figures","Mod.Phys.Lett. A15 (2000) 2245-2256","10.1142/S0217732300002747",,"hep-lat",,"  We calculated the SU(2) gluon propagator in Landau gauge on an anisotropic
coarse lattice with the improved action. The standard and the improved scheme
are used to fix the gauge in this work. Even on the coarse lattice the lattice
gluon propagator can be well described by a function of the continuous
momentum. The effect of the improved gauge fixing scheme is found not to be
apparent. Based on the Marenzoni's model, the mass scale and the anomalous
dimension are extracted and can be reasonably extrapolated to the continuum
limit with the values $\alpha\sim 0.3$ and $M\sim 600MeV$. We also extract the
physical anisotropy $\xi$ from the gluon propagator due to the explicit $\xi$
dependence of the gluon propagator.
","[{""version"":""v1"",""created"":""Wed, 2 Aug 2000 06:31:00 GMT""}]","2009-10-31"
"hep-lat/0008002","Keiichi Nagao","Ikuo Ichinose and Keiichi Nagao","Lattice QCD with the Overlap Fermions at Strong Gauge Coupling (II)","Latex 17 pages, the extended version of hep-lat/0001030, the
  discussion of symmetries and species doubling added, typo corrected, a final
  version to appear in Nucl.Phys.B","Nucl.Phys. B596 (2001) 231-242","10.1016/S0550-3213(00)00689-1","UT-Komaba 00-10","hep-lat",,"  In the previous paper we developed a strong-coupling expansion for the
lattice QCD with the overlap fermions and showed that L\""usher's ""extended""
chiral symmetry is spontaneously broken in some parameter region of the overlap
fermions. In this paper, we derive a low-energy effective action of hadrons and
show that there exist quasi-Nambu-Goldstone bosons which are identified as the
pions. The pion field is a {\em nonlocal} composite field of quark and
anti-quark even at the strong-coupling limit because of the nonlocality of the
overlap fermion formalism and L\""usher's chiral symmetry. The pions become
massless in the limit of the vanishing bare-quark mass as it is desired. We
furthermore examine symmetries of the overlap fermions with the hopping
expansion and argue that there appear no other massless modes other than the
pions.
","[{""version"":""v1"",""created"":""Wed, 2 Aug 2000 07:40:04 GMT""},{""version"":""v2"",""created"":""Fri, 29 Dec 2000 05:40:46 GMT""}]","2009-10-31"
"hep-lat/0008003","Benjamin Svetitsky","Alec J. Schramm and Benjamin Svetitsky","Topology and metastability in the lattice Skyrme model","15 pages RevTeX, 6 figures","Phys.Rev. D62 (2000) 114020","10.1103/PhysRevD.62.114020",,"hep-lat hep-ph",,"  We offer the Skyrme model on a lattice as an effective field theory - fully
quantized - of baryon-meson interactions at temperatures below the chiral phase
transition. We define a local topological density that involves the volumes of
tetrahedra in the target space S^3 and we make use of Coxeter's formula for the
Schlafli function to implement it. This permits us to calculate the mean-square
radius of a skyrmion in the three-dimensional lattice Skyrme model, which may
be viewed as a Ginzburg-Landau effective theory for the full quantum theory at
finite temperature. We find that, contrary to expectations, the skyrmion
shrinks as quantum and thermal fluctuations are enhanced. We ascribe this to a
large number of metastable states that become accessible as the temperature is
raised.
","[{""version"":""v1"",""created"":""Wed, 2 Aug 2000 08:15:08 GMT""}]","2009-10-31"
"hep-ph/0008012","Lisi Eligio","G.L. Fogli (U. of Bari & INFN), E. Lisi (U. of Bari & INFN), D.
  Montanino (U. of Lecce), and A. Palazzo (U. of Bari & INFN)","Day-night asymmetry of high and low energy solar neutrino events in
  Super-Kamiokande and in the Sudbury Neutrino Observatory","6 pages (RevTeX) + 4 figures (PostScript). Final version, to appear
  in Phys. Rev. D","Phys.Rev.D62:113003,2000","10.1103/PhysRevD.62.113003",,"hep-ph",,"  In the context of solar neutrino oscillations among active states, we briefly
discuss the current likelihood of Mikheyev-Smirnov-Wolfenstein (MSW) solutions
to the solar neutrino problem, which appear to be currently favored at large
mixing, where small Earth regeneration effects might still be observable in
Super-Kamiokande (SK) and in the Sudbury Neutrino Observatory (SNO). We point
out that, since such effects are larger at high (low) solar neutrino energies
for high (low) values of the mass square difference \delta m^2, it may be
useful to split the night-day rate asymmetry in two separate energy ranges. We
show that the difference \Delta of the night-day asymmetry at high and low
energy may help to discriminate the two large-mixing solutions at low and high
\delta m^2 through a sign test, both in SK and in SNO, provided that the
sensitivity to \Delta can reach the (sub)percent level.
","[{""version"":""v1"",""created"":""Tue, 1 Aug 2000 16:03:38 GMT""},{""version"":""v2"",""created"":""Tue, 19 Sep 2000 11:36:15 GMT""}]","2009-10-07"
"hep-ph/0008013","Carl Albright","Carl H. Albright (Fermilab)","Overview of Grand Unified Models and Their Predictions for Neutrino
  Oscillations","6 pages, contribution to the Proceedings of the NuFACT'00 Workshop
  held in Monterey, CA May 22-26, 2000","Nucl.Instrum.Meth.A472:359-363,2000","10.1016/S0168-9002(01)01271-2","FERMILAB-Conf-00/179-T","hep-ph",,"  A brief overview of Grand Unified Models is presented with some attention
paid to their predictions for neutrino oscillations. Given the well-known
features of the two non-unified standard models, SM and MSSM, a listing of the
features of classes of unified models is given, where a GUT flavor symmetry
and/or family symmetry are introduced to reduce the number of model parameters.
Some general remarks are then made concerning the type of predictions that
follow for the neutrino masses and mixings.
","[{""version"":""v1"",""created"":""Tue, 1 Aug 2000 20:21:03 GMT""}]","2008-11-26"
"hep-ph/0008014","Richard Easther","Stephon Alexander, Robert Brandenberger, and Richard Easther","Attractive Forces Between Global Monopoles and Domain Walls","5 pages, 8 eps files",,,"BROWN-HET-1207","hep-ph",,"  We study the interaction between stable monopoles and domain walls in a
$SO(3) \times Z(2)$ scalar field theory. Numerical simulations reveal that
there is an attractive force between the monopole and the wall, but that after
the monopole and the wall collide, the monopole does not unwind. We present an
analytic explanation for the origin of the attractive force, and conclude that
this is a generic feature of monopole-wall interactions which does not depend
on the detailed structure of the model. The existence of the attractive force
supports the hypothesis of Dvali {\em et al.} (hep-ph/9710301), who proposed
that monopoles can be ``swept up'' by domain walls, thereby alleviating or
solving the monopole problem associated with phase transitions occurring after
or in the absence of inflation.
","[{""version"":""v1"",""created"":""Tue, 1 Aug 2000 22:06:04 GMT""}]","2007-05-23"
"hep-ph/0008015","Zhang Chen","Zhang Chen","Deeply Virtual Compton Scattering and Skewed Parton Distribution","Contribution to the proceedings of the 7th Conference on the
  Intersections of Particle and Nuclear Physics (CIPANP 2000), Quebec City,
  Canada, May 22 - 28, 2000","AIP Conf.Proc. 549 (2002) 514-519","10.1063/1.1345308",,"hep-ph",,"  An overview of the current status of and possible future theoretical,
phenomenological and experimental studies of DVCS and SPD's is presented.
","[{""version"":""v1"",""created"":""Wed, 2 Aug 2000 08:06:22 GMT""}]","2009-10-31"
"hep-ph/0008016","Karin Dick","K. Dick, M. Freund, P. Huber and M. Lindner","A Comparison of the Physics Potential of Future Long Baseline Neutrino
  Oscillation Experiments","11 pages, 4 figures","Nucl.Phys. B598 (2001) 543-553","10.1016/S0550-3213(01)00005-0",,"hep-ph",,"  We compare the generic physics potential of various combinations of
conventional Wide Band or Neutrino Factory Beams with different detectors to
determine several oscillation parameters in long baseline experiments. For each
combination of beam and detector we show the precision which can be obtained
for the leading oscillation parameters $\dm{31}$ and $\sin^2 2\theta_{23}$.
Furthermore we show the sensitivity to $\sin^2 2\theta_{13}$ and the range in
$\sin^2 2\theta_{13}$ for which the sign of $\dm{31}$ can be extracted via
matter effects. The results suggest that existing conventional Wide Band Beam
and detector technology can be used to considerably improve the precision of
neutrino properties until a neutrino factory will be built.
","[{""version"":""v1"",""created"":""Wed, 2 Aug 2000 10:14:36 GMT""}]","2009-10-31"
