"astro-ph/0008038","Donald R. Garnett","Donald R. Garnett (Steward Observatory), Vanessa C. Galarza (NMSU),
  and You-Hua Chu (University of Illinois)","The He II Emitting Nebula N44C in the LMC: Optical/UV Spectroscopy of
  the Nebula and its Ionizing Star","37 pages, 7 figures (1 color .gif image); accepted for publication in
  the 10 Dec 2000 Astrophysical Journal. Complete PostScript and PDF versions
  can also be obtained at http://ocotillo.as.arizona.edu/~dgarnett",,"10.1086/317798",,"astro-ph",,"  We present HST spectroscopy and imaging, along with new ground-based
spectroscopy and ROSAT HRI imaging, of the He II emitting nebula N44C and its
ionizing star. A GHRS spectrogram of the ionizing star yields a spectral type
of about O7 for the star. The lack of P Cygni profiles for Si IV and C IV
indicates that the star is not a supergiant. The nebular abundances in the
ionized gas are consistent with average abundances for LMC H II regions, with
the possible exception that nitrogen may be enhanced. Enrichment by a former
evolved companion star is not evident. A long-slit echelle spectrogram in
H-alpha + [N II] shows no evidence for high-velocity gas in N44C. This rules
out high-velocity shocks as the source of the nebular He II emission. A 108 ks
ROSAT HRI image of N44C shows no X-ray point source to a 3-sigma upper limit
L(X) < 10^34 erg s^-1 in the 0.1-2.0 keV band. Based on new measurements of the
electron density in the He II emitting region, we derive recombination
timescales of approximately 20 yrs for He^+2 and approximately 4 yrs for Ne^+4.
If N44C is a fossil X-ray ionized nebula, this places severe constraints on
when the putative X-ray source could have turned off. The presence of strong
[Ne IV] emission in the nebula is puzzling if the ionizing source has turned
off. It is possible the system is related to the Be X-ray binaries, although
the O star in N44C does not show Be characteristics at the present time.
Monitoring of X-rays and He II emission from the nebula, as well as a radial
velocity study of the ionizing star, are needed to fully understand the
emission line spectrum of N44C.
","[{""version"":""v1"",""created"":""Tue, 1 Aug 2000 23:22:06 GMT""}]","2009-10-31"
"astro-ph/0008039","Roy Maartens","D.R. Matravers (Portsmouth), J. Triginer (Barcelona Autonoma)","Particle number density fluctuations and pressure effects on structure
  formation","10 pages Revtex; revised to match published version","Class.Quant.Grav. 18 (2001) 3917-3928","10.1088/0264-9381/18/18/310",,"astro-ph gr-qc",,"  We provide a covariant and gauge-invariant approach to the question of how a
first order pressure can be incorporated self-consistently in a cosmological
scenario. The approximation is relevant, in the linear regime, to weakly
self-interacting or warm dark matter models. We also derive number density
fluctuations in which new modes appear because the number density fluctuations
are no longer simply proportional to the density fluctuations.
","[{""version"":""v1"",""created"":""Wed, 2 Aug 2000 09:48:31 GMT""},{""version"":""v2"",""created"":""Fri, 21 Sep 2001 09:18:09 GMT""}]","2009-10-31"
"astro-ph/0008040","Moshe Carmeli","Moshe Carmeli","The First Six Days of The Universe",,,,,"astro-ph",,"  The early stage of the Universe is discussed and the time lengths of its
first six days, as well as its age, are given. There seems to be no
contradiction with the Bible's ascertain that the Universe was created in six
days.
","[{""version"":""v1"",""created"":""Wed, 2 Aug 2000 10:08:00 GMT""}]","2007-05-23"
"astro-ph/0008041","Tsafrir Kolatt","Tsafrir S. Kolatt (1) and Ofer Lahav (2,1) ((1) Hebrew University, (2)
  IoA, Cambridge)","Constraints on Cosmological Anisotropy out to z=1 from Supernovae Ia","6 pages, submitted to MNRAS","Mon.Not.Roy.Astron.Soc. 323 (2001) 859","10.1046/j.1365-8711.2001.04262.x",,"astro-ph",,"  A combined sample of 79 high and low redshift supernovae Ia (SNe) is used to
set constraints on the degree of anisotropy in the Universe out to $z\simeq1$.
First we derive the global most probable values of matter density $\Omega_M $,
the cosmological constant $\Omega_\Lambda $, and the Hubble constant $H_0$, and
find them to be consistent with the published results from the two data sets of
Riess et al. 1998 (R98) and Perlmutter et al. 1999 (P99). We then examine the
Hubble diagram (HD, i.e., the luminosity-redshift relation) in different
directions on the sky by utilising spherical harmonic expansion. In particular,
via the analysis of the dipole anisotropy, we divide the sky into the two
hemispheres that yield the most discrepant of the three cosmological
parameters, and the scatter $\chi^2_{\rm HD}$ in each case. The most discrepant
values roughly move along the locus $-4\Omega_M +3 \Omega_{\Lambda} = 1$ (cf.
P99), but by no more than $\Delta \approx 2.5$ along this line. For a perfect
FRW universe, Monte Carlo realizations that mimic the current set of SNe yield
values higher than the measured $\Delta$ in $\sim 1/5$ of the cases. We discuss
implications for the validity of the Cosmological Principle, and possible
calibration problems in the SNe data sets.
","[{""version"":""v1"",""created"":""Wed, 2 Aug 2000 11:27:54 GMT""}]","2015-06-24"
"astro-ph/0008042","John R. Dickel","John R. dickel, Richard G. Strom, D. K. Milne","The Radio Structure of the Supernova Remnant MSH14-63","15 pages in AAS LaTeX 5.0, 5 figures (2 parts in JPEG, 6 in GIF, 4 in
  eps), accepted by ApJ",,"10.1086/318259",,"astro-ph",,"  G315.4-2.3 is an extended shell supernova remnant (SNR) with some
characteristics of evolutionarily young remnants and some of older ones. To
further elucidate some of its characteristics, we present imaging and
polarimetry of this SNR at a frequency of 1.34 GHz with a resolution of 8
arcsec made with the Australia Telescope Compact Array.
  The indicators of youth are: Morphologically, the radio emission arises in a
smooth shell without the fine scale filaments seen in the optical. Many of the
optical filaments are Balmer dominated. Where measurable, the orientation of
the magnetic field appears to be radial with respect to the center of the
remnant. There may have been a supernova in that region in AD185.
  Indications of older age include: Particularly in RCW86, the bright optical
nebula in the southwestern corner of this extended SNR, but also in other
locations there are several filaments with bright [S II] emission
representative of older shocked filaments in radiative equilibrium. If the
remnant lies at the kinematical distance of 2.8 kpc, it has a diameter of 37 pc
which would be large for a remnant less than two thousand years old.
  The remnant seems to be expanding inside a cavity outlined by infrared
emission and so it could well be young and large. Where it is encountering the
walls of the cavity it is slowing rapidly and we observe the radiative
filaments. RCW86 itself is encountering a dense clump of material but may also
be the remains of a more compact lump of ejecta ploughing into the
surroundings.
","[{""version"":""v1"",""created"":""Wed, 2 Aug 2000 13:10:09 GMT""}]","2009-10-31"
"astro-ph/0008043","Toshinori Yuda","M. Amenomori, S. Ayabe, Caidong, et al. (Tibet ASGamma Collaboration)","Measurement of air shower cores to study the cosmic ray composition in
  the knee energy region","20 pages, 21 figures, to appear in Physical Review D","Phys.Rev.D62:072007,2000","10.1103/PhysRevD.62.072007",,"astro-ph",,"  Since 1996, a hybrid experiment consisting of an emulsion chamber and a burst
detector array and the Tibet-II air shower array has been operated at
Yangbajing (4300 m above sea level) in Tibet. This experiment can detect
air-shower cores, called burst events, accompanied by air showers in excess of
about 100 TeV. Using the burst event data observed by this experiment, we
discuss the primary cosmic ray composition around the knee in comparison with
the Monte Carlo simulations. In this paper, we show that all the features of
burst events are wholly compatible with the heavy enriched composition in the
knee energy region.
","[{""version"":""v1"",""created"":""Wed, 2 Aug 2000 13:28:23 GMT""},{""version"":""v2"",""created"":""Thu, 3 Aug 2000 02:26:48 GMT""}]","2011-07-19"
"astro-ph/0008044","R. J. Wilman","R. J. Wilman, R. M. Johnstone, C. S. Crawford","Extended line emission around seven radio-loud quasars at redshift z~2","16 pages, 9 figures; to appear in MNRAS","Mon.Not.Roy.Astron.Soc. 317 (2000) 9","10.1046/j.1365-8711.2000.03453.x",,"astro-ph",,"  We present near-infrared spectra of seven radio-loud quasars with a median
redshift of 2.1, five of which were previously known to have Ly alpha nebulae.
Extended [OIII]5007 and H alpha emission are evident around six objects, at the
level of a few times 1E-16 erg/cm^2/arcsec^2/s within 2 arcsec of the nucleus
(16 kpc in the adopted cosmology). Nuclear [OII]3727 is detected in three of
the 5 quasars studied at this wavelength, and clearly extended in one of them.
  The extended [OIII] tends to be brighter on the side of the nucleus with the
stronger, jet-like radio emission, indicating at least that the extranuclear
gas is distributed anisotropically. It is also redshifted by several hundred
km/s from the nuclear [OIII], perhaps because the latter is blueshifted from
the systemic velocity of the host galaxy. Alternatively, the velocity shifts
could be due to infall (which is suggested by line widths ~1000 km/s FWHM) in
combination with a suitable dust geometry. Lyalpha/Halpha ratios well below the
case B value suggest that some dust is present.
  Photoionization modelling of the [OIII]/[OII] ratios in the extended gas
suggests that its pressure is around or less than a few times 1E7 cm^-3 K; any
confining intracluster medium may thus host a strong cooling flow. A comparison
with lower-redshift work suggests that there has been little evolution in the
nuclear emission line properties of radio-loud quasars between redshifts 1 and
2.
","[{""version"":""v1"",""created"":""Wed, 2 Aug 2000 14:35:41 GMT""}]","2009-10-31"
"astro-ph/0008045","Patrick McDonald","Patrick McDonald and Jordi Miralda-Escude","The Lyman-alpha Forest Flux Distribution at z\sim 5.2 and the Evolution
  of the Ionizing Background","submitted to ApJL","Astrophys.J.549:L11-L14,2001; Erratum-ibid.595:L67,2003","10.1086/319123",,"astro-ph",,"  We use the redshift evolution of the lyman-alpha forest mean transmitted flux
at z>2.5 to infer the evolution of the intensity of the ionizing background,
using theoretical predictions for the density distribution of the intergalactic
gas giving rise to the lyman-alpha forest. The proper background intensity
declines gradually with redshift, decreasing by a factor \sim 3 between z=3 and
z=5.
  The gravitational structure formation theory of the lyman-alpha forest
implies that, given the observed mean transmitted flux of \bar{F}=0.1 in the
highest redshift quasar (with a mean lyman-alpha forest redshift z=5.2), only
about 3% of the lyman-alpha spectrum should have a flux higher than 50% of the
continuum, and less than 0.5% of pixels should have flux above 75% of the
continuum, assuming a uniform ionizing background intensity. We show that this
is consistent with the spectrum shown in Fan et al.
","[{""version"":""v1"",""created"":""Wed, 2 Aug 2000 15:38:28 GMT""}]","2009-10-31"
"cond-mat/0008003","Alexander Korotkov","Alexander N. Korotkov","Correlated quantum measurement of a solid-state qubit","5 pages","Phys. Rev. B 64, 193407 (2001)","10.1103/PhysRevB.64.193407",,"cond-mat.mes-hall quant-ph",,"  We propose a solid-state experiment to study the process of continuous
quantum measurement of a qubit state. The experiment would verify that an
individual qubit stays coherent during the process of measurement (in contrast
to the gradual decoherence of the ensemble-averaged density matrix) thus
confirming the possibility of the qubit purification by continuous measurement.
The experiment can be realized using quantum dots, single-electron transistors,
or SQUIDs.
","[{""version"":""v1"",""created"":""Tue, 1 Aug 2000 16:45:39 GMT""}]","2009-10-31"
"cond-mat/0008016","Adolfo Avella","Adolfo Avella (1), Ferdinando Mancini (1), and Maria del Mar
  Sanchez-Lopez (2) ((1) Universita' di Salerno (Italy), (2) Universidad Miguel
  Hernandez (Spain))","The 1D Hubbard model within the Composite Operator Method","19 RevTeX pages, 41 embedded eps figures","Eur. Phys. J. B 29, 399 (2002)","10.1140/epjb/e2002-00323-6",,"cond-mat.str-el",,"  Although effective for two dimensional (2D) systems, some approximations may
fail in describing the properties of one-dimensional (1D) models, which belong
to a different universality class. In this paper, we analyze the adequacy of
the Composite Operator Method (COM), which provides a good description of many
features of 2D strongly correlated systems, in grasping the physics of 1D
models. To this purpose, the 1D Hubbard model is studied within the framework
of the COM by considering a two-pole approximation and a paramagnetic ground
state. The local, thermodynamic and single-particle properties, the correlation
functions and susceptibilities are calculated in the case of half filling and
arbitrary filling. The results are compared with those obtained by the Bethe
Ansatz (BA) as well as by other numerical and analytical techniques. The
advantages and limitations of the method are analyzed in detail.
","[{""version"":""v1"",""created"":""Tue, 1 Aug 2000 20:02:13 GMT""},{""version"":""v2"",""created"":""Wed, 9 Oct 2002 16:19:10 GMT""}]","2007-05-23"
"cond-mat/0008019","Sidney Redner","V. Spirin, P. L. Krapivsky, and S. Redner","Fate of Zero-Temperature Ising Ferromagnets","4 pages in column format, 6 figures","Phys. Rev. E 63, 036118 (2001).","10.1103/PhysRevE.63.036118",,"cond-mat.stat-mech",,"  We investigate the relaxation of homogeneous Ising ferromagnets on finite
lattices with zero-temperature spin-flip dynamics. On the square lattice, a
frozen two-stripe state is apparently reached approximately 1/4 of the time,
while the ground state is reached otherwise. The asymptotic relaxation is
characterized by two distinct time scales, with the longer stemming from the
influence of a long-lived diagonal stripe ``defect''. In greater than two
dimensions, the probability to reach the ground state rapidly vanishes as the
size increases and the system typically ends up wandering forever within an
iso-energy set of stochastically ``blinking'' metastable states.
","[{""version"":""v1"",""created"":""Tue, 1 Aug 2000 17:44:02 GMT""}]","2009-10-31"
"cond-mat/0008020","Adriano de Souza Martins","A. S. Martins, Belita Koiller, and R. B. Capaz","An elastic model for the In-In correlations in In(x)Ga(1-x)As
  semiconductor alloys","13 pages, 1 figure, published in Solid State Communications","Solid State Communications 115, 287 (2000)","10.1016/S0038-1098(00)00198-8",,"cond-mat.mtrl-sci",,"  Deviations from randomicity in In(x)Ga(1-x) As semiconductor alloys induced
by elastic effects are investigated within the Keating potential. Our model is
based on Monte Carlo simulations on large (4096 atoms) supercells, performed
with two types of boundary conditions: Fully periodic boundary conditions
represent the bulk, while periodic boundary conditions along the x and y
directions and a free surface in the z direction simulate the epitaxial growth
environment. We show that In-In correlations identified in the bulk tend to be
enhanced in the epitaxially grown samples.
","[{""version"":""v1"",""created"":""Tue, 1 Aug 2000 19:02:28 GMT""}]","2009-10-31"
"cond-mat/0008021","Scott A. Hill","Scott A. Hill and Gene F. Mazenko","A nonlinear hydrodynamical approach to granular materials","17 pages, 14 figures, RevTeX4; minor changes to wording and some
  additional discussion. Accepted by Phys. Rev. E","Phys. Rev. E 63: 031303 (2001).","10.1103/PhysRevE.63.031303",,"cond-mat.soft",,"  We propose a nonlinear hydrodynamical model of granular materials. We show
how this model describes the formation of a sand pile from a homogeneous
distribution of material under gravity, and then discuss a simulation of a
rotating sandpile which shows, in qualitative agreement with experiment, a
static and dynamic angle of repose.
","[{""version"":""v1"",""created"":""Wed, 2 Aug 2000 00:10:58 GMT""},{""version"":""v2"",""created"":""Fri, 5 Jan 2001 20:55:59 GMT""}]","2009-10-31"
"cond-mat/0008022","Mauro Copelli","Mauro Copelli and Katja Lindenberg","Phase-Induced (In)-Stability in Coupled Parametric Oscillators","19 pages, 8 figures; a version with better quality figures can be
  found in http://hypatia.ucsd.edu/~mauro/English/publications.html","Phys. Rev. E Vol. 63, 036605 (2001). (9 pages)","10.1103/PhysRevE.63.036605",,"cond-mat.stat-mech nlin.SI physics.class-ph",,"  We report results on a model of two coupled oscillators that undergo periodic
parametric modulations with a phase difference $\theta$. Being to a large
extent analytically solvable, the model reveals a rich $\theta$ dependence of
the regions of parametric resonance. In particular, the intuitive notion that
anti-phase modulations are less prone to parametric resonance is confirmed for
sufficiently large coupling and damping. We also compare our results to a
recently reported mean field model of collective parametric instability,
showing that the two-oscillator model can capture much of the qualitative
behavior of the infinite system.
","[{""version"":""v1"",""created"":""Wed, 2 Aug 2000 01:19:37 GMT""}]","2009-10-31"
"cond-mat/0008023","S. Anantha Ramakrishna","N. Kumar (Raman Research Institute, Bangalore)","The Zeno effect and an inter-layer pairing mechanism for
  high-temperature superconductivity in layered materials","RevTeX, 9 pages, No figures, To be presented at the 8th Asia Pacific
  Physics Conference, Taipei, Taiwan, 7-10 August, 2000",,"10.1142/9789812811523_0004",,"cond-mat.supr-con cond-mat.str-el",,"  Quantum Zeno Effect (QZE) is the suppression of the inter-subspace transition
by a relatively fast intra-subspace decoherence. Earlier, we had proposed a
QZE-based mechanism for the temperature-dependent normal-state c-axis
resistivity of the layered high-T$_c$ cuprate superconductors in which the
single-particle inter-layer tunneling is blocked by the strong intra-layer
decoherence (entanglement). We now argue that while the single-particle
inter-layer tunneling is thus blocked, the tunneling of the bosonic BCS-like
pairs must remain unblocked inasmuch as a BCS pairing condensate is an
eigenstate of the pair annihilation operator. This pair tunneling stabilizes
","[{""version"":""v1"",""created"":""Wed, 2 Aug 2000 11:50:13 GMT""}]","2017-08-23"
"cond-mat/0008024","Walter Kob","Francesco Sciortino (Roma) and Walter Kob (Mainz)","The Debye-Waller factor of liquid silica: Theory and simulation","5 pages of Latex, 3 figures","Phys. Rev. Lett. 86, 648 (2001)","10.1103/PhysRevLett.86.648","KOMA-00-16","cond-mat.stat-mech cond-mat.dis-nn",,"  We show that the prediction of mode-coupling theory for a model of a
network-forming strong glass-former correctly describes the wave-vector
dependence of the Debye-Waller factor. To obtain a good description it is
important to take into account the triplet correlation function c_3, which we
evaluate from a computer simulation. Our results support the possibility that
this theory is able to accurately describe the non-ergodicity parameters of
simple as well as of network-forming liquids.
","[{""version"":""v1"",""created"":""Wed, 2 Aug 2000 06:59:05 GMT""}]","2009-10-31"
"cond-mat/0008025","Jani-Petri Martikainen","J. -P. Martikainen","Bose-Einstein condensation in shallow traps","6 pages, 4 figures",,"10.1103/PhysRevA.63.043602",,"cond-mat.stat-mech",,"  In this paper we study the properties of Bose-Einstein condensates in shallow
traps. We discuss the case of a Gaussian potential, but many of our results
apply also to the traps having a small quadratic anharmonicity. We show the
errors introduced when a Gaussian potential is approximated with a parabolic
potential, these errors can be quite large for realistic optical trap parameter
values. We study the behavior of the condensate fraction as a function of trap
depth and temperature and calculate the chemical potential of the condensate in
a Gaussian trap. Finally we calculate the frequencies of the collective
excitations in shallow spherically symmetric and 1D traps.
","[{""version"":""v1"",""created"":""Wed, 2 Aug 2000 09:10:03 GMT""}]","2009-10-31"
"cond-mat/0008026","ZhiFeng Huang","Zhi-Feng Huang, Sorin Solomon","Power, Levy, Exponential and Gaussian Regimes in Autocatalytic Financial
  Systems","9 pages with 5 figures; Proceedings of EPS conference ""Applications
  of Physics in Financial Analysis 2"", 13 to 15 July 2000 Liege, Belgium (to
  appear in Eur. Phys. J. B)","Eur. Phys. J. B 20 (2001) 601-607","10.1007/PL00011114",,"cond-mat.stat-mech q-fin.ST",,"  We study by theoretical analysis and by direct numerical simulation the
dynamics of a wide class of asynchronous stochastic systems composed of many
autocatalytic degrees of freedom. We describe the generic emergence of
truncated power laws in the size distribution of their individual elements. The
exponents $\alpha$ of these power laws are time independent and depend only on
the way the elements with very small values are treated. These truncated power
laws determine the collective time evolution of the system. In particular the
global stochastic fluctuations of the system differ from the normal Gaussian
noise according to the time and size scales at which these fluctuations are
considered. We describe the ranges in which these fluctuations are
parameterized respectively by: the Levy regime $\alpha < 2$, the power law
decay with large exponent ($\alpha > 2$), and the exponential decay. Finally we
relate these results to the large exponent power laws found in the actual
behavior of the stock markets and to the exponential cut-off detected in
certain recent measurement.
","[{""version"":""v1"",""created"":""Wed, 2 Aug 2000 09:58:45 GMT""}]","2009-10-31"
"cond-mat/0008027","Shinji Iida","N. Mae and S. Iida (Ryukoku Univ.)","Universality of S-matrix correlations for deterministic plus random
  Hamiltonians","5 pages, no figure, REVTeX 3.1 with pLaTeX 2e. Minor corrections,
  references added. Accepted for publication in Phys. Rev. E",,"10.1103/PhysRevE.63.047102",,"cond-mat.dis-nn cond-mat.mes-hall",,"  We study S-matrix correlations for random matrix ensembles with a Hamiltonian
which is the sum of a given deterministic part and of a random matrix with a
Gaussian probability distribution. Using Efetov's supersymmetry formalism, we
show that, in the limit of infinite matrix size of the Hamiltonian, correlation
functions of S-matrix elements are universal on the scale of the local mean
level spacing: the dependence of the deterministic part enters into these
correlation functions only through the average S-matrix and the average level
density. This statement applies to each of the three symmetry classes
(orthogonal, unitary, and symplectic).
","[{""version"":""v1"",""created"":""Wed, 2 Aug 2000 10:02:23 GMT""},{""version"":""v2"",""created"":""Mon, 8 Jan 2001 07:10:49 GMT""}]","2009-10-31"
"cond-mat/0008028","Gianpaolo Valente","Gianpaolo Valente","The Orbit Space Approach to the Theory of Phase Transitions: The
  Non-Coregular Case","7 pages, LaTeX, no figures","Proceedings of the 4th Int. School on Theoretical Physics SSPCM96,
  T. Lulek et al. editors, World Scientific (1997) p. 223-228",,,"cond-mat hep-th math-ph math.MP",,"  We consider the problem of the determination of the isotropy classes of the
orbit spaces of all the real linear groups, with three independent basic
invariants satisfying only one independent relation. The results are obtained
in the $\hat P$-matrix approach solving a universal differential equation ({\em
master equation}) which involves as free parameters only the degrees $d_a$ of
the invariants. We begin with some remarks which show how the $\hat{P}$-matrix
approach may be relevant in physical contexts where the study of invariant
functions is important, like in the analysis of phase spaces and structural
phase transitions (Landau's theory).
","[{""version"":""v1"",""created"":""Wed, 2 Aug 2000 10:06:56 GMT""}]","2007-05-23"
"cond-mat/0008029","Guo-Meng Zhao","Guo-meng Zhao (1and 2), D. J. Kang (1), W. Prellier (1), M. Rajeswari
  (1), H. Keller (2), T. Venkatesan (1), R. L. Greene (1) ((1) University of
  Maryland, (2) University of Zurich)","Evidence for small or intermediate-size polarons in the ferromagnetic
  state of manganites","4 pages, 4 figures",,,,"cond-mat.str-el",,"  Oxygen-isotope effects on the intrinsic resistivity have been studied in
high-quality epitaxial thin films of La_{0.75}Ca_{0.25}MnO_{3} and
Nd_{0.7}Sr_{0.3}MnO_{3}. We found that the residual resistivity \rho_{o}
increases by about 15(3)% upon replacing ^{16}O by ^{18}O. This provides strong
evidence for the presence of small or intermediate-size polarons in the
metallic ferromagnetic state. Furthermore, the temperature dependent part of
the resistivity at low temperatures consists of an AT^{4.5} term contributed
from 2-magnon scattering, and a B\omega_{s}/\sinh^{2}(\hbar\omega_{s}/2k_{B}T)
term which arises from scattering by a soft optical phonon mode. The absolute
magnitudes of the coefficient A and the phonon frequency \hbar\omega_{s} for
both isotope samples are in quantitative agreement with theoretical
predictions.
","[{""version"":""v1"",""created"":""Wed, 2 Aug 2000 10:21:39 GMT""}]","2007-05-23"
