"math/0008048","Rob Schneiderman","Rob Schneiderman, Peter Teichner","Higher order intersection numbers of 2-spheres in 4-manifolds","Published by Algebraic and Geometric Topology at
  http://www.maths.warwick.ac.uk/agt/AGTVol1/agt-1-1.abs.html","Algebr. Geom. Topol. 1 (2001) 1-29","10.2140/agt.2001.1.1",,"math.GT",,"  This is the beginning of an obstruction theory for deciding whether a map
f:S^2 --> X^4 is homotopic to a topologically flat embedding, in the presence
of fundamental group and in the absence of dual spheres. The first obstruction
is Wall's self-intersection number mu(f) which tells the whole story in higher
dimensions. Our second order obstruction tau(f) is defined if mu(f) vanishes
and has formally very similar properties, except that it lies in a quotient of
the group ring of two copies of pi_1(X) modulo S_3-symmetry (rather then just
one copy modulo S_3-symmetry). It generalizes to the non-simply connected
setting the Kervaire-Milnor invariant which corresponds to the Arf-invariant of
knots in 3-space.
  We also give necessary and sufficient conditions for moving three maps
f_1,f_2,f_3:S^2 --> X^4 to a position in which they have disjoint images. Again
the obstruction lambda(f_1,f_2,f_3) generalizes Wall's intersection number
lambda(f_1,f_2) which answers the same question for two spheres but is not
sufficient (in dimension 4) for three spheres. In the same way as intersection
numbers correspond to linking numbers in dimension 3, our new invariant
corresponds to the Milnor invariant mu(1,2,3), generalizing the Matsumoto
triple to the non simply-connected setting.
","[{""version"":""v1"",""created"":""Mon, 7 Aug 2000 03:31:07 GMT""},{""version"":""v2"",""created"":""Fri, 17 Nov 2000 10:09:40 GMT""}]","2014-10-01"
"math/0008049","Konstantin Salikhov","Konstantin Salikhov","Bordism classes of the multiple points manifolds","5 pages, AmSLaTeX",,,,"math.GT math.AT",,"  Let $f:V^n\looparrowright M^m$ be a smooth generic immersion. Then the set of
points, that have at least $k$ preimages is an image of a (non-generic)
immersion. If the manifolds $V^n$ and $M^m$ are oriented and $m-n$ is even,
then the manifold of $k$-fold points is also oriented. In this paper we compute
the oriented bordism class of the manifold of $k$-fold points in terms of the
differential $df$, provided the tangent bundle of the manifold $M^m$ has a
nowhere zero cross-section.
","[{""version"":""v1"",""created"":""Mon, 7 Aug 2000 08:31:51 GMT""}]","2007-05-23"
"math/0008050","Bethany Marsh","Roger Carter and Bethany Marsh","Regions of linearity, Lusztig cones and canonical basis elements for the
  quantized enveloping algebra of type A_4","61 pages, 17 figures, uses pictex",,,"University of Leicester, 2000/17","math.QA math.CO",,"  Let U_q be the quantum group associated to a Lie algebra g of rank n. The
negative part U^- of U has a canonical basis B with favourable properties,
introduced by Kashiwara and Lusztig. The approaches of Kashiwara and Lusztig
lead to a set of alternative parametrizations of the canonical basis, one for
each reduced expression for the longest word in the Weyl group of g. We show
that if g is of type A_4 there are close relationships between the Lusztig
cones, canonical basis elements and the regions of linearity of
reparametrization functions arising from the above parametrizations. A graph
can be defined on the set of simplicial regions of linearity with respect to
adjacency, and we further show that this graph is isomorphic to the graph with
vertices given by the reduced expressions of the longest word of the Weyl group
modulo commutation and edges given by long braid relations.
  Keywords: Quantum group, Lie algebra, Canonical basis, Tight monomials, Weyl
group, Piecewise-linear functions.
","[{""version"":""v1"",""created"":""Mon, 7 Aug 2000 09:59:49 GMT""}]","2020-12-21"
"math/0008051","Rivoal Tanguy","Tanguy Rivoal","La fonction Zeta de Riemann prend une infinite de valeurs irrationnelles
  aux entiers impairs","4 pages (french), accepted for publication (Comptes rendus de
  l'Academie des sciences de Paris)",,"10.1016/S0764-4442(00)01624-4",,"math.NT",,"  We provide a lower bound for the dimension of the vector space spanned by 1
and by the values of the Riemann Zeta function at the first odd integers. As a
consequence, the Zeta function takes infinitely many irrational values at odd
integers.
","[{""version"":""v1"",""created"":""Mon, 7 Aug 2000 10:11:16 GMT""}]","2009-10-31"
"math/0008052","Yoram Louzoun","Yoram Louzoun, Irun. R. Cohen, and Henri Atlan","Destruction of CD4 T Lymphocytes Alone Cannot Account for their
  Long-term Decrease in AIDS","5 pages 4 figures",,,,"math.DS math-ph math.MP math.NA q-bio",,"  Following previous models describing a quasi steady state (QSS) for the
evolution of HIV infection and AIDS, we have developed a larger formalism
simulating the long-term evolution of the QSS We show that the long-term
evolution of AIDS cannot be explained by the destruction alone of CD4 T cells,
either directly or indirectly. The destruction of CD4 T cells can lead only to
a QSS with a lower concentration of CD4 T cells, but CD4 destruction cannot
generate the sustained long-term decrease in T cells leading to AIDS. We here
suggest some workable explanations.
","[{""version"":""v1"",""created"":""Mon, 7 Aug 2000 10:54:20 GMT""}]","2007-05-23"
"math/0008053","Sergei V. Astashkin","S.V.Astashkin","Selection of subsystems of random variables equivalent in distribution
  to the Rademacher system","26 pages","Matemat. Sbornik, V.191, No.6 (2000), 3-30 (in Russian)",,,"math.FA math.CA",,"  We present necessary and sufficient conditions on systems of random variables
for them to possess a lacunary subsystem equivalent in distribution to the
Rademacher system on the segment [0,1]. In particular, every uniformly bounded
orthonormal system has this property. Furthermore, an arbitrary finite
uniformly bounded orthonormal set of N functions contains a subset of
""logarithmic"" density equivalent in distribution to the corresponding set of
Rademacher functions, with a constant independent of N. A connection between
the tail distribution and the L_p-norms of polynomials with respect to systems
of random variables exploited. We use also these results to study K-closed
representability of some Banach couples.
","[{""version"":""v1"",""created"":""Mon, 7 Aug 2000 11:35:15 GMT""}]","2007-05-23"
"math/0008054","Fabio Pioli","L. Brambila Paz, E. Gomez Gonzalez, F. Pioli","On Picard bundles over Prym varieties","15 pages, Latex2e + amsart, xypic needed",,,,"math.AG",,"  We study the birationality (onto its image) of the Abel-Prym morphism
associated with a Prym-Tuyrin variety. We use such result to prove that Picard
bundles over Prym varieties are simple and moreover they are stable when the
Abel-Prym morphism is not birational. As a consequence we obtain that Picard
bundles over moduli spaces of stable vector bundles with fixed determinant are
simple. We prove that Picard bundles over moduli spaces of rank 2 vector
bundles on curves of genus 2 bundles are stable.
","[{""version"":""v1"",""created"":""Mon, 7 Aug 2000 11:44:33 GMT""}]","2007-05-23"
"math/0008055","Naruhiko Aizawa","N. Aizawa","Twist of Lie algebras by 6 dimensional subalgebra","10pages, Talk given at 32nd Symposium on Mathematical Physics, June
  2000, Torun, Poland","Rep. Math. Phys. 48 (2001) 11-18","10.1016/S0034-4877(01)80059-8",,"math.QA",,"  A new non-standard deformation of all types of classical Lie algebras is
constructed by means of Drinfel'd twist based on a six dimensional subalgebra.
This is an extension of extended twists introduced by Kulish et al. For the
algebra M_3 = so(3,2), a relation to a known non-standard deformation is
discussed.
","[{""version"":""v1"",""created"":""Mon, 7 Aug 2000 13:07:37 GMT""},{""version"":""v2"",""created"":""Mon, 14 Aug 2000 08:27:34 GMT""}]","2009-10-31"
"nlin/0008008","D'hulst","R. D'Hulst and G. J. Rodgers","Transition from coherence to bistability in a model of financial markets","7 pages, 7 figures, proceedings of APFA 2",,"10.1007/s100510170250",,"nlin.AO",,"  We present a model describing the competition between information
transmission and decision making in financial markets. The solution of this
simple model is recalled, and possible variations discussed. It is shown
numerically that despite its simplicity, it can mimic a size effect comparable
to a crash. Two extensions of this model are presented that allow to simulate
the demand process. One of these extensions has a coherent stable equilibrium
and is self-organized, while the other has a bistable equilibrium, with a
spontaneous segregation of the population of agents. A new model is introduced
to generate a transition between those two equilibriums. We show that the
coherent state is dominant up to an equal mixing of the two extensions. We
focuss our attention on the microscopic structure of the investment rate, which
is the main parameter of the original model. A constant investment rate seems
to be a very good approximation.
","[{""version"":""v1"",""created"":""Mon, 7 Aug 2000 15:43:38 GMT""}]","2009-10-31"
"nucl-ex/0008003","Dipangkar Dutta","W. Xu (MIT), et al","The Transverse Asymmetry $\bf A_{\bf T'}$ from Quasi-elastic $^3\vec{\rm
  He}(\vec{e},e')$ Process and the Neutron Magnetic Form Factor","4 pages, 2 figures, revtex, accepted for publication in PRL","Phys.Rev.Lett.85:2900-2904,2000","10.1103/PhysRevLett.85.2900",,"nucl-ex",,"  We have measured the transverse asymmetry from inclusive scattering of
longitudinally polarized electrons from polarized 3He nuclei at quasi-elastic
kinematics in Hall A at Jefferson Lab with high statistical and systematic
precision. The neutron magnetic form factor was extracted based on Faddeev
calculations with an experimental uncertainty of less than 2 %.
","[{""version"":""v1"",""created"":""Mon, 7 Aug 2000 14:06:56 GMT""}]","2010-04-06"
"nucl-th/0008011","Osman Yilmaz","A. Gokalp and O. Yilmaz (Phys. Dept., Middle East Technical
  University, Turkey)","The role of $\sigma$-meson in $\omega\to \pi\pi\gamma$ decays and the
  coupling constant $g_{\omega\sigma\gamma}$","12 Pages, LATEX, 4 Figures","Phys.Lett. B494 (2000) 69-74","10.1016/S0370-2693(00)01126-6",,"nucl-th",,"  We study the $\omega\to\pi\pi\gamma$ decays by adding to the amplitude
calculated within the framework of chiral perturbation theory and vector meson
dominance the amplitude of $\sigma$-meson intermediate state. We estimate the
coupling constant $g_{\omega\sigma\gamma}$ utilizing the experimental value of
the $\omega\to\pi^{0}\pi^{0}\gamma$ decay rate.
","[{""version"":""v1"",""created"":""Mon, 7 Aug 2000 07:54:18 GMT""},{""version"":""v2"",""created"":""Mon, 18 Sep 2000 11:57:41 GMT""},{""version"":""v3"",""created"":""Thu, 26 Oct 2000 09:13:51 GMT""}]","2009-11-06"
"nucl-th/0008012","Munetake Ichimura","Ken Kawahigashi, Kimiaki Nishida, Atsushi Itabashi, Munetake Ichimura","Distorted wave impulse approximation analysis for spin observables in
  nucleon quasi-elastic scattering and enhancement of the spin-longitudinal
  response","RevTex 3, 29 pages, 2 tables, 8 figures","Phys.Rev. C63 (2001) 044609","10.1103/PhysRevC.63.044609",,"nucl-th",,"  We present a formalism of distorted wave impulse approximation (DWIA) for
analyzing spin observables in nucleon inelastic and charge exchange reactions
leading to the continuum. It utilizes response functions calculated by the
continuum random phase approximation (RPA), which include the effective mass,
the spreading widths and the \Delta degrees of freedom. The Fermi motion is
treated by the optimal factorization, and the non-locality of the
nucleon-nucleon t-matrix by an averaged reaction plane approximation. By using
the formalism we calculated the spin-longitudinal and the spin-transverse cross
sections, ID_q and ID_p, of 12C, 40Ca (\vec{p},\vec{n}) at 494 and 346 MeV. The
calculation reasonably reproduced the observed ID_q, which is consistent with
the predicted enhancement of the spin-longitudinal response function R_L.
However, the observed ID_p is much larger than the calculated one, which was
consistent with neither the predicted quenching nor the spin-transverse
response function R_T obtained by the (e,e') scattering. The Landau-Migdal
parameter g'_N\Delta for the N\Delta transition interaction and the effective
mass at the nuclear center m^*(r=0) are treated as adjustable parameters. The
present analysis indicates that the smaller g'_{N\Delta}(\approx 0.3) and
m^*(0) \approx 0.7 m are preferable. We also investigate the validity of the
plane wave impulse approximation (PWIA) with the effective nucleon number
approximation for the absorption, by means of which R_L and R_T have
conventionally been extracted.
","[{""version"":""v1"",""created"":""Mon, 7 Aug 2000 09:51:13 GMT""},{""version"":""v2"",""created"":""Thu, 23 Nov 2000 07:44:29 GMT""}]","2009-11-06"
"physics/0008014","Daniel M. Kaplan","Daniel M. Kaplan, Edgar L. Black, Kevin W. Cassel, Mary Anne Cummings","Energy Absorber R&D","11 pages, 5 figures; presented at the NuFact'00 Workshop, Monterey,
  California, May 22-26, 2000","Nucl.Instrum.Meth.A472:632-638,2000","10.1016/S0168-9002(01)01322-5","IIT-HEP-00/1","physics.acc-ph",,"  We describe the program of research and development being undertaken by a
consortium of Illinois university groups to develop liquid-hydrogen energy
absorbers for muon-beam cooling for a possible stored-muon-beam neutrino
factory.
","[{""version"":""v1"",""created"":""Mon, 7 Aug 2000 14:35:37 GMT""}]","2008-11-26"
"quant-ph/0008031","Jean-Luc Brylinski","Jean-Luc Brylinski","Algebraic measures of entanglement","10 pages, Latex",,,,"quant-ph",,"  We study the rank of a general tensor $u$ in a tensor product $H_1\ot...\ot
H_k$. The rank of $u$ is the minimal number $p$ of pure states $v_1,...,v_p$
such that $u$ is a linear combination of the $v_j$'s. This rank is an algebraic
measure of the degree of entanglement of $u$. Motivated by quantum computation,
we completely describe the rank of an arbitrary tensor in $(\C^2)^{\ot 3}$ and
give normal forms for tensor states up to local unitary transformations. We
also obtain partial results for $(\C^2)^{\ot 4}$; in particular, we show that
the maximal rank of a tensor in $(\C^2)^{\ot 4}$ is equal to 4.
","[{""version"":""v1"",""created"":""Sun, 6 Aug 2000 19:28:39 GMT""}]","2007-05-23"
"quant-ph/0008032","Bill Munro","P. Deuar and W. J. Munro","Quantum copying can increase the practically available information","10 pages, 6 figures, accepted PRA","Phys. Rev A 61, 042304 (2000)","10.1103/PhysRevA.62.042304",,"quant-ph",,"  While it is known that copying a quantum system does not increase the amount
of information obtainable about the originals, it may increase the amount
available in practice, when one is restricted to imperfect measurements. We
present a detection scheme which using imperfect detectors, and possibly noisy
quantum copying machines (that entangle the copies), allows one to extract more
information from an incoming signal, than with the imperfect detectors alone.
The case of single-photon detection with noisy, inefficient detectors and
copiers (single controlled-NOT gates in this case) is investigated in detail.
The improvement in distinguishability between a photon and vacuum is found to
occur for a wide range of parameters, and to be quite robust to random noise.
The properties that a quantum copying device must have to be useful in this
scheme are investigated.
","[{""version"":""v1"",""created"":""Sun, 6 Aug 2000 23:50:14 GMT""}]","2009-11-06"
"quant-ph/0008033","Thomas G. Draper","Thomas G. Draper","Addition on a Quantum Computer","8 pages, 5 figures",,,,"quant-ph",,"  A new method for computing sums on a quantum computer is introduced. This
technique uses the quantum Fourier transform and reduces the number of qubits
necessary for addition by removing the need for temporary carry bits. This
approach also allows the addition of a classical number to a quantum
superposition without encoding the classical number in the quantum register.
This method also allows for massive parallelization in its execution.
","[{""version"":""v1"",""created"":""Mon, 7 Aug 2000 13:28:27 GMT""}]","2007-05-23"
"quant-ph/0008034","Holly Cummins","H. K. Cummins and J. A. Jones","Resonance Offset Tailored Pulses for NMR Quantum Computation","4 pages, 3 (multipart) figures. Submitted to the Journal of Magnetic
  Resonance",,,,"quant-ph",,"  We describe novel composite pulse sequences which act as general rotors and
thus are suitable for nuclear magnetic resonance (NMR) quantum computation. The
Resonance Offset Tailoring To Enhance Nutations (ROTTEN) approach permits
perfect compensation of off-resonance errors at two selected frequencies placed
symmetrically around the frequency of the RF source.
","[{""version"":""v1"",""created"":""Mon, 7 Aug 2000 14:02:22 GMT""}]","2007-05-23"
"quant-ph/0008035","A. K. Popov","Thomas F. George (Office of the Chancellor / Departments of Chemistry
  and Physics & Astronomy, University of Wisconsin-Stevens Point, Stevens
  Point, U.S.A) and A. K. Popov (Institute for Physics, Russian Academy of
  Sciences, Krasnoyarsk, Russia)","Coherence-controlled transparency and far-from-degenerate parametric
  gain in a strongly-absorbing Doppler-broadened medium","4 pages, 3 eps figures, to be published in Optics Letters, vol.25, No
  18 (2000), minor style changes and reference correction","Optics Letters v. 25 (2000) 1364-66","10.1364/OL.25.001364",,"quant-ph physics.atom-ph physics.optics",,"  An inversionless gain of anti-Stokes radiation above the oscillation
threshold in an optically-dense far-from-degenerate double-Lambda
Doppler-broadened medium accompanied by Stokes gain is predicted. The outcomes
are illustrated with numerical simulations applied to sodium dimer vapor.
Optical switching from absorption to gain via transparency controlled by a
small variation of the medium and of the driving radiation parameters which are
at a level less than one photon per molecule is shown. Related video/audio
clips see in: A.K. Popov, S.A. Myslivets, and T.F. George, Optics Express Vol.
7, No 3, 148 (2000)(http://epubs.osa.org/oearchive/source/22947.htm) or
download: http://kirensky.krasn.ru/popov/opa/opa.htm
","[{""version"":""v1"",""created"":""Mon, 7 Aug 2000 14:25:24 GMT""},{""version"":""v2"",""created"":""Tue, 8 Aug 2000 16:52:41 GMT""}]","2009-11-06"
