"cond-mat/0008103","Jean-Philippe Bouchaud","Jean-Philippe Bouchaud (CEA-Saclay and Science & Finance)","Power-laws in economy and finance: some ideas from physics","16 pages, Proceedings of the Santa-Fe Conference `Beyond Efficiency'
  held in May 2000, to appear in Journal of Quantitative Finance",,,,"cond-mat",,"  We discuss several models in order to shed light on the origin of power-law
distributions and power-law correlations in financial time series. From an
empirical point of view, the exponents describing the tails of the price
increments distribution and the decay of the volatility correlations are rather
robust and suggest universality. However, many of the models that appear
naturally (for example, to account for the distribution of wealth) contain some
multiplicative noise, which generically leads to *non universal exponents*.
Recent progress in the empirical study of the volatility suggests that the
volatility results from some sort of multiplicative cascade. A convincing
`microscopic' (i.e. trader based) model that explains this observation is
however not yet available. It would be particularly important to understand the
relevance of the pseudo-geometric progression of natural human time scales on
the long range nature of the volatility correlations.
","[{""version"":""v1"",""created"":""Mon, 7 Aug 2000 10:49:36 GMT""}]","2007-05-23"
"cond-mat/0008104","Roman Istomin","R. A. Istomin, A. S. Moskvin","Features of Hopping Integral and Unconventional Orbital Modes for
  Quantum Skyrmions in Heisenberg Ferromagnet","16 pages, no figures",,,,"cond-mat",,"  We use the coherent state approximation for the skyrmion in the isotropic
quantum Heisenberg ferromagnet to obtain analytical expression for skyrmion
hopping integral as a function of distance. It appears the skyrmion hopping is
restricted by distances larger than its effective diameter. Some puzzling
properties of the orbital skyrmionic modes are discussed. Spin distribution in
these states is obtained and effect of quantum spin contraction is
demonstrated.The principal possibility of lowering the skyrmion energy due to a
bonding-like state formation is illustrated.
","[{""version"":""v1"",""created"":""Mon, 7 Aug 2000 10:58:04 GMT""},{""version"":""v2"",""created"":""Tue, 10 Oct 2000 08:59:13 GMT""}]","2007-05-23"
"cond-mat/0008105","Lambert Alff","J. B. Philipp (2), C. Hoefener (1), S. Thienhaus (1), J. Klein (1), L.
  Alff (1 and 2), and R. Gross (2) ((1) II. Physikalisches Institut, University
  of Cologne, Germany, (2) Walther-Meissner-Institut, Garching, Germany)","Large two-level magnetoresistance effect in doped manganite grain
  boundary junctions","4 pages, 3 figures, to appear in Phys. Rev. B (Rapid Comm.)",,"10.1103/PhysRevB.62.R9248",,"cond-mat.str-el cond-mat.mtrl-sci",,"  We performed a systematic analysis of the tunneling magnetoresistance (TMR)
effect in single grain boundary junctions formed in epitaxial
La(2/3)Ca(1/3)MnO(3) films deposited on SrTiO(3) bicrystals. For magnetic
fields H applied parallel to the grain boundary barrier, an ideal two-level
resistance switching behavior with sharp transitions is observed with a TMR
effect of up to 300% at 4.2 K and still above 100% at 77 K. Varying the angle
between H and the grain boundary results in differently shaped resistance vs H
curves. The observed behavior is explained within a model of magnetic domain
pinning at the grain boundary interface.
","[{""version"":""v1"",""created"":""Mon, 7 Aug 2000 11:05:24 GMT""}]","2009-10-31"
"cond-mat/0008106","Michael Kastner","M. Kastner and M. Promberger","Consistency of Microcanonical and Canonical Finite-Size Scaling","10 pages. Submitted to J. Stat. Phys","Journal of Statistical Physics 103:893-902 (2001)",,,"cond-mat.stat-mech",,"  Typically, in order to obtain finite-size scaling laws for quantities in the
microcanonical ensemble, an assumption is taken as a starting point. In this
paper, consistency of such a Microcanonical Finite-Size Scaling Assumption with
its commonly accepted canonical counterpart is shown, which puts Microcanonical
Finite-Size Scaling on a firmer footing.
","[{""version"":""v1"",""created"":""Mon, 7 Aug 2000 13:42:45 GMT""}]","2007-05-23"
"cond-mat/0008107","Vladimir Konotop","V. V. Konotop and V. Kuzmiak","Double resonant processes in $\chi^{(2)}$ nonlinear periodic media","To appear in JOSA B",,"10.1364/JOSAB.17.001874",,"cond-mat.mtrl-sci physics.optics",,"  In a one-dimensional periodic nonlinear $\chi^{(2)}$ medium, by choosing a
proper material and geometrical parameters of the structure, it is possible to
obtain two matching conditions for simultaneous generation of second and third
harmonics. This leads to new diversity of the processes of the resonant
three-wave interactions, which are discussed within the framework of slowly
varying envelope approach. In particular, we concentrate on the fractional
conversion of the frequency $\omega \to (2/3) \omega$. This phenomenon occurs
by means of intermediate energy transfer to the first harmonic at the frequency
$\omega/3$ and can be controlled by this mode. By analogy the same medium
allows ""nondirect"" second harmonic generation, controlled by the cubic
harmonic. Propagation of localized pulses in the form two coupled bright
solitons on first and third harmonics and a dark soliton on the second harmonic
is possible.
","[{""version"":""v1"",""created"":""Mon, 7 Aug 2000 13:43:57 GMT""}]","2009-10-31"
"cond-mat/0008108","Rideau","D. Rideau, P. Monceau, R. Currat, H. Requardt, F. Nad, J.E. Lorenzo,
  S. Brazovskii, C. Detlefs and G. Grubel","X-Ray Scattering Evidence for Macroscopic Strong Pinning Centers in the
  Sliding CDW state of NbSe_3",,,"10.1209/epl/i2001-00608-x",,"cond-mat.str-el",,"  Using high-resolution X-ray scattering techniques, we measure the variation,
q(x), of the position in reciprocal space of the CDW satellite, in the sliding
state, along the length of NbSe_3 whiskers. We show that structural defects and
intentionally X-ray radiation-damaged regions increase locally the CDW pinning
force, and induce CDW phase distortions which are consistent with those
observed near contacts. Using the semi-microscopic model from Brazovskii
describing the normal-condensed carrier conversion, with spatially varying
parameters, we account for the experimental spatial dependence of the CDW phase
gradient near both types of defects.
","[{""version"":""v1"",""created"":""Mon, 7 Aug 2000 13:47:10 GMT""}]","2009-10-31"
"cond-mat/0008109","Michael L. Gorodetsky","V.B.Braginsky, M.L.Gorodetsky and S.P.Vyatchanin","Thermo-refractive noise in gravitational wave antennae","11 pages, 1 figure, the paper is revised as compared to one accepted
  in Phys.Letts.A (new numerical estimates)","Phys.Lett. A271 (2000) 303-307","10.1016/S0375-9601(00)00389-3",,"cond-mat.mtrl-sci",,"  Thermodynamical fluctuations of temperature in mirrors of gravitational wave
antennae may be transformed into additional noise not only through thermal
expansion coefficient but also through temperature dependence of refraction
index. The intensity of this noise is comparable with other known noises and
must be taken into account in future steps of the antennas.
","[{""version"":""v1"",""created"":""Mon, 7 Aug 2000 14:14:15 GMT""}]","2009-10-31"
"cond-mat/0008110","Robin C. Ball","RC Ball, G Caldarelli, A Flammini","Angular Structure of Lacunarity, and the Renormalisation Group","4 pages, 3 figures",,,"LQ7661","cond-mat.stat-mech",,"  We formulate the angular structure of Lacunarity in fractals, in terms of a
symmetry reduction of the three point correlation function. This provides a
rich probe of universality, and first measurements yield new evidence in
support of the equivalence between self-avoiding walks and percolation
perimeters in two dimensions.
  We argue the Lacunarity reveals much of the Renormalisation Group in real
space. This is supported by exact calculations for Random Walks and measured
data for percolation clusters and SAW's. Relationships follow between exponents
governing inwards and outwards propagating perturbations, and we also find a
very general test for the contribution of long range interactions.
","[{""version"":""v1"",""created"":""Mon, 7 Aug 2000 15:52:59 GMT""}]","2007-05-23"
"gr-qc/0008013","Yuri N. Obukhov","Yuri N. Obukhov and Romualdo Tresguerres","Hyperfluid - a model of classical matter with hypermomentum","plain Tex, 11 pages, no figures","Phys.Lett. A184 (1993) 17-22","10.1016/0375-9601(93)90339-2",,"gr-qc",,"  A variational theory of a continuous medium is developed the elements of
which carry momentum and hypermomentum (hyperfluid). It is shown that the
structure of the sources in metric-affine gravity is predetermined by the
conservation identities and, when using the Weyssenhoff ansatz, these
explicitly yield the hyperfluid currents.
","[{""version"":""v1"",""created"":""Mon, 7 Aug 2000 14:14:43 GMT""}]","2009-10-31"
"gr-qc/0008014","Yuri N. Obukhov","Yuri N. Obukhov","On a model of an unconstrained hyperfluid","Revtex, 10 pages, no figures","Phys.Lett. A210 (1996) 163-167","10.1016/S0375-9601(96)80004-1",,"gr-qc",,"  A hyperfluid is a classical continuous medium carrying hypermomentum. We
modify the earlier developed variational approach to a hyperfluid in such a way
that the Frenkel type constraints imposed on the hypermomentum current are
eliminated. The resulting self-consistent model is different from the
Weyssenhoff type one. The essential point is a conservation of the
hypermomentum current such that the final metrical and canonical
energy-momentum forms coincide.
","[{""version"":""v1"",""created"":""Mon, 7 Aug 2000 14:14:54 GMT""}]","2015-06-25"
"gr-qc/0008015","Yuri N. Obukhov","Yuri N. Obukhov","Spin-driven inflation","plain Tex, 6 pages, no figures","Phys.Lett.A182:214-216,1993","10.1016/0375-9601(93)91059-E",,"gr-qc",,"  Following recent studies of Ford, we suggest -- in the framework of general
relativity -- an inflationary cosmological model with the self-interacting
spinning matter. A generalization of the standard fluid model is discussed and
estimates of the physical parameters of the evolution are given.
","[{""version"":""v1"",""created"":""Mon, 7 Aug 2000 14:15:05 GMT""}]","2010-11-01"
"hep-ex/0008011","Alan J. Flavell","Sung-Won Lee (Glasgow)","Prompt Photons in Photoproduction at HERA","for the ZEUS Collaboration; Talk given at the 8th International
  Workshop on Deep Inelastic Scattering and QCD (DIS'2000), Liverpool, UK,
  April 25-30, 2000",,,"GLAS-PPE/2000-07","hep-ex",,"  First inclusive measurements of isolated prompt photons in photoproduction at
HERA have been made with the ZEUS detector. Cross sections are given as a
function of the pseudorapidity and the transverse energy of the photon, for
E_T^gamma > 5 GeV in the gamma-p centre-of-mass energy range 134-285 GeV.
Comparisons are made with predictions from LO Monte Carlo models and NLO QCD
calculations. For forward eta^gamma (proton direction) good agreement is found,
but in the rear direction all predictions fall below the data.
","[{""version"":""v1"",""created"":""Sun, 6 Aug 2000 21:44:54 GMT""}]","2007-05-23"
"hep-lat/0008006","Timur D. Bakeyev","T. Bakeyev and Ph. de Forcrand","Noisy Monte Carlo revisited","latex, 8 pages","Phys.Rev. D63 (2001) 054505","10.1103/PhysRevD.63.054505",,"hep-lat cond-mat",,"  We present an exact Monte Carlo algorithm designed to sample theories where
the energy is a sum of many couplings of decreasing strength. Our algorithm,
simplified from that of L. Lin et al. hep-lat/9905033, avoids the computation
of almost all non-leading terms. We illustrate its use by simulating SU(2)
lattice gauge theory with a 5-loop action, and discuss further applications to
full QCD.
","[{""version"":""v1"",""created"":""Mon, 7 Aug 2000 12:20:24 GMT""}]","2009-10-31"
"hep-ph/0008052",,"Muge Boz (Hacettepe)","The Higgs masses and explicit CP violation in the gluino-axion model","20 pp, 14 eps figs, title is changed, the manuscript is improved
  using the latest experimental data, some figures and references added","Mod.Phys.Lett.A17:215-230,2002","10.1142/S0217732302006552",,"hep-ph",,"  In this work, we adress the phenomenological consequences of explicit CP
violation on direct Higgs-boson searches at high energy colliders. Having a
restricted parameter space, we concentrate on the recently proposed
gluino-axion model, and investigate the CP violation capability of the model
subject to the recent experimental data. It is shown that the Higgs masses as
well as their CP compositions are quite sensitive to the supersymmetric CP
phases. The lightest Higgs is found to be nearly CP even to a good
approximation whilst the remaining two heavy scalars do not have definite CP
parities.
","[{""version"":""v1"",""created"":""Mon, 7 Aug 2000 04:17:17 GMT""},{""version"":""v2"",""created"":""Thu, 17 Jan 2002 15:02:59 GMT""}]","2014-11-17"
"hep-ph/0008053","Andrew Kirk","A. Kirk","Resonance production in central pp collisions at the CERN Omega
  Spectrometer","14 pages, Latex, 5 Figures","Phys.Lett.B489:29-37,2000","10.1016/S0370-2693(00)00944-8",,"hep-ph hep-ex",,"  A study of resonance production in central pp collisions is presented as a
function of several kinematical variables. In particular the difference in the
transverse momentum (dPT) of the exchanged particles shows that undisputed
qqbar mesons are suppressed at small dPT whereas glueball candidates are
enhanced and in addition, the azimuthal angle phi gives information on the
nature of the Pomeron.
","[{""version"":""v1"",""created"":""Mon, 7 Aug 2000 07:51:58 GMT""}]","2008-11-26"
"hep-ph/0008054",,"I.M. Dremin, J. Tran Thanh Van","Multiplicity distributions of quark and gluon jets in QCD","6 pages, LATEX, no Figs; talk given at 4th Rencontres du Vietnam",,,"FIAN-TD-31/00","hep-ph",,"  The solution of the equations for the generating functions of multiplicity
distributions of quark and gluon jets in higher order 3NLO perturbative QCD is
obtained. The non-perturbative effects are discussed as well. The results are
compared to recent experimental data on mean multiplicities, their ratio and
its slope, higher moments of the distributions.
","[{""version"":""v1"",""created"":""Mon, 7 Aug 2000 08:05:54 GMT""}]","2007-05-23"
"hep-ph/0008055","Asmita","Asmita Mukherjee","A Field Theoretic Investigation of Spin in QCD","4 pages, Latex2e, contribution to the proceedings of Tenth
  International Light-Cone Meeting on Non-Perturbative QCD and Hadron
  Phenomenology, Heidelberg, June 12-17, 2000","Nucl.Phys.Proc.Suppl. 90 (2000) 31-33","10.1016/S0920-5632(00)00867-7",,"hep-ph",,"  Utilizing the kinematical boost in light-front formalism one can address the
issue of relativistic spin operators in an arbitrary reference frame. In the
gauge $A^+=0$, the interaction dependent transverse spin operators can be
separated into three parts. In analogy with the helicity sum rule, we propose a
transverse spin sum rule. We perform a one loop renormalization of the
transverse spin operator and show that the counterterm needed is the same as
the linear mass counterterm in the light-front QCD Hamiltonian.
","[{""version"":""v1"",""created"":""Mon, 7 Aug 2000 08:36:44 GMT""}]","2009-10-31"
"hep-ph/0008056","Joe Sato","Joe Sato","Neutrino Oscillation and CP Violation","Talk given at the NUFACT'00: International Workshop on Muon Storage
  Ring for a Neutrino Factory, Monterey, California, 22-26 May 2000. Several
  typographical errors are corrected","Nucl.Instrum.Meth.A472:434-439,2001","10.1016/S0168-9002(01)01287-6",,"hep-ph",,"  We reconsider the meaning of observing CP violation in neutrino oscillation.
","[{""version"":""v1"",""created"":""Mon, 7 Aug 2000 10:03:14 GMT""},{""version"":""v2"",""created"":""Wed, 20 Sep 2000 01:13:11 GMT""}]","2008-11-26"
"hep-th/0008057","Sheikh-Jabbari Mohammad","A. Micu and M.M. Sheikh-Jabbari","Noncommutative $\Phi^4$ Theory at Two Loops","Latex, several ps figures, v3: 51 pages, presentation of introduction
  and conclusion improved, references added","JHEP 0101:025,2001","10.1088/1126-6708/2001/01/025","IC/2000/94","hep-th",,"  We study perturbative aspects of noncommutative field theories. This work is
arranged in two parts. First, we review noncommutative field theories in
general and discuss both canonical and path integral quantization methods. In
the second part, we consider the particular example of noncommutative $\Phi^4$
theory in four dimensions and work out the corresponding effective action and
discuss renormalizability of the theory, up to two loops.
","[{""version"":""v1"",""created"":""Mon, 7 Aug 2000 09:23:46 GMT""},{""version"":""v2"",""created"":""Fri, 18 Aug 2000 11:44:22 GMT""},{""version"":""v3"",""created"":""Wed, 17 Jan 2001 15:21:15 GMT""}]","2009-10-31"
"hep-th/0008058","Luciano Vanzo","M. Caldarelli, G. Catelani, L. Vanzo","Action, Hamiltonian and CFT for 2D black holes","6 pages, Latex2e document, v2 typos corrected, one reference added","JHEP 0010 (2000) 005","10.1088/1126-6708/2000/10/005","UTF-Preprint 440","hep-th",,"  The boundary terms in the Hamiltonian, in the presence of horizons, are
carefully analyzed in a simple 2D theory admitting AdS black holes. The
agreement between the euclidean approach and Cardy's formula is obtained modulo
certain assumptions on the spectrum of the Virasoro's algebra. There is no
discrepancy factor ""square root of 2"" once the appropriate boundary conditions
are properly recognized. The peculiar features of gravity, that the on-shell
Hamiltonian is determined by boundary terms, is the reason of the mentioned
agreement.
","[{""version"":""v1"",""created"":""Mon, 7 Aug 2000 10:06:38 GMT""},{""version"":""v2"",""created"":""Tue, 8 Aug 2000 14:14:50 GMT""}]","2009-10-31"
"hep-th/0008059","Stuart Dowker","Marcelo De Francia, Klaus Kirsten and J.S.Dowker","Effective actions on squashed lens spaces","16 pages, JyTeX","Class.Quant.Grav. 18 (2001) 955-968","10.1088/0264-9381/18/6/301","MUTP/2000/","hep-th",,"  As a technical exercise with possible relevance to the holographic principle
and string theory, the effective actions (functional determinants) for scalars
and spinors on the squashed three-sphere identified under the action of a
cyclic group, Z_m, are determined. Especially in the extreme oblate squashing
limit, which has a thermodynamic interpretation, the high temperature behaviour
is found as a function of m. Although the intermediate details for odd and even
m are different, the final answers are the same. A thermodynamic interpretation
for spinors is possible only for twisted periodicity conditions and m even.
","[{""version"":""v1"",""created"":""Mon, 7 Aug 2000 11:38:41 GMT""}]","2009-10-31"
"hep-th/0008060","Jussi Kalkkinen","Roberto Iengo and Jussi Kalkkinen","Decay Modes of Highly Excited String States and Kerr Black Holes","18 pages, LaTeX, uses jhep class V2: Section 5 improved, references
  and an appendix added","JHEP 0011:025,2000","10.1088/1126-6708/2000/11/025","SISSA 79/2000/EP","hep-th",,"  We consider four-graviton scattering in Type II string theory on one-loop
level in the large centre of mass energy M^2 limit. We extract from it an
explicit integral expression for the full string theory corrections to the
imaginary part of the mass-shift and the lifetime of a massive state with the
highest allowed spin J=2M^2+2. We find a decay rate that is up to log M
corrections of order 1 in string units, times g_s^2. We also find that the
dominant decay mode corresponds to the emission of light particles, whereas the
decay into two massive or two massless states is exponentially suppressed. We
discuss the relation of our results to quantum gravity aspects of a Kerr Black
Hole.
","[{""version"":""v1"",""created"":""Mon, 7 Aug 2000 12:29:16 GMT""},{""version"":""v2"",""created"":""Tue, 21 Nov 2000 15:11:03 GMT""}]","2014-11-18"
"hep-th/0008061","Sergio Zerbini","Guido Cognola, Sergio Zerbini","On the Dimensional Reduction Procedure","15 pages, Latex, enlarged discussion added in Sec 3 and typos
  corrected. Version to appear in Nucl. Phys. B","Nucl.Phys. B602 (2001) 383-398","10.1016/S0550-3213(01)00091-8","UTF-441","hep-th",,"  The issue related to the so-called dimensional reduction procedure is
revisited within the Euclidean formalism. First, it is shown that for symmetric
spaces, the local exact heat-kernel density is equal to the reduced one, once
the harmonic sum has been succesfully performed. In the general case, due to
the impossibility to deal with exact results, the short time heat-kernel
asymptotics is considered. It is found that the exact heat-kernel and the
dimensionally reduced one coincide up to two non trivial leading contributions
in the short time expansion. Implications of these results with regard to
dimensional-reduction anomaly are discussed.
","[{""version"":""v1"",""created"":""Mon, 7 Aug 2000 15:12:35 GMT""},{""version"":""v2"",""created"":""Mon, 19 Mar 2001 10:00:23 GMT""}]","2015-06-25"
"hep-th/0008062","Arnaud Bossard","A. Bossard (U. of Tours), N. Mohammedi (U. of Tours)","Non-Abelian Duality in the String Effective Action","26 pages, LaTeX, minor changes and typos corrected. Accepted for
  publication in Nuclear Physics B","Nucl.Phys. B595 (2001) 93-118","10.1016/S0550-3213(00)00690-8",,"hep-th",,"  We study the symmetry of the one-loop effective action of bosonic string
theory under non-Abelian T-duality transformations. It is shown that the
original Lagrangian and its dual are proportional. This result implies that the
corresponding reduced low energy effective actions are equivalent and leads to
a functional relation between the Weyl anomaly coefficients of the original and
dual two-dimensional non-linear sigma models. {}Finally, we apply this
formalism to some simple examples.
","[{""version"":""v1"",""created"":""Mon, 7 Aug 2000 15:38:03 GMT""},{""version"":""v2"",""created"":""Thu, 10 Aug 2000 18:46:51 GMT""},{""version"":""v3"",""created"":""Thu, 9 Nov 2000 15:38:48 GMT""}]","2009-10-31"
"math-ph/0008016","Henning Samtleben","M. Niedermaier and H. Samtleben","Sequential Bethe vectors and the quantum Ernst system","6 pages. LaTeX, presented at the 9th Colloquium ``Quantum groups and
  integrable systems'', Prague, 22--24 June 2000","Czech.J.Phys. 50 (2000) 1317-1322","10.1023/A:1022881528752","LPTENS-00/31","math-ph hep-th math.MP",,"  We give a brief review on the use of Bethe ansatz techniques to construct
solutions of recursive functional equations which emerged in a bootstrap
approach to the quantum Ernst system. The construction involves two particular
limits of a rational Bethe ansatz system with complex inhomogeneities. First,
we pinch two insertions to the critical value. This links Bethe systems with
different number of insertions and leads to the concept of sequential Bethe
vectors. Second, we study the semiclassical limit of the system in which the
scale parameter of the insertions tends to infinity.
","[{""version"":""v1"",""created"":""Mon, 7 Aug 2000 12:00:42 GMT""}]","2009-10-31"
"math-ph/0008017","Ariel Caticha","Ariel Caticha","Maximum entropy, fluctuations and priors","presented at MaxEnt 2000, the 20th International Workshop on Bayesian
  Inference and Maximum Entropy Methods (July 8-13, Gif-sur-Yvette, France))","p. 94 in ""Maximum Entropy and Bayesian Methods in Science and
  Engineering"" ed. by A. Mohammad-Djafari (A.I.P. Vol. 568, 2001)","10.1063/1.1381874",,"math-ph cond-mat.stat-mech math.MP math.ST physics.data-an stat.TH",,"  The method of maximum entropy (ME) is extended to address the following
problem: Once one accepts that the ME distribution is to be preferred over all
others, the question is to what extent are distributions with lower entropy
supposed to be ruled out. Two applications are given. The first is to the
theory of thermodynamic fluctuations. The formulation is exact, covariant under
changes of coordinates, and allows fluctuations of both the extensive and the
conjugate intensive variables. The second application is to the construction of
an objective prior for Bayesian inference. The prior obtained by following the
ME method to its inevitable conclusion turns out to be a special case of what
are currently known under the name of entropic priors.
","[{""version"":""v1"",""created"":""Mon, 7 Aug 2000 15:28:30 GMT""}]","2009-10-31"
"math-ph/0008018","Ariel Caticha","Ariel Caticha","Change, time and information geometry","Presented at MaxEnt 2000, the 20th International Workshop on Bayesian
  Inference and Maximum Entropy Methods (July 8-13, 2000, Gif-sur-Yvette,
  France)","p. 72 in ""Maximum Entropy and Bayesian Methods in Science and
  Engineering"" ed. by A. Mohammad-Djafari (A.I.P. Vol. 568, 2001)","10.1063/1.1381872",,"math-ph cond-mat.stat-mech gr-qc math.MP math.PR",,"  Dynamics, the study of change, is normally the subject of mechanics. Whether
the chosen mechanics is ``fundamental'' and deterministic or
``phenomenological'' and stochastic, all changes are described relative to an
external time. Here we show that once we define what we are talking about,
namely, the system, its states and a criterion to distinguish among them, there
is a single, unique, and natural dynamical law for irreversible processes that
is compatible with the principle of maximum entropy. In this alternative
dynamics changes are described relative to an internal, ``intrinsic'' time
which is a derived, statistical concept defined and measured by change itself.
Time is quantified change.
","[{""version"":""v1"",""created"":""Mon, 7 Aug 2000 15:43:55 GMT""}]","2009-10-31"
