"astro-ph/0008191","Soeren S. Larsen","Soeren S. Larsen (UCO / Lick Observatory)","Young massive star clusters in M51","9 pages, 8 figures. Figure 4 is shown with decreased resolution for
  astro-ph. Accepted for publication in MNRAS","Mon.Not.Roy.Astron.Soc. 319 (2000) 893","10.1046/j.1365-8711.2000.03913.x",,"astro-ph",,"  A search for young massive star clusters (YMCs) in the nearby face-on spiral
galaxy M51 (NGC 5194) has been carried out using UBV CCD images from the prime
focus camera on the Lick 3 meter Shane telescope. The YMC population is found
to be quite rich with a specific U-band luminosity T_L(U) = 1.4, consistent
with the high current star formation rate of this galaxy. The brightest
clusters have M_V about -12.5, far brighter than any young clusters currently
known in the Milky Way and even surpassing the luminosity of the R136 cluster
in the 30 Dor complex in the Large Magellanic Cloud. A few of the YMCs are
examined on archive HST/WFPC2 images, confirming their cluster nature and
providing estimates of their effective radii of 2-3 pc. The number of YMCs in
M51 is compatible with extrapolation of a power-law luminosity function with
exponent roughly equal to -2 from a Milky Way-like population of open clusters.
Both the SFR and T_L(U) of M51 are similar to those of other cluster-rich
spiral galaxies like NGC 1313 and M83.
","[{""version"":""v1"",""created"":""Mon, 14 Aug 2000 19:23:25 GMT""}]","2009-10-31"
"astro-ph/0008201","Ray Carlberg","R. G. Carlberg, H. K. C. Yee, S. L. Morris, H. Lin, P. B. Hall, D. R.
  Patton, M. Sawicki and C. W. Shepherd","Galaxy Groups at Intermediate Redshift","50 pages, 24 figures, submitted to ApJ",,"10.1086/320555",,"astro-ph",,"  Galaxy groups likely to be virialized are identified within the CNOC2
intermediate redshift galaxy survey using an iterative method. The
number-velocity dispersion relation is in agreement with the low-mass
extrapolation of the cluster normalized Press-Schechter function. The two-point
group-group correlation function has r_0=6.8+/- 0.3 Mpc, which is larger than
the correlations of individual galaxies at the level predicted from n-body
calibrated halo clustering.
  The groups are stacked in velocity and position to create a sample large
enough for measurement of a density and velocity dispersion profile. The
stacked mean galaxy density profile falls nearly as a power law with r^{-2.5}
and has no well-defined core. The projected velocity dispersion is examined for
a variety of samples with different methods and found to be either flat or
slowly rising outwards. The combination of a steeper-than-isothermal density
profile and the outward rising velocity dispersion implies that the
mass-to-light ratio of groups rises with radius. The M/L can be kept nearly
constant if the galaxy orbits are nearly circular, although such strong
tangential anisotropy is not supported by other evidence. The segregation of
mass and light is not dependent on galaxy luminosity but is far more prominent
in the red galaxies than the blue. The M/L gradient could arise from orbital
``sloshing'' of the galaxies in the group halos, dynamical friction acting on
the galaxies in a background of ``classical'' collisionless dark matter, or,
more speculatively, the dark matter may have a true core.
","[{""version"":""v1"",""created"":""Mon, 14 Aug 2000 16:40:45 GMT""}]","2016-08-30"
"astro-ph/0008202","Stuart Lumsden","S.L. Lumsden (1,3), P.J. Puxley (2) and M.G. Hoare (1) ((1) Department
  of Physics and Astronomy, University of Leeds, UK (2) Gemini Observatory,
  Hilo, Hawaii (3) Anglo-Australian Observatory, Epping, NSW, Australia)","Infrared Helium-Hydrogen Line Ratios as a Measure of Stellar Effective
  Temperature","24 pages 11 figures (in 62 separate postscript files) Accepted for
  publication in Monthly Notices of the Royal Astronomical Society","Mon.Not.Roy.Astron.Soc. 320 (2001) 83","10.1046/j.1365-8711.2001.03954.x",,"astro-ph",,"  We have observed a large sample of compact planetary nebulae in the
near-infrared to determine how the 2^1P-2^1S HeI line at 2.058um varies as a
function of stellar effective temperature, Teff. The ratio of this line with HI
Br g at 2.166um has often been used as a measure of the highest Teff present in
a stellar cluster, and hence on whether there is a cut-off in the stellar
initial mass function at high masses. However, recent photoionisation modelling
has revealed that the behaviour of this line is more complex than previously
anticipated. Our work shows that in most aspects the photoionisation models are
correct. In particular, we confirm the weakening of the 2^1P-2^1S as Teff
increases beyond 40000K. However, in many cases the model underpredicts the
observed ratio when we consider the detailed physical conditions in the
individual planetary nebulae. Furthermore, there is evidence that there is
still significant 2^1P-2^1S HeI line emission even in the planetary nebulae
with very hot (Teff>100000K) central stars. It is clear from our work that this
ratio cannot be considered as a reliable measure of effective temperature on
its own.
","[{""version"":""v1"",""created"":""Mon, 14 Aug 2000 17:02:19 GMT""}]","2009-10-31"
"astro-ph/0008203","Nuria Calvet","Erik Gullbring, Nuria Calvet, James Muzerolle, and Lee Hartmann","The Structure and Emission of the Accretion Shock in T Tauri Stars II:
  the Ultraviolet Continuum Emission","Latex manuscript, 18 pages, 4 figures. To appear in The Astrophysical
  Journal",,"10.1086/317253",,"astro-ph",,"  We compare accretion shock models with optical and ultraviolet spectra of
pre-main sequence stars to (1) make the first determinations of accretion rates
in intermediate mass T Tauri stars from continuum emission, and (2) derive
improved estimates of accretion rates and extinctions for continuum T Tauri
stars. Our method extends the shock models developed by Calvet and Gullbring to
enable comparisons with optical and archival International Ultraviolet Explorer
ultraviolet spectra. We find good agreement between the observations and the
model predictions, supporting the basic model of magnetospheric accretion
shocks as well as previous determinations of accretion rates and interstellar
reddening for the low mass T Tauri stars. The accretion rates determined for
the intermediate-mass T Tauri stars agree well with values obtained through
other methods that use near-infrared hydrogen line strengths (Muzerolle et al.
1998).
","[{""version"":""v1"",""created"":""Mon, 14 Aug 2000 20:47:01 GMT""}]","2009-10-31"
"astro-ph/0008204","Benjamin J. Weiner","Benjamin J. Weiner (OCIW), T.B. Williams (Rutgers), J.H. van Gorkom
  (Columbia), J.A. Sellwood (Rutgers)","The Disk and Dark Halo Mass of the Barred Galaxy NGC 4123. I.
  Observations","accepted by ApJ, 16 pages, 9 figures (1 color), uses emulateapj.sty,
  onecolfloat.sty","Astrophys.J.546:916-930,2001","10.1086/318288",,"astro-ph",,"  The non-circular streaming motions in barred galaxies are sensitive to the
mass of the bar and can be used to lift the degeneracy between disk and dark
matter halo encountered when fitting axisymmetric rotation curves of disk
galaxies. In this paper, we present photometric and kinematic observations of
NGC 4123, a barred galaxy of modest size (V_rot = 130 km/sec, L = 0.7 L_*),
which reveal strong non-circular motions. The bar has straight dust lanes and
an inner Lindblad resonance. The disk of NGC 4123 has no sign of truncation out
to 10 scale lengths, and star-forming regions are found well outside R_25. A
Fabry-Perot H-alpha velocity field shows velocity jumps of >100 km/sec at the
location of the dust lanes within the bar, indicating shocks in the gas flow.
VLA observations yield the velocity field of the H I disk. Axisymmetric mass
models yield good fits to the rotation curve outside the bar regionfor disk
I-band M/L of 2.25 or less, and dark halos with either isothermal or power-law
profiles can fit the data well. In a companion paper, we model the full 2-D
velocity field, including non-circular motions, to determine the stellar M/L
and the mass of the dark halo.
","[{""version"":""v1"",""created"":""Mon, 14 Aug 2000 20:48:53 GMT""}]","2008-11-26"
"astro-ph/0008205","Benjamin J. Weiner","Benjamin J. Weiner (OCIW), J.A. Sellwood, T.B. Williams (Rutgers)","The Disk and Dark Halo Mass of the Barred Galaxy NGC 4123. II.
  Fluid-Dynamical Models","accepted by ApJ, 20 pages, 11 figures (2 color), uses emulateapj.sty,
  onecolfloat.sty","Astrophys.J.546:931-951,2001","10.1086/318289",,"astro-ph",,"  We report a dynamical determination of the separate contributions of disk and
dark halo masses to the rotation curve of a spiral galaxy. We use
fluid-dynamical models of gas flow in the barred galaxy NGC 4123 to constrain
the dynamical properties of the galaxy: disk M/L, bar pattern speed, and the
central density and scale radius of the dark halo. We derive a realistic barred
potential directly from the light distribution. For each model we assume a
value of the stellar M/L and a bar pattern speed Omega_p and add a dark halo to
fit the rotation curve. We then compute the gas flow velocities with a 2-D gas
dynamical code, and compare the model flow patterns to a 2-D velocity field
derived from Fabry-Perot observations. The strong shocks and non-circular
motions in the observed gas flow require a high stellar M/L and a fast-rotating
bar. Models with I-band disk M/L of 2.0 -- 2.5 h_75, or 80 -- 100% of the
maximum disk value, are highly favored. The corotation radius of the bar must
be <= 1.5 times the bar semi-major axis. These results contradict some recent
claimed ``universal'' galaxy disk/halo relations, since NGC 4123 is of modest
size (rotation curve maximum 145 km/sec, and V_flat = 130 km/sec) yet is quite
disk-dominated. The dark halo of NGC 4123 is less concentrated than favored by
current models of dark halos based on cosmological simulations. Since some 30%
of bright disk galaxies are strongly barred and have dust lanes indicating
shock morphology similar to that of NGC 4123, it is likely that they also have
high stellar M/L and low density halos. We suggest that luminous matter
dominates inside the optical radius R_25 of high surface brightness disk
galaxies.
","[{""version"":""v1"",""created"":""Mon, 14 Aug 2000 20:50:06 GMT""}]","2008-11-26"
"astro-ph/0008206","Zhen Cao","T.Abu-Zayyad et. al (HiRes-MIA Collaboration)","A Measurement of the Average Longitudinal Development Profile of Cosmic
  Ray Air Showers Between 10^{17}eV and 10^{18}eV","27 pages including 9 figures in revtex4 epsf style, submited to
  Astroparticle Phys","Astropart.Phys.16:1-11,2001","10.1016/S0927-6505(00)00170-5",,"astro-ph hep-ph",,"  The average extensive air shower longitudinal development profile as a
function of shower age in the energy range from 10$^{17}$ to 10$^{18}$eV is
measured using data from the hybrid HiRes/MIA experiment. An angular bin signal
based Cerenkov light component subtraction method and a shower maximum fitting
method using a local parabolic function are used to correct and normalize the
data. The Gaisser-Hillas and Greisen functions work equally well for describing
the shower profile. The Gaussian function is a poor fit. A simple scale-free
function is proposed and fits the data equally well. The best-fit parameters
for the above functions are determined.
","[{""version"":""v1"",""created"":""Mon, 14 Aug 2000 21:20:12 GMT""}]","2011-05-23"
"astro-ph/0008207","Norman K. Glendenning","Michael B. Christiansen (University of Aarhus) and Norman K.
  Glendenning (Lawrence Berkeley National Laboratory)","Structured Mixed Phase is Favored in Neutron Stars","Latex, 4 pages, 2 figures",,,,"astro-ph",,"  We give a general thermodynamical argument showing that in neutron stars, the
Coulomb structured mixed phase is always favored for any first order phase
transition involving systems in equilibrium with baryon number and electric
charge as the two independent components. This finding is likely to have
important consequences for many neutron star properties, e.g., glitch
phenomena, transport and superfluid properties, r-mode instabilities, and the
braking index.
","[{""version"":""v1"",""created"":""Mon, 14 Aug 2000 22:50:36 GMT""}]","2007-05-23"
"astro-ph/0008208","Hiroko Koyama","Hiroko Koyama and Tetsuro Konishi","Emergence of power-law correlation in 1-dimensional self-gravitating
  system","9 pages, 7 figures, accepted for publication in Physics Letters A","Phys.Lett. A279 (2001) 226-230","10.1016/S0375-9601(00)00832-X","DPNU-00-25","astro-ph nlin.CD",,"  A new phase of temporal evolution of the one-dimensional self-gravitating
system is numerically discovered. Fractal structure is dynamically created from
non-fractal initial conditions. Implication to astrophysics and mathematical
physics is discussed.
","[{""version"":""v1"",""created"":""Tue, 15 Aug 2000 00:59:38 GMT""},{""version"":""v2"",""created"":""Fri, 1 Sep 2000 05:13:48 GMT""},{""version"":""v3"",""created"":""Wed, 13 Dec 2000 11:53:13 GMT""}]","2009-10-31"
"astro-ph/0008209","Toshiharu Samura","K. Kobayakawa, Y. S. Honda, T. Samura","Acceleration of Particles by Oblique Shocks and Cosmic Ray Spectra
  around the Knee Region","29 pages including 9 figures and 1 table, LaTex, a completely revised
  version will appear in Phys.Rev.D.; change of section II made shorter, added
  B; section III B and C added; figs. in section IV changed","Phys.Rev. D66 (2002) 083004","10.1103/PhysRevD.66.083004",,"astro-ph",,"  We examine the first order Fermi acceleration on the presumption that
supernova remnant shocks cross ambient magnetic fields with various angles.
These oblique shocks accelerate particles more efficiently than the parallel
shocks and elevate the maximum energies achievable by the particles. The
primary cosmic ray spectrum is strongly dependent upon these energies. We also
consider the dependence of the injection efficiency and of spectral indices on
obliquity. When indices and absolute fluxes at $10^{12}$ eV are given for six
nuclear groups from balloon-borne data, each energy spectrum develops a smooth
rigidity dependent knee structure. The resultant total spectrum also behaves
similarly and fits well with ground-based experimental data up to several
$10^{17}$ eV. It is shown as well that the chemical composition changes
significantly from lighter to heavier nuclei as the energies of particles
exceed the knee region. Other predicted curves are compared with the
experimental data which they reproduce rather well.
","[{""version"":""v1"",""created"":""Tue, 15 Aug 2000 04:03:34 GMT""},{""version"":""v2"",""created"":""Mon, 11 Sep 2000 09:26:48 GMT""},{""version"":""v3"",""created"":""Tue, 1 Oct 2002 14:15:30 GMT""}]","2009-10-31"
"astro-ph/0008210","Mark Walker","Mark A. Walker (Sydney Uni. & ATNF)","Interpretation of Extreme Scattering Events","6 pages, 1 figure; to appear in Proc. IAU Coll. 182 ``Sources and
  Scintillations: refraction and scattering in radio astronomy'' (Special
  edition of ApSS)","Astrophys.Space Sci. 278 (2001) 149-154","10.1023/A:1013138224603",,"astro-ph",,"  Extreme Scattering Events are sometimes manifest in the light-curves of
compact radio-quasars at frequencies of a few GHz. These events are not
understood. The model which appears to offer the best explanation requires a
new population of AU-sized, neutral gas clouds; these clouds would then make up
a large fraction of the Galaxy's dark matter. Independent of the question of
which theoretical model is correct, if we extrapolate the observed behaviour to
low radio-frequencies, we expect that the sky should be criss-crossed by a
network of narrow caustics, at frequencies below about 700 MHz. Consequently at
these frequencies sources should typically manifest additional, faint images
which are substantially delayed with respect to the primary image. Although
some examples of this type of behaviour are already known, it is expected that
these are just the tip of the iceberg, with strong selection biases having been
imposed by the instrumentation employed to date.
","[{""version"":""v1"",""created"":""Tue, 15 Aug 2000 05:09:37 GMT""}]","2009-10-31"
"astro-ph/0008211","Dr. Henric Krawczynski","The HEGRA Collaboration: F. Aharonian, A. Akhperjanian, J. Barrio, et
  al","The TeV Energy Spectrum of Mkn 501 Measured with the Stereoscopic
  Telescope System of HEGRA during 1998 and 1999","Accepted for publication in The Astrophysical Journal, Part 1, on
  August 4th, 2000","Astrophys.J. 546 (2001) 898-902","10.1086/318321",,"astro-ph",,"  During 1997, the BL Lac object Mkn 501 went into an extraordinary state of
high X-ray and TeV gamma-ray activity, lasting more than 6 months. In this
paper we report on the TeV emission characteristics of the source in the
subsequent years of 1998 and 1999 as measured with the Stereoscopic Cherenkov
Telescope System of HEGRA (La Palma, Canary Islands). Our observations reveal a
1998-1999 mean emission level at 1 TeV of 1/3 of the flux of the Crab Nebula, a
factor of 10 lower than during the year of 1997. A dataset of 122 observations
hours with the HEGRA telescope system makes it possible to assess for the first
time the Mkn 501 TeV energy spectrum for a mean flux level substantially below
that of the Crab Nebula with reasonable statistical accuracy. Excluding the
data of a strong flare, we find evidence that the 1998--1999 low-flux spectrum
is substantially softer (by 0.44+-0.1(stat) in spectral index) than the 1997
time averaged spectrum. The 500 GeV to 10 TeV energy spectrum can well be
described by a power law model with exponential cutoff: dN/dE ~ E^(-alpha)
exp(-E/E0) with alpha=2.31+-0.22(stat), and E0=5.1 (-2.3+7.8)(stat) TeV. Within
statistical accuracy, also a pure power law model gives an acceptable fit to
the data: dN/dE ~ E^(-Gamma) with Gamma=2.76+-0.08(stat). After presenting the
1998-1999 TeV characteristics of the source we discuss the implications of the
results.
","[{""version"":""v1"",""created"":""Tue, 15 Aug 2000 08:00:48 GMT""}]","2018-04-18"
"astro-ph/0008212","Tomoya Tatsuno","T. Tatsuno (1), V. I. Berezhiani (1), and S. M. Mahajan (2)
  ((1)University of Tokyo, (2)University of Texas)","Vortex solitons - Mass, Energy and Angular momentum bunching in
  relativistic electron-positron plasmas","17 pages with 2 figures","Phys. Rev. E 63, 046403 (2001).","10.1103/PhysRevE.63.046403",,"astro-ph",,"  It is shown that the interaction of large amplitude electromagnetic waves
with a hot electron-positron (e-p) plasma (a principal constituent of the
universe in the MeV epoch) leads to a bunching of mass, energy, and angular
momentum in stable, long-lived structures. Electromagnetism in the MeV epoch,
then, could provide a possible route for seeding the observed large-scale
structure of the universe.
","[{""version"":""v1"",""created"":""Tue, 15 Aug 2000 09:09:10 GMT""}]","2009-10-31"
"astro-ph/0008213","Michaela Kraus","M. Kraus (1), E. Kruegel (1), C. Thum (2), T. Geballe (3) ((1) Max
  Planck Institute of Radioastronomy, (2) Institut de Radio Astronomie
  Millimetrique, (3) Gemini Observatory)","CO band emission from MWC349: I. First overtone bands from a disk or
  from a wind?","11 pages with 18 figures. Accepted for publication in Astronomy and
  Astrophysics","Astronomy & Astrophysics, 362, 158-168 (2000)",,,"astro-ph",,"  We observed the near infrared emission in the wavelength range 2.28-2.50
micron from the peculiar B[e]-star MWC349. The spectra contain besides the
strong IR continuum the first overtone CO bands and most of the hydrogen
recombination lines of the Pfund series, both in emission. We also modeled the
spectra. The Pfund lines have a gaussian profile with a FWHM of ~100 km/s, and
it turned out that their emission is in LTE and optically thin. To explain the
CO bands, several scenarios were investigated. We found that the CO band heads
are formed under LTE and that the gas must have a temperature of 3500 to 4000
K. The width of the 2 -> 0 band head indicates kinematical broadening of 50 to
60 km/s. We can obtain fits to the measured spectra assuming that the CO gas
has a column density of 5 10^{20} cm^{-2} and is located either at the inner
edge of the rotating circumstellar disk. In this case, the disk must have a
bulge which partly blocks the radiation so that the observer sees only a sector
on the far side where the radial velocities are small. Or the CO emission
originates in a wind with gaussian line profiles. Both fits are of equal
quality and satisfactory. In a third alternative where the fit is less
convincing, the CO emission is optically thin and comes from an extended
Keplerian disk.
","[{""version"":""v1"",""created"":""Tue, 15 Aug 2000 10:46:59 GMT""}]","2007-05-23"
"astro-ph/0008214","Avery Meiksin","A. Meiksin (IfA, Edinburgh), M. White (CfA, Harvard)","Particle-Mesh Simulations of the Lyman-Alpha Forest","8 pages, 12 PostScript figures. Submitted to MNRAS","Mon.Not.Roy.Astron.Soc.324:141,2001","10.1046/j.1365-8711.2001.04264.x",,"astro-ph",,"  Numerical hydrodynamical simulations have proven a successful means of
reproducing many of the statistical properties of the Lyman-Alpha forest as
measured in high redshift quasar spectra. Pseudo-hydrodynamical methods based
only on simulating the dark matter component have been claimed to yield a
comparable level of success. We investigate the degree to which two
pseudo-methods, with and without allowing for a pseudo-gas pressure, are able
to match the predictions of fully hydrodynamical plus dark matter simulations.
We also address the requirements for convergence to the statistics of the
spectra and the inferred properties of the Lyman-Alpha forest as a function of
resolution and box size. Generally we find it is possible to reach agreement
with full hydrodynamic simulations at the 10% level in the cumulative
distributions of the flux and absorption line parameter statistics for readily
achievable particle and grid numbers, but difficult to do much better.
","[{""version"":""v1"",""created"":""Tue, 15 Aug 2000 10:13:27 GMT""}]","2009-08-18"
"astro-ph/0008215","Eugene Churazov","E.Churazov (MPA,IKI), M.Br\""uggen (MPA, Churchill College), C.R.Kaiser
  (MPA), H.B\""ohringer (MPE), W.Forman (CFA)","Evolution of Buoyant Bubbles in M87","20 pages, 11 figures, ApJ accepted","Astrophys.J. 554 (2001) 261-273","10.1086/321357",,"astro-ph",,"  The morphology of the X-ray and radio emitting features in the central $\sim$
50 kpc region around the galaxy M87 strongly suggests that buoyant bubbles of
cosmic rays (inflated by an earlier nuclear active phase of the galaxy) rise
through the cooling gas at roughly half the sound speed. In the absence of
strong surface tension, initially spherical bubbles will transform into tori as
they rise through an external medium. Such structures can be identified in the
radio images of the halo of M87. During their rise, bubbles will uplift
relatively cool X-ray emitting gas from the central regions of the cooling flow
to larger distances. This gas is colder than the ambient gas and has a higher
volume emissivity. As a result, rising ``radio'' bubbles may be trailed by
elongated X-ray features as indeed is observed in M87. We performed simple
hydrodynamic simulations to qualitatively illustrate the evolution of buoyant
bubbles in the M87 environment.
","[{""version"":""v1"",""created"":""Tue, 15 Aug 2000 14:11:32 GMT""},{""version"":""v2"",""created"":""Tue, 6 Feb 2001 13:31:49 GMT""}]","2016-08-15"
"astro-ph/0008216","Gian Luigi Granato","G.L. Granato, C.G. Lacey, L. Silva, A. Bressan, C.M. Baugh, S. Cole,
  C.S. Frenk","Modelling the Extinction Properties of Galaxies","4 pages with 1 figures in Latex-Kluwer style. To be published in the
  proceedings of the Granada Euroconference ""The Evolution of
  Galaxies.I-Observational Clues""","Astrophys.Space Sci. 277S1 (2001) 589-592","10.1023/A:1012784930833",,"astro-ph",,"  Recently (Granato, Lacey, Silva et al. 2000, astro-ph/0001308) we have
combined our spectrophotometric galaxy evolution code which includes dust
reprocessing (GRASIL, Silva et al. 1998) with semi-analytical galaxy formation
models (GALFORM, Cole et al. 1999). One of the most characteristic features of
the former is that the dust is divided in two main phases: molecular cloud
complexes, where stars are assumed to be born, and the diffuse interstellar
medium. As a consequence, stellar populations of different ages have different
geometrical relationships with the two phases, which is essential in
understanding several observed properties of galaxies, in particular those
undergoing major episodes of star formation at any redshift. Indeed, our merged
GRASIL+GALFORM model reproduces fairly well the SEDs of normal spirals and
starbursts from the far-UV to the sub-mm and their internal extinction
properties. In particular in the model the observed starburst attenuation law
(Calzetti 1999) is accounted for as an effect of geometry of stars and dust,
and has nothing to do with the optical properties of dust grains.
","[{""version"":""v1"",""created"":""Tue, 15 Aug 2000 14:29:49 GMT""}]","2009-10-31"
