"cs/0008009","Myra Spiliopoulou","Myra Spiliopoulou and Carsten Pohle (Institue of Information Systems,
  Humboldt University Berlin)","Data Mining to Measure and Improve the Success of Web Sites","24 pages, 4 postscript figures and 4 figures containing only text. To
  be published in the Journal of Data Mining and Knowledge Discovery (Kluwer
  Academic Publishers), Special Issue on E-Commerce; subject to some revision",,,,"cs.LG cs.DB",,"  For many companies, competitiveness in e-commerce requires a successful
presence on the web. Web sites are used to establish the company's image, to
promote and sell goods and to provide customer support. The success of a web
site affects and reflects directly the success of the company in the electronic
market. In this study, we propose a methodology to improve the ``success'' of
web sites, based on the exploitation of navigation pattern discovery. In
particular, we present a theory, in which success is modelled on the basis of
the navigation behaviour of the site's users. We then exploit WUM, a navigation
pattern discovery miner, to study how the success of a site is reflected in the
users' behaviour. With WUM we measure the success of a site's components and
obtain concrete indications of how the site should be improved. We report on
our first experiments with an online catalog, the success of which we have
studied. Our mining analysis has shown very promising results, on the basis of
which the site is currently undergoing concrete improvements.
","[{""version"":""v1"",""created"":""Tue, 15 Aug 2000 15:20:18 GMT""}]","2007-05-23"
"gr-qc/0008030","Ivan S. N. Booth","Ivan S. Booth","A quasilocal Hamiltonian for gravity with classical and quantum
  applications","PhD Thesis from University of Waterloo, 199 pages, 10 figures",,,,"gr-qc",,"  I modify the quasilocal energy formalism of Brown and York into a purely
Hamiltonian form. As part of the reformulation, I remove their restriction that
the time evolution of the boundary of the spacetime be orthogonal to the leaves
of the time foliation. Thus the new formulation allows an arbitrary evolution
of the boundary which physically corresponds to allowing general motions of the
set of observers making up that boundary. I calculate the rate of change of the
quasilocal energy in such situations, show how it transforms with respect to
boosts of the boundaries, and use the Lanczos-Israel thin shell formalism to
reformulate it from an operational point of view. These steps are performed
both for pure gravity and gravity with attendant matter fields. I then apply
the formalism to characterize naked black holes and study their properties,
investigate gravitational tidal heating, and combine it with the path integral
formulation of quantum gravity to analyze the creation of pairs of charged and
rotating black holes. I show that one must use complex instantons to study this
process though the probabilities of creation remain real and consistent with
the view that the entropy of a black hole is the logarithm of the number of its
quantum states.
","[{""version"":""v1"",""created"":""Mon, 14 Aug 2000 17:47:41 GMT""}]","2007-05-23"
"gr-qc/0008031","Jorge Pullin","Rodolfo Gambini and Jorge Pullin","Making classical and quantum canonical general relativity computable
  through a power series expansion in the inverse cosmological constant","5 pages, RevTeX with multicol and psfig","Phys.Rev.Lett. 85 (2000) 5272-5275","10.1103/PhysRevLett.85.5272","CGPG-00/8-2","gr-qc hep-th",,"  We consider general relativity with a cosmological constant as a perturbative
expansion around a completely solvable diffeomorphism invariant field theory.
This theory is the $\Lambda\to\infty$ limit of general relativity. This allows
an explicit perturbative computational setup in which the quantum states of the
theory and the classical observables can be explicitly computed. The zeroth
order corresponds to highly degenerate space-times with vanishing volume.
Perturbations give rise to space-times with non-vanishing volumes in a natural
way. The spectrum of area- and volume-related observables constructed by
coupling the theory to matter can be directly assessed. An unexpected
relationship arises at a quantum level between the discrete spectrum of the
volume operator and the allowed values of the cosmological constant.
","[{""version"":""v1"",""created"":""Mon, 14 Aug 2000 20:21:45 GMT""},{""version"":""v2"",""created"":""Tue, 15 Aug 2000 13:02:05 GMT""}]","2009-10-31"
"gr-qc/0008032","Jorge Pullin","Rodolfo Gambini and Jorge Pullin","The large cosmological constant approximation to classical and quantum
  gravity: model examples","21 pages, RevTex, 2 figures with epsfig","Class.Quant.Grav. 17 (2000) 4515-4540","10.1088/0264-9381/17/21/311","CGPG-00/8-3","gr-qc hep-th",,"  We have recently introduced an approach for studying perturbatively classical
and quantum canonical general relativity. The perturbative technique appears to
preserve many of the attractive features of the non-perturbative quantization
approach based on Ashtekar's new variables and spin networks. With this
approach one can find perturbatively classical observables (quantities that
have vanishing Poisson brackets with the constraints) and quantum states
(states that are annihilated by the quantum constraints). The relative ease
with which the technique appears to deal with these traditionally hard problems
opens several questions about how relevant the results produced can possibly
be. Among the questions is the issue of how useful are results for large values
of the cosmological constant and how the approach can deal with several
pathologies that are expected to be present in the canonical approach to
quantum gravity. With the aim of clarifying these points, and to make our
construction as explicit as possible, we study its application in several
simple models. We consider Bianchi cosmologies, the asymmetric top, the coupled
harmonic oscillators with constant energy density and a simple quantum
mechanical system with two Hamiltonian constraints. We find that the technique
satisfactorily deals with the pathologies of these models and offers promise
for finding (at least some) results even for small values of the cosmological
constant. Finally, we briefly sketch how the method would operate in the full
four dimensional quantum general relativity case.
","[{""version"":""v1"",""created"":""Mon, 14 Aug 2000 20:26:10 GMT""},{""version"":""v2"",""created"":""Tue, 15 Aug 2000 13:14:37 GMT""}]","2009-10-31"
"gr-qc/0008033","Claus Laemmerzahl","Christian J. Bord\'e, Jean-Claude Houard, and Alain Karasiewicz","Relativistic phase shifts for Dirac particles interacting with weak
  gravitational fields in matter-wave interferometers","32 pages, LaTex, needs rotating and lscape usepackages, to appear in
  C. L\""ammerzahl, C.W.F. Everitt, F.W. Hehl (eds.): ``Gyros, Clocks, and
  Interferometers: Testing Relativistic Gravity in Space'', Springer-Verlag,
  Berlin 2000","Lect.Notes Phys. 562 (2001) 403-438","10.1007/3-540-40988-2_21",,"gr-qc quant-ph",,"  We present a second-quantized field theory of massive spin one-half particles
or antiparticles in the presence of a weak gravitational field treated as a
spin two external field in a flat Minkowski background. We solve the
difficulties which arise from the derivative coupling and we are able to
introduce an interaction picture. We derive expressions for the scattering
amplitude and for the outgoing spinor to first-order. In several appendices,
the link with the canonical approach in General Relativity is established and a
generalized stationary phase method is used to calculate the outgoing spinor.
We show how our expressions can be used to calculate and discuss phase shifts
in the context of matter-wave interferometry (especially atom or antiatom
interferometry). In this way, many effects are introduced in a unified
relativistic framework, including spin-gravitation terms: gravitational red
shift, Thomas precession, Sagnac effect, spin-rotation effect, orbital and spin
Lense-Thirring effects, de Sitter geodetic precession and finally the effect of
gravitational waves. A new analogy with the electromagnetic interaction is
pointed out.
","[{""version"":""v1"",""created"":""Tue, 15 Aug 2000 09:50:11 GMT""}]","2016-12-07"
"gr-qc/0008034","Irina Radinschi","I. Radinschi","The Energy Distribution of the Bianchi Type I Universe","6 pages, Latex, submitted to Acta Physica Slovaca","Acta Phys.Slov. 50 (2000) 609",,,"gr-qc",,"  We calculate the energy distribution of an anisotropic model of universe,
based on the Bianchi type I metric, in the Tolman's prescription. The energy
due to the matter plus gravitational field is equal to zero. This result agrees
with the results of Banerjee and Sen and Xulu. Also, our result supports the
viewpoint of Tryon and Rosen.
","[{""version"":""v1"",""created"":""Tue, 15 Aug 2000 10:25:54 GMT""}]","2007-05-23"
"gr-qc/0008035","Irina Radinschi","I. Radinschi","The Energy of a Dyonic Dilaton Black Hole","8 pages, no figures","Acta Phys.Slov. 49 (1999) 789-794",,,"gr-qc",,"  We calculate the energy distribution of a dyonic dilaton black hole by using
the Tolman's energy-momentum complex. All the calculations are performed in
quasi-Cartesian coordinates. The energy distribution of the dyonic dilaton
black hole depends on the mass, electric charge, magnetic charge and asymptotic
value of the dilaton. We get the same result as obtained by Y-Ching Yang,
Ching-Tzung Yeh, Rue-Ron Hsu and Chin-Rong Lee by using the Einstein's
prescription.
","[{""version"":""v1"",""created"":""Tue, 15 Aug 2000 14:16:56 GMT""}]","2007-05-23"
"gr-qc/0008036","Haret Rosu","R. Klippert, H.C. Rosu, R. Ruffini","Darboux cosmological fluids in comoving time","4 pages latex epsfig, 2 figures",,"10.1142/9789812777386_0470",,"gr-qc",,"  The barotropic indices and the corresponding FRW scale factors of the
so-called Darboux cosmological fluids are presented in the comoving time axis,
which is the natural one for the phenomenology related to the cosmological
data. Some useful comments on the features of the plots are included
","[{""version"":""v1"",""created"":""Tue, 15 Aug 2000 15:27:29 GMT""}]","2017-08-23"
"gr-qc/0008038","Matthias Arnsdorf","Matthias Arnsdorf","Loop Quantum Gravity and Asymptotically Flat Spaces","15 pages, based on talk presented at the MG IX meeting in Rome, July
  2000",,,,"gr-qc",,"  After motivating why the study of asymptotically flat spaces is important in
loop quantum gravity, we review the extension of the standard framework of this
theory to the asymptotically flat sector based on the GNS construction. In
particular, we provide a general procedure for constructing new Hilbert spaces
for loop quantum gravity on non-compact spatial manifolds. States in these
Hilbert spaces can be interpreted as describing fluctuations around fiducial
fixed backgrounds. When the backgrounds are chosen to approximate classical
asymptotically flat 3-geometries this gives a natural framework in which to
discuss physical applications of loop quantum gravity, especially its
semi-classical limit. We present three general proposals for the construction
of suitable backgrounds, including one approach that can lead to quantum
gravity on anti-DeSitter space as described by the Chern-Simons state.
","[{""version"":""v1"",""created"":""Tue, 15 Aug 2000 15:24:45 GMT""}]","2007-05-23"
"hep-ex/0008021","Arthur Maciel","D0 collaboration, B. Abbott, et al","Cross Section for b Jet Production in pbar-p Collisions at sqrt(s) = 1.8
  TeV","11 pages, 3 figures","Phys.Rev.Lett.85:5068-5073,2000","10.1103/PhysRevLett.85.5068","FERMILAB-Pub-00/197-E","hep-ex",,"  Bottom quark production in pbar-p collisions at sqrt(s)=1.8 TeV is studied
with 5 inverse picobarns of data collected in 1995 by the DO detector at the
Fermilab Tevatron Collider. The differential production cross section for b
jets in the central rapidity region (|y(b)| < 1) as a function of jet
transverse energy is extracted from a muon-tagged jet sample. Within
experimental and theoretical uncertainties, DO results are found to be higher
than, but compatible with, next-to-leading-order QCD predictions.
","[{""version"":""v1"",""created"":""Mon, 14 Aug 2000 17:36:36 GMT""}]","2008-11-26"
"hep-ex/0008022","Salvatore Mele","L3 Collaboration","Measurement of the W+W-gamma Cross Section and Direct Limits on
  Anomalous Quartic Gauge Boson Couplings at LEP",,"Phys.Lett.B490:187-195,2000","10.1016/S0370-2693(00)00993-X","CERN-EP-2000-097","hep-ex",,"  The process e+e- -> W+W-gamma is analysed using the data collected with the
L3 detector at LEP at a centre-of-mass energy of 188.6GeV, corresponding to an
integrated luminosity of 176.8pb^-1. Based on a sample of 42 selected W+W-
candidates containing an isolated hard photon, the W+W-gamma cross section,
defined within phase-space cuts, is measured to be: sigma_WWgamma = 290 +/- 80
+/- 16 fb, consistent with the Standard Model expectation. Including the
process e+e- -> nu nu gamma gamma, limits are derived on anomalous
contributions to the Standard Model quartic vertices W+W- gamma gamma and W+W-Z
gamma at 95% CL: -0.043 GeV^-2 < a_0/Lambda^2 < 0.043 GeV^-2 0.08 GeV^-2 <
a_c/Lambda^2 < 0.13 GeV^-2 0.41 GeV^-2 < a_n/Lambda^2 < 0.37 GeV^-2.
","[{""version"":""v1"",""created"":""Mon, 14 Aug 2000 17:52:13 GMT""}]","2012-08-27"
"hep-ex/0008023","Salvatore Mele","L3 Collaboration","Search for anomalous couplings in the Higgs sector at LEP",,"Phys.Lett.B489:102-114,2000","10.1016/S0370-2693(00)00890-X","CERN-EP-2000-098","hep-ex",,"  We search for a Higgs particle with anomalous couplings in the e+e- -> H
gamma, e+e- -> HZ and e+e- -> He+e- processes with the L3 detector at LEP. We
explore the mass range 70GeV < m_H < 170GeV using 176pb^-1 of integrated
luminosity at a center-of-mass energy of \sqrt{s} = 189GeV. The Higgs decays H
-> bb, H -> gamma gamma and H -> Z gamma are considered in the analysis. No
evidence for anomalous Higgs production is found. This is interpreted in terms
of limits on the anomalous couplings d, d_B, Delta g_1^Z and Delta kappa_gamma.
Limits on the Gamma(H -> gamma gamma) and Gamma(H -> Z gamma) partial widths in
the explored Higgs mass range are also obtained.
","[{""version"":""v1"",""created"":""Mon, 14 Aug 2000 18:07:42 GMT""}]","2012-08-27"
"hep-ex/0008024","A. P. Heinson","DZero Collaboration, B. Abbott, et al","Search for Electroweak Production of Single Top Quarks in ppbar
  Collisions","11 pages, 2 figures. This is the published version","Phys.Rev.D63:031101,2000","10.1103/PhysRevD.63.031101","Fermilab-Pub-00/188-E","hep-ex",,"  We present a search for electroweak production of single top quarks in the
electron+jets and muon+jets decay channels. The measurements use ~90 pb^-1 of
data from Run 1 of the Fermilab Tevatron collider, collected at 1.8 TeV with
the DZero detector between 1992 and 1995. We use events that include a tagging
muon, implying the presence of a b jet, to set an upper limit at the 95%
confidence level on the cross section for the s-channel process ppbar->tb+X of
39 pb. The upper limit for the t-channel process ppbar->tqb+X is 58 pb.
","[{""version"":""v1"",""created"":""Tue, 15 Aug 2000 01:05:27 GMT""},{""version"":""v2"",""created"":""Tue, 1 May 2001 20:37:37 GMT""}]","2008-11-26"
"hep-ex/0008025","Salvatore Mele","L3 Collaboration","Search for a Higgs Boson Decaying into Two Photons in e+e- Interactions
  at sqrt{s}=189GeV",,"Phys.Lett.B489:115-124,2000","10.1016/S0370-2693(00)00955-2","CERN-EP-2000-103","hep-ex",,"  A search is performed for a Higgs boson produced in association with a Z
boson and decaying into two photons, using the L3 data collected at LEP at a
centre-of-mass energy of 189 GeV. All decay modes of the Z are considered. No
signal is observed and limits on the branching fraction of the Higgs boson
decay into two photons as a function of the Higgs mass are derived assuming a
Standard Model production rate. A lower limit on the mass of a fermiophobic
Higgs is set at 94.9 GeV at 95% confidence level.
","[{""version"":""v1"",""created"":""Tue, 15 Aug 2000 06:56:09 GMT""}]","2012-08-27"
"hep-ex/0008026","Salvatore Mele","L3 Collaboration","Measurement of the W-Pair Production Cross Section and W-Decay Branching
  Fractions in e+e- Interactions at sqrt{s}=189GeV",,"Phys.Lett.B496:19-33,2000","10.1016/S0370-2693(00)01273-9","CERN-EP-2000-104","hep-ex",,"  The data collected by the L3 experiment at LEP at a centre-of-mass energy of
188.6 GeV are used to measure the W-pair production cross section and the
W-boson decay branching fractions. These data correspond to an integrated
luminosity of 176.8pb^-1. The total cross section for W-pair production,
combining all final states, is measured to be sigma_WW = 16.24 +/- 0.37(stat.)
+/- 0.22(syst.) pb. Including our data collected at lower centre-of-mass
energies, the hadronic branching fraction of the W-boson is determined to be
B(W ->qq) = [68.20 +/- 0.68 (stat.) +/- 0.33 (syst.) ] %. The results agree
with the Standard Model predictions.
","[{""version"":""v1"",""created"":""Tue, 15 Aug 2000 07:10:12 GMT""}]","2012-08-27"
"hep-ex/0008027","Thomas Hadig","T. Hadig","The strong coupling and the gluon density from jets in DIS","4 pages, DIS 2000 conference, Liverpool April 2000",,,,"hep-ex",,"  The extraction of the parameters of perturbative QCD is one of the main tasks
for the HERA experiments. Studies on the structure of the hadronic final states
with jet algorithms give a direct handle on the parton density functions and
the strong coupling strength over a wide kinematic range. In this article, new
results of the H1 and ZEUS collaborations for the strong coupling and the gluon
density in the proton are presented.
","[{""version"":""v1"",""created"":""Tue, 15 Aug 2000 10:45:09 GMT""}]","2007-05-23"
"hep-ex/0008028","Thomas Hadig","T. Hadig","Inclusive Hadron Production and Dijets at HERA","7 pp, ISMD 99 conference, Providence/USA",,,,"hep-ex",,"  This article summarizes a talk given at the International Symposium on
Multiparticle Dynamics 1999 in Providence/USA. It provides an overview on the
variety of measurements of the hadronic final state in jet production for
deep-inelastic scattering and photoproduction at HERA.
","[{""version"":""v1"",""created"":""Tue, 15 Aug 2000 11:08:25 GMT""}]","2007-05-23"
"hep-lat/0008013","Philippe de Forcrand","Ph. de Forcrand (ETH and CERN) and M. Pepe (ETH)","Laplacian Center Vortices","9 pages, 5 figures; talk presented at ""Confinement 2000"", Osaka,
  March 2000",,,,"hep-lat",,"  I present a unified picture of center vortices and Abelian monopoles. Both
appear as local gauge ambiguities in the Laplacian Center Gauge. This gauge is
constructed for a general SU(N) theory. Numerical evidence is presented, for
SU(2) and SU(3), that the projected $Z_N$ theory confines with a string tension
similar to the non-Abelian one.
","[{""version"":""v1"",""created"":""Mon, 14 Aug 2000 20:58:31 GMT""}]","2007-05-23"
"hep-lat/0008014","Philippe de Forcrand","M. Pepe (ETH) and Ph. de Forcrand (ETH and CERN)","A study of center vortices in SU(2) and SU(3) gauge theories","9 pages, 4 figures; talk presented at the International Workshop on
  Non-Perturbative Methods and Lattice QCD, Guangzhou, May 2000",,"10.1142/9789812811370_0020",,"hep-lat",,"  We show how center vortices and Abelian monopoles both appear as local gauge
ambiguities in the Laplacian Center gauge. Numerical results, for SU(2) and
SU(3), support the view that the string tension obtained in the
center-projected theory matches the full string tension when the continuum
limit is taken.
","[{""version"":""v1"",""created"":""Mon, 14 Aug 2000 22:04:16 GMT""}]","2017-08-23"
"hep-lat/0008015","Simeon Warner","Simeon Warner (LANL), Simon Catterall (Syracuse University)","Phase diagram of four-dimensional dynamical triangulations with a
  boundary","13 pages, latex","Phys.Lett. B493 (2000) 389-394","10.1016/S0370-2693(00)01154-0","SU-4240-722; LAUR-00-3925","hep-lat",,"  We report on simulations of DT simplicial gravity for manifolds with the
topology of the 4-disk. We find evidence for four phases in a two-dimensional
parameter space. In two of these the boundary plays no dynamical role and the
geometries are equivalent to those observed earlier for the sphere $S^4$. In
another phase the boundary is maximal and the quantum geometry degenerates to a
one dimensional branched polymer. In contrast we provide evidence that the
fourth phase is effectively three-dimensional. We find discontinuous phase
transitions at all the phase boundaries.
","[{""version"":""v1"",""created"":""Mon, 14 Aug 2000 23:00:41 GMT""}]","2009-10-31"
"hep-lat/0008016","Michele Pepe","Ph. de Forcrand (ETH and CERN) and M. Pepe (ETH)","Center Vortices and Monopoles without lattice Gribov copies","Final version to appear in Nucl. Phys. B. Note added for comparison
  with recent results on Gribov copies in Max. Center Gauge. Interpolation of
  Laplacian eigenvectors (instead of center projection) considered. References
  added. 21 pages, 7 figures","Nucl.Phys. B598 (2001) 557-577","10.1016/S0550-3213(01)00009-8",,"hep-lat hep-th",,"  We construct a smooth gauge for the adjoint field which is free of
ambiguities on the lattice. In this Laplacian Center Gauge, center vortices and
monopoles appear together as local gauge defects. A numerical study of center
vortices in SU(2) and SU(3) supports equality of the $Z_N$ and SU(N) string
tensions in the continuum limit, and only then.
","[{""version"":""v1"",""created"":""Tue, 15 Aug 2000 06:45:36 GMT""},{""version"":""v2"",""created"":""Mon, 25 Sep 2000 11:11:01 GMT""},{""version"":""v3"",""created"":""Wed, 17 Jan 2001 18:31:10 GMT""}]","2009-10-31"
"hep-ph/0008134","Evgeny Akhmedov","E.Kh. Akhmedov","Floquet theory of neutrino oscillations in the earth","LaTeX, 28 pages, 8 eps figures. Contribution to the special issue of
  Yad. Fiz. dedicated to the memory of A.B. Migdal","Phys.Atom.Nucl.64:787-801,2001; Yad.Fiz.64:851-865,2001","10.1134/1.1378869","FISIST/8-2000/CFIF","hep-ph astro-ph hep-th",,"  We review the Floquet theory of linear differential equations with periodic
coefficients and discuss its applications to neutrino oscillations in matter of
periodically varying density. In particular, we consider parametric resonance
in neutrino oscillations which can occur in such media, and discuss
implications for oscillations of neutrinos traversing the earth and passing
through the earth's core.
","[{""version"":""v1"",""created"":""Mon, 14 Aug 2000 16:58:28 GMT""}]","2008-11-26"
"hep-ph/0008137","Savely G. Karshenboim","Savely G. Karshenboim (D. I. Mendeleev Institute for Metrology, St.
  Petersburg and Max-Planck-Institut fuer Quantenoptik, Garching)","The hydrogen Lamb shift and the proton radius","An invited talk presented at workshop `Hadronic Atoms and Positronium
  in the Stardard Model' (Dubna, 1998) 8 pages, 3 figures","Proceedings of the International Workshop `Hadronic Atoms and
  Positronium in the Standard Model'. Ed. By M. A. Ivanov et al., Dubna (1998)
  224-231",,,"hep-ph physics.atom-ph",,"  The Lamb shift measurement and theory are now both a dynamically developing
field and we give a review of the current data. Critical comparison of theory
and experiment can be done using a value of the proton charge radius and we pay
attention to several results of its determination.
","[{""version"":""v1"",""created"":""Mon, 14 Aug 2000 16:07:02 GMT""}]","2007-05-23"
"hep-ph/0008138","Dmitry Semikoz","A.D. Dolgov, S.H. Hansen, G. Raffelt, D.V. Semikoz","Heavy sterile neutrinos: Bounds from big-bang nucleosynthesis and SN
  1987A","19 pages, 5 figures, 1 table. Some references added","Nucl.Phys. B590 (2000) 562-574","10.1016/S0550-3213(00)00566-6",,"hep-ph astro-ph",,"  Cosmological and astrophysical effects of heavy (10 - 200 MeV) sterile Dirac
neutrinos, mixed with the active ones, are considered. The bounds on mass and
mixing angle from both supernovae and big-bang nucleosynthesis are presented.
","[{""version"":""v1"",""created"":""Mon, 14 Aug 2000 16:13:19 GMT""},{""version"":""v2"",""created"":""Thu, 17 Aug 2000 10:04:48 GMT""}]","2009-10-31"
"hep-ph/0008139","David H. Lyth","Eung Jin Chun, Hang Bae Kim and David H. Lyth","Cosmological constraints on a Peccei-Quinn flatino as the lightest
  supersymmetric particle",,"Phys.Rev. D62 (2000) 125001","10.1103/PhysRevD.62.125001",,"hep-ph",,"  In an interesting class of models, non-renormalizable terms of the
superpotential are responsible for the spontanteous breaking of Peccei-Quinn
(PQ) symmetry as well as the generation of the $\mu$ term. The flaton fields
which break PQ symmetry are accompanied by flatinos, and the lightest flatino
(the LSP) can be the stable, while the decay of the lightest neutralino (the
NLSP) might be visible at colliders with a low axion scale. We examine the
cosmology of these models, involving thermal inflation just after the PQ phase
transition. The branching ratio of flatons into axions must be small so as not
to interfere with nucleosynthesis, and flatons must not decay into the LSP or
it will be over-abundant. We explore a simple model,with light flatons which
can decay into $Z$ or $W$ bosons, or into a light Higgs ($h^0$) plus a $Z$
boson, to show that such features can be realized in a wide range of parameter
space. The mass of the NLSP can be as low as $(m_{h^0}+m_Z)/2$, with an axion
scale of order $10^{10}$ GeV and a final reheat temperature typically of order
$10\GeV$. Then, the flatino LSP is a good dark matter candidate because the
reheat temperature can be high enough to allow its production from the decay of
the thermalized LSP, while low enough to prevent its overproduction from the
decay of sfermions.
","[{""version"":""v1"",""created"":""Mon, 14 Aug 2000 18:48:17 GMT""}]","2009-10-31"
