"astro-ph/0008217","Nusser","Adi Nusser","Self-similar spherical collapse with non-radial motions","6 pages, 1 figure, two column MNRAS style","Mon.Not.Roy.Astron.Soc. 325 (2001) 1397","10.1046/j.1365-8711.2001.04527.x",,"astro-ph",,"  We derive the asymptotic mass profile near the collapse center of an initial
spherical density perturbation, $\delta \propto M^{-\epsilon}$, of
collision-less particles with non-radial motions. We show that angular momenta
introduced at the initial time do not affect the mass profile. Alternatively,
we consider a scheme in which a particle moves on a radial orbit until it
reaches its turnaround radius, r_*. At turnaround the particle acquires an
angular momentum $L={\cal L} \sqrt{GM_* r_*}$ per unit mass, where M_* is the
mass interior to r_*. In this scheme, the mass profile is $M\propto
r^{3/(1+3\epsilon)}$ for all $\epsilon >0$, in the region $r/r_t\ll {\cal L}$,
where r_t is the current turnaround radius. If ${\cal L} \ll 1$ then the
profile in the region ${\cal L} \ll r/r_t \ll$ is $M\propto r$ for $\epsilon
<2/3$. The derivation relies on a general property of non-radial orbits which
is that ratio of the pericenter to apocenter is constant in a force field k(t)
r^{n} with k(t) varying adiabatically.
","[{""version"":""v1"",""created"":""Tue, 15 Aug 2000 15:36:07 GMT""}]","2009-10-31"
"cond-mat/0008194","Sergio Coutinho","E. Nogueira Jr., R. F. S. Andrade and S. Coutinho","Multifractal Properties of Aperiodic Ising Model: role of geometric
  fluctuations","10 pages, 7 figures, 3 Tables, 17 references","Physica A 360, 365-378 (2006)","10.1007/s100510170057",,"cond-mat.dis-nn cond-mat.stat-mech",,"  The role of the geometric fluctuations on the multifractal properties of the
local magnetization of aperiodic ferromagnetic Ising models on hierachical
lattices is investigated. The geometric fluctuations are introduced by
generalized Fibonacci sequences. The local magnetization is evaluated via an
exact recurrent procedure encompassing a real space renormalization group
decimation. The symmetries of the local magnetization patterns induced by the
aperiodic couplings is found to be strongly (weakly) different, with respect to
the ones of the corresponding homogeneous systems, when the geometric
fluctuations are relevant (irrelevant) to change the critical properties of the
system. At the criticality, the measure defined by the local magnetization is
found to exhibit a non-trivial F(alpha) spectra being shifted to higher values
of alpha when relevant geometric fluctuations are considered. The critical
exponents are found to be related with some special points of the F(alpha)
function and agree with previous results obtained by the quite distinct
transfer matrix approach.
","[{""version"":""v1"",""created"":""Mon, 14 Aug 2000 21:38:38 GMT""},{""version"":""v2"",""created"":""Tue, 15 Aug 2000 21:06:58 GMT""}]","2009-10-31"
"cond-mat/0008201","Trinh Xuan Hoang","Trinh Xuan Hoang and Marek Cieplak","Sequencing of folding events in Go-like proteins","REVTeX, 12 pages, 11 EPS figures, J. Chem. Phys (in press)","J. Chem. Phys. 113, 8319-8328 (2000)","10.1063/1.1314868",,"cond-mat.stat-mech cond-mat.soft q-bio.BM",,"  We have studied folding mechanisms of three small globular proteins: crambin
(CRN), chymotrypsin inhibitor 2 (CI2) and the fyn Src Homology 3 domain (SH3)
which are modelled by a Go-like Hamiltonian with the Lennard-Jones
interactions. It is shown that folding is dominated by a well-defined
sequencing of events as determined by establishment of particular contacts. The
order of events depends primarily on the geometry of the native state.
Variations in temperature, coupling strengths and viscosity affect the
sequencing scenarios to a rather small extent. The sequencing is strongly
correlated with the distance of the contacting aminoacids along the sequence.
Thus $\alpha$-helices get established first. Crambin is found to behave like a
single-route folder, whereas in CI2 and SH3 the folding trajectories are more
diversified. The folding scenarios for CI2 and SH3 are consistent with
experimental studies of their transition states.
","[{""version"":""v1"",""created"":""Mon, 14 Aug 2000 16:02:35 GMT""}]","2009-10-31"
"cond-mat/0008202","Mechthild Enderle","M. Enderle, H.M. Roennow, D.F. McMorrow, L.P. Regnault, G. Dhalenne,
  A. Revcolevschi, P. Vorderwisch, H. Schneider, P. Smeibidl, and M. Meissner","Excitations of the field-induced soliton lattice in CuGeO3","5 pages, revtex, 4 figures (*.eps), win-zipped",,"10.1103/PhysRevLett.87.177203",,"cond-mat",,"  Here we report the first inelastic neutron scattering study of the magnetic
excitations in the incommensurate phase of a spin-Peierls material. The results
on CuGeO3 provide direct evidence of a finite excitation gap, two sharp
magnetic excitation branches and a very low-lying excitation which is
identified as a phason mode, the Goldstone mode of the incommensurate soliton
lattice.
","[{""version"":""v1"",""created"":""Mon, 14 Aug 2000 17:35:18 GMT""}]","2009-10-31"
"cond-mat/0008203","Sidiney Geraldo Alves","M. L. Martins, G. Ceotto, S. G. Alves, C. C. B. Bufon, J. M. Silva and
  F. F. Laranjeira","A Cellular Automata Model for Citrus Variagated Chlorosis","10 pages, 10 figures, Scheduled tentatively for the issue of: 01Nov00","Phys. Rev. E, November 2000","10.1103/PhysRevE.62.7024",,"cond-mat.stat-mech nlin.CG q-bio",,"  A cellular automata model is proposed to analyze the progress of Citrus
Variegated Chlorosis epidemics in S\~ao Paulo oranges plantation. In this model
epidemiological and environmental features, such as motility of sharpshooter
vectors which perform L\'evy flights, hydric and nutritional level of plant
stress and seasonal climatic effects, are included. The observed epidemics data
were quantitatively reproduced by the proposed model varying the parameters
controlling vectors motility, plant stress and initial population of diseased
plants.
","[{""version"":""v1"",""created"":""Mon, 14 Aug 2000 20:50:40 GMT""}]","2009-10-31"
"cond-mat/0008204","L. Martin-Moreno","L. Martin-Moreno, F. J. Garcia-Vidal, H. J. Lezec, K.M. Pellerin, T.
  Thio, J. B. Pendry and T. W. Ebbesen","Theory of extraordinary optical transmission through subwavelength hole
  arrays","4 pages, 4 figures",,"10.1103/PhysRevLett.86.1114",,"cond-mat.mtrl-sci",,"  We present a fully three-dimensional theoretical study of the extraordinary
transmission of light through subwavelength hole arrays in optically thick
metal films. Good agreement is obtained with experimental data. An analytical
minimal model is also developed, which conclusively shows that the enhancement
of transmission is due to tunneling through surface plasmons formed on each
metal-dielectric interfaces. Different regimes of tunneling (resonant through a
''surface plasmon molecule"", or sequential through two isolated surface
plasmons) are found depending on the geometrical parameters defining the
system.
","[{""version"":""v1"",""created"":""Mon, 14 Aug 2000 18:05:27 GMT""}]","2009-10-31"
"cond-mat/0008205","Robert Haslinger","Robert Haslinger and Robert Joynt","Ohmic Losses in Valence-band Photoemission Experiments","7 postscript figures",,,,"cond-mat.str-el cond-mat.supr-con",,"  Photoemission experiments involve the motion of an electron near a conducting
surface. This necessarily generates heat by ohmic losses from eddy currents.
This inelastic scattering of the electrons will result in a downward shift in
observed spectra. This effect is most pronounced in poorly conducting metals:
in good metals the electron's field is screened out of the material, while
insulators are by definition unable to absorb electromagnetic energy at low
frequencies. We give a classification of photoemission processes which shows
that the effect is an extrinsic proces distinct from final state effects. The
shift is illustrated by a model system with a Drude-like conductivity function
and a temperature-dependent relaxation time. We give a brief experimental
survey of systems in which the ohmic losses may be significant.
","[{""version"":""v1"",""created"":""Mon, 14 Aug 2000 18:55:31 GMT""}]","2007-05-23"
"cond-mat/0008206","George Stan","S. M. Gatica, M. J. Bojan, G. Stan, and M. W. Cole","Quasi-one and two-dimensional transitions of gases adsorbed on nanotube
  bundles","12 pages, 6 figures, submitted to J. Chem. Phys",,"10.1063/1.1339886",,"cond-mat.stat-mech cond-mat.mtrl-sci",,"  Grand canonical Monte Carlo simulations have been performed to determine the
adsorption behavior of Ar and Kr atoms on the exterior surface of a rope
(bundle) consisting of many carbon nanotubes. The computed adsorption isotherms
reveal phase transitions associated with the successive creation of quasi-one
dimensional lines of atoms near and parallel to the intersection of two
adjacent nanotubes.
","[{""version"":""v1"",""created"":""Mon, 14 Aug 2000 19:18:23 GMT""}]","2009-10-31"
"cond-mat/0008207","Maksimov Leonid Aleksandrovich","Yu.Kagan, L.A.Maksimov","Manifestation of superfluidity in an evolving Bose-condensed gas",,,"10.1103/PhysRevLett.85.3075",,"cond-mat.supr-con cond-mat.stat-mech",,"  We study the generation of excitations due to an ''impurity''(static
perturbation) placed into an oscillating Bose-condensed gas in the
time-dependent trapping field. It is shown that there are two regions for the
position of the local perturbation. In the first region the condensate flows
around the ''impurity'' without generation of excitations demonstrating
superfluid properties. In the second region the creation of excitations occurs,
at least within a limited time interval, revealing destruction of
superfluidity. The phenomenon can be studied by measuring the damping of
condensate oscillations at different positions of the ''impurity''.
","[{""version"":""v1"",""created"":""Mon, 14 Aug 2000 19:18:59 GMT""}]","2009-10-31"
"cond-mat/0008208","Ning Ma","Ning Ma, S. M. Girvin and R. Rajaraman","Effective attraction between like-charged colloids in a 2D plasma","14 pages, 14 figures, submit to PRE",,"10.1103/PhysRevE.63.021402",,"cond-mat.soft cond-mat.stat-mech physics.plasm-ph",,"  The existence of attractions between like-charged colloids immersed in ionic
solution have been discovered in recent experiments. This phenomenon
contradicts the predictions of DLVO theory and indicates a failure of mean
field theory. We study a toy model based on a two dimensional one-component
plasma, which is exactly soluble at one particular coupling constant. We show
that colloidal interaction results from a competition between ion-ion repulsion
and longer ranged ion-void attraction.
","[{""version"":""v1"",""created"":""Mon, 14 Aug 2000 20:19:47 GMT""}]","2009-10-31"
"cond-mat/0008209","Su-Chan Park","Su-Chan Park, Jeong-Man Park, and Doochul Kim","Comment on ``Solution of Classical Stochastic One-Dimensional Many-Body
  Systems''","1 page, revtex style, comment on paper Phys. Rev. Lett. {\bf 83},
  5214 (1999)","Phys. Rev. Lett. {\bf 85}, 892 (2000)","10.1103/PhysRevLett.85.892",,"cond-mat.stat-mech",,"  In a recent Letter, Bares and Mobilia proposed the method to find solutions
of the stochastic evolution operator $H=H_0 + {\gamma\over L} H_1$ with a
non-trivial quartic term $H_1$. They claim, ``Because of the conservation of
probability, an analog of the Wick theorem applies and all multipoint
correlation functions can be computed.'' Using the Wick theorem, they expressed
the density correlation functions as solutions of a closed set of
integro-differential equations.
  In this Comment, however, we show that applicability of Wick theorem is
restricted to the case $\gamma = 0$ only.
","[{""version"":""v1"",""created"":""Mon, 14 Aug 2000 22:59:51 GMT""}]","2009-10-31"
"cond-mat/0008210","Su-Chan Park","Su-Chan Park, Doochul Kim and Jeong-Man Park","Path-Integral Formulation of Stochastic Processes for the Exclusive
  Particle Systems","2 figures, revtex style. Revised version with minor changes","Phys. Rev. E 62, 7642 (2000)","10.1103/PhysRevE.62.7642",,"cond-mat.stat-mech",,"  We present the systematic formalism to derive the path-integral formulation
for the hard-core particle systems far from equilibrium. Writing the master
equation for a stochastic process of the system in terms of the annihilation
and creation operators with the mixed commutation relations, we find the
Kramers-Moyal coefficients for the corresponding Fokker-Planck equation (FPE)
and the stochastic differential equation (SDE) is derived by connecting these
coefficients in the FPE to those in the SDE. Finally, the SDE is mapped onto
the field-theory using the path-integral, giving the field-theoretic action
which may be analyzed by the renormalization group method. We apply this
formalism to the two-species reaction-diffusion system with the drift, finding
a universal decay expoent for the long-time behavior of the average
concentration of particles in arbitrary dimensions.
","[{""version"":""v1"",""created"":""Mon, 14 Aug 2000 23:07:30 GMT""},{""version"":""v2"",""created"":""Fri, 29 Dec 2000 06:59:26 GMT""}]","2009-10-31"
"cond-mat/0008211","Eyal Buks","E. Buks, M. L. Roukes","Electrically Tunable Collective Modes in a MEMS Resonator Array","RevTec, 12 pages + 5 figures",,,,"cond-mat.mes-hall",,"  Using optical diffraction, we study the mechanical vibrations of an array of
micromechanical resonators. Implementing tunable electrostatic coupling between
the suspended, doubly-clamped Au beams leads to the formation of a band of
collective vibrational modes within these devices. The evolution of these modes
with coupling strength is clearly manifested in the optical diffraction pattern
of light transmitted through the array. The experimental results are analyzed
using a simple model for one-dimensional phonons. These structures offer unique
prospects for spectral analysis of complex mechanical stimuli.
","[{""version"":""v1"",""created"":""Tue, 15 Aug 2000 00:10:22 GMT""}]","2007-05-23"
"cond-mat/0008212","Lars Hufnagel","L. Hufnagel, M. Weiss, A. Iomin, R. Ketzmerick, S. Fishman, and T.
  Geisel","Metal-insulator transitions in cyclotron resonance of periodic
  nanostructures due to avoided band crossings",,"Phys. Rev. B, 62, 15348, (2000)","10.1103/PhysRevB.62.15348",,"cond-mat.mes-hall nlin.CD",,"  A recently found metal-insulator transition in a model for cyclotron
resonance in a two-dimensional periodic potential is investigated by means of
spectral properties of the time evolution operator. The previously found
dynamical signatures of the transition are explained in terms of avoided band
crossings due to the change of the external electric field. The occurrence of a
cross-like transport is predicted and numerically confirmed.
","[{""version"":""v1"",""created"":""Tue, 15 Aug 2000 11:09:39 GMT""}]","2009-10-31"
"cond-mat/0008213","Mr. Ferenc Simon","Ferenc Simon, Slaven Garaj and Laszlo Forro","Comment on ""Low Temperature Magnetic Instabilities in Triply Charged
  Fulleride Polymers"" by D. Arcon et al., PRL 84, 562 (2000)","1 pags, no figures",,"10.1103/PhysRevLett.87.129703",,"cond-mat.str-el cond-mat.supr-con",,"  Recently, Arcon et al. reported ESR studies of the polymer phase (PP) of
Na_{2}Rb_{0.3}Cs_{0.7}C_{60} fulleride. It was claimed that this phase is a
quasi-one-dimensional metal above 45 K with a spin-gap below this temperature
and has antiferromagnetic(AF) order below 15 K, that is evidenced by
antiferromagnetic resonance(AFMR). For the understanding of the rich physics of
fullerides it is important to identify the different ground states. ESR has
proven to be a useful technique for this purpose. However, since it is a very
sensitive probe, it can detect a multitude of spin species and it is not
straightforward to identify their origin, especially in a system like
Na_{2}Rb_{x}Cs_{1-x}C_{60} with three dopants, when one part of the sample
polymerizes but the majority does not. The observation of a low dimensional
instability in the single bonded PP would be a novel and important result.
Nevertheless, in this Comment we argue that Na_{2}Rb_{0.3}Cs_{0.7}C_{60} is not
a good choice for this purpose since, as we show, the samples used by Arcon et
al. are inhomogeneous. We point out that recent results on the PP of
Na_{2}CsC_{60} contradicts the observation of low dimensional instabilities in
Na_{2}Rb_{0.3}Cs_{0.7}C_{60}.
","[{""version"":""v1"",""created"":""Tue, 15 Aug 2000 11:41:25 GMT""}]","2009-10-31"
"cond-mat/0008214","Vladimir Timoshevskii","A.N. Timoshevskii, V.A. Timoshevskii, B.Z. Yanchitsky and V.A. Yavna","Electronic structure, hyperfine interactions and disordering effects in
  iron nitride Fe4N","8 pages, 2 figures, LaTeX, submitted to Comp. Mat. Sci","Computational Materials Science 22 (2001) 99-105",,,"cond-mat.mtrl-sci",,"  Iron nitride Fe4N is studied by full-potential LAPW method. Structure
parameters, electronic and magnetic properties as well as hyperfine interaction
parameters are obtained. We observe perfect agreement with experimental
results. Hypothetical Fe4N structure was also calculated to study the influence
of disordering effects on parameters of Moessbauer spectra. We performed
detailed analysis of EFG formation on Fe nuclei including magnetization
effects. We show that the formation of N-Fe-N local configuration is
energetically favourable in nitrogen austenites.
","[{""version"":""v1"",""created"":""Tue, 15 Aug 2000 13:34:45 GMT""}]","2007-05-23"
"cond-mat/0008215","Uwe R. Fischer","Uwe R. Fischer and Nils Schopohl","Short wavelength spectrum and Hamiltonian stability of vortex rings","7 pages, 4 figures, final version to appear in Phys. Rev. E","Phys. Rev. E Vol. 64, 016306 (2001)","10.1103/PhysRevE.64.016306",,"cond-mat",,"  We compare dynamical and energetical stability criteria for vortex rings. It
is argued that vortex rings will be intrinsically unstable against
perturbations with short wavelengths below a critical wavelength, because the
canonical vortex Hamiltonian is unbounded from below for these modes. To
explicitly demonstrate this behaviour, we derive the oscillation spectrum of
vortex rings in incompressible, inviscid fluids, within a geometrical cutoff
procedure for the core. The spectrum develops an anomalous branch of negative
group velocity, and approaches the zero of energy for wavelengths which are
about six times the core diameter. We show the consequences of this dispersion
relation for the thermodynamics of vortex rings in superfluid $^4$He at low
temperatures.
","[{""version"":""v1"",""created"":""Tue, 15 Aug 2000 12:18:58 GMT""},{""version"":""v2"",""created"":""Wed, 6 Dec 2000 18:58:15 GMT""},{""version"":""v3"",""created"":""Thu, 8 Mar 2001 17:38:05 GMT""}]","2007-05-23"
"cond-mat/0008216","Giuseppe Mussardo","D. Fioravanti, G. Mussardo, P. Simon","Universal Amplitude Ratios of The Renormalization Group: Two-Dimensional
  Tricritical Ising Model","61 pages, Latex file, figures in a separate file","Phys.Rev. E63 (2001) 016103","10.1103/PhysRevE.63.016103","ISAS/EP/2000/80","cond-mat.stat-mech hep-lat hep-th",,"  The scaling form of the free-energy near a critical point allows for the
definition of various thermodynamical amplitudes and the determination of their
dependence on the microscopic non-universal scales. Universal quantities can be
obtained by considering special combinations of the amplitudes. Together with
the critical exponents they characterize the universality classes and may be
useful quantities for their experimental identification. We compute the
universal amplitude ratios for the Tricritical Ising Model in two dimensions by
using several theoretical methods from Perturbed Conformal Field Theory and
Scattering Integrable Quantum Field Theory. The theoretical approaches are
further supported and integrated by results coming from a numerical
determination of the energy eigenvalues and eigenvectors of the off-critical
systems in an infinite cylinder.
","[{""version"":""v1"",""created"":""Tue, 15 Aug 2000 13:25:31 GMT""}]","2009-10-31"
"cond-mat/0008217",,"G.F. Zharkov, V.G. Zharkov, A.Yu. Zvetkov (P.N. Lebedev Physical
  Institute, Moscow, Russia)","Self-consistent solutions of Ginzburg-Landau equations and
  superconducting edge-suppressed states in magnetic field","11 pages, 14 figures, RevTex, submitted to Phys. Rev. B",,,,"cond-mat.supr-con",,"  Self-consistent solutions of the Ginzburg-Landau system of equations, which
describe the order parameter and the magnetic field distribution in a long
superconducting cylinder of finite radius R, in external magnetic field H, when
vortex line, carrying m flux quanta, is situated on the cylinder axis (a giant
m-vortex state), are studied numerically. If the field H exceeds some critical
value H_s, the giant m-vortex solution becomes unstable and passes to a new
stable edge-suppressed form. The quantum number m in this state does not
change, but the order parameter diminishes by a jump (almost to zero) near the
cylinder surface; however, superconductivity remains in the deep, at some
distance from a cylinder axis. This edge-suppressed state exist in the fields
H_s<H<H_c, where H_c is the field, in which the second order phase transition
into the normal state occures. (In the case of large radii R and finite m the
field H_c coincides with critical field H_{c2}, in which superconductivity
vanishes in the bulk.) If the vorticity m is large, the edge-suppressed state
degenerates into the usual state of surface superconductivity, and may survive
up to the field H_{c3}=1.69H_{c2}. The magnetic moment, total magnetic flux,
the Gibbs free energies are found, as functions of the field H, for different
radii R, vorticities m and parameters \kappa of GL-theory. The intervals of R,
\kappa, m are found, where the edge-suppressed solutions exist. The giant
m-vortex states exist in both type-I and type-II superconductors, but the
edge-suppressed solutions are possible only in type-II superconductors (with
\kappa > 1/sqrt{2}). The paramagnetic effect in mesoscopic samples and also the
possible connection of the theory and experiment are shortly discussed.
","[{""version"":""v1"",""created"":""Tue, 15 Aug 2000 13:39:36 GMT""}]","2007-05-23"
"cond-mat/0008218","Eduardo Jagla","E. A. Jagla","Fragile-strong transitions and polyamorphism in glass former fluids","5 pages, 6 figures","Mol. Phys. 99, 753 (2001)","10.1080/00268970010030031",,"cond-mat",,"  A simple model of a glass former fluid, consisting of a bidisperse mixture of
penetrable spheres is studied. The model shows a transition from fragile to
strong behavior as temperature is reduced. This transition is driven by the
competition between the two mechanisms that contribute to diffusivity in the
model: collective rearrangement of particles (responsible for the fragile
behavior), and individual particle motion (which gives rise to the strong
behavior at low temperature). We also observe a maximum of diffusivity as a
function of pressure that can be interpreted within the same framework. The
connection between this behavior and polyamorphism is addressed.
","[{""version"":""v1"",""created"":""Tue, 15 Aug 2000 14:38:53 GMT""}]","2009-10-31"
"cond-mat/0008219","Eduardo Fradkin","Ana Lopez and Eduardo Fradkin","Effective field theory for the bulk and edge states of quantum Hall
  states in unpolarized single layer and bilayer systems","27 pages; new subsection with summary of results and two tables.
  Misprints and errors of an an earlier version are corrected. In particular
  the tunneling exponents for the SU(2) states at 2/3 and 4/7 have been
  corrected; same with the electron operator for the 2/3 state","Phys. Rev. B {\bf 63}, 085306 (2001)","10.1103/PhysRevB.63.085306",,"cond-mat.mes-hall",,"  We present an effective theory for the bulk Fractional Quantum Hall states in
spin-polarized bilayer and spin-1/2 single layer two-dimensional electron gases
(2DEG) in high magnetic fields consistent with the requirement of global gauge
invariance on systems with periodic boundary conditions. We derive the theory
for the edge states that follows naturally from this bulk theory. We find that
the minimal effective theory contains two propagating edge modes that carry
charge and energy, and two non-propagating topological modes responsible for
the statistics of the excitations. We give a detailed description of the
effective theory for the spin-singlet states, the symmetric bilayer states and
for the $(m,m,m)$ states. We calculate explicitly, for a number of cases of
interest, the operators that create the elementary excitations, their bound
states, and the electron. We also discuss the scaling behavior of the tunneling
conductances in different situations: internal tunneling, tunneling between
identical edges and tunneling into a FQH state from a Fermi liquid.
","[{""version"":""v1"",""created"":""Tue, 15 Aug 2000 15:42:59 GMT""},{""version"":""v2"",""created"":""Thu, 9 Nov 2000 19:40:12 GMT""},{""version"":""v3"",""created"":""Tue, 17 Apr 2001 23:36:18 GMT""}]","2009-10-31"
